,link,classification,category,title,company,salary,min_salary,average_salary,max_salary,location,description,entireDiv,date_posted,Category,Date
0,https://www.seek.com.au//job/73572829?type=promoted&ref=search-standalone,real estate property,Retail & Property Development,Procurement Manager - High-Rise Residential / Mixed-Use Developments,Conquest,-,245000.0,247500.0,250000.0,Sydney NSW,Great opportunity for a Contracts Manager to manage a centralised Procurement division!,"[<div class=""_1wkzzau0 a1msqi6m""><span class=""_1wkzzau0 a1msqi4y lnocuo0 lnocuo1 lnocuo21 _1d0g9qk4 lnocuo7""><a aria-label=""Limit results to Burwood"" class=""_1wkzzau0 _1wkzzauf _1wkzzau0 _1wkzzauf _842p0a0 _842p0a2"" data-automation=""jobLocation"" href=""/jobs-in-real-estate-property/in-Burwood-NSW-2134?salarytype=annual&amp;salaryrange=245000-250000"" rel=""nofollow"" tabindex=""-1"" target=""_self"" title=""Limit results to Burwood"">Burwood</a>, <a aria-label=""Limit results to Sydney NSW"" class=""_1wkzzau0 _1wkzzauf _1wkzzau0 _1wkzzauf _842p0a0 _842p0a2"" data-automation=""jobLocation"" href=""/jobs-in-real-estate-property/in-All-Sydney-NSW?salarytype=annual&amp;salaryrange=245000-250000"" rel=""nofollow"" tabindex=""-1"" target=""_self"" title=""Limit results to Sydney NSW"">Sydney NSW</a></span></div>]",,Real-estate-property - None,08/02/2024
1,https://www.seek.com.au//job/73453941?type=promoted&ref=search-standalone,real estate property,Retail & Property Development,Land Acquisitions Manager - Land Lots for House and Land Packages,Devcon Property Services Pty Ltd,"OTE $200,000 pa (Salary plus Uncapped Commission)",245000.0,247500.0,250000.0,Brisbane QLD,Use your Knowledge and contact base to take your career in Land Acquisitions to a new level,"[<div class=""_1wkzzau0 a1msqi6m""><span class=""_1wkzzau0 a1msqi4y lnocuo0 lnocuo1 lnocuo21 _1d0g9qk4 lnocuo7""><a aria-label=""Limit results to North Lakes"" class=""_1wkzzau0 _1wkzzauf _1wkzzau0 _1wkzzauf _842p0a0 _842p0a2"" data-automation=""jobLocation"" href=""/jobs-in-real-estate-property/in-North-Lakes-QLD-4509?salarytype=annual&amp;salaryrange=245000-250000"" rel=""nofollow"" tabindex=""-1"" target=""_self"" title=""Limit results to North Lakes"">North Lakes</a>, <a aria-label=""Limit results to Brisbane QLD"" class=""_1wkzzau0 _1wkzzauf _1wkzzau0 _1wkzzauf _842p0a0 _842p0a2"" data-automation=""jobLocation"" href=""/jobs-in-real-estate-property/in-All-Brisbane-QLD?salarytype=annual&amp;salaryrange=245000-250000"" rel=""nofollow"" tabindex=""-1"" target=""_self"" title=""Limit results to Brisbane QLD"">Brisbane QLD</a></span></div>, <div class=""_1wkzzau0 a1msqi6m""><div aria-label=""Salary: OTE $200,000 pa (Salary plus Uncapped Commission)"" class=""_1wkzzau0""><span class=""_1wkzzau0 a1msqi4y lnocuo0 lnocuo1 lnocuo21 _1d0g9qk4 lnocuo7"" data-automation=""jobSalary""><span class=""_1wkzzau0 _16v7pfz1 a1msqi4y a1msqi0 a1msqir _16v7pfz3"" style=""--_16v7pfz2:2"">OTE $200,000 pa (Salary plus Uncapped Commission)</span></span></div></div>]",,Real-estate-property - None,08/02/2024
2,https://www.seek.com.au//job/73453792?type=standout&ref=search-standalone,real estate property,"Commercial Sales, Leasing & Property Mgmt",Manager Property,Bayside Council,"$179,562.06 – $202,098.68 per year",179562.06,190830.37,202098.68,Sydney NSW,"Bayside Council is seeking a Manager, Property plays an integral role within the Property function in delivering strategic Council projects.","[<div class=""_1wkzzau0 a1msqi6m""><span class=""_1wkzzau0 a1msqi4y lnocuo0 lnocuo1 lnocuo21 _1d0g9qk4 lnocuo7""><a aria-label=""Limit results to Rockdale"" class=""_1wkzzau0 _1wkzzauf _1wkzzau0 _1wkzzauf _842p0a0 _842p0a2"" data-automation=""jobLocation"" href=""/jobs-in-real-estate-property/in-Rockdale-NSW-2216?salarytype=annual&amp;salaryrange=245000-250000"" rel=""nofollow"" tabindex=""-1"" target=""_self"" title=""Limit results to Rockdale"">Rockdale</a>, <a aria-label=""Limit results to Sydney NSW"" class=""_1wkzzau0 _1wkzzauf _1wkzzau0 _1wkzzauf _842p0a0 _842p0a2"" data-automation=""jobLocation"" href=""/jobs-in-real-estate-property/in-All-Sydney-NSW?salarytype=annual&amp;salaryrange=245000-250000"" rel=""nofollow"" tabindex=""-1"" target=""_self"" title=""Limit results to Sydney NSW"">Sydney NSW</a></span></div>, <div class=""_1wkzzau0 a1msqi6m""><div aria-label=""Salary: $179,562.06 – $202,098.68 per year"" class=""_1wkzzau0""><span class=""_1wkzzau0 a1msqi4y lnocuo0 lnocuo1 lnocuo21 _1d0g9qk4 lnocuo7"" data-automation=""jobSalary""><span class=""_1wkzzau0 _16v7pfz1 a1msqi4y a1msqi0 a1msqir _16v7pfz3"" style=""--_16v7pfz2:2"">$179,562.06 – $202,098.68 per year</span></span></div></div>]",2024-02-01,Real-estate-property - None,08/02/2024
3,https://www.seek.com.au//job/73416948?type=standout&ref=search-standalone,real estate property,Retail & Property Development,"Director of Property Advisory, Acquisitions",Talent Butler PTY LTD,"$250k+ Base plus profit share, OTE $350k",250000.0,300000.0,350000.0,Sydney NSW,"Your expertise should cover a range of property advisory services, with a focus on the acquisition of commercial property assets.","[<div class=""_1wkzzau0 a1msqi6m""><span class=""_1wkzzau0 a1msqi4y lnocuo0 lnocuo1 lnocuo21 _1d0g9qk4 lnocuo7""><a aria-label=""Limit results to Sydney NSW"" class=""_1wkzzau0 _1wkzzauf _1wkzzau0 _1wkzzauf _842p0a0 _842p0a2"" data-automation=""jobLocation"" href=""/jobs-in-real-estate-property/in-All-Sydney-NSW?salarytype=annual&amp;salaryrange=245000-250000"" rel=""nofollow"" tabindex=""-1"" target=""_self"" title=""Limit results to Sydney NSW"">Sydney NSW</a></span></div>, <div class=""_1wkzzau0 a1msqi6m""><div aria-label=""Salary: $250k+ Base plus profit share, OTE $350k"" class=""_1wkzzau0""><span class=""_1wkzzau0 a1msqi4y lnocuo0 lnocuo1 lnocuo21 _1d0g9qk4 lnocuo7"" data-automation=""jobSalary""><span class=""_1wkzzau0 _16v7pfz1 a1msqi4y a1msqi0 a1msqir _16v7pfz3"" style=""--_16v7pfz2:2"">$250k+ Base plus profit share, OTE $350k</span></span></div></div>]",2024-01-31,Real-estate-property - None,08/02/2024
4,https://www.seek.com.au//job/73578368?type=standout&ref=search-standalone,real estate property,Retail & Property Development,Senior Property Development Manager,Newcastle Airport Pty Limited,"$250,000 – $300,000 per year + KPI incentive",250000.0,275000.0,300000.0,Newcastle NSW,Opportunity to progress into an Executive role and make your mark as a strategic leader in property development,"[<div class=""_1wkzzau0 a1msqi6m""><span class=""_1wkzzau0 a1msqi4y lnocuo0 lnocuo1 lnocuo21 _1d0g9qk4 lnocuo7""><a aria-label=""Limit results to Williamtown"" class=""_1wkzzau0 _1wkzzauf _1wkzzau0 _1wkzzauf _842p0a0 _842p0a2"" data-automation=""jobLocation"" href=""/jobs-in-real-estate-property/in-Williamtown-NSW-2318?salarytype=annual&amp;salaryrange=245000-250000"" rel=""nofollow"" tabindex=""-1"" target=""_self"" title=""Limit results to Williamtown"">Williamtown</a>, <a aria-label=""Limit results to Newcastle, Maitland &amp; Hunter NSW"" class=""_1wkzzau0 _1wkzzauf _1wkzzau0 _1wkzzauf _842p0a0 _842p0a2"" data-automation=""jobLocation"" href=""/jobs-in-real-estate-property/in-Newcastle,-Maitland-&amp;-Hunter-NSW?salarytype=annual&amp;salaryrange=245000-250000"" rel=""nofollow"" tabindex=""-1"" target=""_self"" title=""Limit results to Newcastle, Maitland &amp; Hunter NSW"">Newcastle, Maitland &amp; Hunter NSW</a></span></div>, <div class=""_1wkzzau0 a1msqi6m""><div aria-label=""Salary: $250,000 – $300,000 per year + KPI incentive"" class=""_1wkzzau0""><span class=""_1wkzzau0 a1msqi4y lnocuo0 lnocuo1 lnocuo21 _1d0g9qk4 lnocuo7"" data-automation=""jobSalary""><span class=""_1wkzzau0 _16v7pfz1 a1msqi4y a1msqi0 a1msqir _16v7pfz3"" style=""--_16v7pfz2:2"">$250,000 – $300,000 per year + KPI incentive</span></span></div></div>]",2024-02-07,Real-estate-property - None,08/02/2024
5,https://www.seek.com.au//job/73008689?type=standard&ref=search-standalone,real estate property,Other,Buyer's Agent,Henderson Advocacy,"$200,000 – $250,000 per year",200000.0,225000.0,250000.0,Newcastle NSW,"Join Henderson Advocacy as a Buyers Agent in Newcastle. Thrive in innovation, build connections, and redefine property advocacy. Apply now!","[<div class=""_1wkzzau0 a1msqi6m""><span class=""_1wkzzau0 a1msqi4y lnocuo0 lnocuo1 lnocuo21 _1d0g9qk4 lnocuo7""><a aria-label=""Limit results to Newcastle"" class=""_1wkzzau0 _1wkzzauf _1wkzzau0 _1wkzzauf _842p0a0 _842p0a2"" data-automation=""jobLocation"" href=""/jobs-in-real-estate-property/in-Newcastle-NSW-2300?salarytype=annual&amp;salaryrange=245000-250000"" rel=""nofollow"" tabindex=""-1"" target=""_self"" title=""Limit results to Newcastle"">Newcastle</a>, <a aria-label=""Limit results to Newcastle, Maitland &amp; Hunter NSW"" class=""_1wkzzau0 _1wkzzauf _1wkzzau0 _1wkzzauf _842p0a0 _842p0a2"" data-automation=""jobLocation"" href=""/jobs-in-real-estate-property/in-Newcastle,-Maitland-&amp;-Hunter-NSW?salarytype=annual&amp;salaryrange=245000-250000"" rel=""nofollow"" tabindex=""-1"" target=""_self"" title=""Limit results to Newcastle, Maitland &amp; Hunter NSW"">Newcastle, Maitland &amp; Hunter NSW</a></span></div>, <div class=""_1wkzzau0 a1msqi6m""><div aria-label=""Salary: $200,000 – $250,000 per year"" class=""_1wkzzau0""><span class=""_1wkzzau0 a1msqi4y lnocuo0 lnocuo1 lnocuo21 _1d0g9qk4 lnocuo7"" data-automation=""jobSalary""><span class=""_1wkzzau0 _16v7pfz1 a1msqi4y a1msqi0 a1msqir _16v7pfz3"" style=""--_16v7pfz2:2"">$200,000 – $250,000 per year</span></span></div></div>]",2024-02-07,Real-estate-property - None,08/02/2024
6,https://www.seek.com.au//job/73512383?type=standout&ref=search-standalone,real estate property,Residential Sales,Real Estate Sales Agent,Dignam Real Estate,"Opportunity to earn $200,000 – $500,000+ per year",245000.0,247500.0,250000.0,Wollongong NSW,Are you a seasoned Sales Agent that isn’t being given enough opportunities in your current agency?,"[<div class=""_1wkzzau0 a1msqi6m""><span class=""_1wkzzau0 a1msqi4y lnocuo0 lnocuo1 lnocuo21 _1d0g9qk4 lnocuo7""><a aria-label=""Limit results to Dapto"" class=""_1wkzzau0 _1wkzzauf _1wkzzau0 _1wkzzauf _842p0a0 _842p0a2"" data-automation=""jobLocation"" href=""/jobs-in-real-estate-property/in-Dapto-NSW-2530?salarytype=annual&amp;salaryrange=245000-250000"" rel=""nofollow"" tabindex=""-1"" target=""_self"" title=""Limit results to Dapto"">Dapto</a>, <a aria-label=""Limit results to Wollongong, Illawarra &amp; South Coast NSW"" class=""_1wkzzau0 _1wkzzauf _1wkzzau0 _1wkzzauf _842p0a0 _842p0a2"" data-automation=""jobLocation"" href=""/jobs-in-real-estate-property/in-Wollongong,-Illawarra-&amp;-South-Coast-NSW?salarytype=annual&amp;salaryrange=245000-250000"" rel=""nofollow"" tabindex=""-1"" target=""_self"" title=""Limit results to Wollongong, Illawarra &amp; South Coast NSW"">Wollongong, Illawarra &amp; South Coast NSW</a></span></div>, <div class=""_1wkzzau0 a1msqi6m""><div aria-label=""Salary: Opportunity to earn $200,000 – $500,000+ per year"" class=""_1wkzzau0""><span class=""_1wkzzau0 a1msqi4y lnocuo0 lnocuo1 lnocuo21 _1d0g9qk4 lnocuo7"" data-automation=""jobSalary""><span class=""_1wkzzau0 _16v7pfz1 a1msqi4y a1msqi0 a1msqir _16v7pfz3"" style=""--_16v7pfz2:2"">Opportunity to earn $200,000 – $500,000+ per year</span></span></div></div>]",2024-02-05,Real-estate-property - None,08/02/2024
7,https://www.seek.com.au//job/73542439?type=standout&ref=search-standalone,real estate property,Residential Sales,Buyers Agent,Industry Talent Pty Ltd,Base Salary + Commissions,245000.0,247500.0,250000.0,Brisbane QLD,Unlimited OTE! | high end brand | Clients provided | ongoing training and support!,"[<div class=""_1wkzzau0 a1msqi6m""><span class=""_1wkzzau0 a1msqi4y lnocuo0 lnocuo1 lnocuo21 _1d0g9qk4 lnocuo7""><a aria-label=""Limit results to Fortitude Valley"" class=""_1wkzzau0 _1wkzzauf _1wkzzau0 _1wkzzauf _842p0a0 _842p0a2"" data-automation=""jobLocation"" href=""/jobs-in-real-estate-property/in-Fortitude-Valley-QLD-4006?salarytype=annual&amp;salaryrange=245000-250000"" rel=""nofollow"" tabindex=""-1"" target=""_self"" title=""Limit results to Fortitude Valley"">Fortitude Valley</a>, <a aria-label=""Limit results to Brisbane QLD"" class=""_1wkzzau0 _1wkzzauf _1wkzzau0 _1wkzzauf _842p0a0 _842p0a2"" data-automation=""jobLocation"" href=""/jobs-in-real-estate-property/in-All-Brisbane-QLD?salarytype=annual&amp;salaryrange=245000-250000"" rel=""nofollow"" tabindex=""-1"" target=""_self"" title=""Limit results to Brisbane QLD"">Brisbane QLD</a></span></div>, <div class=""_1wkzzau0 a1msqi6m""><div aria-label=""Salary: Base Salary + Commissions"" class=""_1wkzzau0""><span class=""_1wkzzau0 a1msqi4y lnocuo0 lnocuo1 lnocuo21 _1d0g9qk4 lnocuo7"" data-automation=""jobSalary""><span class=""_1wkzzau0 _16v7pfz1 a1msqi4y a1msqi0 a1msqir _16v7pfz3"" style=""--_16v7pfz2:2"">Base Salary + Commissions</span></span></div></div>]",2024-02-06,Real-estate-property - None,08/02/2024
8,https://www.seek.com.au//job/73623754?type=standout&ref=search-standalone,real estate property,"Commercial Sales, Leasing & Property Mgmt","Head of Asset Management, Logistics",GPT Group,-,245000.0,247500.0,250000.0,Sydney NSW,"Drive our strategic vision, unlock new opportunities and maximise the potential of our logistics portfolio","[<div class=""_1wkzzau0 a1msqi6m""><span class=""_1wkzzau0 a1msqi4y lnocuo0 lnocuo1 lnocuo21 _1d0g9qk4 lnocuo7""><a aria-label=""Limit results to Sydney NSW"" class=""_1wkzzau0 _1wkzzauf _1wkzzau0 _1wkzzauf _842p0a0 _842p0a2"" data-automation=""jobLocation"" href=""/jobs-in-real-estate-property/in-All-Sydney-NSW?salarytype=annual&amp;salaryrange=245000-250000"" rel=""nofollow"" tabindex=""-1"" target=""_self"" title=""Limit results to Sydney NSW"">Sydney NSW</a></span></div>]",,Real-estate-property - None,08/02/2024
9,https://www.seek.com.au//job/73520334?type=standout&ref=search-standalone,real estate property,Other,Chief Property Officer,Capstone Recruitment Group Pty Ltd,-,245000.0,247500.0,250000.0,Sydney NSW,"Chief Property Officer - help bring to fruition, the City of Ryde's vision of becoming Sydney's premier destination to work, live & play.","[<div class=""_1wkzzau0 a1msqi6m""><span class=""_1wkzzau0 a1msqi4y lnocuo0 lnocuo1 lnocuo21 _1d0g9qk4 lnocuo7""><a aria-label=""Limit results to Ryde"" class=""_1wkzzau0 _1wkzzauf _1wkzzau0 _1wkzzauf _842p0a0 _842p0a2"" data-automation=""jobLocation"" href=""/jobs-in-real-estate-property/in-Ryde-NSW-2112?salarytype=annual&amp;salaryrange=245000-250000"" rel=""nofollow"" tabindex=""-1"" target=""_self"" title=""Limit results to Ryde"">Ryde</a>, <a aria-label=""Limit results to Sydney NSW"" class=""_1wkzzau0 _1wkzzauf _1wkzzau0 _1wkzzauf _842p0a0 _842p0a2"" data-automation=""jobLocation"" href=""/jobs-in-real-estate-property/in-All-Sydney-NSW?salarytype=annual&amp;salaryrange=245000-250000"" rel=""nofollow"" tabindex=""-1"" target=""_self"" title=""Limit results to Sydney NSW"">Sydney NSW</a></span></div>]",2024-02-05,Real-estate-property - None,08/02/2024
10,https://www.seek.com.au//job/73526789?type=standard&ref=search-standalone,real estate property,Residential Sales,Investment Property Strategist,surge real estate,"$200,000 – $350,000 Plus (Uncapped Commissions)",200000.0,275000.0,350000.0,Melbourne VIC,Appointments are pre set for you with qualified leads,"[<div class=""_1wkzzau0 a1msqi6m""><span class=""_1wkzzau0 a1msqi4y lnocuo0 lnocuo1 lnocuo21 _1d0g9qk4 lnocuo7""><a aria-label=""Limit results to Melbourne VIC"" class=""_1wkzzau0 _1wkzzauf _1wkzzau0 _1wkzzauf _842p0a0 _842p0a2"" data-automation=""jobLocation"" href=""/jobs-in-real-estate-property/in-All-Melbourne-VIC?salarytype=annual&amp;salaryrange=245000-250000"" rel=""nofollow"" tabindex=""-1"" target=""_self"" title=""Limit results to Melbourne VIC"">Melbourne VIC</a></span></div>, <div class=""_1wkzzau0 a1msqi6m""><div aria-label=""Salary: $200,000 – $350,000 Plus (Uncapped Commissions)"" class=""_1wkzzau0""><span class=""_1wkzzau0 a1msqi4y lnocuo0 lnocuo1 lnocuo21 _1d0g9qk4 lnocuo7"" data-automation=""jobSalary""><span class=""_1wkzzau0 _16v7pfz1 a1msqi4y a1msqi0 a1msqir _16v7pfz3"" style=""--_16v7pfz2:2"">$200,000 – $350,000 Plus (Uncapped Commissions)</span></span></div></div>]",2024-02-06,Real-estate-property - None,08/02/2024
11,https://www.seek.com.au//job/73580349?type=standout&ref=search-standalone,real estate property,Valuation,Associate Director - Property Consultancy,Savills Pty Ltd,Competitive annual salary package,245000.0,247500.0,250000.0,Sydney NSW,An exciting opportunity has arisen for an experienced Associate Director to become an integral part of our Property Consultancy Team.,"[<div class=""_1wkzzau0 a1msqi6m""><span class=""_1wkzzau0 a1msqi4y lnocuo0 lnocuo1 lnocuo21 _1d0g9qk4 lnocuo7""><a aria-label=""Limit results to Sydney NSW"" class=""_1wkzzau0 _1wkzzauf _1wkzzau0 _1wkzzauf _842p0a0 _842p0a2"" data-automation=""jobLocation"" href=""/jobs-in-real-estate-property/in-All-Sydney-NSW?salarytype=annual&amp;salaryrange=245000-250000"" rel=""nofollow"" tabindex=""-1"" target=""_self"" title=""Limit results to Sydney NSW"">Sydney NSW</a></span></div>, <div class=""_1wkzzau0 a1msqi6m""><div aria-label=""Salary: Competitive annual salary package"" class=""_1wkzzau0""><span class=""_1wkzzau0 a1msqi4y lnocuo0 lnocuo1 lnocuo21 _1d0g9qk4 lnocuo7"" data-automation=""jobSalary""><span class=""_1wkzzau0 _16v7pfz1 a1msqi4y a1msqi0 a1msqir _16v7pfz3"" style=""--_16v7pfz2:2"">Competitive annual salary package</span></span></div></div>]",2024-02-07,Real-estate-property - None,08/02/2024
12,https://www.seek.com.au//job/73576567?type=standout&ref=search-standalone,real estate property,Retail & Property Development,"Director, Development & Project Delivery",Capstone Recruitment Group Pty Ltd,-,245000.0,247500.0,250000.0,Brisbane QLD,Rare opportunity for leadership role within University of Queensland overseeing their Property Development pipeline.,"[<div class=""_1wkzzau0 a1msqi6m""><span class=""_1wkzzau0 a1msqi4y lnocuo0 lnocuo1 lnocuo21 _1d0g9qk4 lnocuo7""><a aria-label=""Limit results to Brisbane QLD"" class=""_1wkzzau0 _1wkzzauf _1wkzzau0 _1wkzzauf _842p0a0 _842p0a2"" data-automation=""jobLocation"" href=""/jobs-in-real-estate-property/in-All-Brisbane-QLD?salarytype=annual&amp;salaryrange=245000-250000"" rel=""nofollow"" tabindex=""-1"" target=""_self"" title=""Limit results to Brisbane QLD"">Brisbane QLD</a></span></div>]",2024-02-07,Real-estate-property - None,08/02/2024
13,https://www.seek.com.au//job/73529600?type=standard&ref=search-standalone,real estate property,Residential Sales,Buyers Agent,Henderson Advocacy,-,245000.0,247500.0,250000.0,Brisbane QLD,"Join Henderson in Sydney, Brisbane, Adelaide, Melbourne & Newcastle. Advance your career, brand, & income with autonomy, flexibility & support.","[<div class=""_1wkzzau0 a1msqi6m""><span class=""_1wkzzau0 a1msqi4y lnocuo0 lnocuo1 lnocuo21 _1d0g9qk4 lnocuo7""><a aria-label=""Limit results to Brisbane QLD"" class=""_1wkzzau0 _1wkzzauf _1wkzzau0 _1wkzzauf _842p0a0 _842p0a2"" data-automation=""jobLocation"" href=""/jobs-in-real-estate-property/in-All-Brisbane-QLD?salarytype=annual&amp;salaryrange=245000-250000"" rel=""nofollow"" tabindex=""-1"" target=""_self"" title=""Limit results to Brisbane QLD"">Brisbane QLD</a></span></div>]",2024-02-05,Real-estate-property - None,08/02/2024
14,https://www.seek.com.au//job/73611105?type=standout&ref=search-standalone,real estate property,Retail & Property Development,Infrastructure Planning Manager,ROUSSOS Recruitment,-,245000.0,247500.0,250000.0,Adelaide SA,A key executive and leadership opportunity across flagship projects for South Australia.,"[<div class=""_1wkzzau0 a1msqi6m""><span class=""_1wkzzau0 a1msqi4y lnocuo0 lnocuo1 lnocuo21 _1d0g9qk4 lnocuo7""><a aria-label=""Limit results to Adelaide SA"" class=""_1wkzzau0 _1wkzzauf _1wkzzau0 _1wkzzauf _842p0a0 _842p0a2"" data-automation=""jobLocation"" href=""/jobs-in-real-estate-property/in-All-Adelaide-SA?salarytype=annual&amp;salaryrange=245000-250000"" rel=""nofollow"" tabindex=""-1"" target=""_self"" title=""Limit results to Adelaide SA"">Adelaide SA</a></span></div>]",,Real-estate-property - None,08/02/2024
15,https://www.seek.com.au//job/73409266?type=standard&ref=search-standalone,real estate property,Other,Buyers Agent,Wealth Hub Australia,"$150,000 – $220,000",150000.0,185000.0,220000.0,Gold Coast QLD,"Wealth Hub Australia is seeking a full-time, on-site Buyers Agent to join our passionate team.","[<div class=""_1wkzzau0 a1msqi6m""><span class=""_1wkzzau0 a1msqi4y lnocuo0 lnocuo1 lnocuo21 _1d0g9qk4 lnocuo7""><a aria-label=""Limit results to Southport"" class=""_1wkzzau0 _1wkzzauf _1wkzzau0 _1wkzzauf _842p0a0 _842p0a2"" data-automation=""jobLocation"" href=""/jobs-in-real-estate-property/in-Southport-QLD-4215?salarytype=annual&amp;salaryrange=245000-250000"" rel=""nofollow"" tabindex=""-1"" target=""_self"" title=""Limit results to Southport"">Southport</a>, <a aria-label=""Limit results to Gold Coast QLD"" class=""_1wkzzau0 _1wkzzauf _1wkzzau0 _1wkzzauf _842p0a0 _842p0a2"" data-automation=""jobLocation"" href=""/jobs-in-real-estate-property/in-All-Gold-Coast-QLD?salarytype=annual&amp;salaryrange=245000-250000"" rel=""nofollow"" tabindex=""-1"" target=""_self"" title=""Limit results to Gold Coast QLD"">Gold Coast QLD</a></span></div>, <div class=""_1wkzzau0 a1msqi6m""><div aria-label=""Salary: $150,000 – $220,000"" class=""_1wkzzau0""><span class=""_1wkzzau0 a1msqi4y lnocuo0 lnocuo1 lnocuo21 _1d0g9qk4 lnocuo7"" data-automation=""jobSalary""><span class=""_1wkzzau0 _16v7pfz1 a1msqi4y a1msqi0 a1msqir _16v7pfz3"" style=""--_16v7pfz2:2"">$150,000 – $220,000</span></span></div></div>]",2024-01-31,Real-estate-property - None,08/02/2024
16,https://www.seek.com.au//job/73554151?type=standout&ref=search-standalone,real estate property,"Commercial Sales, Leasing & Property Mgmt","Director, Commercial Business",Capstone Recruitment Group Pty Ltd,-,245000.0,247500.0,250000.0,Brisbane QLD,Newly created senior leadership role at The University of Queensland overseeing commercial businesses within their portfolio.,"[<div class=""_1wkzzau0 a1msqi6m""><span class=""_1wkzzau0 a1msqi4y lnocuo0 lnocuo1 lnocuo21 _1d0g9qk4 lnocuo7""><a aria-label=""Limit results to Brisbane QLD"" class=""_1wkzzau0 _1wkzzauf _1wkzzau0 _1wkzzauf _842p0a0 _842p0a2"" data-automation=""jobLocation"" href=""/jobs-in-real-estate-property/in-All-Brisbane-QLD?salarytype=annual&amp;salaryrange=245000-250000"" rel=""nofollow"" tabindex=""-1"" target=""_self"" title=""Limit results to Brisbane QLD"">Brisbane QLD</a></span></div>]",2024-02-06,Real-estate-property - None,08/02/2024
17,https://www.seek.com.au//job/73572707?type=standard&ref=search-standalone,real estate property,Residential Leasing & Property Management,Compliance Project Manager,Randstad - Business Support,$850 p.d. + super,204000.0,227000.0,250000.0,Sydney NSW,"Contract opportunity for an experienced Compliance Project Manager/Property Manager to work with a well-known government agency in Parramatta, NSW","[<div class=""_1wkzzau0 a1msqi6m""><span class=""_1wkzzau0 a1msqi4y lnocuo0 lnocuo1 lnocuo21 _1d0g9qk4 lnocuo7""><a aria-label=""Limit results to Parramatta"" class=""_1wkzzau0 _1wkzzauf _1wkzzau0 _1wkzzauf _842p0a0 _842p0a2"" data-automation=""jobLocation"" href=""/jobs-in-real-estate-property/in-Parramatta-NSW-2150?salarytype=annual&amp;salaryrange=245000-250000"" rel=""nofollow"" tabindex=""-1"" target=""_self"" title=""Limit results to Parramatta"">Parramatta</a>, <a aria-label=""Limit results to Sydney NSW"" class=""_1wkzzau0 _1wkzzauf _1wkzzau0 _1wkzzauf _842p0a0 _842p0a2"" data-automation=""jobLocation"" href=""/jobs-in-real-estate-property/in-All-Sydney-NSW?salarytype=annual&amp;salaryrange=245000-250000"" rel=""nofollow"" tabindex=""-1"" target=""_self"" title=""Limit results to Sydney NSW"">Sydney NSW</a></span></div>, <div class=""_1wkzzau0 a1msqi6m""><div aria-label=""Salary: $850 p.d. + super"" class=""_1wkzzau0""><span class=""_1wkzzau0 a1msqi4y lnocuo0 lnocuo1 lnocuo21 _1d0g9qk4 lnocuo7"" data-automation=""jobSalary""><span class=""_1wkzzau0 _16v7pfz1 a1msqi4y a1msqi0 a1msqir _16v7pfz3"" style=""--_16v7pfz2:2"">$850 p.d. + super</span></span></div></div>]",2024-02-07,Real-estate-property - None,08/02/2024
18,https://www.seek.com.au//job/73617870?type=standout&ref=search-standalone,real estate property,Residential Sales,Head of Apartment Sales,Capstone Recruitment Group Pty Ltd,-,245000.0,247500.0,250000.0,Sydney NSW,Exceptional opportunity to move to an established developer and lead the sales function of stunning Sydney apartments,"[<div class=""_1wkzzau0 a1msqi6m""><span class=""_1wkzzau0 a1msqi4y lnocuo0 lnocuo1 lnocuo21 _1d0g9qk4 lnocuo7""><a aria-label=""Limit results to Sydney NSW"" class=""_1wkzzau0 _1wkzzauf _1wkzzau0 _1wkzzauf _842p0a0 _842p0a2"" data-automation=""jobLocation"" href=""/jobs-in-real-estate-property/in-All-Sydney-NSW?salarytype=annual&amp;salaryrange=245000-250000"" rel=""nofollow"" tabindex=""-1"" target=""_self"" title=""Limit results to Sydney NSW"">Sydney NSW</a></span></div>]",,Real-estate-property - None,08/02/2024
