,link,classification,category,title,company,salary,min_salary,average_salary,max_salary,location,description,entireDiv,date_posted,Category,Date
223,https://www.seek.com.au//job/73007090?type=standard&ref=search-standalone,insurance superannuation,Other,Account Manager - Broker Placement Team,Resilium Insurance Broking,-,140000.0,142500.0,145000.0,Sydney NSW,We’ve got an exciting opportunity for an Account Manager to join Resilium Insurance Broking in our North Sydney Office!,"[<div class=""_1wkzzau0 a1msqi6m""><span class=""_1wkzzau0 a1msqi4y lnocuo0 lnocuo1 lnocuo21 _1d0g9qk4 lnocuo7""><a aria-label=""Limit results to North Sydney"" class=""_1wkzzau0 _1wkzzauf _1wkzzau0 _1wkzzauf _842p0a0 _842p0a2"" data-automation=""jobLocation"" href=""/jobs-in-insurance-superannuation/in-North-Sydney-NSW-2060?salarytype=annual&amp;salaryrange=140000-145000"" rel=""nofollow"" tabindex=""-1"" target=""_self"" title=""Limit results to North Sydney"">North Sydney</a>, <a aria-label=""Limit results to Sydney NSW"" class=""_1wkzzau0 _1wkzzauf _1wkzzau0 _1wkzzauf _842p0a0 _842p0a2"" data-automation=""jobLocation"" href=""/jobs-in-insurance-superannuation/in-All-Sydney-NSW?salarytype=annual&amp;salaryrange=140000-145000"" rel=""nofollow"" tabindex=""-1"" target=""_self"" title=""Limit results to Sydney NSW"">Sydney NSW</a></span></div>]",2024-01-15,Insurance-superannuation - None,08/02/2024
224,https://www.seek.com.au//job/73046854?type=standout&ref=search-standalone,insurance superannuation,Brokerage,Account Executive,Kennedy Reid,"$80,000 - $120,000",80000.0,100000.0,120000.0,Sydney NSW,Tier 1 qualified with experience in the broking industry? We'd love to hear from you!,"[<div class=""_1wkzzau0 a1msqi6m""><span class=""_1wkzzau0 a1msqi4y lnocuo0 lnocuo1 lnocuo21 _1d0g9qk4 lnocuo7""><a aria-label=""Limit results to Sydney NSW"" class=""_1wkzzau0 _1wkzzauf _1wkzzau0 _1wkzzauf _842p0a0 _842p0a2"" data-automation=""jobLocation"" href=""/jobs-in-insurance-superannuation/in-All-Sydney-NSW?salarytype=annual&amp;salaryrange=140000-145000"" rel=""nofollow"" tabindex=""-1"" target=""_self"" title=""Limit results to Sydney NSW"">Sydney NSW</a></span></div>, <div class=""_1wkzzau0 a1msqi6m""><div aria-label=""Salary: $80,000 - $120,000"" class=""_1wkzzau0""><span class=""_1wkzzau0 a1msqi4y lnocuo0 lnocuo1 lnocuo21 _1d0g9qk4 lnocuo7"" data-automation=""jobSalary""><span class=""_1wkzzau0 _16v7pfz1 a1msqi4y a1msqi0 a1msqir _16v7pfz3"" style=""--_16v7pfz2:2"">$80,000 - $120,000</span></span></div></div>]",2024-01-16,Insurance-superannuation - None,08/02/2024
225,https://www.seek.com.au//job/72884410?type=standout&ref=search-standalone,insurance superannuation,Underwriting,Fleet Underwriter,Fuse Recruitment,AUD 90000 - 120000 per annum,140000.0,142500.0,145000.0,Sydney NSW,Join an industry specialist in heavy motor insurance and grow your exposure to unique risks,"[<div class=""_1wkzzau0 a1msqi6m""><span class=""_1wkzzau0 a1msqi4y lnocuo0 lnocuo1 lnocuo21 _1d0g9qk4 lnocuo7""><a aria-label=""Limit results to Sydney NSW"" class=""_1wkzzau0 _1wkzzauf _1wkzzau0 _1wkzzauf _842p0a0 _842p0a2"" data-automation=""jobLocation"" href=""/jobs-in-insurance-superannuation/in-All-Sydney-NSW?salarytype=annual&amp;salaryrange=140000-145000"" rel=""nofollow"" tabindex=""-1"" target=""_self"" title=""Limit results to Sydney NSW"">Sydney NSW</a></span></div>, <div class=""_1wkzzau0 a1msqi6m""><div aria-label=""Salary: AUD 90000 - 120000 per annum"" class=""_1wkzzau0""><span class=""_1wkzzau0 a1msqi4y lnocuo0 lnocuo1 lnocuo21 _1d0g9qk4 lnocuo7"" data-automation=""jobSalary""><span class=""_1wkzzau0 _16v7pfz1 a1msqi4y a1msqi0 a1msqir _16v7pfz3"" style=""--_16v7pfz2:2"">AUD 90000 - 120000 per annum</span></span></div></div>]",2024-01-10,Insurance-superannuation - None,08/02/2024
226,https://www.seek.com.au//job/73072662?type=standout&ref=search-standalone,insurance superannuation,Workers' Compensation,Key Account Manager,GIO (Suncorp Group),Attractive Salary + Bonus + great benefits,140000.0,142500.0,145000.0,Sydney NSW,Do not miss this exciting opportunity to utilise your Workers Compensation experience and make a real difference,"[<div class=""_1wkzzau0 a1msqi6m""><span class=""_1wkzzau0 a1msqi4y lnocuo0 lnocuo1 lnocuo21 _1d0g9qk4 lnocuo7""><a aria-label=""Limit results to Sydney NSW"" class=""_1wkzzau0 _1wkzzauf _1wkzzau0 _1wkzzauf _842p0a0 _842p0a2"" data-automation=""jobLocation"" href=""/jobs-in-insurance-superannuation/in-All-Sydney-NSW?salarytype=annual&amp;salaryrange=140000-145000"" rel=""nofollow"" tabindex=""-1"" target=""_self"" title=""Limit results to Sydney NSW"">Sydney NSW</a></span></div>, <div class=""_1wkzzau0 a1msqi6m""><div aria-label=""Salary: Attractive Salary + Bonus + great benefits"" class=""_1wkzzau0""><span class=""_1wkzzau0 a1msqi4y lnocuo0 lnocuo1 lnocuo21 _1d0g9qk4 lnocuo7"" data-automation=""jobSalary""><span class=""_1wkzzau0 _16v7pfz1 a1msqi4y a1msqi0 a1msqir _16v7pfz3"" style=""--_16v7pfz2:2"">Attractive Salary + Bonus + great benefits</span></span></div></div>]",2024-01-17,Insurance-superannuation - None,08/02/2024
227,https://www.seek.com.au//job/73100301?type=standard&ref=search-standalone,insurance superannuation,Workers' Compensation,Workcover Premium & Policy Specialist,Hooker & Heijden,-,140000.0,142500.0,145000.0,Melbourne VIC,Seeking keen and experienced WorkCover premium and policy experts to join this growing team in a National Workcover consultancy.,"[<div class=""_1wkzzau0 a1msqi6m""><span class=""_1wkzzau0 a1msqi4y lnocuo0 lnocuo1 lnocuo21 _1d0g9qk4 lnocuo7""><a aria-label=""Limit results to Melbourne VIC"" class=""_1wkzzau0 _1wkzzauf _1wkzzau0 _1wkzzauf _842p0a0 _842p0a2"" data-automation=""jobLocation"" href=""/jobs-in-insurance-superannuation/in-All-Melbourne-VIC?salarytype=annual&amp;salaryrange=140000-145000"" rel=""nofollow"" tabindex=""-1"" target=""_self"" title=""Limit results to Melbourne VIC"">Melbourne VIC</a></span></div>]",2024-01-18,Insurance-superannuation - None,08/02/2024
228,https://www.seek.com.au//job/73100723?type=standard&ref=search-standalone,insurance superannuation,Claims,Property Loss Adjuster,AIM Insurance Services,"$120,000 – $150,000 per year",120000.0,135000.0,150000.0,Melbourne VIC,Exciting Opportunity to Join the Best,"[<div class=""_1wkzzau0 a1msqi6m""><span class=""_1wkzzau0 a1msqi4y lnocuo0 lnocuo1 lnocuo21 _1d0g9qk4 lnocuo7""><a aria-label=""Limit results to Melbourne VIC"" class=""_1wkzzau0 _1wkzzauf _1wkzzau0 _1wkzzauf _842p0a0 _842p0a2"" data-automation=""jobLocation"" href=""/jobs-in-insurance-superannuation/in-All-Melbourne-VIC?salarytype=annual&amp;salaryrange=140000-145000"" rel=""nofollow"" tabindex=""-1"" target=""_self"" title=""Limit results to Melbourne VIC"">Melbourne VIC</a></span></div>, <div class=""_1wkzzau0 a1msqi6m""><div aria-label=""Salary: $120,000 – $150,000 per year"" class=""_1wkzzau0""><span class=""_1wkzzau0 a1msqi4y lnocuo0 lnocuo1 lnocuo21 _1d0g9qk4 lnocuo7"" data-automation=""jobSalary""><span class=""_1wkzzau0 _16v7pfz1 a1msqi4y a1msqi0 a1msqir _16v7pfz3"" style=""--_16v7pfz2:2"">$120,000 – $150,000 per year</span></span></div></div>]",2024-01-18,Insurance-superannuation - None,08/02/2024
229,https://www.seek.com.au//job/73306846?type=standout&ref=search-standalone,insurance superannuation,Workers' Compensation,Power BI Analyst,Coal Services Pty Ltd,"Starting from $140,000 incl. of super (pro rata)",140000.0,142500.0,145000.0,Sydney NSW,"Do you have a keen eye for detail, experience with Power BI, analysing data and supporting a system implementation project? Apply within!","[<div class=""_1wkzzau0 a1msqi6m""><span class=""_1wkzzau0 a1msqi4y lnocuo0 lnocuo1 lnocuo21 _1d0g9qk4 lnocuo7""><a aria-label=""Limit results to Sydney NSW"" class=""_1wkzzau0 _1wkzzauf _1wkzzau0 _1wkzzauf _842p0a0 _842p0a2"" data-automation=""jobLocation"" href=""/jobs-in-insurance-superannuation/in-All-Sydney-NSW?salarytype=annual&amp;salaryrange=140000-145000"" rel=""nofollow"" tabindex=""-1"" target=""_self"" title=""Limit results to Sydney NSW"">Sydney NSW</a></span></div>, <div class=""_1wkzzau0 a1msqi6m""><div aria-label=""Salary: Starting from $140,000 incl. of super (pro rata)"" class=""_1wkzzau0""><span class=""_1wkzzau0 a1msqi4y lnocuo0 lnocuo1 lnocuo21 _1d0g9qk4 lnocuo7"" data-automation=""jobSalary""><span class=""_1wkzzau0 _16v7pfz1 a1msqi4y a1msqi0 a1msqir _16v7pfz3"" style=""--_16v7pfz2:2"">Starting from $140,000 incl. of super (pro rata)</span></span></div></div>]",2024-01-25,Insurance-superannuation - None,08/02/2024
230,https://www.seek.com.au//job/73133328?type=standout&ref=search-standalone,insurance superannuation,Brokerage,Business Consultant - General Insurance domain,Cognizant Technology Solutions Australia Pty Ltd,-,140000.0,142500.0,145000.0,Sydney NSW,A Digital Business Consultant / Business Analyst with a focus on a sector is a critical role within Cognizant Consulting,"[<div class=""_1wkzzau0 a1msqi6m""><span class=""_1wkzzau0 a1msqi4y lnocuo0 lnocuo1 lnocuo21 _1d0g9qk4 lnocuo7""><a aria-label=""Limit results to Sydney NSW"" class=""_1wkzzau0 _1wkzzauf _1wkzzau0 _1wkzzauf _842p0a0 _842p0a2"" data-automation=""jobLocation"" href=""/jobs-in-insurance-superannuation/in-All-Sydney-NSW?salarytype=annual&amp;salaryrange=140000-145000"" rel=""nofollow"" tabindex=""-1"" target=""_self"" title=""Limit results to Sydney NSW"">Sydney NSW</a></span></div>]",2024-01-18,Insurance-superannuation - None,08/02/2024
231,https://www.seek.com.au//job/72936751?type=standout&ref=search-standalone,insurance superannuation,Brokerage,Client Executive - Life Insurance,Aon Corporation,-,140000.0,142500.0,145000.0,Sydney NSW,This is a hybrid role with the flexibility to work both virtually and from our Aon offices.,"[<div class=""_1wkzzau0 a1msqi6m""><span class=""_1wkzzau0 a1msqi4y lnocuo0 lnocuo1 lnocuo21 _1d0g9qk4 lnocuo7""><a aria-label=""Limit results to Sydney NSW"" class=""_1wkzzau0 _1wkzzauf _1wkzzau0 _1wkzzauf _842p0a0 _842p0a2"" data-automation=""jobLocation"" href=""/jobs-in-insurance-superannuation/in-All-Sydney-NSW?salarytype=annual&amp;salaryrange=140000-145000"" rel=""nofollow"" tabindex=""-1"" target=""_self"" title=""Limit results to Sydney NSW"">Sydney NSW</a></span></div>]",2024-01-11,Insurance-superannuation - None,08/02/2024
232,https://www.seek.com.au//job/72962053?type=standard&ref=search-standalone,insurance superannuation,Brokerage,Account Manager,Kennedy Reid,"$135,000 + Super",135000.0,140000.0,145000.0,Melbourne VIC,Responsible for service delivery for a key portfolio of commercial clients,"[<div class=""_1wkzzau0 a1msqi6m""><span class=""_1wkzzau0 a1msqi4y lnocuo0 lnocuo1 lnocuo21 _1d0g9qk4 lnocuo7""><a aria-label=""Limit results to Melbourne VIC"" class=""_1wkzzau0 _1wkzzauf _1wkzzau0 _1wkzzauf _842p0a0 _842p0a2"" data-automation=""jobLocation"" href=""/jobs-in-insurance-superannuation/in-All-Melbourne-VIC?salarytype=annual&amp;salaryrange=140000-145000"" rel=""nofollow"" tabindex=""-1"" target=""_self"" title=""Limit results to Melbourne VIC"">Melbourne VIC</a></span></div>, <div class=""_1wkzzau0 a1msqi6m""><div aria-label=""Salary: $135,000 + Super"" class=""_1wkzzau0""><span class=""_1wkzzau0 a1msqi4y lnocuo0 lnocuo1 lnocuo21 _1d0g9qk4 lnocuo7"" data-automation=""jobSalary""><span class=""_1wkzzau0 _16v7pfz1 a1msqi4y a1msqi0 a1msqir _16v7pfz3"" style=""--_16v7pfz2:2"">$135,000 + Super</span></span></div></div>]",2024-01-12,Insurance-superannuation - None,08/02/2024
233,https://www.seek.com.au//job/73541312?type=standout&ref=search-standalone,insurance superannuation,Other,Senior Digital Analytics Specialist - 12 Month Fixed Term Contract,Suncorp,-,140000.0,142500.0,145000.0,Sydney NSW,The Digital Analytics team is accountable for leading the solution and delivery of analytics across our public facing digital assets.,"[<div class=""_1wkzzau0 a1msqi6m""><span class=""_1wkzzau0 a1msqi4y lnocuo0 lnocuo1 lnocuo21 _1d0g9qk4 lnocuo7""><a aria-label=""Limit results to Sydney NSW"" class=""_1wkzzau0 _1wkzzauf _1wkzzau0 _1wkzzauf _842p0a0 _842p0a2"" data-automation=""jobLocation"" href=""/jobs-in-insurance-superannuation/in-All-Sydney-NSW?salarytype=annual&amp;salaryrange=140000-145000"" rel=""nofollow"" tabindex=""-1"" target=""_self"" title=""Limit results to Sydney NSW"">Sydney NSW</a></span></div>]",2024-02-06,Insurance-superannuation - None,08/02/2024
234,https://www.seek.com.au//job/72925626?type=standard&ref=search-standalone,insurance superannuation,Brokerage,General Insurance Broker,Coverforce Pty Ltd,-,140000.0,142500.0,145000.0,Sydney NSW,Exciting opportunity to join a high performing team in a successful Insurance Brokerage. Hybrid work format with Monday and Friday WFH after training.,"[<div class=""_1wkzzau0 a1msqi6m""><span class=""_1wkzzau0 a1msqi4y lnocuo0 lnocuo1 lnocuo21 _1d0g9qk4 lnocuo7""><a aria-label=""Limit results to Sydney NSW"" class=""_1wkzzau0 _1wkzzauf _1wkzzau0 _1wkzzauf _842p0a0 _842p0a2"" data-automation=""jobLocation"" href=""/jobs-in-insurance-superannuation/in-All-Sydney-NSW?salarytype=annual&amp;salaryrange=140000-145000"" rel=""nofollow"" tabindex=""-1"" target=""_self"" title=""Limit results to Sydney NSW"">Sydney NSW</a></span></div>]",2024-01-11,Insurance-superannuation - None,08/02/2024
235,https://www.seek.com.au//job/72968289?type=standout&ref=search-standalone,insurance superannuation,Underwriting,"Senior Underwriter, Fleet",Fuse Recruitment,AUD 120000 - 140000 per annum,140000.0,142500.0,145000.0,Melbourne VIC,"Play a pivotal role in this dynamic team of specialists, utilise your industry knowledge and act as the technical referral point","[<div class=""_1wkzzau0 a1msqi6m""><span class=""_1wkzzau0 a1msqi4y lnocuo0 lnocuo1 lnocuo21 _1d0g9qk4 lnocuo7""><a aria-label=""Limit results to Melbourne VIC"" class=""_1wkzzau0 _1wkzzauf _1wkzzau0 _1wkzzauf _842p0a0 _842p0a2"" data-automation=""jobLocation"" href=""/jobs-in-insurance-superannuation/in-All-Melbourne-VIC?salarytype=annual&amp;salaryrange=140000-145000"" rel=""nofollow"" tabindex=""-1"" target=""_self"" title=""Limit results to Melbourne VIC"">Melbourne VIC</a></span></div>, <div class=""_1wkzzau0 a1msqi6m""><div aria-label=""Salary: AUD 120000 - 140000 per annum"" class=""_1wkzzau0""><span class=""_1wkzzau0 a1msqi4y lnocuo0 lnocuo1 lnocuo21 _1d0g9qk4 lnocuo7"" data-automation=""jobSalary""><span class=""_1wkzzau0 _16v7pfz1 a1msqi4y a1msqi0 a1msqir _16v7pfz3"" style=""--_16v7pfz2:2"">AUD 120000 - 140000 per annum</span></span></div></div>]",2024-01-12,Insurance-superannuation - None,08/02/2024
236,https://www.seek.com.au//job/73280941?type=standout&ref=search-standalone,insurance superannuation,Assessment,Senior Loss Adjuster,CHU Underwriting Agencies Pty Ltd,Annual salary plus bonus,140000.0,142500.0,145000.0,Brisbane QLD,Rare chance to join an engaged & expanding team as part of an award-winning business taking you current Loss Adjusting experience to the next level,"[<div class=""_1wkzzau0 a1msqi6m""><span class=""_1wkzzau0 a1msqi4y lnocuo0 lnocuo1 lnocuo21 _1d0g9qk4 lnocuo7""><a aria-label=""Limit results to Brisbane QLD"" class=""_1wkzzau0 _1wkzzauf _1wkzzau0 _1wkzzauf _842p0a0 _842p0a2"" data-automation=""jobLocation"" href=""/jobs-in-insurance-superannuation/in-All-Brisbane-QLD?salarytype=annual&amp;salaryrange=140000-145000"" rel=""nofollow"" tabindex=""-1"" target=""_self"" title=""Limit results to Brisbane QLD"">Brisbane QLD</a></span></div>, <div class=""_1wkzzau0 a1msqi6m""><div aria-label=""Salary: Annual salary plus bonus"" class=""_1wkzzau0""><span class=""_1wkzzau0 a1msqi4y lnocuo0 lnocuo1 lnocuo21 _1d0g9qk4 lnocuo7"" data-automation=""jobSalary""><span class=""_1wkzzau0 _16v7pfz1 a1msqi4y a1msqi0 a1msqir _16v7pfz3"" style=""--_16v7pfz2:2"">Annual salary plus bonus</span></span></div></div>]",2024-01-24,Insurance-superannuation - None,08/02/2024
237,https://www.seek.com.au//job/73541313?type=standout&ref=search-standalone,insurance superannuation,Other,Senior Digital Analytics Specialist - 12 Month Fixed Term Contract,Suncorp,-,140000.0,142500.0,145000.0,Melbourne VIC,The Digital Analytics team is accountable for leading the solution and delivery of analytics across our public facing digital assets.,"[<div class=""_1wkzzau0 a1msqi6m""><span class=""_1wkzzau0 a1msqi4y lnocuo0 lnocuo1 lnocuo21 _1d0g9qk4 lnocuo7""><a aria-label=""Limit results to Melbourne VIC"" class=""_1wkzzau0 _1wkzzauf _1wkzzau0 _1wkzzauf _842p0a0 _842p0a2"" data-automation=""jobLocation"" href=""/jobs-in-insurance-superannuation/in-All-Melbourne-VIC?salarytype=annual&amp;salaryrange=140000-145000"" rel=""nofollow"" tabindex=""-1"" target=""_self"" title=""Limit results to Melbourne VIC"">Melbourne VIC</a></span></div>]",2024-02-06,Insurance-superannuation - None,08/02/2024
238,https://www.seek.com.au//job/73281193?type=standout&ref=search-standalone,insurance superannuation,Other,Head of Procurement,GMHBA,-,140000.0,142500.0,145000.0,"Geelong, South West Coast VIC",We are seeking a seasoned professional to fill the newly created role of Head of Procurement on a fixed-term basis for 12 months.,"[<div class=""_1wkzzau0 a1msqi6m""><span class=""_1wkzzau0 a1msqi4y lnocuo0 lnocuo1 lnocuo21 _1d0g9qk4 lnocuo7""><a aria-label=""Limit results to Geelong"" class=""_1wkzzau0 _1wkzzauf _1wkzzau0 _1wkzzauf _842p0a0 _842p0a2"" data-automation=""jobLocation"" href=""/jobs-in-insurance-superannuation/in-Geelong-VIC-3220?salarytype=annual&amp;salaryrange=140000-145000"" rel=""nofollow"" tabindex=""-1"" target=""_self"" title=""Limit results to Geelong"">Geelong</a>, <a aria-label=""Limit results to South West Coast VIC"" class=""_1wkzzau0 _1wkzzauf _1wkzzau0 _1wkzzauf _842p0a0 _842p0a2"" data-automation=""jobLocation"" href=""/jobs-in-insurance-superannuation/in-South-West-Coast-VIC?salarytype=annual&amp;salaryrange=140000-145000"" rel=""nofollow"" tabindex=""-1"" target=""_self"" title=""Limit results to South West Coast VIC"">South West Coast VIC</a></span></div>]",2024-01-24,Insurance-superannuation - None,08/02/2024
239,https://www.seek.com.au//job/73009806?type=standout&ref=search-standalone,insurance superannuation,Other,Project Manager,DUAL Asia Pacific,-,140000.0,142500.0,145000.0,Melbourne VIC,We're seeking an experience Project Manager to work closely with our Chief Information Officer!,"[<div class=""_1wkzzau0 a1msqi6m""><span class=""_1wkzzau0 a1msqi4y lnocuo0 lnocuo1 lnocuo21 _1d0g9qk4 lnocuo7""><a aria-label=""Limit results to Melbourne VIC"" class=""_1wkzzau0 _1wkzzauf _1wkzzau0 _1wkzzauf _842p0a0 _842p0a2"" data-automation=""jobLocation"" href=""/jobs-in-insurance-superannuation/in-All-Melbourne-VIC?salarytype=annual&amp;salaryrange=140000-145000"" rel=""nofollow"" tabindex=""-1"" target=""_self"" title=""Limit results to Melbourne VIC"">Melbourne VIC</a></span></div>]",2024-01-15,Insurance-superannuation - None,08/02/2024
240,https://www.seek.com.au//job/72923120?type=standard&ref=search-standalone,insurance superannuation,Claims,Senior Property Claims Executive/2IC,Ensure Recruitment - Seek Award Winner - Best Small Specialist,To $130k + Super,140000.0,142500.0,145000.0,Melbourne VIC,"Join An Innovative Company, Work In A Small Team Environment, Support Team Members.  Be The Property/ISR Claims Specialist. Salary Up To $130k +","[<div class=""_1wkzzau0 a1msqi6m""><span class=""_1wkzzau0 a1msqi4y lnocuo0 lnocuo1 lnocuo21 _1d0g9qk4 lnocuo7""><a aria-label=""Limit results to Melbourne VIC"" class=""_1wkzzau0 _1wkzzauf _1wkzzau0 _1wkzzauf _842p0a0 _842p0a2"" data-automation=""jobLocation"" href=""/jobs-in-insurance-superannuation/in-All-Melbourne-VIC?salarytype=annual&amp;salaryrange=140000-145000"" rel=""nofollow"" tabindex=""-1"" target=""_self"" title=""Limit results to Melbourne VIC"">Melbourne VIC</a></span></div>, <div class=""_1wkzzau0 a1msqi6m""><div aria-label=""Salary: To $130k + Super"" class=""_1wkzzau0""><span class=""_1wkzzau0 a1msqi4y lnocuo0 lnocuo1 lnocuo21 _1d0g9qk4 lnocuo7"" data-automation=""jobSalary""><span class=""_1wkzzau0 _16v7pfz1 a1msqi4y a1msqi0 a1msqir _16v7pfz3"" style=""--_16v7pfz2:2"">To $130k + Super</span></span></div></div>]",2024-01-11,Insurance-superannuation - None,08/02/2024
241,https://www.seek.com.au//job/73013577?type=standout&ref=search-standalone,insurance superannuation,Workers' Compensation,Team Manager,Gallagher Bassett,-,140000.0,142500.0,145000.0,Melbourne VIC,Our Workers Compensation team at GB is offering an exciting opportunity to join us as a Team Manager in our Eligibility Team.,"[<div class=""_1wkzzau0 a1msqi6m""><span class=""_1wkzzau0 a1msqi4y lnocuo0 lnocuo1 lnocuo21 _1d0g9qk4 lnocuo7""><a aria-label=""Limit results to Melbourne VIC"" class=""_1wkzzau0 _1wkzzauf _1wkzzau0 _1wkzzauf _842p0a0 _842p0a2"" data-automation=""jobLocation"" href=""/jobs-in-insurance-superannuation/in-All-Melbourne-VIC?salarytype=annual&amp;salaryrange=140000-145000"" rel=""nofollow"" tabindex=""-1"" target=""_self"" title=""Limit results to Melbourne VIC"">Melbourne VIC</a></span></div>]",2024-01-15,Insurance-superannuation - None,08/02/2024
242,https://www.seek.com.au//job/73109853?type=standout&ref=search-standalone,insurance superannuation,Other,Data & Reporting Analyst,TAL,-,140000.0,142500.0,145000.0,Melbourne VIC,Contribute to our success through delivery of first-class insights,"[<div class=""_1wkzzau0 a1msqi6m""><span class=""_1wkzzau0 a1msqi4y lnocuo0 lnocuo1 lnocuo21 _1d0g9qk4 lnocuo7""><a aria-label=""Limit results to Melbourne VIC"" class=""_1wkzzau0 _1wkzzauf _1wkzzau0 _1wkzzauf _842p0a0 _842p0a2"" data-automation=""jobLocation"" href=""/jobs-in-insurance-superannuation/in-All-Melbourne-VIC?salarytype=annual&amp;salaryrange=140000-145000"" rel=""nofollow"" tabindex=""-1"" target=""_self"" title=""Limit results to Melbourne VIC"">Melbourne VIC</a></span></div>]",2024-01-18,Insurance-superannuation - None,08/02/2024
243,https://www.seek.com.au//job/72883005?type=standout&ref=search-standalone,insurance superannuation,Brokerage,Client Manager - Corporate,Honan Insurance Group,-,140000.0,142500.0,145000.0,Brisbane QLD,An excellent opportunity for an experienced Client Manager to join our Corporate Insurance & Risk Solutions team in Brisbane.,"[<div class=""_1wkzzau0 a1msqi6m""><span class=""_1wkzzau0 a1msqi4y lnocuo0 lnocuo1 lnocuo21 _1d0g9qk4 lnocuo7""><a aria-label=""Limit results to Brisbane QLD"" class=""_1wkzzau0 _1wkzzauf _1wkzzau0 _1wkzzauf _842p0a0 _842p0a2"" data-automation=""jobLocation"" href=""/jobs-in-insurance-superannuation/in-All-Brisbane-QLD?salarytype=annual&amp;salaryrange=140000-145000"" rel=""nofollow"" tabindex=""-1"" target=""_self"" title=""Limit results to Brisbane QLD"">Brisbane QLD</a></span></div>]",2024-01-10,Insurance-superannuation - None,08/02/2024
244,https://www.seek.com.au//job/73166468?type=standout&ref=search-standalone,insurance superannuation,Brokerage,"Client Executive - Energy, Power and Renewables",Aon Corporation,-,140000.0,142500.0,145000.0,Sydney NSW,Assist our clients in executing the energy transition in Australia,"[<div class=""_1wkzzau0 a1msqi6m""><span class=""_1wkzzau0 a1msqi4y lnocuo0 lnocuo1 lnocuo21 _1d0g9qk4 lnocuo7""><a aria-label=""Limit results to Sydney NSW"" class=""_1wkzzau0 _1wkzzauf _1wkzzau0 _1wkzzauf _842p0a0 _842p0a2"" data-automation=""jobLocation"" href=""/jobs-in-insurance-superannuation/in-All-Sydney-NSW?salarytype=annual&amp;salaryrange=140000-145000"" rel=""nofollow"" tabindex=""-1"" target=""_self"" title=""Limit results to Sydney NSW"">Sydney NSW</a></span></div>]",2024-01-19,Insurance-superannuation - None,08/02/2024
245,https://www.seek.com.au//job/73065002?type=standout&ref=search-standalone,insurance superannuation,Workers' Compensation,Client Manager,Aon Corporation,-,140000.0,142500.0,145000.0,Melbourne VIC,Workers’ Compensation Client Manager opportunity in Melbourne,"[<div class=""_1wkzzau0 a1msqi6m""><span class=""_1wkzzau0 a1msqi4y lnocuo0 lnocuo1 lnocuo21 _1d0g9qk4 lnocuo7""><a aria-label=""Limit results to Melbourne VIC"" class=""_1wkzzau0 _1wkzzauf _1wkzzau0 _1wkzzauf _842p0a0 _842p0a2"" data-automation=""jobLocation"" href=""/jobs-in-insurance-superannuation/in-All-Melbourne-VIC?salarytype=annual&amp;salaryrange=140000-145000"" rel=""nofollow"" tabindex=""-1"" target=""_self"" title=""Limit results to Melbourne VIC"">Melbourne VIC</a></span></div>]",2024-01-17,Insurance-superannuation - None,08/02/2024
246,https://www.seek.com.au//job/73004510?type=standout&ref=search-standalone,insurance superannuation,Underwriting,Senior Motor Fleet Underwriter,Haylo People,"Up to $150,000 + Super",140000.0,142500.0,145000.0,Sydney NSW,Join an industry specialist in motor fleet insurance and excel your development in this senior role,"[<div class=""_1wkzzau0 a1msqi6m""><span class=""_1wkzzau0 a1msqi4y lnocuo0 lnocuo1 lnocuo21 _1d0g9qk4 lnocuo7""><a aria-label=""Limit results to Sydney NSW"" class=""_1wkzzau0 _1wkzzauf _1wkzzau0 _1wkzzauf _842p0a0 _842p0a2"" data-automation=""jobLocation"" href=""/jobs-in-insurance-superannuation/in-All-Sydney-NSW?salarytype=annual&amp;salaryrange=140000-145000"" rel=""nofollow"" tabindex=""-1"" target=""_self"" title=""Limit results to Sydney NSW"">Sydney NSW</a></span></div>, <div class=""_1wkzzau0 a1msqi6m""><div aria-label=""Salary: Up to $150,000 + Super"" class=""_1wkzzau0""><span class=""_1wkzzau0 a1msqi4y lnocuo0 lnocuo1 lnocuo21 _1d0g9qk4 lnocuo7"" data-automation=""jobSalary""><span class=""_1wkzzau0 _16v7pfz1 a1msqi4y a1msqi0 a1msqir _16v7pfz3"" style=""--_16v7pfz2:2"">Up to $150,000 + Super</span></span></div></div>]",2024-01-15,Insurance-superannuation - None,08/02/2024
