,link,classification,category,title,company,salary,min_salary,average_salary,max_salary,location,description,entireDiv,date_posted,Category,Date
120,https://www.seek.com.au//job/73294457?type=standout&ref=search-standalone,marketing communications,Management,Marketing Manager,Otway Brewing Group,"$100,000 – $120,000 per year + super",100000.0,110000.0,120000.0,"Barongarook, South West Coast VIC","An exciting opportunity for an experienced Marketing Manager is to help build awareness of our brand, venues and products across key areas.","[<div class=""_1wkzzau0 a1msqi6m""><span class=""_1wkzzau0 a1msqi4y lnocuo0 lnocuo1 lnocuo21 _1d0g9qk4 lnocuo7""><a aria-label=""Limit results to Barongarook"" class=""_1wkzzau0 _1wkzzauf _1wkzzau0 _1wkzzauf _842p0a0 _842p0a2"" data-automation=""jobLocation"" href=""/jobs-in-marketing-communications/in-Barongarook-VIC-3249?salarytype=annual&amp;salaryrange=140000-145000"" rel=""nofollow"" tabindex=""-1"" target=""_self"" title=""Limit results to Barongarook"">Barongarook</a>, <a aria-label=""Limit results to South West Coast VIC"" class=""_1wkzzau0 _1wkzzauf _1wkzzau0 _1wkzzauf _842p0a0 _842p0a2"" data-automation=""jobLocation"" href=""/jobs-in-marketing-communications/in-South-West-Coast-VIC?salarytype=annual&amp;salaryrange=140000-145000"" rel=""nofollow"" tabindex=""-1"" target=""_self"" title=""Limit results to South West Coast VIC"">South West Coast VIC</a></span></div>, <div class=""_1wkzzau0 a1msqi6m""><div aria-label=""Salary: $100,000 – $120,000 per year + super"" class=""_1wkzzau0""><span class=""_1wkzzau0 a1msqi4y lnocuo0 lnocuo1 lnocuo21 _1d0g9qk4 lnocuo7"" data-automation=""jobSalary""><span class=""_1wkzzau0 _16v7pfz1 a1msqi4y a1msqi0 a1msqir _16v7pfz3"" style=""--_16v7pfz2:2"">$100,000 – $120,000 per year + super</span></span></div></div>]",2024-01-25,Marketing-communications - None,08/02/2024
121,https://www.seek.com.au//job/73550057?type=standout&ref=search-standalone,marketing communications,Direct Marketing & CRM,Lifecycle Marketing Manager,Flare,-,140000.0,142500.0,145000.0,Sydney NSW,Are you a dynamic and fast paced marketer who wants to work for a leading technology scale up? Build and own below the line marketing campaigns,"[<div class=""_1wkzzau0 a1msqi6m""><span class=""_1wkzzau0 a1msqi4y lnocuo0 lnocuo1 lnocuo21 _1d0g9qk4 lnocuo7""><a aria-label=""Limit results to Sydney NSW"" class=""_1wkzzau0 _1wkzzauf _1wkzzau0 _1wkzzauf _842p0a0 _842p0a2"" data-automation=""jobLocation"" href=""/jobs-in-marketing-communications/in-All-Sydney-NSW?salarytype=annual&amp;salaryrange=140000-145000"" rel=""nofollow"" tabindex=""-1"" target=""_self"" title=""Limit results to Sydney NSW"">Sydney NSW</a></span></div>]",2024-02-06,Marketing-communications - None,08/02/2024
122,https://www.seek.com.au//job/73552749?type=standout&ref=search-standalone,marketing communications,Management,"Convenience Category Marketing Manager (Oil, Cocoa & Chocolate)",Cargill Australia Limited,-,140000.0,142500.0,145000.0,Sydney NSW,Join Cargill Food Ingredients & Bio-Industrial where you can craft and execute channel marketing strategies!,"[<div class=""_1wkzzau0 a1msqi6m""><span class=""_1wkzzau0 a1msqi4y lnocuo0 lnocuo1 lnocuo21 _1d0g9qk4 lnocuo7""><a aria-label=""Limit results to Sydney NSW"" class=""_1wkzzau0 _1wkzzauf _1wkzzau0 _1wkzzauf _842p0a0 _842p0a2"" data-automation=""jobLocation"" href=""/jobs-in-marketing-communications/in-All-Sydney-NSW?salarytype=annual&amp;salaryrange=140000-145000"" rel=""nofollow"" tabindex=""-1"" target=""_self"" title=""Limit results to Sydney NSW"">Sydney NSW</a></span></div>]",2024-02-06,Marketing-communications - None,08/02/2024
123,https://www.seek.com.au//job/73548975?type=standout&ref=search-standalone,marketing communications,Direct Marketing & CRM,Marketing Manager,Allura Partners,-,140000.0,142500.0,145000.0,Sydney NSW,A leading ASX listed business is looking for a driven and ambitious Marketing Manager to join the team and drive a key category.,"[<div class=""_1wkzzau0 a1msqi6m""><span class=""_1wkzzau0 a1msqi4y lnocuo0 lnocuo1 lnocuo21 _1d0g9qk4 lnocuo7""><a aria-label=""Limit results to Sydney NSW"" class=""_1wkzzau0 _1wkzzauf _1wkzzau0 _1wkzzauf _842p0a0 _842p0a2"" data-automation=""jobLocation"" href=""/jobs-in-marketing-communications/in-All-Sydney-NSW?salarytype=annual&amp;salaryrange=140000-145000"" rel=""nofollow"" tabindex=""-1"" target=""_self"" title=""Limit results to Sydney NSW"">Sydney NSW</a></span></div>]",2024-02-06,Marketing-communications - None,08/02/2024
124,https://www.seek.com.au//job/73515161?type=standout&ref=search-standalone,marketing communications,Marketing Communications,Market Development Manager,Minelab Electronics,-,140000.0,142500.0,145000.0,Adelaide SA,Great opportunity to work in a supportive team environment and continue to develop your professional career.,"[<div class=""_1wkzzau0 a1msqi6m""><span class=""_1wkzzau0 a1msqi4y lnocuo0 lnocuo1 lnocuo21 _1d0g9qk4 lnocuo7""><a aria-label=""Limit results to Mawson Lakes"" class=""_1wkzzau0 _1wkzzauf _1wkzzau0 _1wkzzauf _842p0a0 _842p0a2"" data-automation=""jobLocation"" href=""/jobs-in-marketing-communications/in-Mawson-Lakes-SA-5095?salarytype=annual&amp;salaryrange=140000-145000"" rel=""nofollow"" tabindex=""-1"" target=""_self"" title=""Limit results to Mawson Lakes"">Mawson Lakes</a>, <a aria-label=""Limit results to Adelaide SA"" class=""_1wkzzau0 _1wkzzauf _1wkzzau0 _1wkzzauf _842p0a0 _842p0a2"" data-automation=""jobLocation"" href=""/jobs-in-marketing-communications/in-All-Adelaide-SA?salarytype=annual&amp;salaryrange=140000-145000"" rel=""nofollow"" tabindex=""-1"" target=""_self"" title=""Limit results to Adelaide SA"">Adelaide SA</a></span></div>]",2024-02-05,Marketing-communications - None,08/02/2024
125,https://www.seek.com.au//job/73580101?type=standout&ref=search-standalone,marketing communications,Internal Communications,"Internal Communications Manager, Healius",Healius,-,140000.0,142500.0,145000.0,Sydney NSW,Work closely with a small team on delivering best practice internal communications for a ASX Listed organisation,"[<div class=""_1wkzzau0 a1msqi6m""><span class=""_1wkzzau0 a1msqi4y lnocuo0 lnocuo1 lnocuo21 _1d0g9qk4 lnocuo7""><a aria-label=""Limit results to Sydney NSW"" class=""_1wkzzau0 _1wkzzauf _1wkzzau0 _1wkzzauf _842p0a0 _842p0a2"" data-automation=""jobLocation"" href=""/jobs-in-marketing-communications/in-All-Sydney-NSW?salarytype=annual&amp;salaryrange=140000-145000"" rel=""nofollow"" tabindex=""-1"" target=""_self"" title=""Limit results to Sydney NSW"">Sydney NSW</a></span></div>]",2024-02-07,Marketing-communications - None,08/02/2024
126,https://www.seek.com.au//job/73521262?type=standout&ref=search-standalone,marketing communications,Marketing Assistants/Coordinators,Community and Communications Coordinator,John Holland,-,140000.0,142500.0,145000.0,Sydney NSW,We are currently looking for a Community and Communications Coordinator to join the John Holland team working on our Southwest Metro Corridor project.,"[<div class=""_1wkzzau0 a1msqi6m""><span class=""_1wkzzau0 a1msqi4y lnocuo0 lnocuo1 lnocuo21 _1d0g9qk4 lnocuo7""><a aria-label=""Limit results to Sydney NSW"" class=""_1wkzzau0 _1wkzzauf _1wkzzau0 _1wkzzauf _842p0a0 _842p0a2"" data-automation=""jobLocation"" href=""/jobs-in-marketing-communications/in-All-Sydney-NSW?salarytype=annual&amp;salaryrange=140000-145000"" rel=""nofollow"" tabindex=""-1"" target=""_self"" title=""Limit results to Sydney NSW"">Sydney NSW</a></span></div>]",2024-02-05,Marketing-communications - None,08/02/2024
127,https://www.seek.com.au//job/73347425?type=standout&ref=search-standalone,marketing communications,Management,Marketing Manager,RedSands Campers,-,140000.0,142500.0,145000.0,Perth WA,"As our star Marketing Manager, you will be responsible for driving the demand for the worlds leading recreational off-road, self-drive brand.","[<div class=""_1wkzzau0 a1msqi6m""><span class=""_1wkzzau0 a1msqi4y lnocuo0 lnocuo1 lnocuo21 _1d0g9qk4 lnocuo7""><a aria-label=""Limit results to Balcatta"" class=""_1wkzzau0 _1wkzzauf _1wkzzau0 _1wkzzauf _842p0a0 _842p0a2"" data-automation=""jobLocation"" href=""/jobs-in-marketing-communications/in-Balcatta-WA-6021?salarytype=annual&amp;salaryrange=140000-145000"" rel=""nofollow"" tabindex=""-1"" target=""_self"" title=""Limit results to Balcatta"">Balcatta</a>, <a aria-label=""Limit results to Perth WA"" class=""_1wkzzau0 _1wkzzauf _1wkzzau0 _1wkzzauf _842p0a0 _842p0a2"" data-automation=""jobLocation"" href=""/jobs-in-marketing-communications/in-All-Perth-WA?salarytype=annual&amp;salaryrange=140000-145000"" rel=""nofollow"" tabindex=""-1"" target=""_self"" title=""Limit results to Perth WA"">Perth WA</a></span></div>]",2024-01-28,Marketing-communications - None,08/02/2024
128,https://www.seek.com.au//job/73468385?type=standard&ref=search-standalone,marketing communications,Marketing Communications,Communications Manager,Impact Advising,-,140000.0,142500.0,145000.0,Sydney NSW,Join Macular Disease Foundation Australia as their Communications Officer and lead on all marketing and communications activity.,"[<div class=""_1wkzzau0 a1msqi6m""><span class=""_1wkzzau0 a1msqi4y lnocuo0 lnocuo1 lnocuo21 _1d0g9qk4 lnocuo7""><a aria-label=""Limit results to Sydney NSW"" class=""_1wkzzau0 _1wkzzauf _1wkzzau0 _1wkzzauf _842p0a0 _842p0a2"" data-automation=""jobLocation"" href=""/jobs-in-marketing-communications/in-All-Sydney-NSW?salarytype=annual&amp;salaryrange=140000-145000"" rel=""nofollow"" tabindex=""-1"" target=""_self"" title=""Limit results to Sydney NSW"">Sydney NSW</a></span></div>]",2024-02-02,Marketing-communications - None,08/02/2024
129,https://www.seek.com.au//job/73575450?type=standout&ref=search-standalone,marketing communications,Marketing Communications,Internal Communications & Events Manager,NRI Australia & New Zealand,-,140000.0,142500.0,145000.0,Sydney NSW,"In this 12-month fixed-term contract, you will lead NRI's Internal Communications and Events .","[<div class=""_1wkzzau0 a1msqi6m""><span class=""_1wkzzau0 a1msqi4y lnocuo0 lnocuo1 lnocuo21 _1d0g9qk4 lnocuo7""><a aria-label=""Limit results to Sydney NSW"" class=""_1wkzzau0 _1wkzzauf _1wkzzau0 _1wkzzauf _842p0a0 _842p0a2"" data-automation=""jobLocation"" href=""/jobs-in-marketing-communications/in-All-Sydney-NSW?salarytype=annual&amp;salaryrange=140000-145000"" rel=""nofollow"" tabindex=""-1"" target=""_self"" title=""Limit results to Sydney NSW"">Sydney NSW</a></span></div>]",2024-02-07,Marketing-communications - None,08/02/2024
130,https://www.seek.com.au//job/73553613?type=standard&ref=search-standalone,marketing communications,Marketing Communications,Communications Officer,Ashdown People,$58 - $66 p/h + super,104400.0,111600.0,118800.0,Sydney NSW,New opportunity for an experienced Communications Officer to make a big community impact in a large NSW Government Agency,"[<div class=""_1wkzzau0 a1msqi6m""><span class=""_1wkzzau0 a1msqi4y lnocuo0 lnocuo1 lnocuo21 _1d0g9qk4 lnocuo7""><a aria-label=""Limit results to Sydney NSW"" class=""_1wkzzau0 _1wkzzauf _1wkzzau0 _1wkzzauf _842p0a0 _842p0a2"" data-automation=""jobLocation"" href=""/jobs-in-marketing-communications/in-All-Sydney-NSW?salarytype=annual&amp;salaryrange=140000-145000"" rel=""nofollow"" tabindex=""-1"" target=""_self"" title=""Limit results to Sydney NSW"">Sydney NSW</a></span></div>, <div class=""_1wkzzau0 a1msqi6m""><div aria-label=""Salary: $58 - $66 p/h + super"" class=""_1wkzzau0""><span class=""_1wkzzau0 a1msqi4y lnocuo0 lnocuo1 lnocuo21 _1d0g9qk4 lnocuo7"" data-automation=""jobSalary""><span class=""_1wkzzau0 _16v7pfz1 a1msqi4y a1msqi0 a1msqir _16v7pfz3"" style=""--_16v7pfz2:2"">$58 - $66 p/h + super</span></span></div></div>]",2024-02-06,Marketing-communications - None,08/02/2024
131,https://www.seek.com.au//job/73569285?type=standout&ref=search-standalone,marketing communications,Brand Management,Brand Manager,Sydney Tools,"$110,000 – $130,000 per year",110000.0,120000.0,130000.0,Sydney NSW,We are currently seeking an experience Brand Manager to join our Head Office based in Roselands 2196,"[<div class=""_1wkzzau0 a1msqi6m""><span class=""_1wkzzau0 a1msqi4y lnocuo0 lnocuo1 lnocuo21 _1d0g9qk4 lnocuo7""><a aria-label=""Limit results to Roselands"" class=""_1wkzzau0 _1wkzzauf _1wkzzau0 _1wkzzauf _842p0a0 _842p0a2"" data-automation=""jobLocation"" href=""/jobs-in-marketing-communications/in-Roselands-NSW-2196?salarytype=annual&amp;salaryrange=140000-145000"" rel=""nofollow"" tabindex=""-1"" target=""_self"" title=""Limit results to Roselands"">Roselands</a>, <a aria-label=""Limit results to Sydney NSW"" class=""_1wkzzau0 _1wkzzauf _1wkzzau0 _1wkzzauf _842p0a0 _842p0a2"" data-automation=""jobLocation"" href=""/jobs-in-marketing-communications/in-All-Sydney-NSW?salarytype=annual&amp;salaryrange=140000-145000"" rel=""nofollow"" tabindex=""-1"" target=""_self"" title=""Limit results to Sydney NSW"">Sydney NSW</a></span></div>, <div class=""_1wkzzau0 a1msqi6m""><div aria-label=""Salary: $110,000 – $130,000 per year"" class=""_1wkzzau0""><span class=""_1wkzzau0 a1msqi4y lnocuo0 lnocuo1 lnocuo21 _1d0g9qk4 lnocuo7"" data-automation=""jobSalary""><span class=""_1wkzzau0 _16v7pfz1 a1msqi4y a1msqi0 a1msqir _16v7pfz3"" style=""--_16v7pfz2:2"">$110,000 – $130,000 per year</span></span></div></div>]",2024-02-07,Marketing-communications - None,08/02/2024
132,https://www.seek.com.au//job/73499008?type=standout&ref=search-standalone,marketing communications,Management,Marketing Manager,Saunders Lynn & Co Pty Ltd,"$130,000 + Car Allowance + Super",130000.0,137500.0,145000.0,Sydney NSW,Career development for for a well rounded product manager ready for the next step,"[<div class=""_1wkzzau0 a1msqi6m""><span class=""_1wkzzau0 a1msqi4y lnocuo0 lnocuo1 lnocuo21 _1d0g9qk4 lnocuo7""><a aria-label=""Limit results to South West &amp; M5 Corridor"" class=""_1wkzzau0 _1wkzzauf _1wkzzau0 _1wkzzauf _842p0a0 _842p0a2"" data-automation=""jobLocation"" href=""/jobs-in-marketing-communications/in-South-West-&amp;-M5-Corridor-Sydney-NSW?salarytype=annual&amp;salaryrange=140000-145000"" rel=""nofollow"" tabindex=""-1"" target=""_self"" title=""Limit results to South West &amp; M5 Corridor"">South West &amp; M5 Corridor</a>, <a aria-label=""Limit results to Sydney NSW"" class=""_1wkzzau0 _1wkzzauf _1wkzzau0 _1wkzzauf _842p0a0 _842p0a2"" data-automation=""jobLocation"" href=""/jobs-in-marketing-communications/in-All-Sydney-NSW?salarytype=annual&amp;salaryrange=140000-145000"" rel=""nofollow"" tabindex=""-1"" target=""_self"" title=""Limit results to Sydney NSW"">Sydney NSW</a></span></div>, <div class=""_1wkzzau0 a1msqi6m""><div aria-label=""Salary: $130,000 + Car Allowance + Super"" class=""_1wkzzau0""><span class=""_1wkzzau0 a1msqi4y lnocuo0 lnocuo1 lnocuo21 _1d0g9qk4 lnocuo7"" data-automation=""jobSalary""><span class=""_1wkzzau0 _16v7pfz1 a1msqi4y a1msqi0 a1msqir _16v7pfz3"" style=""--_16v7pfz2:2"">$130,000 + Car Allowance + Super</span></span></div></div>]",2024-02-03,Marketing-communications - None,08/02/2024
133,https://www.seek.com.au//job/73364206?type=standard&ref=search-standalone,marketing communications,Marketing Communications,Media and Communications Coordinator,ChemCentre,"PSCAA Agreement 2022, Level 6 $110,309 to $121,569",140000.0,142500.0,145000.0,Perth WA,Seeking an experienced candidate to develop and deliver a wide range of communications and media materials for internal and external stakeholders.,"[<div class=""_1wkzzau0 a1msqi6m""><span class=""_1wkzzau0 a1msqi4y lnocuo0 lnocuo1 lnocuo21 _1d0g9qk4 lnocuo7""><a aria-label=""Limit results to Bentley"" class=""_1wkzzau0 _1wkzzauf _1wkzzau0 _1wkzzauf _842p0a0 _842p0a2"" data-automation=""jobLocation"" href=""/jobs-in-marketing-communications/in-Bentley-WA-6102?salarytype=annual&amp;salaryrange=140000-145000"" rel=""nofollow"" tabindex=""-1"" target=""_self"" title=""Limit results to Bentley"">Bentley</a>, <a aria-label=""Limit results to Perth WA"" class=""_1wkzzau0 _1wkzzauf _1wkzzau0 _1wkzzauf _842p0a0 _842p0a2"" data-automation=""jobLocation"" href=""/jobs-in-marketing-communications/in-All-Perth-WA?salarytype=annual&amp;salaryrange=140000-145000"" rel=""nofollow"" tabindex=""-1"" target=""_self"" title=""Limit results to Perth WA"">Perth WA</a></span></div>, <div class=""_1wkzzau0 a1msqi6m""><div aria-label=""Salary: PSCAA Agreement 2022, Level 6 $110,309 to $121,569"" class=""_1wkzzau0""><span class=""_1wkzzau0 a1msqi4y lnocuo0 lnocuo1 lnocuo21 _1d0g9qk4 lnocuo7"" data-automation=""jobSalary""><span class=""_1wkzzau0 _16v7pfz1 a1msqi4y a1msqi0 a1msqir _16v7pfz3"" style=""--_16v7pfz2:2"">PSCAA Agreement 2022, Level 6 $110,309 to $121,569</span></span></div></div>]",2024-01-29,Marketing-communications - None,08/02/2024
134,https://www.seek.com.au//job/73408509?type=standout&ref=search-standalone,marketing communications,Marketing Communications,Regional Communications Manager,Department of Defence,"$111,441 - $125,705 (EL 1) + Super",111441.0,118573.0,125705.0,Canberra ACT,Defence is seeking a motivated individual who has experience working with the media and developing influential communications content.,"[<div class=""_1wkzzau0 a1msqi6m""><span class=""_1wkzzau0 a1msqi4y lnocuo0 lnocuo1 lnocuo21 _1d0g9qk4 lnocuo7""><a aria-label=""Limit results to Russell"" class=""_1wkzzau0 _1wkzzauf _1wkzzau0 _1wkzzauf _842p0a0 _842p0a2"" data-automation=""jobLocation"" href=""/jobs-in-marketing-communications/in-Russell-ACT-2600?salarytype=annual&amp;salaryrange=140000-145000"" rel=""nofollow"" tabindex=""-1"" target=""_self"" title=""Limit results to Russell"">Russell</a>, <a aria-label=""Limit results to Canberra ACT"" class=""_1wkzzau0 _1wkzzauf _1wkzzau0 _1wkzzauf _842p0a0 _842p0a2"" data-automation=""jobLocation"" href=""/jobs-in-marketing-communications/in-All-Canberra-ACT?salarytype=annual&amp;salaryrange=140000-145000"" rel=""nofollow"" tabindex=""-1"" target=""_self"" title=""Limit results to Canberra ACT"">Canberra ACT</a></span></div>, <div class=""_1wkzzau0 a1msqi6m""><div aria-label=""Salary: $111,441 - $125,705 (EL 1) + Super"" class=""_1wkzzau0""><span class=""_1wkzzau0 a1msqi4y lnocuo0 lnocuo1 lnocuo21 _1d0g9qk4 lnocuo7"" data-automation=""jobSalary""><span class=""_1wkzzau0 _16v7pfz1 a1msqi4y a1msqi0 a1msqir _16v7pfz3"" style=""--_16v7pfz2:2"">$111,441 - $125,705 (EL 1) + Super</span></span></div></div>]",2024-01-31,Marketing-communications - None,08/02/2024
135,https://www.seek.com.au//job/73470619?type=standard&ref=search-standalone,marketing communications,Digital & Search Marketing,Digital Marketing Manager,WOW Recruitment,AUD 110000 - 120000 per annum,140000.0,142500.0,145000.0,Sydney NSW,"Digital Marketing Manager  Sydney / Hybrid   $110-120,000 + Super       WOW Recruitment are seeking a creative, Digital Marketing Manager to","[<div class=""_1wkzzau0 a1msqi6m""><span class=""_1wkzzau0 a1msqi4y lnocuo0 lnocuo1 lnocuo21 _1d0g9qk4 lnocuo7""><a aria-label=""Limit results to Sydney NSW"" class=""_1wkzzau0 _1wkzzauf _1wkzzau0 _1wkzzauf _842p0a0 _842p0a2"" data-automation=""jobLocation"" href=""/jobs-in-marketing-communications/in-All-Sydney-NSW?salarytype=annual&amp;salaryrange=140000-145000"" rel=""nofollow"" tabindex=""-1"" target=""_self"" title=""Limit results to Sydney NSW"">Sydney NSW</a></span></div>, <div class=""_1wkzzau0 a1msqi6m""><div aria-label=""Salary: AUD 110000 - 120000 per annum"" class=""_1wkzzau0""><span class=""_1wkzzau0 a1msqi4y lnocuo0 lnocuo1 lnocuo21 _1d0g9qk4 lnocuo7"" data-automation=""jobSalary""><span class=""_1wkzzau0 _16v7pfz1 a1msqi4y a1msqi0 a1msqir _16v7pfz3"" style=""--_16v7pfz2:2"">AUD 110000 - 120000 per annum</span></span></div></div>]",2024-02-02,Marketing-communications - None,08/02/2024
136,https://www.seek.com.au//job/73417292?type=standard&ref=search-standalone,marketing communications,Management,Communications Manager,HealthWISE,-,140000.0,142500.0,145000.0,Other,"Design, implement, and monitor the communication strategy and take responsibility for delivering high quality, internal and external communications.","[<div class=""_1wkzzau0 a1msqi6m""><span class=""_1wkzzau0 a1msqi4y lnocuo0 lnocuo1 lnocuo21 _1d0g9qk4 lnocuo7""><a aria-label=""Limit results to Tamworth"" class=""_1wkzzau0 _1wkzzauf _1wkzzau0 _1wkzzauf _842p0a0 _842p0a2"" data-automation=""jobLocation"" href=""/jobs-in-marketing-communications/in-Tamworth-NSW-2340?salarytype=annual&amp;salaryrange=140000-145000"" rel=""nofollow"" tabindex=""-1"" target=""_self"" title=""Limit results to Tamworth"">Tamworth</a>, <a aria-label=""Limit results to Tamworth &amp; North West NSW"" class=""_1wkzzau0 _1wkzzauf _1wkzzau0 _1wkzzauf _842p0a0 _842p0a2"" data-automation=""jobLocation"" href=""/jobs-in-marketing-communications/in-Tamworth-&amp;-North-West-NSW?salarytype=annual&amp;salaryrange=140000-145000"" rel=""nofollow"" tabindex=""-1"" target=""_self"" title=""Limit results to Tamworth &amp; North West NSW"">Tamworth &amp; North West NSW</a></span></div>]",2024-01-31,Marketing-communications - None,08/02/2024
137,https://www.seek.com.au//job/73470342?type=standout&ref=search-standalone,marketing communications,Brand Management,Brand Manager Sydney - Fixed Term Position.,Air New Zealand,-,140000.0,142500.0,145000.0,Sydney NSW,"We have an exciting opportunity to join our Market Development team as Brand Manager, based in our Sydney office in this Fixed Term Position.","[<div class=""_1wkzzau0 a1msqi6m""><span class=""_1wkzzau0 a1msqi4y lnocuo0 lnocuo1 lnocuo21 _1d0g9qk4 lnocuo7""><a aria-label=""Limit results to Sydney NSW"" class=""_1wkzzau0 _1wkzzauf _1wkzzau0 _1wkzzauf _842p0a0 _842p0a2"" data-automation=""jobLocation"" href=""/jobs-in-marketing-communications/in-All-Sydney-NSW?salarytype=annual&amp;salaryrange=140000-145000"" rel=""nofollow"" tabindex=""-1"" target=""_self"" title=""Limit results to Sydney NSW"">Sydney NSW</a></span></div>]",2024-02-02,Marketing-communications - None,08/02/2024
138,https://www.seek.com.au//job/73378125?type=standout&ref=search-standalone,marketing communications,Public Relations & Corporate Affairs,Community Relations Advisor (Uungula Wind Farm),Squadron Energy,-,140000.0,142500.0,145000.0,Other,An exciting opportunity exists for an experienced Community Relations Advisor to make an impact on Australia’s sustainability.,"[<div class=""_1wkzzau0 a1msqi6m""><span class=""_1wkzzau0 a1msqi4y lnocuo0 lnocuo1 lnocuo21 _1d0g9qk4 lnocuo7""><a aria-label=""Limit results to Dubbo"" class=""_1wkzzau0 _1wkzzauf _1wkzzau0 _1wkzzauf _842p0a0 _842p0a2"" data-automation=""jobLocation"" href=""/jobs-in-marketing-communications/in-Dubbo-NSW-2830?salarytype=annual&amp;salaryrange=140000-145000"" rel=""nofollow"" tabindex=""-1"" target=""_self"" title=""Limit results to Dubbo"">Dubbo</a>, <a aria-label=""Limit results to Dubbo &amp; Central NSW"" class=""_1wkzzau0 _1wkzzauf _1wkzzau0 _1wkzzauf _842p0a0 _842p0a2"" data-automation=""jobLocation"" href=""/jobs-in-marketing-communications/in-Dubbo-&amp;-Central-NSW?salarytype=annual&amp;salaryrange=140000-145000"" rel=""nofollow"" tabindex=""-1"" target=""_self"" title=""Limit results to Dubbo &amp; Central NSW"">Dubbo &amp; Central NSW</a></span></div>]",2024-01-30,Marketing-communications - None,08/02/2024
139,https://www.seek.com.au//job/73575612?type=standout&ref=search-standalone,marketing communications,Digital & Search Marketing,Digital Channels Specialist,"Department of Climate Change, Energy, the Environment & Water",-,140000.0,142500.0,145000.0,Sydney NSW,Will you accept the challenge in helping NSW reach net zero emissions by 2050?,"[<div class=""_1wkzzau0 a1msqi6m""><span class=""_1wkzzau0 a1msqi4y lnocuo0 lnocuo1 lnocuo21 _1d0g9qk4 lnocuo7""><a aria-label=""Limit results to Parramatta"" class=""_1wkzzau0 _1wkzzauf _1wkzzau0 _1wkzzauf _842p0a0 _842p0a2"" data-automation=""jobLocation"" href=""/jobs-in-marketing-communications/in-Parramatta-NSW-2150?salarytype=annual&amp;salaryrange=140000-145000"" rel=""nofollow"" tabindex=""-1"" target=""_self"" title=""Limit results to Parramatta"">Parramatta</a>, <a aria-label=""Limit results to Sydney NSW"" class=""_1wkzzau0 _1wkzzauf _1wkzzau0 _1wkzzauf _842p0a0 _842p0a2"" data-automation=""jobLocation"" href=""/jobs-in-marketing-communications/in-All-Sydney-NSW?salarytype=annual&amp;salaryrange=140000-145000"" rel=""nofollow"" tabindex=""-1"" target=""_self"" title=""Limit results to Sydney NSW"">Sydney NSW</a></span></div>]",2024-02-07,Marketing-communications - None,08/02/2024
140,https://www.seek.com.au//job/73554107?type=standout&ref=search-standalone,marketing communications,Marketing Communications,"National Campaign Planner, Cancer Programs",Meritos,-,140000.0,142500.0,145000.0,Sydney NSW,Help shape inclusive campaigns with industry leaders and contribute to a dynamic team committed to health equity and creative excellence.,"[<div class=""_1wkzzau0 a1msqi6m""><span class=""_1wkzzau0 a1msqi4y lnocuo0 lnocuo1 lnocuo21 _1d0g9qk4 lnocuo7""><a aria-label=""Limit results to Sydney NSW"" class=""_1wkzzau0 _1wkzzauf _1wkzzau0 _1wkzzauf _842p0a0 _842p0a2"" data-automation=""jobLocation"" href=""/jobs-in-marketing-communications/in-All-Sydney-NSW?salarytype=annual&amp;salaryrange=140000-145000"" rel=""nofollow"" tabindex=""-1"" target=""_self"" title=""Limit results to Sydney NSW"">Sydney NSW</a></span></div>]",2024-02-06,Marketing-communications - None,08/02/2024
