,link,classification,category,title,company,salary,min_salary,average_salary,max_salary,location,description,entireDiv,date_posted,Category,Date
22,https://www.seek.com.au//job/72877721?type=promoted&ref=search-standalone,design architecture,Landscape Architecture,Senior Landscape Architect,Spiire,Base + Salary + Profit Share,190000.0,192500.0,195000.0,Canberra ACT,Great opportunity for a senior professional to take on management of diverse and complex projects in a multidisciplinary consultancy,"[<div class=""_1wkzzau0 a1msqi6m""><span class=""_1wkzzau0 a1msqi4y lnocuo0 lnocuo1 lnocuo21 _1d0g9qk4 lnocuo7""><a aria-label=""Limit results to Canberra ACT"" class=""_1wkzzau0 _1wkzzauf _1wkzzau0 _1wkzzauf _842p0a0 _842p0a2"" data-automation=""jobLocation"" href=""/jobs-in-design-architecture/in-All-Canberra-ACT?salarytype=annual&amp;salaryrange=190000-195000"" rel=""nofollow"" tabindex=""-1"" target=""_self"" title=""Limit results to Canberra ACT"">Canberra ACT</a></span></div>, <div class=""_1wkzzau0 a1msqi6m""><div aria-label=""Salary: Base + Salary + Profit Share"" class=""_1wkzzau0""><span class=""_1wkzzau0 a1msqi4y lnocuo0 lnocuo1 lnocuo21 _1d0g9qk4 lnocuo7"" data-automation=""jobSalary""><span class=""_1wkzzau0 _16v7pfz1 a1msqi4y a1msqi0 a1msqir _16v7pfz3"" style=""--_16v7pfz2:2"">Base + Salary + Profit Share</span></span></div></div>]",,Design-architecture - None,08/02/2024
23,https://www.seek.com.au//job/73541661?type=standout&ref=search-standalone,design architecture,Landscape Architecture,Landscape Architect,Chandler Macleod,AUD 80 - 120 per hour,190000.0,192500.0,195000.0,Sydney NSW,"Landscape Architect opportunity for Local Council in Oran Park. $80-$120ph + super, 12 month contract, hybrid working.","[<div class=""_1wkzzau0 a1msqi6m""><span class=""_1wkzzau0 a1msqi4y lnocuo0 lnocuo1 lnocuo21 _1d0g9qk4 lnocuo7""><a aria-label=""Limit results to Camden"" class=""_1wkzzau0 _1wkzzauf _1wkzzau0 _1wkzzauf _842p0a0 _842p0a2"" data-automation=""jobLocation"" href=""/jobs-in-design-architecture/in-Camden-NSW-2570?salarytype=annual&amp;salaryrange=190000-195000"" rel=""nofollow"" tabindex=""-1"" target=""_self"" title=""Limit results to Camden"">Camden</a>, <a aria-label=""Limit results to Sydney NSW"" class=""_1wkzzau0 _1wkzzauf _1wkzzau0 _1wkzzauf _842p0a0 _842p0a2"" data-automation=""jobLocation"" href=""/jobs-in-design-architecture/in-All-Sydney-NSW?salarytype=annual&amp;salaryrange=190000-195000"" rel=""nofollow"" tabindex=""-1"" target=""_self"" title=""Limit results to Sydney NSW"">Sydney NSW</a></span></div>, <div class=""_1wkzzau0 a1msqi6m""><div aria-label=""Salary: AUD 80 - 120 per hour"" class=""_1wkzzau0""><span class=""_1wkzzau0 a1msqi4y lnocuo0 lnocuo1 lnocuo21 _1d0g9qk4 lnocuo7"" data-automation=""jobSalary""><span class=""_1wkzzau0 _16v7pfz1 a1msqi4y a1msqi0 a1msqir _16v7pfz3"" style=""--_16v7pfz2:2"">AUD 80 - 120 per hour</span></span></div></div>]",2024-02-06,Design-architecture - None,08/02/2024
24,https://www.seek.com.au//job/73044388?type=standout&ref=search-standalone,design architecture,Architecture,Design Manager,Levande,-,190000.0,192500.0,195000.0,Sydney NSW,Join us as a Design Manager and ensure the delivery of design excellence standards across our portfolio of retirement living projects,"[<div class=""_1wkzzau0 a1msqi6m""><span class=""_1wkzzau0 a1msqi4y lnocuo0 lnocuo1 lnocuo21 _1d0g9qk4 lnocuo7""><a aria-label=""Limit results to Sydney NSW"" class=""_1wkzzau0 _1wkzzauf _1wkzzau0 _1wkzzauf _842p0a0 _842p0a2"" data-automation=""jobLocation"" href=""/jobs-in-design-architecture/in-All-Sydney-NSW?salarytype=annual&amp;salaryrange=190000-195000"" rel=""nofollow"" tabindex=""-1"" target=""_self"" title=""Limit results to Sydney NSW"">Sydney NSW</a></span></div>]",2024-01-16,Design-architecture - None,08/02/2024
25,https://www.seek.com.au//job/73303283?type=standout&ref=search-standalone,design architecture,Architecture,Work Winning Principal - Architecture,Redpath Partners Pty Ltd,160-190K,190000.0,192500.0,195000.0,Melbourne VIC,Impact the growth of an existing Melbourne studio with established success and reputation Nationally and Internationally.,"[<div class=""_1wkzzau0 a1msqi6m""><span class=""_1wkzzau0 a1msqi4y lnocuo0 lnocuo1 lnocuo21 _1d0g9qk4 lnocuo7""><a aria-label=""Limit results to Melbourne VIC"" class=""_1wkzzau0 _1wkzzauf _1wkzzau0 _1wkzzauf _842p0a0 _842p0a2"" data-automation=""jobLocation"" href=""/jobs-in-design-architecture/in-All-Melbourne-VIC?salarytype=annual&amp;salaryrange=190000-195000"" rel=""nofollow"" tabindex=""-1"" target=""_self"" title=""Limit results to Melbourne VIC"">Melbourne VIC</a></span></div>, <div class=""_1wkzzau0 a1msqi6m""><div aria-label=""Salary: 160-190K"" class=""_1wkzzau0""><span class=""_1wkzzau0 a1msqi4y lnocuo0 lnocuo1 lnocuo21 _1d0g9qk4 lnocuo7"" data-automation=""jobSalary""><span class=""_1wkzzau0 _16v7pfz1 a1msqi4y a1msqi0 a1msqir _16v7pfz3"" style=""--_16v7pfz2:2"">160-190K</span></span></div></div>]",2024-01-25,Design-architecture - None,08/02/2024
26,https://www.seek.com.au//job/73486897?type=standard&ref=search-standalone,design architecture,Fashion & Textile Design,Head of Design - Streetwear Fashion Label,Hyphlex Streetwear,"$135,000 – $180,000 per year",135000.0,157500.0,180000.0,Sydney NSW,"Design role, Allowing full creative freedom within the company DNA.","[<div class=""_1wkzzau0 a1msqi6m""><span class=""_1wkzzau0 a1msqi4y lnocuo0 lnocuo1 lnocuo21 _1d0g9qk4 lnocuo7""><a aria-label=""Limit results to Sydney NSW"" class=""_1wkzzau0 _1wkzzauf _1wkzzau0 _1wkzzauf _842p0a0 _842p0a2"" data-automation=""jobLocation"" href=""/jobs-in-design-architecture/in-All-Sydney-NSW?salarytype=annual&amp;salaryrange=190000-195000"" rel=""nofollow"" tabindex=""-1"" target=""_self"" title=""Limit results to Sydney NSW"">Sydney NSW</a></span></div>, <div class=""_1wkzzau0 a1msqi6m""><div aria-label=""Salary: $135,000 – $180,000 per year"" class=""_1wkzzau0""><span class=""_1wkzzau0 a1msqi4y lnocuo0 lnocuo1 lnocuo21 _1d0g9qk4 lnocuo7"" data-automation=""jobSalary""><span class=""_1wkzzau0 _16v7pfz1 a1msqi4y a1msqi0 a1msqir _16v7pfz3"" style=""--_16v7pfz2:2"">$135,000 – $180,000 per year</span></span></div></div>]",2024-02-02,Design-architecture - None,08/02/2024
27,https://www.seek.com.au//job/73443519?type=standout&ref=search-standalone,design architecture,Architecture,Senior Design Architect - Residential,CTC,Annual Salary $100k-150k + Super depending on expe,190000.0,192500.0,195000.0,Adelaide SA,Utilise your passion for design and residential experience and join the organisation behind some of Adelaide's most iconic homes,"[<div class=""_1wkzzau0 a1msqi6m""><span class=""_1wkzzau0 a1msqi4y lnocuo0 lnocuo1 lnocuo21 _1d0g9qk4 lnocuo7""><a aria-label=""Limit results to Adelaide SA"" class=""_1wkzzau0 _1wkzzauf _1wkzzau0 _1wkzzauf _842p0a0 _842p0a2"" data-automation=""jobLocation"" href=""/jobs-in-design-architecture/in-All-Adelaide-SA?salarytype=annual&amp;salaryrange=190000-195000"" rel=""nofollow"" tabindex=""-1"" target=""_self"" title=""Limit results to Adelaide SA"">Adelaide SA</a></span></div>, <div class=""_1wkzzau0 a1msqi6m""><div aria-label=""Salary: Annual Salary $100k-150k + Super depending on expe"" class=""_1wkzzau0""><span class=""_1wkzzau0 a1msqi4y lnocuo0 lnocuo1 lnocuo21 _1d0g9qk4 lnocuo7"" data-automation=""jobSalary""><span class=""_1wkzzau0 _16v7pfz1 a1msqi4y a1msqi0 a1msqir _16v7pfz3"" style=""--_16v7pfz2:2"">Annual Salary $100k-150k + Super depending on expe</span></span></div></div>]",2024-02-01,Design-architecture - None,08/02/2024
28,https://www.seek.com.au//job/73362984?type=standout&ref=search-standalone,design architecture,Architecture,Principal Architect,ROUSSOS Recruitment,-,190000.0,192500.0,195000.0,Adelaide SA,Looking for an experienced architect with a proven record taking projects from concept design to detailed documentation & a collaborative spirit,"[<div class=""_1wkzzau0 a1msqi6m""><span class=""_1wkzzau0 a1msqi4y lnocuo0 lnocuo1 lnocuo21 _1d0g9qk4 lnocuo7""><a aria-label=""Limit results to Adelaide SA"" class=""_1wkzzau0 _1wkzzauf _1wkzzau0 _1wkzzauf _842p0a0 _842p0a2"" data-automation=""jobLocation"" href=""/jobs-in-design-architecture/in-All-Adelaide-SA?salarytype=annual&amp;salaryrange=190000-195000"" rel=""nofollow"" tabindex=""-1"" target=""_self"" title=""Limit results to Adelaide SA"">Adelaide SA</a></span></div>]",2024-01-29,Design-architecture - None,08/02/2024
29,https://www.seek.com.au//job/73020970?type=standout&ref=search-standalone,design architecture,Architecture,Design Manager Architecture,Meriton Property Services Pty Ltd,-,190000.0,192500.0,195000.0,Sydney NSW,Opportunity to work on some of the most significant and exciting large-scale projects across Australia,"[<div class=""_1wkzzau0 a1msqi6m""><span class=""_1wkzzau0 a1msqi4y lnocuo0 lnocuo1 lnocuo21 _1d0g9qk4 lnocuo7""><a aria-label=""Limit results to Sydney NSW"" class=""_1wkzzau0 _1wkzzauf _1wkzzau0 _1wkzzauf _842p0a0 _842p0a2"" data-automation=""jobLocation"" href=""/jobs-in-design-architecture/in-All-Sydney-NSW?salarytype=annual&amp;salaryrange=190000-195000"" rel=""nofollow"" tabindex=""-1"" target=""_self"" title=""Limit results to Sydney NSW"">Sydney NSW</a></span></div>]",2024-01-15,Design-architecture - None,08/02/2024
30,https://www.seek.com.au//job/73442247?type=standout&ref=search-standalone,design architecture,Urban Design & Planning,Manager Development Services,LG Services Group,"$180,000 – $210,000 per year",180000.0,195000.0,210000.0,Sydney NSW,Lead Transformative Development Initiatives in the Scenic Shoalhaven Region,"[<div class=""_1wkzzau0 a1msqi6m""><span class=""_1wkzzau0 a1msqi4y lnocuo0 lnocuo1 lnocuo21 _1d0g9qk4 lnocuo7""><a aria-label=""Limit results to Sydney NSW"" class=""_1wkzzau0 _1wkzzauf _1wkzzau0 _1wkzzauf _842p0a0 _842p0a2"" data-automation=""jobLocation"" href=""/jobs-in-design-architecture/in-All-Sydney-NSW?salarytype=annual&amp;salaryrange=190000-195000"" rel=""nofollow"" tabindex=""-1"" target=""_self"" title=""Limit results to Sydney NSW"">Sydney NSW</a></span></div>, <div class=""_1wkzzau0 a1msqi6m""><div aria-label=""Salary: $180,000 – $210,000 per year"" class=""_1wkzzau0""><span class=""_1wkzzau0 a1msqi4y lnocuo0 lnocuo1 lnocuo21 _1d0g9qk4 lnocuo7"" data-automation=""jobSalary""><span class=""_1wkzzau0 _16v7pfz1 a1msqi4y a1msqi0 a1msqir _16v7pfz3"" style=""--_16v7pfz2:2"">$180,000 – $210,000 per year</span></span></div></div>]",2024-02-01,Design-architecture - None,08/02/2024
31,https://www.seek.com.au//job/73623636?type=standard&ref=search-standalone,design architecture,Urban Design & Planning,Principal Strategic Planner,City of Moreton Bay,"$119,390pa + super (up to 12%) + 9 day fortnight",119390.0,157195.0,195000.0,Brisbane QLD,Provide specialist planning and lead the delivery of highly complex strategic planning and placemaking projects.,"[<div class=""_1wkzzau0 a1msqi6m""><span class=""_1wkzzau0 a1msqi4y lnocuo0 lnocuo1 lnocuo21 _1d0g9qk4 lnocuo7""><a aria-label=""Limit results to Caboolture"" class=""_1wkzzau0 _1wkzzauf _1wkzzau0 _1wkzzauf _842p0a0 _842p0a2"" data-automation=""jobLocation"" href=""/jobs-in-design-architecture/in-Caboolture-QLD-4510?salarytype=annual&amp;salaryrange=190000-195000"" rel=""nofollow"" tabindex=""-1"" target=""_self"" title=""Limit results to Caboolture"">Caboolture</a>, <a aria-label=""Limit results to Brisbane QLD"" class=""_1wkzzau0 _1wkzzauf _1wkzzau0 _1wkzzauf _842p0a0 _842p0a2"" data-automation=""jobLocation"" href=""/jobs-in-design-architecture/in-All-Brisbane-QLD?salarytype=annual&amp;salaryrange=190000-195000"" rel=""nofollow"" tabindex=""-1"" target=""_self"" title=""Limit results to Brisbane QLD"">Brisbane QLD</a></span></div>, <div class=""_1wkzzau0 a1msqi6m""><div aria-label=""Salary: $119,390pa + super (up to 12%) + 9 day fortnight"" class=""_1wkzzau0""><span class=""_1wkzzau0 a1msqi4y lnocuo0 lnocuo1 lnocuo21 _1d0g9qk4 lnocuo7"" data-automation=""jobSalary""><span class=""_1wkzzau0 _16v7pfz1 a1msqi4y a1msqi0 a1msqir _16v7pfz3"" style=""--_16v7pfz2:2"">$119,390pa + super (up to 12%) + 9 day fortnight</span></span></div></div>]",,Design-architecture - None,08/02/2024
32,https://www.seek.com.au//job/73016341?type=standard&ref=search-standalone,design architecture,Architecture,Senior Architect/ Practice Manager,Platt Architects,-,190000.0,192500.0,195000.0,Darwin NT,Seeking a passionate & experienced Senior Architect/ Practice Manager to lead the practice with an opportunity to become shareholder/ Director.,"[<div class=""_1wkzzau0 a1msqi6m""><span class=""_1wkzzau0 a1msqi4y lnocuo0 lnocuo1 lnocuo21 _1d0g9qk4 lnocuo7""><a aria-label=""Limit results to Berrimah"" class=""_1wkzzau0 _1wkzzauf _1wkzzau0 _1wkzzauf _842p0a0 _842p0a2"" data-automation=""jobLocation"" href=""/jobs-in-design-architecture/in-Berrimah-NT-0828?salarytype=annual&amp;salaryrange=190000-195000"" rel=""nofollow"" tabindex=""-1"" target=""_self"" title=""Limit results to Berrimah"">Berrimah</a>, <a aria-label=""Limit results to Darwin NT"" class=""_1wkzzau0 _1wkzzauf _1wkzzau0 _1wkzzauf _842p0a0 _842p0a2"" data-automation=""jobLocation"" href=""/jobs-in-design-architecture/in-All-Darwin-NT?salarytype=annual&amp;salaryrange=190000-195000"" rel=""nofollow"" tabindex=""-1"" target=""_self"" title=""Limit results to Darwin NT"">Darwin NT</a></span></div>]",2024-01-15,Design-architecture - None,08/02/2024
33,https://www.seek.com.au//job/73252331?type=standout&ref=search-standalone,design architecture,Architectural Drafting,Sales Professional - New Homes,Longridge Group,-,190000.0,192500.0,195000.0,Adelaide SA,"If you're a sales professional who wants to expand your lifestyle while helping others improve theirs, an opportunity exists to join a great company!","[<div class=""_1wkzzau0 a1msqi6m""><span class=""_1wkzzau0 a1msqi4y lnocuo0 lnocuo1 lnocuo21 _1d0g9qk4 lnocuo7""><a aria-label=""Limit results to Mile End"" class=""_1wkzzau0 _1wkzzauf _1wkzzau0 _1wkzzauf _842p0a0 _842p0a2"" data-automation=""jobLocation"" href=""/jobs-in-design-architecture/in-Mile-End-SA-5031?salarytype=annual&amp;salaryrange=190000-195000"" rel=""nofollow"" tabindex=""-1"" target=""_self"" title=""Limit results to Mile End"">Mile End</a>, <a aria-label=""Limit results to Adelaide SA"" class=""_1wkzzau0 _1wkzzauf _1wkzzau0 _1wkzzauf _842p0a0 _842p0a2"" data-automation=""jobLocation"" href=""/jobs-in-design-architecture/in-All-Adelaide-SA?salarytype=annual&amp;salaryrange=190000-195000"" rel=""nofollow"" tabindex=""-1"" target=""_self"" title=""Limit results to Adelaide SA"">Adelaide SA</a></span></div>]",2024-01-23,Design-architecture - None,08/02/2024
34,https://www.seek.com.au//job/73557781?type=standard&ref=search-standalone,design architecture,Landscape Architecture,landscape architect,Public Sector People,$80 - $120ph (inc super),144000.0,180000.0,216000.0,Sydney NSW,Public Sector People are currently partnered with Camden Council seeking a Senior Landscape Architect,"[<div class=""_1wkzzau0 a1msqi6m""><span class=""_1wkzzau0 a1msqi4y lnocuo0 lnocuo1 lnocuo21 _1d0g9qk4 lnocuo7""><a aria-label=""Limit results to Sydney NSW"" class=""_1wkzzau0 _1wkzzauf _1wkzzau0 _1wkzzauf _842p0a0 _842p0a2"" data-automation=""jobLocation"" href=""/jobs-in-design-architecture/in-All-Sydney-NSW?salarytype=annual&amp;salaryrange=190000-195000"" rel=""nofollow"" tabindex=""-1"" target=""_self"" title=""Limit results to Sydney NSW"">Sydney NSW</a></span></div>, <div class=""_1wkzzau0 a1msqi6m""><div aria-label=""Salary: $80 - $120ph (inc super)"" class=""_1wkzzau0""><span class=""_1wkzzau0 a1msqi4y lnocuo0 lnocuo1 lnocuo21 _1d0g9qk4 lnocuo7"" data-automation=""jobSalary""><span class=""_1wkzzau0 _16v7pfz1 a1msqi4y a1msqi0 a1msqir _16v7pfz3"" style=""--_16v7pfz2:2"">$80 - $120ph (inc super)</span></span></div></div>]",2024-02-06,Design-architecture - None,08/02/2024
35,https://www.seek.com.au//job/73527481?type=standout&ref=search-standalone,design architecture,Architecture,Landscape Architect,Halcyon Knights Pty Ltd,-,190000.0,192500.0,195000.0,Sydney NSW,"Landscape Architect to contribute to the design, planning, and coordination of open spaces and public domains.","[<div class=""_1wkzzau0 a1msqi6m""><span class=""_1wkzzau0 a1msqi4y lnocuo0 lnocuo1 lnocuo21 _1d0g9qk4 lnocuo7""><a aria-label=""Limit results to Oran Park"" class=""_1wkzzau0 _1wkzzauf _1wkzzau0 _1wkzzauf _842p0a0 _842p0a2"" data-automation=""jobLocation"" href=""/jobs-in-design-architecture/in-Oran-Park-NSW-2570?salarytype=annual&amp;salaryrange=190000-195000"" rel=""nofollow"" tabindex=""-1"" target=""_self"" title=""Limit results to Oran Park"">Oran Park</a>, <a aria-label=""Limit results to Sydney NSW"" class=""_1wkzzau0 _1wkzzauf _1wkzzau0 _1wkzzauf _842p0a0 _842p0a2"" data-automation=""jobLocation"" href=""/jobs-in-design-architecture/in-All-Sydney-NSW?salarytype=annual&amp;salaryrange=190000-195000"" rel=""nofollow"" tabindex=""-1"" target=""_self"" title=""Limit results to Sydney NSW"">Sydney NSW</a></span></div>]",2024-02-05,Design-architecture - None,08/02/2024
36,https://www.seek.com.au//job/73252285?type=standout&ref=search-standalone,design architecture,Architecture,Sales Professional - New Homes,Longridge Group,-,190000.0,192500.0,195000.0,Adelaide SA,"If you're a sales professional who wants to expand your lifestyle while helping others improve theirs, an opportunity exists to join a great company.","[<div class=""_1wkzzau0 a1msqi6m""><span class=""_1wkzzau0 a1msqi4y lnocuo0 lnocuo1 lnocuo21 _1d0g9qk4 lnocuo7""><a aria-label=""Limit results to Mile End"" class=""_1wkzzau0 _1wkzzauf _1wkzzau0 _1wkzzauf _842p0a0 _842p0a2"" data-automation=""jobLocation"" href=""/jobs-in-design-architecture/in-Mile-End-SA-5031?salarytype=annual&amp;salaryrange=190000-195000"" rel=""nofollow"" tabindex=""-1"" target=""_self"" title=""Limit results to Mile End"">Mile End</a>, <a aria-label=""Limit results to Adelaide SA"" class=""_1wkzzau0 _1wkzzauf _1wkzzau0 _1wkzzauf _842p0a0 _842p0a2"" data-automation=""jobLocation"" href=""/jobs-in-design-architecture/in-All-Adelaide-SA?salarytype=annual&amp;salaryrange=190000-195000"" rel=""nofollow"" tabindex=""-1"" target=""_self"" title=""Limit results to Adelaide SA"">Adelaide SA</a></span></div>]",2024-01-23,Design-architecture - None,08/02/2024
37,https://www.seek.com.au//job/73152105?type=standard&ref=search-standalone,design architecture,Architecture,Submissions Leader,BVN,-,190000.0,192500.0,195000.0,Sydney NSW,BVN is looking for a skilled and enthusiastic full-time Submissions leader.,"[<div class=""_1wkzzau0 a1msqi6m""><span class=""_1wkzzau0 a1msqi4y lnocuo0 lnocuo1 lnocuo21 _1d0g9qk4 lnocuo7""><a aria-label=""Limit results to Sydney NSW"" class=""_1wkzzau0 _1wkzzauf _1wkzzau0 _1wkzzauf _842p0a0 _842p0a2"" data-automation=""jobLocation"" href=""/jobs-in-design-architecture/in-All-Sydney-NSW?salarytype=annual&amp;salaryrange=190000-195000"" rel=""nofollow"" tabindex=""-1"" target=""_self"" title=""Limit results to Sydney NSW"">Sydney NSW</a></span></div>]",2024-01-19,Design-architecture - None,08/02/2024
38,https://www.seek.com.au//job/73630535?type=standard&ref=search-standalone,design architecture,Fashion & Textile Design,Garment fit models Size 8 & Size 10. SYDNEY & MELBOURNE,Fit model co.,$60 – $90 per hour,108000.0,135000.0,162000.0,Melbourne VIC,Work with some of Australia's leading fashion brands.,"[<div class=""_1wkzzau0 a1msqi6m""><span class=""_1wkzzau0 a1msqi4y lnocuo0 lnocuo1 lnocuo21 _1d0g9qk4 lnocuo7""><a aria-label=""Limit results to Melbourne VIC"" class=""_1wkzzau0 _1wkzzauf _1wkzzau0 _1wkzzauf _842p0a0 _842p0a2"" data-automation=""jobLocation"" href=""/jobs-in-design-architecture/in-All-Melbourne-VIC?salarytype=annual&amp;salaryrange=190000-195000"" rel=""nofollow"" tabindex=""-1"" target=""_self"" title=""Limit results to Melbourne VIC"">Melbourne VIC</a></span></div>, <div class=""_1wkzzau0 a1msqi6m""><div aria-label=""Salary: $60 – $90 per hour"" class=""_1wkzzau0""><span class=""_1wkzzau0 a1msqi4y lnocuo0 lnocuo1 lnocuo21 _1d0g9qk4 lnocuo7"" data-automation=""jobSalary""><span class=""_1wkzzau0 _16v7pfz1 a1msqi4y a1msqi0 a1msqir _16v7pfz3"" style=""--_16v7pfz2:2"">$60 – $90 per hour</span></span></div></div>]",,Design-architecture - None,08/02/2024
39,https://www.seek.com.au//job/73448012?type=standout&ref=search-standalone,design architecture,Other,Product Design Manager,WorkCover Queensland,-,190000.0,192500.0,195000.0,Brisbane QLD,Lead the strategic direction and delivery of digital product design as part of our enterprise transformation. Shape solutions that make a difference!,"[<div class=""_1wkzzau0 a1msqi6m""><span class=""_1wkzzau0 a1msqi4y lnocuo0 lnocuo1 lnocuo21 _1d0g9qk4 lnocuo7""><a aria-label=""Limit results to Brisbane QLD"" class=""_1wkzzau0 _1wkzzauf _1wkzzau0 _1wkzzauf _842p0a0 _842p0a2"" data-automation=""jobLocation"" href=""/jobs-in-design-architecture/in-All-Brisbane-QLD?salarytype=annual&amp;salaryrange=190000-195000"" rel=""nofollow"" tabindex=""-1"" target=""_self"" title=""Limit results to Brisbane QLD"">Brisbane QLD</a></span></div>]",2024-02-01,Design-architecture - None,08/02/2024
40,https://www.seek.com.au//job/73213955?type=standout&ref=search-standalone,design architecture,Architecture,Architect or Senior Architect QLD,Paul Group,-,190000.0,192500.0,195000.0,Brisbane QLD,Unique opportunity and Top Tier Architectural firm.,"[<div class=""_1wkzzau0 a1msqi6m""><span class=""_1wkzzau0 a1msqi4y lnocuo0 lnocuo1 lnocuo21 _1d0g9qk4 lnocuo7""><a aria-label=""Limit results to Brisbane QLD"" class=""_1wkzzau0 _1wkzzauf _1wkzzau0 _1wkzzauf _842p0a0 _842p0a2"" data-automation=""jobLocation"" href=""/jobs-in-design-architecture/in-All-Brisbane-QLD?salarytype=annual&amp;salaryrange=190000-195000"" rel=""nofollow"" tabindex=""-1"" target=""_self"" title=""Limit results to Brisbane QLD"">Brisbane QLD</a></span></div>]",2024-01-22,Design-architecture - None,08/02/2024
41,https://www.seek.com.au//job/73277698?type=standout&ref=search-standalone,design architecture,Architecture,Associate/Project Leader,Mega Recruitment,"Up to $150,000k + Superannuation",190000.0,192500.0,195000.0,Sydney NSW,Contact Gemma on 0409 909 505 or email [email protected],"[<div class=""_1wkzzau0 a1msqi6m""><span class=""_1wkzzau0 a1msqi4y lnocuo0 lnocuo1 lnocuo21 _1d0g9qk4 lnocuo7""><a aria-label=""Limit results to Sydney NSW"" class=""_1wkzzau0 _1wkzzauf _1wkzzau0 _1wkzzauf _842p0a0 _842p0a2"" data-automation=""jobLocation"" href=""/jobs-in-design-architecture/in-All-Sydney-NSW?salarytype=annual&amp;salaryrange=190000-195000"" rel=""nofollow"" tabindex=""-1"" target=""_self"" title=""Limit results to Sydney NSW"">Sydney NSW</a></span></div>, <div class=""_1wkzzau0 a1msqi6m""><div aria-label=""Salary: Up to $150,000k + Superannuation"" class=""_1wkzzau0""><span class=""_1wkzzau0 a1msqi4y lnocuo0 lnocuo1 lnocuo21 _1d0g9qk4 lnocuo7"" data-automation=""jobSalary""><span class=""_1wkzzau0 _16v7pfz1 a1msqi4y a1msqi0 a1msqir _16v7pfz3"" style=""--_16v7pfz2:2"">Up to $150,000k + Superannuation</span></span></div></div>]",2024-01-24,Design-architecture - None,08/02/2024
42,https://www.seek.com.au//job/73527907?type=standard&ref=search-standalone,design architecture,Landscape Architecture,Landscape Architect,ACM Recruitment,AUD 80 - 120 per hour,190000.0,192500.0,195000.0,Sydney NSW,"Embark on a journey as a Landscape Architect on a 12mth contract, where your creativity will play a pivotal role in reshaping the heart of community","[<div class=""_1wkzzau0 a1msqi6m""><span class=""_1wkzzau0 a1msqi4y lnocuo0 lnocuo1 lnocuo21 _1d0g9qk4 lnocuo7""><a aria-label=""Limit results to Narellan"" class=""_1wkzzau0 _1wkzzauf _1wkzzau0 _1wkzzauf _842p0a0 _842p0a2"" data-automation=""jobLocation"" href=""/jobs-in-design-architecture/in-Narellan-NSW-2567?salarytype=annual&amp;salaryrange=190000-195000"" rel=""nofollow"" tabindex=""-1"" target=""_self"" title=""Limit results to Narellan"">Narellan</a>, <a aria-label=""Limit results to Sydney NSW"" class=""_1wkzzau0 _1wkzzauf _1wkzzau0 _1wkzzauf _842p0a0 _842p0a2"" data-automation=""jobLocation"" href=""/jobs-in-design-architecture/in-All-Sydney-NSW?salarytype=annual&amp;salaryrange=190000-195000"" rel=""nofollow"" tabindex=""-1"" target=""_self"" title=""Limit results to Sydney NSW"">Sydney NSW</a></span></div>, <div class=""_1wkzzau0 a1msqi6m""><div aria-label=""Salary: AUD 80 - 120 per hour"" class=""_1wkzzau0""><span class=""_1wkzzau0 a1msqi4y lnocuo0 lnocuo1 lnocuo21 _1d0g9qk4 lnocuo7"" data-automation=""jobSalary""><span class=""_1wkzzau0 _16v7pfz1 a1msqi4y a1msqi0 a1msqir _16v7pfz3"" style=""--_16v7pfz2:2"">AUD 80 - 120 per hour</span></span></div></div>]",2024-02-05,Design-architecture - None,08/02/2024
43,https://www.seek.com.au//job/73010647?type=standout&ref=search-standalone,design architecture,Other,Principal Structural Designer,rhi,$90 - $98 p.h.,162000.0,169200.0,176400.0,Perth WA,rhi is recruiting for a Principal Structural Designer to join our clients team in Perth.,"[<div class=""_1wkzzau0 a1msqi6m""><span class=""_1wkzzau0 a1msqi4y lnocuo0 lnocuo1 lnocuo21 _1d0g9qk4 lnocuo7""><a aria-label=""Limit results to Perth WA"" class=""_1wkzzau0 _1wkzzauf _1wkzzau0 _1wkzzauf _842p0a0 _842p0a2"" data-automation=""jobLocation"" href=""/jobs-in-design-architecture/in-All-Perth-WA?salarytype=annual&amp;salaryrange=190000-195000"" rel=""nofollow"" tabindex=""-1"" target=""_self"" title=""Limit results to Perth WA"">Perth WA</a></span></div>, <div class=""_1wkzzau0 a1msqi6m""><div aria-label=""Salary: $90 - $98 p.h."" class=""_1wkzzau0""><span class=""_1wkzzau0 a1msqi4y lnocuo0 lnocuo1 lnocuo21 _1d0g9qk4 lnocuo7"" data-automation=""jobSalary""><span class=""_1wkzzau0 _16v7pfz1 a1msqi4y a1msqi0 a1msqir _16v7pfz3"" style=""--_16v7pfz2:2"">$90 - $98 p.h.</span></span></div></div>]",2024-01-15,Design-architecture - None,08/02/2024
