,link,classification,category,title,company,salary,min_salary,average_salary,max_salary,location,description,entireDiv,date_posted,Category,Date
131,https://www.seek.com.au//job/72883421?type=standout&ref=search-standalone,trades services,Electricians,Electrical Service Technician - Longwall,Komatsu Underground,-,145000.0,147500.0,150000.0,Other,"As a skillful Electrician, with exp. performing machine diagnostics on longwall equipment, you'll service our clients in the Southern Highlands.","[<div class=""_1wkzzau0 a1msqi6m""><span class=""_1wkzzau0 a1msqi4y lnocuo0 lnocuo1 lnocuo21 _1d0g9qk4 lnocuo7""><a aria-label=""Limit results to Lithgow"" class=""_1wkzzau0 _1wkzzauf _1wkzzau0 _1wkzzauf _842p0a0 _842p0a2"" data-automation=""jobLocation"" href=""/jobs-in-trades-services/in-Lithgow-NSW-2790?salarytype=annual&amp;salaryrange=145000-150000"" rel=""nofollow"" tabindex=""-1"" target=""_self"" title=""Limit results to Lithgow"">Lithgow</a>, <a aria-label=""Limit results to Blue Mountains &amp; Central West NSW"" class=""_1wkzzau0 _1wkzzauf _1wkzzau0 _1wkzzauf _842p0a0 _842p0a2"" data-automation=""jobLocation"" href=""/jobs-in-trades-services/in-Blue-Mountains-&amp;-Central-West-NSW?salarytype=annual&amp;salaryrange=145000-150000"" rel=""nofollow"" tabindex=""-1"" target=""_self"" title=""Limit results to Blue Mountains &amp; Central West NSW"">Blue Mountains &amp; Central West NSW</a></span></div>]",,Trades-services - None,08/02/2024
132,https://www.seek.com.au//job/72959743?type=promoted&ref=search-standalone,trades services,Labourers,"Are you looking for reliable ""two-man team"" work in your 5 tonne truck?",Ipec Pty Ltd,-,145000.0,147500.0,150000.0,Perth WA,Team Global Express is looking for Owner drivers in two-man teams in 5 tonne trucks with tail lift.,"[<div class=""_1wkzzau0 a1msqi6m""><span class=""_1wkzzau0 a1msqi4y lnocuo0 lnocuo1 lnocuo21 _1d0g9qk4 lnocuo7""><a aria-label=""Limit results to Belmont"" class=""_1wkzzau0 _1wkzzauf _1wkzzau0 _1wkzzauf _842p0a0 _842p0a2"" data-automation=""jobLocation"" href=""/jobs-in-trades-services/in-Belmont-WA-6104?salarytype=annual&amp;salaryrange=145000-150000"" rel=""nofollow"" tabindex=""-1"" target=""_self"" title=""Limit results to Belmont"">Belmont</a>, <a aria-label=""Limit results to Perth WA"" class=""_1wkzzau0 _1wkzzauf _1wkzzau0 _1wkzzauf _842p0a0 _842p0a2"" data-automation=""jobLocation"" href=""/jobs-in-trades-services/in-All-Perth-WA?salarytype=annual&amp;salaryrange=145000-150000"" rel=""nofollow"" tabindex=""-1"" target=""_self"" title=""Limit results to Perth WA"">Perth WA</a></span></div>]",,Trades-services - None,08/02/2024
133,https://www.seek.com.au//job/73622054?type=promoted&ref=search-standalone,trades services,Maintenance & Handyperson Services,Maintenance Leading Hand,Whitehaven Coal Limited,-,145000.0,147500.0,150000.0,Other,Whitehaven Coal is the dominant player in Australia’s only emerging high-quality coal basin!,"[<div class=""_1wkzzau0 a1msqi6m""><span class=""_1wkzzau0 a1msqi4y lnocuo0 lnocuo1 lnocuo21 _1d0g9qk4 lnocuo7""><a aria-label=""Limit results to Gunnedah"" class=""_1wkzzau0 _1wkzzauf _1wkzzau0 _1wkzzauf _842p0a0 _842p0a2"" data-automation=""jobLocation"" href=""/jobs-in-trades-services/in-Gunnedah-NSW-2380?salarytype=annual&amp;salaryrange=145000-150000"" rel=""nofollow"" tabindex=""-1"" target=""_self"" title=""Limit results to Gunnedah"">Gunnedah</a>, <a aria-label=""Limit results to Tamworth &amp; North West NSW"" class=""_1wkzzau0 _1wkzzauf _1wkzzau0 _1wkzzauf _842p0a0 _842p0a2"" data-automation=""jobLocation"" href=""/jobs-in-trades-services/in-Tamworth-&amp;-North-West-NSW?salarytype=annual&amp;salaryrange=145000-150000"" rel=""nofollow"" tabindex=""-1"" target=""_self"" title=""Limit results to Tamworth &amp; North West NSW"">Tamworth &amp; North West NSW</a></span></div>]",,Trades-services - None,08/02/2024
134,https://www.seek.com.au//job/73483005?type=standout&ref=search-standalone,trades services,Building Trades,Construction Labourer,CGC Recruitment,-,145000.0,147500.0,150000.0,Brisbane QLD,"Experienced construction labourers required for projects across Brisbane, immediate starts.","[<div class=""_1wkzzau0 a1msqi6m""><span class=""_1wkzzau0 a1msqi4y lnocuo0 lnocuo1 lnocuo21 _1d0g9qk4 lnocuo7""><a aria-label=""Limit results to Brisbane QLD"" class=""_1wkzzau0 _1wkzzauf _1wkzzau0 _1wkzzauf _842p0a0 _842p0a2"" data-automation=""jobLocation"" href=""/jobs-in-trades-services/in-All-Brisbane-QLD?salarytype=annual&amp;salaryrange=145000-150000"" rel=""nofollow"" tabindex=""-1"" target=""_self"" title=""Limit results to Brisbane QLD"">Brisbane QLD</a></span></div>]",2024-02-02,Trades-services - None,08/02/2024
135,https://www.seek.com.au//job/73540562?type=standout&ref=search-standalone,trades services,Automotive Trades,Workshop Coordinator,Fitzroy Mining Operations,-,145000.0,147500.0,150000.0,"Moranbah, Mackay & Coalfields QLD",Bring your management skills to the mobile fleet maintenance workshop at the newest underground coal mine in the Bowen Basin just 2 hours from Mackay.,"[<div class=""_1wkzzau0 a1msqi6m""><span class=""_1wkzzau0 a1msqi4y lnocuo0 lnocuo1 lnocuo21 _1d0g9qk4 lnocuo7""><a aria-label=""Limit results to Moranbah"" class=""_1wkzzau0 _1wkzzauf _1wkzzau0 _1wkzzauf _842p0a0 _842p0a2"" data-automation=""jobLocation"" href=""/jobs-in-trades-services/in-Moranbah-QLD-4744?salarytype=annual&amp;salaryrange=145000-150000"" rel=""nofollow"" tabindex=""-1"" target=""_self"" title=""Limit results to Moranbah"">Moranbah</a>, <a aria-label=""Limit results to Mackay &amp; Coalfields QLD"" class=""_1wkzzau0 _1wkzzauf _1wkzzau0 _1wkzzauf _842p0a0 _842p0a2"" data-automation=""jobLocation"" href=""/jobs-in-trades-services/in-Mackay-&amp;-Coalfields-QLD?salarytype=annual&amp;salaryrange=145000-150000"" rel=""nofollow"" tabindex=""-1"" target=""_self"" title=""Limit results to Mackay &amp; Coalfields QLD"">Mackay &amp; Coalfields QLD</a></span></div>]",2024-02-06,Trades-services - None,08/02/2024
136,https://www.seek.com.au//job/73550437?type=standout&ref=search-standalone,trades services,Building Trades,Fence Installer (Subcontractor),Fence Pro Installations Victoria Pty Ltd,-,145000.0,147500.0,150000.0,Melbourne VIC,.,"[<div class=""_1wkzzau0 a1msqi6m""><span class=""_1wkzzau0 a1msqi4y lnocuo0 lnocuo1 lnocuo21 _1d0g9qk4 lnocuo7""><a aria-label=""Limit results to Melbourne VIC"" class=""_1wkzzau0 _1wkzzauf _1wkzzau0 _1wkzzauf _842p0a0 _842p0a2"" data-automation=""jobLocation"" href=""/jobs-in-trades-services/in-All-Melbourne-VIC?salarytype=annual&amp;salaryrange=145000-150000"" rel=""nofollow"" tabindex=""-1"" target=""_self"" title=""Limit results to Melbourne VIC"">Melbourne VIC</a></span></div>]",2024-02-06,Trades-services - None,08/02/2024
137,https://www.seek.com.au//job/73621995?type=standard&ref=search-standalone,trades services,Automotive Trades,Auto Electrician - CST Hire,CST Hire,$50 – $65 per hour,90000.0,103500.0,117000.0,Brisbane QLD,"Located at Larapinta with a modern workshop, CST Hire is a specialised truck and commercial vehicle rental company and requires an auto electrician.","[<div class=""_1wkzzau0 a1msqi6m""><span class=""_1wkzzau0 a1msqi4y lnocuo0 lnocuo1 lnocuo21 _1d0g9qk4 lnocuo7""><a aria-label=""Limit results to Larapinta"" class=""_1wkzzau0 _1wkzzauf _1wkzzau0 _1wkzzauf _842p0a0 _842p0a2"" data-automation=""jobLocation"" href=""/jobs-in-trades-services/in-Larapinta-QLD-4110?salarytype=annual&amp;salaryrange=145000-150000"" rel=""nofollow"" tabindex=""-1"" target=""_self"" title=""Limit results to Larapinta"">Larapinta</a>, <a aria-label=""Limit results to Brisbane QLD"" class=""_1wkzzau0 _1wkzzauf _1wkzzau0 _1wkzzauf _842p0a0 _842p0a2"" data-automation=""jobLocation"" href=""/jobs-in-trades-services/in-All-Brisbane-QLD?salarytype=annual&amp;salaryrange=145000-150000"" rel=""nofollow"" tabindex=""-1"" target=""_self"" title=""Limit results to Brisbane QLD"">Brisbane QLD</a></span></div>, <div class=""_1wkzzau0 a1msqi6m""><div aria-label=""Salary: $50 – $65 per hour"" class=""_1wkzzau0""><span class=""_1wkzzau0 a1msqi4y lnocuo0 lnocuo1 lnocuo21 _1d0g9qk4 lnocuo7"" data-automation=""jobSalary""><span class=""_1wkzzau0 _16v7pfz1 a1msqi4y a1msqi0 a1msqir _16v7pfz3"" style=""--_16v7pfz2:2"">$50 – $65 per hour</span></span></div></div>]",,Trades-services - None,08/02/2024
138,https://www.seek.com.au//job/73528881?type=standout&ref=search-standalone,trades services,Automotive Trades,Service Manager,Talent Right,"$90,000 – $120,000 per year",90000.0,105000.0,120000.0,Newcastle NSW,Join us in making a positive impact today!,"[<div class=""_1wkzzau0 a1msqi6m""><span class=""_1wkzzau0 a1msqi4y lnocuo0 lnocuo1 lnocuo21 _1d0g9qk4 lnocuo7""><a aria-label=""Limit results to Singleton"" class=""_1wkzzau0 _1wkzzauf _1wkzzau0 _1wkzzauf _842p0a0 _842p0a2"" data-automation=""jobLocation"" href=""/jobs-in-trades-services/in-Singleton-NSW-2330?salarytype=annual&amp;salaryrange=145000-150000"" rel=""nofollow"" tabindex=""-1"" target=""_self"" title=""Limit results to Singleton"">Singleton</a>, <a aria-label=""Limit results to Newcastle, Maitland &amp; Hunter NSW"" class=""_1wkzzau0 _1wkzzauf _1wkzzau0 _1wkzzauf _842p0a0 _842p0a2"" data-automation=""jobLocation"" href=""/jobs-in-trades-services/in-Newcastle,-Maitland-&amp;-Hunter-NSW?salarytype=annual&amp;salaryrange=145000-150000"" rel=""nofollow"" tabindex=""-1"" target=""_self"" title=""Limit results to Newcastle, Maitland &amp; Hunter NSW"">Newcastle, Maitland &amp; Hunter NSW</a></span></div>, <div class=""_1wkzzau0 a1msqi6m""><div aria-label=""Salary: $90,000 – $120,000 per year"" class=""_1wkzzau0""><span class=""_1wkzzau0 a1msqi4y lnocuo0 lnocuo1 lnocuo21 _1d0g9qk4 lnocuo7"" data-automation=""jobSalary""><span class=""_1wkzzau0 _16v7pfz1 a1msqi4y a1msqi0 a1msqir _16v7pfz3"" style=""--_16v7pfz2:2"">$90,000 – $120,000 per year</span></span></div></div>]",2024-02-05,Trades-services - None,08/02/2024
139,https://www.seek.com.au//job/73393193?type=standout&ref=search-standalone,trades services,Technicians,Maintenance Technician,Veolia Australia & New Zealand,"Salary, benefits and bonus",145000.0,147500.0,150000.0,Other,"Novated lease, employee share plan, discounted health insurance, corporate discounts, employee assistance program & more.","[<div class=""_1wkzzau0 a1msqi6m""><span class=""_1wkzzau0 a1msqi4y lnocuo0 lnocuo1 lnocuo21 _1d0g9qk4 lnocuo7""><a aria-label=""Limit results to Lithgow"" class=""_1wkzzau0 _1wkzzauf _1wkzzau0 _1wkzzauf _842p0a0 _842p0a2"" data-automation=""jobLocation"" href=""/jobs-in-trades-services/in-Lithgow-NSW-2790?salarytype=annual&amp;salaryrange=145000-150000"" rel=""nofollow"" tabindex=""-1"" target=""_self"" title=""Limit results to Lithgow"">Lithgow</a>, <a aria-label=""Limit results to Blue Mountains &amp; Central West NSW"" class=""_1wkzzau0 _1wkzzauf _1wkzzau0 _1wkzzauf _842p0a0 _842p0a2"" data-automation=""jobLocation"" href=""/jobs-in-trades-services/in-Blue-Mountains-&amp;-Central-West-NSW?salarytype=annual&amp;salaryrange=145000-150000"" rel=""nofollow"" tabindex=""-1"" target=""_self"" title=""Limit results to Blue Mountains &amp; Central West NSW"">Blue Mountains &amp; Central West NSW</a></span></div>, <div class=""_1wkzzau0 a1msqi6m""><div aria-label=""Salary: Salary, benefits and bonus"" class=""_1wkzzau0""><span class=""_1wkzzau0 a1msqi4y lnocuo0 lnocuo1 lnocuo21 _1d0g9qk4 lnocuo7"" data-automation=""jobSalary""><span class=""_1wkzzau0 _16v7pfz1 a1msqi4y a1msqi0 a1msqir _16v7pfz3"" style=""--_16v7pfz2:2"">Salary, benefits and bonus</span></span></div></div>]",2024-01-30,Trades-services - None,08/02/2024
140,https://www.seek.com.au//job/73622113?type=standout&ref=search-standalone,trades services,Other,Resident Field Service Agricultural Mechanic - West Wyalong Region,WesTrac Pty Ltd,"Potential earnings from $138,000 - $170,000",145000.0,147500.0,150000.0,Other,A Resident Field Service position with WesTrac will challenge you whilst giving you exposure to a large range of Caterpillar Machines,"[<div class=""_1wkzzau0 a1msqi6m""><span class=""_1wkzzau0 a1msqi4y lnocuo0 lnocuo1 lnocuo21 _1d0g9qk4 lnocuo7""><a aria-label=""Limit results to West Wyalong"" class=""_1wkzzau0 _1wkzzauf _1wkzzau0 _1wkzzauf _842p0a0 _842p0a2"" data-automation=""jobLocation"" href=""/jobs-in-trades-services/in-West-Wyalong-NSW-2671?salarytype=annual&amp;salaryrange=145000-150000"" rel=""nofollow"" tabindex=""-1"" target=""_self"" title=""Limit results to West Wyalong"">West Wyalong</a>, <a aria-label=""Limit results to Dubbo &amp; Central NSW"" class=""_1wkzzau0 _1wkzzauf _1wkzzau0 _1wkzzauf _842p0a0 _842p0a2"" data-automation=""jobLocation"" href=""/jobs-in-trades-services/in-Dubbo-&amp;-Central-NSW?salarytype=annual&amp;salaryrange=145000-150000"" rel=""nofollow"" tabindex=""-1"" target=""_self"" title=""Limit results to Dubbo &amp; Central NSW"">Dubbo &amp; Central NSW</a></span></div>, <div class=""_1wkzzau0 a1msqi6m""><div aria-label=""Salary: Potential earnings from $138,000 - $170,000"" class=""_1wkzzau0""><span class=""_1wkzzau0 a1msqi4y lnocuo0 lnocuo1 lnocuo21 _1d0g9qk4 lnocuo7"" data-automation=""jobSalary""><span class=""_1wkzzau0 _16v7pfz1 a1msqi4y a1msqi0 a1msqir _16v7pfz3"" style=""--_16v7pfz2:2"">Potential earnings from $138,000 - $170,000</span></span></div></div>]",,Trades-services - None,08/02/2024
141,https://www.seek.com.au//job/73584359?type=standard&ref=search-standalone,trades services,Building Trades,Experienced Installer - Outdoor Retractable Roofing / Awnings & Indoor Blinds,Fantastic Blinds Shutters,"$150,000 – $200,000 per year",150000.0,175000.0,200000.0,Melbourne VIC,FBS are seeking Installers for Outdoor Retractable Roofing / Awnings & Indoor Blinds,"[<div class=""_1wkzzau0 a1msqi6m""><span class=""_1wkzzau0 a1msqi4y lnocuo0 lnocuo1 lnocuo21 _1d0g9qk4 lnocuo7""><a aria-label=""Limit results to Dandenong South"" class=""_1wkzzau0 _1wkzzauf _1wkzzau0 _1wkzzauf _842p0a0 _842p0a2"" data-automation=""jobLocation"" href=""/jobs-in-trades-services/in-Dandenong-South-VIC-3175?salarytype=annual&amp;salaryrange=145000-150000"" rel=""nofollow"" tabindex=""-1"" target=""_self"" title=""Limit results to Dandenong South"">Dandenong South</a>, <a aria-label=""Limit results to Melbourne VIC"" class=""_1wkzzau0 _1wkzzauf _1wkzzau0 _1wkzzauf _842p0a0 _842p0a2"" data-automation=""jobLocation"" href=""/jobs-in-trades-services/in-All-Melbourne-VIC?salarytype=annual&amp;salaryrange=145000-150000"" rel=""nofollow"" tabindex=""-1"" target=""_self"" title=""Limit results to Melbourne VIC"">Melbourne VIC</a></span></div>, <div class=""_1wkzzau0 a1msqi6m""><div aria-label=""Salary: $150,000 – $200,000 per year"" class=""_1wkzzau0""><span class=""_1wkzzau0 a1msqi4y lnocuo0 lnocuo1 lnocuo21 _1d0g9qk4 lnocuo7"" data-automation=""jobSalary""><span class=""_1wkzzau0 _16v7pfz1 a1msqi4y a1msqi0 a1msqir _16v7pfz3"" style=""--_16v7pfz2:2"">$150,000 – $200,000 per year</span></span></div></div>]",2024-02-07,Trades-services - None,08/02/2024
142,https://www.seek.com.au//job/73553630?type=standout&ref=search-standalone,trades services,Electricians,Service Electrician - Early Start,Tasman Asset Management Services,$40 – $60 per hour,72000.0,90000.0,108000.0,Brisbane QLD,Electrical role that offers the opportunity to use your electrical skill set to its full potential. Have weekends off and enjoy permanent employment.,"[<div class=""_1wkzzau0 a1msqi6m""><span class=""_1wkzzau0 a1msqi4y lnocuo0 lnocuo1 lnocuo21 _1d0g9qk4 lnocuo7""><a aria-label=""Limit results to Brisbane QLD"" class=""_1wkzzau0 _1wkzzauf _1wkzzau0 _1wkzzauf _842p0a0 _842p0a2"" data-automation=""jobLocation"" href=""/jobs-in-trades-services/in-All-Brisbane-QLD?salarytype=annual&amp;salaryrange=145000-150000"" rel=""nofollow"" tabindex=""-1"" target=""_self"" title=""Limit results to Brisbane QLD"">Brisbane QLD</a></span></div>, <div class=""_1wkzzau0 a1msqi6m""><div aria-label=""Salary: $40 – $60 per hour"" class=""_1wkzzau0""><span class=""_1wkzzau0 a1msqi4y lnocuo0 lnocuo1 lnocuo21 _1d0g9qk4 lnocuo7"" data-automation=""jobSalary""><span class=""_1wkzzau0 _16v7pfz1 a1msqi4y a1msqi0 a1msqir _16v7pfz3"" style=""--_16v7pfz2:2"">$40 – $60 per hour</span></span></div></div>]",2024-02-06,Trades-services - None,08/02/2024
143,https://www.seek.com.au//job/73553625?type=standout&ref=search-standalone,trades services,Other,Workshop Foreperson,Haynes Group,$73 - $78 p.h.,131400.0,135900.0,140400.0,"Mackay, Mackay & Coalfields QLD",An exciting opportunity to work with a reputable company in Mackay. Enquire now!,"[<div class=""_1wkzzau0 a1msqi6m""><span class=""_1wkzzau0 a1msqi4y lnocuo0 lnocuo1 lnocuo21 _1d0g9qk4 lnocuo7""><a aria-label=""Limit results to Mackay"" class=""_1wkzzau0 _1wkzzauf _1wkzzau0 _1wkzzauf _842p0a0 _842p0a2"" data-automation=""jobLocation"" href=""/jobs-in-trades-services/in-Mackay-QLD-4740?salarytype=annual&amp;salaryrange=145000-150000"" rel=""nofollow"" tabindex=""-1"" target=""_self"" title=""Limit results to Mackay"">Mackay</a>, <a aria-label=""Limit results to Mackay &amp; Coalfields QLD"" class=""_1wkzzau0 _1wkzzauf _1wkzzau0 _1wkzzauf _842p0a0 _842p0a2"" data-automation=""jobLocation"" href=""/jobs-in-trades-services/in-Mackay-&amp;-Coalfields-QLD?salarytype=annual&amp;salaryrange=145000-150000"" rel=""nofollow"" tabindex=""-1"" target=""_self"" title=""Limit results to Mackay &amp; Coalfields QLD"">Mackay &amp; Coalfields QLD</a></span></div>, <div class=""_1wkzzau0 a1msqi6m""><div aria-label=""Salary: $73 - $78 p.h."" class=""_1wkzzau0""><span class=""_1wkzzau0 a1msqi4y lnocuo0 lnocuo1 lnocuo21 _1d0g9qk4 lnocuo7"" data-automation=""jobSalary""><span class=""_1wkzzau0 _16v7pfz1 a1msqi4y a1msqi0 a1msqir _16v7pfz3"" style=""--_16v7pfz2:2"">$73 - $78 p.h.</span></span></div></div>]",2024-02-06,Trades-services - None,08/02/2024
144,https://www.seek.com.au//job/73598894?type=standard&ref=search-standalone,trades services,Building Trades,"Carpenters/Builders -Patios, Glass rooms, Decks.",Spanline Home Additions Mid Coast,"$150,000 – $220,000per year",150000.0,185000.0,220000.0,Other,Spanline Home Additions is seeking experienced patio installers to join our existing successful team,"[<div class=""_1wkzzau0 a1msqi6m""><span class=""_1wkzzau0 a1msqi4y lnocuo0 lnocuo1 lnocuo21 _1d0g9qk4 lnocuo7""><a aria-label=""Limit results to Port Macquarie"" class=""_1wkzzau0 _1wkzzauf _1wkzzau0 _1wkzzauf _842p0a0 _842p0a2"" data-automation=""jobLocation"" href=""/jobs-in-trades-services/in-Port-Macquarie-NSW-2444?salarytype=annual&amp;salaryrange=145000-150000"" rel=""nofollow"" tabindex=""-1"" target=""_self"" title=""Limit results to Port Macquarie"">Port Macquarie</a>, <a aria-label=""Limit results to Port Macquarie &amp; Mid North Coast NSW"" class=""_1wkzzau0 _1wkzzauf _1wkzzau0 _1wkzzauf _842p0a0 _842p0a2"" data-automation=""jobLocation"" href=""/jobs-in-trades-services/in-Port-Macquarie-&amp;-Mid-North-Coast-NSW?salarytype=annual&amp;salaryrange=145000-150000"" rel=""nofollow"" tabindex=""-1"" target=""_self"" title=""Limit results to Port Macquarie &amp; Mid North Coast NSW"">Port Macquarie &amp; Mid North Coast NSW</a></span></div>, <div class=""_1wkzzau0 a1msqi6m""><div aria-label=""Salary: $150,000 – $220,000per year"" class=""_1wkzzau0""><span class=""_1wkzzau0 a1msqi4y lnocuo0 lnocuo1 lnocuo21 _1d0g9qk4 lnocuo7"" data-automation=""jobSalary""><span class=""_1wkzzau0 _16v7pfz1 a1msqi4y a1msqi0 a1msqir _16v7pfz3"" style=""--_16v7pfz2:2"">$150,000 – $220,000per year</span></span></div></div>]",2024-02-07,Trades-services - None,08/02/2024
145,https://www.seek.com.au//job/73611555?type=standout&ref=search-standalone,trades services,"Fitters, Turners & Machinists",Mechanical Fitter - Shutdowns,Engineering Trades Australia,-,145000.0,147500.0,150000.0,"Mackay, Mackay & Coalfields QLD",EOI - Mechanical Fitters needed for various Shutdowns across the Bowen Basin starting from March 2024,"[<div class=""_1wkzzau0 a1msqi6m""><span class=""_1wkzzau0 a1msqi4y lnocuo0 lnocuo1 lnocuo21 _1d0g9qk4 lnocuo7""><a aria-label=""Limit results to Mackay"" class=""_1wkzzau0 _1wkzzauf _1wkzzau0 _1wkzzauf _842p0a0 _842p0a2"" data-automation=""jobLocation"" href=""/jobs-in-trades-services/in-Mackay-QLD-4740?salarytype=annual&amp;salaryrange=145000-150000"" rel=""nofollow"" tabindex=""-1"" target=""_self"" title=""Limit results to Mackay"">Mackay</a>, <a aria-label=""Limit results to Mackay &amp; Coalfields QLD"" class=""_1wkzzau0 _1wkzzauf _1wkzzau0 _1wkzzauf _842p0a0 _842p0a2"" data-automation=""jobLocation"" href=""/jobs-in-trades-services/in-Mackay-&amp;-Coalfields-QLD?salarytype=annual&amp;salaryrange=145000-150000"" rel=""nofollow"" tabindex=""-1"" target=""_self"" title=""Limit results to Mackay &amp; Coalfields QLD"">Mackay &amp; Coalfields QLD</a></span></div>]",,Trades-services - None,08/02/2024
146,https://www.seek.com.au//job/73617759?type=standard&ref=search-standalone,trades services,Welders & Boilermakers,Boilermakers / Welders / Sheet Metal Workers / Fabricators,Mogfab,$40 – $60 per hour,72000.0,90000.0,108000.0,"Mackay, Mackay & Coalfields QLD","Full time and casual roles available, with flexible hours/days/roster with an option for long weekends.","[<div class=""_1wkzzau0 a1msqi6m""><span class=""_1wkzzau0 a1msqi4y lnocuo0 lnocuo1 lnocuo21 _1d0g9qk4 lnocuo7""><a aria-label=""Limit results to Mackay"" class=""_1wkzzau0 _1wkzzauf _1wkzzau0 _1wkzzauf _842p0a0 _842p0a2"" data-automation=""jobLocation"" href=""/jobs-in-trades-services/in-Mackay-QLD-4740?salarytype=annual&amp;salaryrange=145000-150000"" rel=""nofollow"" tabindex=""-1"" target=""_self"" title=""Limit results to Mackay"">Mackay</a>, <a aria-label=""Limit results to Mackay &amp; Coalfields QLD"" class=""_1wkzzau0 _1wkzzauf _1wkzzau0 _1wkzzauf _842p0a0 _842p0a2"" data-automation=""jobLocation"" href=""/jobs-in-trades-services/in-Mackay-&amp;-Coalfields-QLD?salarytype=annual&amp;salaryrange=145000-150000"" rel=""nofollow"" tabindex=""-1"" target=""_self"" title=""Limit results to Mackay &amp; Coalfields QLD"">Mackay &amp; Coalfields QLD</a></span></div>, <div class=""_1wkzzau0 a1msqi6m""><div aria-label=""Salary: $40 – $60 per hour"" class=""_1wkzzau0""><span class=""_1wkzzau0 a1msqi4y lnocuo0 lnocuo1 lnocuo21 _1d0g9qk4 lnocuo7"" data-automation=""jobSalary""><span class=""_1wkzzau0 _16v7pfz1 a1msqi4y a1msqi0 a1msqir _16v7pfz3"" style=""--_16v7pfz2:2"">$40 – $60 per hour</span></span></div></div>]",,Trades-services - None,08/02/2024
147,https://www.seek.com.au//job/73623879?type=standout&ref=search-standalone,trades services,Security Services,Aviation Protection Officer Casual Airside Role - Melbourne Airport,ISS Facility Services,-,145000.0,147500.0,150000.0,Melbourne VIC,Be part of Australia's most prominent airport security operations as industry leaders in exemplary service delivery!,"[<div class=""_1wkzzau0 a1msqi6m""><span class=""_1wkzzau0 a1msqi4y lnocuo0 lnocuo1 lnocuo21 _1d0g9qk4 lnocuo7""><a aria-label=""Limit results to Melbourne Airport"" class=""_1wkzzau0 _1wkzzauf _1wkzzau0 _1wkzzauf _842p0a0 _842p0a2"" data-automation=""jobLocation"" href=""/jobs-in-trades-services/in-Melbourne-Airport-VIC-3045?salarytype=annual&amp;salaryrange=145000-150000"" rel=""nofollow"" tabindex=""-1"" target=""_self"" title=""Limit results to Melbourne Airport"">Melbourne Airport</a>, <a aria-label=""Limit results to Melbourne VIC"" class=""_1wkzzau0 _1wkzzauf _1wkzzau0 _1wkzzauf _842p0a0 _842p0a2"" data-automation=""jobLocation"" href=""/jobs-in-trades-services/in-All-Melbourne-VIC?salarytype=annual&amp;salaryrange=145000-150000"" rel=""nofollow"" tabindex=""-1"" target=""_self"" title=""Limit results to Melbourne VIC"">Melbourne VIC</a></span></div>]",,Trades-services - None,08/02/2024
148,https://www.seek.com.au//job/73587824?type=standout&ref=search-standalone,trades services,"Fitters, Turners & Machinists",Mechanical Fitter,Workforce Success,Up to $53.00/hr + pens & OT,145000.0,147500.0,150000.0,Brisbane QLD,DAY OR ARVO SHIFT Use your heavy mechanical knowledge to complete detailed strip down & rebuilds of OEM heavy mining components! Call Lee 0402 304 982,"[<div class=""_1wkzzau0 a1msqi6m""><span class=""_1wkzzau0 a1msqi4y lnocuo0 lnocuo1 lnocuo21 _1d0g9qk4 lnocuo7""><a aria-label=""Limit results to Carole Park"" class=""_1wkzzau0 _1wkzzauf _1wkzzau0 _1wkzzauf _842p0a0 _842p0a2"" data-automation=""jobLocation"" href=""/jobs-in-trades-services/in-Carole-Park-QLD-4300?salarytype=annual&amp;salaryrange=145000-150000"" rel=""nofollow"" tabindex=""-1"" target=""_self"" title=""Limit results to Carole Park"">Carole Park</a>, <a aria-label=""Limit results to Brisbane QLD"" class=""_1wkzzau0 _1wkzzauf _1wkzzau0 _1wkzzauf _842p0a0 _842p0a2"" data-automation=""jobLocation"" href=""/jobs-in-trades-services/in-All-Brisbane-QLD?salarytype=annual&amp;salaryrange=145000-150000"" rel=""nofollow"" tabindex=""-1"" target=""_self"" title=""Limit results to Brisbane QLD"">Brisbane QLD</a></span></div>, <div class=""_1wkzzau0 a1msqi6m""><div aria-label=""Salary: Up to $53.00/hr + pens &amp; OT"" class=""_1wkzzau0""><span class=""_1wkzzau0 a1msqi4y lnocuo0 lnocuo1 lnocuo21 _1d0g9qk4 lnocuo7"" data-automation=""jobSalary""><span class=""_1wkzzau0 _16v7pfz1 a1msqi4y a1msqi0 a1msqir _16v7pfz3"" style=""--_16v7pfz2:2"">Up to $53.00/hr + pens &amp; OT</span></span></div></div>]",2024-02-07,Trades-services - None,08/02/2024
