,link,classification,category,title,company,salary,min_salary,average_salary,max_salary,location,description,entireDiv,date_posted,Category,Date
395,https://www.seek.com.au//job/73620947?type=standout&ref=search-standalone,construction,Foreperson/Supervisors,Supervisor - Plant & Workshop,Ertech Pty Ltd,-,140000.0,142500.0,145000.0,"Barrow Island, Port Hedland, Karratha & Pilbara WA","Thrive as the leader for Ertech's Barrow Island workshop! Benefits, growth potential, and compensation that are competitive. Apply now!","[<div class=""_1wkzzau0 a1msqi6m""><span class=""_1wkzzau0 a1msqi4y lnocuo0 lnocuo1 lnocuo21 _1d0g9qk4 lnocuo7""><a aria-label=""Limit results to Barrow Island"" class=""_1wkzzau0 _1wkzzauf _1wkzzau0 _1wkzzauf _842p0a0 _842p0a2"" data-automation=""jobLocation"" href=""/jobs-in-construction/in-Barrow-Island-WA-6712?salarytype=annual&amp;salaryrange=140000-145000"" rel=""nofollow"" tabindex=""-1"" target=""_self"" title=""Limit results to Barrow Island"">Barrow Island</a>, <a aria-label=""Limit results to Port Hedland, Karratha &amp; Pilbara WA"" class=""_1wkzzau0 _1wkzzauf _1wkzzau0 _1wkzzauf _842p0a0 _842p0a2"" data-automation=""jobLocation"" href=""/jobs-in-construction/in-Port-Hedland,-Karratha-&amp;-Pilbara-WA?salarytype=annual&amp;salaryrange=140000-145000"" rel=""nofollow"" tabindex=""-1"" target=""_self"" title=""Limit results to Port Hedland, Karratha &amp; Pilbara WA"">Port Hedland, Karratha &amp; Pilbara WA</a></span></div>]",,Construction - None,08/02/2024
396,https://www.seek.com.au//job/73582664?type=promoted&ref=search-standalone,construction,Plant & Machinery Operators,Final Trim GPS Excavator Operator,Hawthorne Plant and Logistics,-,140000.0,142500.0,145000.0,Brisbane QLD,"Fast paced, dynamic company seeking skilled operators to take us to the next level!","[<div class=""_1wkzzau0 a1msqi6m""><span class=""_1wkzzau0 a1msqi4y lnocuo0 lnocuo1 lnocuo21 _1d0g9qk4 lnocuo7""><a aria-label=""Limit results to Brisbane QLD"" class=""_1wkzzau0 _1wkzzauf _1wkzzau0 _1wkzzauf _842p0a0 _842p0a2"" data-automation=""jobLocation"" href=""/jobs-in-construction/in-All-Brisbane-QLD?salarytype=annual&amp;salaryrange=140000-145000"" rel=""nofollow"" tabindex=""-1"" target=""_self"" title=""Limit results to Brisbane QLD"">Brisbane QLD</a></span></div>]",,Construction - None,08/02/2024
397,https://www.seek.com.au//job/73471791?type=promoted&ref=search-standalone,construction,Project Management,Project Manager - Site Based,Soho Projects,-,140000.0,142500.0,145000.0,Sydney NSW,"Experienced Project/Construction Site Manager to lead in an exciting and vibrant environment, delivering high-end projects.","[<div class=""_1wkzzau0 a1msqi6m""><span class=""_1wkzzau0 a1msqi4y lnocuo0 lnocuo1 lnocuo21 _1d0g9qk4 lnocuo7""><a aria-label=""Limit results to Bondi Junction"" class=""_1wkzzau0 _1wkzzauf _1wkzzau0 _1wkzzauf _842p0a0 _842p0a2"" data-automation=""jobLocation"" href=""/jobs-in-construction/in-Bondi-Junction-NSW-2022?salarytype=annual&amp;salaryrange=140000-145000"" rel=""nofollow"" tabindex=""-1"" target=""_self"" title=""Limit results to Bondi Junction"">Bondi Junction</a>, <a aria-label=""Limit results to Sydney NSW"" class=""_1wkzzau0 _1wkzzauf _1wkzzau0 _1wkzzauf _842p0a0 _842p0a2"" data-automation=""jobLocation"" href=""/jobs-in-construction/in-All-Sydney-NSW?salarytype=annual&amp;salaryrange=140000-145000"" rel=""nofollow"" tabindex=""-1"" target=""_self"" title=""Limit results to Sydney NSW"">Sydney NSW</a></span></div>]",,Construction - None,08/02/2024
398,https://www.seek.com.au//job/73487462?type=standout&ref=search-standalone,construction,Contracts Management,Contracts Administrator,GFG Projects Pty Ltd,-,140000.0,142500.0,145000.0,"Toowoomba, Toowoomba & Darling Downs QLD",Are you an experienced Contracts Administrator wanting to work with a diverse and thriving business? Click to join our team today!,"[<div class=""_1wkzzau0 a1msqi6m""><span class=""_1wkzzau0 a1msqi4y lnocuo0 lnocuo1 lnocuo21 _1d0g9qk4 lnocuo7""><a aria-label=""Limit results to Toowoomba"" class=""_1wkzzau0 _1wkzzauf _1wkzzau0 _1wkzzauf _842p0a0 _842p0a2"" data-automation=""jobLocation"" href=""/jobs-in-construction/in-Toowoomba-QLD-4350?salarytype=annual&amp;salaryrange=140000-145000"" rel=""nofollow"" tabindex=""-1"" target=""_self"" title=""Limit results to Toowoomba"">Toowoomba</a>, <a aria-label=""Limit results to Toowoomba &amp; Darling Downs QLD"" class=""_1wkzzau0 _1wkzzauf _1wkzzau0 _1wkzzauf _842p0a0 _842p0a2"" data-automation=""jobLocation"" href=""/jobs-in-construction/in-Toowoomba-&amp;-Darling-Downs-QLD?salarytype=annual&amp;salaryrange=140000-145000"" rel=""nofollow"" tabindex=""-1"" target=""_self"" title=""Limit results to Toowoomba &amp; Darling Downs QLD"">Toowoomba &amp; Darling Downs QLD</a></span></div>]",2024-02-02,Construction - None,08/02/2024
399,https://www.seek.com.au//job/73523766?type=standout&ref=search-standalone,construction,Contracts Management,Contract Administrator,ACRWORLD,"130, 000",140000.0,142500.0,145000.0,Sydney NSW,Leading fit out contractor seeking experienced Contract Administrator to join their team,"[<div class=""_1wkzzau0 a1msqi6m""><span class=""_1wkzzau0 a1msqi4y lnocuo0 lnocuo1 lnocuo21 _1d0g9qk4 lnocuo7""><a aria-label=""Limit results to Sydney NSW"" class=""_1wkzzau0 _1wkzzauf _1wkzzau0 _1wkzzauf _842p0a0 _842p0a2"" data-automation=""jobLocation"" href=""/jobs-in-construction/in-All-Sydney-NSW?salarytype=annual&amp;salaryrange=140000-145000"" rel=""nofollow"" tabindex=""-1"" target=""_self"" title=""Limit results to Sydney NSW"">Sydney NSW</a></span></div>, <div class=""_1wkzzau0 a1msqi6m""><div aria-label=""Salary: 130, 000"" class=""_1wkzzau0""><span class=""_1wkzzau0 a1msqi4y lnocuo0 lnocuo1 lnocuo21 _1d0g9qk4 lnocuo7"" data-automation=""jobSalary""><span class=""_1wkzzau0 _16v7pfz1 a1msqi4y a1msqi0 a1msqir _16v7pfz3"" style=""--_16v7pfz2:2"">130, 000</span></span></div></div>]",2024-02-05,Construction - None,08/02/2024
400,https://www.seek.com.au//job/73278216?type=standout&ref=search-standalone,construction,Foreperson/Supervisors,Construction Site Supervisor,Croft Developments Pty Ltd,"$120,000 – $130,000 per year",120000.0,125000.0,130000.0,"Romsey, Bendigo, Goldfields & Macedon Ranges VIC",Are you a confident site supervisor looking to work with a reputable company in a growing industry? Then we have the job for you!,"[<div class=""_1wkzzau0 a1msqi6m""><span class=""_1wkzzau0 a1msqi4y lnocuo0 lnocuo1 lnocuo21 _1d0g9qk4 lnocuo7""><a aria-label=""Limit results to Romsey"" class=""_1wkzzau0 _1wkzzauf _1wkzzau0 _1wkzzauf _842p0a0 _842p0a2"" data-automation=""jobLocation"" href=""/jobs-in-construction/in-Romsey-VIC-3434?salarytype=annual&amp;salaryrange=140000-145000"" rel=""nofollow"" tabindex=""-1"" target=""_self"" title=""Limit results to Romsey"">Romsey</a>, <a aria-label=""Limit results to Bendigo, Goldfields &amp; Macedon Ranges VIC"" class=""_1wkzzau0 _1wkzzauf _1wkzzau0 _1wkzzauf _842p0a0 _842p0a2"" data-automation=""jobLocation"" href=""/jobs-in-construction/in-Bendigo,-Goldfields-&amp;-Macedon-Ranges-VIC?salarytype=annual&amp;salaryrange=140000-145000"" rel=""nofollow"" tabindex=""-1"" target=""_self"" title=""Limit results to Bendigo, Goldfields &amp; Macedon Ranges VIC"">Bendigo, Goldfields &amp; Macedon Ranges VIC</a></span></div>, <div class=""_1wkzzau0 a1msqi6m""><div aria-label=""Salary: $120,000 – $130,000 per year"" class=""_1wkzzau0""><span class=""_1wkzzau0 a1msqi4y lnocuo0 lnocuo1 lnocuo21 _1d0g9qk4 lnocuo7"" data-automation=""jobSalary""><span class=""_1wkzzau0 _16v7pfz1 a1msqi4y a1msqi0 a1msqir _16v7pfz3"" style=""--_16v7pfz2:2"">$120,000 – $130,000 per year</span></span></div></div>]",2024-01-24,Construction - None,08/02/2024
401,https://www.seek.com.au//job/73451228?type=standout&ref=search-standalone,construction,Foreperson/Supervisors,Site Manager,Metricon Homes,-,140000.0,142500.0,145000.0,Sydney NSW,"Based in Rockdale and surrounding suburbs, coordinate your on-site activity on Award Winning Designs. Partner with OH&S, QA, Trades and Suppliers.","[<div class=""_1wkzzau0 a1msqi6m""><span class=""_1wkzzau0 a1msqi4y lnocuo0 lnocuo1 lnocuo21 _1d0g9qk4 lnocuo7""><a aria-label=""Limit results to Rockdale"" class=""_1wkzzau0 _1wkzzauf _1wkzzau0 _1wkzzauf _842p0a0 _842p0a2"" data-automation=""jobLocation"" href=""/jobs-in-construction/in-Rockdale-NSW-2216?salarytype=annual&amp;salaryrange=140000-145000"" rel=""nofollow"" tabindex=""-1"" target=""_self"" title=""Limit results to Rockdale"">Rockdale</a>, <a aria-label=""Limit results to Sydney NSW"" class=""_1wkzzau0 _1wkzzauf _1wkzzau0 _1wkzzauf _842p0a0 _842p0a2"" data-automation=""jobLocation"" href=""/jobs-in-construction/in-All-Sydney-NSW?salarytype=annual&amp;salaryrange=140000-145000"" rel=""nofollow"" tabindex=""-1"" target=""_self"" title=""Limit results to Sydney NSW"">Sydney NSW</a></span></div>]",2024-02-01,Construction - None,08/02/2024
402,https://www.seek.com.au//job/73628139?type=standout&ref=search-standalone,construction,Other,Steel fixers - RIO Tinto $65 An hour,Techforce Personnel Pty.,-,140000.0,142500.0,145000.0,Perth WA,Seeking Steel fixers for a full time RIO Tinto project,"[<div class=""_1wkzzau0 a1msqi6m""><span class=""_1wkzzau0 a1msqi4y lnocuo0 lnocuo1 lnocuo21 _1d0g9qk4 lnocuo7""><a aria-label=""Limit results to Perth WA"" class=""_1wkzzau0 _1wkzzauf _1wkzzau0 _1wkzzauf _842p0a0 _842p0a2"" data-automation=""jobLocation"" href=""/jobs-in-construction/in-All-Perth-WA?salarytype=annual&amp;salaryrange=140000-145000"" rel=""nofollow"" tabindex=""-1"" target=""_self"" title=""Limit results to Perth WA"">Perth WA</a></span></div>]",,Construction - None,08/02/2024
403,https://www.seek.com.au//job/73579289?type=standout&ref=search-standalone,construction,Estimating,Estimator,Holcim,-,140000.0,142500.0,145000.0,"Rockhampton, Rockhampton & Capricorn Coast QLD","Join Our Team as an Estimator at Humes in Rockhampton, QLD","[<div class=""_1wkzzau0 a1msqi6m""><span class=""_1wkzzau0 a1msqi4y lnocuo0 lnocuo1 lnocuo21 _1d0g9qk4 lnocuo7""><a aria-label=""Limit results to Rockhampton"" class=""_1wkzzau0 _1wkzzauf _1wkzzau0 _1wkzzauf _842p0a0 _842p0a2"" data-automation=""jobLocation"" href=""/jobs-in-construction/in-Rockhampton-QLD-4700?salarytype=annual&amp;salaryrange=140000-145000"" rel=""nofollow"" tabindex=""-1"" target=""_self"" title=""Limit results to Rockhampton"">Rockhampton</a>, <a aria-label=""Limit results to Rockhampton &amp; Capricorn Coast QLD"" class=""_1wkzzau0 _1wkzzauf _1wkzzau0 _1wkzzauf _842p0a0 _842p0a2"" data-automation=""jobLocation"" href=""/jobs-in-construction/in-Rockhampton-&amp;-Capricorn-Coast-QLD?salarytype=annual&amp;salaryrange=140000-145000"" rel=""nofollow"" tabindex=""-1"" target=""_self"" title=""Limit results to Rockhampton &amp; Capricorn Coast QLD"">Rockhampton &amp; Capricorn Coast QLD</a></span></div>]",2024-02-07,Construction - None,08/02/2024
404,https://www.seek.com.au//job/73358143?type=standout&ref=search-standalone,construction,Project Management,Development Manager,Hume Community Housing,-,140000.0,142500.0,145000.0,Newcastle NSW,HUME Housing is on the hunt to find a well-seasoned Development Manager to join our highly performing team! Join our cause in the Not-For-Profit space,"[<div class=""_1wkzzau0 a1msqi6m""><span class=""_1wkzzau0 a1msqi4y lnocuo0 lnocuo1 lnocuo21 _1d0g9qk4 lnocuo7""><a aria-label=""Limit results to Maitland"" class=""_1wkzzau0 _1wkzzauf _1wkzzau0 _1wkzzauf _842p0a0 _842p0a2"" data-automation=""jobLocation"" href=""/jobs-in-construction/in-Maitland-NSW-2320?salarytype=annual&amp;salaryrange=140000-145000"" rel=""nofollow"" tabindex=""-1"" target=""_self"" title=""Limit results to Maitland"">Maitland</a>, <a aria-label=""Limit results to Newcastle, Maitland &amp; Hunter NSW"" class=""_1wkzzau0 _1wkzzauf _1wkzzau0 _1wkzzauf _842p0a0 _842p0a2"" data-automation=""jobLocation"" href=""/jobs-in-construction/in-Newcastle,-Maitland-&amp;-Hunter-NSW?salarytype=annual&amp;salaryrange=140000-145000"" rel=""nofollow"" tabindex=""-1"" target=""_self"" title=""Limit results to Newcastle, Maitland &amp; Hunter NSW"">Newcastle, Maitland &amp; Hunter NSW</a></span></div>]",2024-01-29,Construction - None,08/02/2024
405,https://www.seek.com.au//job/73351326?type=standard&ref=search-standalone,construction,Foreperson/Supervisors,Site Supervisor - Volume residential housing,Design & Build,$120k - $130K + super & vehicle,120000.0,125000.0,130000.0,Sydney NSW,Residential home builder is looking for a Site Supervisor to join their expanding business. Oversee up to 20 new homes in Northwest Sydney.,"[<div class=""_1wkzzau0 a1msqi6m""><span class=""_1wkzzau0 a1msqi4y lnocuo0 lnocuo1 lnocuo21 _1d0g9qk4 lnocuo7""><a aria-label=""Limit results to Box Hill"" class=""_1wkzzau0 _1wkzzauf _1wkzzau0 _1wkzzauf _842p0a0 _842p0a2"" data-automation=""jobLocation"" href=""/jobs-in-construction/in-Box-Hill-NSW-2765?salarytype=annual&amp;salaryrange=140000-145000"" rel=""nofollow"" tabindex=""-1"" target=""_self"" title=""Limit results to Box Hill"">Box Hill</a>, <a aria-label=""Limit results to Sydney NSW"" class=""_1wkzzau0 _1wkzzauf _1wkzzau0 _1wkzzauf _842p0a0 _842p0a2"" data-automation=""jobLocation"" href=""/jobs-in-construction/in-All-Sydney-NSW?salarytype=annual&amp;salaryrange=140000-145000"" rel=""nofollow"" tabindex=""-1"" target=""_self"" title=""Limit results to Sydney NSW"">Sydney NSW</a></span></div>, <div class=""_1wkzzau0 a1msqi6m""><div aria-label=""Salary: $120k - $130K + super &amp; vehicle"" class=""_1wkzzau0""><span class=""_1wkzzau0 a1msqi4y lnocuo0 lnocuo1 lnocuo21 _1d0g9qk4 lnocuo7"" data-automation=""jobSalary""><span class=""_1wkzzau0 _16v7pfz1 a1msqi4y a1msqi0 a1msqir _16v7pfz3"" style=""--_16v7pfz2:2"">$120k - $130K + super &amp; vehicle</span></span></div></div>]",2024-01-29,Construction - None,08/02/2024
406,https://www.seek.com.au//job/73456974?type=standard&ref=search-standalone,construction,Project Management,Project & Civil Supervisor,Ausco Civil Pty Ltd,-,140000.0,142500.0,145000.0,"Esk, Somerset & Lockyer QLD",We are seeking an experienced project and civil supervisor to join our growing civil business based in the Somerset Region,"[<div class=""_1wkzzau0 a1msqi6m""><span class=""_1wkzzau0 a1msqi4y lnocuo0 lnocuo1 lnocuo21 _1d0g9qk4 lnocuo7""><a aria-label=""Limit results to Esk"" class=""_1wkzzau0 _1wkzzauf _1wkzzau0 _1wkzzauf _842p0a0 _842p0a2"" data-automation=""jobLocation"" href=""/jobs-in-construction/in-Esk-QLD-4312?salarytype=annual&amp;salaryrange=140000-145000"" rel=""nofollow"" tabindex=""-1"" target=""_self"" title=""Limit results to Esk"">Esk</a>, <a aria-label=""Limit results to Somerset &amp; Lockyer QLD"" class=""_1wkzzau0 _1wkzzauf _1wkzzau0 _1wkzzauf _842p0a0 _842p0a2"" data-automation=""jobLocation"" href=""/jobs-in-construction/in-Somerset-&amp;-Lockyer-QLD?salarytype=annual&amp;salaryrange=140000-145000"" rel=""nofollow"" tabindex=""-1"" target=""_self"" title=""Limit results to Somerset &amp; Lockyer QLD"">Somerset &amp; Lockyer QLD</a></span></div>]",2024-02-01,Construction - None,08/02/2024
407,https://www.seek.com.au//job/73357153?type=standout&ref=search-standalone,construction,Estimating,Estimator,Combined Steel Solutions Pty Ltd,"$95,000 – $140,000 per year",95000.0,117500.0,140000.0,"Hastings, Mornington Peninsula & Bass Coast VIC","An attractive remuneration 
Full time position in Hastings 3915 including RDO's 
Neat and clean office space with a new office currently being built.","[<div class=""_1wkzzau0 a1msqi6m""><span class=""_1wkzzau0 a1msqi4y lnocuo0 lnocuo1 lnocuo21 _1d0g9qk4 lnocuo7""><a aria-label=""Limit results to Hastings"" class=""_1wkzzau0 _1wkzzauf _1wkzzau0 _1wkzzauf _842p0a0 _842p0a2"" data-automation=""jobLocation"" href=""/jobs-in-construction/in-Hastings-VIC-3915?salarytype=annual&amp;salaryrange=140000-145000"" rel=""nofollow"" tabindex=""-1"" target=""_self"" title=""Limit results to Hastings"">Hastings</a>, <a aria-label=""Limit results to Mornington Peninsula &amp; Bass Coast VIC"" class=""_1wkzzau0 _1wkzzauf _1wkzzau0 _1wkzzauf _842p0a0 _842p0a2"" data-automation=""jobLocation"" href=""/jobs-in-construction/in-Mornington-Peninsula-&amp;-Bass-Coast-VIC?salarytype=annual&amp;salaryrange=140000-145000"" rel=""nofollow"" tabindex=""-1"" target=""_self"" title=""Limit results to Mornington Peninsula &amp; Bass Coast VIC"">Mornington Peninsula &amp; Bass Coast VIC</a></span></div>, <div class=""_1wkzzau0 a1msqi6m""><div aria-label=""Salary: $95,000 – $140,000 per year"" class=""_1wkzzau0""><span class=""_1wkzzau0 a1msqi4y lnocuo0 lnocuo1 lnocuo21 _1d0g9qk4 lnocuo7"" data-automation=""jobSalary""><span class=""_1wkzzau0 _16v7pfz1 a1msqi4y a1msqi0 a1msqir _16v7pfz3"" style=""--_16v7pfz2:2"">$95,000 – $140,000 per year</span></span></div></div>]",2024-01-29,Construction - None,08/02/2024
408,https://www.seek.com.au//job/73361370?type=standard&ref=search-standalone,construction,Foreperson/Supervisors,Site Foreman,Bison Constructions,"$90,000 – $120,000 per year",90000.0,105000.0,120000.0,"Launceston, Launceston & North East TAS",We are offering a position for a site based foreman / team leader with experience in building and roof plumbing to be based in Northern Tasmania.,"[<div class=""_1wkzzau0 a1msqi6m""><span class=""_1wkzzau0 a1msqi4y lnocuo0 lnocuo1 lnocuo21 _1d0g9qk4 lnocuo7""><a aria-label=""Limit results to Launceston"" class=""_1wkzzau0 _1wkzzauf _1wkzzau0 _1wkzzauf _842p0a0 _842p0a2"" data-automation=""jobLocation"" href=""/jobs-in-construction/in-Launceston-TAS-7250?salarytype=annual&amp;salaryrange=140000-145000"" rel=""nofollow"" tabindex=""-1"" target=""_self"" title=""Limit results to Launceston"">Launceston</a>, <a aria-label=""Limit results to Launceston &amp; North East TAS"" class=""_1wkzzau0 _1wkzzauf _1wkzzau0 _1wkzzauf _842p0a0 _842p0a2"" data-automation=""jobLocation"" href=""/jobs-in-construction/in-Launceston-&amp;-North-East-TAS?salarytype=annual&amp;salaryrange=140000-145000"" rel=""nofollow"" tabindex=""-1"" target=""_self"" title=""Limit results to Launceston &amp; North East TAS"">Launceston &amp; North East TAS</a></span></div>, <div class=""_1wkzzau0 a1msqi6m""><div aria-label=""Salary: $90,000 – $120,000 per year"" class=""_1wkzzau0""><span class=""_1wkzzau0 a1msqi4y lnocuo0 lnocuo1 lnocuo21 _1d0g9qk4 lnocuo7"" data-automation=""jobSalary""><span class=""_1wkzzau0 _16v7pfz1 a1msqi4y a1msqi0 a1msqir _16v7pfz3"" style=""--_16v7pfz2:2"">$90,000 – $120,000 per year</span></span></div></div>]",2024-01-29,Construction - None,08/02/2024
409,https://www.seek.com.au//job/73378352?type=standard&ref=search-standalone,construction,Foreperson/Supervisors,Site Supervisor (New Homes - Residential),Newport Homes,-,140000.0,142500.0,145000.0,Sydney NSW,We have an exciting opportunity for you to join our award-winning team as a Site Supervisor.,"[<div class=""_1wkzzau0 a1msqi6m""><span class=""_1wkzzau0 a1msqi4y lnocuo0 lnocuo1 lnocuo21 _1d0g9qk4 lnocuo7""><a aria-label=""Limit results to Sydney NSW"" class=""_1wkzzau0 _1wkzzauf _1wkzzau0 _1wkzzauf _842p0a0 _842p0a2"" data-automation=""jobLocation"" href=""/jobs-in-construction/in-All-Sydney-NSW?salarytype=annual&amp;salaryrange=140000-145000"" rel=""nofollow"" tabindex=""-1"" target=""_self"" title=""Limit results to Sydney NSW"">Sydney NSW</a></span></div>]",2024-01-30,Construction - None,08/02/2024
410,https://www.seek.com.au//job/73160151?type=standout&ref=search-standalone,construction,Estimating,Sales Estimator - Residential Project Builder,Coral Homes,-,140000.0,142500.0,145000.0,Gold Coast QLD,Coral Homes is looking for an experienced Sales Estimator to join their Sales Estimating team on the Gold Coast!,"[<div class=""_1wkzzau0 a1msqi6m""><span class=""_1wkzzau0 a1msqi4y lnocuo0 lnocuo1 lnocuo21 _1d0g9qk4 lnocuo7""><a aria-label=""Limit results to Varsity Lakes"" class=""_1wkzzau0 _1wkzzauf _1wkzzau0 _1wkzzauf _842p0a0 _842p0a2"" data-automation=""jobLocation"" href=""/jobs-in-construction/in-Varsity-Lakes-QLD-4227?salarytype=annual&amp;salaryrange=140000-145000"" rel=""nofollow"" tabindex=""-1"" target=""_self"" title=""Limit results to Varsity Lakes"">Varsity Lakes</a>, <a aria-label=""Limit results to Gold Coast QLD"" class=""_1wkzzau0 _1wkzzauf _1wkzzau0 _1wkzzauf _842p0a0 _842p0a2"" data-automation=""jobLocation"" href=""/jobs-in-construction/in-All-Gold-Coast-QLD?salarytype=annual&amp;salaryrange=140000-145000"" rel=""nofollow"" tabindex=""-1"" target=""_self"" title=""Limit results to Gold Coast QLD"">Gold Coast QLD</a></span></div>]",2024-02-07,Construction - None,08/02/2024
411,https://www.seek.com.au//job/73619190?type=standard&ref=search-standalone,construction,Planning & Scheduling,Procurement Coordinator,GOUGH RECRUITMENT - REAL ESTATE | PROPERTY | DEVELOPMENT | CONSTRUCTION,-,140000.0,142500.0,145000.0,Perth WA,Stop contracting! | Work direct for owner | huge pipeline of projects and consistent work | Don't look for a job again | Industrial projects |,"[<div class=""_1wkzzau0 a1msqi6m""><span class=""_1wkzzau0 a1msqi4y lnocuo0 lnocuo1 lnocuo21 _1d0g9qk4 lnocuo7""><a aria-label=""Limit results to Perth WA"" class=""_1wkzzau0 _1wkzzauf _1wkzzau0 _1wkzzauf _842p0a0 _842p0a2"" data-automation=""jobLocation"" href=""/jobs-in-construction/in-All-Perth-WA?salarytype=annual&amp;salaryrange=140000-145000"" rel=""nofollow"" tabindex=""-1"" target=""_self"" title=""Limit results to Perth WA"">Perth WA</a></span></div>]",,Construction - None,08/02/2024
412,https://www.seek.com.au//job/73492733?type=standard&ref=search-standalone,construction,Management,Operations Manager,FourQuarters Recruitment,-,140000.0,142500.0,145000.0,Sydney NSW,Your opportunity to join an established business based in the Southern Suburbs of Sydney on a permanent full-time basis as an Operations Manager.,"[<div class=""_1wkzzau0 a1msqi6m""><span class=""_1wkzzau0 a1msqi4y lnocuo0 lnocuo1 lnocuo21 _1d0g9qk4 lnocuo7""><a aria-label=""Limit results to Southern Suburbs &amp; Sutherland Shire"" class=""_1wkzzau0 _1wkzzauf _1wkzzau0 _1wkzzauf _842p0a0 _842p0a2"" data-automation=""jobLocation"" href=""/jobs-in-construction/in-Southern-Suburbs-&amp;-Sutherland-Shire-Sydney-NSW?salarytype=annual&amp;salaryrange=140000-145000"" rel=""nofollow"" tabindex=""-1"" target=""_self"" title=""Limit results to Southern Suburbs &amp; Sutherland Shire"">Southern Suburbs &amp; Sutherland Shire</a>, <a aria-label=""Limit results to Sydney NSW"" class=""_1wkzzau0 _1wkzzauf _1wkzzau0 _1wkzzauf _842p0a0 _842p0a2"" data-automation=""jobLocation"" href=""/jobs-in-construction/in-All-Sydney-NSW?salarytype=annual&amp;salaryrange=140000-145000"" rel=""nofollow"" tabindex=""-1"" target=""_self"" title=""Limit results to Sydney NSW"">Sydney NSW</a></span></div>]",2024-02-02,Construction - None,08/02/2024
413,https://www.seek.com.au//job/73489185?type=standout&ref=search-standalone,construction,Foreperson/Supervisors,Concrete Supervisor (Construction),Mecon Construction,"$100,000 – $120,000 per year",100000.0,110000.0,120000.0,Perth WA,"Seeking reliable, hard working, experienced construction concrete supervisor to work with our friendly team.","[<div class=""_1wkzzau0 a1msqi6m""><span class=""_1wkzzau0 a1msqi4y lnocuo0 lnocuo1 lnocuo21 _1d0g9qk4 lnocuo7""><a aria-label=""Limit results to Perth WA"" class=""_1wkzzau0 _1wkzzauf _1wkzzau0 _1wkzzauf _842p0a0 _842p0a2"" data-automation=""jobLocation"" href=""/jobs-in-construction/in-All-Perth-WA?salarytype=annual&amp;salaryrange=140000-145000"" rel=""nofollow"" tabindex=""-1"" target=""_self"" title=""Limit results to Perth WA"">Perth WA</a></span></div>, <div class=""_1wkzzau0 a1msqi6m""><div aria-label=""Salary: $100,000 – $120,000 per year"" class=""_1wkzzau0""><span class=""_1wkzzau0 a1msqi4y lnocuo0 lnocuo1 lnocuo21 _1d0g9qk4 lnocuo7"" data-automation=""jobSalary""><span class=""_1wkzzau0 _16v7pfz1 a1msqi4y a1msqi0 a1msqir _16v7pfz3"" style=""--_16v7pfz2:2"">$100,000 – $120,000 per year</span></span></div></div>]",2024-02-02,Construction - None,08/02/2024
414,https://www.seek.com.au//job/73547661?type=standard&ref=search-standalone,construction,Estimating,Civil Estimator (Renewables),Vikcon Construction Services Pty Ltd,-,140000.0,142500.0,145000.0,Brisbane QLD,Civil Estimator required for faced paced indusrty of the future.,"[<div class=""_1wkzzau0 a1msqi6m""><span class=""_1wkzzau0 a1msqi4y lnocuo0 lnocuo1 lnocuo21 _1d0g9qk4 lnocuo7""><a aria-label=""Limit results to Eagle Farm"" class=""_1wkzzau0 _1wkzzauf _1wkzzau0 _1wkzzauf _842p0a0 _842p0a2"" data-automation=""jobLocation"" href=""/jobs-in-construction/in-Eagle-Farm-QLD-4009?salarytype=annual&amp;salaryrange=140000-145000"" rel=""nofollow"" tabindex=""-1"" target=""_self"" title=""Limit results to Eagle Farm"">Eagle Farm</a>, <a aria-label=""Limit results to Brisbane QLD"" class=""_1wkzzau0 _1wkzzauf _1wkzzau0 _1wkzzauf _842p0a0 _842p0a2"" data-automation=""jobLocation"" href=""/jobs-in-construction/in-All-Brisbane-QLD?salarytype=annual&amp;salaryrange=140000-145000"" rel=""nofollow"" tabindex=""-1"" target=""_self"" title=""Limit results to Brisbane QLD"">Brisbane QLD</a></span></div>]",2024-02-06,Construction - None,08/02/2024
