,link,classification,category,title,company,salary,min_salary,average_salary,max_salary,location,description,entireDiv,date_posted,Category,Date
398,https://www.seek.com.au//job/73523390?type=standard&ref=search-standalone,trades services,"Fitters, Turners & Machinists",Diesel Fitter,JRT Construction & Equipment Hire,-,145000.0,147500.0,150000.0,"Rockhampton, Rockhampton & Capricorn Coast QLD","We currently have an opportunity for a Diesel Fitter to join our brand, available for an immediate start.","[<div class=""_1wkzzau0 a1msqi6m""><span class=""_1wkzzau0 a1msqi4y lnocuo0 lnocuo1 lnocuo21 _1d0g9qk4 lnocuo7""><a aria-label=""Limit results to Rockhampton"" class=""_1wkzzau0 _1wkzzauf _1wkzzau0 _1wkzzauf _842p0a0 _842p0a2"" data-automation=""jobLocation"" href=""/jobs-in-trades-services/in-Rockhampton-QLD-4700?salarytype=annual&amp;salaryrange=145000-150000"" rel=""nofollow"" tabindex=""-1"" target=""_self"" title=""Limit results to Rockhampton"">Rockhampton</a>, <a aria-label=""Limit results to Rockhampton &amp; Capricorn Coast QLD"" class=""_1wkzzau0 _1wkzzauf _1wkzzau0 _1wkzzauf _842p0a0 _842p0a2"" data-automation=""jobLocation"" href=""/jobs-in-trades-services/in-Rockhampton-&amp;-Capricorn-Coast-QLD?salarytype=annual&amp;salaryrange=145000-150000"" rel=""nofollow"" tabindex=""-1"" target=""_self"" title=""Limit results to Rockhampton &amp; Capricorn Coast QLD"">Rockhampton &amp; Capricorn Coast QLD</a></span></div>]",2024-02-05,Trades-services - None,08/02/2024
399,https://www.seek.com.au//job/73578556?type=standard&ref=search-standalone,trades services,Technicians,Facilities Supervisor/Technician (M4),FinXL IT Professional Services,-,145000.0,147500.0,150000.0,Sydney NSW,We are seeking a Facilities Supervisor/Technician to join our global leading Telco client. Great opportunity to take your career to the next level!,"[<div class=""_1wkzzau0 a1msqi6m""><span class=""_1wkzzau0 a1msqi4y lnocuo0 lnocuo1 lnocuo21 _1d0g9qk4 lnocuo7""><a aria-label=""Limit results to Sydney NSW"" class=""_1wkzzau0 _1wkzzauf _1wkzzau0 _1wkzzauf _842p0a0 _842p0a2"" data-automation=""jobLocation"" href=""/jobs-in-trades-services/in-All-Sydney-NSW?salarytype=annual&amp;salaryrange=145000-150000"" rel=""nofollow"" tabindex=""-1"" target=""_self"" title=""Limit results to Sydney NSW"">Sydney NSW</a></span></div>]",2024-02-07,Trades-services - None,08/02/2024
400,https://www.seek.com.au//job/73520971?type=standard&ref=search-standalone,trades services,Security Services,Senior Security Maintenance Officer,Department of Education,"$120,859 – $133,183 per year",120859.0,127021.0,133183.0,Sydney NSW,"You will lead a fantastic team responsible for the provision of high-quality, customer focused security maintenance services for NSW schools.","[<div class=""_1wkzzau0 a1msqi6m""><span class=""_1wkzzau0 a1msqi4y lnocuo0 lnocuo1 lnocuo21 _1d0g9qk4 lnocuo7""><a aria-label=""Limit results to Blacktown"" class=""_1wkzzau0 _1wkzzauf _1wkzzau0 _1wkzzauf _842p0a0 _842p0a2"" data-automation=""jobLocation"" href=""/jobs-in-trades-services/in-Blacktown-NSW-2148?salarytype=annual&amp;salaryrange=145000-150000"" rel=""nofollow"" tabindex=""-1"" target=""_self"" title=""Limit results to Blacktown"">Blacktown</a>, <a aria-label=""Limit results to Sydney NSW"" class=""_1wkzzau0 _1wkzzauf _1wkzzau0 _1wkzzauf _842p0a0 _842p0a2"" data-automation=""jobLocation"" href=""/jobs-in-trades-services/in-All-Sydney-NSW?salarytype=annual&amp;salaryrange=145000-150000"" rel=""nofollow"" tabindex=""-1"" target=""_self"" title=""Limit results to Sydney NSW"">Sydney NSW</a></span></div>, <div class=""_1wkzzau0 a1msqi6m""><div aria-label=""Salary: $120,859 – $133,183 per year"" class=""_1wkzzau0""><span class=""_1wkzzau0 a1msqi4y lnocuo0 lnocuo1 lnocuo21 _1d0g9qk4 lnocuo7"" data-automation=""jobSalary""><span class=""_1wkzzau0 _16v7pfz1 a1msqi4y a1msqi0 a1msqir _16v7pfz3"" style=""--_16v7pfz2:2"">$120,859 – $133,183 per year</span></span></div></div>]",2024-02-05,Trades-services - None,08/02/2024
401,https://www.seek.com.au//job/73452661?type=standard&ref=search-standalone,trades services,Maintenance & Handyperson Services,Maintenance Supervisor,Quest Personnel,-,145000.0,147500.0,150000.0,Melbourne VIC,Experienced Maintenance Supervisor needed. ASAP start available!,"[<div class=""_1wkzzau0 a1msqi6m""><span class=""_1wkzzau0 a1msqi4y lnocuo0 lnocuo1 lnocuo21 _1d0g9qk4 lnocuo7""><a aria-label=""Limit results to Mordialloc"" class=""_1wkzzau0 _1wkzzauf _1wkzzau0 _1wkzzauf _842p0a0 _842p0a2"" data-automation=""jobLocation"" href=""/jobs-in-trades-services/in-Mordialloc-VIC-3195?salarytype=annual&amp;salaryrange=145000-150000"" rel=""nofollow"" tabindex=""-1"" target=""_self"" title=""Limit results to Mordialloc"">Mordialloc</a>, <a aria-label=""Limit results to Melbourne VIC"" class=""_1wkzzau0 _1wkzzauf _1wkzzau0 _1wkzzauf _842p0a0 _842p0a2"" data-automation=""jobLocation"" href=""/jobs-in-trades-services/in-All-Melbourne-VIC?salarytype=annual&amp;salaryrange=145000-150000"" rel=""nofollow"" tabindex=""-1"" target=""_self"" title=""Limit results to Melbourne VIC"">Melbourne VIC</a></span></div>]",2024-02-01,Trades-services - None,08/02/2024
402,https://www.seek.com.au//job/73577265?type=standard&ref=search-standalone,trades services,Printing & Publishing Services,Production Manager (Lithographic Printing),Peacock Bros Pty Ltd,-,145000.0,147500.0,150000.0,Melbourne VIC,We are looking for a Production Manager with lithographic printing experience to join our team in our production department in Tullamarine.,"[<div class=""_1wkzzau0 a1msqi6m""><span class=""_1wkzzau0 a1msqi4y lnocuo0 lnocuo1 lnocuo21 _1d0g9qk4 lnocuo7""><a aria-label=""Limit results to Tullamarine"" class=""_1wkzzau0 _1wkzzauf _1wkzzau0 _1wkzzauf _842p0a0 _842p0a2"" data-automation=""jobLocation"" href=""/jobs-in-trades-services/in-Tullamarine-VIC-3043?salarytype=annual&amp;salaryrange=145000-150000"" rel=""nofollow"" tabindex=""-1"" target=""_self"" title=""Limit results to Tullamarine"">Tullamarine</a>, <a aria-label=""Limit results to Melbourne VIC"" class=""_1wkzzau0 _1wkzzauf _1wkzzau0 _1wkzzauf _842p0a0 _842p0a2"" data-automation=""jobLocation"" href=""/jobs-in-trades-services/in-All-Melbourne-VIC?salarytype=annual&amp;salaryrange=145000-150000"" rel=""nofollow"" tabindex=""-1"" target=""_self"" title=""Limit results to Melbourne VIC"">Melbourne VIC</a></span></div>]",2024-02-07,Trades-services - None,08/02/2024
403,https://www.seek.com.au//job/73620870?type=standout&ref=search-standalone,trades services,Automotive Trades,Colour Matcher,Parramatta Smash Repairs,-,145000.0,147500.0,150000.0,Sydney NSW,Colour Matcher required,"[<div class=""_1wkzzau0 a1msqi6m""><span class=""_1wkzzau0 a1msqi4y lnocuo0 lnocuo1 lnocuo21 _1d0g9qk4 lnocuo7""><a aria-label=""Limit results to North Parramatta"" class=""_1wkzzau0 _1wkzzauf _1wkzzau0 _1wkzzauf _842p0a0 _842p0a2"" data-automation=""jobLocation"" href=""/jobs-in-trades-services/in-North-Parramatta-NSW-2151?salarytype=annual&amp;salaryrange=145000-150000"" rel=""nofollow"" tabindex=""-1"" target=""_self"" title=""Limit results to North Parramatta"">North Parramatta</a>, <a aria-label=""Limit results to Sydney NSW"" class=""_1wkzzau0 _1wkzzauf _1wkzzau0 _1wkzzauf _842p0a0 _842p0a2"" data-automation=""jobLocation"" href=""/jobs-in-trades-services/in-All-Sydney-NSW?salarytype=annual&amp;salaryrange=145000-150000"" rel=""nofollow"" tabindex=""-1"" target=""_self"" title=""Limit results to Sydney NSW"">Sydney NSW</a></span></div>]",,Trades-services - None,08/02/2024
404,https://www.seek.com.au//job/73540916?type=standout&ref=search-standalone,trades services,Welders & Boilermakers,Afternoon Boilermakers,Backam Group,$60 - $61 p.h. + Penalty Rates,108000.0,108900.0,109800.0,Newcastle NSW,Backam Group is currently seeking multiple experienced Boilermakers to join our team in Tomago on afternoon shift for an ASAP Start!,"[<div class=""_1wkzzau0 a1msqi6m""><span class=""_1wkzzau0 a1msqi4y lnocuo0 lnocuo1 lnocuo21 _1d0g9qk4 lnocuo7""><a aria-label=""Limit results to Tomago"" class=""_1wkzzau0 _1wkzzauf _1wkzzau0 _1wkzzauf _842p0a0 _842p0a2"" data-automation=""jobLocation"" href=""/jobs-in-trades-services/in-Tomago-NSW-2322?salarytype=annual&amp;salaryrange=145000-150000"" rel=""nofollow"" tabindex=""-1"" target=""_self"" title=""Limit results to Tomago"">Tomago</a>, <a aria-label=""Limit results to Newcastle, Maitland &amp; Hunter NSW"" class=""_1wkzzau0 _1wkzzauf _1wkzzau0 _1wkzzauf _842p0a0 _842p0a2"" data-automation=""jobLocation"" href=""/jobs-in-trades-services/in-Newcastle,-Maitland-&amp;-Hunter-NSW?salarytype=annual&amp;salaryrange=145000-150000"" rel=""nofollow"" tabindex=""-1"" target=""_self"" title=""Limit results to Newcastle, Maitland &amp; Hunter NSW"">Newcastle, Maitland &amp; Hunter NSW</a></span></div>, <div class=""_1wkzzau0 a1msqi6m""><div aria-label=""Salary: $60 - $61 p.h. + Penalty Rates"" class=""_1wkzzau0""><span class=""_1wkzzau0 a1msqi4y lnocuo0 lnocuo1 lnocuo21 _1d0g9qk4 lnocuo7"" data-automation=""jobSalary""><span class=""_1wkzzau0 _16v7pfz1 a1msqi4y a1msqi0 a1msqir _16v7pfz3"" style=""--_16v7pfz2:2"">$60 - $61 p.h. + Penalty Rates</span></span></div></div>]",2024-02-06,Trades-services - None,08/02/2024
405,https://www.seek.com.au//job/73575516?type=standout&ref=search-standalone,trades services,Air Conditioning & Refrigeration,HVAC Technician,Intura,-,145000.0,147500.0,150000.0,"Gladstone, Gladstone & Central QLD","Intura are seeking a HVAC Technician for Field Operations & Maintenance work in the Coal Seam Gas Industry. Reputable company, great culture....","[<div class=""_1wkzzau0 a1msqi6m""><span class=""_1wkzzau0 a1msqi4y lnocuo0 lnocuo1 lnocuo21 _1d0g9qk4 lnocuo7""><a aria-label=""Limit results to Gladstone"" class=""_1wkzzau0 _1wkzzauf _1wkzzau0 _1wkzzauf _842p0a0 _842p0a2"" data-automation=""jobLocation"" href=""/jobs-in-trades-services/in-Gladstone-QLD-4680?salarytype=annual&amp;salaryrange=145000-150000"" rel=""nofollow"" tabindex=""-1"" target=""_self"" title=""Limit results to Gladstone"">Gladstone</a>, <a aria-label=""Limit results to Gladstone &amp; Central QLD"" class=""_1wkzzau0 _1wkzzauf _1wkzzau0 _1wkzzauf _842p0a0 _842p0a2"" data-automation=""jobLocation"" href=""/jobs-in-trades-services/in-Gladstone-&amp;-Central-QLD?salarytype=annual&amp;salaryrange=145000-150000"" rel=""nofollow"" tabindex=""-1"" target=""_self"" title=""Limit results to Gladstone &amp; Central QLD"">Gladstone &amp; Central QLD</a></span></div>]",2024-02-07,Trades-services - None,08/02/2024
406,https://www.seek.com.au//job/73528152?type=standout&ref=search-standalone,trades services,Electricians,Mobile Plant Electricians | FIFO to WA,Mader Group,$75 – $85 per hour,135000.0,144000.0,153000.0,Brisbane QLD,Mader are seeking experienced Mobile Plant Electricians to join our team in the Pilbara on an even time roster.,"[<div class=""_1wkzzau0 a1msqi6m""><span class=""_1wkzzau0 a1msqi4y lnocuo0 lnocuo1 lnocuo21 _1d0g9qk4 lnocuo7""><a aria-label=""Limit results to Brisbane QLD"" class=""_1wkzzau0 _1wkzzauf _1wkzzau0 _1wkzzauf _842p0a0 _842p0a2"" data-automation=""jobLocation"" href=""/jobs-in-trades-services/in-All-Brisbane-QLD?salarytype=annual&amp;salaryrange=145000-150000"" rel=""nofollow"" tabindex=""-1"" target=""_self"" title=""Limit results to Brisbane QLD"">Brisbane QLD</a></span></div>, <div class=""_1wkzzau0 a1msqi6m""><div aria-label=""Salary: $75 – $85 per hour"" class=""_1wkzzau0""><span class=""_1wkzzau0 a1msqi4y lnocuo0 lnocuo1 lnocuo21 _1d0g9qk4 lnocuo7"" data-automation=""jobSalary""><span class=""_1wkzzau0 _16v7pfz1 a1msqi4y a1msqi0 a1msqir _16v7pfz3"" style=""--_16v7pfz2:2"">$75 – $85 per hour</span></span></div></div>]",2024-02-05,Trades-services - None,08/02/2024
407,https://www.seek.com.au//job/73578912?type=standout&ref=search-standalone,trades services,Building Trades,Render Contractors,Hickinbotham,-,145000.0,147500.0,150000.0,Adelaide SA,"Hickinbotham, SA’s largest & longest established builder, seeks experienced & high calibre Render Contractors to join their dynamic team. Apply now!","[<div class=""_1wkzzau0 a1msqi6m""><span class=""_1wkzzau0 a1msqi4y lnocuo0 lnocuo1 lnocuo21 _1d0g9qk4 lnocuo7""><a aria-label=""Limit results to Adelaide SA"" class=""_1wkzzau0 _1wkzzauf _1wkzzau0 _1wkzzauf _842p0a0 _842p0a2"" data-automation=""jobLocation"" href=""/jobs-in-trades-services/in-All-Adelaide-SA?salarytype=annual&amp;salaryrange=145000-150000"" rel=""nofollow"" tabindex=""-1"" target=""_self"" title=""Limit results to Adelaide SA"">Adelaide SA</a></span></div>]",2024-02-07,Trades-services - None,08/02/2024
408,https://www.seek.com.au//job/73442260?type=standard&ref=search-standalone,trades services,Electricians,Electrician (South Brisbane),LiVE Electrical & Air Conditioning,"$90,000 – $120,000 per year",90000.0,105000.0,120000.0,Brisbane QLD,Live Services Group is seeking an accredited electrician to join our awesome team!,"[<div class=""_1wkzzau0 a1msqi6m""><span class=""_1wkzzau0 a1msqi4y lnocuo0 lnocuo1 lnocuo21 _1d0g9qk4 lnocuo7""><a aria-label=""Limit results to South Brisbane"" class=""_1wkzzau0 _1wkzzauf _1wkzzau0 _1wkzzauf _842p0a0 _842p0a2"" data-automation=""jobLocation"" href=""/jobs-in-trades-services/in-South-Brisbane-QLD-4101?salarytype=annual&amp;salaryrange=145000-150000"" rel=""nofollow"" tabindex=""-1"" target=""_self"" title=""Limit results to South Brisbane"">South Brisbane</a>, <a aria-label=""Limit results to Brisbane QLD"" class=""_1wkzzau0 _1wkzzauf _1wkzzau0 _1wkzzauf _842p0a0 _842p0a2"" data-automation=""jobLocation"" href=""/jobs-in-trades-services/in-All-Brisbane-QLD?salarytype=annual&amp;salaryrange=145000-150000"" rel=""nofollow"" tabindex=""-1"" target=""_self"" title=""Limit results to Brisbane QLD"">Brisbane QLD</a></span></div>, <div class=""_1wkzzau0 a1msqi6m""><div aria-label=""Salary: $90,000 – $120,000 per year"" class=""_1wkzzau0""><span class=""_1wkzzau0 a1msqi4y lnocuo0 lnocuo1 lnocuo21 _1d0g9qk4 lnocuo7"" data-automation=""jobSalary""><span class=""_1wkzzau0 _16v7pfz1 a1msqi4y a1msqi0 a1msqir _16v7pfz3"" style=""--_16v7pfz2:2"">$90,000 – $120,000 per year</span></span></div></div>]",2024-02-01,Trades-services - None,08/02/2024
409,https://www.seek.com.au//job/73462107?type=standard&ref=search-standalone,trades services,"Fitters, Turners & Machinists",Fitter & Turner,Wilmar Sugar Pty Ltd,-,145000.0,147500.0,150000.0,"Proserpine, Northern QLD",Great opportunity for a Fitter Turner based in Proserpine with Airlie Beach and the Whitsunday Islands as your backyard!,"[<div class=""_1wkzzau0 a1msqi6m""><span class=""_1wkzzau0 a1msqi4y lnocuo0 lnocuo1 lnocuo21 _1d0g9qk4 lnocuo7""><a aria-label=""Limit results to Proserpine"" class=""_1wkzzau0 _1wkzzauf _1wkzzau0 _1wkzzauf _842p0a0 _842p0a2"" data-automation=""jobLocation"" href=""/jobs-in-trades-services/in-Proserpine-QLD-4800?salarytype=annual&amp;salaryrange=145000-150000"" rel=""nofollow"" tabindex=""-1"" target=""_self"" title=""Limit results to Proserpine"">Proserpine</a>, <a aria-label=""Limit results to Northern QLD"" class=""_1wkzzau0 _1wkzzauf _1wkzzau0 _1wkzzauf _842p0a0 _842p0a2"" data-automation=""jobLocation"" href=""/jobs-in-trades-services/in-Northern-QLD?salarytype=annual&amp;salaryrange=145000-150000"" rel=""nofollow"" tabindex=""-1"" target=""_self"" title=""Limit results to Northern QLD"">Northern QLD</a></span></div>]",2024-02-01,Trades-services - None,08/02/2024
410,https://www.seek.com.au//job/73518968?type=standard&ref=search-standalone,trades services,"Fitters, Turners & Machinists",Mechanical Fitters - Perth,Aurora Resourcing and Talent,-,145000.0,147500.0,150000.0,Perth WA,Mechanical Fitters for Local Perth Work. Australian and Overseas Trade Certificates recognised,"[<div class=""_1wkzzau0 a1msqi6m""><span class=""_1wkzzau0 a1msqi4y lnocuo0 lnocuo1 lnocuo21 _1d0g9qk4 lnocuo7""><a aria-label=""Limit results to Perth WA"" class=""_1wkzzau0 _1wkzzauf _1wkzzau0 _1wkzzauf _842p0a0 _842p0a2"" data-automation=""jobLocation"" href=""/jobs-in-trades-services/in-All-Perth-WA?salarytype=annual&amp;salaryrange=145000-150000"" rel=""nofollow"" tabindex=""-1"" target=""_self"" title=""Limit results to Perth WA"">Perth WA</a></span></div>]",2024-02-05,Trades-services - None,08/02/2024
411,https://www.seek.com.au//job/73387414?type=standard&ref=search-standalone,trades services,Automotive Trades,Auto Electrician - Automotive Industry,Motor Staff,To $110k + Super,145000.0,147500.0,150000.0,Brisbane QLD,"Highly regarded vehicle mounted warning systems supplier seeks an Auto Electrician or Apprentice for a well rewarded, varied and interesting role","[<div class=""_1wkzzau0 a1msqi6m""><span class=""_1wkzzau0 a1msqi4y lnocuo0 lnocuo1 lnocuo21 _1d0g9qk4 lnocuo7""><a aria-label=""Limit results to Brisbane QLD"" class=""_1wkzzau0 _1wkzzauf _1wkzzau0 _1wkzzauf _842p0a0 _842p0a2"" data-automation=""jobLocation"" href=""/jobs-in-trades-services/in-All-Brisbane-QLD?salarytype=annual&amp;salaryrange=145000-150000"" rel=""nofollow"" tabindex=""-1"" target=""_self"" title=""Limit results to Brisbane QLD"">Brisbane QLD</a></span></div>, <div class=""_1wkzzau0 a1msqi6m""><div aria-label=""Salary: To $110k + Super"" class=""_1wkzzau0""><span class=""_1wkzzau0 a1msqi4y lnocuo0 lnocuo1 lnocuo21 _1d0g9qk4 lnocuo7"" data-automation=""jobSalary""><span class=""_1wkzzau0 _16v7pfz1 a1msqi4y a1msqi0 a1msqir _16v7pfz3"" style=""--_16v7pfz2:2"">To $110k + Super</span></span></div></div>]",2024-01-30,Trades-services - None,08/02/2024
412,https://www.seek.com.au//job/73462109?type=standard&ref=search-standalone,trades services,"Fitters, Turners & Machinists",Fitter & Turner,Wilmar Sugar Pty Ltd,-,145000.0,147500.0,150000.0,"Mount Isa, Western QLD",Great opportunity for a Fitter Turner based in Proserpine with Airlie Beach and the Whitsunday Islands as your backyard!,"[<div class=""_1wkzzau0 a1msqi6m""><span class=""_1wkzzau0 a1msqi4y lnocuo0 lnocuo1 lnocuo21 _1d0g9qk4 lnocuo7""><a aria-label=""Limit results to Mount Isa"" class=""_1wkzzau0 _1wkzzauf _1wkzzau0 _1wkzzauf _842p0a0 _842p0a2"" data-automation=""jobLocation"" href=""/jobs-in-trades-services/in-Mount-Isa-QLD-4825?salarytype=annual&amp;salaryrange=145000-150000"" rel=""nofollow"" tabindex=""-1"" target=""_self"" title=""Limit results to Mount Isa"">Mount Isa</a>, <a aria-label=""Limit results to Western QLD"" class=""_1wkzzau0 _1wkzzauf _1wkzzau0 _1wkzzauf _842p0a0 _842p0a2"" data-automation=""jobLocation"" href=""/jobs-in-trades-services/in-Western-QLD?salarytype=annual&amp;salaryrange=145000-150000"" rel=""nofollow"" tabindex=""-1"" target=""_self"" title=""Limit results to Western QLD"">Western QLD</a></span></div>]",2024-02-01,Trades-services - None,08/02/2024
413,https://www.seek.com.au//job/73448223?type=standout&ref=search-standalone,trades services,Technicians,Service Technician (VIC),Evo Industries Australia Pty Ltd,-,145000.0,147500.0,150000.0,Melbourne VIC,Excellent role for a Service Technician seeking career advancement / higher level responsibilities in the rapidly growing bioenergy solutions market.,"[<div class=""_1wkzzau0 a1msqi6m""><span class=""_1wkzzau0 a1msqi4y lnocuo0 lnocuo1 lnocuo21 _1d0g9qk4 lnocuo7""><a aria-label=""Limit results to Melbourne VIC"" class=""_1wkzzau0 _1wkzzauf _1wkzzau0 _1wkzzauf _842p0a0 _842p0a2"" data-automation=""jobLocation"" href=""/jobs-in-trades-services/in-All-Melbourne-VIC?salarytype=annual&amp;salaryrange=145000-150000"" rel=""nofollow"" tabindex=""-1"" target=""_self"" title=""Limit results to Melbourne VIC"">Melbourne VIC</a></span></div>]",2024-02-01,Trades-services - None,08/02/2024
414,https://www.seek.com.au//job/73462108?type=standard&ref=search-standalone,trades services,"Fitters, Turners & Machinists",Fitter & Turner,Wilmar Sugar Pty Ltd,-,145000.0,147500.0,150000.0,"Mackay, Mackay & Coalfields QLD",Great opportunity for a Fitter Turner based in Proserpine with Airlie Beach and the Whitsunday Islands as your backyard!,"[<div class=""_1wkzzau0 a1msqi6m""><span class=""_1wkzzau0 a1msqi4y lnocuo0 lnocuo1 lnocuo21 _1d0g9qk4 lnocuo7""><a aria-label=""Limit results to Mackay"" class=""_1wkzzau0 _1wkzzauf _1wkzzau0 _1wkzzauf _842p0a0 _842p0a2"" data-automation=""jobLocation"" href=""/jobs-in-trades-services/in-Mackay-QLD-4740?salarytype=annual&amp;salaryrange=145000-150000"" rel=""nofollow"" tabindex=""-1"" target=""_self"" title=""Limit results to Mackay"">Mackay</a>, <a aria-label=""Limit results to Mackay &amp; Coalfields QLD"" class=""_1wkzzau0 _1wkzzauf _1wkzzau0 _1wkzzauf _842p0a0 _842p0a2"" data-automation=""jobLocation"" href=""/jobs-in-trades-services/in-Mackay-&amp;-Coalfields-QLD?salarytype=annual&amp;salaryrange=145000-150000"" rel=""nofollow"" tabindex=""-1"" target=""_self"" title=""Limit results to Mackay &amp; Coalfields QLD"">Mackay &amp; Coalfields QLD</a></span></div>]",2024-02-01,Trades-services - None,08/02/2024
415,https://www.seek.com.au//job/73198154?type=standout&ref=search-standalone,trades services,Maintenance & Handyperson Services,Handyman,Builtmain Complex Care,$50 – $70 per hour,90000.0,108000.0,126000.0,Sydney NSW,This is a rewarding role with a lot of flexibility. Reach out If you feel you meet the above criteria,"[<div class=""_1wkzzau0 a1msqi6m""><span class=""_1wkzzau0 a1msqi4y lnocuo0 lnocuo1 lnocuo21 _1d0g9qk4 lnocuo7""><a aria-label=""Limit results to Sydney NSW"" class=""_1wkzzau0 _1wkzzauf _1wkzzau0 _1wkzzauf _842p0a0 _842p0a2"" data-automation=""jobLocation"" href=""/jobs-in-trades-services/in-All-Sydney-NSW?salarytype=annual&amp;salaryrange=145000-150000"" rel=""nofollow"" tabindex=""-1"" target=""_self"" title=""Limit results to Sydney NSW"">Sydney NSW</a></span></div>, <div class=""_1wkzzau0 a1msqi6m""><div aria-label=""Salary: $50 – $70 per hour"" class=""_1wkzzau0""><span class=""_1wkzzau0 a1msqi4y lnocuo0 lnocuo1 lnocuo21 _1d0g9qk4 lnocuo7"" data-automation=""jobSalary""><span class=""_1wkzzau0 _16v7pfz1 a1msqi4y a1msqi0 a1msqir _16v7pfz3"" style=""--_16v7pfz2:2"">$50 – $70 per hour</span></span></div></div>]",2024-01-22,Trades-services - None,08/02/2024
416,https://www.seek.com.au//job/73416993?type=standout&ref=search-standalone,trades services,Welders & Boilermakers,Field Boilermakers - Monday to Thursday & Monday to Friday roles,MMS Engineering,"$130,000 – $150,000 per year",130000.0,140000.0,150000.0,Newcastle NSW,"MMS is seeking boilermakers to fill Monday to Friday roles in our growing field service team. Looking for a great team who values you, apply now!","[<div class=""_1wkzzau0 a1msqi6m""><span class=""_1wkzzau0 a1msqi4y lnocuo0 lnocuo1 lnocuo21 _1d0g9qk4 lnocuo7""><a aria-label=""Limit results to Muswellbrook"" class=""_1wkzzau0 _1wkzzauf _1wkzzau0 _1wkzzauf _842p0a0 _842p0a2"" data-automation=""jobLocation"" href=""/jobs-in-trades-services/in-Muswellbrook-NSW-2333?salarytype=annual&amp;salaryrange=145000-150000"" rel=""nofollow"" tabindex=""-1"" target=""_self"" title=""Limit results to Muswellbrook"">Muswellbrook</a>, <a aria-label=""Limit results to Newcastle, Maitland &amp; Hunter NSW"" class=""_1wkzzau0 _1wkzzauf _1wkzzau0 _1wkzzauf _842p0a0 _842p0a2"" data-automation=""jobLocation"" href=""/jobs-in-trades-services/in-Newcastle,-Maitland-&amp;-Hunter-NSW?salarytype=annual&amp;salaryrange=145000-150000"" rel=""nofollow"" tabindex=""-1"" target=""_self"" title=""Limit results to Newcastle, Maitland &amp; Hunter NSW"">Newcastle, Maitland &amp; Hunter NSW</a></span></div>, <div class=""_1wkzzau0 a1msqi6m""><div aria-label=""Salary: $130,000 – $150,000 per year"" class=""_1wkzzau0""><span class=""_1wkzzau0 a1msqi4y lnocuo0 lnocuo1 lnocuo21 _1d0g9qk4 lnocuo7"" data-automation=""jobSalary""><span class=""_1wkzzau0 _16v7pfz1 a1msqi4y a1msqi0 a1msqir _16v7pfz3"" style=""--_16v7pfz2:2"">$130,000 – $150,000 per year</span></span></div></div>]",2024-01-31,Trades-services - None,08/02/2024
417,https://www.seek.com.au//job/73534667?type=standout&ref=search-standalone,trades services,Other,"Field Service Plant Mechanics, Heavy Diesel Mechanics & Agricultural Mechanics",WesTrac Pty Ltd,Hourly rate from $52 + additional allowances + OT,145000.0,147500.0,150000.0,Other,"Are you looking for flexibility, 5 weeks annual leave, allowances and to work in a high performing team? Join our WesTrac Tamworth team today!","[<div class=""_1wkzzau0 a1msqi6m""><span class=""_1wkzzau0 a1msqi4y lnocuo0 lnocuo1 lnocuo21 _1d0g9qk4 lnocuo7""><a aria-label=""Limit results to Tamworth"" class=""_1wkzzau0 _1wkzzauf _1wkzzau0 _1wkzzauf _842p0a0 _842p0a2"" data-automation=""jobLocation"" href=""/jobs-in-trades-services/in-Tamworth-NSW-2340?salarytype=annual&amp;salaryrange=145000-150000"" rel=""nofollow"" tabindex=""-1"" target=""_self"" title=""Limit results to Tamworth"">Tamworth</a>, <a aria-label=""Limit results to Tamworth &amp; North West NSW"" class=""_1wkzzau0 _1wkzzauf _1wkzzau0 _1wkzzauf _842p0a0 _842p0a2"" data-automation=""jobLocation"" href=""/jobs-in-trades-services/in-Tamworth-&amp;-North-West-NSW?salarytype=annual&amp;salaryrange=145000-150000"" rel=""nofollow"" tabindex=""-1"" target=""_self"" title=""Limit results to Tamworth &amp; North West NSW"">Tamworth &amp; North West NSW</a></span></div>, <div class=""_1wkzzau0 a1msqi6m""><div aria-label=""Salary: Hourly rate from $52 + additional allowances + OT"" class=""_1wkzzau0""><span class=""_1wkzzau0 a1msqi4y lnocuo0 lnocuo1 lnocuo21 _1d0g9qk4 lnocuo7"" data-automation=""jobSalary""><span class=""_1wkzzau0 _16v7pfz1 a1msqi4y a1msqi0 a1msqir _16v7pfz3"" style=""--_16v7pfz2:2"">Hourly rate from $52 + additional allowances + OT</span></span></div></div>]",2024-02-05,Trades-services - None,08/02/2024
