,link,classification,category,title,company,salary,min_salary,average_salary,max_salary,location,description,entireDiv,date_posted,Category,Date
0,https://www.seek.com.au//job/73618017?type=promoted&ref=search-standalone,design architecture,Web & Interaction Design,Mid/Senior UX Designer,Thought Collaborative Pty Ltd,-,140000.0,142500.0,145000.0,Melbourne VIC,You'll be joining an initiative re-defining the way they deliver their own digital self serve experience.,"[<div class=""_1wkzzau0 a1msqi6m""><span class=""_1wkzzau0 a1msqi4y lnocuo0 lnocuo1 lnocuo21 _1d0g9qk4 lnocuo7""><a aria-label=""Limit results to Melbourne VIC"" class=""_1wkzzau0 _1wkzzauf _1wkzzau0 _1wkzzauf _842p0a0 _842p0a2"" data-automation=""jobLocation"" href=""/jobs-in-design-architecture/in-All-Melbourne-VIC?salarytype=annual&amp;salaryrange=140000-145000"" rel=""nofollow"" tabindex=""-1"" target=""_self"" title=""Limit results to Melbourne VIC"">Melbourne VIC</a></span></div>]",,Design-architecture - None,08/02/2024
1,https://www.seek.com.au//job/73355790?type=promoted&ref=search-standalone,design architecture,Architecture,Senior Architect,Hames Sharley,-,140000.0,142500.0,145000.0,Darwin NT,"Enable communities to flourish through researching, planning, designing, documenting, and administering building contracts at the highest standard.","[<div class=""_1wkzzau0 a1msqi6m""><span class=""_1wkzzau0 a1msqi4y lnocuo0 lnocuo1 lnocuo21 _1d0g9qk4 lnocuo7""><a aria-label=""Limit results to Darwin NT"" class=""_1wkzzau0 _1wkzzauf _1wkzzau0 _1wkzzauf _842p0a0 _842p0a2"" data-automation=""jobLocation"" href=""/jobs-in-design-architecture/in-All-Darwin-NT?salarytype=annual&amp;salaryrange=140000-145000"" rel=""nofollow"" tabindex=""-1"" target=""_self"" title=""Limit results to Darwin NT"">Darwin NT</a></span></div>]",,Design-architecture - None,08/02/2024
2,https://www.seek.com.au//job/73576302?type=standard&ref=search-standalone,design architecture,Architecture,Architect Part Time,BTM Constructions,-,140000.0,142500.0,145000.0,Sydney NSW,"Part Time Architect Role, Construction Experience + Great Company Culture.","[<div class=""_1wkzzau0 a1msqi6m""><span class=""_1wkzzau0 a1msqi4y lnocuo0 lnocuo1 lnocuo21 _1d0g9qk4 lnocuo7""><a aria-label=""Limit results to Hornsby"" class=""_1wkzzau0 _1wkzzauf _1wkzzau0 _1wkzzauf _842p0a0 _842p0a2"" data-automation=""jobLocation"" href=""/jobs-in-design-architecture/in-Hornsby-NSW-2077?salarytype=annual&amp;salaryrange=140000-145000"" rel=""nofollow"" tabindex=""-1"" target=""_self"" title=""Limit results to Hornsby"">Hornsby</a>, <a aria-label=""Limit results to Sydney NSW"" class=""_1wkzzau0 _1wkzzauf _1wkzzau0 _1wkzzauf _842p0a0 _842p0a2"" data-automation=""jobLocation"" href=""/jobs-in-design-architecture/in-All-Sydney-NSW?salarytype=annual&amp;salaryrange=140000-145000"" rel=""nofollow"" tabindex=""-1"" target=""_self"" title=""Limit results to Sydney NSW"">Sydney NSW</a></span></div>]",2024-02-07,Design-architecture - None,08/02/2024
3,https://www.seek.com.au//job/73551119?type=standout&ref=search-standalone,design architecture,Architecture,Architectural and Retail Design Manager,Peregrine Corporation,-,140000.0,142500.0,145000.0,Adelaide SA,The Architectural and Retail Design Manager will manage the architectural design process within the Peregrine retail network.,"[<div class=""_1wkzzau0 a1msqi6m""><span class=""_1wkzzau0 a1msqi4y lnocuo0 lnocuo1 lnocuo21 _1d0g9qk4 lnocuo7""><a aria-label=""Limit results to Norwood"" class=""_1wkzzau0 _1wkzzauf _1wkzzau0 _1wkzzauf _842p0a0 _842p0a2"" data-automation=""jobLocation"" href=""/jobs-in-design-architecture/in-Norwood-SA-5067?salarytype=annual&amp;salaryrange=140000-145000"" rel=""nofollow"" tabindex=""-1"" target=""_self"" title=""Limit results to Norwood"">Norwood</a>, <a aria-label=""Limit results to Adelaide SA"" class=""_1wkzzau0 _1wkzzauf _1wkzzau0 _1wkzzauf _842p0a0 _842p0a2"" data-automation=""jobLocation"" href=""/jobs-in-design-architecture/in-All-Adelaide-SA?salarytype=annual&amp;salaryrange=140000-145000"" rel=""nofollow"" tabindex=""-1"" target=""_self"" title=""Limit results to Adelaide SA"">Adelaide SA</a></span></div>]",2024-02-06,Design-architecture - None,08/02/2024
4,https://www.seek.com.au//job/73573900?type=standard&ref=search-standalone,design architecture,Graphic Design,Design Consultant /drafting METAL ART laser cut screen and sculpture studio,Entanglements,-,140000.0,142500.0,145000.0,Melbourne VIC,Immediate start,"[<div class=""_1wkzzau0 a1msqi6m""><span class=""_1wkzzau0 a1msqi4y lnocuo0 lnocuo1 lnocuo21 _1d0g9qk4 lnocuo7""><a aria-label=""Limit results to Ormond"" class=""_1wkzzau0 _1wkzzauf _1wkzzau0 _1wkzzauf _842p0a0 _842p0a2"" data-automation=""jobLocation"" href=""/jobs-in-design-architecture/in-Ormond-VIC-3204?salarytype=annual&amp;salaryrange=140000-145000"" rel=""nofollow"" tabindex=""-1"" target=""_self"" title=""Limit results to Ormond"">Ormond</a>, <a aria-label=""Limit results to Melbourne VIC"" class=""_1wkzzau0 _1wkzzauf _1wkzzau0 _1wkzzauf _842p0a0 _842p0a2"" data-automation=""jobLocation"" href=""/jobs-in-design-architecture/in-All-Melbourne-VIC?salarytype=annual&amp;salaryrange=140000-145000"" rel=""nofollow"" tabindex=""-1"" target=""_self"" title=""Limit results to Melbourne VIC"">Melbourne VIC</a></span></div>]",,Design-architecture - None,08/02/2024
5,https://www.seek.com.au//job/73542350?type=standout&ref=search-standalone,design architecture,Architecture,Design Manager,Co. Recruit,Competitive remuneration on offer,140000.0,142500.0,145000.0,Brisbane QLD,"Key design role with highly regarded, award winning Developer Builder.","[<div class=""_1wkzzau0 a1msqi6m""><span class=""_1wkzzau0 a1msqi4y lnocuo0 lnocuo1 lnocuo21 _1d0g9qk4 lnocuo7""><a aria-label=""Limit results to Brisbane QLD"" class=""_1wkzzau0 _1wkzzauf _1wkzzau0 _1wkzzauf _842p0a0 _842p0a2"" data-automation=""jobLocation"" href=""/jobs-in-design-architecture/in-All-Brisbane-QLD?salarytype=annual&amp;salaryrange=140000-145000"" rel=""nofollow"" tabindex=""-1"" target=""_self"" title=""Limit results to Brisbane QLD"">Brisbane QLD</a></span></div>, <div class=""_1wkzzau0 a1msqi6m""><div aria-label=""Salary: Competitive remuneration on offer"" class=""_1wkzzau0""><span class=""_1wkzzau0 a1msqi4y lnocuo0 lnocuo1 lnocuo21 _1d0g9qk4 lnocuo7"" data-automation=""jobSalary""><span class=""_1wkzzau0 _16v7pfz1 a1msqi4y a1msqi0 a1msqir _16v7pfz3"" style=""--_16v7pfz2:2"">Competitive remuneration on offer</span></span></div></div>]",2024-02-06,Design-architecture - None,08/02/2024
6,https://www.seek.com.au//job/73304848?type=standard&ref=search-standalone,design architecture,Architecture,Graduate of Architecture/Architects - Working Holiday Visa,Bespoke Careers,$40 – $60 p/h + Super,72000.0,90000.0,108000.0,Sydney NSW,A number of exciting opportunities available for Working Holiday Visa Architects and Graduate Architects to join some of Australia's top-tier studios,"[<div class=""_1wkzzau0 a1msqi6m""><span class=""_1wkzzau0 a1msqi4y lnocuo0 lnocuo1 lnocuo21 _1d0g9qk4 lnocuo7""><a aria-label=""Limit results to Sydney NSW"" class=""_1wkzzau0 _1wkzzauf _1wkzzau0 _1wkzzauf _842p0a0 _842p0a2"" data-automation=""jobLocation"" href=""/jobs-in-design-architecture/in-All-Sydney-NSW?salarytype=annual&amp;salaryrange=140000-145000"" rel=""nofollow"" tabindex=""-1"" target=""_self"" title=""Limit results to Sydney NSW"">Sydney NSW</a></span></div>, <div class=""_1wkzzau0 a1msqi6m""><div aria-label=""Salary: $40 – $60 p/h + Super"" class=""_1wkzzau0""><span class=""_1wkzzau0 a1msqi4y lnocuo0 lnocuo1 lnocuo21 _1d0g9qk4 lnocuo7"" data-automation=""jobSalary""><span class=""_1wkzzau0 _16v7pfz1 a1msqi4y a1msqi0 a1msqir _16v7pfz3"" style=""--_16v7pfz2:2"">$40 – $60 p/h + Super</span></span></div></div>]",2024-01-25,Design-architecture - None,08/02/2024
7,https://www.seek.com.au//job/73611682?type=standout&ref=search-standalone,design architecture,Architectural Drafting,Residential Designer / Draftsperson,Deacon Recruitment,"100,000 - 120,000 - 2 days WFH available!",140000.0,142500.0,145000.0,Gold Coast QLD,Seeking a motivated REVIT Residential Designer to join industry leading Developer and Builder. Employer of choice! WFH 2 days per week!,"[<div class=""_1wkzzau0 a1msqi6m""><span class=""_1wkzzau0 a1msqi4y lnocuo0 lnocuo1 lnocuo21 _1d0g9qk4 lnocuo7""><a aria-label=""Limit results to Gold Coast QLD"" class=""_1wkzzau0 _1wkzzauf _1wkzzau0 _1wkzzauf _842p0a0 _842p0a2"" data-automation=""jobLocation"" href=""/jobs-in-design-architecture/in-All-Gold-Coast-QLD?salarytype=annual&amp;salaryrange=140000-145000"" rel=""nofollow"" tabindex=""-1"" target=""_self"" title=""Limit results to Gold Coast QLD"">Gold Coast QLD</a></span></div>, <div class=""_1wkzzau0 a1msqi6m""><div aria-label=""Salary: 100,000 - 120,000 - 2 days WFH available!"" class=""_1wkzzau0""><span class=""_1wkzzau0 a1msqi4y lnocuo0 lnocuo1 lnocuo21 _1d0g9qk4 lnocuo7"" data-automation=""jobSalary""><span class=""_1wkzzau0 _16v7pfz1 a1msqi4y a1msqi0 a1msqir _16v7pfz3"" style=""--_16v7pfz2:2"">100,000 - 120,000 - 2 days WFH available!</span></span></div></div>]",,Design-architecture - None,08/02/2024
8,https://www.seek.com.au//job/73204904?type=standout&ref=search-standalone,design architecture,Architecture,Architect,ROSSI ARCHITECTS,"$100,000 – $125,000 per year",100000.0,112500.0,125000.0,Darwin NT,"Rossi Architects are on the lookout for a highly talented and motivated architect to join our boutique studio, working on a range of dynamic projects","[<div class=""_1wkzzau0 a1msqi6m""><span class=""_1wkzzau0 a1msqi4y lnocuo0 lnocuo1 lnocuo21 _1d0g9qk4 lnocuo7""><a aria-label=""Limit results to Darwin NT"" class=""_1wkzzau0 _1wkzzauf _1wkzzau0 _1wkzzauf _842p0a0 _842p0a2"" data-automation=""jobLocation"" href=""/jobs-in-design-architecture/in-All-Darwin-NT?salarytype=annual&amp;salaryrange=140000-145000"" rel=""nofollow"" tabindex=""-1"" target=""_self"" title=""Limit results to Darwin NT"">Darwin NT</a></span></div>, <div class=""_1wkzzau0 a1msqi6m""><div aria-label=""Salary: $100,000 – $125,000 per year"" class=""_1wkzzau0""><span class=""_1wkzzau0 a1msqi4y lnocuo0 lnocuo1 lnocuo21 _1d0g9qk4 lnocuo7"" data-automation=""jobSalary""><span class=""_1wkzzau0 _16v7pfz1 a1msqi4y a1msqi0 a1msqir _16v7pfz3"" style=""--_16v7pfz2:2"">$100,000 – $125,000 per year</span></span></div></div>]",2024-01-22,Design-architecture - None,08/02/2024
9,https://www.seek.com.au//job/73526442?type=standard&ref=search-standalone,design architecture,Architecture,Graduate and Project Lead Architect roles,Glue Executive,-,140000.0,142500.0,145000.0,Sydney NSW,"Join a progressive Design Studio as Graduate Architect or Project Leader, working Luxury Multi Residential projects. Great supportive culture.","[<div class=""_1wkzzau0 a1msqi6m""><span class=""_1wkzzau0 a1msqi4y lnocuo0 lnocuo1 lnocuo21 _1d0g9qk4 lnocuo7""><a aria-label=""Limit results to Sydney NSW"" class=""_1wkzzau0 _1wkzzauf _1wkzzau0 _1wkzzauf _842p0a0 _842p0a2"" data-automation=""jobLocation"" href=""/jobs-in-design-architecture/in-All-Sydney-NSW?salarytype=annual&amp;salaryrange=140000-145000"" rel=""nofollow"" tabindex=""-1"" target=""_self"" title=""Limit results to Sydney NSW"">Sydney NSW</a></span></div>]",2024-02-05,Design-architecture - None,08/02/2024
10,https://www.seek.com.au//job/73611399?type=standout&ref=search-standalone,design architecture,Architectural Drafting,Draftsperson,Bluestone Recruitment,-,140000.0,142500.0,145000.0,Melbourne VIC,Opportunity to work with established brand on custom & challenging projects,"[<div class=""_1wkzzau0 a1msqi6m""><span class=""_1wkzzau0 a1msqi4y lnocuo0 lnocuo1 lnocuo21 _1d0g9qk4 lnocuo7""><a aria-label=""Limit results to Dandenong South"" class=""_1wkzzau0 _1wkzzauf _1wkzzau0 _1wkzzauf _842p0a0 _842p0a2"" data-automation=""jobLocation"" href=""/jobs-in-design-architecture/in-Dandenong-South-VIC-3175?salarytype=annual&amp;salaryrange=140000-145000"" rel=""nofollow"" tabindex=""-1"" target=""_self"" title=""Limit results to Dandenong South"">Dandenong South</a>, <a aria-label=""Limit results to Melbourne VIC"" class=""_1wkzzau0 _1wkzzauf _1wkzzau0 _1wkzzauf _842p0a0 _842p0a2"" data-automation=""jobLocation"" href=""/jobs-in-design-architecture/in-All-Melbourne-VIC?salarytype=annual&amp;salaryrange=140000-145000"" rel=""nofollow"" tabindex=""-1"" target=""_self"" title=""Limit results to Melbourne VIC"">Melbourne VIC</a></span></div>]",,Design-architecture - None,08/02/2024
11,https://www.seek.com.au//job/73550463?type=standout&ref=search-standalone,design architecture,Architecture,Architect,Peregrine Corporation,-,140000.0,142500.0,145000.0,Adelaide SA,"The Architect is responsible for conceptualising, designing, and executing innovative and sustainable architectural solutions for our projects.","[<div class=""_1wkzzau0 a1msqi6m""><span class=""_1wkzzau0 a1msqi4y lnocuo0 lnocuo1 lnocuo21 _1d0g9qk4 lnocuo7""><a aria-label=""Limit results to Norwood"" class=""_1wkzzau0 _1wkzzauf _1wkzzau0 _1wkzzauf _842p0a0 _842p0a2"" data-automation=""jobLocation"" href=""/jobs-in-design-architecture/in-Norwood-SA-5067?salarytype=annual&amp;salaryrange=140000-145000"" rel=""nofollow"" tabindex=""-1"" target=""_self"" title=""Limit results to Norwood"">Norwood</a>, <a aria-label=""Limit results to Adelaide SA"" class=""_1wkzzau0 _1wkzzauf _1wkzzau0 _1wkzzauf _842p0a0 _842p0a2"" data-automation=""jobLocation"" href=""/jobs-in-design-architecture/in-All-Adelaide-SA?salarytype=annual&amp;salaryrange=140000-145000"" rel=""nofollow"" tabindex=""-1"" target=""_self"" title=""Limit results to Adelaide SA"">Adelaide SA</a></span></div>]",2024-02-06,Design-architecture - None,08/02/2024
12,https://www.seek.com.au//job/73621738?type=standard&ref=search-standalone,design architecture,Architecture,Senior Architect and Client Manager,Bespoke Careers,"$120,000 – $140,000 + Super",120000.0,130000.0,140000.0,Sydney NSW,Unique role - Boutique houses (Design and Construct),"[<div class=""_1wkzzau0 a1msqi6m""><span class=""_1wkzzau0 a1msqi4y lnocuo0 lnocuo1 lnocuo21 _1d0g9qk4 lnocuo7""><a aria-label=""Limit results to Freshwater"" class=""_1wkzzau0 _1wkzzauf _1wkzzau0 _1wkzzauf _842p0a0 _842p0a2"" data-automation=""jobLocation"" href=""/jobs-in-design-architecture/in-Freshwater-NSW-2096?salarytype=annual&amp;salaryrange=140000-145000"" rel=""nofollow"" tabindex=""-1"" target=""_self"" title=""Limit results to Freshwater"">Freshwater</a>, <a aria-label=""Limit results to Sydney NSW"" class=""_1wkzzau0 _1wkzzauf _1wkzzau0 _1wkzzauf _842p0a0 _842p0a2"" data-automation=""jobLocation"" href=""/jobs-in-design-architecture/in-All-Sydney-NSW?salarytype=annual&amp;salaryrange=140000-145000"" rel=""nofollow"" tabindex=""-1"" target=""_self"" title=""Limit results to Sydney NSW"">Sydney NSW</a></span></div>, <div class=""_1wkzzau0 a1msqi6m""><div aria-label=""Salary: $120,000 – $140,000 + Super"" class=""_1wkzzau0""><span class=""_1wkzzau0 a1msqi4y lnocuo0 lnocuo1 lnocuo21 _1d0g9qk4 lnocuo7"" data-automation=""jobSalary""><span class=""_1wkzzau0 _16v7pfz1 a1msqi4y a1msqi0 a1msqir _16v7pfz3"" style=""--_16v7pfz2:2"">$120,000 – $140,000 + Super</span></span></div></div>]",,Design-architecture - None,08/02/2024
13,https://www.seek.com.au//job/73502993?type=standout&ref=search-standalone,design architecture,Architectural Drafting,Drafting Opportunities - New Home Building Industry - Melbourne Wide,Austcorp Executive,$70k-$110k + Super (Depending on experience level),70000.0,90000.0,110000.0,Melbourne VIC,Our home-building clients are recruiting for Production Estimators and Sales Estimators Melbourne wide! Apply today!!,"[<div class=""_1wkzzau0 a1msqi6m""><span class=""_1wkzzau0 a1msqi4y lnocuo0 lnocuo1 lnocuo21 _1d0g9qk4 lnocuo7""><a aria-label=""Limit results to Melbourne VIC"" class=""_1wkzzau0 _1wkzzauf _1wkzzau0 _1wkzzauf _842p0a0 _842p0a2"" data-automation=""jobLocation"" href=""/jobs-in-design-architecture/in-All-Melbourne-VIC?salarytype=annual&amp;salaryrange=140000-145000"" rel=""nofollow"" tabindex=""-1"" target=""_self"" title=""Limit results to Melbourne VIC"">Melbourne VIC</a></span></div>, <div class=""_1wkzzau0 a1msqi6m""><div aria-label=""Salary: $70k-$110k + Super (Depending on experience level)"" class=""_1wkzzau0""><span class=""_1wkzzau0 a1msqi4y lnocuo0 lnocuo1 lnocuo21 _1d0g9qk4 lnocuo7"" data-automation=""jobSalary""><span class=""_1wkzzau0 _16v7pfz1 a1msqi4y a1msqi0 a1msqir _16v7pfz3"" style=""--_16v7pfz2:2"">$70k-$110k + Super (Depending on experience level)</span></span></div></div>]",2024-02-03,Design-architecture - None,08/02/2024
14,https://www.seek.com.au//job/73488186?type=standout&ref=search-standalone,design architecture,Architecture,Architectural Designer,Scotford Fennessy,Up To Circa $120k Salary Package,140000.0,142500.0,145000.0,Perth WA,"Design Excellence, End-to-End Project Management, Commercial & Industrial Design, ArchiCAD, Leadership","[<div class=""_1wkzzau0 a1msqi6m""><span class=""_1wkzzau0 a1msqi4y lnocuo0 lnocuo1 lnocuo21 _1d0g9qk4 lnocuo7""><a aria-label=""Limit results to Perth WA"" class=""_1wkzzau0 _1wkzzauf _1wkzzau0 _1wkzzauf _842p0a0 _842p0a2"" data-automation=""jobLocation"" href=""/jobs-in-design-architecture/in-All-Perth-WA?salarytype=annual&amp;salaryrange=140000-145000"" rel=""nofollow"" tabindex=""-1"" target=""_self"" title=""Limit results to Perth WA"">Perth WA</a></span></div>, <div class=""_1wkzzau0 a1msqi6m""><div aria-label=""Salary: Up To Circa $120k Salary Package"" class=""_1wkzzau0""><span class=""_1wkzzau0 a1msqi4y lnocuo0 lnocuo1 lnocuo21 _1d0g9qk4 lnocuo7"" data-automation=""jobSalary""><span class=""_1wkzzau0 _16v7pfz1 a1msqi4y a1msqi0 a1msqir _16v7pfz3"" style=""--_16v7pfz2:2"">Up To Circa $120k Salary Package</span></span></div></div>]",2024-02-02,Design-architecture - None,08/02/2024
15,https://www.seek.com.au//job/73544942?type=standard&ref=search-standalone,design architecture,Architecture,Project Architect,Aspect Personnel,"$115,000 +S uper",115000.0,130000.0,145000.0,Melbourne VIC,An exciting opportunity for a experienced Project Architect looking for the next step in their career to management.,"[<div class=""_1wkzzau0 a1msqi6m""><span class=""_1wkzzau0 a1msqi4y lnocuo0 lnocuo1 lnocuo21 _1d0g9qk4 lnocuo7""><a aria-label=""Limit results to Melbourne VIC"" class=""_1wkzzau0 _1wkzzauf _1wkzzau0 _1wkzzauf _842p0a0 _842p0a2"" data-automation=""jobLocation"" href=""/jobs-in-design-architecture/in-All-Melbourne-VIC?salarytype=annual&amp;salaryrange=140000-145000"" rel=""nofollow"" tabindex=""-1"" target=""_self"" title=""Limit results to Melbourne VIC"">Melbourne VIC</a></span></div>, <div class=""_1wkzzau0 a1msqi6m""><div aria-label=""Salary: $115,000 +S uper"" class=""_1wkzzau0""><span class=""_1wkzzau0 a1msqi4y lnocuo0 lnocuo1 lnocuo21 _1d0g9qk4 lnocuo7"" data-automation=""jobSalary""><span class=""_1wkzzau0 _16v7pfz1 a1msqi4y a1msqi0 a1msqir _16v7pfz3"" style=""--_16v7pfz2:2"">$115,000 +S uper</span></span></div></div>]",2024-02-06,Design-architecture - None,08/02/2024
16,https://www.seek.com.au//job/73597645?type=standout&ref=search-standalone,design architecture,Architecture,Architect,Scotford Fennessy,$100k++,100000.0,122500.0,145000.0,Perth WA,Ignite your passion with a team of dedicated leaders! Explore a Middle Management Position brimming with opportunities for involvement from A to Z.,"[<div class=""_1wkzzau0 a1msqi6m""><span class=""_1wkzzau0 a1msqi4y lnocuo0 lnocuo1 lnocuo21 _1d0g9qk4 lnocuo7""><a aria-label=""Limit results to Perth WA"" class=""_1wkzzau0 _1wkzzauf _1wkzzau0 _1wkzzauf _842p0a0 _842p0a2"" data-automation=""jobLocation"" href=""/jobs-in-design-architecture/in-All-Perth-WA?salarytype=annual&amp;salaryrange=140000-145000"" rel=""nofollow"" tabindex=""-1"" target=""_self"" title=""Limit results to Perth WA"">Perth WA</a></span></div>, <div class=""_1wkzzau0 a1msqi6m""><div aria-label=""Salary: $100k++"" class=""_1wkzzau0""><span class=""_1wkzzau0 a1msqi4y lnocuo0 lnocuo1 lnocuo21 _1d0g9qk4 lnocuo7"" data-automation=""jobSalary""><span class=""_1wkzzau0 _16v7pfz1 a1msqi4y a1msqi0 a1msqir _16v7pfz3"" style=""--_16v7pfz2:2"">$100k++</span></span></div></div>]",2024-02-07,Design-architecture - None,08/02/2024
17,https://www.seek.com.au//job/73626798?type=standout&ref=search-standalone,design architecture,Architecture,Architectural BDM (Manufacturing Roofing),Revolution by DG Pty Ltd,Salary Negotiable! Competitive package!,140000.0,142500.0,145000.0,Adelaide SA,One of Australia's largest Sheetmetal Companies. Stability & Flexibility. Career Growth. High performance sales role. Industry leaders. Great Salary.,"[<div class=""_1wkzzau0 a1msqi6m""><span class=""_1wkzzau0 a1msqi4y lnocuo0 lnocuo1 lnocuo21 _1d0g9qk4 lnocuo7""><a aria-label=""Limit results to Regency Park"" class=""_1wkzzau0 _1wkzzauf _1wkzzau0 _1wkzzauf _842p0a0 _842p0a2"" data-automation=""jobLocation"" href=""/jobs-in-design-architecture/in-Regency-Park-SA-5010?salarytype=annual&amp;salaryrange=140000-145000"" rel=""nofollow"" tabindex=""-1"" target=""_self"" title=""Limit results to Regency Park"">Regency Park</a>, <a aria-label=""Limit results to Adelaide SA"" class=""_1wkzzau0 _1wkzzauf _1wkzzau0 _1wkzzauf _842p0a0 _842p0a2"" data-automation=""jobLocation"" href=""/jobs-in-design-architecture/in-All-Adelaide-SA?salarytype=annual&amp;salaryrange=140000-145000"" rel=""nofollow"" tabindex=""-1"" target=""_self"" title=""Limit results to Adelaide SA"">Adelaide SA</a></span></div>, <div class=""_1wkzzau0 a1msqi6m""><div aria-label=""Salary: Salary Negotiable! Competitive package!"" class=""_1wkzzau0""><span class=""_1wkzzau0 a1msqi4y lnocuo0 lnocuo1 lnocuo21 _1d0g9qk4 lnocuo7"" data-automation=""jobSalary""><span class=""_1wkzzau0 _16v7pfz1 a1msqi4y a1msqi0 a1msqir _16v7pfz3"" style=""--_16v7pfz2:2"">Salary Negotiable! Competitive package!</span></span></div></div>]",,Design-architecture - None,08/02/2024
18,https://www.seek.com.au//job/73583413?type=standout&ref=search-standalone,design architecture,Architectural Drafting,Draftsperson,Bluestone Recruitment,-,140000.0,142500.0,145000.0,Melbourne VIC,"Rare drafting opportunity with a leading property, development & construction group","[<div class=""_1wkzzau0 a1msqi6m""><span class=""_1wkzzau0 a1msqi4y lnocuo0 lnocuo1 lnocuo21 _1d0g9qk4 lnocuo7""><a aria-label=""Limit results to Melbourne VIC"" class=""_1wkzzau0 _1wkzzauf _1wkzzau0 _1wkzzauf _842p0a0 _842p0a2"" data-automation=""jobLocation"" href=""/jobs-in-design-architecture/in-All-Melbourne-VIC?salarytype=annual&amp;salaryrange=140000-145000"" rel=""nofollow"" tabindex=""-1"" target=""_self"" title=""Limit results to Melbourne VIC"">Melbourne VIC</a></span></div>]",2024-02-07,Design-architecture - None,08/02/2024
19,https://www.seek.com.au//job/73307205?type=standout&ref=search-standalone,design architecture,Interior Design,Communication & Interior Design Manager,IKEA - Canberra,"5 weeks Annual Leave, Discounts & Loyalty Program!",140000.0,142500.0,145000.0,Canberra ACT,"At IKEA we are committed to providing a supportive environment that values inclusion and diversity, where you can bring your whole self to work.","[<div class=""_1wkzzau0 a1msqi6m""><span class=""_1wkzzau0 a1msqi4y lnocuo0 lnocuo1 lnocuo21 _1d0g9qk4 lnocuo7""><a aria-label=""Limit results to Majura"" class=""_1wkzzau0 _1wkzzauf _1wkzzau0 _1wkzzauf _842p0a0 _842p0a2"" data-automation=""jobLocation"" href=""/jobs-in-design-architecture/in-Majura-ACT-2609?salarytype=annual&amp;salaryrange=140000-145000"" rel=""nofollow"" tabindex=""-1"" target=""_self"" title=""Limit results to Majura"">Majura</a>, <a aria-label=""Limit results to Canberra ACT"" class=""_1wkzzau0 _1wkzzauf _1wkzzau0 _1wkzzauf _842p0a0 _842p0a2"" data-automation=""jobLocation"" href=""/jobs-in-design-architecture/in-All-Canberra-ACT?salarytype=annual&amp;salaryrange=140000-145000"" rel=""nofollow"" tabindex=""-1"" target=""_self"" title=""Limit results to Canberra ACT"">Canberra ACT</a></span></div>, <div class=""_1wkzzau0 a1msqi6m""><div aria-label=""Salary: 5 weeks Annual Leave, Discounts &amp; Loyalty Program!"" class=""_1wkzzau0""><span class=""_1wkzzau0 a1msqi4y lnocuo0 lnocuo1 lnocuo21 _1d0g9qk4 lnocuo7"" data-automation=""jobSalary""><span class=""_1wkzzau0 _16v7pfz1 a1msqi4y a1msqi0 a1msqir _16v7pfz3"" style=""--_16v7pfz2:2"">5 weeks Annual Leave, Discounts &amp; Loyalty Program!</span></span></div></div>]",2024-01-25,Design-architecture - None,08/02/2024
20,https://www.seek.com.au//job/73355790?type=standout&ref=search-standalone,design architecture,Architecture,Senior Architect,Hames Sharley,-,140000.0,142500.0,145000.0,Darwin NT,"Enable communities to flourish through researching, planning, designing, documenting, and administering building contracts at the highest standard.","[<div class=""_1wkzzau0 a1msqi6m""><span class=""_1wkzzau0 a1msqi4y lnocuo0 lnocuo1 lnocuo21 _1d0g9qk4 lnocuo7""><a aria-label=""Limit results to Darwin NT"" class=""_1wkzzau0 _1wkzzauf _1wkzzau0 _1wkzzauf _842p0a0 _842p0a2"" data-automation=""jobLocation"" href=""/jobs-in-design-architecture/in-All-Darwin-NT?salarytype=annual&amp;salaryrange=140000-145000"" rel=""nofollow"" tabindex=""-1"" target=""_self"" title=""Limit results to Darwin NT"">Darwin NT</a></span></div>]",2024-01-29,Design-architecture - None,08/02/2024
