,link,classification,category,title,company,salary,min_salary,average_salary,max_salary,location,description,entireDiv,date_posted,Category,Date
131,https://www.seek.com.au//job/73554030?type=standout&ref=search-standalone,insurance superannuation,Risk Consulting,Manager Member Office - Product and Investments,Insignia Financial Ltd,Competitive Salary Package + Career Progression,140000.0,142500.0,145000.0,Melbourne VIC,Are you a team player with a background in product or investments looking to make a positive impact? Join Insignia Financial!,"[<div class=""_1wkzzau0 a1msqi6m""><span class=""_1wkzzau0 a1msqi4y lnocuo0 lnocuo1 lnocuo21 _1d0g9qk4 lnocuo7""><a aria-label=""Limit results to Melbourne VIC"" class=""_1wkzzau0 _1wkzzauf _1wkzzau0 _1wkzzauf _842p0a0 _842p0a2"" data-automation=""jobLocation"" href=""/jobs-in-insurance-superannuation/in-All-Melbourne-VIC?salarytype=annual&amp;salaryrange=140000-145000"" rel=""nofollow"" tabindex=""-1"" target=""_self"" title=""Limit results to Melbourne VIC"">Melbourne VIC</a></span></div>, <div class=""_1wkzzau0 a1msqi6m""><div aria-label=""Salary: Competitive Salary Package + Career Progression"" class=""_1wkzzau0""><span class=""_1wkzzau0 a1msqi4y lnocuo0 lnocuo1 lnocuo21 _1d0g9qk4 lnocuo7"" data-automation=""jobSalary""><span class=""_1wkzzau0 _16v7pfz1 a1msqi4y a1msqi0 a1msqir _16v7pfz3"" style=""--_16v7pfz2:2"">Competitive Salary Package + Career Progression</span></span></div></div>]",2024-02-06,Insurance-superannuation - None,08/02/2024
132,https://www.seek.com.au//job/73155554?type=standard&ref=search-standalone,insurance superannuation,Brokerage,Insurance Account Manager,,"$100,000 – $130,000 per year",100000.0,115000.0,130000.0,Melbourne VIC,Fantastic new role available in Moorabbin - Insurance Broker - Commercial and SME - Don't miss out and apply today.,"[<div class=""_1wkzzau0 a1msqi6m""><span class=""_1wkzzau0 a1msqi4y lnocuo0 lnocuo1 lnocuo21 _1d0g9qk4 lnocuo7""><a aria-label=""Limit results to Moorabbin"" class=""_1wkzzau0 _1wkzzauf _1wkzzau0 _1wkzzauf _842p0a0 _842p0a2"" data-automation=""jobLocation"" href=""/jobs-in-insurance-superannuation/in-Moorabbin-VIC-3189?salarytype=annual&amp;salaryrange=140000-145000"" rel=""nofollow"" tabindex=""-1"" target=""_self"" title=""Limit results to Moorabbin"">Moorabbin</a>, <a aria-label=""Limit results to Melbourne VIC"" class=""_1wkzzau0 _1wkzzauf _1wkzzau0 _1wkzzauf _842p0a0 _842p0a2"" data-automation=""jobLocation"" href=""/jobs-in-insurance-superannuation/in-All-Melbourne-VIC?salarytype=annual&amp;salaryrange=140000-145000"" rel=""nofollow"" tabindex=""-1"" target=""_self"" title=""Limit results to Melbourne VIC"">Melbourne VIC</a></span></div>, <div class=""_1wkzzau0 a1msqi6m""><div aria-label=""Salary: $100,000 – $130,000 per year"" class=""_1wkzzau0""><span class=""_1wkzzau0 a1msqi4y lnocuo0 lnocuo1 lnocuo21 _1d0g9qk4 lnocuo7"" data-automation=""jobSalary""><span class=""_1wkzzau0 _16v7pfz1 a1msqi4y a1msqi0 a1msqir _16v7pfz3"" style=""--_16v7pfz2:2"">$100,000 – $130,000 per year</span></span></div></div>]",2024-01-19,Insurance-superannuation - None,08/02/2024
133,https://www.seek.com.au//job/73366127?type=standard&ref=search-standalone,insurance superannuation,Claims,Large Loss Property Claims Specialist,MAYDAY Recruitment,-,140000.0,142500.0,145000.0,Melbourne VIC,"Join a fantastic organisation in the insurance industry going through an exciting time of growth, establish their large and complex claims function.","[<div class=""_1wkzzau0 a1msqi6m""><span class=""_1wkzzau0 a1msqi4y lnocuo0 lnocuo1 lnocuo21 _1d0g9qk4 lnocuo7""><a aria-label=""Limit results to Hawthorn East"" class=""_1wkzzau0 _1wkzzauf _1wkzzau0 _1wkzzauf _842p0a0 _842p0a2"" data-automation=""jobLocation"" href=""/jobs-in-insurance-superannuation/in-Hawthorn-East-VIC-3123?salarytype=annual&amp;salaryrange=140000-145000"" rel=""nofollow"" tabindex=""-1"" target=""_self"" title=""Limit results to Hawthorn East"">Hawthorn East</a>, <a aria-label=""Limit results to Melbourne VIC"" class=""_1wkzzau0 _1wkzzauf _1wkzzau0 _1wkzzauf _842p0a0 _842p0a2"" data-automation=""jobLocation"" href=""/jobs-in-insurance-superannuation/in-All-Melbourne-VIC?salarytype=annual&amp;salaryrange=140000-145000"" rel=""nofollow"" tabindex=""-1"" target=""_self"" title=""Limit results to Melbourne VIC"">Melbourne VIC</a></span></div>]",2024-01-29,Insurance-superannuation - None,08/02/2024
134,https://www.seek.com.au//job/72923939?type=standout&ref=search-standalone,insurance superannuation,Brokerage,Commercial Insurance Broker,Chevron Equipment Finance,"Minimum OTE $120,000 with uncapped commission",140000.0,142500.0,145000.0,Gold Coast QLD,This isn't just a job; it's an opportunity to shape your future in commercial insurance working alongside a team of high performers.,"[<div class=""_1wkzzau0 a1msqi6m""><span class=""_1wkzzau0 a1msqi4y lnocuo0 lnocuo1 lnocuo21 _1d0g9qk4 lnocuo7""><a aria-label=""Limit results to Burleigh Waters"" class=""_1wkzzau0 _1wkzzauf _1wkzzau0 _1wkzzauf _842p0a0 _842p0a2"" data-automation=""jobLocation"" href=""/jobs-in-insurance-superannuation/in-Burleigh-Waters-QLD-4220?salarytype=annual&amp;salaryrange=140000-145000"" rel=""nofollow"" tabindex=""-1"" target=""_self"" title=""Limit results to Burleigh Waters"">Burleigh Waters</a>, <a aria-label=""Limit results to Gold Coast QLD"" class=""_1wkzzau0 _1wkzzauf _1wkzzau0 _1wkzzauf _842p0a0 _842p0a2"" data-automation=""jobLocation"" href=""/jobs-in-insurance-superannuation/in-All-Gold-Coast-QLD?salarytype=annual&amp;salaryrange=140000-145000"" rel=""nofollow"" tabindex=""-1"" target=""_self"" title=""Limit results to Gold Coast QLD"">Gold Coast QLD</a></span></div>, <div class=""_1wkzzau0 a1msqi6m""><div aria-label=""Salary: Minimum OTE $120,000 with uncapped commission"" class=""_1wkzzau0""><span class=""_1wkzzau0 a1msqi4y lnocuo0 lnocuo1 lnocuo21 _1d0g9qk4 lnocuo7"" data-automation=""jobSalary""><span class=""_1wkzzau0 _16v7pfz1 a1msqi4y a1msqi0 a1msqir _16v7pfz3"" style=""--_16v7pfz2:2"">Minimum OTE $120,000 with uncapped commission</span></span></div></div>]",2024-01-11,Insurance-superannuation - None,08/02/2024
135,https://www.seek.com.au//job/73309158?type=standout&ref=search-standalone,insurance superannuation,Claims,Senior Claims Specialist,Reo Group,$130k - $140k p.a. + Superannuation,130000.0,135000.0,140000.0,Sydney NSW,Experienced strata claims professional to manage a complex claims portfolio. Implement strong processes and systems to improve customer experience.,"[<div class=""_1wkzzau0 a1msqi6m""><span class=""_1wkzzau0 a1msqi4y lnocuo0 lnocuo1 lnocuo21 _1d0g9qk4 lnocuo7""><a aria-label=""Limit results to Sydney NSW"" class=""_1wkzzau0 _1wkzzauf _1wkzzau0 _1wkzzauf _842p0a0 _842p0a2"" data-automation=""jobLocation"" href=""/jobs-in-insurance-superannuation/in-All-Sydney-NSW?salarytype=annual&amp;salaryrange=140000-145000"" rel=""nofollow"" tabindex=""-1"" target=""_self"" title=""Limit results to Sydney NSW"">Sydney NSW</a></span></div>, <div class=""_1wkzzau0 a1msqi6m""><div aria-label=""Salary: $130k - $140k p.a. + Superannuation"" class=""_1wkzzau0""><span class=""_1wkzzau0 a1msqi4y lnocuo0 lnocuo1 lnocuo21 _1d0g9qk4 lnocuo7"" data-automation=""jobSalary""><span class=""_1wkzzau0 _16v7pfz1 a1msqi4y a1msqi0 a1msqir _16v7pfz3"" style=""--_16v7pfz2:2"">$130k - $140k p.a. + Superannuation</span></span></div></div>]",2024-01-25,Insurance-superannuation - None,08/02/2024
136,https://www.seek.com.au//job/73266426?type=standout&ref=search-standalone,insurance superannuation,Brokerage,Client Manager,Aon Corporation,-,140000.0,142500.0,145000.0,Canberra ACT,Lead a diverse portfolio of clients across the general insurance space whilst working with a high performing team. Apply now!,"[<div class=""_1wkzzau0 a1msqi6m""><span class=""_1wkzzau0 a1msqi4y lnocuo0 lnocuo1 lnocuo21 _1d0g9qk4 lnocuo7""><a aria-label=""Limit results to Canberra ACT"" class=""_1wkzzau0 _1wkzzauf _1wkzzau0 _1wkzzauf _842p0a0 _842p0a2"" data-automation=""jobLocation"" href=""/jobs-in-insurance-superannuation/in-All-Canberra-ACT?salarytype=annual&amp;salaryrange=140000-145000"" rel=""nofollow"" tabindex=""-1"" target=""_self"" title=""Limit results to Canberra ACT"">Canberra ACT</a></span></div>]",2024-01-24,Insurance-superannuation - None,08/02/2024
137,https://www.seek.com.au//job/73308787?type=standout&ref=search-standalone,insurance superannuation,Underwriting,Portfolio Manager,Auto & General,-,140000.0,142500.0,145000.0,Brisbane QLD,Opportunity for an experienced General Insurance professional seeking a new challenge with a growing insurer! Full-time role based in Toowong.,"[<div class=""_1wkzzau0 a1msqi6m""><span class=""_1wkzzau0 a1msqi4y lnocuo0 lnocuo1 lnocuo21 _1d0g9qk4 lnocuo7""><a aria-label=""Limit results to Toowong"" class=""_1wkzzau0 _1wkzzauf _1wkzzau0 _1wkzzauf _842p0a0 _842p0a2"" data-automation=""jobLocation"" href=""/jobs-in-insurance-superannuation/in-Toowong-QLD-4066?salarytype=annual&amp;salaryrange=140000-145000"" rel=""nofollow"" tabindex=""-1"" target=""_self"" title=""Limit results to Toowong"">Toowong</a>, <a aria-label=""Limit results to Brisbane QLD"" class=""_1wkzzau0 _1wkzzauf _1wkzzau0 _1wkzzauf _842p0a0 _842p0a2"" data-automation=""jobLocation"" href=""/jobs-in-insurance-superannuation/in-All-Brisbane-QLD?salarytype=annual&amp;salaryrange=140000-145000"" rel=""nofollow"" tabindex=""-1"" target=""_self"" title=""Limit results to Brisbane QLD"">Brisbane QLD</a></span></div>]",2024-01-25,Insurance-superannuation - None,08/02/2024
138,https://www.seek.com.au//job/73472620?type=standout&ref=search-standalone,insurance superannuation,Risk Consulting,Risk Engineer,Asset Inspect Pty Ltd,-,140000.0,142500.0,145000.0,Sydney NSW,"Risk Engineer role based in Sydney with regular metro, regional, and interstate travel.","[<div class=""_1wkzzau0 a1msqi6m""><span class=""_1wkzzau0 a1msqi4y lnocuo0 lnocuo1 lnocuo21 _1d0g9qk4 lnocuo7""><a aria-label=""Limit results to Sydney NSW"" class=""_1wkzzau0 _1wkzzauf _1wkzzau0 _1wkzzauf _842p0a0 _842p0a2"" data-automation=""jobLocation"" href=""/jobs-in-insurance-superannuation/in-All-Sydney-NSW?salarytype=annual&amp;salaryrange=140000-145000"" rel=""nofollow"" tabindex=""-1"" target=""_self"" title=""Limit results to Sydney NSW"">Sydney NSW</a></span></div>]",2024-02-02,Insurance-superannuation - None,08/02/2024
139,https://www.seek.com.au//job/73112296?type=standout&ref=search-standalone,insurance superannuation,Brokerage,Senior Account Manager,Newpath Recruitment,-,140000.0,142500.0,145000.0,Wollongong NSW,A growing brokerage is looking for a senior account manager to take over a portfolio of commercial clientele,"[<div class=""_1wkzzau0 a1msqi6m""><span class=""_1wkzzau0 a1msqi4y lnocuo0 lnocuo1 lnocuo21 _1d0g9qk4 lnocuo7""><a aria-label=""Limit results to Wollongong"" class=""_1wkzzau0 _1wkzzauf _1wkzzau0 _1wkzzauf _842p0a0 _842p0a2"" data-automation=""jobLocation"" href=""/jobs-in-insurance-superannuation/in-Wollongong-NSW-2500?salarytype=annual&amp;salaryrange=140000-145000"" rel=""nofollow"" tabindex=""-1"" target=""_self"" title=""Limit results to Wollongong"">Wollongong</a>, <a aria-label=""Limit results to Wollongong, Illawarra &amp; South Coast NSW"" class=""_1wkzzau0 _1wkzzauf _1wkzzau0 _1wkzzauf _842p0a0 _842p0a2"" data-automation=""jobLocation"" href=""/jobs-in-insurance-superannuation/in-Wollongong,-Illawarra-&amp;-South-Coast-NSW?salarytype=annual&amp;salaryrange=140000-145000"" rel=""nofollow"" tabindex=""-1"" target=""_self"" title=""Limit results to Wollongong, Illawarra &amp; South Coast NSW"">Wollongong, Illawarra &amp; South Coast NSW</a></span></div>]",2024-01-18,Insurance-superannuation - None,08/02/2024
140,https://www.seek.com.au//job/73265950?type=standout&ref=search-standalone,insurance superannuation,Other,Claims Performance Analyst,NTI Ltd,Competitive salary + up to 15% bonus annually,140000.0,142500.0,145000.0,Brisbane QLD,Have an impact on strategic decision making through analysis of claims performance!,"[<div class=""_1wkzzau0 a1msqi6m""><span class=""_1wkzzau0 a1msqi4y lnocuo0 lnocuo1 lnocuo21 _1d0g9qk4 lnocuo7""><a aria-label=""Limit results to Brisbane QLD"" class=""_1wkzzau0 _1wkzzauf _1wkzzau0 _1wkzzauf _842p0a0 _842p0a2"" data-automation=""jobLocation"" href=""/jobs-in-insurance-superannuation/in-All-Brisbane-QLD?salarytype=annual&amp;salaryrange=140000-145000"" rel=""nofollow"" tabindex=""-1"" target=""_self"" title=""Limit results to Brisbane QLD"">Brisbane QLD</a></span></div>, <div class=""_1wkzzau0 a1msqi6m""><div aria-label=""Salary: Competitive salary + up to 15% bonus annually"" class=""_1wkzzau0""><span class=""_1wkzzau0 a1msqi4y lnocuo0 lnocuo1 lnocuo21 _1d0g9qk4 lnocuo7"" data-automation=""jobSalary""><span class=""_1wkzzau0 _16v7pfz1 a1msqi4y a1msqi0 a1msqir _16v7pfz3"" style=""--_16v7pfz2:2"">Competitive salary + up to 15% bonus annually</span></span></div></div>]",2024-01-24,Insurance-superannuation - None,08/02/2024
141,https://www.seek.com.au//job/73483661?type=standout&ref=search-standalone,insurance superannuation,Brokerage,Senior Commercial Insurance Broker,Succession Partners Pty Ltd,-,140000.0,142500.0,145000.0,Sydney NSW,Newly created position for a Senior Broker to manage and service an existing portfolio of clients.,"[<div class=""_1wkzzau0 a1msqi6m""><span class=""_1wkzzau0 a1msqi4y lnocuo0 lnocuo1 lnocuo21 _1d0g9qk4 lnocuo7""><a aria-label=""Limit results to Sydney NSW"" class=""_1wkzzau0 _1wkzzauf _1wkzzau0 _1wkzzauf _842p0a0 _842p0a2"" data-automation=""jobLocation"" href=""/jobs-in-insurance-superannuation/in-All-Sydney-NSW?salarytype=annual&amp;salaryrange=140000-145000"" rel=""nofollow"" tabindex=""-1"" target=""_self"" title=""Limit results to Sydney NSW"">Sydney NSW</a></span></div>]",2024-02-02,Insurance-superannuation - None,08/02/2024
142,https://www.seek.com.au//job/73446432?type=standout&ref=search-standalone,insurance superannuation,Risk Consulting,Incident Management and Breach Specialist,Aware Super,-,140000.0,142500.0,145000.0,Melbourne VIC,Support the Senior Manager - Regulatory Affairs to manage regulatory requests and interactions in accordance with the Regulatory Engagement Policy.,"[<div class=""_1wkzzau0 a1msqi6m""><span class=""_1wkzzau0 a1msqi4y lnocuo0 lnocuo1 lnocuo21 _1d0g9qk4 lnocuo7""><a aria-label=""Limit results to Melbourne VIC"" class=""_1wkzzau0 _1wkzzauf _1wkzzau0 _1wkzzauf _842p0a0 _842p0a2"" data-automation=""jobLocation"" href=""/jobs-in-insurance-superannuation/in-All-Melbourne-VIC?salarytype=annual&amp;salaryrange=140000-145000"" rel=""nofollow"" tabindex=""-1"" target=""_self"" title=""Limit results to Melbourne VIC"">Melbourne VIC</a></span></div>]",2024-02-01,Insurance-superannuation - None,08/02/2024
143,https://www.seek.com.au//job/73509767?type=standout&ref=search-standalone,insurance superannuation,Workers' Compensation,Account Executive - Workers' Compensation,Willis Towers Watson,-,140000.0,142500.0,145000.0,Melbourne VIC,Provide hands-on injury management and workers’ compensation advice to support our clients’ workplace risk programs.,"[<div class=""_1wkzzau0 a1msqi6m""><span class=""_1wkzzau0 a1msqi4y lnocuo0 lnocuo1 lnocuo21 _1d0g9qk4 lnocuo7""><a aria-label=""Limit results to Melbourne VIC"" class=""_1wkzzau0 _1wkzzauf _1wkzzau0 _1wkzzauf _842p0a0 _842p0a2"" data-automation=""jobLocation"" href=""/jobs-in-insurance-superannuation/in-All-Melbourne-VIC?salarytype=annual&amp;salaryrange=140000-145000"" rel=""nofollow"" tabindex=""-1"" target=""_self"" title=""Limit results to Melbourne VIC"">Melbourne VIC</a></span></div>]",2024-02-04,Insurance-superannuation - None,08/02/2024
144,https://www.seek.com.au//job/73215146?type=standout&ref=search-standalone,insurance superannuation,Brokerage,Senior Insurance Broker / Insurance Broking,Apollo Risk Services,-,140000.0,142500.0,145000.0,Perth WA,We are seeking a motivated professional Snr Insurance Broker to join our team as Senior Account Manager.,"[<div class=""_1wkzzau0 a1msqi6m""><span class=""_1wkzzau0 a1msqi4y lnocuo0 lnocuo1 lnocuo21 _1d0g9qk4 lnocuo7""><a aria-label=""Limit results to Osborne Park"" class=""_1wkzzau0 _1wkzzauf _1wkzzau0 _1wkzzauf _842p0a0 _842p0a2"" data-automation=""jobLocation"" href=""/jobs-in-insurance-superannuation/in-Osborne-Park-WA-6017?salarytype=annual&amp;salaryrange=140000-145000"" rel=""nofollow"" tabindex=""-1"" target=""_self"" title=""Limit results to Osborne Park"">Osborne Park</a>, <a aria-label=""Limit results to Perth WA"" class=""_1wkzzau0 _1wkzzauf _1wkzzau0 _1wkzzauf _842p0a0 _842p0a2"" data-automation=""jobLocation"" href=""/jobs-in-insurance-superannuation/in-All-Perth-WA?salarytype=annual&amp;salaryrange=140000-145000"" rel=""nofollow"" tabindex=""-1"" target=""_self"" title=""Limit results to Perth WA"">Perth WA</a></span></div>]",2024-01-22,Insurance-superannuation - None,08/02/2024
145,https://www.seek.com.au//job/73406038?type=standout&ref=search-standalone,insurance superannuation,Workers' Compensation,Key Account Manager,EML Group,Attractive salary + benefits,140000.0,142500.0,145000.0,Sydney NSW,Utilise your account management experience in the workers compensation and or finance industry and join a vibrant & diverse company!,"[<div class=""_1wkzzau0 a1msqi6m""><span class=""_1wkzzau0 a1msqi4y lnocuo0 lnocuo1 lnocuo21 _1d0g9qk4 lnocuo7""><a aria-label=""Limit results to Sydney NSW"" class=""_1wkzzau0 _1wkzzauf _1wkzzau0 _1wkzzauf _842p0a0 _842p0a2"" data-automation=""jobLocation"" href=""/jobs-in-insurance-superannuation/in-All-Sydney-NSW?salarytype=annual&amp;salaryrange=140000-145000"" rel=""nofollow"" tabindex=""-1"" target=""_self"" title=""Limit results to Sydney NSW"">Sydney NSW</a></span></div>, <div class=""_1wkzzau0 a1msqi6m""><div aria-label=""Salary: Attractive salary + benefits"" class=""_1wkzzau0""><span class=""_1wkzzau0 a1msqi4y lnocuo0 lnocuo1 lnocuo21 _1d0g9qk4 lnocuo7"" data-automation=""jobSalary""><span class=""_1wkzzau0 _16v7pfz1 a1msqi4y a1msqi0 a1msqir _16v7pfz3"" style=""--_16v7pfz2:2"">Attractive salary + benefits</span></span></div></div>]",2024-01-31,Insurance-superannuation - None,08/02/2024
146,https://www.seek.com.au//job/73378709?type=standout&ref=search-standalone,insurance superannuation,Claims,Motor Claims Assessing and Repair Services Team Lead,RACT,-,140000.0,142500.0,145000.0,Hobart TAS,Exciting opportunity to join our Motor Assessing Team!,"[<div class=""_1wkzzau0 a1msqi6m""><span class=""_1wkzzau0 a1msqi4y lnocuo0 lnocuo1 lnocuo21 _1d0g9qk4 lnocuo7""><a aria-label=""Limit results to Hobart TAS"" class=""_1wkzzau0 _1wkzzauf _1wkzzau0 _1wkzzauf _842p0a0 _842p0a2"" data-automation=""jobLocation"" href=""/jobs-in-insurance-superannuation/in-All-Hobart-TAS?salarytype=annual&amp;salaryrange=140000-145000"" rel=""nofollow"" tabindex=""-1"" target=""_self"" title=""Limit results to Hobart TAS"">Hobart TAS</a></span></div>]",2024-01-30,Insurance-superannuation - None,08/02/2024
147,https://www.seek.com.au//job/73357569?type=standout&ref=search-standalone,insurance superannuation,Assessment,Investigators - Factual and Surveillance,Brennan and Associates,-,140000.0,142500.0,145000.0,Perth WA,Factual and Surveillance Investigators required - We are seeking motivated individuals to join our growing team of investigators.,"[<div class=""_1wkzzau0 a1msqi6m""><span class=""_1wkzzau0 a1msqi4y lnocuo0 lnocuo1 lnocuo21 _1d0g9qk4 lnocuo7""><a aria-label=""Limit results to Perth WA"" class=""_1wkzzau0 _1wkzzauf _1wkzzau0 _1wkzzauf _842p0a0 _842p0a2"" data-automation=""jobLocation"" href=""/jobs-in-insurance-superannuation/in-All-Perth-WA?salarytype=annual&amp;salaryrange=140000-145000"" rel=""nofollow"" tabindex=""-1"" target=""_self"" title=""Limit results to Perth WA"">Perth WA</a></span></div>]",2024-01-29,Insurance-superannuation - None,08/02/2024
148,https://www.seek.com.au//job/73357761?type=standout&ref=search-standalone,insurance superannuation,Claims,Claims Officer - Financial Lines,QBE,-,140000.0,142500.0,145000.0,Sydney NSW,"We have a permanent, full-time opportunity for a Claims Officer within our Financial Lines claims team!","[<div class=""_1wkzzau0 a1msqi6m""><span class=""_1wkzzau0 a1msqi4y lnocuo0 lnocuo1 lnocuo21 _1d0g9qk4 lnocuo7""><a aria-label=""Limit results to Parramatta"" class=""_1wkzzau0 _1wkzzauf _1wkzzau0 _1wkzzauf _842p0a0 _842p0a2"" data-automation=""jobLocation"" href=""/jobs-in-insurance-superannuation/in-Parramatta-NSW-2150?salarytype=annual&amp;salaryrange=140000-145000"" rel=""nofollow"" tabindex=""-1"" target=""_self"" title=""Limit results to Parramatta"">Parramatta</a>, <a aria-label=""Limit results to Sydney NSW"" class=""_1wkzzau0 _1wkzzauf _1wkzzau0 _1wkzzauf _842p0a0 _842p0a2"" data-automation=""jobLocation"" href=""/jobs-in-insurance-superannuation/in-All-Sydney-NSW?salarytype=annual&amp;salaryrange=140000-145000"" rel=""nofollow"" tabindex=""-1"" target=""_self"" title=""Limit results to Sydney NSW"">Sydney NSW</a></span></div>]",2024-01-29,Insurance-superannuation - None,08/02/2024
149,https://www.seek.com.au//job/73156661?type=standard&ref=search-standalone,insurance superannuation,Brokerage,Insurance Senior Account Executive,,"$120,000 – $140,000 per year",120000.0,130000.0,140000.0,Perth WA,Senior Account Executive - succession plan to management and equity,"[<div class=""_1wkzzau0 a1msqi6m""><span class=""_1wkzzau0 a1msqi4y lnocuo0 lnocuo1 lnocuo21 _1d0g9qk4 lnocuo7""><a aria-label=""Limit results to Perth WA"" class=""_1wkzzau0 _1wkzzauf _1wkzzau0 _1wkzzauf _842p0a0 _842p0a2"" data-automation=""jobLocation"" href=""/jobs-in-insurance-superannuation/in-All-Perth-WA?salarytype=annual&amp;salaryrange=140000-145000"" rel=""nofollow"" tabindex=""-1"" target=""_self"" title=""Limit results to Perth WA"">Perth WA</a></span></div>, <div class=""_1wkzzau0 a1msqi6m""><div aria-label=""Salary: $120,000 – $140,000 per year"" class=""_1wkzzau0""><span class=""_1wkzzau0 a1msqi4y lnocuo0 lnocuo1 lnocuo21 _1d0g9qk4 lnocuo7"" data-automation=""jobSalary""><span class=""_1wkzzau0 _16v7pfz1 a1msqi4y a1msqi0 a1msqir _16v7pfz3"" style=""--_16v7pfz2:2"">$120,000 – $140,000 per year</span></span></div></div>]",2024-01-19,Insurance-superannuation - None,08/02/2024
150,https://www.seek.com.au//job/73243462?type=standout&ref=search-standalone,insurance superannuation,Superannuation,Operations Governance & Compliance Manager,Hostplus Superannuation,-,140000.0,142500.0,145000.0,Melbourne VIC,"In the role you will; ensure compliance, manage incidents, and resolve issues collaboratively to achieve operational excellence in the business.","[<div class=""_1wkzzau0 a1msqi6m""><span class=""_1wkzzau0 a1msqi4y lnocuo0 lnocuo1 lnocuo21 _1d0g9qk4 lnocuo7""><a aria-label=""Limit results to Melbourne VIC"" class=""_1wkzzau0 _1wkzzauf _1wkzzau0 _1wkzzauf _842p0a0 _842p0a2"" data-automation=""jobLocation"" href=""/jobs-in-insurance-superannuation/in-All-Melbourne-VIC?salarytype=annual&amp;salaryrange=140000-145000"" rel=""nofollow"" tabindex=""-1"" target=""_self"" title=""Limit results to Melbourne VIC"">Melbourne VIC</a></span></div>]",2024-01-23,Insurance-superannuation - None,08/02/2024
151,https://www.seek.com.au//job/73298252?type=standout&ref=search-standalone,insurance superannuation,Risk Consulting,Business Improvement Specialist,Capricorn,-,140000.0,142500.0,145000.0,Perth WA,Looking for a unique organisation that works for its Members and truly values you?,"[<div class=""_1wkzzau0 a1msqi6m""><span class=""_1wkzzau0 a1msqi4y lnocuo0 lnocuo1 lnocuo21 _1d0g9qk4 lnocuo7""><a aria-label=""Limit results to West Perth"" class=""_1wkzzau0 _1wkzzauf _1wkzzau0 _1wkzzauf _842p0a0 _842p0a2"" data-automation=""jobLocation"" href=""/jobs-in-insurance-superannuation/in-West-Perth-WA-6005?salarytype=annual&amp;salaryrange=140000-145000"" rel=""nofollow"" tabindex=""-1"" target=""_self"" title=""Limit results to West Perth"">West Perth</a>, <a aria-label=""Limit results to Perth WA"" class=""_1wkzzau0 _1wkzzauf _1wkzzau0 _1wkzzauf _842p0a0 _842p0a2"" data-automation=""jobLocation"" href=""/jobs-in-insurance-superannuation/in-All-Perth-WA?salarytype=annual&amp;salaryrange=140000-145000"" rel=""nofollow"" tabindex=""-1"" target=""_self"" title=""Limit results to Perth WA"">Perth WA</a></span></div>]",2024-01-25,Insurance-superannuation - None,08/02/2024
152,https://www.seek.com.au//job/73416309?type=standout&ref=search-standalone,insurance superannuation,Assessment,Motor Assessing Manager,COLLAR®,-,140000.0,142500.0,145000.0,Melbourne VIC,"Join Melbourne's fastest growing Insurtech and leader within Motor Assessing, working from home with an excellent remuneration package","[<div class=""_1wkzzau0 a1msqi6m""><span class=""_1wkzzau0 a1msqi4y lnocuo0 lnocuo1 lnocuo21 _1d0g9qk4 lnocuo7""><a aria-label=""Limit results to Melbourne VIC"" class=""_1wkzzau0 _1wkzzauf _1wkzzau0 _1wkzzauf _842p0a0 _842p0a2"" data-automation=""jobLocation"" href=""/jobs-in-insurance-superannuation/in-All-Melbourne-VIC?salarytype=annual&amp;salaryrange=140000-145000"" rel=""nofollow"" tabindex=""-1"" target=""_self"" title=""Limit results to Melbourne VIC"">Melbourne VIC</a></span></div>]",2024-01-31,Insurance-superannuation - None,08/02/2024
