,link,classification,category,title,company,salary,min_salary,average_salary,max_salary,location,description,entireDiv,date_posted,Category,Date
41,https://www.seek.com.au//job/73629190?type=standout&ref=search-standalone,administration office support,Records Management & Document Control,Information Management Advisor,Airswift,-,180000.0,182500.0,185000.0,Perth WA,Are you an experience document controller/Information Management specialist? Have you had advisory experience? Read further!,"[<div class=""_1wkzzau0 a1msqi6m""><span class=""_1wkzzau0 a1msqi4y lnocuo0 lnocuo1 lnocuo21 _1d0g9qk4 lnocuo7""><a aria-label=""Limit results to Perth WA"" class=""_1wkzzau0 _1wkzzauf _1wkzzau0 _1wkzzauf _842p0a0 _842p0a2"" data-automation=""jobLocation"" href=""/jobs-in-administration-office-support/in-All-Perth-WA?salarytype=annual&amp;salaryrange=180000-185000"" rel=""nofollow"" tabindex=""-1"" target=""_self"" title=""Limit results to Perth WA"">Perth WA</a></span></div>]",,Administration-office-support - None,08/02/2024
42,https://www.seek.com.au//job/73101465?type=standout&ref=search-standalone,administration office support,"PA, EA & Secretarial","Assistant Secretary, Governance","Department of Agriculture, Fisheries & Forest",-,180000.0,182500.0,185000.0,Brisbane QLD,"We are seeking a strong, confident and experienced leader to join our Senior Executive leadership team.","[<div class=""_1wkzzau0 a1msqi6m""><span class=""_1wkzzau0 a1msqi4y lnocuo0 lnocuo1 lnocuo21 _1d0g9qk4 lnocuo7""><a aria-label=""Limit results to Brisbane QLD"" class=""_1wkzzau0 _1wkzzauf _1wkzzau0 _1wkzzauf _842p0a0 _842p0a2"" data-automation=""jobLocation"" href=""/jobs-in-administration-office-support/in-All-Brisbane-QLD?salarytype=annual&amp;salaryrange=180000-185000"" rel=""nofollow"" tabindex=""-1"" target=""_self"" title=""Limit results to Brisbane QLD"">Brisbane QLD</a></span></div>]",2024-01-18,Administration-office-support - None,08/02/2024
43,https://www.seek.com.au//job/73610731?type=standout&ref=search-standalone,administration office support,Contracts Administration,Senior Contracts Administrator,Spark NEL DC JV,-,180000.0,182500.0,185000.0,Melbourne VIC,We are seeking a dynamic and highly skilled Senior Contracts Administrator to join our thriving team at North East Link.,"[<div class=""_1wkzzau0 a1msqi6m""><span class=""_1wkzzau0 a1msqi4y lnocuo0 lnocuo1 lnocuo21 _1d0g9qk4 lnocuo7""><a aria-label=""Limit results to Melbourne VIC"" class=""_1wkzzau0 _1wkzzauf _1wkzzau0 _1wkzzauf _842p0a0 _842p0a2"" data-automation=""jobLocation"" href=""/jobs-in-administration-office-support/in-All-Melbourne-VIC?salarytype=annual&amp;salaryrange=180000-185000"" rel=""nofollow"" tabindex=""-1"" target=""_self"" title=""Limit results to Melbourne VIC"">Melbourne VIC</a></span></div>]",,Administration-office-support - None,08/02/2024
44,https://www.seek.com.au//job/73294348?type=standout&ref=search-standalone,administration office support,"PA, EA & Secretarial",Executive Manager to Co-CEOs,Findex,-,180000.0,182500.0,185000.0,Melbourne VIC,Seeking an experienced Executive Manager with prior experience providing EA/Secretarial support to C-Suite/Executive/Board level stakeholders.,"[<div class=""_1wkzzau0 a1msqi6m""><span class=""_1wkzzau0 a1msqi4y lnocuo0 lnocuo1 lnocuo21 _1d0g9qk4 lnocuo7""><a aria-label=""Limit results to Melbourne VIC"" class=""_1wkzzau0 _1wkzzauf _1wkzzau0 _1wkzzauf _842p0a0 _842p0a2"" data-automation=""jobLocation"" href=""/jobs-in-administration-office-support/in-All-Melbourne-VIC?salarytype=annual&amp;salaryrange=180000-185000"" rel=""nofollow"" tabindex=""-1"" target=""_self"" title=""Limit results to Melbourne VIC"">Melbourne VIC</a></span></div>]",2024-01-25,Administration-office-support - None,08/02/2024
45,https://www.seek.com.au//job/72966523?type=standout&ref=search-standalone,administration office support,Contracts Administration,Contract Specialist,Guidera O'Connor,-,180000.0,182500.0,185000.0,Perth WA,"Use your superior knowledge of contract review, preparation and management in this key role","[<div class=""_1wkzzau0 a1msqi6m""><span class=""_1wkzzau0 a1msqi4y lnocuo0 lnocuo1 lnocuo21 _1d0g9qk4 lnocuo7""><a aria-label=""Limit results to Bibra Lake"" class=""_1wkzzau0 _1wkzzauf _1wkzzau0 _1wkzzauf _842p0a0 _842p0a2"" data-automation=""jobLocation"" href=""/jobs-in-administration-office-support/in-Bibra-Lake-WA-6163?salarytype=annual&amp;salaryrange=180000-185000"" rel=""nofollow"" tabindex=""-1"" target=""_self"" title=""Limit results to Bibra Lake"">Bibra Lake</a>, <a aria-label=""Limit results to Perth WA"" class=""_1wkzzau0 _1wkzzauf _1wkzzau0 _1wkzzauf _842p0a0 _842p0a2"" data-automation=""jobLocation"" href=""/jobs-in-administration-office-support/in-All-Perth-WA?salarytype=annual&amp;salaryrange=180000-185000"" rel=""nofollow"" tabindex=""-1"" target=""_self"" title=""Limit results to Perth WA"">Perth WA</a></span></div>]",2024-02-07,Administration-office-support - None,08/02/2024
46,https://www.seek.com.au//job/73446123?type=standout&ref=search-standalone,administration office support,Contracts Administration,Contracts Administrator,Civmec Construction & Engineering,-,180000.0,182500.0,185000.0,Perth WA,Experienced Contract Administrator OR Quantity Surveyor for delivery of  new projects.,"[<div class=""_1wkzzau0 a1msqi6m""><span class=""_1wkzzau0 a1msqi4y lnocuo0 lnocuo1 lnocuo21 _1d0g9qk4 lnocuo7""><a aria-label=""Limit results to Henderson"" class=""_1wkzzau0 _1wkzzauf _1wkzzau0 _1wkzzauf _842p0a0 _842p0a2"" data-automation=""jobLocation"" href=""/jobs-in-administration-office-support/in-Henderson-WA-6166?salarytype=annual&amp;salaryrange=180000-185000"" rel=""nofollow"" tabindex=""-1"" target=""_self"" title=""Limit results to Henderson"">Henderson</a>, <a aria-label=""Limit results to Perth WA"" class=""_1wkzzau0 _1wkzzauf _1wkzzau0 _1wkzzauf _842p0a0 _842p0a2"" data-automation=""jobLocation"" href=""/jobs-in-administration-office-support/in-All-Perth-WA?salarytype=annual&amp;salaryrange=180000-185000"" rel=""nofollow"" tabindex=""-1"" target=""_self"" title=""Limit results to Perth WA"">Perth WA</a></span></div>]",2024-02-01,Administration-office-support - None,08/02/2024
47,https://www.seek.com.au//job/73477739?type=standout&ref=search-standalone,administration office support,Contracts Administration,Senior Contracts Administrator (Regional),Infrastructure People,-,180000.0,182500.0,185000.0,Other,Infrastructure People have an exciting opportunity for a Senior CA to join a Tier 1 principle contractor on a coastal city-shaping project.,"[<div class=""_1wkzzau0 a1msqi6m""><span class=""_1wkzzau0 a1msqi4y lnocuo0 lnocuo1 lnocuo21 _1d0g9qk4 lnocuo7""><a aria-label=""Limit results to Coffs Harbour"" class=""_1wkzzau0 _1wkzzauf _1wkzzau0 _1wkzzauf _842p0a0 _842p0a2"" data-automation=""jobLocation"" href=""/jobs-in-administration-office-support/in-Coffs-Harbour-NSW-2450?salarytype=annual&amp;salaryrange=180000-185000"" rel=""nofollow"" tabindex=""-1"" target=""_self"" title=""Limit results to Coffs Harbour"">Coffs Harbour</a>, <a aria-label=""Limit results to Coffs Harbour &amp; North Coast NSW"" class=""_1wkzzau0 _1wkzzauf _1wkzzau0 _1wkzzauf _842p0a0 _842p0a2"" data-automation=""jobLocation"" href=""/jobs-in-administration-office-support/in-Coffs-Harbour-&amp;-North-Coast-NSW?salarytype=annual&amp;salaryrange=180000-185000"" rel=""nofollow"" tabindex=""-1"" target=""_self"" title=""Limit results to Coffs Harbour &amp; North Coast NSW"">Coffs Harbour &amp; North Coast NSW</a></span></div>]",2024-02-02,Administration-office-support - None,08/02/2024
48,https://www.seek.com.au//job/73084367?type=standout&ref=search-standalone,administration office support,Administrative Assistants,Operations Coordinator,NEXUS MINING PTY LTD,-,180000.0,182500.0,185000.0,Wollongong NSW,Nexus Mining is seeking a highly motivated and experienced Operations Coordinator to join the team.,"[<div class=""_1wkzzau0 a1msqi6m""><span class=""_1wkzzau0 a1msqi4y lnocuo0 lnocuo1 lnocuo21 _1d0g9qk4 lnocuo7""><a aria-label=""Limit results to Wollongong"" class=""_1wkzzau0 _1wkzzauf _1wkzzau0 _1wkzzauf _842p0a0 _842p0a2"" data-automation=""jobLocation"" href=""/jobs-in-administration-office-support/in-Wollongong-NSW-2500?salarytype=annual&amp;salaryrange=180000-185000"" rel=""nofollow"" tabindex=""-1"" target=""_self"" title=""Limit results to Wollongong"">Wollongong</a>, <a aria-label=""Limit results to Wollongong, Illawarra &amp; South Coast NSW"" class=""_1wkzzau0 _1wkzzauf _1wkzzau0 _1wkzzauf _842p0a0 _842p0a2"" data-automation=""jobLocation"" href=""/jobs-in-administration-office-support/in-Wollongong,-Illawarra-&amp;-South-Coast-NSW?salarytype=annual&amp;salaryrange=180000-185000"" rel=""nofollow"" tabindex=""-1"" target=""_self"" title=""Limit results to Wollongong, Illawarra &amp; South Coast NSW"">Wollongong, Illawarra &amp; South Coast NSW</a></span></div>]",2024-01-17,Administration-office-support - None,08/02/2024
49,https://www.seek.com.au//job/73382864?type=standard&ref=search-standalone,administration office support,Contracts Administration,Contracts Administrator,Inverse Group Pty Ltd,-,180000.0,182500.0,185000.0,Perth WA,We're looking for a Contracts Administrator to join our client's Perth based office.,"[<div class=""_1wkzzau0 a1msqi6m""><span class=""_1wkzzau0 a1msqi4y lnocuo0 lnocuo1 lnocuo21 _1d0g9qk4 lnocuo7""><a aria-label=""Limit results to Perth WA"" class=""_1wkzzau0 _1wkzzauf _1wkzzau0 _1wkzzauf _842p0a0 _842p0a2"" data-automation=""jobLocation"" href=""/jobs-in-administration-office-support/in-All-Perth-WA?salarytype=annual&amp;salaryrange=180000-185000"" rel=""nofollow"" tabindex=""-1"" target=""_self"" title=""Limit results to Perth WA"">Perth WA</a></span></div>]",2024-01-30,Administration-office-support - None,08/02/2024
50,https://www.seek.com.au//job/73101472?type=standout&ref=search-standalone,administration office support,"PA, EA & Secretarial","Assistant Secretary, Governance","Department of Agriculture, Fisheries & Forest",-,180000.0,182500.0,185000.0,Perth WA,"We are seeking a strong, confident and experienced leader to join our Senior Executive leadership team.","[<div class=""_1wkzzau0 a1msqi6m""><span class=""_1wkzzau0 a1msqi4y lnocuo0 lnocuo1 lnocuo21 _1d0g9qk4 lnocuo7""><a aria-label=""Limit results to Perth WA"" class=""_1wkzzau0 _1wkzzauf _1wkzzau0 _1wkzzauf _842p0a0 _842p0a2"" data-automation=""jobLocation"" href=""/jobs-in-administration-office-support/in-All-Perth-WA?salarytype=annual&amp;salaryrange=180000-185000"" rel=""nofollow"" tabindex=""-1"" target=""_self"" title=""Limit results to Perth WA"">Perth WA</a></span></div>]",2024-01-18,Administration-office-support - None,08/02/2024
51,https://www.seek.com.au//job/73101503?type=standout&ref=search-standalone,administration office support,"PA, EA & Secretarial","Assistant Secretary, Governance","Department of Agriculture, Fisheries & Forest",-,180000.0,182500.0,185000.0,Adelaide SA,"We are seeking a strong, confident and experienced leader to join our Senior Executive leadership team.","[<div class=""_1wkzzau0 a1msqi6m""><span class=""_1wkzzau0 a1msqi4y lnocuo0 lnocuo1 lnocuo21 _1d0g9qk4 lnocuo7""><a aria-label=""Limit results to Adelaide SA"" class=""_1wkzzau0 _1wkzzauf _1wkzzau0 _1wkzzauf _842p0a0 _842p0a2"" data-automation=""jobLocation"" href=""/jobs-in-administration-office-support/in-All-Adelaide-SA?salarytype=annual&amp;salaryrange=180000-185000"" rel=""nofollow"" tabindex=""-1"" target=""_self"" title=""Limit results to Adelaide SA"">Adelaide SA</a></span></div>]",2024-01-18,Administration-office-support - None,08/02/2024
52,https://www.seek.com.au//job/73101470?type=standout&ref=search-standalone,administration office support,"PA, EA & Secretarial","Assistant Secretary, Governance","Department of Agriculture, Fisheries & Forest",-,180000.0,182500.0,185000.0,Darwin NT,"We are seeking a strong, confident and experienced leader to join our Senior Executive leadership team.","[<div class=""_1wkzzau0 a1msqi6m""><span class=""_1wkzzau0 a1msqi4y lnocuo0 lnocuo1 lnocuo21 _1d0g9qk4 lnocuo7""><a aria-label=""Limit results to Darwin NT"" class=""_1wkzzau0 _1wkzzauf _1wkzzau0 _1wkzzauf _842p0a0 _842p0a2"" data-automation=""jobLocation"" href=""/jobs-in-administration-office-support/in-All-Darwin-NT?salarytype=annual&amp;salaryrange=180000-185000"" rel=""nofollow"" tabindex=""-1"" target=""_self"" title=""Limit results to Darwin NT"">Darwin NT</a></span></div>]",2024-01-18,Administration-office-support - None,08/02/2024
53,https://www.seek.com.au//job/73111836?type=standard&ref=search-standalone,administration office support,Receptionists,Receptionist/EA,Indigeco Pty Ltd,$81.27,146286.0,165643.0,185000.0,Canberra ACT,Exciting opportunity to work for a government department in ACT.,"[<div class=""_1wkzzau0 a1msqi6m""><span class=""_1wkzzau0 a1msqi4y lnocuo0 lnocuo1 lnocuo21 _1d0g9qk4 lnocuo7""><a aria-label=""Limit results to Stirling"" class=""_1wkzzau0 _1wkzzauf _1wkzzau0 _1wkzzauf _842p0a0 _842p0a2"" data-automation=""jobLocation"" href=""/jobs-in-administration-office-support/in-Stirling-ACT-2611?salarytype=annual&amp;salaryrange=180000-185000"" rel=""nofollow"" tabindex=""-1"" target=""_self"" title=""Limit results to Stirling"">Stirling</a>, <a aria-label=""Limit results to Canberra ACT"" class=""_1wkzzau0 _1wkzzauf _1wkzzau0 _1wkzzauf _842p0a0 _842p0a2"" data-automation=""jobLocation"" href=""/jobs-in-administration-office-support/in-All-Canberra-ACT?salarytype=annual&amp;salaryrange=180000-185000"" rel=""nofollow"" tabindex=""-1"" target=""_self"" title=""Limit results to Canberra ACT"">Canberra ACT</a></span></div>, <div class=""_1wkzzau0 a1msqi6m""><div aria-label=""Salary: $81.27"" class=""_1wkzzau0""><span class=""_1wkzzau0 a1msqi4y lnocuo0 lnocuo1 lnocuo21 _1d0g9qk4 lnocuo7"" data-automation=""jobSalary""><span class=""_1wkzzau0 _16v7pfz1 a1msqi4y a1msqi0 a1msqir _16v7pfz3"" style=""--_16v7pfz2:2"">$81.27</span></span></div></div>]",2024-01-18,Administration-office-support - None,08/02/2024
54,https://www.seek.com.au//job/73168306?type=standout&ref=search-standalone,administration office support,"PA, EA & Secretarial",Executive Assistant,MJD Recruitment,-,180000.0,182500.0,185000.0,Sydney NSW,Dynamic EA role in the renewable energy industry. 8+ years of EA experience supporting top executives. Drive efficiency and support CEO's success!,"[<div class=""_1wkzzau0 a1msqi6m""><span class=""_1wkzzau0 a1msqi4y lnocuo0 lnocuo1 lnocuo21 _1d0g9qk4 lnocuo7""><a aria-label=""Limit results to Sydney NSW"" class=""_1wkzzau0 _1wkzzauf _1wkzzau0 _1wkzzauf _842p0a0 _842p0a2"" data-automation=""jobLocation"" href=""/jobs-in-administration-office-support/in-All-Sydney-NSW?salarytype=annual&amp;salaryrange=180000-185000"" rel=""nofollow"" tabindex=""-1"" target=""_self"" title=""Limit results to Sydney NSW"">Sydney NSW</a></span></div>]",2024-01-19,Administration-office-support - None,08/02/2024
55,https://www.seek.com.au//job/73045168?type=standout&ref=search-standalone,administration office support,"PA, EA & Secretarial",Executive / Personal Assistant,Boutique Consulting,$130K + Super,130000.0,157500.0,185000.0,Sydney NSW,A senior role that will see you navigate Executive and Personalised assistance across a diverse set of business and interests,"[<div class=""_1wkzzau0 a1msqi6m""><span class=""_1wkzzau0 a1msqi4y lnocuo0 lnocuo1 lnocuo21 _1d0g9qk4 lnocuo7""><a aria-label=""Limit results to North Sydney"" class=""_1wkzzau0 _1wkzzauf _1wkzzau0 _1wkzzauf _842p0a0 _842p0a2"" data-automation=""jobLocation"" href=""/jobs-in-administration-office-support/in-North-Sydney-NSW-2060?salarytype=annual&amp;salaryrange=180000-185000"" rel=""nofollow"" tabindex=""-1"" target=""_self"" title=""Limit results to North Sydney"">North Sydney</a>, <a aria-label=""Limit results to Sydney NSW"" class=""_1wkzzau0 _1wkzzauf _1wkzzau0 _1wkzzauf _842p0a0 _842p0a2"" data-automation=""jobLocation"" href=""/jobs-in-administration-office-support/in-All-Sydney-NSW?salarytype=annual&amp;salaryrange=180000-185000"" rel=""nofollow"" tabindex=""-1"" target=""_self"" title=""Limit results to Sydney NSW"">Sydney NSW</a></span></div>, <div class=""_1wkzzau0 a1msqi6m""><div aria-label=""Salary: $130K + Super"" class=""_1wkzzau0""><span class=""_1wkzzau0 a1msqi4y lnocuo0 lnocuo1 lnocuo21 _1d0g9qk4 lnocuo7"" data-automation=""jobSalary""><span class=""_1wkzzau0 _16v7pfz1 a1msqi4y a1msqi0 a1msqir _16v7pfz3"" style=""--_16v7pfz2:2"">$130K + Super</span></span></div></div>]",2024-01-16,Administration-office-support - None,08/02/2024
56,https://www.seek.com.au//job/72990597?type=standout&ref=search-standalone,administration office support,Office Management,Factory Office Manager (admin + HR + operation) - footwear manufacturer...,JPC Texson Limited,-,180000.0,182500.0,185000.0,Australia,"THE COMPANY :



 Hong Kong company over 30 years history
 Footwear manufacturer
 Main product : leather casual shoes
 Factory : SE Asia...","[<div class=""_1wkzzau0 a1msqi6m""><span class=""_1wkzzau0 a1msqi4y lnocuo0 lnocuo1 lnocuo21 _1d0g9qk4 lnocuo7""><a aria-label=""Limit results to Australia"" class=""_1wkzzau0 _1wkzzauf _1wkzzau0 _1wkzzauf _842p0a0 _842p0a2"" data-automation=""jobLocation"" href=""/jobs-in-administration-office-support/in-All-Australia?salarytype=annual&amp;salaryrange=180000-185000"" rel=""nofollow"" tabindex=""-1"" target=""_self"" title=""Limit results to Australia"">Australia</a></span></div>]",2024-01-13,Administration-office-support - None,08/02/2024
57,https://www.seek.com.au//job/73509039?type=standout&ref=search-standalone,administration office support,Contracts Administration,Contract Management Advisor,Hays | Procurement,To $90ph,180000.0,182500.0,185000.0,Perth WA,Contract Administration - Post Contract,"[<div class=""_1wkzzau0 a1msqi6m""><span class=""_1wkzzau0 a1msqi4y lnocuo0 lnocuo1 lnocuo21 _1d0g9qk4 lnocuo7""><a aria-label=""Limit results to Perth WA"" class=""_1wkzzau0 _1wkzzauf _1wkzzau0 _1wkzzauf _842p0a0 _842p0a2"" data-automation=""jobLocation"" href=""/jobs-in-administration-office-support/in-All-Perth-WA?salarytype=annual&amp;salaryrange=180000-185000"" rel=""nofollow"" tabindex=""-1"" target=""_self"" title=""Limit results to Perth WA"">Perth WA</a></span></div>, <div class=""_1wkzzau0 a1msqi6m""><div aria-label=""Salary: To $90ph"" class=""_1wkzzau0""><span class=""_1wkzzau0 a1msqi4y lnocuo0 lnocuo1 lnocuo21 _1d0g9qk4 lnocuo7"" data-automation=""jobSalary""><span class=""_1wkzzau0 _16v7pfz1 a1msqi4y a1msqi0 a1msqir _16v7pfz3"" style=""--_16v7pfz2:2"">To $90ph</span></span></div></div>]",2024-02-04,Administration-office-support - None,08/02/2024
58,https://www.seek.com.au//job/73101468?type=standout&ref=search-standalone,administration office support,"PA, EA & Secretarial","Assistant Secretary, Governance","Department of Agriculture, Fisheries & Forest",-,180000.0,182500.0,185000.0,Melbourne VIC,"We are seeking a strong, confident and experienced leader to join our Senior Executive leadership team.","[<div class=""_1wkzzau0 a1msqi6m""><span class=""_1wkzzau0 a1msqi4y lnocuo0 lnocuo1 lnocuo21 _1d0g9qk4 lnocuo7""><a aria-label=""Limit results to Melbourne VIC"" class=""_1wkzzau0 _1wkzzauf _1wkzzau0 _1wkzzauf _842p0a0 _842p0a2"" data-automation=""jobLocation"" href=""/jobs-in-administration-office-support/in-All-Melbourne-VIC?salarytype=annual&amp;salaryrange=180000-185000"" rel=""nofollow"" tabindex=""-1"" target=""_self"" title=""Limit results to Melbourne VIC"">Melbourne VIC</a></span></div>]",2024-01-18,Administration-office-support - None,08/02/2024
59,https://www.seek.com.au//job/73101467?type=standout&ref=search-standalone,administration office support,"PA, EA & Secretarial","Assistant Secretary, Governance","Department of Agriculture, Fisheries & Forest",-,180000.0,182500.0,185000.0,Sydney NSW,"We are seeking a strong, confident and experienced leader to join our Senior Executive leadership team.","[<div class=""_1wkzzau0 a1msqi6m""><span class=""_1wkzzau0 a1msqi4y lnocuo0 lnocuo1 lnocuo21 _1d0g9qk4 lnocuo7""><a aria-label=""Limit results to Sydney NSW"" class=""_1wkzzau0 _1wkzzauf _1wkzzau0 _1wkzzauf _842p0a0 _842p0a2"" data-automation=""jobLocation"" href=""/jobs-in-administration-office-support/in-All-Sydney-NSW?salarytype=annual&amp;salaryrange=180000-185000"" rel=""nofollow"" tabindex=""-1"" target=""_self"" title=""Limit results to Sydney NSW"">Sydney NSW</a></span></div>]",2024-01-18,Administration-office-support - None,08/02/2024
60,https://www.seek.com.au//job/73079759?type=standout&ref=search-standalone,administration office support,Administrative Assistants,Site Administration Superintendent | FIFO | 8/6:4/3 roster | New Camp,Liontown Resources,-,180000.0,182500.0,185000.0,Perth WA,"Join us as part of our Site Administration team and help lead and create our culture by bringing your knowledge, energy and inspiration.","[<div class=""_1wkzzau0 a1msqi6m""><span class=""_1wkzzau0 a1msqi4y lnocuo0 lnocuo1 lnocuo21 _1d0g9qk4 lnocuo7""><a aria-label=""Limit results to Perth WA"" class=""_1wkzzau0 _1wkzzauf _1wkzzau0 _1wkzzauf _842p0a0 _842p0a2"" data-automation=""jobLocation"" href=""/jobs-in-administration-office-support/in-All-Perth-WA?salarytype=annual&amp;salaryrange=180000-185000"" rel=""nofollow"" tabindex=""-1"" target=""_self"" title=""Limit results to Perth WA"">Perth WA</a></span></div>]",2024-01-17,Administration-office-support - None,08/02/2024
61,https://www.seek.com.au//job/73522537?type=standard&ref=search-standalone,administration office support,Contracts Administration,Contract Procurement Specialist - Energy Industry (Sydney),The Aquarium,$650 p/d,156000.0,170500.0,185000.0,Sydney NSW,We are seeking a highly motivated and experienced Contract Procurement Specialist to join our growing team in Sydney. 6 Month Contract. $650 p/d,"[<div class=""_1wkzzau0 a1msqi6m""><span class=""_1wkzzau0 a1msqi4y lnocuo0 lnocuo1 lnocuo21 _1d0g9qk4 lnocuo7""><a aria-label=""Limit results to Sydney NSW"" class=""_1wkzzau0 _1wkzzauf _1wkzzau0 _1wkzzauf _842p0a0 _842p0a2"" data-automation=""jobLocation"" href=""/jobs-in-administration-office-support/in-All-Sydney-NSW?salarytype=annual&amp;salaryrange=180000-185000"" rel=""nofollow"" tabindex=""-1"" target=""_self"" title=""Limit results to Sydney NSW"">Sydney NSW</a></span></div>, <div class=""_1wkzzau0 a1msqi6m""><div aria-label=""Salary: $650 p/d"" class=""_1wkzzau0""><span class=""_1wkzzau0 a1msqi4y lnocuo0 lnocuo1 lnocuo21 _1d0g9qk4 lnocuo7"" data-automation=""jobSalary""><span class=""_1wkzzau0 _16v7pfz1 a1msqi4y a1msqi0 a1msqir _16v7pfz3"" style=""--_16v7pfz2:2"">$650 p/d</span></span></div></div>]",2024-02-05,Administration-office-support - None,08/02/2024
62,https://www.seek.com.au//job/73157249?type=standout&ref=search-standalone,administration office support,Records Management & Document Control,Information Management Service Delivery Coordinator,NES Fircroft,-,180000.0,182500.0,185000.0,Brisbane QLD,Unlock Your Potential with Arrow Energy! Be the driving force behind cutting-edge Information Management solutions.,"[<div class=""_1wkzzau0 a1msqi6m""><span class=""_1wkzzau0 a1msqi4y lnocuo0 lnocuo1 lnocuo21 _1d0g9qk4 lnocuo7""><a aria-label=""Limit results to Brisbane QLD"" class=""_1wkzzau0 _1wkzzauf _1wkzzau0 _1wkzzauf _842p0a0 _842p0a2"" data-automation=""jobLocation"" href=""/jobs-in-administration-office-support/in-All-Brisbane-QLD?salarytype=annual&amp;salaryrange=180000-185000"" rel=""nofollow"" tabindex=""-1"" target=""_self"" title=""Limit results to Brisbane QLD"">Brisbane QLD</a></span></div>]",2024-01-19,Administration-office-support - None,08/02/2024
63,https://www.seek.com.au//job/73154045?type=standout&ref=search-standalone,administration office support,Contracts Administration,Contract Support officer,Jacobs,-,180000.0,182500.0,185000.0,Brisbane QLD,We are looking for a Contract Support Officer to join our team. This role sits in a major project within Defence and has great career progression,"[<div class=""_1wkzzau0 a1msqi6m""><span class=""_1wkzzau0 a1msqi4y lnocuo0 lnocuo1 lnocuo21 _1d0g9qk4 lnocuo7""><a aria-label=""Limit results to Brisbane QLD"" class=""_1wkzzau0 _1wkzzauf _1wkzzau0 _1wkzzauf _842p0a0 _842p0a2"" data-automation=""jobLocation"" href=""/jobs-in-administration-office-support/in-All-Brisbane-QLD?salarytype=annual&amp;salaryrange=180000-185000"" rel=""nofollow"" tabindex=""-1"" target=""_self"" title=""Limit results to Brisbane QLD"">Brisbane QLD</a></span></div>]",2024-01-19,Administration-office-support - None,08/02/2024
