,link,classification,category,title,company,salary,min_salary,average_salary,max_salary,location,description,entireDiv,date_posted,Category,Date
0,https://www.seek.com.au//job/73609829?type=promoted&ref=search-standalone,insurance superannuation,Claims,"Claims Consultant, Professional Indemnity",IAG,-,140000.0,142500.0,145000.0,Sydney NSW,"You will be managing complex professional risk indemnity claims, providing a full legal defence and/or resolution of all claims","[<div class=""_1wkzzau0 a1msqi6m""><span class=""_1wkzzau0 a1msqi4y lnocuo0 lnocuo1 lnocuo21 _1d0g9qk4 lnocuo7""><a aria-label=""Limit results to Sydney NSW"" class=""_1wkzzau0 _1wkzzauf _1wkzzau0 _1wkzzauf _842p0a0 _842p0a2"" data-automation=""jobLocation"" href=""/jobs-in-insurance-superannuation/in-All-Sydney-NSW?salarytype=annual&amp;salaryrange=140000-145000"" rel=""nofollow"" tabindex=""-1"" target=""_self"" title=""Limit results to Sydney NSW"">Sydney NSW</a></span></div>]",,Insurance-superannuation - None,08/02/2024
1,https://www.seek.com.au//job/73539193?type=promoted&ref=search-standalone,insurance superannuation,Other,Client Manager,B & K Consulting,$145000.00 - $165000.00 p.a. + bonus,145000.0,155000.0,165000.0,Sydney NSW,"Client focussed role, based in Asia, focus on Aus and NZ market, variety in role (people and technical), passionate leader and team.","[<div class=""_1wkzzau0 a1msqi6m""><span class=""_1wkzzau0 a1msqi4y lnocuo0 lnocuo1 lnocuo21 _1d0g9qk4 lnocuo7""><a aria-label=""Limit results to Sydney NSW"" class=""_1wkzzau0 _1wkzzauf _1wkzzau0 _1wkzzauf _842p0a0 _842p0a2"" data-automation=""jobLocation"" href=""/jobs-in-insurance-superannuation/in-All-Sydney-NSW?salarytype=annual&amp;salaryrange=140000-145000"" rel=""nofollow"" tabindex=""-1"" target=""_self"" title=""Limit results to Sydney NSW"">Sydney NSW</a></span></div>, <div class=""_1wkzzau0 a1msqi6m""><div aria-label=""Salary: $145000.00 - $165000.00 p.a. + bonus"" class=""_1wkzzau0""><span class=""_1wkzzau0 a1msqi4y lnocuo0 lnocuo1 lnocuo21 _1d0g9qk4 lnocuo7"" data-automation=""jobSalary""><span class=""_1wkzzau0 _16v7pfz1 a1msqi4y a1msqi0 a1msqir _16v7pfz3"" style=""--_16v7pfz2:2"">$145000.00 - $165000.00 p.a. + bonus</span></span></div></div>]",,Insurance-superannuation - None,08/02/2024
2,https://www.seek.com.au//job/73611833?type=standout&ref=search-standalone,insurance superannuation,Brokerage,Account Executive Insurance Broking - Gold Coast,Lighthouse Insurance Brokers,"$90,000 – $120,000 per year plus commission",90000.0,105000.0,120000.0,Gold Coast QLD,"* Exciting opportunity to grow a portfolio of SME & Mid Market 
  clients.
* Competitive salary + commission 
* Dedicated assistant","[<div class=""_1wkzzau0 a1msqi6m""><span class=""_1wkzzau0 a1msqi4y lnocuo0 lnocuo1 lnocuo21 _1d0g9qk4 lnocuo7""><a aria-label=""Limit results to Burleigh Waters"" class=""_1wkzzau0 _1wkzzauf _1wkzzau0 _1wkzzauf _842p0a0 _842p0a2"" data-automation=""jobLocation"" href=""/jobs-in-insurance-superannuation/in-Burleigh-Waters-QLD-4220?salarytype=annual&amp;salaryrange=140000-145000"" rel=""nofollow"" tabindex=""-1"" target=""_self"" title=""Limit results to Burleigh Waters"">Burleigh Waters</a>, <a aria-label=""Limit results to Gold Coast QLD"" class=""_1wkzzau0 _1wkzzauf _1wkzzau0 _1wkzzauf _842p0a0 _842p0a2"" data-automation=""jobLocation"" href=""/jobs-in-insurance-superannuation/in-All-Gold-Coast-QLD?salarytype=annual&amp;salaryrange=140000-145000"" rel=""nofollow"" tabindex=""-1"" target=""_self"" title=""Limit results to Gold Coast QLD"">Gold Coast QLD</a></span></div>, <div class=""_1wkzzau0 a1msqi6m""><div aria-label=""Salary: $90,000 – $120,000 per year plus commission"" class=""_1wkzzau0""><span class=""_1wkzzau0 a1msqi4y lnocuo0 lnocuo1 lnocuo21 _1d0g9qk4 lnocuo7"" data-automation=""jobSalary""><span class=""_1wkzzau0 _16v7pfz1 a1msqi4y a1msqi0 a1msqir _16v7pfz3"" style=""--_16v7pfz2:2"">$90,000 – $120,000 per year plus commission</span></span></div></div>]",,Insurance-superannuation - None,08/02/2024
3,https://www.seek.com.au//job/73573199?type=standout&ref=search-standalone,insurance superannuation,Assessment,Area Manager - Insurance,Haylo People,"$110,000-$140,000 Plus Super",110000.0,125000.0,140000.0,Gold Coast QLD,"Join this global leader in insurance, as a passionate, customer-focused, and experienced leader in this unique opportunity.","[<div class=""_1wkzzau0 a1msqi6m""><span class=""_1wkzzau0 a1msqi4y lnocuo0 lnocuo1 lnocuo21 _1d0g9qk4 lnocuo7""><a aria-label=""Limit results to Gold Coast QLD"" class=""_1wkzzau0 _1wkzzauf _1wkzzau0 _1wkzzauf _842p0a0 _842p0a2"" data-automation=""jobLocation"" href=""/jobs-in-insurance-superannuation/in-All-Gold-Coast-QLD?salarytype=annual&amp;salaryrange=140000-145000"" rel=""nofollow"" tabindex=""-1"" target=""_self"" title=""Limit results to Gold Coast QLD"">Gold Coast QLD</a></span></div>, <div class=""_1wkzzau0 a1msqi6m""><div aria-label=""Salary: $110,000-$140,000 Plus Super"" class=""_1wkzzau0""><span class=""_1wkzzau0 a1msqi4y lnocuo0 lnocuo1 lnocuo21 _1d0g9qk4 lnocuo7"" data-automation=""jobSalary""><span class=""_1wkzzau0 _16v7pfz1 a1msqi4y a1msqi0 a1msqir _16v7pfz3"" style=""--_16v7pfz2:2"">$110,000-$140,000 Plus Super</span></span></div></div>]",2024-02-07,Insurance-superannuation - None,08/02/2024
4,https://www.seek.com.au//job/73610611?type=standout&ref=search-standalone,insurance superannuation,Brokerage,Client Manager,Aon Corporation,-,140000.0,142500.0,145000.0,"Toowoomba, Toowoomba & Darling Downs QLD",We have a fantastic opportunity for a Client Manager to join our close-knit National team. Apply now!,"[<div class=""_1wkzzau0 a1msqi6m""><span class=""_1wkzzau0 a1msqi4y lnocuo0 lnocuo1 lnocuo21 _1d0g9qk4 lnocuo7""><a aria-label=""Limit results to Toowoomba"" class=""_1wkzzau0 _1wkzzauf _1wkzzau0 _1wkzzauf _842p0a0 _842p0a2"" data-automation=""jobLocation"" href=""/jobs-in-insurance-superannuation/in-Toowoomba-QLD-4350?salarytype=annual&amp;salaryrange=140000-145000"" rel=""nofollow"" tabindex=""-1"" target=""_self"" title=""Limit results to Toowoomba"">Toowoomba</a>, <a aria-label=""Limit results to Toowoomba &amp; Darling Downs QLD"" class=""_1wkzzau0 _1wkzzauf _1wkzzau0 _1wkzzauf _842p0a0 _842p0a2"" data-automation=""jobLocation"" href=""/jobs-in-insurance-superannuation/in-Toowoomba-&amp;-Darling-Downs-QLD?salarytype=annual&amp;salaryrange=140000-145000"" rel=""nofollow"" tabindex=""-1"" target=""_self"" title=""Limit results to Toowoomba &amp; Darling Downs QLD"">Toowoomba &amp; Darling Downs QLD</a></span></div>]",,Insurance-superannuation - None,08/02/2024
5,https://www.seek.com.au//job/73516982?type=standout&ref=search-standalone,insurance superannuation,Brokerage,Insurance Brokers / Leaders / Seniors & Account Executives & Assistants /Claims,Insurance Recruitment Services,$70K – $180K per year,70000.0,125000.0,180000.0,Melbourne VIC,"16 new jobs in last week !!!! 
Operations / Team Leader / Mentorship x 3
Seniors / Account Executives 13
Assistant Account Executives x 6
Claims x 2","[<div class=""_1wkzzau0 a1msqi6m""><span class=""_1wkzzau0 a1msqi4y lnocuo0 lnocuo1 lnocuo21 _1d0g9qk4 lnocuo7""><a aria-label=""Limit results to Melbourne VIC"" class=""_1wkzzau0 _1wkzzauf _1wkzzau0 _1wkzzauf _842p0a0 _842p0a2"" data-automation=""jobLocation"" href=""/jobs-in-insurance-superannuation/in-All-Melbourne-VIC?salarytype=annual&amp;salaryrange=140000-145000"" rel=""nofollow"" tabindex=""-1"" target=""_self"" title=""Limit results to Melbourne VIC"">Melbourne VIC</a></span></div>, <div class=""_1wkzzau0 a1msqi6m""><div aria-label=""Salary: $70K – $180K per year"" class=""_1wkzzau0""><span class=""_1wkzzau0 a1msqi4y lnocuo0 lnocuo1 lnocuo21 _1d0g9qk4 lnocuo7"" data-automation=""jobSalary""><span class=""_1wkzzau0 _16v7pfz1 a1msqi4y a1msqi0 a1msqir _16v7pfz3"" style=""--_16v7pfz2:2"">$70K – $180K per year</span></span></div></div>]",2024-02-05,Insurance-superannuation - None,08/02/2024
6,https://www.seek.com.au//job/73585017?type=standout&ref=search-standalone,insurance superannuation,Workers' Compensation,Senior Case Manager,Haylo People,"Up to $110,000 package",140000.0,142500.0,145000.0,Newcastle NSW,Varying opportunities across complex physical claims or psychological claims. Commence with a well reputed and expanding organisation in 2024,"[<div class=""_1wkzzau0 a1msqi6m""><span class=""_1wkzzau0 a1msqi4y lnocuo0 lnocuo1 lnocuo21 _1d0g9qk4 lnocuo7""><a aria-label=""Limit results to Newcastle"" class=""_1wkzzau0 _1wkzzauf _1wkzzau0 _1wkzzauf _842p0a0 _842p0a2"" data-automation=""jobLocation"" href=""/jobs-in-insurance-superannuation/in-Newcastle-NSW-2300?salarytype=annual&amp;salaryrange=140000-145000"" rel=""nofollow"" tabindex=""-1"" target=""_self"" title=""Limit results to Newcastle"">Newcastle</a>, <a aria-label=""Limit results to Newcastle, Maitland &amp; Hunter NSW"" class=""_1wkzzau0 _1wkzzauf _1wkzzau0 _1wkzzauf _842p0a0 _842p0a2"" data-automation=""jobLocation"" href=""/jobs-in-insurance-superannuation/in-Newcastle,-Maitland-&amp;-Hunter-NSW?salarytype=annual&amp;salaryrange=140000-145000"" rel=""nofollow"" tabindex=""-1"" target=""_self"" title=""Limit results to Newcastle, Maitland &amp; Hunter NSW"">Newcastle, Maitland &amp; Hunter NSW</a></span></div>, <div class=""_1wkzzau0 a1msqi6m""><div aria-label=""Salary: Up to $110,000 package"" class=""_1wkzzau0""><span class=""_1wkzzau0 a1msqi4y lnocuo0 lnocuo1 lnocuo21 _1d0g9qk4 lnocuo7"" data-automation=""jobSalary""><span class=""_1wkzzau0 _16v7pfz1 a1msqi4y a1msqi0 a1msqir _16v7pfz3"" style=""--_16v7pfz2:2"">Up to $110,000 package</span></span></div></div>]",2024-02-07,Insurance-superannuation - None,08/02/2024
7,https://www.seek.com.au//job/73281789?type=standout&ref=search-standalone,insurance superannuation,Brokerage,"Insurance Broking, Claims, Operations & Team Manager Positions",Southorn Recruitment Pty Ltd,"$75,000– $200,000 plus super",75000.0,137500.0,200000.0,Melbourne VIC,Exciting roles in the insurance industry? Discover your next move. We are seeking talented individuals. Contact Felicity Southorn- 0412 732 088,"[<div class=""_1wkzzau0 a1msqi6m""><span class=""_1wkzzau0 a1msqi4y lnocuo0 lnocuo1 lnocuo21 _1d0g9qk4 lnocuo7""><a aria-label=""Limit results to Melbourne VIC"" class=""_1wkzzau0 _1wkzzauf _1wkzzau0 _1wkzzauf _842p0a0 _842p0a2"" data-automation=""jobLocation"" href=""/jobs-in-insurance-superannuation/in-All-Melbourne-VIC?salarytype=annual&amp;salaryrange=140000-145000"" rel=""nofollow"" tabindex=""-1"" target=""_self"" title=""Limit results to Melbourne VIC"">Melbourne VIC</a></span></div>, <div class=""_1wkzzau0 a1msqi6m""><div aria-label=""Salary: $75,000– $200,000 plus super"" class=""_1wkzzau0""><span class=""_1wkzzau0 a1msqi4y lnocuo0 lnocuo1 lnocuo21 _1d0g9qk4 lnocuo7"" data-automation=""jobSalary""><span class=""_1wkzzau0 _16v7pfz1 a1msqi4y a1msqi0 a1msqir _16v7pfz3"" style=""--_16v7pfz2:2"">$75,000– $200,000 plus super</span></span></div></div>]",2024-01-24,Insurance-superannuation - None,08/02/2024
8,https://www.seek.com.au//job/73528648?type=standout&ref=search-standalone,insurance superannuation,Brokerage,Insurance Account Manager / Insurance Broker - Maitland,Maxwell Stone Pty Ltd,-,140000.0,142500.0,145000.0,Newcastle NSW,Exceptional opportunity to join a highly reputable & growing insurance brokerage. Manage & grow a client portfolio in this supportive & flexible firm.,"[<div class=""_1wkzzau0 a1msqi6m""><span class=""_1wkzzau0 a1msqi4y lnocuo0 lnocuo1 lnocuo21 _1d0g9qk4 lnocuo7""><a aria-label=""Limit results to Maitland"" class=""_1wkzzau0 _1wkzzauf _1wkzzau0 _1wkzzauf _842p0a0 _842p0a2"" data-automation=""jobLocation"" href=""/jobs-in-insurance-superannuation/in-Maitland-NSW-2320?salarytype=annual&amp;salaryrange=140000-145000"" rel=""nofollow"" tabindex=""-1"" target=""_self"" title=""Limit results to Maitland"">Maitland</a>, <a aria-label=""Limit results to Newcastle, Maitland &amp; Hunter NSW"" class=""_1wkzzau0 _1wkzzauf _1wkzzau0 _1wkzzauf _842p0a0 _842p0a2"" data-automation=""jobLocation"" href=""/jobs-in-insurance-superannuation/in-Newcastle,-Maitland-&amp;-Hunter-NSW?salarytype=annual&amp;salaryrange=140000-145000"" rel=""nofollow"" tabindex=""-1"" target=""_self"" title=""Limit results to Newcastle, Maitland &amp; Hunter NSW"">Newcastle, Maitland &amp; Hunter NSW</a></span></div>]",2024-02-05,Insurance-superannuation - None,08/02/2024
9,https://www.seek.com.au//job/73447884?type=standout&ref=search-standalone,insurance superannuation,Other,APS6 Senior Compliance/Investigations Officers,Robert Walters,$61 - $70 p.h. + Plus Super + Hybrid Working Arran,109800.0,117900.0,126000.0,Canberra ACT,Our Key client in the Federal Government is currently looking for APS6 Senior Compliance/Investigations Officers.,"[<div class=""_1wkzzau0 a1msqi6m""><span class=""_1wkzzau0 a1msqi4y lnocuo0 lnocuo1 lnocuo21 _1d0g9qk4 lnocuo7""><a aria-label=""Limit results to Canberra ACT"" class=""_1wkzzau0 _1wkzzauf _1wkzzau0 _1wkzzauf _842p0a0 _842p0a2"" data-automation=""jobLocation"" href=""/jobs-in-insurance-superannuation/in-All-Canberra-ACT?salarytype=annual&amp;salaryrange=140000-145000"" rel=""nofollow"" tabindex=""-1"" target=""_self"" title=""Limit results to Canberra ACT"">Canberra ACT</a></span></div>, <div class=""_1wkzzau0 a1msqi6m""><div aria-label=""Salary: $61 - $70 p.h. + Plus Super + Hybrid Working Arran"" class=""_1wkzzau0""><span class=""_1wkzzau0 a1msqi4y lnocuo0 lnocuo1 lnocuo21 _1d0g9qk4 lnocuo7"" data-automation=""jobSalary""><span class=""_1wkzzau0 _16v7pfz1 a1msqi4y a1msqi0 a1msqir _16v7pfz3"" style=""--_16v7pfz2:2"">$61 - $70 p.h. + Plus Super + Hybrid Working Arran</span></span></div></div>]",2024-02-01,Insurance-superannuation - None,08/02/2024
10,https://www.seek.com.au//job/73447039?type=standout&ref=search-standalone,insurance superannuation,Other,APS5 Compliance/Investigations Officers,Robert Walters,$52 - $60 p.h. + Plus Super + Hybrid Working Arran,93600.0,100800.0,108000.0,Canberra ACT,Our Key client in the Federal Government is currently looking for APS5 Compliance/Investigations Officers.,"[<div class=""_1wkzzau0 a1msqi6m""><span class=""_1wkzzau0 a1msqi4y lnocuo0 lnocuo1 lnocuo21 _1d0g9qk4 lnocuo7""><a aria-label=""Limit results to Canberra ACT"" class=""_1wkzzau0 _1wkzzauf _1wkzzau0 _1wkzzauf _842p0a0 _842p0a2"" data-automation=""jobLocation"" href=""/jobs-in-insurance-superannuation/in-All-Canberra-ACT?salarytype=annual&amp;salaryrange=140000-145000"" rel=""nofollow"" tabindex=""-1"" target=""_self"" title=""Limit results to Canberra ACT"">Canberra ACT</a></span></div>, <div class=""_1wkzzau0 a1msqi6m""><div aria-label=""Salary: $52 - $60 p.h. + Plus Super + Hybrid Working Arran"" class=""_1wkzzau0""><span class=""_1wkzzau0 a1msqi4y lnocuo0 lnocuo1 lnocuo21 _1d0g9qk4 lnocuo7"" data-automation=""jobSalary""><span class=""_1wkzzau0 _16v7pfz1 a1msqi4y a1msqi0 a1msqir _16v7pfz3"" style=""--_16v7pfz2:2"">$52 - $60 p.h. + Plus Super + Hybrid Working Arran</span></span></div></div>]",2024-02-01,Insurance-superannuation - None,08/02/2024
11,https://www.seek.com.au//job/73517167?type=standout&ref=search-standalone,insurance superannuation,Brokerage,Well Being Insurance Consultants,AIA Australia Limited,Competitive salary package and bonus,140000.0,142500.0,145000.0,Sydney NSW,Help us redefine how people think about insurance and build an innovative culture with health and wellbeing at its heart.,"[<div class=""_1wkzzau0 a1msqi6m""><span class=""_1wkzzau0 a1msqi4y lnocuo0 lnocuo1 lnocuo21 _1d0g9qk4 lnocuo7""><a aria-label=""Limit results to Sydney NSW"" class=""_1wkzzau0 _1wkzzauf _1wkzzau0 _1wkzzauf _842p0a0 _842p0a2"" data-automation=""jobLocation"" href=""/jobs-in-insurance-superannuation/in-All-Sydney-NSW?salarytype=annual&amp;salaryrange=140000-145000"" rel=""nofollow"" tabindex=""-1"" target=""_self"" title=""Limit results to Sydney NSW"">Sydney NSW</a></span></div>, <div class=""_1wkzzau0 a1msqi6m""><div aria-label=""Salary: Competitive salary package and bonus"" class=""_1wkzzau0""><span class=""_1wkzzau0 a1msqi4y lnocuo0 lnocuo1 lnocuo21 _1d0g9qk4 lnocuo7"" data-automation=""jobSalary""><span class=""_1wkzzau0 _16v7pfz1 a1msqi4y a1msqi0 a1msqir _16v7pfz3"" style=""--_16v7pfz2:2"">Competitive salary package and bonus</span></span></div></div>]",2024-02-05,Insurance-superannuation - None,08/02/2024
12,https://www.seek.com.au//job/73539141?type=standout&ref=search-standalone,insurance superannuation,Workers' Compensation,Branch Manager,Gallagher Bassett,-,140000.0,142500.0,145000.0,Darwin NT,Lead our NT Workers Compensation business to deliver superior outcomes and build and maintain strong stakeholder relationships.,"[<div class=""_1wkzzau0 a1msqi6m""><span class=""_1wkzzau0 a1msqi4y lnocuo0 lnocuo1 lnocuo21 _1d0g9qk4 lnocuo7""><a aria-label=""Limit results to Darwin NT"" class=""_1wkzzau0 _1wkzzauf _1wkzzau0 _1wkzzauf _842p0a0 _842p0a2"" data-automation=""jobLocation"" href=""/jobs-in-insurance-superannuation/in-All-Darwin-NT?salarytype=annual&amp;salaryrange=140000-145000"" rel=""nofollow"" tabindex=""-1"" target=""_self"" title=""Limit results to Darwin NT"">Darwin NT</a></span></div>]",2024-02-06,Insurance-superannuation - None,08/02/2024
13,https://www.seek.com.au//job/73575360?type=standout&ref=search-standalone,insurance superannuation,Brokerage,Business Development Advisor,Vero (Suncorp Group),Attractive salary + bonus + great benefits,140000.0,142500.0,145000.0,Melbourne VIC,Join our supportive team and utilise your Insurance BDM experience!,"[<div class=""_1wkzzau0 a1msqi6m""><span class=""_1wkzzau0 a1msqi4y lnocuo0 lnocuo1 lnocuo21 _1d0g9qk4 lnocuo7""><a aria-label=""Limit results to Melbourne VIC"" class=""_1wkzzau0 _1wkzzauf _1wkzzau0 _1wkzzauf _842p0a0 _842p0a2"" data-automation=""jobLocation"" href=""/jobs-in-insurance-superannuation/in-All-Melbourne-VIC?salarytype=annual&amp;salaryrange=140000-145000"" rel=""nofollow"" tabindex=""-1"" target=""_self"" title=""Limit results to Melbourne VIC"">Melbourne VIC</a></span></div>, <div class=""_1wkzzau0 a1msqi6m""><div aria-label=""Salary: Attractive salary + bonus + great benefits"" class=""_1wkzzau0""><span class=""_1wkzzau0 a1msqi4y lnocuo0 lnocuo1 lnocuo21 _1d0g9qk4 lnocuo7"" data-automation=""jobSalary""><span class=""_1wkzzau0 _16v7pfz1 a1msqi4y a1msqi0 a1msqir _16v7pfz3"" style=""--_16v7pfz2:2"">Attractive salary + bonus + great benefits</span></span></div></div>]",2024-02-07,Insurance-superannuation - None,08/02/2024
14,https://www.seek.com.au//job/73452273?type=standard&ref=search-standalone,insurance superannuation,Claims,Claims Manager,,"$110,000 – $130,000 plus super per year",110000.0,120000.0,130000.0,Perth WA,"Rare opportunity to step into a Claims Manager role of a small team - due to retirement.
Don't miss out, apply today!","[<div class=""_1wkzzau0 a1msqi6m""><span class=""_1wkzzau0 a1msqi4y lnocuo0 lnocuo1 lnocuo21 _1d0g9qk4 lnocuo7""><a aria-label=""Limit results to Perth WA"" class=""_1wkzzau0 _1wkzzauf _1wkzzau0 _1wkzzauf _842p0a0 _842p0a2"" data-automation=""jobLocation"" href=""/jobs-in-insurance-superannuation/in-All-Perth-WA?salarytype=annual&amp;salaryrange=140000-145000"" rel=""nofollow"" tabindex=""-1"" target=""_self"" title=""Limit results to Perth WA"">Perth WA</a></span></div>, <div class=""_1wkzzau0 a1msqi6m""><div aria-label=""Salary: $110,000 – $130,000 plus super per year"" class=""_1wkzzau0""><span class=""_1wkzzau0 a1msqi4y lnocuo0 lnocuo1 lnocuo21 _1d0g9qk4 lnocuo7"" data-automation=""jobSalary""><span class=""_1wkzzau0 _16v7pfz1 a1msqi4y a1msqi0 a1msqir _16v7pfz3"" style=""--_16v7pfz2:2"">$110,000 – $130,000 plus super per year</span></span></div></div>]",2024-02-01,Insurance-superannuation - None,08/02/2024
15,https://www.seek.com.au//job/73529043?type=standout&ref=search-standalone,insurance superannuation,Brokerage,Internal Account Executive - Brisbane,Maxwell Stone Pty Ltd,-,140000.0,142500.0,145000.0,Brisbane QLD,Exciting new opportunity for an Internal Account Executive to join this highly respected brokerage and manage an established portfolio of SME clients.,"[<div class=""_1wkzzau0 a1msqi6m""><span class=""_1wkzzau0 a1msqi4y lnocuo0 lnocuo1 lnocuo21 _1d0g9qk4 lnocuo7""><a aria-label=""Limit results to Brisbane QLD"" class=""_1wkzzau0 _1wkzzauf _1wkzzau0 _1wkzzauf _842p0a0 _842p0a2"" data-automation=""jobLocation"" href=""/jobs-in-insurance-superannuation/in-All-Brisbane-QLD?salarytype=annual&amp;salaryrange=140000-145000"" rel=""nofollow"" tabindex=""-1"" target=""_self"" title=""Limit results to Brisbane QLD"">Brisbane QLD</a></span></div>]",2024-02-05,Insurance-superannuation - None,08/02/2024
16,https://www.seek.com.au//job/73540778?type=standout&ref=search-standalone,insurance superannuation,Underwriting,Portfolio Leader,Suncorp,-,140000.0,142500.0,145000.0,Brisbane QLD,Join a high performing Home Product and Portfolio Team.,"[<div class=""_1wkzzau0 a1msqi6m""><span class=""_1wkzzau0 a1msqi4y lnocuo0 lnocuo1 lnocuo21 _1d0g9qk4 lnocuo7""><a aria-label=""Limit results to Brisbane QLD"" class=""_1wkzzau0 _1wkzzauf _1wkzzau0 _1wkzzauf _842p0a0 _842p0a2"" data-automation=""jobLocation"" href=""/jobs-in-insurance-superannuation/in-All-Brisbane-QLD?salarytype=annual&amp;salaryrange=140000-145000"" rel=""nofollow"" tabindex=""-1"" target=""_self"" title=""Limit results to Brisbane QLD"">Brisbane QLD</a></span></div>]",2024-02-06,Insurance-superannuation - None,08/02/2024
17,https://www.seek.com.au//job/73578720?type=standout&ref=search-standalone,insurance superannuation,Claims,Portfolio Analyst (Home Portfolio),Suncorp,-,140000.0,142500.0,145000.0,Brisbane QLD,Contribute to a strong collaborative and supportive culture with a focus on continuous improvement.,"[<div class=""_1wkzzau0 a1msqi6m""><span class=""_1wkzzau0 a1msqi4y lnocuo0 lnocuo1 lnocuo21 _1d0g9qk4 lnocuo7""><a aria-label=""Limit results to Brisbane QLD"" class=""_1wkzzau0 _1wkzzauf _1wkzzau0 _1wkzzauf _842p0a0 _842p0a2"" data-automation=""jobLocation"" href=""/jobs-in-insurance-superannuation/in-All-Brisbane-QLD?salarytype=annual&amp;salaryrange=140000-145000"" rel=""nofollow"" tabindex=""-1"" target=""_self"" title=""Limit results to Brisbane QLD"">Brisbane QLD</a></span></div>]",2024-02-07,Insurance-superannuation - None,08/02/2024
18,https://www.seek.com.au//job/73609829?type=standout&ref=search-standalone,insurance superannuation,Claims,"Claims Consultant, Professional Indemnity",IAG,-,140000.0,142500.0,145000.0,Sydney NSW,"You will be managing complex professional risk indemnity claims, providing a full legal defence and/or resolution of all claims","[<div class=""_1wkzzau0 a1msqi6m""><span class=""_1wkzzau0 a1msqi4y lnocuo0 lnocuo1 lnocuo21 _1d0g9qk4 lnocuo7""><a aria-label=""Limit results to Sydney NSW"" class=""_1wkzzau0 _1wkzzauf _1wkzzau0 _1wkzzauf _842p0a0 _842p0a2"" data-automation=""jobLocation"" href=""/jobs-in-insurance-superannuation/in-All-Sydney-NSW?salarytype=annual&amp;salaryrange=140000-145000"" rel=""nofollow"" tabindex=""-1"" target=""_self"" title=""Limit results to Sydney NSW"">Sydney NSW</a></span></div>]",,Insurance-superannuation - None,08/02/2024
19,https://www.seek.com.au//job/73574980?type=standout&ref=search-standalone,insurance superannuation,Brokerage,Account Executive (different levels) - Job Opportunities,Paragon Recruitment Group,-,140000.0,142500.0,145000.0,Perth WA,"If you are an Insurance Assistant Acc Exec, an Acc Exec or Snr Acc Exec & need a new role with firms that will recognise your skills and develop you.","[<div class=""_1wkzzau0 a1msqi6m""><span class=""_1wkzzau0 a1msqi4y lnocuo0 lnocuo1 lnocuo21 _1d0g9qk4 lnocuo7""><a aria-label=""Limit results to Perth WA"" class=""_1wkzzau0 _1wkzzauf _1wkzzau0 _1wkzzauf _842p0a0 _842p0a2"" data-automation=""jobLocation"" href=""/jobs-in-insurance-superannuation/in-All-Perth-WA?salarytype=annual&amp;salaryrange=140000-145000"" rel=""nofollow"" tabindex=""-1"" target=""_self"" title=""Limit results to Perth WA"">Perth WA</a></span></div>]",2024-02-07,Insurance-superannuation - None,08/02/2024
20,https://www.seek.com.au//job/73351414?type=standout&ref=search-standalone,insurance superannuation,Brokerage,Account Executive,Fuse Recruitment,AUD 80000 - 130000 per annum,140000.0,142500.0,145000.0,Canberra ACT,A fantastic opportunity to join a National Brokerage in their growing Canberra office.,"[<div class=""_1wkzzau0 a1msqi6m""><span class=""_1wkzzau0 a1msqi4y lnocuo0 lnocuo1 lnocuo21 _1d0g9qk4 lnocuo7""><a aria-label=""Limit results to Canberra ACT"" class=""_1wkzzau0 _1wkzzauf _1wkzzau0 _1wkzzauf _842p0a0 _842p0a2"" data-automation=""jobLocation"" href=""/jobs-in-insurance-superannuation/in-All-Canberra-ACT?salarytype=annual&amp;salaryrange=140000-145000"" rel=""nofollow"" tabindex=""-1"" target=""_self"" title=""Limit results to Canberra ACT"">Canberra ACT</a></span></div>, <div class=""_1wkzzau0 a1msqi6m""><div aria-label=""Salary: AUD 80000 - 130000 per annum"" class=""_1wkzzau0""><span class=""_1wkzzau0 a1msqi4y lnocuo0 lnocuo1 lnocuo21 _1d0g9qk4 lnocuo7"" data-automation=""jobSalary""><span class=""_1wkzzau0 _16v7pfz1 a1msqi4y a1msqi0 a1msqir _16v7pfz3"" style=""--_16v7pfz2:2"">AUD 80000 - 130000 per annum</span></span></div></div>]",2024-01-29,Insurance-superannuation - None,08/02/2024
