,link,classification,category,title,company,salary,min_salary,average_salary,max_salary,location,description,entireDiv,date_posted,Category,Date
264,https://www.seek.com.au//job/73317400?type=promoted&ref=search-standalone,marketing communications,Brand Management,Marketing Manager,Frasers Property Australia,-,140000.0,142500.0,145000.0,Sydney NSW,Marketing Manager to join the Retail team based in our Ed Square Town Centre at Edmondson Park 2174,"[<div class=""_1wkzzau0 a1msqi6m""><span class=""_1wkzzau0 a1msqi4y lnocuo0 lnocuo1 lnocuo21 _1d0g9qk4 lnocuo7""><a aria-label=""Limit results to Edmondson Park"" class=""_1wkzzau0 _1wkzzauf _1wkzzau0 _1wkzzauf _842p0a0 _842p0a2"" data-automation=""jobLocation"" href=""/jobs-in-marketing-communications/in-Edmondson-Park-NSW-2174?salarytype=annual&amp;salaryrange=140000-145000"" rel=""nofollow"" tabindex=""-1"" target=""_self"" title=""Limit results to Edmondson Park"">Edmondson Park</a>, <a aria-label=""Limit results to Sydney NSW"" class=""_1wkzzau0 _1wkzzauf _1wkzzau0 _1wkzzauf _842p0a0 _842p0a2"" data-automation=""jobLocation"" href=""/jobs-in-marketing-communications/in-All-Sydney-NSW?salarytype=annual&amp;salaryrange=140000-145000"" rel=""nofollow"" tabindex=""-1"" target=""_self"" title=""Limit results to Sydney NSW"">Sydney NSW</a></span></div>]",,Marketing-communications - None,08/02/2024
265,https://www.seek.com.au//job/73458065?type=promoted&ref=search-standalone,marketing communications,Brand Management,Senior Campaign Manager,Metcash Limited,-,140000.0,142500.0,145000.0,Sydney NSW,Are you a marketing genius with a passion for turning insights and strategies into unforgettable shopper campaigns?,"[<div class=""_1wkzzau0 a1msqi6m""><span class=""_1wkzzau0 a1msqi4y lnocuo0 lnocuo1 lnocuo21 _1d0g9qk4 lnocuo7""><a aria-label=""Limit results to Macquarie Park"" class=""_1wkzzau0 _1wkzzauf _1wkzzau0 _1wkzzauf _842p0a0 _842p0a2"" data-automation=""jobLocation"" href=""/jobs-in-marketing-communications/in-Macquarie-Park-NSW-2113?salarytype=annual&amp;salaryrange=140000-145000"" rel=""nofollow"" tabindex=""-1"" target=""_self"" title=""Limit results to Macquarie Park"">Macquarie Park</a>, <a aria-label=""Limit results to Sydney NSW"" class=""_1wkzzau0 _1wkzzauf _1wkzzau0 _1wkzzauf _842p0a0 _842p0a2"" data-automation=""jobLocation"" href=""/jobs-in-marketing-communications/in-All-Sydney-NSW?salarytype=annual&amp;salaryrange=140000-145000"" rel=""nofollow"" tabindex=""-1"" target=""_self"" title=""Limit results to Sydney NSW"">Sydney NSW</a></span></div>]",,Marketing-communications - None,08/02/2024
266,https://www.seek.com.au//job/73081352?type=standout&ref=search-standalone,marketing communications,Internal Communications,Internal Communications Manager,Newcastle Greater Mutual Group,-,140000.0,142500.0,145000.0,Newcastle NSW,"We are looking for a person who is passionate about people, authenticity and storytelling.","[<div class=""_1wkzzau0 a1msqi6m""><span class=""_1wkzzau0 a1msqi4y lnocuo0 lnocuo1 lnocuo21 _1d0g9qk4 lnocuo7""><a aria-label=""Limit results to Newcastle"" class=""_1wkzzau0 _1wkzzauf _1wkzzau0 _1wkzzauf _842p0a0 _842p0a2"" data-automation=""jobLocation"" href=""/jobs-in-marketing-communications/in-Newcastle-NSW-2300?salarytype=annual&amp;salaryrange=140000-145000"" rel=""nofollow"" tabindex=""-1"" target=""_self"" title=""Limit results to Newcastle"">Newcastle</a>, <a aria-label=""Limit results to Newcastle, Maitland &amp; Hunter NSW"" class=""_1wkzzau0 _1wkzzauf _1wkzzau0 _1wkzzauf _842p0a0 _842p0a2"" data-automation=""jobLocation"" href=""/jobs-in-marketing-communications/in-Newcastle,-Maitland-&amp;-Hunter-NSW?salarytype=annual&amp;salaryrange=140000-145000"" rel=""nofollow"" tabindex=""-1"" target=""_self"" title=""Limit results to Newcastle, Maitland &amp; Hunter NSW"">Newcastle, Maitland &amp; Hunter NSW</a></span></div>]",2024-01-17,Marketing-communications - None,08/02/2024
267,https://www.seek.com.au//job/73615358?type=standout&ref=search-standalone,marketing communications,Digital & Search Marketing,Digital Lead,Hitachi Energy,-,140000.0,142500.0,145000.0,Sydney NSW,Deliver on Hitachi Energy's ambition to advance a sustainable energy future for the Digital market segments in Australia.,"[<div class=""_1wkzzau0 a1msqi6m""><span class=""_1wkzzau0 a1msqi4y lnocuo0 lnocuo1 lnocuo21 _1d0g9qk4 lnocuo7""><a aria-label=""Limit results to Sydney NSW"" class=""_1wkzzau0 _1wkzzauf _1wkzzau0 _1wkzzauf _842p0a0 _842p0a2"" data-automation=""jobLocation"" href=""/jobs-in-marketing-communications/in-All-Sydney-NSW?salarytype=annual&amp;salaryrange=140000-145000"" rel=""nofollow"" tabindex=""-1"" target=""_self"" title=""Limit results to Sydney NSW"">Sydney NSW</a></span></div>]",,Marketing-communications - None,08/02/2024
268,https://www.seek.com.au//job/73351160?type=standout&ref=search-standalone,marketing communications,Management,"Manager, Partnerships and Engagement",SA Water,-,140000.0,142500.0,145000.0,Adelaide SA,Opportunity to lead strategic integration of partnerships and communication within 'Resilient Water Futures.',"[<div class=""_1wkzzau0 a1msqi6m""><span class=""_1wkzzau0 a1msqi4y lnocuo0 lnocuo1 lnocuo21 _1d0g9qk4 lnocuo7""><a aria-label=""Limit results to Adelaide SA"" class=""_1wkzzau0 _1wkzzauf _1wkzzau0 _1wkzzauf _842p0a0 _842p0a2"" data-automation=""jobLocation"" href=""/jobs-in-marketing-communications/in-All-Adelaide-SA?salarytype=annual&amp;salaryrange=140000-145000"" rel=""nofollow"" tabindex=""-1"" target=""_self"" title=""Limit results to Adelaide SA"">Adelaide SA</a></span></div>]",2024-01-29,Marketing-communications - None,08/02/2024
269,https://www.seek.com.au//job/73211584?type=standard&ref=search-standalone,marketing communications,Brand Management,Marketing Executive,Arete Executive,>$100K+base+super+bonus,140000.0,142500.0,145000.0,Brisbane QLD,"•	High growth group of SME companies
•	Indigenous owned and operated
•	Based in BNE, MELB or SYD","[<div class=""_1wkzzau0 a1msqi6m""><span class=""_1wkzzau0 a1msqi4y lnocuo0 lnocuo1 lnocuo21 _1d0g9qk4 lnocuo7""><a aria-label=""Limit results to Brisbane QLD"" class=""_1wkzzau0 _1wkzzauf _1wkzzau0 _1wkzzauf _842p0a0 _842p0a2"" data-automation=""jobLocation"" href=""/jobs-in-marketing-communications/in-All-Brisbane-QLD?salarytype=annual&amp;salaryrange=140000-145000"" rel=""nofollow"" tabindex=""-1"" target=""_self"" title=""Limit results to Brisbane QLD"">Brisbane QLD</a></span></div>, <div class=""_1wkzzau0 a1msqi6m""><div aria-label=""Salary: &gt;$100K+base+super+bonus"" class=""_1wkzzau0""><span class=""_1wkzzau0 a1msqi4y lnocuo0 lnocuo1 lnocuo21 _1d0g9qk4 lnocuo7"" data-automation=""jobSalary""><span class=""_1wkzzau0 _16v7pfz1 a1msqi4y a1msqi0 a1msqir _16v7pfz3"" style=""--_16v7pfz2:2"">&gt;$100K+base+super+bonus</span></span></div></div>]",2024-01-22,Marketing-communications - None,08/02/2024
270,https://www.seek.com.au//job/73266692?type=standout&ref=search-standalone,marketing communications,Management,Head of Marketing and Growth,Southern Cross Support Services,Competitive Package + WFH,140000.0,142500.0,145000.0,Brisbane QLD,Newly created role | Opportunity to build your team | High-growth business | High-visibility leadership position | Design & Implement Growth Strategy,"[<div class=""_1wkzzau0 a1msqi6m""><span class=""_1wkzzau0 a1msqi4y lnocuo0 lnocuo1 lnocuo21 _1d0g9qk4 lnocuo7""><a aria-label=""Limit results to Brisbane QLD"" class=""_1wkzzau0 _1wkzzauf _1wkzzau0 _1wkzzauf _842p0a0 _842p0a2"" data-automation=""jobLocation"" href=""/jobs-in-marketing-communications/in-All-Brisbane-QLD?salarytype=annual&amp;salaryrange=140000-145000"" rel=""nofollow"" tabindex=""-1"" target=""_self"" title=""Limit results to Brisbane QLD"">Brisbane QLD</a></span></div>, <div class=""_1wkzzau0 a1msqi6m""><div aria-label=""Salary: Competitive Package + WFH"" class=""_1wkzzau0""><span class=""_1wkzzau0 a1msqi4y lnocuo0 lnocuo1 lnocuo21 _1d0g9qk4 lnocuo7"" data-automation=""jobSalary""><span class=""_1wkzzau0 _16v7pfz1 a1msqi4y a1msqi0 a1msqir _16v7pfz3"" style=""--_16v7pfz2:2"">Competitive Package + WFH</span></span></div></div>]",2024-01-24,Marketing-communications - None,08/02/2024
271,https://www.seek.com.au//job/73380780?type=standard&ref=search-standalone,marketing communications,Marketing Communications,A06 Senior HR & Communications Advisor,OnTalent Pty Ltd,$70.00 - $75.00 per hour plus super,126000.0,130500.0,135000.0,Brisbane QLD,"We require a talented Communications Advisor within the People & Engagement, Capability & Culture Team, with good solid HR knowledge.","[<div class=""_1wkzzau0 a1msqi6m""><span class=""_1wkzzau0 a1msqi4y lnocuo0 lnocuo1 lnocuo21 _1d0g9qk4 lnocuo7""><a aria-label=""Limit results to Brisbane QLD"" class=""_1wkzzau0 _1wkzzauf _1wkzzau0 _1wkzzauf _842p0a0 _842p0a2"" data-automation=""jobLocation"" href=""/jobs-in-marketing-communications/in-All-Brisbane-QLD?salarytype=annual&amp;salaryrange=140000-145000"" rel=""nofollow"" tabindex=""-1"" target=""_self"" title=""Limit results to Brisbane QLD"">Brisbane QLD</a></span></div>, <div class=""_1wkzzau0 a1msqi6m""><div aria-label=""Salary: $70.00 - $75.00 per hour plus super"" class=""_1wkzzau0""><span class=""_1wkzzau0 a1msqi4y lnocuo0 lnocuo1 lnocuo21 _1d0g9qk4 lnocuo7"" data-automation=""jobSalary""><span class=""_1wkzzau0 _16v7pfz1 a1msqi4y a1msqi0 a1msqir _16v7pfz3"" style=""--_16v7pfz2:2"">$70.00 - $75.00 per hour plus super</span></span></div></div>]",2024-01-30,Marketing-communications - None,08/02/2024
272,https://www.seek.com.au//job/73069179?type=standard&ref=search-standalone,marketing communications,Management,Senior Marketing Manager,Oomf Recruitment,-,140000.0,142500.0,145000.0,Other,Phenomenal opportunity for a highly strategic Senior Marketing Manager to elevate this growing global brand in a hands on and key leadership role.,"[<div class=""_1wkzzau0 a1msqi6m""><span class=""_1wkzzau0 a1msqi4y lnocuo0 lnocuo1 lnocuo21 _1d0g9qk4 lnocuo7""><a aria-label=""Limit results to Byron Bay"" class=""_1wkzzau0 _1wkzzauf _1wkzzau0 _1wkzzauf _842p0a0 _842p0a2"" data-automation=""jobLocation"" href=""/jobs-in-marketing-communications/in-Byron-Bay-NSW-2481?salarytype=annual&amp;salaryrange=140000-145000"" rel=""nofollow"" tabindex=""-1"" target=""_self"" title=""Limit results to Byron Bay"">Byron Bay</a>, <a aria-label=""Limit results to Lismore &amp; Far North Coast NSW"" class=""_1wkzzau0 _1wkzzauf _1wkzzau0 _1wkzzauf _842p0a0 _842p0a2"" data-automation=""jobLocation"" href=""/jobs-in-marketing-communications/in-Lismore-&amp;-Far-North-Coast-NSW?salarytype=annual&amp;salaryrange=140000-145000"" rel=""nofollow"" tabindex=""-1"" target=""_self"" title=""Limit results to Lismore &amp; Far North Coast NSW"">Lismore &amp; Far North Coast NSW</a></span></div>]",2024-01-17,Marketing-communications - None,08/02/2024
273,https://www.seek.com.au//job/73317400?type=standout&ref=search-standalone,marketing communications,Brand Management,Marketing Manager,Frasers Property Australia,-,140000.0,142500.0,145000.0,Sydney NSW,Marketing Manager to join the Retail team based in our Ed Square Town Centre at Edmondson Park 2174,"[<div class=""_1wkzzau0 a1msqi6m""><span class=""_1wkzzau0 a1msqi4y lnocuo0 lnocuo1 lnocuo21 _1d0g9qk4 lnocuo7""><a aria-label=""Limit results to Edmondson Park"" class=""_1wkzzau0 _1wkzzauf _1wkzzau0 _1wkzzauf _842p0a0 _842p0a2"" data-automation=""jobLocation"" href=""/jobs-in-marketing-communications/in-Edmondson-Park-NSW-2174?salarytype=annual&amp;salaryrange=140000-145000"" rel=""nofollow"" tabindex=""-1"" target=""_self"" title=""Limit results to Edmondson Park"">Edmondson Park</a>, <a aria-label=""Limit results to Sydney NSW"" class=""_1wkzzau0 _1wkzzauf _1wkzzau0 _1wkzzauf _842p0a0 _842p0a2"" data-automation=""jobLocation"" href=""/jobs-in-marketing-communications/in-All-Sydney-NSW?salarytype=annual&amp;salaryrange=140000-145000"" rel=""nofollow"" tabindex=""-1"" target=""_self"" title=""Limit results to Sydney NSW"">Sydney NSW</a></span></div>]",2024-01-25,Marketing-communications - None,08/02/2024
274,https://www.seek.com.au//job/73390228?type=standout&ref=search-standalone,marketing communications,Brand Management,Brand Manager - Coles Own Brand,Coles,-,140000.0,142500.0,145000.0,Melbourne VIC,"Manage an assigned portfolio of brands, to deliver the Own Brand strategy for growth across Fresh categories.","[<div class=""_1wkzzau0 a1msqi6m""><span class=""_1wkzzau0 a1msqi4y lnocuo0 lnocuo1 lnocuo21 _1d0g9qk4 lnocuo7""><a aria-label=""Limit results to Hawthorn East"" class=""_1wkzzau0 _1wkzzauf _1wkzzau0 _1wkzzauf _842p0a0 _842p0a2"" data-automation=""jobLocation"" href=""/jobs-in-marketing-communications/in-Hawthorn-East-VIC-3123?salarytype=annual&amp;salaryrange=140000-145000"" rel=""nofollow"" tabindex=""-1"" target=""_self"" title=""Limit results to Hawthorn East"">Hawthorn East</a>, <a aria-label=""Limit results to Melbourne VIC"" class=""_1wkzzau0 _1wkzzauf _1wkzzau0 _1wkzzauf _842p0a0 _842p0a2"" data-automation=""jobLocation"" href=""/jobs-in-marketing-communications/in-All-Melbourne-VIC?salarytype=annual&amp;salaryrange=140000-145000"" rel=""nofollow"" tabindex=""-1"" target=""_self"" title=""Limit results to Melbourne VIC"">Melbourne VIC</a></span></div>]",2024-01-30,Marketing-communications - None,08/02/2024
275,https://www.seek.com.au//job/73287832?type=standout&ref=search-standalone,marketing communications,Management,International Marketing Manager,ThinkTribe Pty Ltd,"$100,000 – $120,000 per year",100000.0,110000.0,120000.0,Perth WA,"Join an expanding, well-established international recruitment company and help drive business growth in new markets and deliver a rebrand.","[<div class=""_1wkzzau0 a1msqi6m""><span class=""_1wkzzau0 a1msqi4y lnocuo0 lnocuo1 lnocuo21 _1d0g9qk4 lnocuo7""><a aria-label=""Limit results to Perth WA"" class=""_1wkzzau0 _1wkzzauf _1wkzzau0 _1wkzzauf _842p0a0 _842p0a2"" data-automation=""jobLocation"" href=""/jobs-in-marketing-communications/in-All-Perth-WA?salarytype=annual&amp;salaryrange=140000-145000"" rel=""nofollow"" tabindex=""-1"" target=""_self"" title=""Limit results to Perth WA"">Perth WA</a></span></div>, <div class=""_1wkzzau0 a1msqi6m""><div aria-label=""Salary: $100,000 – $120,000 per year"" class=""_1wkzzau0""><span class=""_1wkzzau0 a1msqi4y lnocuo0 lnocuo1 lnocuo21 _1d0g9qk4 lnocuo7"" data-automation=""jobSalary""><span class=""_1wkzzau0 _16v7pfz1 a1msqi4y a1msqi0 a1msqir _16v7pfz3"" style=""--_16v7pfz2:2"">$100,000 – $120,000 per year</span></span></div></div>]",2024-01-24,Marketing-communications - None,08/02/2024
276,https://www.seek.com.au//job/73513047?type=standout&ref=search-standalone,marketing communications,Marketing Communications,Community Relations Advisor (Greensborough),ACCIONA Australia,-,140000.0,142500.0,145000.0,Melbourne VIC,Major Infrastructure Project. Great supportive team. Bundoora based.,"[<div class=""_1wkzzau0 a1msqi6m""><span class=""_1wkzzau0 a1msqi4y lnocuo0 lnocuo1 lnocuo21 _1d0g9qk4 lnocuo7""><a aria-label=""Limit results to Greensborough"" class=""_1wkzzau0 _1wkzzauf _1wkzzau0 _1wkzzauf _842p0a0 _842p0a2"" data-automation=""jobLocation"" href=""/jobs-in-marketing-communications/in-Greensborough-VIC-3088?salarytype=annual&amp;salaryrange=140000-145000"" rel=""nofollow"" tabindex=""-1"" target=""_self"" title=""Limit results to Greensborough"">Greensborough</a>, <a aria-label=""Limit results to Melbourne VIC"" class=""_1wkzzau0 _1wkzzauf _1wkzzau0 _1wkzzauf _842p0a0 _842p0a2"" data-automation=""jobLocation"" href=""/jobs-in-marketing-communications/in-All-Melbourne-VIC?salarytype=annual&amp;salaryrange=140000-145000"" rel=""nofollow"" tabindex=""-1"" target=""_self"" title=""Limit results to Melbourne VIC"">Melbourne VIC</a></span></div>]",2024-02-05,Marketing-communications - None,08/02/2024
277,https://www.seek.com.au//job/73624330?type=standout&ref=search-standalone,marketing communications,Brand Management,Project Manager,Torrens University Australia,-,140000.0,142500.0,145000.0,Sydney NSW,The Project Managers in the team will work closely with the Enterprise Portfolio Team to: ensure initiatives that align with Torren’s strategic.,"[<div class=""_1wkzzau0 a1msqi6m""><span class=""_1wkzzau0 a1msqi4y lnocuo0 lnocuo1 lnocuo21 _1d0g9qk4 lnocuo7""><a aria-label=""Limit results to Sydney NSW"" class=""_1wkzzau0 _1wkzzauf _1wkzzau0 _1wkzzauf _842p0a0 _842p0a2"" data-automation=""jobLocation"" href=""/jobs-in-marketing-communications/in-All-Sydney-NSW?salarytype=annual&amp;salaryrange=140000-145000"" rel=""nofollow"" tabindex=""-1"" target=""_self"" title=""Limit results to Sydney NSW"">Sydney NSW</a></span></div>]",,Marketing-communications - None,08/02/2024
278,https://www.seek.com.au//job/73446445?type=standout&ref=search-standalone,marketing communications,Marketing Communications,Senior Communications Officer- Stakeholder Engagement and Media,Austroads Ltd,-,140000.0,142500.0,145000.0,Melbourne VIC,Austroads seeks a talented and creative person to develop strategic media strategies and implement project-based stakeholder engagement activities.,"[<div class=""_1wkzzau0 a1msqi6m""><span class=""_1wkzzau0 a1msqi4y lnocuo0 lnocuo1 lnocuo21 _1d0g9qk4 lnocuo7""><a aria-label=""Limit results to Melbourne VIC"" class=""_1wkzzau0 _1wkzzauf _1wkzzau0 _1wkzzauf _842p0a0 _842p0a2"" data-automation=""jobLocation"" href=""/jobs-in-marketing-communications/in-All-Melbourne-VIC?salarytype=annual&amp;salaryrange=140000-145000"" rel=""nofollow"" tabindex=""-1"" target=""_self"" title=""Limit results to Melbourne VIC"">Melbourne VIC</a></span></div>]",2024-02-01,Marketing-communications - None,08/02/2024
279,https://www.seek.com.au//job/73352000?type=standout&ref=search-standalone,marketing communications,Other,Head of Strategic Communications,Djirra,-,140000.0,142500.0,145000.0,Melbourne VIC,"Working closely with the Office of the CEO, to develop and execute the internal and external strategic communications strategy.","[<div class=""_1wkzzau0 a1msqi6m""><span class=""_1wkzzau0 a1msqi4y lnocuo0 lnocuo1 lnocuo21 _1d0g9qk4 lnocuo7""><a aria-label=""Limit results to Collingwood"" class=""_1wkzzau0 _1wkzzauf _1wkzzau0 _1wkzzauf _842p0a0 _842p0a2"" data-automation=""jobLocation"" href=""/jobs-in-marketing-communications/in-Collingwood-VIC-3066?salarytype=annual&amp;salaryrange=140000-145000"" rel=""nofollow"" tabindex=""-1"" target=""_self"" title=""Limit results to Collingwood"">Collingwood</a>, <a aria-label=""Limit results to Melbourne VIC"" class=""_1wkzzau0 _1wkzzauf _1wkzzau0 _1wkzzauf _842p0a0 _842p0a2"" data-automation=""jobLocation"" href=""/jobs-in-marketing-communications/in-All-Melbourne-VIC?salarytype=annual&amp;salaryrange=140000-145000"" rel=""nofollow"" tabindex=""-1"" target=""_self"" title=""Limit results to Melbourne VIC"">Melbourne VIC</a></span></div>]",2024-01-29,Marketing-communications - None,08/02/2024
280,https://www.seek.com.au//job/73388810?type=standard&ref=search-standalone,marketing communications,Brand Management,Senior Brand Strategist,WOW Recruitment,AUD 140000 - 150000 per annum,140000.0,142500.0,145000.0,Sydney NSW,"Senior Brand Strategist / Manager  Sydney $140,000 - $150,000 + Super     WOW Recruitment is on the lookout for a creative thinker with a","[<div class=""_1wkzzau0 a1msqi6m""><span class=""_1wkzzau0 a1msqi4y lnocuo0 lnocuo1 lnocuo21 _1d0g9qk4 lnocuo7""><a aria-label=""Limit results to St Leonards"" class=""_1wkzzau0 _1wkzzauf _1wkzzau0 _1wkzzauf _842p0a0 _842p0a2"" data-automation=""jobLocation"" href=""/jobs-in-marketing-communications/in-St-Leonards-NSW-2065?salarytype=annual&amp;salaryrange=140000-145000"" rel=""nofollow"" tabindex=""-1"" target=""_self"" title=""Limit results to St Leonards"">St Leonards</a>, <a aria-label=""Limit results to Sydney NSW"" class=""_1wkzzau0 _1wkzzauf _1wkzzau0 _1wkzzauf _842p0a0 _842p0a2"" data-automation=""jobLocation"" href=""/jobs-in-marketing-communications/in-All-Sydney-NSW?salarytype=annual&amp;salaryrange=140000-145000"" rel=""nofollow"" tabindex=""-1"" target=""_self"" title=""Limit results to Sydney NSW"">Sydney NSW</a></span></div>, <div class=""_1wkzzau0 a1msqi6m""><div aria-label=""Salary: AUD 140000 - 150000 per annum"" class=""_1wkzzau0""><span class=""_1wkzzau0 a1msqi4y lnocuo0 lnocuo1 lnocuo21 _1d0g9qk4 lnocuo7"" data-automation=""jobSalary""><span class=""_1wkzzau0 _16v7pfz1 a1msqi4y a1msqi0 a1msqir _16v7pfz3"" style=""--_16v7pfz2:2"">AUD 140000 - 150000 per annum</span></span></div></div>]",2024-01-30,Marketing-communications - None,08/02/2024
281,https://www.seek.com.au//job/73445783?type=standout&ref=search-standalone,marketing communications,Digital & Search Marketing,Digital / Marketing Insights Analyst,Kitchen Warehouse Pty Ltd,Competitive Salary + Generous Discounts,140000.0,142500.0,145000.0,Perth WA,We are looking for people who share our love of cooking and entertaining to join our Marketing Team as Digital/Marketing Insights Analyst.,"[<div class=""_1wkzzau0 a1msqi6m""><span class=""_1wkzzau0 a1msqi4y lnocuo0 lnocuo1 lnocuo21 _1d0g9qk4 lnocuo7""><a aria-label=""Limit results to Perth WA"" class=""_1wkzzau0 _1wkzzauf _1wkzzau0 _1wkzzauf _842p0a0 _842p0a2"" data-automation=""jobLocation"" href=""/jobs-in-marketing-communications/in-All-Perth-WA?salarytype=annual&amp;salaryrange=140000-145000"" rel=""nofollow"" tabindex=""-1"" target=""_self"" title=""Limit results to Perth WA"">Perth WA</a></span></div>, <div class=""_1wkzzau0 a1msqi6m""><div aria-label=""Salary: Competitive Salary + Generous Discounts"" class=""_1wkzzau0""><span class=""_1wkzzau0 a1msqi4y lnocuo0 lnocuo1 lnocuo21 _1d0g9qk4 lnocuo7"" data-automation=""jobSalary""><span class=""_1wkzzau0 _16v7pfz1 a1msqi4y a1msqi0 a1msqir _16v7pfz3"" style=""--_16v7pfz2:2"">Competitive Salary + Generous Discounts</span></span></div></div>]",2024-02-01,Marketing-communications - None,08/02/2024
282,https://www.seek.com.au//job/73398629?type=standout&ref=search-standalone,marketing communications,Marketing Communications,Content and Communications Specialist,Woods Bagot Pty Ltd,-,140000.0,142500.0,145000.0,Sydney NSW,Woods Bagot are looking for a Content and Communications Specialist to join their Sydney team on a permanent basis.,"[<div class=""_1wkzzau0 a1msqi6m""><span class=""_1wkzzau0 a1msqi4y lnocuo0 lnocuo1 lnocuo21 _1d0g9qk4 lnocuo7""><a aria-label=""Limit results to Sydney NSW"" class=""_1wkzzau0 _1wkzzauf _1wkzzau0 _1wkzzauf _842p0a0 _842p0a2"" data-automation=""jobLocation"" href=""/jobs-in-marketing-communications/in-All-Sydney-NSW?salarytype=annual&amp;salaryrange=140000-145000"" rel=""nofollow"" tabindex=""-1"" target=""_self"" title=""Limit results to Sydney NSW"">Sydney NSW</a></span></div>]",2024-01-30,Marketing-communications - None,08/02/2024
283,https://www.seek.com.au//job/73515124?type=standout&ref=search-standalone,marketing communications,Other,Community Advisor,ACCIONA Australia,-,140000.0,142500.0,145000.0,Sydney NSW,"Oversee stakeholder engagement, handle inquiries and complaints, and produce and distribute notices, letters, and presentations.","[<div class=""_1wkzzau0 a1msqi6m""><span class=""_1wkzzau0 a1msqi4y lnocuo0 lnocuo1 lnocuo21 _1d0g9qk4 lnocuo7""><a aria-label=""Limit results to Sydney NSW"" class=""_1wkzzau0 _1wkzzauf _1wkzzau0 _1wkzzauf _842p0a0 _842p0a2"" data-automation=""jobLocation"" href=""/jobs-in-marketing-communications/in-All-Sydney-NSW?salarytype=annual&amp;salaryrange=140000-145000"" rel=""nofollow"" tabindex=""-1"" target=""_self"" title=""Limit results to Sydney NSW"">Sydney NSW</a></span></div>]",2024-02-05,Marketing-communications - None,08/02/2024
284,https://www.seek.com.au//job/73317401?type=standout&ref=search-standalone,marketing communications,Management,Marketing Manager,Frasers Property Australia,-,140000.0,142500.0,145000.0,Sydney NSW,Marketing Manager to join the Retail team based in our Ed Square Town Centre at Edmondson Park 2174,"[<div class=""_1wkzzau0 a1msqi6m""><span class=""_1wkzzau0 a1msqi4y lnocuo0 lnocuo1 lnocuo21 _1d0g9qk4 lnocuo7""><a aria-label=""Limit results to Edmondson Park"" class=""_1wkzzau0 _1wkzzauf _1wkzzau0 _1wkzzauf _842p0a0 _842p0a2"" data-automation=""jobLocation"" href=""/jobs-in-marketing-communications/in-Edmondson-Park-NSW-2174?salarytype=annual&amp;salaryrange=140000-145000"" rel=""nofollow"" tabindex=""-1"" target=""_self"" title=""Limit results to Edmondson Park"">Edmondson Park</a>, <a aria-label=""Limit results to Sydney NSW"" class=""_1wkzzau0 _1wkzzauf _1wkzzau0 _1wkzzauf _842p0a0 _842p0a2"" data-automation=""jobLocation"" href=""/jobs-in-marketing-communications/in-All-Sydney-NSW?salarytype=annual&amp;salaryrange=140000-145000"" rel=""nofollow"" tabindex=""-1"" target=""_self"" title=""Limit results to Sydney NSW"">Sydney NSW</a></span></div>]",2024-01-25,Marketing-communications - None,08/02/2024
