,link,classification,category,title,company,salary,min_salary,average_salary,max_salary,location,description,entireDiv,date_posted,Category,Date
19,https://www.seek.com.au//job/73409189?type=standard&ref=search-standalone,administration office support,Administrative Assistants,Cost Administrator,Martinus Rail,-,180000.0,182500.0,185000.0,Brisbane QLD,The Company   Martinus is a 100% Australian-owned and operated rail construction company working on some of Australia's largest rail infrastructure...,"[<div class=""_1wkzzau0 a1msqi6m""><span class=""_1wkzzau0 a1msqi4y lnocuo0 lnocuo1 lnocuo21 _1d0g9qk4 lnocuo7""><a aria-label=""Limit results to Brisbane QLD"" class=""_1wkzzau0 _1wkzzauf _1wkzzau0 _1wkzzauf _842p0a0 _842p0a2"" data-automation=""jobLocation"" href=""/jobs-in-administration-office-support/in-All-Brisbane-QLD?salarytype=annual&amp;salaryrange=180000-185000"" rel=""nofollow"" tabindex=""-1"" target=""_self"" title=""Limit results to Brisbane QLD"">Brisbane QLD</a></span></div>]",2024-01-31,Administration-office-support - None,08/02/2024
20,https://www.seek.com.au//job/73472947?type=standard&ref=search-standalone,administration office support,Records Management & Document Control,Strategic Records Manager,Public Sector People,$95 per hour + super,171000.0,178000.0,185000.0,Brisbane QLD,As the Strategic Records Manager - Archivist you will lead the strategic governance of records within a busy Queensland Government Department,"[<div class=""_1wkzzau0 a1msqi6m""><span class=""_1wkzzau0 a1msqi4y lnocuo0 lnocuo1 lnocuo21 _1d0g9qk4 lnocuo7""><a aria-label=""Limit results to Brisbane QLD"" class=""_1wkzzau0 _1wkzzauf _1wkzzau0 _1wkzzauf _842p0a0 _842p0a2"" data-automation=""jobLocation"" href=""/jobs-in-administration-office-support/in-All-Brisbane-QLD?salarytype=annual&amp;salaryrange=180000-185000"" rel=""nofollow"" tabindex=""-1"" target=""_self"" title=""Limit results to Brisbane QLD"">Brisbane QLD</a></span></div>, <div class=""_1wkzzau0 a1msqi6m""><div aria-label=""Salary: $95 per hour + super"" class=""_1wkzzau0""><span class=""_1wkzzau0 a1msqi4y lnocuo0 lnocuo1 lnocuo21 _1d0g9qk4 lnocuo7"" data-automation=""jobSalary""><span class=""_1wkzzau0 _16v7pfz1 a1msqi4y a1msqi0 a1msqir _16v7pfz3"" style=""--_16v7pfz2:2"">$95 per hour + super</span></span></div></div>]",2024-02-02,Administration-office-support - None,08/02/2024
21,https://www.seek.com.au//job/73553309?type=standout&ref=search-standalone,administration office support,Office Management,Manager Cabinet and Parliamentary Submissions,Department of Health - Queensland,-,180000.0,182500.0,185000.0,Brisbane QLD,Temporary full-time opportunity (with a possibility of extension) based in Brisbane CBD,"[<div class=""_1wkzzau0 a1msqi6m""><span class=""_1wkzzau0 a1msqi4y lnocuo0 lnocuo1 lnocuo21 _1d0g9qk4 lnocuo7""><a aria-label=""Limit results to Brisbane QLD"" class=""_1wkzzau0 _1wkzzauf _1wkzzau0 _1wkzzauf _842p0a0 _842p0a2"" data-automation=""jobLocation"" href=""/jobs-in-administration-office-support/in-All-Brisbane-QLD?salarytype=annual&amp;salaryrange=180000-185000"" rel=""nofollow"" tabindex=""-1"" target=""_self"" title=""Limit results to Brisbane QLD"">Brisbane QLD</a></span></div>]",2024-02-06,Administration-office-support - None,08/02/2024
22,https://www.seek.com.au//job/73428356?type=standout&ref=search-standalone,administration office support,Other,Site Administrator,UGL Services - Resources and Energy West,-,180000.0,182500.0,185000.0,Darwin NT,UGL has an opportunity for a Site Administrator to work on an O&G Brownfield Construction Project in Darwin. Monday-Friday residential role.,"[<div class=""_1wkzzau0 a1msqi6m""><span class=""_1wkzzau0 a1msqi4y lnocuo0 lnocuo1 lnocuo21 _1d0g9qk4 lnocuo7""><a aria-label=""Limit results to Darwin NT"" class=""_1wkzzau0 _1wkzzauf _1wkzzau0 _1wkzzauf _842p0a0 _842p0a2"" data-automation=""jobLocation"" href=""/jobs-in-administration-office-support/in-All-Darwin-NT?salarytype=annual&amp;salaryrange=180000-185000"" rel=""nofollow"" tabindex=""-1"" target=""_self"" title=""Limit results to Darwin NT"">Darwin NT</a></span></div>]",2024-01-31,Administration-office-support - None,08/02/2024
23,https://www.seek.com.au//job/73597746?type=standout&ref=search-standalone,administration office support,Administrative Assistants,Site Administrators (50D),IronMerge Pty Ltd,-,180000.0,182500.0,185000.0,Perth WA,IronMerge are seeking Indigenous Australians for site administration opportunities in the mining and construction industries,"[<div class=""_1wkzzau0 a1msqi6m""><span class=""_1wkzzau0 a1msqi4y lnocuo0 lnocuo1 lnocuo21 _1d0g9qk4 lnocuo7""><a aria-label=""Limit results to Perth WA"" class=""_1wkzzau0 _1wkzzauf _1wkzzau0 _1wkzzauf _842p0a0 _842p0a2"" data-automation=""jobLocation"" href=""/jobs-in-administration-office-support/in-All-Perth-WA?salarytype=annual&amp;salaryrange=180000-185000"" rel=""nofollow"" tabindex=""-1"" target=""_self"" title=""Limit results to Perth WA"">Perth WA</a></span></div>]",2024-02-07,Administration-office-support - None,08/02/2024
24,https://www.seek.com.au//job/73453756?type=standout&ref=search-standalone,administration office support,"PA, EA & Secretarial",Executive Coordinator,"Talent – Specialists in tech, transformation & beyond",Up to $602.55 p.d.,180000.0,182500.0,185000.0,Melbourne VIC,12 month initial contract | Federal Government Agency | Richmond or Geelong | $602.55 + Super daily | 2 days working from home,"[<div class=""_1wkzzau0 a1msqi6m""><span class=""_1wkzzau0 a1msqi4y lnocuo0 lnocuo1 lnocuo21 _1d0g9qk4 lnocuo7""><a aria-label=""Limit results to Richmond"" class=""_1wkzzau0 _1wkzzauf _1wkzzau0 _1wkzzauf _842p0a0 _842p0a2"" data-automation=""jobLocation"" href=""/jobs-in-administration-office-support/in-Richmond-VIC-3121?salarytype=annual&amp;salaryrange=180000-185000"" rel=""nofollow"" tabindex=""-1"" target=""_self"" title=""Limit results to Richmond"">Richmond</a>, <a aria-label=""Limit results to Melbourne VIC"" class=""_1wkzzau0 _1wkzzauf _1wkzzau0 _1wkzzauf _842p0a0 _842p0a2"" data-automation=""jobLocation"" href=""/jobs-in-administration-office-support/in-All-Melbourne-VIC?salarytype=annual&amp;salaryrange=180000-185000"" rel=""nofollow"" tabindex=""-1"" target=""_self"" title=""Limit results to Melbourne VIC"">Melbourne VIC</a></span></div>, <div class=""_1wkzzau0 a1msqi6m""><div aria-label=""Salary: Up to $602.55 p.d."" class=""_1wkzzau0""><span class=""_1wkzzau0 a1msqi4y lnocuo0 lnocuo1 lnocuo21 _1d0g9qk4 lnocuo7"" data-automation=""jobSalary""><span class=""_1wkzzau0 _16v7pfz1 a1msqi4y a1msqi0 a1msqir _16v7pfz3"" style=""--_16v7pfz2:2"">Up to $602.55 p.d.</span></span></div></div>]",2024-02-01,Administration-office-support - None,08/02/2024
25,https://www.seek.com.au//job/73387567?type=standout&ref=search-standalone,administration office support,"PA, EA & Secretarial",Executive Assistant,MinterEllison,-,180000.0,182500.0,185000.0,Brisbane QLD,"Elevate your career in Australia's premier law firm—excel in dynamic business services, collaborating with elite legal professionals.","[<div class=""_1wkzzau0 a1msqi6m""><span class=""_1wkzzau0 a1msqi4y lnocuo0 lnocuo1 lnocuo21 _1d0g9qk4 lnocuo7""><a aria-label=""Limit results to Brisbane QLD"" class=""_1wkzzau0 _1wkzzauf _1wkzzau0 _1wkzzauf _842p0a0 _842p0a2"" data-automation=""jobLocation"" href=""/jobs-in-administration-office-support/in-All-Brisbane-QLD?salarytype=annual&amp;salaryrange=180000-185000"" rel=""nofollow"" tabindex=""-1"" target=""_self"" title=""Limit results to Brisbane QLD"">Brisbane QLD</a></span></div>]",2024-01-30,Administration-office-support - None,08/02/2024
26,https://www.seek.com.au//job/73522361?type=standout&ref=search-standalone,administration office support,Office Management,Legal Practice Administration Manager,Herbert Smith Freehills,-,180000.0,182500.0,185000.0,Sydney NSW,Manage a sizable team of legal support colleagues to enhance service quality for legal teams,"[<div class=""_1wkzzau0 a1msqi6m""><span class=""_1wkzzau0 a1msqi4y lnocuo0 lnocuo1 lnocuo21 _1d0g9qk4 lnocuo7""><a aria-label=""Limit results to Sydney NSW"" class=""_1wkzzau0 _1wkzzauf _1wkzzau0 _1wkzzauf _842p0a0 _842p0a2"" data-automation=""jobLocation"" href=""/jobs-in-administration-office-support/in-All-Sydney-NSW?salarytype=annual&amp;salaryrange=180000-185000"" rel=""nofollow"" tabindex=""-1"" target=""_self"" title=""Limit results to Sydney NSW"">Sydney NSW</a></span></div>]",2024-02-05,Administration-office-support - None,08/02/2024
27,https://www.seek.com.au//job/73408813?type=standard&ref=search-standalone,administration office support,"PA, EA & Secretarial",Executive Assistant to MD,Lean Vision,-,180000.0,182500.0,185000.0,Sydney NSW,"A critical role to help the MD and CFO support the operations of the group.
Immediate start available.","[<div class=""_1wkzzau0 a1msqi6m""><span class=""_1wkzzau0 a1msqi4y lnocuo0 lnocuo1 lnocuo21 _1d0g9qk4 lnocuo7""><a aria-label=""Limit results to Sydney NSW"" class=""_1wkzzau0 _1wkzzauf _1wkzzau0 _1wkzzauf _842p0a0 _842p0a2"" data-automation=""jobLocation"" href=""/jobs-in-administration-office-support/in-All-Sydney-NSW?salarytype=annual&amp;salaryrange=180000-185000"" rel=""nofollow"" tabindex=""-1"" target=""_self"" title=""Limit results to Sydney NSW"">Sydney NSW</a></span></div>]",2024-01-31,Administration-office-support - None,08/02/2024
28,https://www.seek.com.au//job/73578741?type=standout&ref=search-standalone,administration office support,"PA, EA & Secretarial",Secretariat Consultant,King & Wood Mallesons,-,180000.0,182500.0,185000.0,Sydney NSW,"Get involved in high quality work in an exceptional team
Leading top-tier law firm with excellent benefits","[<div class=""_1wkzzau0 a1msqi6m""><span class=""_1wkzzau0 a1msqi4y lnocuo0 lnocuo1 lnocuo21 _1d0g9qk4 lnocuo7""><a aria-label=""Limit results to Sydney NSW"" class=""_1wkzzau0 _1wkzzauf _1wkzzau0 _1wkzzauf _842p0a0 _842p0a2"" data-automation=""jobLocation"" href=""/jobs-in-administration-office-support/in-All-Sydney-NSW?salarytype=annual&amp;salaryrange=180000-185000"" rel=""nofollow"" tabindex=""-1"" target=""_self"" title=""Limit results to Sydney NSW"">Sydney NSW</a></span></div>]",2024-02-07,Administration-office-support - None,08/02/2024
29,https://www.seek.com.au//job/73471031?type=standout&ref=search-standalone,administration office support,Office Management,Business Manager,Keegan Adams Recruitment Pty Ltd,Generous salary negotiable for experience,180000.0,182500.0,185000.0,Sydney NSW,Act as an extension of the CEO in this fast-growing Investment firm.  Pivotal role covering a mix of operational & strategic initiatives,"[<div class=""_1wkzzau0 a1msqi6m""><span class=""_1wkzzau0 a1msqi4y lnocuo0 lnocuo1 lnocuo21 _1d0g9qk4 lnocuo7""><a aria-label=""Limit results to Sydney NSW"" class=""_1wkzzau0 _1wkzzauf _1wkzzau0 _1wkzzauf _842p0a0 _842p0a2"" data-automation=""jobLocation"" href=""/jobs-in-administration-office-support/in-All-Sydney-NSW?salarytype=annual&amp;salaryrange=180000-185000"" rel=""nofollow"" tabindex=""-1"" target=""_self"" title=""Limit results to Sydney NSW"">Sydney NSW</a></span></div>, <div class=""_1wkzzau0 a1msqi6m""><div aria-label=""Salary: Generous salary negotiable for experience"" class=""_1wkzzau0""><span class=""_1wkzzau0 a1msqi4y lnocuo0 lnocuo1 lnocuo21 _1d0g9qk4 lnocuo7"" data-automation=""jobSalary""><span class=""_1wkzzau0 _16v7pfz1 a1msqi4y a1msqi0 a1msqir _16v7pfz3"" style=""--_16v7pfz2:2"">Generous salary negotiable for experience</span></span></div></div>]",2024-02-02,Administration-office-support - None,08/02/2024
30,https://www.seek.com.au//job/73346469?type=standout&ref=search-standalone,administration office support,Contracts Administration,Contracts Administrator,Buildability Group,"$160,000 -$200,000+",160000.0,180000.0,200000.0,Sydney NSW,National builder who have been successfully delivering in all sectors of construction in NSW for many a decade.,"[<div class=""_1wkzzau0 a1msqi6m""><span class=""_1wkzzau0 a1msqi4y lnocuo0 lnocuo1 lnocuo21 _1d0g9qk4 lnocuo7""><a aria-label=""Limit results to Sydney NSW"" class=""_1wkzzau0 _1wkzzauf _1wkzzau0 _1wkzzauf _842p0a0 _842p0a2"" data-automation=""jobLocation"" href=""/jobs-in-administration-office-support/in-All-Sydney-NSW?salarytype=annual&amp;salaryrange=180000-185000"" rel=""nofollow"" tabindex=""-1"" target=""_self"" title=""Limit results to Sydney NSW"">Sydney NSW</a></span></div>, <div class=""_1wkzzau0 a1msqi6m""><div aria-label=""Salary: $160,000 -$200,000+"" class=""_1wkzzau0""><span class=""_1wkzzau0 a1msqi4y lnocuo0 lnocuo1 lnocuo21 _1d0g9qk4 lnocuo7"" data-automation=""jobSalary""><span class=""_1wkzzau0 _16v7pfz1 a1msqi4y a1msqi0 a1msqir _16v7pfz3"" style=""--_16v7pfz2:2"">$160,000 -$200,000+</span></span></div></div>]",2024-01-28,Administration-office-support - None,08/02/2024
31,https://www.seek.com.au//job/73546634?type=standout&ref=search-standalone,administration office support,Contracts Administration,Contracts Administrator,UGL Services - Resources and Energy West,-,180000.0,182500.0,185000.0,Darwin NT,"UGL are currently seeking Expressions of Interest for a Contracts Administrator to work onsite, supporting a Brownfield Construction Project.","[<div class=""_1wkzzau0 a1msqi6m""><span class=""_1wkzzau0 a1msqi4y lnocuo0 lnocuo1 lnocuo21 _1d0g9qk4 lnocuo7""><a aria-label=""Limit results to Darwin NT"" class=""_1wkzzau0 _1wkzzauf _1wkzzau0 _1wkzzauf _842p0a0 _842p0a2"" data-automation=""jobLocation"" href=""/jobs-in-administration-office-support/in-All-Darwin-NT?salarytype=annual&amp;salaryrange=180000-185000"" rel=""nofollow"" tabindex=""-1"" target=""_self"" title=""Limit results to Darwin NT"">Darwin NT</a></span></div>]",2024-02-06,Administration-office-support - None,08/02/2024
32,https://www.seek.com.au//job/73259924?type=standout&ref=search-standalone,administration office support,Administrative Assistants,Administration Services & Onboarding Coordinator,Anglo American,"Competitive pay, bonus, and employee share scheme",180000.0,182500.0,185000.0,Brisbane QLD,"New position created to lead a team of 10 delivering Admin, Onboarding & Offboarding services for APAC","[<div class=""_1wkzzau0 a1msqi6m""><span class=""_1wkzzau0 a1msqi4y lnocuo0 lnocuo1 lnocuo21 _1d0g9qk4 lnocuo7""><a aria-label=""Limit results to Brisbane QLD"" class=""_1wkzzau0 _1wkzzauf _1wkzzau0 _1wkzzauf _842p0a0 _842p0a2"" data-automation=""jobLocation"" href=""/jobs-in-administration-office-support/in-All-Brisbane-QLD?salarytype=annual&amp;salaryrange=180000-185000"" rel=""nofollow"" tabindex=""-1"" target=""_self"" title=""Limit results to Brisbane QLD"">Brisbane QLD</a></span></div>, <div class=""_1wkzzau0 a1msqi6m""><div aria-label=""Salary: Competitive pay, bonus, and employee share scheme"" class=""_1wkzzau0""><span class=""_1wkzzau0 a1msqi4y lnocuo0 lnocuo1 lnocuo21 _1d0g9qk4 lnocuo7"" data-automation=""jobSalary""><span class=""_1wkzzau0 _16v7pfz1 a1msqi4y a1msqi0 a1msqir _16v7pfz3"" style=""--_16v7pfz2:2"">Competitive pay, bonus, and employee share scheme</span></span></div></div>]",2024-01-24,Administration-office-support - None,08/02/2024
33,https://www.seek.com.au//job/73100270?type=standout&ref=search-standalone,administration office support,Administrative Assistants,"Privacy and GIPA Officer, Office of Governance Services",Western Sydney University,"$127,852 to $136,536 p.a., plus Super & Leave",127852.0,132194.0,136536.0,Other,The Privacy and GIPA Officer is responsible for ensuring that the University complies with the privacy obligations set by NSW and Commonwealth laws.,"[<div class=""_1wkzzau0 a1msqi6m""><span class=""_1wkzzau0 a1msqi4y lnocuo0 lnocuo1 lnocuo21 _1d0g9qk4 lnocuo7""><a aria-label=""Limit results to Richmond"" class=""_1wkzzau0 _1wkzzauf _1wkzzau0 _1wkzzauf _842p0a0 _842p0a2"" data-automation=""jobLocation"" href=""/jobs-in-administration-office-support/in-Richmond-NSW-2753?salarytype=annual&amp;salaryrange=180000-185000"" rel=""nofollow"" tabindex=""-1"" target=""_self"" title=""Limit results to Richmond"">Richmond</a>, <a aria-label=""Limit results to Richmond &amp; Hawkesbury NSW"" class=""_1wkzzau0 _1wkzzauf _1wkzzau0 _1wkzzauf _842p0a0 _842p0a2"" data-automation=""jobLocation"" href=""/jobs-in-administration-office-support/in-Richmond-&amp;-Hawkesbury-NSW?salarytype=annual&amp;salaryrange=180000-185000"" rel=""nofollow"" tabindex=""-1"" target=""_self"" title=""Limit results to Richmond &amp; Hawkesbury NSW"">Richmond &amp; Hawkesbury NSW</a></span></div>, <div class=""_1wkzzau0 a1msqi6m""><div aria-label=""Salary: $127,852 to $136,536 p.a., plus Super &amp; Leave"" class=""_1wkzzau0""><span class=""_1wkzzau0 a1msqi4y lnocuo0 lnocuo1 lnocuo21 _1d0g9qk4 lnocuo7"" data-automation=""jobSalary""><span class=""_1wkzzau0 _16v7pfz1 a1msqi4y a1msqi0 a1msqir _16v7pfz3"" style=""--_16v7pfz2:2"">$127,852 to $136,536 p.a., plus Super &amp; Leave</span></span></div></div>]",2024-01-18,Administration-office-support - None,08/02/2024
34,https://www.seek.com.au//job/73543561?type=standout&ref=search-standalone,administration office support,Records Management & Document Control,Document Controller,Alchemy Recruitment Consulting Pty Ltd,Highly competetive hourly rate,180000.0,182500.0,185000.0,Brisbane QLD,Provide document control support by adhering to document control standards and service level agreements in the Mining Sector,"[<div class=""_1wkzzau0 a1msqi6m""><span class=""_1wkzzau0 a1msqi4y lnocuo0 lnocuo1 lnocuo21 _1d0g9qk4 lnocuo7""><a aria-label=""Limit results to Brisbane QLD"" class=""_1wkzzau0 _1wkzzauf _1wkzzau0 _1wkzzauf _842p0a0 _842p0a2"" data-automation=""jobLocation"" href=""/jobs-in-administration-office-support/in-All-Brisbane-QLD?salarytype=annual&amp;salaryrange=180000-185000"" rel=""nofollow"" tabindex=""-1"" target=""_self"" title=""Limit results to Brisbane QLD"">Brisbane QLD</a></span></div>, <div class=""_1wkzzau0 a1msqi6m""><div aria-label=""Salary: Highly competetive hourly rate"" class=""_1wkzzau0""><span class=""_1wkzzau0 a1msqi4y lnocuo0 lnocuo1 lnocuo21 _1d0g9qk4 lnocuo7"" data-automation=""jobSalary""><span class=""_1wkzzau0 _16v7pfz1 a1msqi4y a1msqi0 a1msqir _16v7pfz3"" style=""--_16v7pfz2:2"">Highly competetive hourly rate</span></span></div></div>]",2024-02-06,Administration-office-support - None,08/02/2024
35,https://www.seek.com.au//job/73341331?type=standard&ref=search-standalone,administration office support,Office Management,ADMINISTRATION / FINANCE MANAGER,SCS Business Consultants,-,180000.0,182500.0,185000.0,Adelaide SA,Are you an experienced Administration / Finance Manager with great leadership and staff development skills? Then read on!,"[<div class=""_1wkzzau0 a1msqi6m""><span class=""_1wkzzau0 a1msqi4y lnocuo0 lnocuo1 lnocuo21 _1d0g9qk4 lnocuo7""><a aria-label=""Limit results to Adelaide SA"" class=""_1wkzzau0 _1wkzzauf _1wkzzau0 _1wkzzauf _842p0a0 _842p0a2"" data-automation=""jobLocation"" href=""/jobs-in-administration-office-support/in-All-Adelaide-SA?salarytype=annual&amp;salaryrange=180000-185000"" rel=""nofollow"" tabindex=""-1"" target=""_self"" title=""Limit results to Adelaide SA"">Adelaide SA</a></span></div>]",2024-01-27,Administration-office-support - None,08/02/2024
36,https://www.seek.com.au//job/73101364?type=standout&ref=search-standalone,administration office support,Other,Superintendent - Supply,Batchfire Resources Pty Ltd,-,180000.0,182500.0,185000.0,"Biloela, Gladstone & Central QLD","We are seeking a highly motivated and experienced Superintendent - Supply to lead, direct and manage warehousing, inventory and purchasing activities.","[<div class=""_1wkzzau0 a1msqi6m""><span class=""_1wkzzau0 a1msqi4y lnocuo0 lnocuo1 lnocuo21 _1d0g9qk4 lnocuo7""><a aria-label=""Limit results to Biloela"" class=""_1wkzzau0 _1wkzzauf _1wkzzau0 _1wkzzauf _842p0a0 _842p0a2"" data-automation=""jobLocation"" href=""/jobs-in-administration-office-support/in-Biloela-QLD-4715?salarytype=annual&amp;salaryrange=180000-185000"" rel=""nofollow"" tabindex=""-1"" target=""_self"" title=""Limit results to Biloela"">Biloela</a>, <a aria-label=""Limit results to Gladstone &amp; Central QLD"" class=""_1wkzzau0 _1wkzzauf _1wkzzau0 _1wkzzauf _842p0a0 _842p0a2"" data-automation=""jobLocation"" href=""/jobs-in-administration-office-support/in-Gladstone-&amp;-Central-QLD?salarytype=annual&amp;salaryrange=180000-185000"" rel=""nofollow"" tabindex=""-1"" target=""_self"" title=""Limit results to Gladstone &amp; Central QLD"">Gladstone &amp; Central QLD</a></span></div>]",2024-01-18,Administration-office-support - None,08/02/2024
37,https://www.seek.com.au//job/73237981?type=standard&ref=search-standalone,administration office support,"PA, EA & Secretarial",EA,FourQuarters Recruitment,-,180000.0,182500.0,185000.0,Perth WA,"Seeking a talented Executive Assistant for an immediate start, to support with exciting and rewarding projects. Have Impact!","[<div class=""_1wkzzau0 a1msqi6m""><span class=""_1wkzzau0 a1msqi4y lnocuo0 lnocuo1 lnocuo21 _1d0g9qk4 lnocuo7""><a aria-label=""Limit results to Perth WA"" class=""_1wkzzau0 _1wkzzauf _1wkzzau0 _1wkzzauf _842p0a0 _842p0a2"" data-automation=""jobLocation"" href=""/jobs-in-administration-office-support/in-All-Perth-WA?salarytype=annual&amp;salaryrange=180000-185000"" rel=""nofollow"" tabindex=""-1"" target=""_self"" title=""Limit results to Perth WA"">Perth WA</a></span></div>]",2024-01-23,Administration-office-support - None,08/02/2024
38,https://www.seek.com.au//job/73301747?type=standout&ref=search-standalone,administration office support,Contracts Administration,Senior Administrator,Fulton Hogan Australia Pty Limited,-,180000.0,182500.0,185000.0,"Launceston, Launceston & North East TAS",We are seeking a Senior Administrator to support the continued growth of our Tasmania operations. Based in Mowbray with great career growth on offer.,"[<div class=""_1wkzzau0 a1msqi6m""><span class=""_1wkzzau0 a1msqi4y lnocuo0 lnocuo1 lnocuo21 _1d0g9qk4 lnocuo7""><a aria-label=""Limit results to Launceston"" class=""_1wkzzau0 _1wkzzauf _1wkzzau0 _1wkzzauf _842p0a0 _842p0a2"" data-automation=""jobLocation"" href=""/jobs-in-administration-office-support/in-Launceston-TAS-7250?salarytype=annual&amp;salaryrange=180000-185000"" rel=""nofollow"" tabindex=""-1"" target=""_self"" title=""Limit results to Launceston"">Launceston</a>, <a aria-label=""Limit results to Launceston &amp; North East TAS"" class=""_1wkzzau0 _1wkzzauf _1wkzzau0 _1wkzzauf _842p0a0 _842p0a2"" data-automation=""jobLocation"" href=""/jobs-in-administration-office-support/in-Launceston-&amp;-North-East-TAS?salarytype=annual&amp;salaryrange=180000-185000"" rel=""nofollow"" tabindex=""-1"" target=""_self"" title=""Limit results to Launceston &amp; North East TAS"">Launceston &amp; North East TAS</a></span></div>]",2024-01-25,Administration-office-support - None,08/02/2024
39,https://www.seek.com.au//job/73307149?type=standout&ref=search-standalone,administration office support,Contracts Administration,Contracts Administrator,ACRWORLD,*COMPETITIVE SALARY*,180000.0,182500.0,185000.0,Sydney NSW,CA to work as No2 delivering a hi end residential projects ranging up to $150M site based,"[<div class=""_1wkzzau0 a1msqi6m""><span class=""_1wkzzau0 a1msqi4y lnocuo0 lnocuo1 lnocuo21 _1d0g9qk4 lnocuo7""><a aria-label=""Limit results to Liverpool"" class=""_1wkzzau0 _1wkzzauf _1wkzzau0 _1wkzzauf _842p0a0 _842p0a2"" data-automation=""jobLocation"" href=""/jobs-in-administration-office-support/in-Liverpool-NSW-2170?salarytype=annual&amp;salaryrange=180000-185000"" rel=""nofollow"" tabindex=""-1"" target=""_self"" title=""Limit results to Liverpool"">Liverpool</a>, <a aria-label=""Limit results to Sydney NSW"" class=""_1wkzzau0 _1wkzzauf _1wkzzau0 _1wkzzauf _842p0a0 _842p0a2"" data-automation=""jobLocation"" href=""/jobs-in-administration-office-support/in-All-Sydney-NSW?salarytype=annual&amp;salaryrange=180000-185000"" rel=""nofollow"" tabindex=""-1"" target=""_self"" title=""Limit results to Sydney NSW"">Sydney NSW</a></span></div>, <div class=""_1wkzzau0 a1msqi6m""><div aria-label=""Salary: *COMPETITIVE SALARY*"" class=""_1wkzzau0""><span class=""_1wkzzau0 a1msqi4y lnocuo0 lnocuo1 lnocuo21 _1d0g9qk4 lnocuo7"" data-automation=""jobSalary""><span class=""_1wkzzau0 _16v7pfz1 a1msqi4y a1msqi0 a1msqir _16v7pfz3"" style=""--_16v7pfz2:2"">*COMPETITIVE SALARY*</span></span></div></div>]",2024-01-25,Administration-office-support - None,08/02/2024
40,https://www.seek.com.au//job/73211619?type=standard&ref=search-standalone,administration office support,"PA, EA & Secretarial",Board Secretariat and Governance Officer | ACT Government,SB Recruitment Pty Ltd,$65 - $81.27 per hour plus super,117000.0,131643.0,146286.0,Canberra ACT,Well-respected ACT Gov org. seek a Secretariat to support with board and governance activities. 3 months with extension!,"[<div class=""_1wkzzau0 a1msqi6m""><span class=""_1wkzzau0 a1msqi4y lnocuo0 lnocuo1 lnocuo21 _1d0g9qk4 lnocuo7""><a aria-label=""Limit results to Canberra ACT"" class=""_1wkzzau0 _1wkzzauf _1wkzzau0 _1wkzzauf _842p0a0 _842p0a2"" data-automation=""jobLocation"" href=""/jobs-in-administration-office-support/in-All-Canberra-ACT?salarytype=annual&amp;salaryrange=180000-185000"" rel=""nofollow"" tabindex=""-1"" target=""_self"" title=""Limit results to Canberra ACT"">Canberra ACT</a></span></div>, <div class=""_1wkzzau0 a1msqi6m""><div aria-label=""Salary: $65 - $81.27 per hour plus super"" class=""_1wkzzau0""><span class=""_1wkzzau0 a1msqi4y lnocuo0 lnocuo1 lnocuo21 _1d0g9qk4 lnocuo7"" data-automation=""jobSalary""><span class=""_1wkzzau0 _16v7pfz1 a1msqi4y a1msqi0 a1msqir _16v7pfz3"" style=""--_16v7pfz2:2"">$65 - $81.27 per hour plus super</span></span></div></div>]",2024-01-22,Administration-office-support - None,08/02/2024
