,link,classification,category,title,company,salary,min_salary,average_salary,max_salary,location,description,entireDiv,date_posted,Category,Date
410,https://www.seek.com.au//job/73519075?type=standout&ref=search-standalone,marketing communications,Digital & Search Marketing,"Platforms Partner Manager, Google Marketing Platform",Google,World Class Benefits,140000.0,142500.0,145000.0,Sydney NSW,Grow the platforms partner business by developing a strategic approach to the market for an assigned territory and/or account list.,"[<div class=""_1wkzzau0 a1msqi6m""><span class=""_1wkzzau0 a1msqi4y lnocuo0 lnocuo1 lnocuo21 _1d0g9qk4 lnocuo7""><a aria-label=""Limit results to Sydney NSW"" class=""_1wkzzau0 _1wkzzauf _1wkzzau0 _1wkzzauf _842p0a0 _842p0a2"" data-automation=""jobLocation"" href=""/jobs-in-marketing-communications/in-All-Sydney-NSW?salarytype=annual&amp;salaryrange=140000-145000"" rel=""nofollow"" tabindex=""-1"" target=""_self"" title=""Limit results to Sydney NSW"">Sydney NSW</a></span></div>, <div class=""_1wkzzau0 a1msqi6m""><div aria-label=""Salary: World Class Benefits"" class=""_1wkzzau0""><span class=""_1wkzzau0 a1msqi4y lnocuo0 lnocuo1 lnocuo21 _1d0g9qk4 lnocuo7"" data-automation=""jobSalary""><span class=""_1wkzzau0 _16v7pfz1 a1msqi4y a1msqi0 a1msqir _16v7pfz3"" style=""--_16v7pfz2:2"">World Class Benefits</span></span></div></div>]",2024-02-05,Marketing-communications - None,08/02/2024
411,https://www.seek.com.au//job/73621597?type=standard&ref=search-standalone,marketing communications,Digital & Search Marketing,"Digital Perf Mgr - Search, Shelf & eCom",Colgate Palmolive,-,140000.0,142500.0,145000.0,Sydney NSW,This role is  to lead our online product presence and optimize our digital shelf space across various e-commerce platforms.,"[<div class=""_1wkzzau0 a1msqi6m""><span class=""_1wkzzau0 a1msqi4y lnocuo0 lnocuo1 lnocuo21 _1d0g9qk4 lnocuo7""><a aria-label=""Limit results to Sydney NSW"" class=""_1wkzzau0 _1wkzzauf _1wkzzau0 _1wkzzauf _842p0a0 _842p0a2"" data-automation=""jobLocation"" href=""/jobs-in-marketing-communications/in-All-Sydney-NSW?salarytype=annual&amp;salaryrange=140000-145000"" rel=""nofollow"" tabindex=""-1"" target=""_self"" title=""Limit results to Sydney NSW"">Sydney NSW</a></span></div>]",,Marketing-communications - None,08/02/2024
412,https://www.seek.com.au//job/73554548?type=standout&ref=search-standalone,marketing communications,Product Management & Development,Product & Portfolio Manager,Inghams Enterprises Pty Ltd,-,140000.0,142500.0,145000.0,Sydney NSW,Work with our customers to drive and project manage category growth across new and existing products!,"[<div class=""_1wkzzau0 a1msqi6m""><span class=""_1wkzzau0 a1msqi4y lnocuo0 lnocuo1 lnocuo21 _1d0g9qk4 lnocuo7""><a aria-label=""Limit results to North Ryde"" class=""_1wkzzau0 _1wkzzauf _1wkzzau0 _1wkzzauf _842p0a0 _842p0a2"" data-automation=""jobLocation"" href=""/jobs-in-marketing-communications/in-North-Ryde-NSW-2113?salarytype=annual&amp;salaryrange=140000-145000"" rel=""nofollow"" tabindex=""-1"" target=""_self"" title=""Limit results to North Ryde"">North Ryde</a>, <a aria-label=""Limit results to Sydney NSW"" class=""_1wkzzau0 _1wkzzauf _1wkzzau0 _1wkzzauf _842p0a0 _842p0a2"" data-automation=""jobLocation"" href=""/jobs-in-marketing-communications/in-All-Sydney-NSW?salarytype=annual&amp;salaryrange=140000-145000"" rel=""nofollow"" tabindex=""-1"" target=""_self"" title=""Limit results to Sydney NSW"">Sydney NSW</a></span></div>]",2024-02-06,Marketing-communications - None,08/02/2024
413,https://www.seek.com.au//job/73283344?type=standard&ref=search-standalone,marketing communications,Marketing Communications,"Marketing Manager, Real Estate/Property - REMOTE FIRST",people2people - Sydney,AUD 120000 - 130000 per annum,140000.0,142500.0,145000.0,Sydney NSW,A rare opportunity exists for an experienced and passionate Marketing Manager to join a rapidly growing leader in the real estate / property space,"[<div class=""_1wkzzau0 a1msqi6m""><span class=""_1wkzzau0 a1msqi4y lnocuo0 lnocuo1 lnocuo21 _1d0g9qk4 lnocuo7""><a aria-label=""Limit results to Sydney NSW"" class=""_1wkzzau0 _1wkzzauf _1wkzzau0 _1wkzzauf _842p0a0 _842p0a2"" data-automation=""jobLocation"" href=""/jobs-in-marketing-communications/in-All-Sydney-NSW?salarytype=annual&amp;salaryrange=140000-145000"" rel=""nofollow"" tabindex=""-1"" target=""_self"" title=""Limit results to Sydney NSW"">Sydney NSW</a></span></div>, <div class=""_1wkzzau0 a1msqi6m""><div aria-label=""Salary: AUD 120000 - 130000 per annum"" class=""_1wkzzau0""><span class=""_1wkzzau0 a1msqi4y lnocuo0 lnocuo1 lnocuo21 _1d0g9qk4 lnocuo7"" data-automation=""jobSalary""><span class=""_1wkzzau0 _16v7pfz1 a1msqi4y a1msqi0 a1msqir _16v7pfz3"" style=""--_16v7pfz2:2"">AUD 120000 - 130000 per annum</span></span></div></div>]",2024-01-24,Marketing-communications - None,08/02/2024
414,https://www.seek.com.au//job/73186637?type=standout&ref=search-standalone,marketing communications,Management,Growth Marketing Manager,Digital Talent Lab,$140k - $160k + super,140000.0,150000.0,160000.0,Sydney NSW,Growth Marketing Manager,"[<div class=""_1wkzzau0 a1msqi6m""><span class=""_1wkzzau0 a1msqi4y lnocuo0 lnocuo1 lnocuo21 _1d0g9qk4 lnocuo7""><a aria-label=""Limit results to Sydney NSW"" class=""_1wkzzau0 _1wkzzauf _1wkzzau0 _1wkzzauf _842p0a0 _842p0a2"" data-automation=""jobLocation"" href=""/jobs-in-marketing-communications/in-All-Sydney-NSW?salarytype=annual&amp;salaryrange=140000-145000"" rel=""nofollow"" tabindex=""-1"" target=""_self"" title=""Limit results to Sydney NSW"">Sydney NSW</a></span></div>, <div class=""_1wkzzau0 a1msqi6m""><div aria-label=""Salary: $140k - $160k + super"" class=""_1wkzzau0""><span class=""_1wkzzau0 a1msqi4y lnocuo0 lnocuo1 lnocuo21 _1d0g9qk4 lnocuo7"" data-automation=""jobSalary""><span class=""_1wkzzau0 _16v7pfz1 a1msqi4y a1msqi0 a1msqir _16v7pfz3"" style=""--_16v7pfz2:2"">$140k - $160k + super</span></span></div></div>]",2024-01-20,Marketing-communications - None,08/02/2024
415,https://www.seek.com.au//job/73236777?type=standout&ref=search-standalone,marketing communications,Public Relations & Corporate Affairs,Senior Communications Advisor,Suncorp,Competitive Salary + WFH + Benefits,140000.0,142500.0,145000.0,Sydney NSW,We’re looking for an experienced communication professional to work across both internal communication and public relations,"[<div class=""_1wkzzau0 a1msqi6m""><span class=""_1wkzzau0 a1msqi4y lnocuo0 lnocuo1 lnocuo21 _1d0g9qk4 lnocuo7""><a aria-label=""Limit results to Sydney NSW"" class=""_1wkzzau0 _1wkzzauf _1wkzzau0 _1wkzzauf _842p0a0 _842p0a2"" data-automation=""jobLocation"" href=""/jobs-in-marketing-communications/in-All-Sydney-NSW?salarytype=annual&amp;salaryrange=140000-145000"" rel=""nofollow"" tabindex=""-1"" target=""_self"" title=""Limit results to Sydney NSW"">Sydney NSW</a></span></div>, <div class=""_1wkzzau0 a1msqi6m""><div aria-label=""Salary: Competitive Salary + WFH + Benefits"" class=""_1wkzzau0""><span class=""_1wkzzau0 a1msqi4y lnocuo0 lnocuo1 lnocuo21 _1d0g9qk4 lnocuo7"" data-automation=""jobSalary""><span class=""_1wkzzau0 _16v7pfz1 a1msqi4y a1msqi0 a1msqir _16v7pfz3"" style=""--_16v7pfz2:2"">Competitive Salary + WFH + Benefits</span></span></div></div>]",2024-01-23,Marketing-communications - None,08/02/2024
416,https://www.seek.com.au//job/73305942?type=standout&ref=search-standalone,marketing communications,Management,Acquisition Marketing Manager,Latitude Financial Services,Base + Incentives,140000.0,142500.0,145000.0,Melbourne VIC,Drive new customer acquisition for both our Credit Cards and Personal Loans.,"[<div class=""_1wkzzau0 a1msqi6m""><span class=""_1wkzzau0 a1msqi4y lnocuo0 lnocuo1 lnocuo21 _1d0g9qk4 lnocuo7""><a aria-label=""Limit results to Melbourne VIC"" class=""_1wkzzau0 _1wkzzauf _1wkzzau0 _1wkzzauf _842p0a0 _842p0a2"" data-automation=""jobLocation"" href=""/jobs-in-marketing-communications/in-All-Melbourne-VIC?salarytype=annual&amp;salaryrange=140000-145000"" rel=""nofollow"" tabindex=""-1"" target=""_self"" title=""Limit results to Melbourne VIC"">Melbourne VIC</a></span></div>, <div class=""_1wkzzau0 a1msqi6m""><div aria-label=""Salary: Base + Incentives"" class=""_1wkzzau0""><span class=""_1wkzzau0 a1msqi4y lnocuo0 lnocuo1 lnocuo21 _1d0g9qk4 lnocuo7"" data-automation=""jobSalary""><span class=""_1wkzzau0 _16v7pfz1 a1msqi4y a1msqi0 a1msqir _16v7pfz3"" style=""--_16v7pfz2:2"">Base + Incentives</span></span></div></div>]",2024-01-25,Marketing-communications - None,08/02/2024
417,https://www.seek.com.au//job/72961853?type=standard&ref=search-standalone,marketing communications,Brand Management,Head of Marketing,ONE LABS,"$90,000 – $125,000 per year + bonuses",90000.0,107500.0,125000.0,Brisbane QLD,"- Immediate start available and flexibility of work days and hours
- You don't have to have a corporate personality
- Large opportunity","[<div class=""_1wkzzau0 a1msqi6m""><span class=""_1wkzzau0 a1msqi4y lnocuo0 lnocuo1 lnocuo21 _1d0g9qk4 lnocuo7""><a aria-label=""Limit results to Brisbane QLD"" class=""_1wkzzau0 _1wkzzauf _1wkzzau0 _1wkzzauf _842p0a0 _842p0a2"" data-automation=""jobLocation"" href=""/jobs-in-marketing-communications/in-All-Brisbane-QLD?salarytype=annual&amp;salaryrange=140000-145000"" rel=""nofollow"" tabindex=""-1"" target=""_self"" title=""Limit results to Brisbane QLD"">Brisbane QLD</a></span></div>, <div class=""_1wkzzau0 a1msqi6m""><div aria-label=""Salary: $90,000 – $125,000 per year + bonuses"" class=""_1wkzzau0""><span class=""_1wkzzau0 a1msqi4y lnocuo0 lnocuo1 lnocuo21 _1d0g9qk4 lnocuo7"" data-automation=""jobSalary""><span class=""_1wkzzau0 _16v7pfz1 a1msqi4y a1msqi0 a1msqir _16v7pfz3"" style=""--_16v7pfz2:2"">$90,000 – $125,000 per year + bonuses</span></span></div></div>]",2024-01-12,Marketing-communications - None,08/02/2024
418,https://www.seek.com.au//job/73100236?type=promoted&ref=search-standalone,marketing communications,Digital & Search Marketing,Digital Marketing Manager,O'Brien Glass Industries Limited,Competitive base + Recognition programs + Hybrid,140000.0,142500.0,145000.0,Sydney NSW,As exciting opportunity to own and deliver a digital marketing strategy for a national market leader and well-known brand.,"[<div class=""_1wkzzau0 a1msqi6m""><span class=""_1wkzzau0 a1msqi4y lnocuo0 lnocuo1 lnocuo21 _1d0g9qk4 lnocuo7""><a aria-label=""Limit results to Padstow"" class=""_1wkzzau0 _1wkzzauf _1wkzzau0 _1wkzzauf _842p0a0 _842p0a2"" data-automation=""jobLocation"" href=""/jobs-in-marketing-communications/in-Padstow-NSW-2211?salarytype=annual&amp;salaryrange=140000-145000"" rel=""nofollow"" tabindex=""-1"" target=""_self"" title=""Limit results to Padstow"">Padstow</a>, <a aria-label=""Limit results to Sydney NSW"" class=""_1wkzzau0 _1wkzzauf _1wkzzau0 _1wkzzauf _842p0a0 _842p0a2"" data-automation=""jobLocation"" href=""/jobs-in-marketing-communications/in-All-Sydney-NSW?salarytype=annual&amp;salaryrange=140000-145000"" rel=""nofollow"" tabindex=""-1"" target=""_self"" title=""Limit results to Sydney NSW"">Sydney NSW</a></span></div>, <div class=""_1wkzzau0 a1msqi6m""><div aria-label=""Salary: Competitive base + Recognition programs + Hybrid"" class=""_1wkzzau0""><span class=""_1wkzzau0 a1msqi4y lnocuo0 lnocuo1 lnocuo21 _1d0g9qk4 lnocuo7"" data-automation=""jobSalary""><span class=""_1wkzzau0 _16v7pfz1 a1msqi4y a1msqi0 a1msqir _16v7pfz3"" style=""--_16v7pfz2:2"">Competitive base + Recognition programs + Hybrid</span></span></div></div>]",,Marketing-communications - None,08/02/2024
419,https://www.seek.com.au//job/73347425?type=promoted&ref=search-standalone,marketing communications,Management,Marketing Manager,RedSands Campers,-,140000.0,142500.0,145000.0,Perth WA,"As our star Marketing Manager, you will be responsible for driving the demand for the worlds leading recreational off-road, self-drive brand.","[<div class=""_1wkzzau0 a1msqi6m""><span class=""_1wkzzau0 a1msqi4y lnocuo0 lnocuo1 lnocuo21 _1d0g9qk4 lnocuo7""><a aria-label=""Limit results to Balcatta"" class=""_1wkzzau0 _1wkzzauf _1wkzzau0 _1wkzzauf _842p0a0 _842p0a2"" data-automation=""jobLocation"" href=""/jobs-in-marketing-communications/in-Balcatta-WA-6021?salarytype=annual&amp;salaryrange=140000-145000"" rel=""nofollow"" tabindex=""-1"" target=""_self"" title=""Limit results to Balcatta"">Balcatta</a>, <a aria-label=""Limit results to Perth WA"" class=""_1wkzzau0 _1wkzzauf _1wkzzau0 _1wkzzauf _842p0a0 _842p0a2"" data-automation=""jobLocation"" href=""/jobs-in-marketing-communications/in-All-Perth-WA?salarytype=annual&amp;salaryrange=140000-145000"" rel=""nofollow"" tabindex=""-1"" target=""_self"" title=""Limit results to Perth WA"">Perth WA</a></span></div>]",,Marketing-communications - None,08/02/2024
420,https://www.seek.com.au//job/73193591?type=standout&ref=search-standalone,marketing communications,Brand Management,Commercial & Brand Manager - SPT Football,Sport Group,"$100,000 – $120,000 per year",100000.0,110000.0,120000.0,Melbourne VIC,Are you obsessed with Football? We are looking for a Commercial/Brand marketing professional to combine their love of football with their profession.,"[<div class=""_1wkzzau0 a1msqi6m""><span class=""_1wkzzau0 a1msqi4y lnocuo0 lnocuo1 lnocuo21 _1d0g9qk4 lnocuo7""><a aria-label=""Limit results to Moorabbin"" class=""_1wkzzau0 _1wkzzauf _1wkzzau0 _1wkzzauf _842p0a0 _842p0a2"" data-automation=""jobLocation"" href=""/jobs-in-marketing-communications/in-Moorabbin-VIC-3189?salarytype=annual&amp;salaryrange=140000-145000"" rel=""nofollow"" tabindex=""-1"" target=""_self"" title=""Limit results to Moorabbin"">Moorabbin</a>, <a aria-label=""Limit results to Melbourne VIC"" class=""_1wkzzau0 _1wkzzauf _1wkzzau0 _1wkzzauf _842p0a0 _842p0a2"" data-automation=""jobLocation"" href=""/jobs-in-marketing-communications/in-All-Melbourne-VIC?salarytype=annual&amp;salaryrange=140000-145000"" rel=""nofollow"" tabindex=""-1"" target=""_self"" title=""Limit results to Melbourne VIC"">Melbourne VIC</a></span></div>, <div class=""_1wkzzau0 a1msqi6m""><div aria-label=""Salary: $100,000 – $120,000 per year"" class=""_1wkzzau0""><span class=""_1wkzzau0 a1msqi4y lnocuo0 lnocuo1 lnocuo21 _1d0g9qk4 lnocuo7"" data-automation=""jobSalary""><span class=""_1wkzzau0 _16v7pfz1 a1msqi4y a1msqi0 a1msqir _16v7pfz3"" style=""--_16v7pfz2:2"">$100,000 – $120,000 per year</span></span></div></div>]",2024-01-21,Marketing-communications - None,08/02/2024
421,https://www.seek.com.au//job/73390153?type=standard&ref=search-standalone,marketing communications,Digital & Search Marketing,Digital Content Manager,Commerce Vision Pty Ltd,-,140000.0,142500.0,145000.0,Melbourne VIC,This is is the perfect role for a results driven Digital Content Manager to lead and own content marketing efforts and help improve lead generation.,"[<div class=""_1wkzzau0 a1msqi6m""><span class=""_1wkzzau0 a1msqi4y lnocuo0 lnocuo1 lnocuo21 _1d0g9qk4 lnocuo7""><a aria-label=""Limit results to Melbourne VIC"" class=""_1wkzzau0 _1wkzzauf _1wkzzau0 _1wkzzauf _842p0a0 _842p0a2"" data-automation=""jobLocation"" href=""/jobs-in-marketing-communications/in-All-Melbourne-VIC?salarytype=annual&amp;salaryrange=140000-145000"" rel=""nofollow"" tabindex=""-1"" target=""_self"" title=""Limit results to Melbourne VIC"">Melbourne VIC</a></span></div>]",2024-01-30,Marketing-communications - None,08/02/2024
422,https://www.seek.com.au//job/73453079?type=standout&ref=search-standalone,marketing communications,Digital & Search Marketing,eCommerce Manager,Adventure Operations Australia,-,140000.0,142500.0,145000.0,Brisbane QLD,Ready to take charge in revolutionising our online presence -this eCommerce Manager role is your ticket to shaping the future of our online success!,"[<div class=""_1wkzzau0 a1msqi6m""><span class=""_1wkzzau0 a1msqi4y lnocuo0 lnocuo1 lnocuo21 _1d0g9qk4 lnocuo7""><a aria-label=""Limit results to Eagle Farm"" class=""_1wkzzau0 _1wkzzauf _1wkzzau0 _1wkzzauf _842p0a0 _842p0a2"" data-automation=""jobLocation"" href=""/jobs-in-marketing-communications/in-Eagle-Farm-QLD-4009?salarytype=annual&amp;salaryrange=140000-145000"" rel=""nofollow"" tabindex=""-1"" target=""_self"" title=""Limit results to Eagle Farm"">Eagle Farm</a>, <a aria-label=""Limit results to Brisbane QLD"" class=""_1wkzzau0 _1wkzzauf _1wkzzau0 _1wkzzauf _842p0a0 _842p0a2"" data-automation=""jobLocation"" href=""/jobs-in-marketing-communications/in-All-Brisbane-QLD?salarytype=annual&amp;salaryrange=140000-145000"" rel=""nofollow"" tabindex=""-1"" target=""_self"" title=""Limit results to Brisbane QLD"">Brisbane QLD</a></span></div>]",2024-02-01,Marketing-communications - None,08/02/2024
423,https://www.seek.com.au//job/73584710?type=standard&ref=search-standalone,marketing communications,Digital & Search Marketing,Paid Media Manager,TheDriveGroup,-,140000.0,142500.0,145000.0,Sydney NSW,Paid Media Specialist for a newly created Marketing team to own the paid media function.,"[<div class=""_1wkzzau0 a1msqi6m""><span class=""_1wkzzau0 a1msqi4y lnocuo0 lnocuo1 lnocuo21 _1d0g9qk4 lnocuo7""><a aria-label=""Limit results to Sydney NSW"" class=""_1wkzzau0 _1wkzzauf _1wkzzau0 _1wkzzauf _842p0a0 _842p0a2"" data-automation=""jobLocation"" href=""/jobs-in-marketing-communications/in-All-Sydney-NSW?salarytype=annual&amp;salaryrange=140000-145000"" rel=""nofollow"" tabindex=""-1"" target=""_self"" title=""Limit results to Sydney NSW"">Sydney NSW</a></span></div>]",2024-02-07,Marketing-communications - None,08/02/2024
424,https://www.seek.com.au//job/73484509?type=standout&ref=search-standalone,marketing communications,Product Management & Development,Product Delivery Manager,Heritage and People's Choice,-,140000.0,142500.0,145000.0,Brisbane QLD,This is a truly unique opportunity where you will showcase your ability to deliver the best product offerings for our customers.,"[<div class=""_1wkzzau0 a1msqi6m""><span class=""_1wkzzau0 a1msqi4y lnocuo0 lnocuo1 lnocuo21 _1d0g9qk4 lnocuo7""><a aria-label=""Limit results to Brisbane QLD"" class=""_1wkzzau0 _1wkzzauf _1wkzzau0 _1wkzzauf _842p0a0 _842p0a2"" data-automation=""jobLocation"" href=""/jobs-in-marketing-communications/in-All-Brisbane-QLD?salarytype=annual&amp;salaryrange=140000-145000"" rel=""nofollow"" tabindex=""-1"" target=""_self"" title=""Limit results to Brisbane QLD"">Brisbane QLD</a></span></div>]",2024-02-02,Marketing-communications - None,08/02/2024
425,https://www.seek.com.au//job/73153342?type=standout&ref=search-standalone,marketing communications,Digital & Search Marketing,Digital Marketing Manager,Blackmores,-,140000.0,142500.0,145000.0,Sydney NSW,Fixed-term Digital Marketing role to execute campaigns and manage agencies across ANZ,"[<div class=""_1wkzzau0 a1msqi6m""><span class=""_1wkzzau0 a1msqi4y lnocuo0 lnocuo1 lnocuo21 _1d0g9qk4 lnocuo7""><a aria-label=""Limit results to Sydney NSW"" class=""_1wkzzau0 _1wkzzauf _1wkzzau0 _1wkzzauf _842p0a0 _842p0a2"" data-automation=""jobLocation"" href=""/jobs-in-marketing-communications/in-All-Sydney-NSW?salarytype=annual&amp;salaryrange=140000-145000"" rel=""nofollow"" tabindex=""-1"" target=""_self"" title=""Limit results to Sydney NSW"">Sydney NSW</a></span></div>]",2024-01-19,Marketing-communications - None,08/02/2024
426,https://www.seek.com.au//job/73245589?type=standout&ref=search-standalone,marketing communications,Brand Management,Brand Manager,Bega Group,+ bonus + benefits,140000.0,142500.0,145000.0,Melbourne VIC,"Australia's #1 Iced Coffee brand is seeking an experienced Brand Manager to join the Bega Group marketing team, in this career defining role!","[<div class=""_1wkzzau0 a1msqi6m""><span class=""_1wkzzau0 a1msqi4y lnocuo0 lnocuo1 lnocuo21 _1d0g9qk4 lnocuo7""><a aria-label=""Limit results to Docklands"" class=""_1wkzzau0 _1wkzzauf _1wkzzau0 _1wkzzauf _842p0a0 _842p0a2"" data-automation=""jobLocation"" href=""/jobs-in-marketing-communications/in-Docklands-VIC-3008?salarytype=annual&amp;salaryrange=140000-145000"" rel=""nofollow"" tabindex=""-1"" target=""_self"" title=""Limit results to Docklands"">Docklands</a>, <a aria-label=""Limit results to Melbourne VIC"" class=""_1wkzzau0 _1wkzzauf _1wkzzau0 _1wkzzauf _842p0a0 _842p0a2"" data-automation=""jobLocation"" href=""/jobs-in-marketing-communications/in-All-Melbourne-VIC?salarytype=annual&amp;salaryrange=140000-145000"" rel=""nofollow"" tabindex=""-1"" target=""_self"" title=""Limit results to Melbourne VIC"">Melbourne VIC</a></span></div>, <div class=""_1wkzzau0 a1msqi6m""><div aria-label=""Salary: + bonus + benefits"" class=""_1wkzzau0""><span class=""_1wkzzau0 a1msqi4y lnocuo0 lnocuo1 lnocuo21 _1d0g9qk4 lnocuo7"" data-automation=""jobSalary""><span class=""_1wkzzau0 _16v7pfz1 a1msqi4y a1msqi0 a1msqir _16v7pfz3"" style=""--_16v7pfz2:2"">+ bonus + benefits</span></span></div></div>]",2024-01-23,Marketing-communications - None,08/02/2024
427,https://www.seek.com.au//job/73208003?type=standout&ref=search-standalone,marketing communications,Internal Communications,Employee Communications Specialist,Microsoft,Subsidised health insurance + stock discounts,140000.0,142500.0,145000.0,Sydney NSW,Provide strategic communications advice to build and protect Microsoft’s brand and reputation by influencing the internal narrative about Microsoft.,"[<div class=""_1wkzzau0 a1msqi6m""><span class=""_1wkzzau0 a1msqi4y lnocuo0 lnocuo1 lnocuo21 _1d0g9qk4 lnocuo7""><a aria-label=""Limit results to Sydney NSW"" class=""_1wkzzau0 _1wkzzauf _1wkzzau0 _1wkzzauf _842p0a0 _842p0a2"" data-automation=""jobLocation"" href=""/jobs-in-marketing-communications/in-All-Sydney-NSW?salarytype=annual&amp;salaryrange=140000-145000"" rel=""nofollow"" tabindex=""-1"" target=""_self"" title=""Limit results to Sydney NSW"">Sydney NSW</a></span></div>, <div class=""_1wkzzau0 a1msqi6m""><div aria-label=""Salary: Subsidised health insurance + stock discounts"" class=""_1wkzzau0""><span class=""_1wkzzau0 a1msqi4y lnocuo0 lnocuo1 lnocuo21 _1d0g9qk4 lnocuo7"" data-automation=""jobSalary""><span class=""_1wkzzau0 _16v7pfz1 a1msqi4y a1msqi0 a1msqir _16v7pfz3"" style=""--_16v7pfz2:2"">Subsidised health insurance + stock discounts</span></span></div></div>]",2024-01-22,Marketing-communications - None,08/02/2024
428,https://www.seek.com.au//job/73008599?type=standout&ref=search-standalone,marketing communications,Management,Marketing Manager,CardioTech,"$100,000 – $125,000 per year",100000.0,112500.0,125000.0,Brisbane QLD,"Iconic Company seeking Marketing Manager/Creative Ad Copy Writer - great pay, great company culture! Immediate start.","[<div class=""_1wkzzau0 a1msqi6m""><span class=""_1wkzzau0 a1msqi4y lnocuo0 lnocuo1 lnocuo21 _1d0g9qk4 lnocuo7""><a aria-label=""Limit results to Brendale"" class=""_1wkzzau0 _1wkzzauf _1wkzzau0 _1wkzzauf _842p0a0 _842p0a2"" data-automation=""jobLocation"" href=""/jobs-in-marketing-communications/in-Brendale-QLD-4500?salarytype=annual&amp;salaryrange=140000-145000"" rel=""nofollow"" tabindex=""-1"" target=""_self"" title=""Limit results to Brendale"">Brendale</a>, <a aria-label=""Limit results to Brisbane QLD"" class=""_1wkzzau0 _1wkzzauf _1wkzzau0 _1wkzzauf _842p0a0 _842p0a2"" data-automation=""jobLocation"" href=""/jobs-in-marketing-communications/in-All-Brisbane-QLD?salarytype=annual&amp;salaryrange=140000-145000"" rel=""nofollow"" tabindex=""-1"" target=""_self"" title=""Limit results to Brisbane QLD"">Brisbane QLD</a></span></div>, <div class=""_1wkzzau0 a1msqi6m""><div aria-label=""Salary: $100,000 – $125,000 per year"" class=""_1wkzzau0""><span class=""_1wkzzau0 a1msqi4y lnocuo0 lnocuo1 lnocuo21 _1d0g9qk4 lnocuo7"" data-automation=""jobSalary""><span class=""_1wkzzau0 _16v7pfz1 a1msqi4y a1msqi0 a1msqir _16v7pfz3"" style=""--_16v7pfz2:2"">$100,000 – $125,000 per year</span></span></div></div>]",2024-01-15,Marketing-communications - None,08/02/2024
429,https://www.seek.com.au//job/73277067?type=standout&ref=search-standalone,marketing communications,Public Relations & Corporate Affairs,Communications Advisor,Transdev John Holland Buses (NSW) Pty Ltd,Attractive salary and benefits,140000.0,142500.0,145000.0,Sydney NSW,Join one of the world’s leading mobility companies,"[<div class=""_1wkzzau0 a1msqi6m""><span class=""_1wkzzau0 a1msqi4y lnocuo0 lnocuo1 lnocuo21 _1d0g9qk4 lnocuo7""><a aria-label=""Limit results to Sydney NSW"" class=""_1wkzzau0 _1wkzzauf _1wkzzau0 _1wkzzauf _842p0a0 _842p0a2"" data-automation=""jobLocation"" href=""/jobs-in-marketing-communications/in-All-Sydney-NSW?salarytype=annual&amp;salaryrange=140000-145000"" rel=""nofollow"" tabindex=""-1"" target=""_self"" title=""Limit results to Sydney NSW"">Sydney NSW</a></span></div>, <div class=""_1wkzzau0 a1msqi6m""><div aria-label=""Salary: Attractive salary and benefits"" class=""_1wkzzau0""><span class=""_1wkzzau0 a1msqi4y lnocuo0 lnocuo1 lnocuo21 _1d0g9qk4 lnocuo7"" data-automation=""jobSalary""><span class=""_1wkzzau0 _16v7pfz1 a1msqi4y a1msqi0 a1msqir _16v7pfz3"" style=""--_16v7pfz2:2"">Attractive salary and benefits</span></span></div></div>]",2024-01-24,Marketing-communications - None,08/02/2024
430,https://www.seek.com.au//job/73315617?type=standout&ref=search-standalone,marketing communications,Digital & Search Marketing,Head of Ecommerce and Digital Marketing,Marion's Kitchen,-,140000.0,142500.0,145000.0,Melbourne VIC,This role will be pivotal in overseeing and managing all aspects of our online sales and digital presence.,"[<div class=""_1wkzzau0 a1msqi6m""><span class=""_1wkzzau0 a1msqi4y lnocuo0 lnocuo1 lnocuo21 _1d0g9qk4 lnocuo7""><a aria-label=""Limit results to Melbourne VIC"" class=""_1wkzzau0 _1wkzzauf _1wkzzau0 _1wkzzauf _842p0a0 _842p0a2"" data-automation=""jobLocation"" href=""/jobs-in-marketing-communications/in-All-Melbourne-VIC?salarytype=annual&amp;salaryrange=140000-145000"" rel=""nofollow"" tabindex=""-1"" target=""_self"" title=""Limit results to Melbourne VIC"">Melbourne VIC</a></span></div>]",2024-01-25,Marketing-communications - None,08/02/2024
