,link,classification,category,title,company,salary,min_salary,average_salary,max_salary,location,description,entireDiv,date_posted,Category,Date
265,https://www.seek.com.au//job/73601850?type=promoted&ref=search-standalone,trades services,Automotive Trades,Terminal Supervisor (Mechanic Preferred),Campbell Transport,-,145000.0,147500.0,150000.0,"Geraldton, Geraldton, Gascoyne & Midwest WA",Looking for a rare opportunity in a fast growing company? Love Geraldton and everything it has to offer? Look no further!,"[<div class=""_1wkzzau0 a1msqi6m""><span class=""_1wkzzau0 a1msqi4y lnocuo0 lnocuo1 lnocuo21 _1d0g9qk4 lnocuo7""><a aria-label=""Limit results to Geraldton"" class=""_1wkzzau0 _1wkzzauf _1wkzzau0 _1wkzzauf _842p0a0 _842p0a2"" data-automation=""jobLocation"" href=""/jobs-in-trades-services/in-Geraldton-WA-6530?salarytype=annual&amp;salaryrange=145000-150000"" rel=""nofollow"" tabindex=""-1"" target=""_self"" title=""Limit results to Geraldton"">Geraldton</a>, <a aria-label=""Limit results to Geraldton, Gascoyne &amp; Midwest WA"" class=""_1wkzzau0 _1wkzzauf _1wkzzau0 _1wkzzauf _842p0a0 _842p0a2"" data-automation=""jobLocation"" href=""/jobs-in-trades-services/in-Geraldton,-Gascoyne-&amp;-Midwest-WA?salarytype=annual&amp;salaryrange=145000-150000"" rel=""nofollow"" tabindex=""-1"" target=""_self"" title=""Limit results to Geraldton, Gascoyne &amp; Midwest WA"">Geraldton, Gascoyne &amp; Midwest WA</a></span></div>]",,Trades-services - None,08/02/2024
266,https://www.seek.com.au//job/73438326?type=standard&ref=search-standalone,trades services,Automotive Trades,Heavy Vehicle Truck and Trailer Technicians - Fleet Maintenance,STT Mechanical,$55 – $60 per hour,99000.0,103500.0,108000.0,Brisbane QLD,"• Attractive wage and benefits
• Paid weekly 
• Family owned & operated","[<div class=""_1wkzzau0 a1msqi6m""><span class=""_1wkzzau0 a1msqi4y lnocuo0 lnocuo1 lnocuo21 _1d0g9qk4 lnocuo7""><a aria-label=""Limit results to Wacol"" class=""_1wkzzau0 _1wkzzauf _1wkzzau0 _1wkzzauf _842p0a0 _842p0a2"" data-automation=""jobLocation"" href=""/jobs-in-trades-services/in-Wacol-QLD-4076?salarytype=annual&amp;salaryrange=145000-150000"" rel=""nofollow"" tabindex=""-1"" target=""_self"" title=""Limit results to Wacol"">Wacol</a>, <a aria-label=""Limit results to Brisbane QLD"" class=""_1wkzzau0 _1wkzzauf _1wkzzau0 _1wkzzauf _842p0a0 _842p0a2"" data-automation=""jobLocation"" href=""/jobs-in-trades-services/in-All-Brisbane-QLD?salarytype=annual&amp;salaryrange=145000-150000"" rel=""nofollow"" tabindex=""-1"" target=""_self"" title=""Limit results to Brisbane QLD"">Brisbane QLD</a></span></div>, <div class=""_1wkzzau0 a1msqi6m""><div aria-label=""Salary: $55 – $60 per hour"" class=""_1wkzzau0""><span class=""_1wkzzau0 a1msqi4y lnocuo0 lnocuo1 lnocuo21 _1d0g9qk4 lnocuo7"" data-automation=""jobSalary""><span class=""_1wkzzau0 _16v7pfz1 a1msqi4y a1msqi0 a1msqir _16v7pfz3"" style=""--_16v7pfz2:2"">$55 – $60 per hour</span></span></div></div>]",2024-01-31,Trades-services - None,08/02/2024
267,https://www.seek.com.au//job/73563394?type=standout&ref=search-standalone,trades services,Electricians,Field Service Technician - Electrical,XYLEM WATER SOLUTIONS AUSTRALIA LIMITED,Great Benefits | 12% Super | Bonus,145000.0,147500.0,150000.0,Sydney NSW,"Xylem are looking for an experienced Electrician with an interest in treatment, monitoring, control & instrumentation to work in the water industry.","[<div class=""_1wkzzau0 a1msqi6m""><span class=""_1wkzzau0 a1msqi4y lnocuo0 lnocuo1 lnocuo21 _1d0g9qk4 lnocuo7""><a aria-label=""Limit results to Kemps Creek"" class=""_1wkzzau0 _1wkzzauf _1wkzzau0 _1wkzzauf _842p0a0 _842p0a2"" data-automation=""jobLocation"" href=""/jobs-in-trades-services/in-Kemps-Creek-NSW-2178?salarytype=annual&amp;salaryrange=145000-150000"" rel=""nofollow"" tabindex=""-1"" target=""_self"" title=""Limit results to Kemps Creek"">Kemps Creek</a>, <a aria-label=""Limit results to Sydney NSW"" class=""_1wkzzau0 _1wkzzauf _1wkzzau0 _1wkzzauf _842p0a0 _842p0a2"" data-automation=""jobLocation"" href=""/jobs-in-trades-services/in-All-Sydney-NSW?salarytype=annual&amp;salaryrange=145000-150000"" rel=""nofollow"" tabindex=""-1"" target=""_self"" title=""Limit results to Sydney NSW"">Sydney NSW</a></span></div>, <div class=""_1wkzzau0 a1msqi6m""><div aria-label=""Salary: Great Benefits | 12% Super | Bonus"" class=""_1wkzzau0""><span class=""_1wkzzau0 a1msqi4y lnocuo0 lnocuo1 lnocuo21 _1d0g9qk4 lnocuo7"" data-automation=""jobSalary""><span class=""_1wkzzau0 _16v7pfz1 a1msqi4y a1msqi0 a1msqir _16v7pfz3"" style=""--_16v7pfz2:2"">Great Benefits | 12% Super | Bonus</span></span></div></div>]",2024-02-06,Trades-services - None,08/02/2024
268,https://www.seek.com.au//job/73548847?type=standout&ref=search-standalone,trades services,"Fitters, Turners & Machinists",Mechanical Fitter - South 32,RCR Mining Technologies,-,145000.0,147500.0,150000.0,"Collie, Bunbury & South West WA",Are you a skilled Mechanical Fitter? RCR Mining Technologies is seeking talented individuals like you to join our team at South 32 in Collie.,"[<div class=""_1wkzzau0 a1msqi6m""><span class=""_1wkzzau0 a1msqi4y lnocuo0 lnocuo1 lnocuo21 _1d0g9qk4 lnocuo7""><a aria-label=""Limit results to Collie"" class=""_1wkzzau0 _1wkzzauf _1wkzzau0 _1wkzzauf _842p0a0 _842p0a2"" data-automation=""jobLocation"" href=""/jobs-in-trades-services/in-Collie-WA-6225?salarytype=annual&amp;salaryrange=145000-150000"" rel=""nofollow"" tabindex=""-1"" target=""_self"" title=""Limit results to Collie"">Collie</a>, <a aria-label=""Limit results to Bunbury &amp; South West WA"" class=""_1wkzzau0 _1wkzzauf _1wkzzau0 _1wkzzauf _842p0a0 _842p0a2"" data-automation=""jobLocation"" href=""/jobs-in-trades-services/in-Bunbury-&amp;-South-West-WA?salarytype=annual&amp;salaryrange=145000-150000"" rel=""nofollow"" tabindex=""-1"" target=""_self"" title=""Limit results to Bunbury &amp; South West WA"">Bunbury &amp; South West WA</a></span></div>]",2024-02-06,Trades-services - None,08/02/2024
269,https://www.seek.com.au//job/73519039?type=standout&ref=search-standalone,trades services,Labourers,Steel Fixer,Reo Tech Solutions Australia,-,145000.0,147500.0,150000.0,Perth WA,We have opportunties for you to join one of WA's leading Steel Fixing companies and work across various projects throughout the state.,"[<div class=""_1wkzzau0 a1msqi6m""><span class=""_1wkzzau0 a1msqi4y lnocuo0 lnocuo1 lnocuo21 _1d0g9qk4 lnocuo7""><a aria-label=""Limit results to Perth WA"" class=""_1wkzzau0 _1wkzzauf _1wkzzau0 _1wkzzauf _842p0a0 _842p0a2"" data-automation=""jobLocation"" href=""/jobs-in-trades-services/in-All-Perth-WA?salarytype=annual&amp;salaryrange=145000-150000"" rel=""nofollow"" tabindex=""-1"" target=""_self"" title=""Limit results to Perth WA"">Perth WA</a></span></div>]",2024-02-05,Trades-services - None,08/02/2024
270,https://www.seek.com.au//job/73581850?type=standout&ref=search-standalone,trades services,Maintenance & Handyperson Services,Repairs and Maintenance Storage Project Manager,Capstone Recruitment Group Pty Ltd,-,145000.0,147500.0,150000.0,Melbourne VIC,National storage business in a growth phase requires skilled PM/maintenance professional to manage audits across across Victoria.,"[<div class=""_1wkzzau0 a1msqi6m""><span class=""_1wkzzau0 a1msqi4y lnocuo0 lnocuo1 lnocuo21 _1d0g9qk4 lnocuo7""><a aria-label=""Limit results to Eastern Suburbs"" class=""_1wkzzau0 _1wkzzauf _1wkzzau0 _1wkzzauf _842p0a0 _842p0a2"" data-automation=""jobLocation"" href=""/jobs-in-trades-services/in-Eastern-Suburbs-Melbourne-VIC?salarytype=annual&amp;salaryrange=145000-150000"" rel=""nofollow"" tabindex=""-1"" target=""_self"" title=""Limit results to Eastern Suburbs"">Eastern Suburbs</a>, <a aria-label=""Limit results to Melbourne VIC"" class=""_1wkzzau0 _1wkzzauf _1wkzzau0 _1wkzzauf _842p0a0 _842p0a2"" data-automation=""jobLocation"" href=""/jobs-in-trades-services/in-All-Melbourne-VIC?salarytype=annual&amp;salaryrange=145000-150000"" rel=""nofollow"" tabindex=""-1"" target=""_self"" title=""Limit results to Melbourne VIC"">Melbourne VIC</a></span></div>]",2024-02-07,Trades-services - None,08/02/2024
271,https://www.seek.com.au//job/73572635?type=standout&ref=search-standalone,trades services,"Fitters, Turners & Machinists",Mechanical Fitter,C&H Recruitment,-,145000.0,147500.0,150000.0,Sydney NSW,Mechanical Fitters required to work on overhaul and strip/assembly of underground mining equipment. Apply now!,"[<div class=""_1wkzzau0 a1msqi6m""><span class=""_1wkzzau0 a1msqi4y lnocuo0 lnocuo1 lnocuo21 _1d0g9qk4 lnocuo7""><a aria-label=""Limit results to Campbelltown"" class=""_1wkzzau0 _1wkzzauf _1wkzzau0 _1wkzzauf _842p0a0 _842p0a2"" data-automation=""jobLocation"" href=""/jobs-in-trades-services/in-Campbelltown-NSW-2560?salarytype=annual&amp;salaryrange=145000-150000"" rel=""nofollow"" tabindex=""-1"" target=""_self"" title=""Limit results to Campbelltown"">Campbelltown</a>, <a aria-label=""Limit results to Sydney NSW"" class=""_1wkzzau0 _1wkzzauf _1wkzzau0 _1wkzzauf _842p0a0 _842p0a2"" data-automation=""jobLocation"" href=""/jobs-in-trades-services/in-All-Sydney-NSW?salarytype=annual&amp;salaryrange=145000-150000"" rel=""nofollow"" tabindex=""-1"" target=""_self"" title=""Limit results to Sydney NSW"">Sydney NSW</a></span></div>]",2024-02-07,Trades-services - None,08/02/2024
272,https://www.seek.com.au//job/73516246?type=standout&ref=search-standalone,trades services,Air Conditioning & Refrigeration,Commercial HVAC Technician,Cool Air Conditioning Pty Ltd,$40 – $60 per hour depending on Skill set,72000.0,90000.0,108000.0,Brisbane QLD,"Looking for Commercial HVAC Technicians. 
Multiple positions available.","[<div class=""_1wkzzau0 a1msqi6m""><span class=""_1wkzzau0 a1msqi4y lnocuo0 lnocuo1 lnocuo21 _1d0g9qk4 lnocuo7""><a aria-label=""Limit results to Cannon Hill"" class=""_1wkzzau0 _1wkzzauf _1wkzzau0 _1wkzzauf _842p0a0 _842p0a2"" data-automation=""jobLocation"" href=""/jobs-in-trades-services/in-Cannon-Hill-QLD-4170?salarytype=annual&amp;salaryrange=145000-150000"" rel=""nofollow"" tabindex=""-1"" target=""_self"" title=""Limit results to Cannon Hill"">Cannon Hill</a>, <a aria-label=""Limit results to Brisbane QLD"" class=""_1wkzzau0 _1wkzzauf _1wkzzau0 _1wkzzauf _842p0a0 _842p0a2"" data-automation=""jobLocation"" href=""/jobs-in-trades-services/in-All-Brisbane-QLD?salarytype=annual&amp;salaryrange=145000-150000"" rel=""nofollow"" tabindex=""-1"" target=""_self"" title=""Limit results to Brisbane QLD"">Brisbane QLD</a></span></div>, <div class=""_1wkzzau0 a1msqi6m""><div aria-label=""Salary: $40 – $60 per hour depending on Skill set"" class=""_1wkzzau0""><span class=""_1wkzzau0 a1msqi4y lnocuo0 lnocuo1 lnocuo21 _1d0g9qk4 lnocuo7"" data-automation=""jobSalary""><span class=""_1wkzzau0 _16v7pfz1 a1msqi4y a1msqi0 a1msqir _16v7pfz3"" style=""--_16v7pfz2:2"">$40 – $60 per hour depending on Skill set</span></span></div></div>]",2024-02-05,Trades-services - None,08/02/2024
273,https://www.seek.com.au//job/73482594?type=standard&ref=search-standalone,trades services,"Fitters, Turners & Machinists",CNC Programmer - Lathe,Next Level Consulting Solutions,-,145000.0,147500.0,150000.0,Brisbane QLD,"Machining Centre Operator/ Programmer/ Setter required for workshop on the south side of Brisbane. Positive, no blame working culture","[<div class=""_1wkzzau0 a1msqi6m""><span class=""_1wkzzau0 a1msqi4y lnocuo0 lnocuo1 lnocuo21 _1d0g9qk4 lnocuo7""><a aria-label=""Limit results to Archerfield"" class=""_1wkzzau0 _1wkzzauf _1wkzzau0 _1wkzzauf _842p0a0 _842p0a2"" data-automation=""jobLocation"" href=""/jobs-in-trades-services/in-Archerfield-QLD-4108?salarytype=annual&amp;salaryrange=145000-150000"" rel=""nofollow"" tabindex=""-1"" target=""_self"" title=""Limit results to Archerfield"">Archerfield</a>, <a aria-label=""Limit results to Brisbane QLD"" class=""_1wkzzau0 _1wkzzauf _1wkzzau0 _1wkzzauf _842p0a0 _842p0a2"" data-automation=""jobLocation"" href=""/jobs-in-trades-services/in-All-Brisbane-QLD?salarytype=annual&amp;salaryrange=145000-150000"" rel=""nofollow"" tabindex=""-1"" target=""_self"" title=""Limit results to Brisbane QLD"">Brisbane QLD</a></span></div>]",2024-02-02,Trades-services - None,08/02/2024
274,https://www.seek.com.au//job/73528698?type=standout&ref=search-standalone,trades services,Other,Hi Rail Excavator Operator,Monadelphous,-,145000.0,147500.0,150000.0,Newcastle NSW,"Seeking an experienced Hi Rail Excavator Operator to join our Newcastle Rail Operations team on a permanent, full-time basis.","[<div class=""_1wkzzau0 a1msqi6m""><span class=""_1wkzzau0 a1msqi4y lnocuo0 lnocuo1 lnocuo21 _1d0g9qk4 lnocuo7""><a aria-label=""Limit results to Rutherford"" class=""_1wkzzau0 _1wkzzauf _1wkzzau0 _1wkzzauf _842p0a0 _842p0a2"" data-automation=""jobLocation"" href=""/jobs-in-trades-services/in-Rutherford-NSW-2320?salarytype=annual&amp;salaryrange=145000-150000"" rel=""nofollow"" tabindex=""-1"" target=""_self"" title=""Limit results to Rutherford"">Rutherford</a>, <a aria-label=""Limit results to Newcastle, Maitland &amp; Hunter NSW"" class=""_1wkzzau0 _1wkzzauf _1wkzzau0 _1wkzzauf _842p0a0 _842p0a2"" data-automation=""jobLocation"" href=""/jobs-in-trades-services/in-Newcastle,-Maitland-&amp;-Hunter-NSW?salarytype=annual&amp;salaryrange=145000-150000"" rel=""nofollow"" tabindex=""-1"" target=""_self"" title=""Limit results to Newcastle, Maitland &amp; Hunter NSW"">Newcastle, Maitland &amp; Hunter NSW</a></span></div>]",2024-02-05,Trades-services - None,08/02/2024
275,https://www.seek.com.au//job/73358794?type=standard&ref=search-standalone,trades services,Welders & Boilermakers,Field Fitters and Boilermakers/ Supervisors,Maintech Group Pty Ltd,"$100,000 – $150,000 per year",100000.0,125000.0,150000.0,Brisbane QLD,Seeking a Highly Motivated industrial Blasting with Basic Painting Skills,"[<div class=""_1wkzzau0 a1msqi6m""><span class=""_1wkzzau0 a1msqi4y lnocuo0 lnocuo1 lnocuo21 _1d0g9qk4 lnocuo7""><a aria-label=""Limit results to Narangba"" class=""_1wkzzau0 _1wkzzauf _1wkzzau0 _1wkzzauf _842p0a0 _842p0a2"" data-automation=""jobLocation"" href=""/jobs-in-trades-services/in-Narangba-QLD-4504?salarytype=annual&amp;salaryrange=145000-150000"" rel=""nofollow"" tabindex=""-1"" target=""_self"" title=""Limit results to Narangba"">Narangba</a>, <a aria-label=""Limit results to Brisbane QLD"" class=""_1wkzzau0 _1wkzzauf _1wkzzau0 _1wkzzauf _842p0a0 _842p0a2"" data-automation=""jobLocation"" href=""/jobs-in-trades-services/in-All-Brisbane-QLD?salarytype=annual&amp;salaryrange=145000-150000"" rel=""nofollow"" tabindex=""-1"" target=""_self"" title=""Limit results to Brisbane QLD"">Brisbane QLD</a></span></div>, <div class=""_1wkzzau0 a1msqi6m""><div aria-label=""Salary: $100,000 – $150,000 per year"" class=""_1wkzzau0""><span class=""_1wkzzau0 a1msqi4y lnocuo0 lnocuo1 lnocuo21 _1d0g9qk4 lnocuo7"" data-automation=""jobSalary""><span class=""_1wkzzau0 _16v7pfz1 a1msqi4y a1msqi0 a1msqir _16v7pfz3"" style=""--_16v7pfz2:2"">$100,000 – $150,000 per year</span></span></div></div>]",2024-01-29,Trades-services - None,08/02/2024
276,https://www.seek.com.au//job/73524044?type=standout&ref=search-standalone,trades services,Welders & Boilermakers,"Sheet Metal Workers, Welders, Fabricators and Site Installers wanted!",Thump Architectural Fittings,$40 – $60 per hour,72000.0,90000.0,108000.0,Brisbane QLD,Seeking enthusiastic and committed staff for fabrication and installation of  metalwork and balustrade. Very diverse and interesting work.,"[<div class=""_1wkzzau0 a1msqi6m""><span class=""_1wkzzau0 a1msqi4y lnocuo0 lnocuo1 lnocuo21 _1d0g9qk4 lnocuo7""><a aria-label=""Limit results to Acacia Ridge"" class=""_1wkzzau0 _1wkzzauf _1wkzzau0 _1wkzzauf _842p0a0 _842p0a2"" data-automation=""jobLocation"" href=""/jobs-in-trades-services/in-Acacia-Ridge-QLD-4110?salarytype=annual&amp;salaryrange=145000-150000"" rel=""nofollow"" tabindex=""-1"" target=""_self"" title=""Limit results to Acacia Ridge"">Acacia Ridge</a>, <a aria-label=""Limit results to Brisbane QLD"" class=""_1wkzzau0 _1wkzzauf _1wkzzau0 _1wkzzauf _842p0a0 _842p0a2"" data-automation=""jobLocation"" href=""/jobs-in-trades-services/in-All-Brisbane-QLD?salarytype=annual&amp;salaryrange=145000-150000"" rel=""nofollow"" tabindex=""-1"" target=""_self"" title=""Limit results to Brisbane QLD"">Brisbane QLD</a></span></div>, <div class=""_1wkzzau0 a1msqi6m""><div aria-label=""Salary: $40 – $60 per hour"" class=""_1wkzzau0""><span class=""_1wkzzau0 a1msqi4y lnocuo0 lnocuo1 lnocuo21 _1d0g9qk4 lnocuo7"" data-automation=""jobSalary""><span class=""_1wkzzau0 _16v7pfz1 a1msqi4y a1msqi0 a1msqir _16v7pfz3"" style=""--_16v7pfz2:2"">$40 – $60 per hour</span></span></div></div>]",2024-02-05,Trades-services - None,08/02/2024
277,https://www.seek.com.au//job/73611802?type=standout&ref=search-standalone,trades services,Carpentry & Cabinet Making,Trade Qualified Carpenter,Coast 2 Country Construction,"$100,000 – $120,000 per year",100000.0,110000.0,120000.0,"Gladstone, Gladstone & Central QLD","Full time employment 
Over time and site allowances
Competitive wages","[<div class=""_1wkzzau0 a1msqi6m""><span class=""_1wkzzau0 a1msqi4y lnocuo0 lnocuo1 lnocuo21 _1d0g9qk4 lnocuo7""><a aria-label=""Limit results to Gladstone"" class=""_1wkzzau0 _1wkzzauf _1wkzzau0 _1wkzzauf _842p0a0 _842p0a2"" data-automation=""jobLocation"" href=""/jobs-in-trades-services/in-Gladstone-QLD-4680?salarytype=annual&amp;salaryrange=145000-150000"" rel=""nofollow"" tabindex=""-1"" target=""_self"" title=""Limit results to Gladstone"">Gladstone</a>, <a aria-label=""Limit results to Gladstone &amp; Central QLD"" class=""_1wkzzau0 _1wkzzauf _1wkzzau0 _1wkzzauf _842p0a0 _842p0a2"" data-automation=""jobLocation"" href=""/jobs-in-trades-services/in-Gladstone-&amp;-Central-QLD?salarytype=annual&amp;salaryrange=145000-150000"" rel=""nofollow"" tabindex=""-1"" target=""_self"" title=""Limit results to Gladstone &amp; Central QLD"">Gladstone &amp; Central QLD</a></span></div>, <div class=""_1wkzzau0 a1msqi6m""><div aria-label=""Salary: $100,000 – $120,000 per year"" class=""_1wkzzau0""><span class=""_1wkzzau0 a1msqi4y lnocuo0 lnocuo1 lnocuo21 _1d0g9qk4 lnocuo7"" data-automation=""jobSalary""><span class=""_1wkzzau0 _16v7pfz1 a1msqi4y a1msqi0 a1msqir _16v7pfz3"" style=""--_16v7pfz2:2"">$100,000 – $120,000 per year</span></span></div></div>]",,Trades-services - None,08/02/2024
278,https://www.seek.com.au//job/73625868?type=standout&ref=search-standalone,trades services,Technicians,Maintenance Team Lead (Rigging and Transport),Raytheon Australia,-,145000.0,147500.0,150000.0,"Exmouth, Geraldton, Gascoyne & Midwest WA","Raytheon Australia is seeking a Precinct Supervisor (Antenna Maintainer) to join our team in Exmouth, WA","[<div class=""_1wkzzau0 a1msqi6m""><span class=""_1wkzzau0 a1msqi4y lnocuo0 lnocuo1 lnocuo21 _1d0g9qk4 lnocuo7""><a aria-label=""Limit results to Exmouth"" class=""_1wkzzau0 _1wkzzauf _1wkzzau0 _1wkzzauf _842p0a0 _842p0a2"" data-automation=""jobLocation"" href=""/jobs-in-trades-services/in-Exmouth-WA-6707?salarytype=annual&amp;salaryrange=145000-150000"" rel=""nofollow"" tabindex=""-1"" target=""_self"" title=""Limit results to Exmouth"">Exmouth</a>, <a aria-label=""Limit results to Geraldton, Gascoyne &amp; Midwest WA"" class=""_1wkzzau0 _1wkzzauf _1wkzzau0 _1wkzzauf _842p0a0 _842p0a2"" data-automation=""jobLocation"" href=""/jobs-in-trades-services/in-Geraldton,-Gascoyne-&amp;-Midwest-WA?salarytype=annual&amp;salaryrange=145000-150000"" rel=""nofollow"" tabindex=""-1"" target=""_self"" title=""Limit results to Geraldton, Gascoyne &amp; Midwest WA"">Geraldton, Gascoyne &amp; Midwest WA</a></span></div>]",,Trades-services - None,08/02/2024
279,https://www.seek.com.au//job/73416132?type=standout&ref=search-standalone,trades services,"Fitters, Turners & Machinists",Mechanical Fitter,AWX Executive,"$79,040 - $84,968 + Super",79040.0,82004.0,84968.0,Brisbane QLD,Our client is looking leading engineering contractor known for delivering high-quality mechanical solutions to a diverse range of industries.,"[<div class=""_1wkzzau0 a1msqi6m""><span class=""_1wkzzau0 a1msqi4y lnocuo0 lnocuo1 lnocuo21 _1d0g9qk4 lnocuo7""><a aria-label=""Limit results to Brisbane QLD"" class=""_1wkzzau0 _1wkzzauf _1wkzzau0 _1wkzzauf _842p0a0 _842p0a2"" data-automation=""jobLocation"" href=""/jobs-in-trades-services/in-All-Brisbane-QLD?salarytype=annual&amp;salaryrange=145000-150000"" rel=""nofollow"" tabindex=""-1"" target=""_self"" title=""Limit results to Brisbane QLD"">Brisbane QLD</a></span></div>, <div class=""_1wkzzau0 a1msqi6m""><div aria-label=""Salary: $79,040 - $84,968 + Super"" class=""_1wkzzau0""><span class=""_1wkzzau0 a1msqi4y lnocuo0 lnocuo1 lnocuo21 _1d0g9qk4 lnocuo7"" data-automation=""jobSalary""><span class=""_1wkzzau0 _16v7pfz1 a1msqi4y a1msqi0 a1msqir _16v7pfz3"" style=""--_16v7pfz2:2"">$79,040 - $84,968 + Super</span></span></div></div>]",2024-01-31,Trades-services - None,08/02/2024
280,https://www.seek.com.au//job/73572490?type=standout&ref=search-standalone,trades services,"Fitters, Turners & Machinists",Mechanical Fitter,C&H Recruitment,-,145000.0,147500.0,150000.0,Other,We are seeking skilled Mechanical Fitters with mining experience for projects throughout 2024,"[<div class=""_1wkzzau0 a1msqi6m""><span class=""_1wkzzau0 a1msqi4y lnocuo0 lnocuo1 lnocuo21 _1d0g9qk4 lnocuo7""><a aria-label=""Limit results to Moss Vale"" class=""_1wkzzau0 _1wkzzauf _1wkzzau0 _1wkzzauf _842p0a0 _842p0a2"" data-automation=""jobLocation"" href=""/jobs-in-trades-services/in-Moss-Vale-NSW-2577?salarytype=annual&amp;salaryrange=145000-150000"" rel=""nofollow"" tabindex=""-1"" target=""_self"" title=""Limit results to Moss Vale"">Moss Vale</a>, <a aria-label=""Limit results to Southern Highlands &amp; Tablelands NSW"" class=""_1wkzzau0 _1wkzzauf _1wkzzau0 _1wkzzauf _842p0a0 _842p0a2"" data-automation=""jobLocation"" href=""/jobs-in-trades-services/in-Southern-Highlands-&amp;-Tablelands-NSW?salarytype=annual&amp;salaryrange=145000-150000"" rel=""nofollow"" tabindex=""-1"" target=""_self"" title=""Limit results to Southern Highlands &amp; Tablelands NSW"">Southern Highlands &amp; Tablelands NSW</a></span></div>]",2024-02-07,Trades-services - None,08/02/2024
281,https://www.seek.com.au//job/73529833?type=standout&ref=search-standalone,trades services,Technicians,Two-Way Radio Technician,TRANS COMMUNICATIONS PTY LTD,-,145000.0,147500.0,150000.0,Brisbane QLD,Bring your skills as a qualified and experienced two-way radio technician to this long standing two-way radio company.,"[<div class=""_1wkzzau0 a1msqi6m""><span class=""_1wkzzau0 a1msqi4y lnocuo0 lnocuo1 lnocuo21 _1d0g9qk4 lnocuo7""><a aria-label=""Limit results to Stafford"" class=""_1wkzzau0 _1wkzzauf _1wkzzau0 _1wkzzauf _842p0a0 _842p0a2"" data-automation=""jobLocation"" href=""/jobs-in-trades-services/in-Stafford-QLD-4053?salarytype=annual&amp;salaryrange=145000-150000"" rel=""nofollow"" tabindex=""-1"" target=""_self"" title=""Limit results to Stafford"">Stafford</a>, <a aria-label=""Limit results to Brisbane QLD"" class=""_1wkzzau0 _1wkzzauf _1wkzzau0 _1wkzzauf _842p0a0 _842p0a2"" data-automation=""jobLocation"" href=""/jobs-in-trades-services/in-All-Brisbane-QLD?salarytype=annual&amp;salaryrange=145000-150000"" rel=""nofollow"" tabindex=""-1"" target=""_self"" title=""Limit results to Brisbane QLD"">Brisbane QLD</a></span></div>]",2024-02-05,Trades-services - None,08/02/2024
282,https://www.seek.com.au//job/73443317?type=standard&ref=search-standalone,trades services,Technicians,Field Service Technician - excellent working conditions!!!,Conquest Recruitment Group Pty Ltd,Great package on offer!!!,145000.0,147500.0,150000.0,Melbourne VIC,"*Great hours and above award rates of pay
*Optional weekend work at overtime rates
*Mornington Peninsula location","[<div class=""_1wkzzau0 a1msqi6m""><span class=""_1wkzzau0 a1msqi4y lnocuo0 lnocuo1 lnocuo21 _1d0g9qk4 lnocuo7""><a aria-label=""Limit results to Dandenong"" class=""_1wkzzau0 _1wkzzauf _1wkzzau0 _1wkzzauf _842p0a0 _842p0a2"" data-automation=""jobLocation"" href=""/jobs-in-trades-services/in-Dandenong-VIC-3175?salarytype=annual&amp;salaryrange=145000-150000"" rel=""nofollow"" tabindex=""-1"" target=""_self"" title=""Limit results to Dandenong"">Dandenong</a>, <a aria-label=""Limit results to Melbourne VIC"" class=""_1wkzzau0 _1wkzzauf _1wkzzau0 _1wkzzauf _842p0a0 _842p0a2"" data-automation=""jobLocation"" href=""/jobs-in-trades-services/in-All-Melbourne-VIC?salarytype=annual&amp;salaryrange=145000-150000"" rel=""nofollow"" tabindex=""-1"" target=""_self"" title=""Limit results to Melbourne VIC"">Melbourne VIC</a></span></div>, <div class=""_1wkzzau0 a1msqi6m""><div aria-label=""Salary: Great package on offer!!!"" class=""_1wkzzau0""><span class=""_1wkzzau0 a1msqi4y lnocuo0 lnocuo1 lnocuo21 _1d0g9qk4 lnocuo7"" data-automation=""jobSalary""><span class=""_1wkzzau0 _16v7pfz1 a1msqi4y a1msqi0 a1msqir _16v7pfz3"" style=""--_16v7pfz2:2"">Great package on offer!!!</span></span></div></div>]",2024-02-01,Trades-services - None,08/02/2024
