,link,classification,category,title,company,salary,min_salary,average_salary,max_salary,location,description,entireDiv,date_posted,Category,Date
0,https://www.seek.com.au//job/73630552?type=promoted&ref=search-standalone,marketing communications,Management,Head of Brand and Marketing,EzyDog Pty Ltd,-,140000.0,142500.0,145000.0,Gold Coast QLD,"Reporting directly to the Founder/Directors, you will oversee all elements of Brand and Marketing for the EzyDog brand internationally.","[<div class=""_1wkzzau0 a1msqi6m""><span class=""_1wkzzau0 a1msqi4y lnocuo0 lnocuo1 lnocuo21 _1d0g9qk4 lnocuo7""><a aria-label=""Limit results to Burleigh Heads"" class=""_1wkzzau0 _1wkzzauf _1wkzzau0 _1wkzzauf _842p0a0 _842p0a2"" data-automation=""jobLocation"" href=""/jobs-in-marketing-communications/in-Burleigh-Heads-QLD-4220?salarytype=annual&amp;salaryrange=140000-145000"" rel=""nofollow"" tabindex=""-1"" target=""_self"" title=""Limit results to Burleigh Heads"">Burleigh Heads</a>, <a aria-label=""Limit results to Gold Coast QLD"" class=""_1wkzzau0 _1wkzzauf _1wkzzau0 _1wkzzauf _842p0a0 _842p0a2"" data-automation=""jobLocation"" href=""/jobs-in-marketing-communications/in-All-Gold-Coast-QLD?salarytype=annual&amp;salaryrange=140000-145000"" rel=""nofollow"" tabindex=""-1"" target=""_self"" title=""Limit results to Gold Coast QLD"">Gold Coast QLD</a></span></div>]",,Marketing-communications - None,08/02/2024
1,https://www.seek.com.au//job/73623354?type=promoted&ref=search-standalone,marketing communications,Management,Marketing Manager,Market Direct Camper Trailers,-,140000.0,142500.0,145000.0,Brisbane QLD,A great opportunity to lead a core team within our business!  Join an industry leader in selling the Camping/Caravanning dream to our customers.,"[<div class=""_1wkzzau0 a1msqi6m""><span class=""_1wkzzau0 a1msqi4y lnocuo0 lnocuo1 lnocuo21 _1d0g9qk4 lnocuo7""><a aria-label=""Limit results to Coopers Plains"" class=""_1wkzzau0 _1wkzzauf _1wkzzau0 _1wkzzauf _842p0a0 _842p0a2"" data-automation=""jobLocation"" href=""/jobs-in-marketing-communications/in-Coopers-Plains-QLD-4108?salarytype=annual&amp;salaryrange=140000-145000"" rel=""nofollow"" tabindex=""-1"" target=""_self"" title=""Limit results to Coopers Plains"">Coopers Plains</a>, <a aria-label=""Limit results to Brisbane QLD"" class=""_1wkzzau0 _1wkzzauf _1wkzzau0 _1wkzzauf _842p0a0 _842p0a2"" data-automation=""jobLocation"" href=""/jobs-in-marketing-communications/in-All-Brisbane-QLD?salarytype=annual&amp;salaryrange=140000-145000"" rel=""nofollow"" tabindex=""-1"" target=""_self"" title=""Limit results to Brisbane QLD"">Brisbane QLD</a></span></div>]",,Marketing-communications - None,08/02/2024
2,https://www.seek.com.au//job/73617271?type=standard&ref=search-standalone,marketing communications,Management,Senior Marketing Manager,,-,140000.0,142500.0,145000.0,Gold Coast QLD,"Great career opportunity for a future CMO. Flexible working, career development and supportive team. Drive the marketing strategy of growing business.","[<div class=""_1wkzzau0 a1msqi6m""><span class=""_1wkzzau0 a1msqi4y lnocuo0 lnocuo1 lnocuo21 _1d0g9qk4 lnocuo7""><a aria-label=""Limit results to Bundall"" class=""_1wkzzau0 _1wkzzauf _1wkzzau0 _1wkzzauf _842p0a0 _842p0a2"" data-automation=""jobLocation"" href=""/jobs-in-marketing-communications/in-Bundall-QLD-4217?salarytype=annual&amp;salaryrange=140000-145000"" rel=""nofollow"" tabindex=""-1"" target=""_self"" title=""Limit results to Bundall"">Bundall</a>, <a aria-label=""Limit results to Gold Coast QLD"" class=""_1wkzzau0 _1wkzzauf _1wkzzau0 _1wkzzauf _842p0a0 _842p0a2"" data-automation=""jobLocation"" href=""/jobs-in-marketing-communications/in-All-Gold-Coast-QLD?salarytype=annual&amp;salaryrange=140000-145000"" rel=""nofollow"" tabindex=""-1"" target=""_self"" title=""Limit results to Gold Coast QLD"">Gold Coast QLD</a></span></div>]",,Marketing-communications - None,08/02/2024
3,https://www.seek.com.au//job/73555482?type=standout&ref=search-standalone,marketing communications,Marketing Communications,Senior Content Strategist,Charles Sturt University,-,140000.0,142500.0,145000.0,Other,Take the lead and manage a high performing team to develop and deliver a range of content projects and key strategies.,"[<div class=""_1wkzzau0 a1msqi6m""><span class=""_1wkzzau0 a1msqi4y lnocuo0 lnocuo1 lnocuo21 _1d0g9qk4 lnocuo7""><a aria-label=""Limit results to Port Macquarie"" class=""_1wkzzau0 _1wkzzauf _1wkzzau0 _1wkzzauf _842p0a0 _842p0a2"" data-automation=""jobLocation"" href=""/jobs-in-marketing-communications/in-Port-Macquarie-NSW-2444?salarytype=annual&amp;salaryrange=140000-145000"" rel=""nofollow"" tabindex=""-1"" target=""_self"" title=""Limit results to Port Macquarie"">Port Macquarie</a>, <a aria-label=""Limit results to Port Macquarie &amp; Mid North Coast NSW"" class=""_1wkzzau0 _1wkzzauf _1wkzzau0 _1wkzzauf _842p0a0 _842p0a2"" data-automation=""jobLocation"" href=""/jobs-in-marketing-communications/in-Port-Macquarie-&amp;-Mid-North-Coast-NSW?salarytype=annual&amp;salaryrange=140000-145000"" rel=""nofollow"" tabindex=""-1"" target=""_self"" title=""Limit results to Port Macquarie &amp; Mid North Coast NSW"">Port Macquarie &amp; Mid North Coast NSW</a></span></div>]",2024-02-06,Marketing-communications - None,08/02/2024
4,https://www.seek.com.au//job/73555481?type=standout&ref=search-standalone,marketing communications,Marketing Communications,Senior Content Strategist,Charles Sturt University,-,140000.0,142500.0,145000.0,Other,Take the lead and manage a high performing team to develop and deliver a range of content projects and key strategies.,"[<div class=""_1wkzzau0 a1msqi6m""><span class=""_1wkzzau0 a1msqi4y lnocuo0 lnocuo1 lnocuo21 _1d0g9qk4 lnocuo7""><a aria-label=""Limit results to Orange"" class=""_1wkzzau0 _1wkzzauf _1wkzzau0 _1wkzzauf _842p0a0 _842p0a2"" data-automation=""jobLocation"" href=""/jobs-in-marketing-communications/in-Orange-NSW-2800?salarytype=annual&amp;salaryrange=140000-145000"" rel=""nofollow"" tabindex=""-1"" target=""_self"" title=""Limit results to Orange"">Orange</a>, <a aria-label=""Limit results to Blue Mountains &amp; Central West NSW"" class=""_1wkzzau0 _1wkzzauf _1wkzzau0 _1wkzzauf _842p0a0 _842p0a2"" data-automation=""jobLocation"" href=""/jobs-in-marketing-communications/in-Blue-Mountains-&amp;-Central-West-NSW?salarytype=annual&amp;salaryrange=140000-145000"" rel=""nofollow"" tabindex=""-1"" target=""_self"" title=""Limit results to Blue Mountains &amp; Central West NSW"">Blue Mountains &amp; Central West NSW</a></span></div>]",2024-02-06,Marketing-communications - None,08/02/2024
5,https://www.seek.com.au//job/73630552?type=standout&ref=search-standalone,marketing communications,Management,Head of Brand and Marketing,EzyDog Pty Ltd,-,140000.0,142500.0,145000.0,Gold Coast QLD,"Reporting directly to the Founder/Directors, you will oversee all elements of Brand and Marketing for the EzyDog brand internationally.","[<div class=""_1wkzzau0 a1msqi6m""><span class=""_1wkzzau0 a1msqi4y lnocuo0 lnocuo1 lnocuo21 _1d0g9qk4 lnocuo7""><a aria-label=""Limit results to Burleigh Heads"" class=""_1wkzzau0 _1wkzzauf _1wkzzau0 _1wkzzauf _842p0a0 _842p0a2"" data-automation=""jobLocation"" href=""/jobs-in-marketing-communications/in-Burleigh-Heads-QLD-4220?salarytype=annual&amp;salaryrange=140000-145000"" rel=""nofollow"" tabindex=""-1"" target=""_self"" title=""Limit results to Burleigh Heads"">Burleigh Heads</a>, <a aria-label=""Limit results to Gold Coast QLD"" class=""_1wkzzau0 _1wkzzauf _1wkzzau0 _1wkzzauf _842p0a0 _842p0a2"" data-automation=""jobLocation"" href=""/jobs-in-marketing-communications/in-All-Gold-Coast-QLD?salarytype=annual&amp;salaryrange=140000-145000"" rel=""nofollow"" tabindex=""-1"" target=""_self"" title=""Limit results to Gold Coast QLD"">Gold Coast QLD</a></span></div>]",,Marketing-communications - None,08/02/2024
6,https://www.seek.com.au//job/73626161?type=standout&ref=search-standalone,marketing communications,Marketing Communications,Communications Officer,Gold Coast Hospital & Health Service,$51.69 - $56.24 per hour + 12.75% super,93041.99999999999,97137.0,101232.0,Gold Coast QLD,The primary focus of this role is to develop and implement digital engagement strategies and communication content,"[<div class=""_1wkzzau0 a1msqi6m""><span class=""_1wkzzau0 a1msqi4y lnocuo0 lnocuo1 lnocuo21 _1d0g9qk4 lnocuo7""><a aria-label=""Limit results to Carrara"" class=""_1wkzzau0 _1wkzzauf _1wkzzau0 _1wkzzauf _842p0a0 _842p0a2"" data-automation=""jobLocation"" href=""/jobs-in-marketing-communications/in-Carrara-QLD-4211?salarytype=annual&amp;salaryrange=140000-145000"" rel=""nofollow"" tabindex=""-1"" target=""_self"" title=""Limit results to Carrara"">Carrara</a>, <a aria-label=""Limit results to Gold Coast QLD"" class=""_1wkzzau0 _1wkzzauf _1wkzzau0 _1wkzzauf _842p0a0 _842p0a2"" data-automation=""jobLocation"" href=""/jobs-in-marketing-communications/in-All-Gold-Coast-QLD?salarytype=annual&amp;salaryrange=140000-145000"" rel=""nofollow"" tabindex=""-1"" target=""_self"" title=""Limit results to Gold Coast QLD"">Gold Coast QLD</a></span></div>, <div class=""_1wkzzau0 a1msqi6m""><div aria-label=""Salary: $51.69 - $56.24 per hour + 12.75% super"" class=""_1wkzzau0""><span class=""_1wkzzau0 a1msqi4y lnocuo0 lnocuo1 lnocuo21 _1d0g9qk4 lnocuo7"" data-automation=""jobSalary""><span class=""_1wkzzau0 _16v7pfz1 a1msqi4y a1msqi0 a1msqir _16v7pfz3"" style=""--_16v7pfz2:2"">$51.69 - $56.24 per hour + 12.75% super</span></span></div></div>]",,Marketing-communications - None,08/02/2024
7,https://www.seek.com.au//job/73623366?type=standard&ref=search-standalone,marketing communications,Marketing Communications,Project Officer - Social Marketing,Health System Support Group,"$106,142 - $125,241 per annum excl. super",106142.0,115691.5,125241.0,Sydney NSW,Temporary Full Time up to 15 Nov 2024 opportunity to work with an innovative Healthcare organisation classified as Health Manager Level 2.,"[<div class=""_1wkzzau0 a1msqi6m""><span class=""_1wkzzau0 a1msqi4y lnocuo0 lnocuo1 lnocuo21 _1d0g9qk4 lnocuo7""><a aria-label=""Limit results to St Leonards"" class=""_1wkzzau0 _1wkzzauf _1wkzzau0 _1wkzzauf _842p0a0 _842p0a2"" data-automation=""jobLocation"" href=""/jobs-in-marketing-communications/in-St-Leonards-NSW-2065?salarytype=annual&amp;salaryrange=140000-145000"" rel=""nofollow"" tabindex=""-1"" target=""_self"" title=""Limit results to St Leonards"">St Leonards</a>, <a aria-label=""Limit results to Sydney NSW"" class=""_1wkzzau0 _1wkzzauf _1wkzzau0 _1wkzzauf _842p0a0 _842p0a2"" data-automation=""jobLocation"" href=""/jobs-in-marketing-communications/in-All-Sydney-NSW?salarytype=annual&amp;salaryrange=140000-145000"" rel=""nofollow"" tabindex=""-1"" target=""_self"" title=""Limit results to Sydney NSW"">Sydney NSW</a></span></div>, <div class=""_1wkzzau0 a1msqi6m""><div aria-label=""Salary: $106,142 - $125,241 per annum excl. super"" class=""_1wkzzau0""><span class=""_1wkzzau0 a1msqi4y lnocuo0 lnocuo1 lnocuo21 _1d0g9qk4 lnocuo7"" data-automation=""jobSalary""><span class=""_1wkzzau0 _16v7pfz1 a1msqi4y a1msqi0 a1msqir _16v7pfz3"" style=""--_16v7pfz2:2"">$106,142 - $125,241 per annum excl. super</span></span></div></div>]",,Marketing-communications - None,08/02/2024
8,https://www.seek.com.au//job/73571169?type=standout&ref=search-standalone,marketing communications,Public Relations & Corporate Affairs,Senior Specialist - Community Relations,Newcrest Mining Limited,-,140000.0,142500.0,145000.0,Other,Key role in delivering effective communications to Key stakeholders and community members.,"[<div class=""_1wkzzau0 a1msqi6m""><span class=""_1wkzzau0 a1msqi4y lnocuo0 lnocuo1 lnocuo21 _1d0g9qk4 lnocuo7""><a aria-label=""Limit results to Cadia"" class=""_1wkzzau0 _1wkzzauf _1wkzzau0 _1wkzzauf _842p0a0 _842p0a2"" data-automation=""jobLocation"" href=""/jobs-in-marketing-communications/in-Cadia-NSW-2800?salarytype=annual&amp;salaryrange=140000-145000"" rel=""nofollow"" tabindex=""-1"" target=""_self"" title=""Limit results to Cadia"">Cadia</a>, <a aria-label=""Limit results to Blue Mountains &amp; Central West NSW"" class=""_1wkzzau0 _1wkzzauf _1wkzzau0 _1wkzzauf _842p0a0 _842p0a2"" data-automation=""jobLocation"" href=""/jobs-in-marketing-communications/in-Blue-Mountains-&amp;-Central-West-NSW?salarytype=annual&amp;salaryrange=140000-145000"" rel=""nofollow"" tabindex=""-1"" target=""_self"" title=""Limit results to Blue Mountains &amp; Central West NSW"">Blue Mountains &amp; Central West NSW</a></span></div>]",2024-02-07,Marketing-communications - None,08/02/2024
9,https://www.seek.com.au//job/73555471?type=standout&ref=search-standalone,marketing communications,Marketing Communications,Senior Content Strategist,Charles Sturt University,-,140000.0,142500.0,145000.0,Other,Take the lead and manage a high performing team to develop and deliver a range of content projects and key strategies.,"[<div class=""_1wkzzau0 a1msqi6m""><span class=""_1wkzzau0 a1msqi4y lnocuo0 lnocuo1 lnocuo21 _1d0g9qk4 lnocuo7""><a aria-label=""Limit results to Wagga Wagga"" class=""_1wkzzau0 _1wkzzauf _1wkzzau0 _1wkzzauf _842p0a0 _842p0a2"" data-automation=""jobLocation"" href=""/jobs-in-marketing-communications/in-Wagga-Wagga-NSW-2650?salarytype=annual&amp;salaryrange=140000-145000"" rel=""nofollow"" tabindex=""-1"" target=""_self"" title=""Limit results to Wagga Wagga"">Wagga Wagga</a>, <a aria-label=""Limit results to Wagga Wagga &amp; Riverina NSW"" class=""_1wkzzau0 _1wkzzauf _1wkzzau0 _1wkzzauf _842p0a0 _842p0a2"" data-automation=""jobLocation"" href=""/jobs-in-marketing-communications/in-Wagga-Wagga-&amp;-Riverina-NSW?salarytype=annual&amp;salaryrange=140000-145000"" rel=""nofollow"" tabindex=""-1"" target=""_self"" title=""Limit results to Wagga Wagga &amp; Riverina NSW"">Wagga Wagga &amp; Riverina NSW</a></span></div>]",2024-02-06,Marketing-communications - None,08/02/2024
10,https://www.seek.com.au//job/73476315?type=standout&ref=search-standalone,marketing communications,Marketing Communications,"Manager Marketing, Communication and Engagement",City of Darwin,"$135,000 per year plus superannuation",135000.0,140000.0,145000.0,Darwin NT,This is such a special and unique role - don't miss out!,"[<div class=""_1wkzzau0 a1msqi6m""><span class=""_1wkzzau0 a1msqi4y lnocuo0 lnocuo1 lnocuo21 _1d0g9qk4 lnocuo7""><a aria-label=""Limit results to Darwin NT"" class=""_1wkzzau0 _1wkzzauf _1wkzzau0 _1wkzzauf _842p0a0 _842p0a2"" data-automation=""jobLocation"" href=""/jobs-in-marketing-communications/in-All-Darwin-NT?salarytype=annual&amp;salaryrange=140000-145000"" rel=""nofollow"" tabindex=""-1"" target=""_self"" title=""Limit results to Darwin NT"">Darwin NT</a></span></div>, <div class=""_1wkzzau0 a1msqi6m""><div aria-label=""Salary: $135,000 per year plus superannuation"" class=""_1wkzzau0""><span class=""_1wkzzau0 a1msqi4y lnocuo0 lnocuo1 lnocuo21 _1d0g9qk4 lnocuo7"" data-automation=""jobSalary""><span class=""_1wkzzau0 _16v7pfz1 a1msqi4y a1msqi0 a1msqir _16v7pfz3"" style=""--_16v7pfz2:2"">$135,000 per year plus superannuation</span></span></div></div>]",2024-02-02,Marketing-communications - None,08/02/2024
11,https://www.seek.com.au//job/73611823?type=standout&ref=search-standalone,marketing communications,Digital & Search Marketing,Digital Marketing Manager @ Woolworths - Work From Home / Hybrid [10161],Hatch People Pty Ltd,"$110,000 – $130,000 per year",110000.0,120000.0,130000.0,Sydney NSW,"An opportunity to join Woolworths Group, a leading FMCG company and work from home or office","[<div class=""_1wkzzau0 a1msqi6m""><span class=""_1wkzzau0 a1msqi4y lnocuo0 lnocuo1 lnocuo21 _1d0g9qk4 lnocuo7""><a aria-label=""Limit results to Sydney NSW"" class=""_1wkzzau0 _1wkzzauf _1wkzzau0 _1wkzzauf _842p0a0 _842p0a2"" data-automation=""jobLocation"" href=""/jobs-in-marketing-communications/in-All-Sydney-NSW?salarytype=annual&amp;salaryrange=140000-145000"" rel=""nofollow"" tabindex=""-1"" target=""_self"" title=""Limit results to Sydney NSW"">Sydney NSW</a></span></div>, <div class=""_1wkzzau0 a1msqi6m""><div aria-label=""Salary: $110,000 – $130,000 per year"" class=""_1wkzzau0""><span class=""_1wkzzau0 a1msqi4y lnocuo0 lnocuo1 lnocuo21 _1d0g9qk4 lnocuo7"" data-automation=""jobSalary""><span class=""_1wkzzau0 _16v7pfz1 a1msqi4y a1msqi0 a1msqir _16v7pfz3"" style=""--_16v7pfz2:2"">$110,000 – $130,000 per year</span></span></div></div>]",,Marketing-communications - None,08/02/2024
12,https://www.seek.com.au//job/73506926?type=standout&ref=search-standalone,marketing communications,Digital & Search Marketing,Head Of Marketing,Cosmetic Boss,"$85,000 – $120,000 per year",85000.0,102500.0,120000.0,Gold Coast QLD,Growth based position. For creative people looking for autonomous roles.,"[<div class=""_1wkzzau0 a1msqi6m""><span class=""_1wkzzau0 a1msqi4y lnocuo0 lnocuo1 lnocuo21 _1d0g9qk4 lnocuo7""><a aria-label=""Limit results to Burleigh Heads"" class=""_1wkzzau0 _1wkzzauf _1wkzzau0 _1wkzzauf _842p0a0 _842p0a2"" data-automation=""jobLocation"" href=""/jobs-in-marketing-communications/in-Burleigh-Heads-QLD-4220?salarytype=annual&amp;salaryrange=140000-145000"" rel=""nofollow"" tabindex=""-1"" target=""_self"" title=""Limit results to Burleigh Heads"">Burleigh Heads</a>, <a aria-label=""Limit results to Gold Coast QLD"" class=""_1wkzzau0 _1wkzzauf _1wkzzau0 _1wkzzauf _842p0a0 _842p0a2"" data-automation=""jobLocation"" href=""/jobs-in-marketing-communications/in-All-Gold-Coast-QLD?salarytype=annual&amp;salaryrange=140000-145000"" rel=""nofollow"" tabindex=""-1"" target=""_self"" title=""Limit results to Gold Coast QLD"">Gold Coast QLD</a></span></div>, <div class=""_1wkzzau0 a1msqi6m""><div aria-label=""Salary: $85,000 – $120,000 per year"" class=""_1wkzzau0""><span class=""_1wkzzau0 a1msqi4y lnocuo0 lnocuo1 lnocuo21 _1d0g9qk4 lnocuo7"" data-automation=""jobSalary""><span class=""_1wkzzau0 _16v7pfz1 a1msqi4y a1msqi0 a1msqir _16v7pfz3"" style=""--_16v7pfz2:2"">$85,000 – $120,000 per year</span></span></div></div>]",2024-02-04,Marketing-communications - None,08/02/2024
13,https://www.seek.com.au//job/73549431?type=standout&ref=search-standalone,marketing communications,Management,Marketing Manager,Coral Expeditions,-,140000.0,142500.0,145000.0,"Cairns, Cairns & Far North QLD",As Marketing Manager you will be responsible for leading & executing our marketing plan across key market sectors with energy & organisation.,"[<div class=""_1wkzzau0 a1msqi6m""><span class=""_1wkzzau0 a1msqi4y lnocuo0 lnocuo1 lnocuo21 _1d0g9qk4 lnocuo7""><a aria-label=""Limit results to Cairns"" class=""_1wkzzau0 _1wkzzauf _1wkzzau0 _1wkzzauf _842p0a0 _842p0a2"" data-automation=""jobLocation"" href=""/jobs-in-marketing-communications/in-Cairns-QLD-4870?salarytype=annual&amp;salaryrange=140000-145000"" rel=""nofollow"" tabindex=""-1"" target=""_self"" title=""Limit results to Cairns"">Cairns</a>, <a aria-label=""Limit results to Cairns &amp; Far North QLD"" class=""_1wkzzau0 _1wkzzauf _1wkzzau0 _1wkzzauf _842p0a0 _842p0a2"" data-automation=""jobLocation"" href=""/jobs-in-marketing-communications/in-Cairns-&amp;-Far-North-QLD?salarytype=annual&amp;salaryrange=140000-145000"" rel=""nofollow"" tabindex=""-1"" target=""_self"" title=""Limit results to Cairns &amp; Far North QLD"">Cairns &amp; Far North QLD</a></span></div>]",2024-02-06,Marketing-communications - None,08/02/2024
14,https://www.seek.com.au//job/73515988?type=standard&ref=search-standalone,marketing communications,Management,Head of Marketing,sharonbennie - Specialist Property Recruitment,$$6-Figures Neg,140000.0,142500.0,145000.0,Sydney NSW,"Given full creative license to make this role your own & exciting variety across Brand, Agent, Social & Property marketing. Vibrant agency in growth","[<div class=""_1wkzzau0 a1msqi6m""><span class=""_1wkzzau0 a1msqi4y lnocuo0 lnocuo1 lnocuo21 _1d0g9qk4 lnocuo7""><a aria-label=""Limit results to Norwest"" class=""_1wkzzau0 _1wkzzauf _1wkzzau0 _1wkzzauf _842p0a0 _842p0a2"" data-automation=""jobLocation"" href=""/jobs-in-marketing-communications/in-Norwest-NSW-2153?salarytype=annual&amp;salaryrange=140000-145000"" rel=""nofollow"" tabindex=""-1"" target=""_self"" title=""Limit results to Norwest"">Norwest</a>, <a aria-label=""Limit results to Sydney NSW"" class=""_1wkzzau0 _1wkzzauf _1wkzzau0 _1wkzzauf _842p0a0 _842p0a2"" data-automation=""jobLocation"" href=""/jobs-in-marketing-communications/in-All-Sydney-NSW?salarytype=annual&amp;salaryrange=140000-145000"" rel=""nofollow"" tabindex=""-1"" target=""_self"" title=""Limit results to Sydney NSW"">Sydney NSW</a></span></div>, <div class=""_1wkzzau0 a1msqi6m""><div aria-label=""Salary: $$6-Figures Neg"" class=""_1wkzzau0""><span class=""_1wkzzau0 a1msqi4y lnocuo0 lnocuo1 lnocuo21 _1d0g9qk4 lnocuo7"" data-automation=""jobSalary""><span class=""_1wkzzau0 _16v7pfz1 a1msqi4y a1msqi0 a1msqir _16v7pfz3"" style=""--_16v7pfz2:2"">$$6-Figures Neg</span></span></div></div>]",2024-02-05,Marketing-communications - None,08/02/2024
15,https://www.seek.com.au//job/73583237?type=standard&ref=search-standalone,marketing communications,Product Management & Development,Head of Merchandise & Marketing,Independent Liquor Retailers,-,140000.0,142500.0,145000.0,Canberra ACT,We are seeking a Head of Merchandise and Marketing to join our growing team.,"[<div class=""_1wkzzau0 a1msqi6m""><span class=""_1wkzzau0 a1msqi4y lnocuo0 lnocuo1 lnocuo21 _1d0g9qk4 lnocuo7""><a aria-label=""Limit results to Canberra ACT"" class=""_1wkzzau0 _1wkzzauf _1wkzzau0 _1wkzzauf _842p0a0 _842p0a2"" data-automation=""jobLocation"" href=""/jobs-in-marketing-communications/in-All-Canberra-ACT?salarytype=annual&amp;salaryrange=140000-145000"" rel=""nofollow"" tabindex=""-1"" target=""_self"" title=""Limit results to Canberra ACT"">Canberra ACT</a></span></div>]",2024-02-07,Marketing-communications - None,08/02/2024
16,https://www.seek.com.au//job/73611112?type=standout&ref=search-standalone,marketing communications,Brand Management,E-Commerce Brand Specialist,Waverley Mills,-,140000.0,142500.0,145000.0,"Launceston, Launceston & North East TAS",VIC or TAS (Flexible working arrangements). We're seeking an E-Commerce expert to join our team and help rejuvenate an iconic Australian brand.,"[<div class=""_1wkzzau0 a1msqi6m""><span class=""_1wkzzau0 a1msqi4y lnocuo0 lnocuo1 lnocuo21 _1d0g9qk4 lnocuo7""><a aria-label=""Limit results to Launceston"" class=""_1wkzzau0 _1wkzzauf _1wkzzau0 _1wkzzauf _842p0a0 _842p0a2"" data-automation=""jobLocation"" href=""/jobs-in-marketing-communications/in-Launceston-TAS-7250?salarytype=annual&amp;salaryrange=140000-145000"" rel=""nofollow"" tabindex=""-1"" target=""_self"" title=""Limit results to Launceston"">Launceston</a>, <a aria-label=""Limit results to Launceston &amp; North East TAS"" class=""_1wkzzau0 _1wkzzauf _1wkzzau0 _1wkzzauf _842p0a0 _842p0a2"" data-automation=""jobLocation"" href=""/jobs-in-marketing-communications/in-Launceston-&amp;-North-East-TAS?salarytype=annual&amp;salaryrange=140000-145000"" rel=""nofollow"" tabindex=""-1"" target=""_self"" title=""Limit results to Launceston &amp; North East TAS"">Launceston &amp; North East TAS</a></span></div>]",,Marketing-communications - None,08/02/2024
17,https://www.seek.com.au//job/73511654?type=standout&ref=search-standalone,marketing communications,Management,Manager Brand and Communications,Anglicare WA,"From $117,787 + super + salary packaging",140000.0,142500.0,145000.0,Perth WA,Lead Anglicare WA's brand and communication strategies to amplify our impact on the WA community.,"[<div class=""_1wkzzau0 a1msqi6m""><span class=""_1wkzzau0 a1msqi4y lnocuo0 lnocuo1 lnocuo21 _1d0g9qk4 lnocuo7""><a aria-label=""Limit results to East Perth"" class=""_1wkzzau0 _1wkzzauf _1wkzzau0 _1wkzzauf _842p0a0 _842p0a2"" data-automation=""jobLocation"" href=""/jobs-in-marketing-communications/in-East-Perth-WA-6004?salarytype=annual&amp;salaryrange=140000-145000"" rel=""nofollow"" tabindex=""-1"" target=""_self"" title=""Limit results to East Perth"">East Perth</a>, <a aria-label=""Limit results to Perth WA"" class=""_1wkzzau0 _1wkzzauf _1wkzzau0 _1wkzzauf _842p0a0 _842p0a2"" data-automation=""jobLocation"" href=""/jobs-in-marketing-communications/in-All-Perth-WA?salarytype=annual&amp;salaryrange=140000-145000"" rel=""nofollow"" tabindex=""-1"" target=""_self"" title=""Limit results to Perth WA"">Perth WA</a></span></div>, <div class=""_1wkzzau0 a1msqi6m""><div aria-label=""Salary: From $117,787 + super + salary packaging"" class=""_1wkzzau0""><span class=""_1wkzzau0 a1msqi4y lnocuo0 lnocuo1 lnocuo21 _1d0g9qk4 lnocuo7"" data-automation=""jobSalary""><span class=""_1wkzzau0 _16v7pfz1 a1msqi4y a1msqi0 a1msqir _16v7pfz3"" style=""--_16v7pfz2:2"">From $117,787 + super + salary packaging</span></span></div></div>]",2024-02-05,Marketing-communications - None,08/02/2024
