,link,classification,category,title,company,salary,min_salary,average_salary,max_salary,location,description,entireDiv,date_posted,Category,Date
418,https://www.seek.com.au//job/73553352?type=promoted&ref=search-standalone,engineering,Systems Engineering,Systems Engineering Manager,Talent Managed Solutions,-,170000.0,172500.0,175000.0,Sydney NSW,We’re looking for a Systems / Automation Engineering Manager with a focus on Hardware Systems Engineering in Manufacturing to join our client!,"[<div class=""_1wkzzau0 a1msqi6m""><span class=""_1wkzzau0 a1msqi4y lnocuo0 lnocuo1 lnocuo21 _1d0g9qk4 lnocuo7""><a aria-label=""Limit results to Sydney NSW"" class=""_1wkzzau0 _1wkzzauf _1wkzzau0 _1wkzzauf _842p0a0 _842p0a2"" data-automation=""jobLocation"" href=""/jobs-in-engineering/in-All-Sydney-NSW?salarytype=annual&amp;salaryrange=170000-175000"" rel=""nofollow"" tabindex=""-1"" target=""_self"" title=""Limit results to Sydney NSW"">Sydney NSW</a></span></div>]",,Engineering - None,08/02/2024
419,https://www.seek.com.au//job/72886427?type=promoted&ref=search-standalone,engineering,Civil/Structural Engineering,Signatures Engineer,ASC,Find a deeper purpose at ASC | Rewarding career,170000.0,172500.0,175000.0,Adelaide SA,Contribute to Australia's Maritime Defence by utilising your noise and vibration expertise to enhance the stealth of the Collins Class Submarines.,"[<div class=""_1wkzzau0 a1msqi6m""><span class=""_1wkzzau0 a1msqi4y lnocuo0 lnocuo1 lnocuo21 _1d0g9qk4 lnocuo7""><a aria-label=""Limit results to Osborne"" class=""_1wkzzau0 _1wkzzauf _1wkzzau0 _1wkzzauf _842p0a0 _842p0a2"" data-automation=""jobLocation"" href=""/jobs-in-engineering/in-Osborne-SA-5017?salarytype=annual&amp;salaryrange=170000-175000"" rel=""nofollow"" tabindex=""-1"" target=""_self"" title=""Limit results to Osborne"">Osborne</a>, <a aria-label=""Limit results to Adelaide SA"" class=""_1wkzzau0 _1wkzzauf _1wkzzau0 _1wkzzauf _842p0a0 _842p0a2"" data-automation=""jobLocation"" href=""/jobs-in-engineering/in-All-Adelaide-SA?salarytype=annual&amp;salaryrange=170000-175000"" rel=""nofollow"" tabindex=""-1"" target=""_self"" title=""Limit results to Adelaide SA"">Adelaide SA</a></span></div>, <div class=""_1wkzzau0 a1msqi6m""><div aria-label=""Salary: Find a deeper purpose at ASC | Rewarding career"" class=""_1wkzzau0""><span class=""_1wkzzau0 a1msqi4y lnocuo0 lnocuo1 lnocuo21 _1d0g9qk4 lnocuo7"" data-automation=""jobSalary""><span class=""_1wkzzau0 _16v7pfz1 a1msqi4y a1msqi0 a1msqir _16v7pfz3"" style=""--_16v7pfz2:2"">Find a deeper purpose at ASC | Rewarding career</span></span></div></div>]",,Engineering - None,08/02/2024
420,https://www.seek.com.au//job/73509715?type=standout&ref=search-standalone,engineering,Project Engineering,Senior Project Engineer,SAGE Automation,-,170000.0,172500.0,175000.0,Adelaide SA,A fantastic opportunity for a Senior Project Engineer with an engineering degree and previous experience in a similar role to join our team in SA.,"[<div class=""_1wkzzau0 a1msqi6m""><span class=""_1wkzzau0 a1msqi4y lnocuo0 lnocuo1 lnocuo21 _1d0g9qk4 lnocuo7""><a aria-label=""Limit results to Oaklands Park"" class=""_1wkzzau0 _1wkzzauf _1wkzzau0 _1wkzzauf _842p0a0 _842p0a2"" data-automation=""jobLocation"" href=""/jobs-in-engineering/in-Oaklands-Park-SA-5046?salarytype=annual&amp;salaryrange=170000-175000"" rel=""nofollow"" tabindex=""-1"" target=""_self"" title=""Limit results to Oaklands Park"">Oaklands Park</a>, <a aria-label=""Limit results to Adelaide SA"" class=""_1wkzzau0 _1wkzzauf _1wkzzau0 _1wkzzauf _842p0a0 _842p0a2"" data-automation=""jobLocation"" href=""/jobs-in-engineering/in-All-Adelaide-SA?salarytype=annual&amp;salaryrange=170000-175000"" rel=""nofollow"" tabindex=""-1"" target=""_self"" title=""Limit results to Adelaide SA"">Adelaide SA</a></span></div>]",2024-02-04,Engineering - None,08/02/2024
421,https://www.seek.com.au//job/73210094?type=standard&ref=search-standalone,engineering,Project Engineering,Project Engineer,Carnegie Clean Energy,-,170000.0,172500.0,175000.0,Perth WA,Join Carnegie as our new Project Engineer and be part of the renewable energy revolution with projects in Europe and Australia.,"[<div class=""_1wkzzau0 a1msqi6m""><span class=""_1wkzzau0 a1msqi4y lnocuo0 lnocuo1 lnocuo21 _1d0g9qk4 lnocuo7""><a aria-label=""Limit results to North Fremantle"" class=""_1wkzzau0 _1wkzzauf _1wkzzau0 _1wkzzauf _842p0a0 _842p0a2"" data-automation=""jobLocation"" href=""/jobs-in-engineering/in-North-Fremantle-WA-6159?salarytype=annual&amp;salaryrange=170000-175000"" rel=""nofollow"" tabindex=""-1"" target=""_self"" title=""Limit results to North Fremantle"">North Fremantle</a>, <a aria-label=""Limit results to Perth WA"" class=""_1wkzzau0 _1wkzzauf _1wkzzau0 _1wkzzauf _842p0a0 _842p0a2"" data-automation=""jobLocation"" href=""/jobs-in-engineering/in-All-Perth-WA?salarytype=annual&amp;salaryrange=170000-175000"" rel=""nofollow"" tabindex=""-1"" target=""_self"" title=""Limit results to Perth WA"">Perth WA</a></span></div>]",2024-01-22,Engineering - None,08/02/2024
422,https://www.seek.com.au//job/73209469?type=standout&ref=search-standalone,engineering,Management,Engineering Manager,Icon Engineering,-,170000.0,172500.0,175000.0,Perth WA,"Lead your team of talented Engineers & Drafters through an interesting mix of topside & subsea, greenfield & brownfield projects.","[<div class=""_1wkzzau0 a1msqi6m""><span class=""_1wkzzau0 a1msqi4y lnocuo0 lnocuo1 lnocuo21 _1d0g9qk4 lnocuo7""><a aria-label=""Limit results to Perth WA"" class=""_1wkzzau0 _1wkzzauf _1wkzzau0 _1wkzzauf _842p0a0 _842p0a2"" data-automation=""jobLocation"" href=""/jobs-in-engineering/in-All-Perth-WA?salarytype=annual&amp;salaryrange=170000-175000"" rel=""nofollow"" tabindex=""-1"" target=""_self"" title=""Limit results to Perth WA"">Perth WA</a></span></div>]",2024-01-22,Engineering - None,08/02/2024
423,https://www.seek.com.au//job/73547996?type=standout&ref=search-standalone,engineering,Project Engineering,Senior Project Engineer- OHW,Laing O'Rourke Australia Construction Pty Limited,Negotiable $$$ based on experience | Base + Super,170000.0,172500.0,175000.0,Perth WA,"Based in Malaga, WA. Develop and deliver management plans.","[<div class=""_1wkzzau0 a1msqi6m""><span class=""_1wkzzau0 a1msqi4y lnocuo0 lnocuo1 lnocuo21 _1d0g9qk4 lnocuo7""><a aria-label=""Limit results to Malaga"" class=""_1wkzzau0 _1wkzzauf _1wkzzau0 _1wkzzauf _842p0a0 _842p0a2"" data-automation=""jobLocation"" href=""/jobs-in-engineering/in-Malaga-WA-6090?salarytype=annual&amp;salaryrange=170000-175000"" rel=""nofollow"" tabindex=""-1"" target=""_self"" title=""Limit results to Malaga"">Malaga</a>, <a aria-label=""Limit results to Perth WA"" class=""_1wkzzau0 _1wkzzauf _1wkzzau0 _1wkzzauf _842p0a0 _842p0a2"" data-automation=""jobLocation"" href=""/jobs-in-engineering/in-All-Perth-WA?salarytype=annual&amp;salaryrange=170000-175000"" rel=""nofollow"" tabindex=""-1"" target=""_self"" title=""Limit results to Perth WA"">Perth WA</a></span></div>, <div class=""_1wkzzau0 a1msqi6m""><div aria-label=""Salary: Negotiable $$$ based on experience | Base + Super"" class=""_1wkzzau0""><span class=""_1wkzzau0 a1msqi4y lnocuo0 lnocuo1 lnocuo21 _1d0g9qk4 lnocuo7"" data-automation=""jobSalary""><span class=""_1wkzzau0 _16v7pfz1 a1msqi4y a1msqi0 a1msqir _16v7pfz3"" style=""--_16v7pfz2:2"">Negotiable $$$ based on experience | Base + Super</span></span></div></div>]",2024-02-06,Engineering - None,08/02/2024
424,https://www.seek.com.au//job/73167938?type=standout&ref=search-standalone,engineering,Mechanical Engineering,Senior Mechanical Design Engineer,Gravity Resources,"$160,000 – $190,000 per year",160000.0,175000.0,190000.0,Brisbane QLD,"Are you ready to step into a new Senior Leadership Engineering role and start the new year with an amazing new career? 
APPLY NOW!!","[<div class=""_1wkzzau0 a1msqi6m""><span class=""_1wkzzau0 a1msqi4y lnocuo0 lnocuo1 lnocuo21 _1d0g9qk4 lnocuo7""><a aria-label=""Limit results to Brisbane QLD"" class=""_1wkzzau0 _1wkzzauf _1wkzzau0 _1wkzzauf _842p0a0 _842p0a2"" data-automation=""jobLocation"" href=""/jobs-in-engineering/in-All-Brisbane-QLD?salarytype=annual&amp;salaryrange=170000-175000"" rel=""nofollow"" tabindex=""-1"" target=""_self"" title=""Limit results to Brisbane QLD"">Brisbane QLD</a></span></div>, <div class=""_1wkzzau0 a1msqi6m""><div aria-label=""Salary: $160,000 – $190,000 per year"" class=""_1wkzzau0""><span class=""_1wkzzau0 a1msqi4y lnocuo0 lnocuo1 lnocuo21 _1d0g9qk4 lnocuo7"" data-automation=""jobSalary""><span class=""_1wkzzau0 _16v7pfz1 a1msqi4y a1msqi0 a1msqir _16v7pfz3"" style=""--_16v7pfz2:2"">$160,000 – $190,000 per year</span></span></div></div>]",2024-01-19,Engineering - None,08/02/2024
425,https://www.seek.com.au//job/73475678?type=standout&ref=search-standalone,engineering,Electrical/Electronic Engineering,Experienced Automation Engineer- Delivery,ElectraNet,-,170000.0,172500.0,175000.0,Adelaide SA,ElectraNet is looking for Automation Engineers for the development and delivery of Automation System design work!,"[<div class=""_1wkzzau0 a1msqi6m""><span class=""_1wkzzau0 a1msqi4y lnocuo0 lnocuo1 lnocuo21 _1d0g9qk4 lnocuo7""><a aria-label=""Limit results to Adelaide SA"" class=""_1wkzzau0 _1wkzzauf _1wkzzau0 _1wkzzauf _842p0a0 _842p0a2"" data-automation=""jobLocation"" href=""/jobs-in-engineering/in-All-Adelaide-SA?salarytype=annual&amp;salaryrange=170000-175000"" rel=""nofollow"" tabindex=""-1"" target=""_self"" title=""Limit results to Adelaide SA"">Adelaide SA</a></span></div>]",2024-02-02,Engineering - None,08/02/2024
426,https://www.seek.com.au//job/73389209?type=standout&ref=search-standalone,engineering,Project Management,Project Development Manager - Solar,Hanwha Energy Australia Pty Ltd,"$150,000 – $170,000 per year",150000.0,160000.0,170000.0,Sydney NSW,We are seeking a highly motivated Project Development Manager to join our team in Sydney.,"[<div class=""_1wkzzau0 a1msqi6m""><span class=""_1wkzzau0 a1msqi4y lnocuo0 lnocuo1 lnocuo21 _1d0g9qk4 lnocuo7""><a aria-label=""Limit results to Sydney NSW"" class=""_1wkzzau0 _1wkzzauf _1wkzzau0 _1wkzzauf _842p0a0 _842p0a2"" data-automation=""jobLocation"" href=""/jobs-in-engineering/in-All-Sydney-NSW?salarytype=annual&amp;salaryrange=170000-175000"" rel=""nofollow"" tabindex=""-1"" target=""_self"" title=""Limit results to Sydney NSW"">Sydney NSW</a></span></div>, <div class=""_1wkzzau0 a1msqi6m""><div aria-label=""Salary: $150,000 – $170,000 per year"" class=""_1wkzzau0""><span class=""_1wkzzau0 a1msqi4y lnocuo0 lnocuo1 lnocuo21 _1d0g9qk4 lnocuo7"" data-automation=""jobSalary""><span class=""_1wkzzau0 _16v7pfz1 a1msqi4y a1msqi0 a1msqir _16v7pfz3"" style=""--_16v7pfz2:2"">$150,000 – $170,000 per year</span></span></div></div>]",2024-01-30,Engineering - None,08/02/2024
427,https://www.seek.com.au//job/73044607?type=standout&ref=search-standalone,engineering,Civil/Structural Engineering,Project Engineer / Junior Project Manager - Client-Side,CPM Advisory and Project Management,-,170000.0,172500.0,175000.0,"Maroochydore, Sunshine Coast QLD",Kickstart the new year with a bold move! Take charge of Client-Side project management on a variety of civil water infrastructure projects. Mon - Fri.,"[<div class=""_1wkzzau0 a1msqi6m""><span class=""_1wkzzau0 a1msqi4y lnocuo0 lnocuo1 lnocuo21 _1d0g9qk4 lnocuo7""><a aria-label=""Limit results to Maroochydore"" class=""_1wkzzau0 _1wkzzauf _1wkzzau0 _1wkzzauf _842p0a0 _842p0a2"" data-automation=""jobLocation"" href=""/jobs-in-engineering/in-Maroochydore-QLD-4558?salarytype=annual&amp;salaryrange=170000-175000"" rel=""nofollow"" tabindex=""-1"" target=""_self"" title=""Limit results to Maroochydore"">Maroochydore</a>, <a aria-label=""Limit results to Sunshine Coast QLD"" class=""_1wkzzau0 _1wkzzauf _1wkzzau0 _1wkzzauf _842p0a0 _842p0a2"" data-automation=""jobLocation"" href=""/jobs-in-engineering/in-Sunshine-Coast-QLD?salarytype=annual&amp;salaryrange=170000-175000"" rel=""nofollow"" tabindex=""-1"" target=""_self"" title=""Limit results to Sunshine Coast QLD"">Sunshine Coast QLD</a></span></div>]",2024-01-16,Engineering - None,08/02/2024
428,https://www.seek.com.au//job/73616730?type=standout&ref=search-standalone,engineering,Engineering Drafting,Lead Piping Designer,Sedgman Limited,-,170000.0,172500.0,175000.0,Perth WA,We are currently seeking a Lead Piping/SMP Designer to join Sedgman in our Perth office.,"[<div class=""_1wkzzau0 a1msqi6m""><span class=""_1wkzzau0 a1msqi4y lnocuo0 lnocuo1 lnocuo21 _1d0g9qk4 lnocuo7""><a aria-label=""Limit results to Perth WA"" class=""_1wkzzau0 _1wkzzauf _1wkzzau0 _1wkzzauf _842p0a0 _842p0a2"" data-automation=""jobLocation"" href=""/jobs-in-engineering/in-All-Perth-WA?salarytype=annual&amp;salaryrange=170000-175000"" rel=""nofollow"" tabindex=""-1"" target=""_self"" title=""Limit results to Perth WA"">Perth WA</a></span></div>]",,Engineering - None,08/02/2024
429,https://www.seek.com.au//job/73621136?type=standout&ref=search-standalone,engineering,Electrical/Electronic Engineering,Lead Power Systems Engineer,Aurecon,-,170000.0,172500.0,175000.0,Melbourne VIC,The Lead Power Systems Engineer will play an integral part in a team of highly skilled specialists that 'bring ideas to life' for our clients.,"[<div class=""_1wkzzau0 a1msqi6m""><span class=""_1wkzzau0 a1msqi4y lnocuo0 lnocuo1 lnocuo21 _1d0g9qk4 lnocuo7""><a aria-label=""Limit results to Docklands"" class=""_1wkzzau0 _1wkzzauf _1wkzzau0 _1wkzzauf _842p0a0 _842p0a2"" data-automation=""jobLocation"" href=""/jobs-in-engineering/in-Docklands-VIC-3008?salarytype=annual&amp;salaryrange=170000-175000"" rel=""nofollow"" tabindex=""-1"" target=""_self"" title=""Limit results to Docklands"">Docklands</a>, <a aria-label=""Limit results to Melbourne VIC"" class=""_1wkzzau0 _1wkzzauf _1wkzzau0 _1wkzzauf _842p0a0 _842p0a2"" data-automation=""jobLocation"" href=""/jobs-in-engineering/in-All-Melbourne-VIC?salarytype=annual&amp;salaryrange=170000-175000"" rel=""nofollow"" tabindex=""-1"" target=""_self"" title=""Limit results to Melbourne VIC"">Melbourne VIC</a></span></div>]",,Engineering - None,08/02/2024
430,https://www.seek.com.au//job/73406327?type=standout&ref=search-standalone,engineering,Management,Deputy Head of Satellites,Gilmour Space Technologies Pty Ltd,Base Salary + Super,170000.0,172500.0,175000.0,Gold Coast QLD,"All Orbits, All Planets - Join us on our journey Gilmour Space is the leading Australian rocket company, pioneering next-generation hybrid propulsi...","[<div class=""_1wkzzau0 a1msqi6m""><span class=""_1wkzzau0 a1msqi4y lnocuo0 lnocuo1 lnocuo21 _1d0g9qk4 lnocuo7""><a aria-label=""Limit results to Helensvale"" class=""_1wkzzau0 _1wkzzauf _1wkzzau0 _1wkzzauf _842p0a0 _842p0a2"" data-automation=""jobLocation"" href=""/jobs-in-engineering/in-Helensvale-QLD-4212?salarytype=annual&amp;salaryrange=170000-175000"" rel=""nofollow"" tabindex=""-1"" target=""_self"" title=""Limit results to Helensvale"">Helensvale</a>, <a aria-label=""Limit results to Gold Coast QLD"" class=""_1wkzzau0 _1wkzzauf _1wkzzau0 _1wkzzauf _842p0a0 _842p0a2"" data-automation=""jobLocation"" href=""/jobs-in-engineering/in-All-Gold-Coast-QLD?salarytype=annual&amp;salaryrange=170000-175000"" rel=""nofollow"" tabindex=""-1"" target=""_self"" title=""Limit results to Gold Coast QLD"">Gold Coast QLD</a></span></div>, <div class=""_1wkzzau0 a1msqi6m""><div aria-label=""Salary: Base Salary + Super"" class=""_1wkzzau0""><span class=""_1wkzzau0 a1msqi4y lnocuo0 lnocuo1 lnocuo21 _1d0g9qk4 lnocuo7"" data-automation=""jobSalary""><span class=""_1wkzzau0 _16v7pfz1 a1msqi4y a1msqi0 a1msqir _16v7pfz3"" style=""--_16v7pfz2:2"">Base Salary + Super</span></span></div></div>]",2024-01-31,Engineering - None,08/02/2024
431,https://www.seek.com.au//job/73485721?type=standout&ref=search-standalone,engineering,Civil/Structural Engineering,Engineer - Project,Ertech Pty Ltd,-,170000.0,172500.0,175000.0,Perth WA,Great opportunity for a Project Engineer with Earthworks and Civil experience to join our Team on Barrow Island working a 2/2 FIFO roster.,"[<div class=""_1wkzzau0 a1msqi6m""><span class=""_1wkzzau0 a1msqi4y lnocuo0 lnocuo1 lnocuo21 _1d0g9qk4 lnocuo7""><a aria-label=""Limit results to Perth WA"" class=""_1wkzzau0 _1wkzzauf _1wkzzau0 _1wkzzauf _842p0a0 _842p0a2"" data-automation=""jobLocation"" href=""/jobs-in-engineering/in-All-Perth-WA?salarytype=annual&amp;salaryrange=170000-175000"" rel=""nofollow"" tabindex=""-1"" target=""_self"" title=""Limit results to Perth WA"">Perth WA</a></span></div>]",2024-02-02,Engineering - None,08/02/2024
432,https://www.seek.com.au//job/73409563?type=standout&ref=search-standalone,engineering,Mechanical Engineering,Senior Mechanical Engineer,Primero Group,-,170000.0,172500.0,175000.0,Perth WA,Primero is growing and we want you! Join us to deliver a variety of International and Australian projects and studies in the energy & minerals sectors,"[<div class=""_1wkzzau0 a1msqi6m""><span class=""_1wkzzau0 a1msqi4y lnocuo0 lnocuo1 lnocuo21 _1d0g9qk4 lnocuo7""><a aria-label=""Limit results to Perth WA"" class=""_1wkzzau0 _1wkzzauf _1wkzzau0 _1wkzzauf _842p0a0 _842p0a2"" data-automation=""jobLocation"" href=""/jobs-in-engineering/in-All-Perth-WA?salarytype=annual&amp;salaryrange=170000-175000"" rel=""nofollow"" tabindex=""-1"" target=""_self"" title=""Limit results to Perth WA"">Perth WA</a></span></div>]",2024-01-31,Engineering - None,08/02/2024
433,https://www.seek.com.au//job/73407841?type=standout&ref=search-standalone,engineering,Project Engineering,Customer Connections Development Engineers and Senior Engineers – Major Projects,Energy Queensland Group,$140k - $204k per annum + 12.75% superannuation,140000.0,172000.0,204000.0,"Townsville, Northern QLD",Ready for a career that makes a difference? It’s an exciting time to join team EQL where you can have a real impact.,"[<div class=""_1wkzzau0 a1msqi6m""><span class=""_1wkzzau0 a1msqi4y lnocuo0 lnocuo1 lnocuo21 _1d0g9qk4 lnocuo7""><a aria-label=""Limit results to Townsville"" class=""_1wkzzau0 _1wkzzauf _1wkzzau0 _1wkzzauf _842p0a0 _842p0a2"" data-automation=""jobLocation"" href=""/jobs-in-engineering/in-Townsville-QLD-4810?salarytype=annual&amp;salaryrange=170000-175000"" rel=""nofollow"" tabindex=""-1"" target=""_self"" title=""Limit results to Townsville"">Townsville</a>, <a aria-label=""Limit results to Northern QLD"" class=""_1wkzzau0 _1wkzzauf _1wkzzau0 _1wkzzauf _842p0a0 _842p0a2"" data-automation=""jobLocation"" href=""/jobs-in-engineering/in-Northern-QLD?salarytype=annual&amp;salaryrange=170000-175000"" rel=""nofollow"" tabindex=""-1"" target=""_self"" title=""Limit results to Northern QLD"">Northern QLD</a></span></div>, <div class=""_1wkzzau0 a1msqi6m""><div aria-label=""Salary: $140k - $204k per annum + 12.75% superannuation"" class=""_1wkzzau0""><span class=""_1wkzzau0 a1msqi4y lnocuo0 lnocuo1 lnocuo21 _1d0g9qk4 lnocuo7"" data-automation=""jobSalary""><span class=""_1wkzzau0 _16v7pfz1 a1msqi4y a1msqi0 a1msqir _16v7pfz3"" style=""--_16v7pfz2:2"">$140k - $204k per annum + 12.75% superannuation</span></span></div></div>]",2024-01-31,Engineering - None,08/02/2024
434,https://www.seek.com.au//job/73237377?type=standout&ref=search-standalone,engineering,Mechanical Engineering,Mechanical Design Engineer,Verve Partners,-,170000.0,172500.0,175000.0,Melbourne VIC,Join a world-renowned global OEM at the forefront of innovation and multidisciplinary product development.,"[<div class=""_1wkzzau0 a1msqi6m""><span class=""_1wkzzau0 a1msqi4y lnocuo0 lnocuo1 lnocuo21 _1d0g9qk4 lnocuo7""><a aria-label=""Limit results to Melbourne VIC"" class=""_1wkzzau0 _1wkzzauf _1wkzzau0 _1wkzzauf _842p0a0 _842p0a2"" data-automation=""jobLocation"" href=""/jobs-in-engineering/in-All-Melbourne-VIC?salarytype=annual&amp;salaryrange=170000-175000"" rel=""nofollow"" tabindex=""-1"" target=""_self"" title=""Limit results to Melbourne VIC"">Melbourne VIC</a></span></div>]",2024-01-23,Engineering - None,08/02/2024
435,https://www.seek.com.au//job/73294607?type=standout&ref=search-standalone,engineering,Civil/Structural Engineering,Assistant Manager Works,Local Government NSW,-,170000.0,172500.0,175000.0,Other,"If you have an Engineering background in transport infrastructure, we would love to hear from you!","[<div class=""_1wkzzau0 a1msqi6m""><span class=""_1wkzzau0 a1msqi4y lnocuo0 lnocuo1 lnocuo21 _1d0g9qk4 lnocuo7""><a aria-label=""Limit results to Gunnedah"" class=""_1wkzzau0 _1wkzzauf _1wkzzau0 _1wkzzauf _842p0a0 _842p0a2"" data-automation=""jobLocation"" href=""/jobs-in-engineering/in-Gunnedah-NSW-2380?salarytype=annual&amp;salaryrange=170000-175000"" rel=""nofollow"" tabindex=""-1"" target=""_self"" title=""Limit results to Gunnedah"">Gunnedah</a>, <a aria-label=""Limit results to Tamworth &amp; North West NSW"" class=""_1wkzzau0 _1wkzzauf _1wkzzau0 _1wkzzauf _842p0a0 _842p0a2"" data-automation=""jobLocation"" href=""/jobs-in-engineering/in-Tamworth-&amp;-North-West-NSW?salarytype=annual&amp;salaryrange=170000-175000"" rel=""nofollow"" tabindex=""-1"" target=""_self"" title=""Limit results to Tamworth &amp; North West NSW"">Tamworth &amp; North West NSW</a></span></div>]",2024-01-25,Engineering - None,08/02/2024
436,https://www.seek.com.au//job/73386026?type=standout&ref=search-standalone,engineering,Electrical/Electronic Engineering,Energy Engineer,Aurecon,Attractive salary and flexible working!,170000.0,172500.0,175000.0,Perth WA,"Flex working options including: working from home, flexible hours to fit in your life, part-time, purchased leave and many more to suit your lifestyle","[<div class=""_1wkzzau0 a1msqi6m""><span class=""_1wkzzau0 a1msqi4y lnocuo0 lnocuo1 lnocuo21 _1d0g9qk4 lnocuo7""><a aria-label=""Limit results to Perth WA"" class=""_1wkzzau0 _1wkzzauf _1wkzzau0 _1wkzzauf _842p0a0 _842p0a2"" data-automation=""jobLocation"" href=""/jobs-in-engineering/in-All-Perth-WA?salarytype=annual&amp;salaryrange=170000-175000"" rel=""nofollow"" tabindex=""-1"" target=""_self"" title=""Limit results to Perth WA"">Perth WA</a></span></div>, <div class=""_1wkzzau0 a1msqi6m""><div aria-label=""Salary: Attractive salary and flexible working!"" class=""_1wkzzau0""><span class=""_1wkzzau0 a1msqi4y lnocuo0 lnocuo1 lnocuo21 _1d0g9qk4 lnocuo7"" data-automation=""jobSalary""><span class=""_1wkzzau0 _16v7pfz1 a1msqi4y a1msqi0 a1msqir _16v7pfz3"" style=""--_16v7pfz2:2"">Attractive salary and flexible working!</span></span></div></div>]",2024-01-30,Engineering - None,08/02/2024
437,https://www.seek.com.au//job/73611598?type=standard&ref=search-standalone,engineering,Engineering Drafting,Civil Designers\Drafters,Contract Personnel,-,170000.0,172500.0,175000.0,Brisbane QLD,We are searching for talented civil drafters and designers for a wide range of project backgrounds,"[<div class=""_1wkzzau0 a1msqi6m""><span class=""_1wkzzau0 a1msqi4y lnocuo0 lnocuo1 lnocuo21 _1d0g9qk4 lnocuo7""><a aria-label=""Limit results to Brisbane QLD"" class=""_1wkzzau0 _1wkzzauf _1wkzzau0 _1wkzzauf _842p0a0 _842p0a2"" data-automation=""jobLocation"" href=""/jobs-in-engineering/in-All-Brisbane-QLD?salarytype=annual&amp;salaryrange=170000-175000"" rel=""nofollow"" tabindex=""-1"" target=""_self"" title=""Limit results to Brisbane QLD"">Brisbane QLD</a></span></div>]",,Engineering - None,08/02/2024
438,https://www.seek.com.au//job/73228283?type=standard&ref=search-standalone,engineering,Project Engineering,Research & Development Mechanical Engineer Management,Engineering People,$100k - $160k p.a.,100000.0,130000.0,160000.0,Melbourne VIC,"Hi All, I'm currently recruiting for this position. Please click on the job title below to view the Job Description and apply to it!","[<div class=""_1wkzzau0 a1msqi6m""><span class=""_1wkzzau0 a1msqi4y lnocuo0 lnocuo1 lnocuo21 _1d0g9qk4 lnocuo7""><a aria-label=""Limit results to Bayswater"" class=""_1wkzzau0 _1wkzzauf _1wkzzau0 _1wkzzauf _842p0a0 _842p0a2"" data-automation=""jobLocation"" href=""/jobs-in-engineering/in-Bayswater-VIC-3153?salarytype=annual&amp;salaryrange=170000-175000"" rel=""nofollow"" tabindex=""-1"" target=""_self"" title=""Limit results to Bayswater"">Bayswater</a>, <a aria-label=""Limit results to Melbourne VIC"" class=""_1wkzzau0 _1wkzzauf _1wkzzau0 _1wkzzauf _842p0a0 _842p0a2"" data-automation=""jobLocation"" href=""/jobs-in-engineering/in-All-Melbourne-VIC?salarytype=annual&amp;salaryrange=170000-175000"" rel=""nofollow"" tabindex=""-1"" target=""_self"" title=""Limit results to Melbourne VIC"">Melbourne VIC</a></span></div>, <div class=""_1wkzzau0 a1msqi6m""><div aria-label=""Salary: $100k - $160k p.a."" class=""_1wkzzau0""><span class=""_1wkzzau0 a1msqi4y lnocuo0 lnocuo1 lnocuo21 _1d0g9qk4 lnocuo7"" data-automation=""jobSalary""><span class=""_1wkzzau0 _16v7pfz1 a1msqi4y a1msqi0 a1msqir _16v7pfz3"" style=""--_16v7pfz2:2"">$100k - $160k p.a.</span></span></div></div>]",2024-01-23,Engineering - None,08/02/2024
439,https://www.seek.com.au//job/73310491?type=standout&ref=search-standalone,engineering,Process Engineering,Senior Project Process Engineer (Mechanical or Chemical),Bright Engineering Consultants Pty Ltd,-,170000.0,172500.0,175000.0,Brisbane QLD,"Great opportunity: Senior Project Process Engineer (Mechanical or Chemical) in a Dynamic, Food & Beverage, Pharma & Cosmetics, Engineering Consultancy","[<div class=""_1wkzzau0 a1msqi6m""><span class=""_1wkzzau0 a1msqi4y lnocuo0 lnocuo1 lnocuo21 _1d0g9qk4 lnocuo7""><a aria-label=""Limit results to Brisbane QLD"" class=""_1wkzzau0 _1wkzzauf _1wkzzau0 _1wkzzauf _842p0a0 _842p0a2"" data-automation=""jobLocation"" href=""/jobs-in-engineering/in-All-Brisbane-QLD?salarytype=annual&amp;salaryrange=170000-175000"" rel=""nofollow"" tabindex=""-1"" target=""_self"" title=""Limit results to Brisbane QLD"">Brisbane QLD</a></span></div>]",2024-01-25,Engineering - None,08/02/2024
