,link,classification,category,title,company,salary,min_salary,average_salary,max_salary,location,description,entireDiv,date_posted,Category,Date
86,https://www.seek.com.au//job/73238223?type=standard&ref=search-standalone,design architecture,Interior Design,Senior Interior Designer,Spaceful Pty Ltd,-,190000.0,192500.0,195000.0,Sydney NSW,Certified Great Place to Work™ / #13 Best Places to Work™ award winner / Hybrid / Brand new office in Sydney CBD,"[<div class=""_1wkzzau0 a1msqi6m""><span class=""_1wkzzau0 a1msqi4y lnocuo0 lnocuo1 lnocuo21 _1d0g9qk4 lnocuo7""><a aria-label=""Limit results to Sydney NSW"" class=""_1wkzzau0 _1wkzzauf _1wkzzau0 _1wkzzauf _842p0a0 _842p0a2"" data-automation=""jobLocation"" href=""/jobs-in-design-architecture/in-All-Sydney-NSW?salarytype=annual&amp;salaryrange=190000-195000"" rel=""nofollow"" tabindex=""-1"" target=""_self"" title=""Limit results to Sydney NSW"">Sydney NSW</a></span></div>]",2024-01-23,Design-architecture - None,08/02/2024
87,https://www.seek.com.au//job/73546810?type=standout&ref=search-standalone,design architecture,Web & Interaction Design,Digital Content Designer,"Talent – Specialists in tech, transformation & beyond","CBD/WFH hybrid, ASAP start",190000.0,192500.0,195000.0,Melbourne VIC,Leverage insights & best practice to discover opportunities to optimise & improve customer experience & customer acquisitions across digital platforms,"[<div class=""_1wkzzau0 a1msqi6m""><span class=""_1wkzzau0 a1msqi4y lnocuo0 lnocuo1 lnocuo21 _1d0g9qk4 lnocuo7""><a aria-label=""Limit results to Melbourne VIC"" class=""_1wkzzau0 _1wkzzauf _1wkzzau0 _1wkzzauf _842p0a0 _842p0a2"" data-automation=""jobLocation"" href=""/jobs-in-design-architecture/in-All-Melbourne-VIC?salarytype=annual&amp;salaryrange=190000-195000"" rel=""nofollow"" tabindex=""-1"" target=""_self"" title=""Limit results to Melbourne VIC"">Melbourne VIC</a></span></div>, <div class=""_1wkzzau0 a1msqi6m""><div aria-label=""Salary: CBD/WFH hybrid, ASAP start"" class=""_1wkzzau0""><span class=""_1wkzzau0 a1msqi4y lnocuo0 lnocuo1 lnocuo21 _1d0g9qk4 lnocuo7"" data-automation=""jobSalary""><span class=""_1wkzzau0 _16v7pfz1 a1msqi4y a1msqi0 a1msqir _16v7pfz3"" style=""--_16v7pfz2:2"">CBD/WFH hybrid, ASAP start</span></span></div></div>]",2024-02-06,Design-architecture - None,08/02/2024
88,https://www.seek.com.au//job/73201199?type=standout&ref=search-standalone,design architecture,Landscape Architecture,Landscape Planner/Landscape and Visual Impact Assessment (LVIA),Tract Consultants,-,190000.0,192500.0,195000.0,Melbourne VIC,"Take a leading role as an Associate or Principal in our LVIA / Landscape Planning team, working across a vast range of project sectors.","[<div class=""_1wkzzau0 a1msqi6m""><span class=""_1wkzzau0 a1msqi4y lnocuo0 lnocuo1 lnocuo21 _1d0g9qk4 lnocuo7""><a aria-label=""Limit results to Southbank"" class=""_1wkzzau0 _1wkzzauf _1wkzzau0 _1wkzzauf _842p0a0 _842p0a2"" data-automation=""jobLocation"" href=""/jobs-in-design-architecture/in-Southbank-VIC-3006?salarytype=annual&amp;salaryrange=190000-195000"" rel=""nofollow"" tabindex=""-1"" target=""_self"" title=""Limit results to Southbank"">Southbank</a>, <a aria-label=""Limit results to Melbourne VIC"" class=""_1wkzzau0 _1wkzzauf _1wkzzau0 _1wkzzauf _842p0a0 _842p0a2"" data-automation=""jobLocation"" href=""/jobs-in-design-architecture/in-All-Melbourne-VIC?salarytype=annual&amp;salaryrange=190000-195000"" rel=""nofollow"" tabindex=""-1"" target=""_self"" title=""Limit results to Melbourne VIC"">Melbourne VIC</a></span></div>]",2024-01-22,Design-architecture - None,08/02/2024
89,https://www.seek.com.au//job/73408208?type=standout&ref=search-standalone,design architecture,Web & Interaction Design,Senior Experience Designer,SustainRecruit,$145k base - $165k base + super,145000.0,155000.0,165000.0,Sydney NSW,An opportunity to work for an award winning company alongside talented designers.,"[<div class=""_1wkzzau0 a1msqi6m""><span class=""_1wkzzau0 a1msqi4y lnocuo0 lnocuo1 lnocuo21 _1d0g9qk4 lnocuo7""><a aria-label=""Limit results to Sydney NSW"" class=""_1wkzzau0 _1wkzzauf _1wkzzau0 _1wkzzauf _842p0a0 _842p0a2"" data-automation=""jobLocation"" href=""/jobs-in-design-architecture/in-All-Sydney-NSW?salarytype=annual&amp;salaryrange=190000-195000"" rel=""nofollow"" tabindex=""-1"" target=""_self"" title=""Limit results to Sydney NSW"">Sydney NSW</a></span></div>, <div class=""_1wkzzau0 a1msqi6m""><div aria-label=""Salary: $145k base - $165k base + super"" class=""_1wkzzau0""><span class=""_1wkzzau0 a1msqi4y lnocuo0 lnocuo1 lnocuo21 _1d0g9qk4 lnocuo7"" data-automation=""jobSalary""><span class=""_1wkzzau0 _16v7pfz1 a1msqi4y a1msqi0 a1msqir _16v7pfz3"" style=""--_16v7pfz2:2"">$145k base - $165k base + super</span></span></div></div>]",2024-01-31,Design-architecture - None,08/02/2024
90,https://www.seek.com.au//job/73207806?type=standard&ref=search-standalone,design architecture,Web & Interaction Design,Multimedia Specialist,Incubeta,"$130,000 – $150,000 per year",130000.0,140000.0,150000.0,Sydney NSW,Incubeta is looking for an experienced Multimedia Specialist to help design and develop digital content for Incubeta and NMPI (group companies).,"[<div class=""_1wkzzau0 a1msqi6m""><span class=""_1wkzzau0 a1msqi4y lnocuo0 lnocuo1 lnocuo21 _1d0g9qk4 lnocuo7""><a aria-label=""Limit results to Pyrmont"" class=""_1wkzzau0 _1wkzzauf _1wkzzau0 _1wkzzauf _842p0a0 _842p0a2"" data-automation=""jobLocation"" href=""/jobs-in-design-architecture/in-Pyrmont-NSW-2009?salarytype=annual&amp;salaryrange=190000-195000"" rel=""nofollow"" tabindex=""-1"" target=""_self"" title=""Limit results to Pyrmont"">Pyrmont</a>, <a aria-label=""Limit results to Sydney NSW"" class=""_1wkzzau0 _1wkzzauf _1wkzzau0 _1wkzzauf _842p0a0 _842p0a2"" data-automation=""jobLocation"" href=""/jobs-in-design-architecture/in-All-Sydney-NSW?salarytype=annual&amp;salaryrange=190000-195000"" rel=""nofollow"" tabindex=""-1"" target=""_self"" title=""Limit results to Sydney NSW"">Sydney NSW</a></span></div>, <div class=""_1wkzzau0 a1msqi6m""><div aria-label=""Salary: $130,000 – $150,000 per year"" class=""_1wkzzau0""><span class=""_1wkzzau0 a1msqi4y lnocuo0 lnocuo1 lnocuo21 _1d0g9qk4 lnocuo7"" data-automation=""jobSalary""><span class=""_1wkzzau0 _16v7pfz1 a1msqi4y a1msqi0 a1msqir _16v7pfz3"" style=""--_16v7pfz2:2"">$130,000 – $150,000 per year</span></span></div></div>]",2024-01-22,Design-architecture - None,08/02/2024
91,https://www.seek.com.au//job/73359710?type=standout&ref=search-standalone,design architecture,Urban Design & Planning,Senior Town Planner,Bathla,-,190000.0,192500.0,195000.0,Sydney NSW,An experienced Senior Town Planner to support our in-house town planning team,"[<div class=""_1wkzzau0 a1msqi6m""><span class=""_1wkzzau0 a1msqi4y lnocuo0 lnocuo1 lnocuo21 _1d0g9qk4 lnocuo7""><a aria-label=""Limit results to Girraween"" class=""_1wkzzau0 _1wkzzauf _1wkzzau0 _1wkzzauf _842p0a0 _842p0a2"" data-automation=""jobLocation"" href=""/jobs-in-design-architecture/in-Girraween-NSW-2145?salarytype=annual&amp;salaryrange=190000-195000"" rel=""nofollow"" tabindex=""-1"" target=""_self"" title=""Limit results to Girraween"">Girraween</a>, <a aria-label=""Limit results to Sydney NSW"" class=""_1wkzzau0 _1wkzzauf _1wkzzau0 _1wkzzauf _842p0a0 _842p0a2"" data-automation=""jobLocation"" href=""/jobs-in-design-architecture/in-All-Sydney-NSW?salarytype=annual&amp;salaryrange=190000-195000"" rel=""nofollow"" tabindex=""-1"" target=""_self"" title=""Limit results to Sydney NSW"">Sydney NSW</a></span></div>]",2024-01-29,Design-architecture - None,08/02/2024
92,https://www.seek.com.au//job/73000841?type=standout&ref=search-standalone,design architecture,Urban Design & Planning,Associate Director or Director - Town Planner,Hunthem,-,190000.0,192500.0,195000.0,Sydney NSW,We are currently seeking an Associate Director or Director - town planner to join a private urban planning firm in the Sydney CBD area.,"[<div class=""_1wkzzau0 a1msqi6m""><span class=""_1wkzzau0 a1msqi4y lnocuo0 lnocuo1 lnocuo21 _1d0g9qk4 lnocuo7""><a aria-label=""Limit results to Sydney NSW"" class=""_1wkzzau0 _1wkzzauf _1wkzzau0 _1wkzzauf _842p0a0 _842p0a2"" data-automation=""jobLocation"" href=""/jobs-in-design-architecture/in-All-Sydney-NSW?salarytype=annual&amp;salaryrange=190000-195000"" rel=""nofollow"" tabindex=""-1"" target=""_self"" title=""Limit results to Sydney NSW"">Sydney NSW</a></span></div>]",2024-01-15,Design-architecture - None,08/02/2024
93,https://www.seek.com.au//job/73360876?type=standout&ref=search-standalone,design architecture,Web & Interaction Design,UX Researcher,Magentus,-,190000.0,192500.0,195000.0,Brisbane QLD,Inspire better strategic decision making by delivering compelling presentations and insights based on customer research.,"[<div class=""_1wkzzau0 a1msqi6m""><span class=""_1wkzzau0 a1msqi4y lnocuo0 lnocuo1 lnocuo21 _1d0g9qk4 lnocuo7""><a aria-label=""Limit results to Brisbane QLD"" class=""_1wkzzau0 _1wkzzauf _1wkzzau0 _1wkzzauf _842p0a0 _842p0a2"" data-automation=""jobLocation"" href=""/jobs-in-design-architecture/in-All-Brisbane-QLD?salarytype=annual&amp;salaryrange=190000-195000"" rel=""nofollow"" tabindex=""-1"" target=""_self"" title=""Limit results to Brisbane QLD"">Brisbane QLD</a></span></div>]",2024-01-29,Design-architecture - None,08/02/2024
94,https://www.seek.com.au//job/73611986?type=standout&ref=search-standalone,design architecture,Web & Interaction Design,Senior Content Designer,SustainRecruit,Up to $150k base + Super,190000.0,192500.0,195000.0,Sydney NSW,"Award winning company offering 3 days WFH, amazing culture offering mental health & well-being programs","[<div class=""_1wkzzau0 a1msqi6m""><span class=""_1wkzzau0 a1msqi4y lnocuo0 lnocuo1 lnocuo21 _1d0g9qk4 lnocuo7""><a aria-label=""Limit results to Sydney NSW"" class=""_1wkzzau0 _1wkzzauf _1wkzzau0 _1wkzzauf _842p0a0 _842p0a2"" data-automation=""jobLocation"" href=""/jobs-in-design-architecture/in-All-Sydney-NSW?salarytype=annual&amp;salaryrange=190000-195000"" rel=""nofollow"" tabindex=""-1"" target=""_self"" title=""Limit results to Sydney NSW"">Sydney NSW</a></span></div>, <div class=""_1wkzzau0 a1msqi6m""><div aria-label=""Salary: Up to $150k base + Super"" class=""_1wkzzau0""><span class=""_1wkzzau0 a1msqi4y lnocuo0 lnocuo1 lnocuo21 _1d0g9qk4 lnocuo7"" data-automation=""jobSalary""><span class=""_1wkzzau0 _16v7pfz1 a1msqi4y a1msqi0 a1msqir _16v7pfz3"" style=""--_16v7pfz2:2"">Up to $150k base + Super</span></span></div></div>]",,Design-architecture - None,08/02/2024
95,https://www.seek.com.au//job/73247400?type=standout&ref=search-standalone,design architecture,Web & Interaction Design,UX/UI Designer,M&T Resources,Up to $800 per day,190000.0,192500.0,195000.0,Sydney NSW,Initial 6 month contract UX/UI Designer role to help refresh online presence of a strong Australian digital business,"[<div class=""_1wkzzau0 a1msqi6m""><span class=""_1wkzzau0 a1msqi4y lnocuo0 lnocuo1 lnocuo21 _1d0g9qk4 lnocuo7""><a aria-label=""Limit results to Sydney NSW"" class=""_1wkzzau0 _1wkzzauf _1wkzzau0 _1wkzzauf _842p0a0 _842p0a2"" data-automation=""jobLocation"" href=""/jobs-in-design-architecture/in-All-Sydney-NSW?salarytype=annual&amp;salaryrange=190000-195000"" rel=""nofollow"" tabindex=""-1"" target=""_self"" title=""Limit results to Sydney NSW"">Sydney NSW</a></span></div>, <div class=""_1wkzzau0 a1msqi6m""><div aria-label=""Salary: Up to $800 per day"" class=""_1wkzzau0""><span class=""_1wkzzau0 a1msqi4y lnocuo0 lnocuo1 lnocuo21 _1d0g9qk4 lnocuo7"" data-automation=""jobSalary""><span class=""_1wkzzau0 _16v7pfz1 a1msqi4y a1msqi0 a1msqir _16v7pfz3"" style=""--_16v7pfz2:2"">Up to $800 per day</span></span></div></div>]",2024-01-23,Design-architecture - None,08/02/2024
96,https://www.seek.com.au//job/73448503?type=standard&ref=search-standalone,design architecture,Web & Interaction Design,UX - Designer,A2B Australia,-,190000.0,192500.0,195000.0,Sydney NSW,We are looking for a UX designer,"[<div class=""_1wkzzau0 a1msqi6m""><span class=""_1wkzzau0 a1msqi4y lnocuo0 lnocuo1 lnocuo21 _1d0g9qk4 lnocuo7""><a aria-label=""Limit results to Alexandria"" class=""_1wkzzau0 _1wkzzauf _1wkzzau0 _1wkzzauf _842p0a0 _842p0a2"" data-automation=""jobLocation"" href=""/jobs-in-design-architecture/in-Alexandria-NSW-2015?salarytype=annual&amp;salaryrange=190000-195000"" rel=""nofollow"" tabindex=""-1"" target=""_self"" title=""Limit results to Alexandria"">Alexandria</a>, <a aria-label=""Limit results to Sydney NSW"" class=""_1wkzzau0 _1wkzzauf _1wkzzau0 _1wkzzauf _842p0a0 _842p0a2"" data-automation=""jobLocation"" href=""/jobs-in-design-architecture/in-All-Sydney-NSW?salarytype=annual&amp;salaryrange=190000-195000"" rel=""nofollow"" tabindex=""-1"" target=""_self"" title=""Limit results to Sydney NSW"">Sydney NSW</a></span></div>]",2024-02-01,Design-architecture - None,08/02/2024
97,https://www.seek.com.au//job/73074931?type=standard&ref=search-standalone,design architecture,Landscape Architecture,Principal Landscape Architect,Bespoke Careers - Melbourne,"$110,000 – $150,000 + super",110000.0,130000.0,150000.0,Melbourne VIC,Are you looking for a new challenge in the D&C space and looking to help build a team? Use your leadership skills and join this established company!,"[<div class=""_1wkzzau0 a1msqi6m""><span class=""_1wkzzau0 a1msqi4y lnocuo0 lnocuo1 lnocuo21 _1d0g9qk4 lnocuo7""><a aria-label=""Limit results to Melbourne VIC"" class=""_1wkzzau0 _1wkzzauf _1wkzzau0 _1wkzzauf _842p0a0 _842p0a2"" data-automation=""jobLocation"" href=""/jobs-in-design-architecture/in-All-Melbourne-VIC?salarytype=annual&amp;salaryrange=190000-195000"" rel=""nofollow"" tabindex=""-1"" target=""_self"" title=""Limit results to Melbourne VIC"">Melbourne VIC</a></span></div>, <div class=""_1wkzzau0 a1msqi6m""><div aria-label=""Salary: $110,000 – $150,000 + super "" class=""_1wkzzau0""><span class=""_1wkzzau0 a1msqi4y lnocuo0 lnocuo1 lnocuo21 _1d0g9qk4 lnocuo7"" data-automation=""jobSalary""><span class=""_1wkzzau0 _16v7pfz1 a1msqi4y a1msqi0 a1msqir _16v7pfz3"" style=""--_16v7pfz2:2"">$110,000 – $150,000 + super </span></span></div></div>]",2024-01-17,Design-architecture - None,08/02/2024
98,https://www.seek.com.au//job/73389194?type=standout&ref=search-standalone,design architecture,Urban Design & Planning,Senior/Principal DA Planner,Planned Resources,"$140,000 – $150,000 package negotiable",140000.0,145000.0,150000.0,Sydney NSW,A unique opportunity for an experienced Planner to run all of NSW approvals for a Melbourne-based company!,"[<div class=""_1wkzzau0 a1msqi6m""><span class=""_1wkzzau0 a1msqi4y lnocuo0 lnocuo1 lnocuo21 _1d0g9qk4 lnocuo7""><a aria-label=""Limit results to Sydney NSW"" class=""_1wkzzau0 _1wkzzauf _1wkzzau0 _1wkzzauf _842p0a0 _842p0a2"" data-automation=""jobLocation"" href=""/jobs-in-design-architecture/in-All-Sydney-NSW?salarytype=annual&amp;salaryrange=190000-195000"" rel=""nofollow"" tabindex=""-1"" target=""_self"" title=""Limit results to Sydney NSW"">Sydney NSW</a></span></div>, <div class=""_1wkzzau0 a1msqi6m""><div aria-label=""Salary: $140,000 – $150,000 package negotiable"" class=""_1wkzzau0""><span class=""_1wkzzau0 a1msqi4y lnocuo0 lnocuo1 lnocuo21 _1d0g9qk4 lnocuo7"" data-automation=""jobSalary""><span class=""_1wkzzau0 _16v7pfz1 a1msqi4y a1msqi0 a1msqir _16v7pfz3"" style=""--_16v7pfz2:2"">$140,000 – $150,000 package negotiable</span></span></div></div>]",2024-01-30,Design-architecture - None,08/02/2024
99,https://www.seek.com.au//job/73421145?type=standard&ref=search-standalone,design architecture,Web & Interaction Design,Senior Service Designer,PRA,-,190000.0,192500.0,195000.0,Sydney NSW,Looking for a customer experience specialist to join a top Australian organisation.,"[<div class=""_1wkzzau0 a1msqi6m""><span class=""_1wkzzau0 a1msqi4y lnocuo0 lnocuo1 lnocuo21 _1d0g9qk4 lnocuo7""><a aria-label=""Limit results to Sydney NSW"" class=""_1wkzzau0 _1wkzzauf _1wkzzau0 _1wkzzauf _842p0a0 _842p0a2"" data-automation=""jobLocation"" href=""/jobs-in-design-architecture/in-All-Sydney-NSW?salarytype=annual&amp;salaryrange=190000-195000"" rel=""nofollow"" tabindex=""-1"" target=""_self"" title=""Limit results to Sydney NSW"">Sydney NSW</a></span></div>]",2024-01-31,Design-architecture - None,08/02/2024
100,https://www.seek.com.au//job/73454412?type=standard&ref=search-standalone,design architecture,Web & Interaction Design,Senior Product Designer,Coles,-,190000.0,192500.0,195000.0,Melbourne VIC,"As a Senior Product Designer you lead by example to inspire your design team and squad across planning, research, ideation, design and execution","[<div class=""_1wkzzau0 a1msqi6m""><span class=""_1wkzzau0 a1msqi4y lnocuo0 lnocuo1 lnocuo21 _1d0g9qk4 lnocuo7""><a aria-label=""Limit results to Melbourne VIC"" class=""_1wkzzau0 _1wkzzauf _1wkzzau0 _1wkzzauf _842p0a0 _842p0a2"" data-automation=""jobLocation"" href=""/jobs-in-design-architecture/in-All-Melbourne-VIC?salarytype=annual&amp;salaryrange=190000-195000"" rel=""nofollow"" tabindex=""-1"" target=""_self"" title=""Limit results to Melbourne VIC"">Melbourne VIC</a></span></div>]",2024-02-01,Design-architecture - None,08/02/2024
101,https://www.seek.com.au//job/73017435?type=standout&ref=search-standalone,design architecture,Urban Design & Planning,Senior Planner,Hays | Architecture,-,190000.0,192500.0,195000.0,Sydney NSW,Sydney based opportunity for a Senior DA Planner to join a thriving council based in the Western Sydney area.,"[<div class=""_1wkzzau0 a1msqi6m""><span class=""_1wkzzau0 a1msqi4y lnocuo0 lnocuo1 lnocuo21 _1d0g9qk4 lnocuo7""><a aria-label=""Limit results to Harris Park"" class=""_1wkzzau0 _1wkzzauf _1wkzzau0 _1wkzzauf _842p0a0 _842p0a2"" data-automation=""jobLocation"" href=""/jobs-in-design-architecture/in-Harris-Park-NSW-2150?salarytype=annual&amp;salaryrange=190000-195000"" rel=""nofollow"" tabindex=""-1"" target=""_self"" title=""Limit results to Harris Park"">Harris Park</a>, <a aria-label=""Limit results to Sydney NSW"" class=""_1wkzzau0 _1wkzzauf _1wkzzau0 _1wkzzauf _842p0a0 _842p0a2"" data-automation=""jobLocation"" href=""/jobs-in-design-architecture/in-All-Sydney-NSW?salarytype=annual&amp;salaryrange=190000-195000"" rel=""nofollow"" tabindex=""-1"" target=""_self"" title=""Limit results to Sydney NSW"">Sydney NSW</a></span></div>]",2024-01-15,Design-architecture - None,08/02/2024
102,https://www.seek.com.au//job/73046441?type=standout&ref=search-standalone,design architecture,Web & Interaction Design,Lead Product Designer,Macquarie Group Limited,-,190000.0,192500.0,195000.0,Sydney NSW,Join our innovative and collaborative team and deliver human-centred solutions across the entire Macquarie Group.,"[<div class=""_1wkzzau0 a1msqi6m""><span class=""_1wkzzau0 a1msqi4y lnocuo0 lnocuo1 lnocuo21 _1d0g9qk4 lnocuo7""><a aria-label=""Limit results to Sydney NSW"" class=""_1wkzzau0 _1wkzzauf _1wkzzau0 _1wkzzauf _842p0a0 _842p0a2"" data-automation=""jobLocation"" href=""/jobs-in-design-architecture/in-All-Sydney-NSW?salarytype=annual&amp;salaryrange=190000-195000"" rel=""nofollow"" tabindex=""-1"" target=""_self"" title=""Limit results to Sydney NSW"">Sydney NSW</a></span></div>]",2024-01-16,Design-architecture - None,08/02/2024
103,https://www.seek.com.au//job/73257637?type=standard&ref=search-standalone,design architecture,Web & Interaction Design,Senior Content Designer,Randstad - Sales and Marketing,-,190000.0,192500.0,195000.0,Sydney NSW,"lead a team of content designers to create end-to-end content solutions 
Collaborate with cross-functional teams of Designers, Marketers,","[<div class=""_1wkzzau0 a1msqi6m""><span class=""_1wkzzau0 a1msqi4y lnocuo0 lnocuo1 lnocuo21 _1d0g9qk4 lnocuo7""><a aria-label=""Limit results to Sydney NSW"" class=""_1wkzzau0 _1wkzzauf _1wkzzau0 _1wkzzauf _842p0a0 _842p0a2"" data-automation=""jobLocation"" href=""/jobs-in-design-architecture/in-All-Sydney-NSW?salarytype=annual&amp;salaryrange=190000-195000"" rel=""nofollow"" tabindex=""-1"" target=""_self"" title=""Limit results to Sydney NSW"">Sydney NSW</a></span></div>]",2024-01-23,Design-architecture - None,08/02/2024
104,https://www.seek.com.au//job/72877721?type=standout&ref=search-standalone,design architecture,Landscape Architecture,Senior Landscape Architect,Spiire,Base + Salary + Profit Share,190000.0,192500.0,195000.0,Canberra ACT,Great opportunity for a senior professional to take on management of diverse and complex projects in a multidisciplinary consultancy,"[<div class=""_1wkzzau0 a1msqi6m""><span class=""_1wkzzau0 a1msqi4y lnocuo0 lnocuo1 lnocuo21 _1d0g9qk4 lnocuo7""><a aria-label=""Limit results to Canberra ACT"" class=""_1wkzzau0 _1wkzzauf _1wkzzau0 _1wkzzauf _842p0a0 _842p0a2"" data-automation=""jobLocation"" href=""/jobs-in-design-architecture/in-All-Canberra-ACT?salarytype=annual&amp;salaryrange=190000-195000"" rel=""nofollow"" tabindex=""-1"" target=""_self"" title=""Limit results to Canberra ACT"">Canberra ACT</a></span></div>, <div class=""_1wkzzau0 a1msqi6m""><div aria-label=""Salary: Base + Salary + Profit Share"" class=""_1wkzzau0""><span class=""_1wkzzau0 a1msqi4y lnocuo0 lnocuo1 lnocuo21 _1d0g9qk4 lnocuo7"" data-automation=""jobSalary""><span class=""_1wkzzau0 _16v7pfz1 a1msqi4y a1msqi0 a1msqir _16v7pfz3"" style=""--_16v7pfz2:2"">Base + Salary + Profit Share</span></span></div></div>]",2024-01-10,Design-architecture - None,08/02/2024
105,https://www.seek.com.au//job/73618017?type=standout&ref=search-standalone,design architecture,Web & Interaction Design,Mid/Senior UX Designer,Thought Collaborative Pty Ltd,-,190000.0,192500.0,195000.0,Melbourne VIC,You'll be joining an initiative re-defining the way they deliver their own digital self serve experience.,"[<div class=""_1wkzzau0 a1msqi6m""><span class=""_1wkzzau0 a1msqi4y lnocuo0 lnocuo1 lnocuo21 _1d0g9qk4 lnocuo7""><a aria-label=""Limit results to Melbourne VIC"" class=""_1wkzzau0 _1wkzzauf _1wkzzau0 _1wkzzauf _842p0a0 _842p0a2"" data-automation=""jobLocation"" href=""/jobs-in-design-architecture/in-All-Melbourne-VIC?salarytype=annual&amp;salaryrange=190000-195000"" rel=""nofollow"" tabindex=""-1"" target=""_self"" title=""Limit results to Melbourne VIC"">Melbourne VIC</a></span></div>]",,Design-architecture - None,08/02/2024
106,https://www.seek.com.au//job/73420287?type=standard&ref=search-standalone,design architecture,Web & Interaction Design,Senior UX Designer,PRA,$140-$160k,252000.0,252000.0,252000.0,Sydney NSW,Award winning Credit and Asset Management org are in search of a Senior UX Designer to join their team.,"[<div class=""_1wkzzau0 a1msqi6m""><span class=""_1wkzzau0 a1msqi4y lnocuo0 lnocuo1 lnocuo21 _1d0g9qk4 lnocuo7""><a aria-label=""Limit results to Sydney NSW"" class=""_1wkzzau0 _1wkzzauf _1wkzzau0 _1wkzzauf _842p0a0 _842p0a2"" data-automation=""jobLocation"" href=""/jobs-in-design-architecture/in-All-Sydney-NSW?salarytype=annual&amp;salaryrange=190000-195000"" rel=""nofollow"" tabindex=""-1"" target=""_self"" title=""Limit results to Sydney NSW"">Sydney NSW</a></span></div>, <div class=""_1wkzzau0 a1msqi6m""><div aria-label=""Salary: $140-$160k"" class=""_1wkzzau0""><span class=""_1wkzzau0 a1msqi4y lnocuo0 lnocuo1 lnocuo21 _1d0g9qk4 lnocuo7"" data-automation=""jobSalary""><span class=""_1wkzzau0 _16v7pfz1 a1msqi4y a1msqi0 a1msqir _16v7pfz3"" style=""--_16v7pfz2:2"">$140-$160k</span></span></div></div>]",2024-01-31,Design-architecture - None,08/02/2024
107,https://www.seek.com.au//job/72945063?type=standout&ref=search-standalone,design architecture,Other,SEO Lead position,Target Australia Pty Ltd,-,190000.0,192500.0,195000.0,Melbourne VIC,"Drive online visibility and traffic, optimising web content, implementing strategies, and staying ahead in the dynamic digital landscape.","[<div class=""_1wkzzau0 a1msqi6m""><span class=""_1wkzzau0 a1msqi4y lnocuo0 lnocuo1 lnocuo21 _1d0g9qk4 lnocuo7""><a aria-label=""Limit results to Williams Landing"" class=""_1wkzzau0 _1wkzzauf _1wkzzau0 _1wkzzauf _842p0a0 _842p0a2"" data-automation=""jobLocation"" href=""/jobs-in-design-architecture/in-Williams-Landing-VIC-3027?salarytype=annual&amp;salaryrange=190000-195000"" rel=""nofollow"" tabindex=""-1"" target=""_self"" title=""Limit results to Williams Landing"">Williams Landing</a>, <a aria-label=""Limit results to Melbourne VIC"" class=""_1wkzzau0 _1wkzzauf _1wkzzau0 _1wkzzauf _842p0a0 _842p0a2"" data-automation=""jobLocation"" href=""/jobs-in-design-architecture/in-All-Melbourne-VIC?salarytype=annual&amp;salaryrange=190000-195000"" rel=""nofollow"" tabindex=""-1"" target=""_self"" title=""Limit results to Melbourne VIC"">Melbourne VIC</a></span></div>]",2024-01-11,Design-architecture - None,08/02/2024
108,https://www.seek.com.au//job/73100878?type=standard&ref=search-standalone,design architecture,Web & Interaction Design,Senior Product Designer,PRA,$750-$850 per day,180000.0,192000.0,204000.0,Sydney NSW,"B2B focused end-end product design role with an ASX listed company, 3 days WFH, CBD office location.","[<div class=""_1wkzzau0 a1msqi6m""><span class=""_1wkzzau0 a1msqi4y lnocuo0 lnocuo1 lnocuo21 _1d0g9qk4 lnocuo7""><a aria-label=""Limit results to Sydney NSW"" class=""_1wkzzau0 _1wkzzauf _1wkzzau0 _1wkzzauf _842p0a0 _842p0a2"" data-automation=""jobLocation"" href=""/jobs-in-design-architecture/in-All-Sydney-NSW?salarytype=annual&amp;salaryrange=190000-195000"" rel=""nofollow"" tabindex=""-1"" target=""_self"" title=""Limit results to Sydney NSW"">Sydney NSW</a></span></div>, <div class=""_1wkzzau0 a1msqi6m""><div aria-label=""Salary: $750-$850 per day"" class=""_1wkzzau0""><span class=""_1wkzzau0 a1msqi4y lnocuo0 lnocuo1 lnocuo21 _1d0g9qk4 lnocuo7"" data-automation=""jobSalary""><span class=""_1wkzzau0 _16v7pfz1 a1msqi4y a1msqi0 a1msqir _16v7pfz3"" style=""--_16v7pfz2:2"">$750-$850 per day</span></span></div></div>]",2024-01-18,Design-architecture - None,08/02/2024
