,link,classification,category,title,company,salary,min_salary,average_salary,max_salary,location,description,entireDiv,date_posted,Category,Date
0,https://www.seek.com.au//job/73597746?type=promoted&ref=search-standalone,administration office support,Administrative Assistants,Site Administrators (50D),IronMerge Pty Ltd,-,180000.0,182500.0,185000.0,Perth WA,IronMerge are seeking Indigenous Australians for site administration opportunities in the mining and construction industries,"[<div class=""_1wkzzau0 a1msqi6m""><span class=""_1wkzzau0 a1msqi4y lnocuo0 lnocuo1 lnocuo21 _1d0g9qk4 lnocuo7""><a aria-label=""Limit results to Perth WA"" class=""_1wkzzau0 _1wkzzauf _1wkzzau0 _1wkzzauf _842p0a0 _842p0a2"" data-automation=""jobLocation"" href=""/jobs-in-administration-office-support/in-All-Perth-WA?salarytype=annual&amp;salaryrange=180000-185000"" rel=""nofollow"" tabindex=""-1"" target=""_self"" title=""Limit results to Perth WA"">Perth WA</a></span></div>]",,Administration-office-support - None,08/02/2024
1,https://www.seek.com.au//job/73301747?type=promoted&ref=search-standalone,administration office support,Contracts Administration,Senior Administrator,Fulton Hogan Australia Pty Limited,-,180000.0,182500.0,185000.0,"Launceston, Launceston & North East TAS",We are seeking a Senior Administrator to support the continued growth of our Tasmania operations. Based in Mowbray with great career growth on offer.,"[<div class=""_1wkzzau0 a1msqi6m""><span class=""_1wkzzau0 a1msqi4y lnocuo0 lnocuo1 lnocuo21 _1d0g9qk4 lnocuo7""><a aria-label=""Limit results to Launceston"" class=""_1wkzzau0 _1wkzzauf _1wkzzau0 _1wkzzauf _842p0a0 _842p0a2"" data-automation=""jobLocation"" href=""/jobs-in-administration-office-support/in-Launceston-TAS-7250?salarytype=annual&amp;salaryrange=180000-185000"" rel=""nofollow"" tabindex=""-1"" target=""_self"" title=""Limit results to Launceston"">Launceston</a>, <a aria-label=""Limit results to Launceston &amp; North East TAS"" class=""_1wkzzau0 _1wkzzauf _1wkzzau0 _1wkzzauf _842p0a0 _842p0a2"" data-automation=""jobLocation"" href=""/jobs-in-administration-office-support/in-Launceston-&amp;-North-East-TAS?salarytype=annual&amp;salaryrange=180000-185000"" rel=""nofollow"" tabindex=""-1"" target=""_self"" title=""Limit results to Launceston &amp; North East TAS"">Launceston &amp; North East TAS</a></span></div>]",,Administration-office-support - None,08/02/2024
2,https://www.seek.com.au//job/73577929?type=standout&ref=search-standalone,administration office support,Administrative Assistants,Administration Assistant,Grant Thornton Australia,-,180000.0,182500.0,185000.0,Brisbane QLD,Flexibility looks different to everyone - make a true difference to our Audit and Assurance team as an Administration Assistant,"[<div class=""_1wkzzau0 a1msqi6m""><span class=""_1wkzzau0 a1msqi4y lnocuo0 lnocuo1 lnocuo21 _1d0g9qk4 lnocuo7""><a aria-label=""Limit results to Brisbane QLD"" class=""_1wkzzau0 _1wkzzauf _1wkzzau0 _1wkzzauf _842p0a0 _842p0a2"" data-automation=""jobLocation"" href=""/jobs-in-administration-office-support/in-All-Brisbane-QLD?salarytype=annual&amp;salaryrange=180000-185000"" rel=""nofollow"" tabindex=""-1"" target=""_self"" title=""Limit results to Brisbane QLD"">Brisbane QLD</a></span></div>]",2024-02-07,Administration-office-support - None,08/02/2024
3,https://www.seek.com.au//job/73539540?type=standard&ref=search-standalone,administration office support,Administrative Assistants,Administration Assistant - Nura Gili,University of New South Wales,From $82K + 17% superannuation and leave loading,180000.0,182500.0,185000.0,Sydney NSW,Play a key administrative role within the Operations team at Nura Gili Centre for Indigenous Programs,"[<div class=""_1wkzzau0 a1msqi6m""><span class=""_1wkzzau0 a1msqi4y lnocuo0 lnocuo1 lnocuo21 _1d0g9qk4 lnocuo7""><a aria-label=""Limit results to Kensington"" class=""_1wkzzau0 _1wkzzauf _1wkzzau0 _1wkzzauf _842p0a0 _842p0a2"" data-automation=""jobLocation"" href=""/jobs-in-administration-office-support/in-Kensington-NSW-2033?salarytype=annual&amp;salaryrange=180000-185000"" rel=""nofollow"" tabindex=""-1"" target=""_self"" title=""Limit results to Kensington"">Kensington</a>, <a aria-label=""Limit results to Sydney NSW"" class=""_1wkzzau0 _1wkzzauf _1wkzzau0 _1wkzzauf _842p0a0 _842p0a2"" data-automation=""jobLocation"" href=""/jobs-in-administration-office-support/in-All-Sydney-NSW?salarytype=annual&amp;salaryrange=180000-185000"" rel=""nofollow"" tabindex=""-1"" target=""_self"" title=""Limit results to Sydney NSW"">Sydney NSW</a></span></div>, <div class=""_1wkzzau0 a1msqi6m""><div aria-label=""Salary: From $82K + 17% superannuation and leave loading"" class=""_1wkzzau0""><span class=""_1wkzzau0 a1msqi4y lnocuo0 lnocuo1 lnocuo21 _1d0g9qk4 lnocuo7"" data-automation=""jobSalary""><span class=""_1wkzzau0 _16v7pfz1 a1msqi4y a1msqi0 a1msqir _16v7pfz3"" style=""--_16v7pfz2:2"">From $82K + 17% superannuation and leave loading</span></span></div></div>]",2024-02-06,Administration-office-support - None,08/02/2024
4,https://www.seek.com.au//job/73571961?type=standard&ref=search-standalone,administration office support,Office Management,Service Support Manager,Department of Communities and Justice,93295 (EUR),180000.0,182500.0,185000.0,Sydney NSW,"supervise a team in the provision of efficient, effective frontline, administrative and site management services","[<div class=""_1wkzzau0 a1msqi6m""><span class=""_1wkzzau0 a1msqi4y lnocuo0 lnocuo1 lnocuo21 _1d0g9qk4 lnocuo7""><a aria-label=""Limit results to Parramatta"" class=""_1wkzzau0 _1wkzzauf _1wkzzau0 _1wkzzauf _842p0a0 _842p0a2"" data-automation=""jobLocation"" href=""/jobs-in-administration-office-support/in-Parramatta-NSW-2150?salarytype=annual&amp;salaryrange=180000-185000"" rel=""nofollow"" tabindex=""-1"" target=""_self"" title=""Limit results to Parramatta"">Parramatta</a>, <a aria-label=""Limit results to Sydney NSW"" class=""_1wkzzau0 _1wkzzauf _1wkzzau0 _1wkzzauf _842p0a0 _842p0a2"" data-automation=""jobLocation"" href=""/jobs-in-administration-office-support/in-All-Sydney-NSW?salarytype=annual&amp;salaryrange=180000-185000"" rel=""nofollow"" tabindex=""-1"" target=""_self"" title=""Limit results to Sydney NSW"">Sydney NSW</a></span></div>, <div class=""_1wkzzau0 a1msqi6m""><div aria-label=""Salary: 93295 (EUR)"" class=""_1wkzzau0""><span class=""_1wkzzau0 a1msqi4y lnocuo0 lnocuo1 lnocuo21 _1d0g9qk4 lnocuo7"" data-automation=""jobSalary""><span class=""_1wkzzau0 _16v7pfz1 a1msqi4y a1msqi0 a1msqir _16v7pfz3"" style=""--_16v7pfz2:2"">93295 (EUR)</span></span></div></div>]",2024-02-07,Administration-office-support - None,08/02/2024
5,https://www.seek.com.au//job/73617823?type=standout&ref=search-standalone,administration office support,"PA, EA & Secretarial",Executive Assistant,Wodonga Institute of TAFE,-,180000.0,182500.0,185000.0,"Wodonga, Yarra Valley & High Country VIC","You are someone who thrives on getting tasks completed, ensuring you’re organising those in your charge, so that their working day is a success!","[<div class=""_1wkzzau0 a1msqi6m""><span class=""_1wkzzau0 a1msqi4y lnocuo0 lnocuo1 lnocuo21 _1d0g9qk4 lnocuo7""><a aria-label=""Limit results to Wodonga"" class=""_1wkzzau0 _1wkzzauf _1wkzzau0 _1wkzzauf _842p0a0 _842p0a2"" data-automation=""jobLocation"" href=""/jobs-in-administration-office-support/in-Wodonga-VIC-3690?salarytype=annual&amp;salaryrange=180000-185000"" rel=""nofollow"" tabindex=""-1"" target=""_self"" title=""Limit results to Wodonga"">Wodonga</a>, <a aria-label=""Limit results to Yarra Valley &amp; High Country VIC"" class=""_1wkzzau0 _1wkzzauf _1wkzzau0 _1wkzzauf _842p0a0 _842p0a2"" data-automation=""jobLocation"" href=""/jobs-in-administration-office-support/in-Yarra-Valley-&amp;-High-Country-VIC?salarytype=annual&amp;salaryrange=180000-185000"" rel=""nofollow"" tabindex=""-1"" target=""_self"" title=""Limit results to Yarra Valley &amp; High Country VIC"">Yarra Valley &amp; High Country VIC</a></span></div>]",,Administration-office-support - None,08/02/2024
6,https://www.seek.com.au//job/73573130?type=standout&ref=search-standalone,administration office support,Administrative Assistants,Director Corporate Governance and Reporting,Transport Canberra and City Services,"$140,226 - $157,418",140226.0,148822.0,157418.0,Canberra ACT,Do you like a challenge and want to be a key part of a high performing team who work to support a complex operational organisation.,"[<div class=""_1wkzzau0 a1msqi6m""><span class=""_1wkzzau0 a1msqi4y lnocuo0 lnocuo1 lnocuo21 _1d0g9qk4 lnocuo7""><a aria-label=""Limit results to Canberra ACT"" class=""_1wkzzau0 _1wkzzauf _1wkzzau0 _1wkzzauf _842p0a0 _842p0a2"" data-automation=""jobLocation"" href=""/jobs-in-administration-office-support/in-All-Canberra-ACT?salarytype=annual&amp;salaryrange=180000-185000"" rel=""nofollow"" tabindex=""-1"" target=""_self"" title=""Limit results to Canberra ACT"">Canberra ACT</a></span></div>, <div class=""_1wkzzau0 a1msqi6m""><div aria-label=""Salary: $140,226 - $157,418"" class=""_1wkzzau0""><span class=""_1wkzzau0 a1msqi4y lnocuo0 lnocuo1 lnocuo21 _1d0g9qk4 lnocuo7"" data-automation=""jobSalary""><span class=""_1wkzzau0 _16v7pfz1 a1msqi4y a1msqi0 a1msqir _16v7pfz3"" style=""--_16v7pfz2:2"">$140,226 - $157,418</span></span></div></div>]",2024-02-07,Administration-office-support - None,08/02/2024
7,https://www.seek.com.au//job/73553019?type=standard&ref=search-standalone,administration office support,"PA, EA & Secretarial",Executive Assistant,Page Personnel,$65.00 - $80.00 p.h.,117000.0,130500.0,144000.0,Perth WA,The purpose of this role is to provide exceptional support to the Executive Team of this large ASX listed business.,"[<div class=""_1wkzzau0 a1msqi6m""><span class=""_1wkzzau0 a1msqi4y lnocuo0 lnocuo1 lnocuo21 _1d0g9qk4 lnocuo7""><a aria-label=""Limit results to Osborne Park"" class=""_1wkzzau0 _1wkzzauf _1wkzzau0 _1wkzzauf _842p0a0 _842p0a2"" data-automation=""jobLocation"" href=""/jobs-in-administration-office-support/in-Osborne-Park-WA-6017?salarytype=annual&amp;salaryrange=180000-185000"" rel=""nofollow"" tabindex=""-1"" target=""_self"" title=""Limit results to Osborne Park"">Osborne Park</a>, <a aria-label=""Limit results to Perth WA"" class=""_1wkzzau0 _1wkzzauf _1wkzzau0 _1wkzzauf _842p0a0 _842p0a2"" data-automation=""jobLocation"" href=""/jobs-in-administration-office-support/in-All-Perth-WA?salarytype=annual&amp;salaryrange=180000-185000"" rel=""nofollow"" tabindex=""-1"" target=""_self"" title=""Limit results to Perth WA"">Perth WA</a></span></div>, <div class=""_1wkzzau0 a1msqi6m""><div aria-label=""Salary: $65.00 - $80.00 p.h."" class=""_1wkzzau0""><span class=""_1wkzzau0 a1msqi4y lnocuo0 lnocuo1 lnocuo21 _1d0g9qk4 lnocuo7"" data-automation=""jobSalary""><span class=""_1wkzzau0 _16v7pfz1 a1msqi4y a1msqi0 a1msqir _16v7pfz3"" style=""--_16v7pfz2:2"">$65.00 - $80.00 p.h.</span></span></div></div>]",2024-02-06,Administration-office-support - None,08/02/2024
8,https://www.seek.com.au//job/73513543?type=standout&ref=search-standalone,administration office support,Office Management,Director,"Department of State Development, Infrastructure, Local Government and Planning","$155,548 - $162,751 p.a.",155548.0,159149.5,162751.0,Brisbane QLD,You will manage the delivery of the key executive support functions to support the Director-General on key and emerging priorities.,"[<div class=""_1wkzzau0 a1msqi6m""><span class=""_1wkzzau0 a1msqi4y lnocuo0 lnocuo1 lnocuo21 _1d0g9qk4 lnocuo7""><a aria-label=""Limit results to Brisbane QLD"" class=""_1wkzzau0 _1wkzzauf _1wkzzau0 _1wkzzauf _842p0a0 _842p0a2"" data-automation=""jobLocation"" href=""/jobs-in-administration-office-support/in-All-Brisbane-QLD?salarytype=annual&amp;salaryrange=180000-185000"" rel=""nofollow"" tabindex=""-1"" target=""_self"" title=""Limit results to Brisbane QLD"">Brisbane QLD</a></span></div>, <div class=""_1wkzzau0 a1msqi6m""><div aria-label=""Salary: $155,548 - $162,751 p.a."" class=""_1wkzzau0""><span class=""_1wkzzau0 a1msqi4y lnocuo0 lnocuo1 lnocuo21 _1d0g9qk4 lnocuo7"" data-automation=""jobSalary""><span class=""_1wkzzau0 _16v7pfz1 a1msqi4y a1msqi0 a1msqir _16v7pfz3"" style=""--_16v7pfz2:2"">$155,548 - $162,751 p.a.</span></span></div></div>]",2024-02-05,Administration-office-support - None,08/02/2024
9,https://www.seek.com.au//job/73380292?type=standard&ref=search-standalone,administration office support,Administrative Assistants,Administrative Officer - Student Services,University of New South Wales,From $82K + 17% Super and Leave Loading,180000.0,182500.0,185000.0,Sydney NSW,Provide effective administrative support within the Office of Registrar & Student Services (RaSS) ensuring all services are provided efficiently,"[<div class=""_1wkzzau0 a1msqi6m""><span class=""_1wkzzau0 a1msqi4y lnocuo0 lnocuo1 lnocuo21 _1d0g9qk4 lnocuo7""><a aria-label=""Limit results to Kensington"" class=""_1wkzzau0 _1wkzzauf _1wkzzau0 _1wkzzauf _842p0a0 _842p0a2"" data-automation=""jobLocation"" href=""/jobs-in-administration-office-support/in-Kensington-NSW-2033?salarytype=annual&amp;salaryrange=180000-185000"" rel=""nofollow"" tabindex=""-1"" target=""_self"" title=""Limit results to Kensington"">Kensington</a>, <a aria-label=""Limit results to Sydney NSW"" class=""_1wkzzau0 _1wkzzauf _1wkzzau0 _1wkzzauf _842p0a0 _842p0a2"" data-automation=""jobLocation"" href=""/jobs-in-administration-office-support/in-All-Sydney-NSW?salarytype=annual&amp;salaryrange=180000-185000"" rel=""nofollow"" tabindex=""-1"" target=""_self"" title=""Limit results to Sydney NSW"">Sydney NSW</a></span></div>, <div class=""_1wkzzau0 a1msqi6m""><div aria-label=""Salary: From $82K + 17% Super and Leave Loading"" class=""_1wkzzau0""><span class=""_1wkzzau0 a1msqi4y lnocuo0 lnocuo1 lnocuo21 _1d0g9qk4 lnocuo7"" data-automation=""jobSalary""><span class=""_1wkzzau0 _16v7pfz1 a1msqi4y a1msqi0 a1msqir _16v7pfz3"" style=""--_16v7pfz2:2"">From $82K + 17% Super and Leave Loading</span></span></div></div>]",2024-01-30,Administration-office-support - None,08/02/2024
10,https://www.seek.com.au//job/73452463?type=standard&ref=search-standalone,administration office support,"PA, EA & Secretarial",Executive Assistant,Legal People,Call Laine or Rosie on 0416 127 656,180000.0,182500.0,185000.0,Melbourne VIC,Career opportunity for talented Executive Assistant | No two days the same! | CBD Offices | Excellent salary package,"[<div class=""_1wkzzau0 a1msqi6m""><span class=""_1wkzzau0 a1msqi4y lnocuo0 lnocuo1 lnocuo21 _1d0g9qk4 lnocuo7""><a aria-label=""Limit results to Melbourne VIC"" class=""_1wkzzau0 _1wkzzauf _1wkzzau0 _1wkzzauf _842p0a0 _842p0a2"" data-automation=""jobLocation"" href=""/jobs-in-administration-office-support/in-All-Melbourne-VIC?salarytype=annual&amp;salaryrange=180000-185000"" rel=""nofollow"" tabindex=""-1"" target=""_self"" title=""Limit results to Melbourne VIC"">Melbourne VIC</a></span></div>, <div class=""_1wkzzau0 a1msqi6m""><div aria-label=""Salary: Call Laine or Rosie on 0416 127 656"" class=""_1wkzzau0""><span class=""_1wkzzau0 a1msqi4y lnocuo0 lnocuo1 lnocuo21 _1d0g9qk4 lnocuo7"" data-automation=""jobSalary""><span class=""_1wkzzau0 _16v7pfz1 a1msqi4y a1msqi0 a1msqir _16v7pfz3"" style=""--_16v7pfz2:2"">Call Laine or Rosie on 0416 127 656</span></span></div></div>]",2024-02-01,Administration-office-support - None,08/02/2024
11,https://www.seek.com.au//job/73575490?type=standard&ref=search-standalone,administration office support,"PA, EA & Secretarial",Senior Ministerial Liaison Officer,Ashdown People,$66.18 - $72.93 p/h + super,119124.0,125199.0,131274.0,Sydney NSW,New opportunity for an experienced Senior Ministerial Liaison Officer to make a big community impact in a large NSW Government Agency,"[<div class=""_1wkzzau0 a1msqi6m""><span class=""_1wkzzau0 a1msqi4y lnocuo0 lnocuo1 lnocuo21 _1d0g9qk4 lnocuo7""><a aria-label=""Limit results to Parramatta"" class=""_1wkzzau0 _1wkzzauf _1wkzzau0 _1wkzzauf _842p0a0 _842p0a2"" data-automation=""jobLocation"" href=""/jobs-in-administration-office-support/in-Parramatta-NSW-2150?salarytype=annual&amp;salaryrange=180000-185000"" rel=""nofollow"" tabindex=""-1"" target=""_self"" title=""Limit results to Parramatta"">Parramatta</a>, <a aria-label=""Limit results to Sydney NSW"" class=""_1wkzzau0 _1wkzzauf _1wkzzau0 _1wkzzauf _842p0a0 _842p0a2"" data-automation=""jobLocation"" href=""/jobs-in-administration-office-support/in-All-Sydney-NSW?salarytype=annual&amp;salaryrange=180000-185000"" rel=""nofollow"" tabindex=""-1"" target=""_self"" title=""Limit results to Sydney NSW"">Sydney NSW</a></span></div>, <div class=""_1wkzzau0 a1msqi6m""><div aria-label=""Salary: $66.18 - $72.93 p/h + super"" class=""_1wkzzau0""><span class=""_1wkzzau0 a1msqi4y lnocuo0 lnocuo1 lnocuo21 _1d0g9qk4 lnocuo7"" data-automation=""jobSalary""><span class=""_1wkzzau0 _16v7pfz1 a1msqi4y a1msqi0 a1msqir _16v7pfz3"" style=""--_16v7pfz2:2"">$66.18 - $72.93 p/h + super</span></span></div></div>]",2024-02-07,Administration-office-support - None,08/02/2024
12,https://www.seek.com.au//job/73612291?type=standout&ref=search-standalone,administration office support,Other,Project Administrator - Mining,Chandler Macleod,AUD 80 per hour,180000.0,182500.0,185000.0,Adelaide SA,Chandler Macleod is seeking a skilled and experienced Project Administrator to join our mining client's team.,"[<div class=""_1wkzzau0 a1msqi6m""><span class=""_1wkzzau0 a1msqi4y lnocuo0 lnocuo1 lnocuo21 _1d0g9qk4 lnocuo7""><a aria-label=""Limit results to Adelaide SA"" class=""_1wkzzau0 _1wkzzauf _1wkzzau0 _1wkzzauf _842p0a0 _842p0a2"" data-automation=""jobLocation"" href=""/jobs-in-administration-office-support/in-All-Adelaide-SA?salarytype=annual&amp;salaryrange=180000-185000"" rel=""nofollow"" tabindex=""-1"" target=""_self"" title=""Limit results to Adelaide SA"">Adelaide SA</a></span></div>, <div class=""_1wkzzau0 a1msqi6m""><div aria-label=""Salary: AUD 80 per hour"" class=""_1wkzzau0""><span class=""_1wkzzau0 a1msqi4y lnocuo0 lnocuo1 lnocuo21 _1d0g9qk4 lnocuo7"" data-automation=""jobSalary""><span class=""_1wkzzau0 _16v7pfz1 a1msqi4y a1msqi0 a1msqir _16v7pfz3"" style=""--_16v7pfz2:2"">AUD 80 per hour</span></span></div></div>]",,Administration-office-support - None,08/02/2024
13,https://www.seek.com.au//job/73611947?type=standout&ref=search-standalone,administration office support,Other,Project Support Officer (Trials Coordinator),Omni Executive,-,180000.0,182500.0,185000.0,Adelaide SA,We are looking for an Project Support Officer with excellent time management and organisational skills to join the team in SA.,"[<div class=""_1wkzzau0 a1msqi6m""><span class=""_1wkzzau0 a1msqi4y lnocuo0 lnocuo1 lnocuo21 _1d0g9qk4 lnocuo7""><a aria-label=""Limit results to Adelaide SA"" class=""_1wkzzau0 _1wkzzauf _1wkzzau0 _1wkzzauf _842p0a0 _842p0a2"" data-automation=""jobLocation"" href=""/jobs-in-administration-office-support/in-All-Adelaide-SA?salarytype=annual&amp;salaryrange=180000-185000"" rel=""nofollow"" tabindex=""-1"" target=""_self"" title=""Limit results to Adelaide SA"">Adelaide SA</a></span></div>]",,Administration-office-support - None,08/02/2024
14,https://www.seek.com.au//job/73540006?type=standard&ref=search-standalone,administration office support,Other,ISLHD - Service Development Manager,Illawarra Shoalhaven Local Health District,"$137,173 - $163,431",137173.0,150302.0,163431.0,Wollongong NSW,"Employment Type: Permanent Full TimePosition Classification: Health Manager Level 4Remuneration: $137,173 - $163,431 per annum Hours Per Week: 38","[<div class=""_1wkzzau0 a1msqi6m""><span class=""_1wkzzau0 a1msqi4y lnocuo0 lnocuo1 lnocuo21 _1d0g9qk4 lnocuo7""><a aria-label=""Limit results to Wollongong"" class=""_1wkzzau0 _1wkzzauf _1wkzzau0 _1wkzzauf _842p0a0 _842p0a2"" data-automation=""jobLocation"" href=""/jobs-in-administration-office-support/in-Wollongong-NSW-2500?salarytype=annual&amp;salaryrange=180000-185000"" rel=""nofollow"" tabindex=""-1"" target=""_self"" title=""Limit results to Wollongong"">Wollongong</a>, <a aria-label=""Limit results to Wollongong, Illawarra &amp; South Coast NSW"" class=""_1wkzzau0 _1wkzzauf _1wkzzau0 _1wkzzauf _842p0a0 _842p0a2"" data-automation=""jobLocation"" href=""/jobs-in-administration-office-support/in-Wollongong,-Illawarra-&amp;-South-Coast-NSW?salarytype=annual&amp;salaryrange=180000-185000"" rel=""nofollow"" tabindex=""-1"" target=""_self"" title=""Limit results to Wollongong, Illawarra &amp; South Coast NSW"">Wollongong, Illawarra &amp; South Coast NSW</a></span></div>, <div class=""_1wkzzau0 a1msqi6m""><div aria-label=""Salary: $137,173 - $163,431"" class=""_1wkzzau0""><span class=""_1wkzzau0 a1msqi4y lnocuo0 lnocuo1 lnocuo21 _1d0g9qk4 lnocuo7"" data-automation=""jobSalary""><span class=""_1wkzzau0 _16v7pfz1 a1msqi4y a1msqi0 a1msqir _16v7pfz3"" style=""--_16v7pfz2:2"">$137,173 - $163,431</span></span></div></div>]",2024-02-06,Administration-office-support - None,08/02/2024
15,https://www.seek.com.au//job/73515217?type=standout&ref=search-standalone,administration office support,Other,Superintendent - People Logistics,Whitehaven Coal Limited,-,180000.0,182500.0,185000.0,Brisbane QLD,Exciting opportunity for an Accommodation and Flights Superintendent to join our expanding Brisbane office.,"[<div class=""_1wkzzau0 a1msqi6m""><span class=""_1wkzzau0 a1msqi4y lnocuo0 lnocuo1 lnocuo21 _1d0g9qk4 lnocuo7""><a aria-label=""Limit results to Brisbane QLD"" class=""_1wkzzau0 _1wkzzauf _1wkzzau0 _1wkzzauf _842p0a0 _842p0a2"" data-automation=""jobLocation"" href=""/jobs-in-administration-office-support/in-All-Brisbane-QLD?salarytype=annual&amp;salaryrange=180000-185000"" rel=""nofollow"" tabindex=""-1"" target=""_self"" title=""Limit results to Brisbane QLD"">Brisbane QLD</a></span></div>]",2024-02-05,Administration-office-support - None,08/02/2024
16,https://www.seek.com.au//job/73414355?type=standout&ref=search-standalone,administration office support,"PA, EA & Secretarial",Executive Assistant - Government,Chandler Macleod,Competitive hourly rate + super,180000.0,182500.0,185000.0,Brisbane QLD,Awesome opportunity for three (3) Executive Assistants to join a federal agency and provide high-level executive support and administration. APPLY NOW,"[<div class=""_1wkzzau0 a1msqi6m""><span class=""_1wkzzau0 a1msqi4y lnocuo0 lnocuo1 lnocuo21 _1d0g9qk4 lnocuo7""><a aria-label=""Limit results to Brisbane QLD"" class=""_1wkzzau0 _1wkzzauf _1wkzzau0 _1wkzzauf _842p0a0 _842p0a2"" data-automation=""jobLocation"" href=""/jobs-in-administration-office-support/in-All-Brisbane-QLD?salarytype=annual&amp;salaryrange=180000-185000"" rel=""nofollow"" tabindex=""-1"" target=""_self"" title=""Limit results to Brisbane QLD"">Brisbane QLD</a></span></div>, <div class=""_1wkzzau0 a1msqi6m""><div aria-label=""Salary: Competitive hourly rate + super"" class=""_1wkzzau0""><span class=""_1wkzzau0 a1msqi4y lnocuo0 lnocuo1 lnocuo21 _1d0g9qk4 lnocuo7"" data-automation=""jobSalary""><span class=""_1wkzzau0 _16v7pfz1 a1msqi4y a1msqi0 a1msqir _16v7pfz3"" style=""--_16v7pfz2:2"">Competitive hourly rate + super</span></span></div></div>]",2024-01-31,Administration-office-support - None,08/02/2024
17,https://www.seek.com.au//job/73354545?type=standard&ref=search-standalone,administration office support,Administrative Assistants,ADMIN TRANSPORT COMPANY,NGO Transport,-,180000.0,182500.0,185000.0,Brisbane QLD,Administration for transport company.,"[<div class=""_1wkzzau0 a1msqi6m""><span class=""_1wkzzau0 a1msqi4y lnocuo0 lnocuo1 lnocuo21 _1d0g9qk4 lnocuo7""><a aria-label=""Limit results to Salisbury"" class=""_1wkzzau0 _1wkzzauf _1wkzzau0 _1wkzzauf _842p0a0 _842p0a2"" data-automation=""jobLocation"" href=""/jobs-in-administration-office-support/in-Salisbury-QLD-4107?salarytype=annual&amp;salaryrange=180000-185000"" rel=""nofollow"" tabindex=""-1"" target=""_self"" title=""Limit results to Salisbury"">Salisbury</a>, <a aria-label=""Limit results to Brisbane QLD"" class=""_1wkzzau0 _1wkzzauf _1wkzzau0 _1wkzzauf _842p0a0 _842p0a2"" data-automation=""jobLocation"" href=""/jobs-in-administration-office-support/in-All-Brisbane-QLD?salarytype=annual&amp;salaryrange=180000-185000"" rel=""nofollow"" tabindex=""-1"" target=""_self"" title=""Limit results to Brisbane QLD"">Brisbane QLD</a></span></div>]",2024-01-29,Administration-office-support - None,08/02/2024
18,https://www.seek.com.au//job/73386494?type=standout&ref=search-standalone,administration office support,Administrative Assistants,Assistant Project Officer,The Recruitment Company,$69.55 Per hour + super,125190.0,155095.0,185000.0,Sydney NSW,"Support projects with a focus on contracts. Using Excel to collate, manage & analyze datasets.Use TRIM. $69.55 P/H+Super. WFH. Start ASAP.","[<div class=""_1wkzzau0 a1msqi6m""><span class=""_1wkzzau0 a1msqi4y lnocuo0 lnocuo1 lnocuo21 _1d0g9qk4 lnocuo7""><a aria-label=""Limit results to Parramatta"" class=""_1wkzzau0 _1wkzzauf _1wkzzau0 _1wkzzauf _842p0a0 _842p0a2"" data-automation=""jobLocation"" href=""/jobs-in-administration-office-support/in-Parramatta-NSW-2150?salarytype=annual&amp;salaryrange=180000-185000"" rel=""nofollow"" tabindex=""-1"" target=""_self"" title=""Limit results to Parramatta"">Parramatta</a>, <a aria-label=""Limit results to Sydney NSW"" class=""_1wkzzau0 _1wkzzauf _1wkzzau0 _1wkzzauf _842p0a0 _842p0a2"" data-automation=""jobLocation"" href=""/jobs-in-administration-office-support/in-All-Sydney-NSW?salarytype=annual&amp;salaryrange=180000-185000"" rel=""nofollow"" tabindex=""-1"" target=""_self"" title=""Limit results to Sydney NSW"">Sydney NSW</a></span></div>, <div class=""_1wkzzau0 a1msqi6m""><div aria-label=""Salary: $69.55 Per hour + super"" class=""_1wkzzau0""><span class=""_1wkzzau0 a1msqi4y lnocuo0 lnocuo1 lnocuo21 _1d0g9qk4 lnocuo7"" data-automation=""jobSalary""><span class=""_1wkzzau0 _16v7pfz1 a1msqi4y a1msqi0 a1msqir _16v7pfz3"" style=""--_16v7pfz2:2"">$69.55 Per hour + super</span></span></div></div>]",2024-01-30,Administration-office-support - None,08/02/2024
