,link,classification,category,title,company,salary,min_salary,average_salary,max_salary,location,description,entireDiv,date_posted,Category,Date
119,https://www.seek.com.au//job/73361289?type=standout&ref=search-standalone,engineering,Management,ANZ Regional Engineering Manager,Miller Leith,-,170000.0,172500.0,175000.0,"Ballarat, Ballarat & Central Highlands VIC",to implement the global maintenance excellence program with the view to improve and optimise the equipment lifecycle.,"[<div class=""_1wkzzau0 a1msqi6m""><span class=""_1wkzzau0 a1msqi4y lnocuo0 lnocuo1 lnocuo21 _1d0g9qk4 lnocuo7""><a aria-label=""Limit results to Ballarat"" class=""_1wkzzau0 _1wkzzauf _1wkzzau0 _1wkzzauf _842p0a0 _842p0a2"" data-automation=""jobLocation"" href=""/jobs-in-engineering/in-Ballarat-VIC-3350?salarytype=annual&amp;salaryrange=170000-175000"" rel=""nofollow"" tabindex=""-1"" target=""_self"" title=""Limit results to Ballarat"">Ballarat</a>, <a aria-label=""Limit results to Ballarat &amp; Central Highlands VIC"" class=""_1wkzzau0 _1wkzzauf _1wkzzau0 _1wkzzauf _842p0a0 _842p0a2"" data-automation=""jobLocation"" href=""/jobs-in-engineering/in-Ballarat-&amp;-Central-Highlands-VIC?salarytype=annual&amp;salaryrange=170000-175000"" rel=""nofollow"" tabindex=""-1"" target=""_self"" title=""Limit results to Ballarat &amp; Central Highlands VIC"">Ballarat &amp; Central Highlands VIC</a></span></div>]",2024-01-29,Engineering - None,08/02/2024
120,https://www.seek.com.au//job/73632785?type=standout&ref=search-standalone,engineering,Supervisors,Superintendents and Supervisors,Aerison,-,170000.0,172500.0,175000.0,Perth WA,"We are currently seeking SMP Superintendents and Supervisors for FIFO projects, and shutdowns on a full-time permanent contract across multiple sites.","[<div class=""_1wkzzau0 a1msqi6m""><span class=""_1wkzzau0 a1msqi4y lnocuo0 lnocuo1 lnocuo21 _1d0g9qk4 lnocuo7""><a aria-label=""Limit results to Perth WA"" class=""_1wkzzau0 _1wkzzauf _1wkzzau0 _1wkzzauf _842p0a0 _842p0a2"" data-automation=""jobLocation"" href=""/jobs-in-engineering/in-All-Perth-WA?salarytype=annual&amp;salaryrange=170000-175000"" rel=""nofollow"" tabindex=""-1"" target=""_self"" title=""Limit results to Perth WA"">Perth WA</a></span></div>]",,Engineering - None,08/02/2024
121,https://www.seek.com.au//job/73614979?type=standout&ref=search-standalone,engineering,Civil/Structural Engineering,Site Engineer,URBANA CORP PTY LTD,"$120,000 – $180,000 per year",120000.0,150000.0,180000.0,Sydney NSW,Looking for a new site engineer for a Class 2 construction project,"[<div class=""_1wkzzau0 a1msqi6m""><span class=""_1wkzzau0 a1msqi4y lnocuo0 lnocuo1 lnocuo21 _1d0g9qk4 lnocuo7""><a aria-label=""Limit results to Sydney NSW"" class=""_1wkzzau0 _1wkzzauf _1wkzzau0 _1wkzzauf _842p0a0 _842p0a2"" data-automation=""jobLocation"" href=""/jobs-in-engineering/in-All-Sydney-NSW?salarytype=annual&amp;salaryrange=170000-175000"" rel=""nofollow"" tabindex=""-1"" target=""_self"" title=""Limit results to Sydney NSW"">Sydney NSW</a></span></div>, <div class=""_1wkzzau0 a1msqi6m""><div aria-label=""Salary: $120,000 – $180,000 per year"" class=""_1wkzzau0""><span class=""_1wkzzau0 a1msqi4y lnocuo0 lnocuo1 lnocuo21 _1d0g9qk4 lnocuo7"" data-automation=""jobSalary""><span class=""_1wkzzau0 _16v7pfz1 a1msqi4y a1msqi0 a1msqir _16v7pfz3"" style=""--_16v7pfz2:2"">$120,000 – $180,000 per year</span></span></div></div>]",,Engineering - None,08/02/2024
122,https://www.seek.com.au//job/73611651?type=standout&ref=search-standalone,engineering,Maintenance,Maintenance Planner,UGL - Services - Industrial and Resources East,-,170000.0,172500.0,175000.0,"Kingaroy, Toowoomba & Darling Downs QLD",Maintenance Planner with reliability experience for ongoing position in the Kingaroy region. Exposure to food processing preferred.,"[<div class=""_1wkzzau0 a1msqi6m""><span class=""_1wkzzau0 a1msqi4y lnocuo0 lnocuo1 lnocuo21 _1d0g9qk4 lnocuo7""><a aria-label=""Limit results to Kingaroy"" class=""_1wkzzau0 _1wkzzauf _1wkzzau0 _1wkzzauf _842p0a0 _842p0a2"" data-automation=""jobLocation"" href=""/jobs-in-engineering/in-Kingaroy-QLD-4610?salarytype=annual&amp;salaryrange=170000-175000"" rel=""nofollow"" tabindex=""-1"" target=""_self"" title=""Limit results to Kingaroy"">Kingaroy</a>, <a aria-label=""Limit results to Toowoomba &amp; Darling Downs QLD"" class=""_1wkzzau0 _1wkzzauf _1wkzzau0 _1wkzzauf _842p0a0 _842p0a2"" data-automation=""jobLocation"" href=""/jobs-in-engineering/in-Toowoomba-&amp;-Darling-Downs-QLD?salarytype=annual&amp;salaryrange=170000-175000"" rel=""nofollow"" tabindex=""-1"" target=""_self"" title=""Limit results to Toowoomba &amp; Darling Downs QLD"">Toowoomba &amp; Darling Downs QLD</a></span></div>]",,Engineering - None,08/02/2024
123,https://www.seek.com.au//job/73546201?type=standout&ref=search-standalone,engineering,Project Management,Project MANAGER (Client-Side),CPM Advisory and Project Management,-,170000.0,172500.0,175000.0,"Toowoomba, Toowoomba & Darling Downs QLD",Join CPM in the Toowoomba region. Various public sector clients. Challenging and long-term projects. Unrivalled company culture.,"[<div class=""_1wkzzau0 a1msqi6m""><span class=""_1wkzzau0 a1msqi4y lnocuo0 lnocuo1 lnocuo21 _1d0g9qk4 lnocuo7""><a aria-label=""Limit results to Toowoomba"" class=""_1wkzzau0 _1wkzzauf _1wkzzau0 _1wkzzauf _842p0a0 _842p0a2"" data-automation=""jobLocation"" href=""/jobs-in-engineering/in-Toowoomba-QLD-4350?salarytype=annual&amp;salaryrange=170000-175000"" rel=""nofollow"" tabindex=""-1"" target=""_self"" title=""Limit results to Toowoomba"">Toowoomba</a>, <a aria-label=""Limit results to Toowoomba &amp; Darling Downs QLD"" class=""_1wkzzau0 _1wkzzauf _1wkzzau0 _1wkzzauf _842p0a0 _842p0a2"" data-automation=""jobLocation"" href=""/jobs-in-engineering/in-Toowoomba-&amp;-Darling-Downs-QLD?salarytype=annual&amp;salaryrange=170000-175000"" rel=""nofollow"" tabindex=""-1"" target=""_self"" title=""Limit results to Toowoomba &amp; Darling Downs QLD"">Toowoomba &amp; Darling Downs QLD</a></span></div>]",2024-02-06,Engineering - None,08/02/2024
124,https://www.seek.com.au//job/73541149?type=standout&ref=search-standalone,engineering,Management,Mechatronics Design Engineer Team Leader,Finisar,-,170000.0,172500.0,175000.0,Sydney NSW,"Come join our team and design the machines that build the internet! We develop equipment from concept to manufacturing, for our world leading WSS.","[<div class=""_1wkzzau0 a1msqi6m""><span class=""_1wkzzau0 a1msqi4y lnocuo0 lnocuo1 lnocuo21 _1d0g9qk4 lnocuo7""><a aria-label=""Limit results to Rosebery"" class=""_1wkzzau0 _1wkzzauf _1wkzzau0 _1wkzzauf _842p0a0 _842p0a2"" data-automation=""jobLocation"" href=""/jobs-in-engineering/in-Rosebery-NSW-2018?salarytype=annual&amp;salaryrange=170000-175000"" rel=""nofollow"" tabindex=""-1"" target=""_self"" title=""Limit results to Rosebery"">Rosebery</a>, <a aria-label=""Limit results to Sydney NSW"" class=""_1wkzzau0 _1wkzzauf _1wkzzau0 _1wkzzauf _842p0a0 _842p0a2"" data-automation=""jobLocation"" href=""/jobs-in-engineering/in-All-Sydney-NSW?salarytype=annual&amp;salaryrange=170000-175000"" rel=""nofollow"" tabindex=""-1"" target=""_self"" title=""Limit results to Sydney NSW"">Sydney NSW</a></span></div>]",2024-02-06,Engineering - None,08/02/2024
125,https://www.seek.com.au//job/73574160?type=standout&ref=search-standalone,engineering,Electrical/Electronic Engineering,Electrical /  Project Controls Engineer; ECG Electrical Engineering Perth,ECG Engineering,-,170000.0,172500.0,175000.0,Perth WA,Electrical Engineering / Project Controls: join industry leader in project delivery & get deep in execution legal commercial engineering construction,"[<div class=""_1wkzzau0 a1msqi6m""><span class=""_1wkzzau0 a1msqi4y lnocuo0 lnocuo1 lnocuo21 _1d0g9qk4 lnocuo7""><a aria-label=""Limit results to Perth WA"" class=""_1wkzzau0 _1wkzzauf _1wkzzau0 _1wkzzauf _842p0a0 _842p0a2"" data-automation=""jobLocation"" href=""/jobs-in-engineering/in-All-Perth-WA?salarytype=annual&amp;salaryrange=170000-175000"" rel=""nofollow"" tabindex=""-1"" target=""_self"" title=""Limit results to Perth WA"">Perth WA</a></span></div>]",2024-02-07,Engineering - None,08/02/2024
126,https://www.seek.com.au//job/73486126?type=standard&ref=search-standalone,engineering,Maintenance,Maintenance Superintendent,Michael Page,$160k - $180k p.a. + Super + Bonus,160000.0,170000.0,180000.0,"Bunbury, Bunbury & South West WA",Come join a leading manufacturing company and impart your knowledge and experience with a large team!,"[<div class=""_1wkzzau0 a1msqi6m""><span class=""_1wkzzau0 a1msqi4y lnocuo0 lnocuo1 lnocuo21 _1d0g9qk4 lnocuo7""><a aria-label=""Limit results to Bunbury"" class=""_1wkzzau0 _1wkzzauf _1wkzzau0 _1wkzzauf _842p0a0 _842p0a2"" data-automation=""jobLocation"" href=""/jobs-in-engineering/in-Bunbury-WA-6230?salarytype=annual&amp;salaryrange=170000-175000"" rel=""nofollow"" tabindex=""-1"" target=""_self"" title=""Limit results to Bunbury"">Bunbury</a>, <a aria-label=""Limit results to Bunbury &amp; South West WA"" class=""_1wkzzau0 _1wkzzauf _1wkzzau0 _1wkzzauf _842p0a0 _842p0a2"" data-automation=""jobLocation"" href=""/jobs-in-engineering/in-Bunbury-&amp;-South-West-WA?salarytype=annual&amp;salaryrange=170000-175000"" rel=""nofollow"" tabindex=""-1"" target=""_self"" title=""Limit results to Bunbury &amp; South West WA"">Bunbury &amp; South West WA</a></span></div>, <div class=""_1wkzzau0 a1msqi6m""><div aria-label=""Salary: $160k - $180k p.a. + Super + Bonus"" class=""_1wkzzau0""><span class=""_1wkzzau0 a1msqi4y lnocuo0 lnocuo1 lnocuo21 _1d0g9qk4 lnocuo7"" data-automation=""jobSalary""><span class=""_1wkzzau0 _16v7pfz1 a1msqi4y a1msqi0 a1msqir _16v7pfz3"" style=""--_16v7pfz2:2"">$160k - $180k p.a. + Super + Bonus</span></span></div></div>]",2024-02-02,Engineering - None,08/02/2024
127,https://www.seek.com.au//job/73512591?type=standout&ref=search-standalone,engineering,Maintenance,"Reliability Engineer - Located in Adelaide, SA",Blackbook Executive,-,170000.0,172500.0,175000.0,Melbourne VIC,This is a great opportunity to join a leading Australian food manufacturing business as a Reliability Engineer.,"[<div class=""_1wkzzau0 a1msqi6m""><span class=""_1wkzzau0 a1msqi4y lnocuo0 lnocuo1 lnocuo21 _1d0g9qk4 lnocuo7""><a aria-label=""Limit results to Melbourne VIC"" class=""_1wkzzau0 _1wkzzauf _1wkzzau0 _1wkzzauf _842p0a0 _842p0a2"" data-automation=""jobLocation"" href=""/jobs-in-engineering/in-All-Melbourne-VIC?salarytype=annual&amp;salaryrange=170000-175000"" rel=""nofollow"" tabindex=""-1"" target=""_self"" title=""Limit results to Melbourne VIC"">Melbourne VIC</a></span></div>]",2024-02-05,Engineering - None,08/02/2024
128,https://www.seek.com.au//job/73542488?type=standout&ref=search-standalone,engineering,Electrical/Electronic Engineering,Instrumentation Engineer,Fortescue,-,170000.0,172500.0,175000.0,Perth WA,We are seeking an experienced Instrumentation Engineer to work on our heavy industry decarbonization and green energy products/programs.,"[<div class=""_1wkzzau0 a1msqi6m""><span class=""_1wkzzau0 a1msqi4y lnocuo0 lnocuo1 lnocuo21 _1d0g9qk4 lnocuo7""><a aria-label=""Limit results to Perth WA"" class=""_1wkzzau0 _1wkzzauf _1wkzzau0 _1wkzzauf _842p0a0 _842p0a2"" data-automation=""jobLocation"" href=""/jobs-in-engineering/in-All-Perth-WA?salarytype=annual&amp;salaryrange=170000-175000"" rel=""nofollow"" tabindex=""-1"" target=""_self"" title=""Limit results to Perth WA"">Perth WA</a></span></div>]",2024-02-06,Engineering - None,08/02/2024
129,https://www.seek.com.au//job/73450453?type=standard&ref=search-standalone,engineering,Engineering Drafting,Mechanical designers,Execom Group Pty Ltd,$80 – $100 per hour,144000.0,162000.0,180000.0,Perth WA,"Billion $ project, Mid to Senior Mechanical Designers, 12 months+ contract, Paying $80 to $100/hr","[<div class=""_1wkzzau0 a1msqi6m""><span class=""_1wkzzau0 a1msqi4y lnocuo0 lnocuo1 lnocuo21 _1d0g9qk4 lnocuo7""><a aria-label=""Limit results to Perth WA"" class=""_1wkzzau0 _1wkzzauf _1wkzzau0 _1wkzzauf _842p0a0 _842p0a2"" data-automation=""jobLocation"" href=""/jobs-in-engineering/in-All-Perth-WA?salarytype=annual&amp;salaryrange=170000-175000"" rel=""nofollow"" tabindex=""-1"" target=""_self"" title=""Limit results to Perth WA"">Perth WA</a></span></div>, <div class=""_1wkzzau0 a1msqi6m""><div aria-label=""Salary: $80 – $100 per hour"" class=""_1wkzzau0""><span class=""_1wkzzau0 a1msqi4y lnocuo0 lnocuo1 lnocuo21 _1d0g9qk4 lnocuo7"" data-automation=""jobSalary""><span class=""_1wkzzau0 _16v7pfz1 a1msqi4y a1msqi0 a1msqir _16v7pfz3"" style=""--_16v7pfz2:2"">$80 – $100 per hour</span></span></div></div>]",2024-02-01,Engineering - None,08/02/2024
130,https://www.seek.com.au//job/73475344?type=standout&ref=search-standalone,engineering,Project Engineering,Project Engineer - Toowoomba,CMC,-,170000.0,172500.0,175000.0,"Toowoomba, Toowoomba & Darling Downs QLD",Looking for your next road project where you can make an impact? Join us and get recognition for your efforts.,"[<div class=""_1wkzzau0 a1msqi6m""><span class=""_1wkzzau0 a1msqi4y lnocuo0 lnocuo1 lnocuo21 _1d0g9qk4 lnocuo7""><a aria-label=""Limit results to Toowoomba"" class=""_1wkzzau0 _1wkzzauf _1wkzzau0 _1wkzzauf _842p0a0 _842p0a2"" data-automation=""jobLocation"" href=""/jobs-in-engineering/in-Toowoomba-QLD-4350?salarytype=annual&amp;salaryrange=170000-175000"" rel=""nofollow"" tabindex=""-1"" target=""_self"" title=""Limit results to Toowoomba"">Toowoomba</a>, <a aria-label=""Limit results to Toowoomba &amp; Darling Downs QLD"" class=""_1wkzzau0 _1wkzzauf _1wkzzau0 _1wkzzauf _842p0a0 _842p0a2"" data-automation=""jobLocation"" href=""/jobs-in-engineering/in-Toowoomba-&amp;-Darling-Downs-QLD?salarytype=annual&amp;salaryrange=170000-175000"" rel=""nofollow"" tabindex=""-1"" target=""_self"" title=""Limit results to Toowoomba &amp; Darling Downs QLD"">Toowoomba &amp; Darling Downs QLD</a></span></div>]",2024-02-02,Engineering - None,08/02/2024
131,https://www.seek.com.au//job/73600934?type=standout&ref=search-standalone,engineering,Process Engineering,Process Engineer,UGL - Services - Fuels and Energy East,-,170000.0,172500.0,175000.0,Perth WA,UGL are seeking applications from Process Engineer’s to join the team onsite at the Kwinana Fuel Terminal,"[<div class=""_1wkzzau0 a1msqi6m""><span class=""_1wkzzau0 a1msqi4y lnocuo0 lnocuo1 lnocuo21 _1d0g9qk4 lnocuo7""><a aria-label=""Limit results to Kwinana Beach"" class=""_1wkzzau0 _1wkzzauf _1wkzzau0 _1wkzzauf _842p0a0 _842p0a2"" data-automation=""jobLocation"" href=""/jobs-in-engineering/in-Kwinana-Beach-WA-6167?salarytype=annual&amp;salaryrange=170000-175000"" rel=""nofollow"" tabindex=""-1"" target=""_self"" title=""Limit results to Kwinana Beach"">Kwinana Beach</a>, <a aria-label=""Limit results to Perth WA"" class=""_1wkzzau0 _1wkzzauf _1wkzzau0 _1wkzzauf _842p0a0 _842p0a2"" data-automation=""jobLocation"" href=""/jobs-in-engineering/in-All-Perth-WA?salarytype=annual&amp;salaryrange=170000-175000"" rel=""nofollow"" tabindex=""-1"" target=""_self"" title=""Limit results to Perth WA"">Perth WA</a></span></div>]",2024-02-07,Engineering - None,08/02/2024
132,https://www.seek.com.au//job/73616521?type=promoted&ref=search-standalone,engineering,Systems Engineering,Safety Assurance Engineer - QTMP,Downer EDI Limited,-,170000.0,172500.0,175000.0,Brisbane QLD,You will manage completion of safety assurance activities to confirm and document compliance to contract specification requirements.,"[<div class=""_1wkzzau0 a1msqi6m""><span class=""_1wkzzau0 a1msqi4y lnocuo0 lnocuo1 lnocuo21 _1d0g9qk4 lnocuo7""><a aria-label=""Limit results to Brisbane QLD"" class=""_1wkzzau0 _1wkzzauf _1wkzzau0 _1wkzzauf _842p0a0 _842p0a2"" data-automation=""jobLocation"" href=""/jobs-in-engineering/in-All-Brisbane-QLD?salarytype=annual&amp;salaryrange=170000-175000"" rel=""nofollow"" tabindex=""-1"" target=""_self"" title=""Limit results to Brisbane QLD"">Brisbane QLD</a></span></div>]",,Engineering - None,08/02/2024
133,https://www.seek.com.au//job/73542452?type=promoted&ref=search-standalone,engineering,Project Management,Program Manager - Capital Projects,Snowy Hydro,-,170000.0,172500.0,175000.0,Other,"Manage concurrent, complex programmes of capital works across the iconic Snowy Hydro.","[<div class=""_1wkzzau0 a1msqi6m""><span class=""_1wkzzau0 a1msqi4y lnocuo0 lnocuo1 lnocuo21 _1d0g9qk4 lnocuo7""><a aria-label=""Limit results to Cooma"" class=""_1wkzzau0 _1wkzzauf _1wkzzau0 _1wkzzauf _842p0a0 _842p0a2"" data-automation=""jobLocation"" href=""/jobs-in-engineering/in-Cooma-NSW-2630?salarytype=annual&amp;salaryrange=170000-175000"" rel=""nofollow"" tabindex=""-1"" target=""_self"" title=""Limit results to Cooma"">Cooma</a>, <a aria-label=""Limit results to Tumut, Snowy &amp; Monaro NSW"" class=""_1wkzzau0 _1wkzzauf _1wkzzau0 _1wkzzauf _842p0a0 _842p0a2"" data-automation=""jobLocation"" href=""/jobs-in-engineering/in-Tumut,-Snowy-&amp;-Monaro-NSW?salarytype=annual&amp;salaryrange=170000-175000"" rel=""nofollow"" tabindex=""-1"" target=""_self"" title=""Limit results to Tumut, Snowy &amp; Monaro NSW"">Tumut, Snowy &amp; Monaro NSW</a></span></div>]",,Engineering - None,08/02/2024
134,https://www.seek.com.au//job/73470971?type=standout&ref=search-standalone,engineering,Electrical/Electronic Engineering,Multiple Opportunities for Substation Design Engineers,Energy Queensland Group,-,170000.0,172500.0,175000.0,"Rockhampton, Rockhampton & Capricorn Coast QLD",Now is the time to energise your career!,"[<div class=""_1wkzzau0 a1msqi6m""><span class=""_1wkzzau0 a1msqi4y lnocuo0 lnocuo1 lnocuo21 _1d0g9qk4 lnocuo7""><a aria-label=""Limit results to Rockhampton"" class=""_1wkzzau0 _1wkzzauf _1wkzzau0 _1wkzzauf _842p0a0 _842p0a2"" data-automation=""jobLocation"" href=""/jobs-in-engineering/in-Rockhampton-QLD-4700?salarytype=annual&amp;salaryrange=170000-175000"" rel=""nofollow"" tabindex=""-1"" target=""_self"" title=""Limit results to Rockhampton"">Rockhampton</a>, <a aria-label=""Limit results to Rockhampton &amp; Capricorn Coast QLD"" class=""_1wkzzau0 _1wkzzauf _1wkzzau0 _1wkzzauf _842p0a0 _842p0a2"" data-automation=""jobLocation"" href=""/jobs-in-engineering/in-Rockhampton-&amp;-Capricorn-Coast-QLD?salarytype=annual&amp;salaryrange=170000-175000"" rel=""nofollow"" tabindex=""-1"" target=""_self"" title=""Limit results to Rockhampton &amp; Capricorn Coast QLD"">Rockhampton &amp; Capricorn Coast QLD</a></span></div>]",2024-02-02,Engineering - None,08/02/2024
135,https://www.seek.com.au//job/73523704?type=standout&ref=search-standalone,engineering,Mechanical Engineering,HVAC Engineer,Hays | Defence,Significant additional benefits,170000.0,172500.0,175000.0,Sydney NSW,An opportunity to expand your career and gain specialised training and defence project exposure. 12 months expensed secondment to the UK included !,"[<div class=""_1wkzzau0 a1msqi6m""><span class=""_1wkzzau0 a1msqi4y lnocuo0 lnocuo1 lnocuo21 _1d0g9qk4 lnocuo7""><a aria-label=""Limit results to Sydney NSW"" class=""_1wkzzau0 _1wkzzauf _1wkzzau0 _1wkzzauf _842p0a0 _842p0a2"" data-automation=""jobLocation"" href=""/jobs-in-engineering/in-All-Sydney-NSW?salarytype=annual&amp;salaryrange=170000-175000"" rel=""nofollow"" tabindex=""-1"" target=""_self"" title=""Limit results to Sydney NSW"">Sydney NSW</a></span></div>, <div class=""_1wkzzau0 a1msqi6m""><div aria-label=""Salary: Significant additional benefits"" class=""_1wkzzau0""><span class=""_1wkzzau0 a1msqi4y lnocuo0 lnocuo1 lnocuo21 _1d0g9qk4 lnocuo7"" data-automation=""jobSalary""><span class=""_1wkzzau0 _16v7pfz1 a1msqi4y a1msqi0 a1msqir _16v7pfz3"" style=""--_16v7pfz2:2"">Significant additional benefits</span></span></div></div>]",2024-02-05,Engineering - None,08/02/2024
136,https://www.seek.com.au//job/73619813?type=standout&ref=search-standalone,engineering,Maintenance,Maintenance Superintendent,JFD,-,170000.0,172500.0,175000.0,Perth WA,"JFD seeks an experienced, quality focused Maintenance Superintendent to join our high performing team in Bibra Lake.","[<div class=""_1wkzzau0 a1msqi6m""><span class=""_1wkzzau0 a1msqi4y lnocuo0 lnocuo1 lnocuo21 _1d0g9qk4 lnocuo7""><a aria-label=""Limit results to Bibra Lake"" class=""_1wkzzau0 _1wkzzauf _1wkzzau0 _1wkzzauf _842p0a0 _842p0a2"" data-automation=""jobLocation"" href=""/jobs-in-engineering/in-Bibra-Lake-WA-6163?salarytype=annual&amp;salaryrange=170000-175000"" rel=""nofollow"" tabindex=""-1"" target=""_self"" title=""Limit results to Bibra Lake"">Bibra Lake</a>, <a aria-label=""Limit results to Perth WA"" class=""_1wkzzau0 _1wkzzauf _1wkzzau0 _1wkzzauf _842p0a0 _842p0a2"" data-automation=""jobLocation"" href=""/jobs-in-engineering/in-All-Perth-WA?salarytype=annual&amp;salaryrange=170000-175000"" rel=""nofollow"" tabindex=""-1"" target=""_self"" title=""Limit results to Perth WA"">Perth WA</a></span></div>]",,Engineering - None,08/02/2024
137,https://www.seek.com.au//job/73523616?type=standout&ref=search-standalone,engineering,Water & Waste Engineering,Reliability Engineer,Embedded Expertise,-,170000.0,172500.0,175000.0,Adelaide SA,Build & maintain equipment maintenance strategies for critical infrastructure equipment @ the application of Reliability Centred Maintenance analysis,"[<div class=""_1wkzzau0 a1msqi6m""><span class=""_1wkzzau0 a1msqi4y lnocuo0 lnocuo1 lnocuo21 _1d0g9qk4 lnocuo7""><a aria-label=""Limit results to Adelaide SA"" class=""_1wkzzau0 _1wkzzauf _1wkzzau0 _1wkzzauf _842p0a0 _842p0a2"" data-automation=""jobLocation"" href=""/jobs-in-engineering/in-All-Adelaide-SA?salarytype=annual&amp;salaryrange=170000-175000"" rel=""nofollow"" tabindex=""-1"" target=""_self"" title=""Limit results to Adelaide SA"">Adelaide SA</a></span></div>]",2024-02-05,Engineering - None,08/02/2024
138,https://www.seek.com.au//job/73514071?type=standout&ref=search-standalone,engineering,Project Engineering,SMP Project Engineer,Civmec Construction & Engineering,-,170000.0,172500.0,175000.0,Perth WA,We are seeking an experienced SMP Project Engineer's to join our Western Range team!,"[<div class=""_1wkzzau0 a1msqi6m""><span class=""_1wkzzau0 a1msqi4y lnocuo0 lnocuo1 lnocuo21 _1d0g9qk4 lnocuo7""><a aria-label=""Limit results to Perth WA"" class=""_1wkzzau0 _1wkzzauf _1wkzzau0 _1wkzzauf _842p0a0 _842p0a2"" data-automation=""jobLocation"" href=""/jobs-in-engineering/in-All-Perth-WA?salarytype=annual&amp;salaryrange=170000-175000"" rel=""nofollow"" tabindex=""-1"" target=""_self"" title=""Limit results to Perth WA"">Perth WA</a></span></div>]",2024-02-05,Engineering - None,08/02/2024
139,https://www.seek.com.au//job/73555166?type=standout&ref=search-standalone,engineering,Aerospace Engineering,Senior Manufacturing Engineer,Gilmour Space Technologies Pty Ltd,-,170000.0,172500.0,175000.0,Gold Coast QLD,"All Orbits, All Planets - Join us on our journey Gilmour Space is the leading Australian rocket company, pioneering next-generation hybrid propulsi...","[<div class=""_1wkzzau0 a1msqi6m""><span class=""_1wkzzau0 a1msqi4y lnocuo0 lnocuo1 lnocuo21 _1d0g9qk4 lnocuo7""><a aria-label=""Limit results to Helensvale"" class=""_1wkzzau0 _1wkzzauf _1wkzzau0 _1wkzzauf _842p0a0 _842p0a2"" data-automation=""jobLocation"" href=""/jobs-in-engineering/in-Helensvale-QLD-4212?salarytype=annual&amp;salaryrange=170000-175000"" rel=""nofollow"" tabindex=""-1"" target=""_self"" title=""Limit results to Helensvale"">Helensvale</a>, <a aria-label=""Limit results to Gold Coast QLD"" class=""_1wkzzau0 _1wkzzauf _1wkzzau0 _1wkzzauf _842p0a0 _842p0a2"" data-automation=""jobLocation"" href=""/jobs-in-engineering/in-All-Gold-Coast-QLD?salarytype=annual&amp;salaryrange=170000-175000"" rel=""nofollow"" tabindex=""-1"" target=""_self"" title=""Limit results to Gold Coast QLD"">Gold Coast QLD</a></span></div>]",2024-02-06,Engineering - None,08/02/2024
140,https://www.seek.com.au//job/73385554?type=standout&ref=search-standalone,engineering,Electrical/Electronic Engineering,Automation Engineer,Fonterra,-,170000.0,172500.0,175000.0,"Wynyard, Devonport & North West TAS",We are seeking a talented and motivated Automation Engineer to join our dynamic team at our Fonterra Wynyard site.,"[<div class=""_1wkzzau0 a1msqi6m""><span class=""_1wkzzau0 a1msqi4y lnocuo0 lnocuo1 lnocuo21 _1d0g9qk4 lnocuo7""><a aria-label=""Limit results to Wynyard"" class=""_1wkzzau0 _1wkzzauf _1wkzzau0 _1wkzzauf _842p0a0 _842p0a2"" data-automation=""jobLocation"" href=""/jobs-in-engineering/in-Wynyard-TAS-7325?salarytype=annual&amp;salaryrange=170000-175000"" rel=""nofollow"" tabindex=""-1"" target=""_self"" title=""Limit results to Wynyard"">Wynyard</a>, <a aria-label=""Limit results to Devonport &amp; North West TAS"" class=""_1wkzzau0 _1wkzzauf _1wkzzau0 _1wkzzauf _842p0a0 _842p0a2"" data-automation=""jobLocation"" href=""/jobs-in-engineering/in-Devonport-&amp;-North-West-TAS?salarytype=annual&amp;salaryrange=170000-175000"" rel=""nofollow"" tabindex=""-1"" target=""_self"" title=""Limit results to Devonport &amp; North West TAS"">Devonport &amp; North West TAS</a></span></div>]",2024-01-30,Engineering - None,08/02/2024
