,link,classification,category,title,company,salary,min_salary,average_salary,max_salary,location,description,entireDiv,date_posted,Category,Date
121,https://www.seek.com.au//job/73512408?type=standout&ref=search-standalone,design architecture,Urban Design & Planning,Senior Strategic Planner,North Sydney Council,-,140000.0,142500.0,145000.0,Sydney NSW,"Assist in the preparation, development, documentation and implementation of strategic policies, with a particular focus on housing and affordability.","[<div class=""_1wkzzau0 a1msqi6m""><span class=""_1wkzzau0 a1msqi4y lnocuo0 lnocuo1 lnocuo21 _1d0g9qk4 lnocuo7""><a aria-label=""Limit results to North Sydney"" class=""_1wkzzau0 _1wkzzauf _1wkzzau0 _1wkzzauf _842p0a0 _842p0a2"" data-automation=""jobLocation"" href=""/jobs-in-design-architecture/in-North-Sydney-NSW-2060?salarytype=annual&amp;salaryrange=140000-145000"" rel=""nofollow"" tabindex=""-1"" target=""_self"" title=""Limit results to North Sydney"">North Sydney</a>, <a aria-label=""Limit results to Sydney NSW"" class=""_1wkzzau0 _1wkzzauf _1wkzzau0 _1wkzzauf _842p0a0 _842p0a2"" data-automation=""jobLocation"" href=""/jobs-in-design-architecture/in-All-Sydney-NSW?salarytype=annual&amp;salaryrange=140000-145000"" rel=""nofollow"" tabindex=""-1"" target=""_self"" title=""Limit results to Sydney NSW"">Sydney NSW</a></span></div>]",2024-02-05,Design-architecture - None,08/02/2024
122,https://www.seek.com.au//job/73048077?type=standard&ref=search-standalone,design architecture,Architecture,Project Manager / Architect  - Social Housing,Belkirk Group,$115K circa,115000.0,130000.0,145000.0,Melbourne VIC,Contract role to start - Work from home - Travel required - Projects $10M - Salary $115K package,"[<div class=""_1wkzzau0 a1msqi6m""><span class=""_1wkzzau0 a1msqi4y lnocuo0 lnocuo1 lnocuo21 _1d0g9qk4 lnocuo7""><a aria-label=""Limit results to Melbourne VIC"" class=""_1wkzzau0 _1wkzzauf _1wkzzau0 _1wkzzauf _842p0a0 _842p0a2"" data-automation=""jobLocation"" href=""/jobs-in-design-architecture/in-All-Melbourne-VIC?salarytype=annual&amp;salaryrange=140000-145000"" rel=""nofollow"" tabindex=""-1"" target=""_self"" title=""Limit results to Melbourne VIC"">Melbourne VIC</a></span></div>, <div class=""_1wkzzau0 a1msqi6m""><div aria-label=""Salary: $115K circa"" class=""_1wkzzau0""><span class=""_1wkzzau0 a1msqi4y lnocuo0 lnocuo1 lnocuo21 _1d0g9qk4 lnocuo7"" data-automation=""jobSalary""><span class=""_1wkzzau0 _16v7pfz1 a1msqi4y a1msqi0 a1msqir _16v7pfz3"" style=""--_16v7pfz2:2"">$115K circa</span></span></div></div>]",2024-01-16,Design-architecture - None,08/02/2024
123,https://www.seek.com.au//job/73093193?type=standout&ref=search-standalone,design architecture,Architecture,Senior Project Architect,Jesse Ant Architects,-,140000.0,142500.0,145000.0,Melbourne VIC,A fantastic opportunity for a senior project architect to join our great team in delivering successful projects.,"[<div class=""_1wkzzau0 a1msqi6m""><span class=""_1wkzzau0 a1msqi4y lnocuo0 lnocuo1 lnocuo21 _1d0g9qk4 lnocuo7""><a aria-label=""Limit results to Deepdene"" class=""_1wkzzau0 _1wkzzauf _1wkzzau0 _1wkzzauf _842p0a0 _842p0a2"" data-automation=""jobLocation"" href=""/jobs-in-design-architecture/in-Deepdene-VIC-3103?salarytype=annual&amp;salaryrange=140000-145000"" rel=""nofollow"" tabindex=""-1"" target=""_self"" title=""Limit results to Deepdene"">Deepdene</a>, <a aria-label=""Limit results to Melbourne VIC"" class=""_1wkzzau0 _1wkzzauf _1wkzzau0 _1wkzzauf _842p0a0 _842p0a2"" data-automation=""jobLocation"" href=""/jobs-in-design-architecture/in-All-Melbourne-VIC?salarytype=annual&amp;salaryrange=140000-145000"" rel=""nofollow"" tabindex=""-1"" target=""_self"" title=""Limit results to Melbourne VIC"">Melbourne VIC</a></span></div>]",2024-01-17,Design-architecture - None,08/02/2024
124,https://www.seek.com.au//job/73300455?type=standard&ref=search-standalone,design architecture,Industrial Design,Mechanical Designer,Downer EDI Limited,-,140000.0,142500.0,145000.0,Sydney NSW,"Looking for Mechanical CAD Designer to permanently join our Rollingstock team, this position would be based in one of 4 locations QLD and NSW based.","[<div class=""_1wkzzau0 a1msqi6m""><span class=""_1wkzzau0 a1msqi4y lnocuo0 lnocuo1 lnocuo21 _1d0g9qk4 lnocuo7""><a aria-label=""Limit results to North Ryde"" class=""_1wkzzau0 _1wkzzauf _1wkzzau0 _1wkzzauf _842p0a0 _842p0a2"" data-automation=""jobLocation"" href=""/jobs-in-design-architecture/in-North-Ryde-NSW-2113?salarytype=annual&amp;salaryrange=140000-145000"" rel=""nofollow"" tabindex=""-1"" target=""_self"" title=""Limit results to North Ryde"">North Ryde</a>, <a aria-label=""Limit results to Sydney NSW"" class=""_1wkzzau0 _1wkzzauf _1wkzzau0 _1wkzzauf _842p0a0 _842p0a2"" data-automation=""jobLocation"" href=""/jobs-in-design-architecture/in-All-Sydney-NSW?salarytype=annual&amp;salaryrange=140000-145000"" rel=""nofollow"" tabindex=""-1"" target=""_self"" title=""Limit results to Sydney NSW"">Sydney NSW</a></span></div>]",2024-01-25,Design-architecture - None,08/02/2024
125,https://www.seek.com.au//job/73079294?type=standout&ref=search-standalone,design architecture,Urban Design & Planning,Urban Designer,GHD Pty Ltd,-,140000.0,142500.0,145000.0,Melbourne VIC,"Bring a passion for urban design and precinct planning. Make impact on how people live, move and interact in our communities.","[<div class=""_1wkzzau0 a1msqi6m""><span class=""_1wkzzau0 a1msqi4y lnocuo0 lnocuo1 lnocuo21 _1d0g9qk4 lnocuo7""><a aria-label=""Limit results to Melbourne VIC"" class=""_1wkzzau0 _1wkzzauf _1wkzzau0 _1wkzzauf _842p0a0 _842p0a2"" data-automation=""jobLocation"" href=""/jobs-in-design-architecture/in-All-Melbourne-VIC?salarytype=annual&amp;salaryrange=140000-145000"" rel=""nofollow"" tabindex=""-1"" target=""_self"" title=""Limit results to Melbourne VIC"">Melbourne VIC</a></span></div>]",2024-01-17,Design-architecture - None,08/02/2024
126,https://www.seek.com.au//job/73276823?type=standout&ref=search-standalone,design architecture,Architecture,Architectural Studio Lead - Industrial/Commercial,Redpath Partners Pty Ltd,-,140000.0,142500.0,145000.0,Melbourne VIC,"Due to an increasing pipeline of national client work, this specialist Sydney Boutique is seeking a Studio Lead to open their Melbourne Business.","[<div class=""_1wkzzau0 a1msqi6m""><span class=""_1wkzzau0 a1msqi4y lnocuo0 lnocuo1 lnocuo21 _1d0g9qk4 lnocuo7""><a aria-label=""Limit results to Melbourne VIC"" class=""_1wkzzau0 _1wkzzauf _1wkzzau0 _1wkzzauf _842p0a0 _842p0a2"" data-automation=""jobLocation"" href=""/jobs-in-design-architecture/in-All-Melbourne-VIC?salarytype=annual&amp;salaryrange=140000-145000"" rel=""nofollow"" tabindex=""-1"" target=""_self"" title=""Limit results to Melbourne VIC"">Melbourne VIC</a></span></div>]",2024-01-24,Design-architecture - None,08/02/2024
127,https://www.seek.com.au//job/73046767?type=standard&ref=search-standalone,design architecture,Other,Business Development Manager,Bespoke Careers - Melbourne,"$95,000 – $110,000 per year",95000.0,102500.0,110000.0,Melbourne VIC,"Step into this young and vibrant workspace, and put your stamp on the offering of this reputable and creative studio","[<div class=""_1wkzzau0 a1msqi6m""><span class=""_1wkzzau0 a1msqi4y lnocuo0 lnocuo1 lnocuo21 _1d0g9qk4 lnocuo7""><a aria-label=""Limit results to Melbourne VIC"" class=""_1wkzzau0 _1wkzzauf _1wkzzau0 _1wkzzauf _842p0a0 _842p0a2"" data-automation=""jobLocation"" href=""/jobs-in-design-architecture/in-All-Melbourne-VIC?salarytype=annual&amp;salaryrange=140000-145000"" rel=""nofollow"" tabindex=""-1"" target=""_self"" title=""Limit results to Melbourne VIC"">Melbourne VIC</a></span></div>, <div class=""_1wkzzau0 a1msqi6m""><div aria-label=""Salary: $95,000 – $110,000 per year"" class=""_1wkzzau0""><span class=""_1wkzzau0 a1msqi4y lnocuo0 lnocuo1 lnocuo21 _1d0g9qk4 lnocuo7"" data-automation=""jobSalary""><span class=""_1wkzzau0 _16v7pfz1 a1msqi4y a1msqi0 a1msqir _16v7pfz3"" style=""--_16v7pfz2:2"">$95,000 – $110,000 per year</span></span></div></div>]",2024-01-16,Design-architecture - None,08/02/2024
128,https://www.seek.com.au//job/73387339?type=standout&ref=search-standalone,design architecture,Landscape Architecture,Landscape Architect,Good Manors Pty Ltd,"$90,000 – $120,000 per year",90000.0,105000.0,120000.0,Sydney NSW,"Landscape Architect, driving projects from concept development to construction.","[<div class=""_1wkzzau0 a1msqi6m""><span class=""_1wkzzau0 a1msqi4y lnocuo0 lnocuo1 lnocuo21 _1d0g9qk4 lnocuo7""><a aria-label=""Limit results to Lilyfield"" class=""_1wkzzau0 _1wkzzauf _1wkzzau0 _1wkzzauf _842p0a0 _842p0a2"" data-automation=""jobLocation"" href=""/jobs-in-design-architecture/in-Lilyfield-NSW-2040?salarytype=annual&amp;salaryrange=140000-145000"" rel=""nofollow"" tabindex=""-1"" target=""_self"" title=""Limit results to Lilyfield"">Lilyfield</a>, <a aria-label=""Limit results to Sydney NSW"" class=""_1wkzzau0 _1wkzzauf _1wkzzau0 _1wkzzauf _842p0a0 _842p0a2"" data-automation=""jobLocation"" href=""/jobs-in-design-architecture/in-All-Sydney-NSW?salarytype=annual&amp;salaryrange=140000-145000"" rel=""nofollow"" tabindex=""-1"" target=""_self"" title=""Limit results to Sydney NSW"">Sydney NSW</a></span></div>, <div class=""_1wkzzau0 a1msqi6m""><div aria-label=""Salary: $90,000 – $120,000 per year"" class=""_1wkzzau0""><span class=""_1wkzzau0 a1msqi4y lnocuo0 lnocuo1 lnocuo21 _1d0g9qk4 lnocuo7"" data-automation=""jobSalary""><span class=""_1wkzzau0 _16v7pfz1 a1msqi4y a1msqi0 a1msqir _16v7pfz3"" style=""--_16v7pfz2:2"">$90,000 – $120,000 per year</span></span></div></div>]",2024-01-30,Design-architecture - None,08/02/2024
129,https://www.seek.com.au//job/73572950?type=standout&ref=search-standalone,design architecture,Web & Interaction Design,User Experience Designer,Australian Digital Health Agency,-,140000.0,142500.0,145000.0,Canberra ACT,Responsible for delivering experience design expertise and solutions which contribute to the design of Australian Digital Health Agency products.,"[<div class=""_1wkzzau0 a1msqi6m""><span class=""_1wkzzau0 a1msqi4y lnocuo0 lnocuo1 lnocuo21 _1d0g9qk4 lnocuo7""><a aria-label=""Limit results to Canberra ACT"" class=""_1wkzzau0 _1wkzzauf _1wkzzau0 _1wkzzauf _842p0a0 _842p0a2"" data-automation=""jobLocation"" href=""/jobs-in-design-architecture/in-All-Canberra-ACT?salarytype=annual&amp;salaryrange=140000-145000"" rel=""nofollow"" tabindex=""-1"" target=""_self"" title=""Limit results to Canberra ACT"">Canberra ACT</a></span></div>]",2024-02-07,Design-architecture - None,08/02/2024
130,https://www.seek.com.au//job/73477364?type=standout&ref=search-standalone,design architecture,Interior Design,Senior Retail Project Manager,Cheil Worldwide Australia Pty Ltd,-,140000.0,142500.0,145000.0,Sydney NSW,Oversee and execute retail projects for global leading brands.,"[<div class=""_1wkzzau0 a1msqi6m""><span class=""_1wkzzau0 a1msqi4y lnocuo0 lnocuo1 lnocuo21 _1d0g9qk4 lnocuo7""><a aria-label=""Limit results to Sydney Olympic Park"" class=""_1wkzzau0 _1wkzzauf _1wkzzau0 _1wkzzauf _842p0a0 _842p0a2"" data-automation=""jobLocation"" href=""/jobs-in-design-architecture/in-Sydney-Olympic-Park-NSW-2127?salarytype=annual&amp;salaryrange=140000-145000"" rel=""nofollow"" tabindex=""-1"" target=""_self"" title=""Limit results to Sydney Olympic Park"">Sydney Olympic Park</a>, <a aria-label=""Limit results to Sydney NSW"" class=""_1wkzzau0 _1wkzzauf _1wkzzau0 _1wkzzauf _842p0a0 _842p0a2"" data-automation=""jobLocation"" href=""/jobs-in-design-architecture/in-All-Sydney-NSW?salarytype=annual&amp;salaryrange=140000-145000"" rel=""nofollow"" tabindex=""-1"" target=""_self"" title=""Limit results to Sydney NSW"">Sydney NSW</a></span></div>]",2024-02-02,Design-architecture - None,08/02/2024
131,https://www.seek.com.au//job/73002561?type=standard&ref=search-standalone,design architecture,Graphic Design,Graphic Designer & Video Production,ALL THINGS VISUAL,$40 – $60 per hour,72000.0,90000.0,108000.0,Sydney NSW,"Experienced Graphic Designer 1-day/week working-from home flexibility. 
Apply with resume, portfolio, and cover letter.","[<div class=""_1wkzzau0 a1msqi6m""><span class=""_1wkzzau0 a1msqi4y lnocuo0 lnocuo1 lnocuo21 _1d0g9qk4 lnocuo7""><a aria-label=""Limit results to Manly"" class=""_1wkzzau0 _1wkzzauf _1wkzzau0 _1wkzzauf _842p0a0 _842p0a2"" data-automation=""jobLocation"" href=""/jobs-in-design-architecture/in-Manly-NSW-2095?salarytype=annual&amp;salaryrange=140000-145000"" rel=""nofollow"" tabindex=""-1"" target=""_self"" title=""Limit results to Manly"">Manly</a>, <a aria-label=""Limit results to Sydney NSW"" class=""_1wkzzau0 _1wkzzauf _1wkzzau0 _1wkzzauf _842p0a0 _842p0a2"" data-automation=""jobLocation"" href=""/jobs-in-design-architecture/in-All-Sydney-NSW?salarytype=annual&amp;salaryrange=140000-145000"" rel=""nofollow"" tabindex=""-1"" target=""_self"" title=""Limit results to Sydney NSW"">Sydney NSW</a></span></div>, <div class=""_1wkzzau0 a1msqi6m""><div aria-label=""Salary: $40 – $60 per hour"" class=""_1wkzzau0""><span class=""_1wkzzau0 a1msqi4y lnocuo0 lnocuo1 lnocuo21 _1d0g9qk4 lnocuo7"" data-automation=""jobSalary""><span class=""_1wkzzau0 _16v7pfz1 a1msqi4y a1msqi0 a1msqir _16v7pfz3"" style=""--_16v7pfz2:2"">$40 – $60 per hour</span></span></div></div>]",2024-01-15,Design-architecture - None,08/02/2024
132,https://www.seek.com.au//job/72967073?type=promoted&ref=search-standalone,design architecture,Web & Interaction Design,UI Designer,NewyTechPeople,AUD 130000 per annum,140000.0,142500.0,145000.0,Newcastle NSW,This is an amazing opportunity to dive into a complex web platform overhaul that will impact a wide demographic of Australians.,"[<div class=""_1wkzzau0 a1msqi6m""><span class=""_1wkzzau0 a1msqi4y lnocuo0 lnocuo1 lnocuo21 _1d0g9qk4 lnocuo7""><a aria-label=""Limit results to Newcastle"" class=""_1wkzzau0 _1wkzzauf _1wkzzau0 _1wkzzauf _842p0a0 _842p0a2"" data-automation=""jobLocation"" href=""/jobs-in-design-architecture/in-Newcastle-NSW-2300?salarytype=annual&amp;salaryrange=140000-145000"" rel=""nofollow"" tabindex=""-1"" target=""_self"" title=""Limit results to Newcastle"">Newcastle</a>, <a aria-label=""Limit results to Newcastle, Maitland &amp; Hunter NSW"" class=""_1wkzzau0 _1wkzzauf _1wkzzau0 _1wkzzauf _842p0a0 _842p0a2"" data-automation=""jobLocation"" href=""/jobs-in-design-architecture/in-Newcastle,-Maitland-&amp;-Hunter-NSW?salarytype=annual&amp;salaryrange=140000-145000"" rel=""nofollow"" tabindex=""-1"" target=""_self"" title=""Limit results to Newcastle, Maitland &amp; Hunter NSW"">Newcastle, Maitland &amp; Hunter NSW</a></span></div>, <div class=""_1wkzzau0 a1msqi6m""><div aria-label=""Salary: AUD 130000 per annum"" class=""_1wkzzau0""><span class=""_1wkzzau0 a1msqi4y lnocuo0 lnocuo1 lnocuo21 _1d0g9qk4 lnocuo7"" data-automation=""jobSalary""><span class=""_1wkzzau0 _16v7pfz1 a1msqi4y a1msqi0 a1msqir _16v7pfz3"" style=""--_16v7pfz2:2"">AUD 130000 per annum</span></span></div></div>]",,Design-architecture - None,08/02/2024
133,https://www.seek.com.au//job/73093193?type=promoted&ref=search-standalone,design architecture,Architecture,Senior Project Architect,Jesse Ant Architects,-,140000.0,142500.0,145000.0,Melbourne VIC,A fantastic opportunity for a senior project architect to join our great team in delivering successful projects.,"[<div class=""_1wkzzau0 a1msqi6m""><span class=""_1wkzzau0 a1msqi4y lnocuo0 lnocuo1 lnocuo21 _1d0g9qk4 lnocuo7""><a aria-label=""Limit results to Deepdene"" class=""_1wkzzau0 _1wkzzauf _1wkzzau0 _1wkzzauf _842p0a0 _842p0a2"" data-automation=""jobLocation"" href=""/jobs-in-design-architecture/in-Deepdene-VIC-3103?salarytype=annual&amp;salaryrange=140000-145000"" rel=""nofollow"" tabindex=""-1"" target=""_self"" title=""Limit results to Deepdene"">Deepdene</a>, <a aria-label=""Limit results to Melbourne VIC"" class=""_1wkzzau0 _1wkzzauf _1wkzzau0 _1wkzzauf _842p0a0 _842p0a2"" data-automation=""jobLocation"" href=""/jobs-in-design-architecture/in-All-Melbourne-VIC?salarytype=annual&amp;salaryrange=140000-145000"" rel=""nofollow"" tabindex=""-1"" target=""_self"" title=""Limit results to Melbourne VIC"">Melbourne VIC</a></span></div>]",,Design-architecture - None,08/02/2024
134,https://www.seek.com.au//job/73575548?type=standout&ref=search-standalone,design architecture,Web & Interaction Design,User Experience Designer,Australian Digital Health Agency,-,140000.0,142500.0,145000.0,Adelaide SA,Responsible for delivering experience design expertise and solutions which contribute to the design of Australian Digital Health Agency products.,"[<div class=""_1wkzzau0 a1msqi6m""><span class=""_1wkzzau0 a1msqi4y lnocuo0 lnocuo1 lnocuo21 _1d0g9qk4 lnocuo7""><a aria-label=""Limit results to Adelaide SA"" class=""_1wkzzau0 _1wkzzauf _1wkzzau0 _1wkzzauf _842p0a0 _842p0a2"" data-automation=""jobLocation"" href=""/jobs-in-design-architecture/in-All-Adelaide-SA?salarytype=annual&amp;salaryrange=140000-145000"" rel=""nofollow"" tabindex=""-1"" target=""_self"" title=""Limit results to Adelaide SA"">Adelaide SA</a></span></div>]",2024-02-07,Design-architecture - None,08/02/2024
135,https://www.seek.com.au//job/73099728?type=standout&ref=search-standalone,design architecture,Architecture,Access Consultant,Bureau Veritas Australia Pty Ltd,"$100,000 – $150,000 per year",100000.0,125000.0,150000.0,Melbourne VIC,Leave Your Mark that is unmatched in the industry.,"[<div class=""_1wkzzau0 a1msqi6m""><span class=""_1wkzzau0 a1msqi4y lnocuo0 lnocuo1 lnocuo21 _1d0g9qk4 lnocuo7""><a aria-label=""Limit results to Melbourne VIC"" class=""_1wkzzau0 _1wkzzauf _1wkzzau0 _1wkzzauf _842p0a0 _842p0a2"" data-automation=""jobLocation"" href=""/jobs-in-design-architecture/in-All-Melbourne-VIC?salarytype=annual&amp;salaryrange=140000-145000"" rel=""nofollow"" tabindex=""-1"" target=""_self"" title=""Limit results to Melbourne VIC"">Melbourne VIC</a></span></div>, <div class=""_1wkzzau0 a1msqi6m""><div aria-label=""Salary: $100,000 – $150,000 per year"" class=""_1wkzzau0""><span class=""_1wkzzau0 a1msqi4y lnocuo0 lnocuo1 lnocuo21 _1d0g9qk4 lnocuo7"" data-automation=""jobSalary""><span class=""_1wkzzau0 _16v7pfz1 a1msqi4y a1msqi0 a1msqir _16v7pfz3"" style=""--_16v7pfz2:2"">$100,000 – $150,000 per year</span></span></div></div>]",2024-01-18,Design-architecture - None,08/02/2024
136,https://www.seek.com.au//job/73048093?type=standout&ref=search-standalone,design architecture,Architectural Drafting,Architectural Draftsman - Revit/AutoCAD,Concise Recruitment,-,140000.0,142500.0,145000.0,Melbourne VIC,Specialist design and construct engineering company is seeking an Architectural Draftsman working on infrastructure projects.,"[<div class=""_1wkzzau0 a1msqi6m""><span class=""_1wkzzau0 a1msqi4y lnocuo0 lnocuo1 lnocuo21 _1d0g9qk4 lnocuo7""><a aria-label=""Limit results to Melbourne VIC"" class=""_1wkzzau0 _1wkzzauf _1wkzzau0 _1wkzzauf _842p0a0 _842p0a2"" data-automation=""jobLocation"" href=""/jobs-in-design-architecture/in-All-Melbourne-VIC?salarytype=annual&amp;salaryrange=140000-145000"" rel=""nofollow"" tabindex=""-1"" target=""_self"" title=""Limit results to Melbourne VIC"">Melbourne VIC</a></span></div>]",2024-01-16,Design-architecture - None,08/02/2024
137,https://www.seek.com.au//job/73020342?type=standout&ref=search-standalone,design architecture,Architecture,Project Architect,Meriton Property Services Pty Ltd,-,140000.0,142500.0,145000.0,Sydney NSW,Join Meriton as Project Architect to lead projects from post DA approval to completion. Strong construction documentation (REVIT) focus,"[<div class=""_1wkzzau0 a1msqi6m""><span class=""_1wkzzau0 a1msqi4y lnocuo0 lnocuo1 lnocuo21 _1d0g9qk4 lnocuo7""><a aria-label=""Limit results to Sydney NSW"" class=""_1wkzzau0 _1wkzzauf _1wkzzau0 _1wkzzauf _842p0a0 _842p0a2"" data-automation=""jobLocation"" href=""/jobs-in-design-architecture/in-All-Sydney-NSW?salarytype=annual&amp;salaryrange=140000-145000"" rel=""nofollow"" tabindex=""-1"" target=""_self"" title=""Limit results to Sydney NSW"">Sydney NSW</a></span></div>]",2024-01-15,Design-architecture - None,08/02/2024
138,https://www.seek.com.au//job/73410247?type=standout&ref=search-standalone,design architecture,Interior Design,Workplace Strategist - Elevate Strategy Lead,Concept Commercial Interiors,-,140000.0,142500.0,145000.0,Melbourne VIC,Flexible career building opportunity in a collaborative environment for a Senior Interior Designer passionate about workplace design and strategy.,"[<div class=""_1wkzzau0 a1msqi6m""><span class=""_1wkzzau0 a1msqi4y lnocuo0 lnocuo1 lnocuo21 _1d0g9qk4 lnocuo7""><a aria-label=""Limit results to Melbourne VIC"" class=""_1wkzzau0 _1wkzzauf _1wkzzau0 _1wkzzauf _842p0a0 _842p0a2"" data-automation=""jobLocation"" href=""/jobs-in-design-architecture/in-All-Melbourne-VIC?salarytype=annual&amp;salaryrange=140000-145000"" rel=""nofollow"" tabindex=""-1"" target=""_self"" title=""Limit results to Melbourne VIC"">Melbourne VIC</a></span></div>]",2024-01-31,Design-architecture - None,08/02/2024
139,https://www.seek.com.au//job/73269892?type=standard&ref=search-standalone,design architecture,Architecture,Senior Project Architect - Cutting Edge projects,Bespoke Careers - Melbourne,"$100,000 – $120,000 + super",100000.0,110000.0,120000.0,Melbourne VIC,"Enjoy a great level of autonomy and responsibility within a boutique, city-fringe practice where you can take the reins across all aspects of projects","[<div class=""_1wkzzau0 a1msqi6m""><span class=""_1wkzzau0 a1msqi4y lnocuo0 lnocuo1 lnocuo21 _1d0g9qk4 lnocuo7""><a aria-label=""Limit results to Melbourne VIC"" class=""_1wkzzau0 _1wkzzauf _1wkzzau0 _1wkzzauf _842p0a0 _842p0a2"" data-automation=""jobLocation"" href=""/jobs-in-design-architecture/in-All-Melbourne-VIC?salarytype=annual&amp;salaryrange=140000-145000"" rel=""nofollow"" tabindex=""-1"" target=""_self"" title=""Limit results to Melbourne VIC"">Melbourne VIC</a></span></div>, <div class=""_1wkzzau0 a1msqi6m""><div aria-label=""Salary: $100,000 – $120,000 + super"" class=""_1wkzzau0""><span class=""_1wkzzau0 a1msqi4y lnocuo0 lnocuo1 lnocuo21 _1d0g9qk4 lnocuo7"" data-automation=""jobSalary""><span class=""_1wkzzau0 _16v7pfz1 a1msqi4y a1msqi0 a1msqir _16v7pfz3"" style=""--_16v7pfz2:2"">$100,000 – $120,000 + super</span></span></div></div>]",2024-01-24,Design-architecture - None,08/02/2024
140,https://www.seek.com.au//job/73165869?type=standout&ref=search-standalone,design architecture,Architecture,Associate / Project Lead,Architectus Group Pty Ltd,-,140000.0,142500.0,145000.0,Perth WA,Bring your strong design and delivery skills coupled with client-facing experience to deliver large-scale Infrastructure projects for Architectus,"[<div class=""_1wkzzau0 a1msqi6m""><span class=""_1wkzzau0 a1msqi4y lnocuo0 lnocuo1 lnocuo21 _1d0g9qk4 lnocuo7""><a aria-label=""Limit results to Perth WA"" class=""_1wkzzau0 _1wkzzauf _1wkzzau0 _1wkzzauf _842p0a0 _842p0a2"" data-automation=""jobLocation"" href=""/jobs-in-design-architecture/in-All-Perth-WA?salarytype=annual&amp;salaryrange=140000-145000"" rel=""nofollow"" tabindex=""-1"" target=""_self"" title=""Limit results to Perth WA"">Perth WA</a></span></div>]",2024-01-19,Design-architecture - None,08/02/2024
141,https://www.seek.com.au//job/73447323?type=standout&ref=search-standalone,design architecture,Fashion & Textile Design,"AXL + CO by CONNOR BRAND DESIGNER, SYDNEY",CONNOR CLOTHING,-,140000.0,142500.0,145000.0,Sydney NSW,AXL + CO by Connor is a new fashion & value brand and we are looking for an experienced and talented Brand Designer to join the team!,"[<div class=""_1wkzzau0 a1msqi6m""><span class=""_1wkzzau0 a1msqi4y lnocuo0 lnocuo1 lnocuo21 _1d0g9qk4 lnocuo7""><a aria-label=""Limit results to Waterloo"" class=""_1wkzzau0 _1wkzzauf _1wkzzau0 _1wkzzauf _842p0a0 _842p0a2"" data-automation=""jobLocation"" href=""/jobs-in-design-architecture/in-Waterloo-NSW-2017?salarytype=annual&amp;salaryrange=140000-145000"" rel=""nofollow"" tabindex=""-1"" target=""_self"" title=""Limit results to Waterloo"">Waterloo</a>, <a aria-label=""Limit results to Sydney NSW"" class=""_1wkzzau0 _1wkzzauf _1wkzzau0 _1wkzzauf _842p0a0 _842p0a2"" data-automation=""jobLocation"" href=""/jobs-in-design-architecture/in-All-Sydney-NSW?salarytype=annual&amp;salaryrange=140000-145000"" rel=""nofollow"" tabindex=""-1"" target=""_self"" title=""Limit results to Sydney NSW"">Sydney NSW</a></span></div>]",2024-02-01,Design-architecture - None,08/02/2024
142,https://www.seek.com.au//job/73015075?type=standard&ref=search-standalone,design architecture,Other,ESD Consultant,TRG,-,140000.0,142500.0,145000.0,Sydney NSW,"TRG is well-established business with a legacy of over 30 years, specialising in retail and commercial project is looking for an ESD Consultant.","[<div class=""_1wkzzau0 a1msqi6m""><span class=""_1wkzzau0 a1msqi4y lnocuo0 lnocuo1 lnocuo21 _1d0g9qk4 lnocuo7""><a aria-label=""Limit results to Macquarie Park"" class=""_1wkzzau0 _1wkzzauf _1wkzzau0 _1wkzzauf _842p0a0 _842p0a2"" data-automation=""jobLocation"" href=""/jobs-in-design-architecture/in-Macquarie-Park-NSW-2113?salarytype=annual&amp;salaryrange=140000-145000"" rel=""nofollow"" tabindex=""-1"" target=""_self"" title=""Limit results to Macquarie Park"">Macquarie Park</a>, <a aria-label=""Limit results to Sydney NSW"" class=""_1wkzzau0 _1wkzzauf _1wkzzau0 _1wkzzauf _842p0a0 _842p0a2"" data-automation=""jobLocation"" href=""/jobs-in-design-architecture/in-All-Sydney-NSW?salarytype=annual&amp;salaryrange=140000-145000"" rel=""nofollow"" tabindex=""-1"" target=""_self"" title=""Limit results to Sydney NSW"">Sydney NSW</a></span></div>]",2024-01-15,Design-architecture - None,08/02/2024
