,link,classification,category,title,company,salary,min_salary,average_salary,max_salary,location,description,entireDiv,date_posted,Category,Date
64,https://www.seek.com.au//job/73077382?type=standout&ref=search-standalone,retail consumer products,Planning,Merchandise Planning Manager,Super Retail Group,-,160000.0,162500.0,165000.0,Brisbane QLD,"Excellent opportunity to join a highly successful business in a key leadership role, where you will make an immediate contribution.","[<div class=""_1wkzzau0 a1msqi6m""><span class=""_1wkzzau0 a1msqi4y lnocuo0 lnocuo1 lnocuo21 _1d0g9qk4 lnocuo7""><a aria-label=""Limit results to Strathpine"" class=""_1wkzzau0 _1wkzzauf _1wkzzau0 _1wkzzauf _842p0a0 _842p0a2"" data-automation=""jobLocation"" href=""/jobs-in-retail-consumer-products/in-Strathpine-QLD-4500?salarytype=annual&amp;salaryrange=160000-165000"" rel=""nofollow"" tabindex=""-1"" target=""_self"" title=""Limit results to Strathpine"">Strathpine</a>, <a aria-label=""Limit results to Brisbane QLD"" class=""_1wkzzau0 _1wkzzauf _1wkzzau0 _1wkzzauf _842p0a0 _842p0a2"" data-automation=""jobLocation"" href=""/jobs-in-retail-consumer-products/in-All-Brisbane-QLD?salarytype=annual&amp;salaryrange=160000-165000"" rel=""nofollow"" tabindex=""-1"" target=""_self"" title=""Limit results to Brisbane QLD"">Brisbane QLD</a></span></div>]",2024-01-17,Retail-consumer-products - None,08/02/2024
65,https://www.seek.com.au//job/73266127?type=standard&ref=search-standalone,retail consumer products,Buying,Senior Buyer,TSHR - Trak and Scarlett,$130k - $150k p.a.,130000.0,140000.0,150000.0,Sydney NSW,Our client is looking for an experienced Senior Menswear Buyer to join their thriving and buzzing team!,"[<div class=""_1wkzzau0 a1msqi6m""><span class=""_1wkzzau0 a1msqi4y lnocuo0 lnocuo1 lnocuo21 _1d0g9qk4 lnocuo7""><a aria-label=""Limit results to Zetland"" class=""_1wkzzau0 _1wkzzauf _1wkzzau0 _1wkzzauf _842p0a0 _842p0a2"" data-automation=""jobLocation"" href=""/jobs-in-retail-consumer-products/in-Zetland-NSW-2017?salarytype=annual&amp;salaryrange=160000-165000"" rel=""nofollow"" tabindex=""-1"" target=""_self"" title=""Limit results to Zetland"">Zetland</a>, <a aria-label=""Limit results to Sydney NSW"" class=""_1wkzzau0 _1wkzzauf _1wkzzau0 _1wkzzauf _842p0a0 _842p0a2"" data-automation=""jobLocation"" href=""/jobs-in-retail-consumer-products/in-All-Sydney-NSW?salarytype=annual&amp;salaryrange=160000-165000"" rel=""nofollow"" tabindex=""-1"" target=""_self"" title=""Limit results to Sydney NSW"">Sydney NSW</a></span></div>, <div class=""_1wkzzau0 a1msqi6m""><div aria-label=""Salary: $130k - $150k p.a."" class=""_1wkzzau0""><span class=""_1wkzzau0 a1msqi4y lnocuo0 lnocuo1 lnocuo21 _1d0g9qk4 lnocuo7"" data-automation=""jobSalary""><span class=""_1wkzzau0 _16v7pfz1 a1msqi4y a1msqi0 a1msqir _16v7pfz3"" style=""--_16v7pfz2:2"">$130k - $150k p.a.</span></span></div></div>]",2024-01-24,Retail-consumer-products - None,08/02/2024
66,https://www.seek.com.au//job/73379673?type=promoted&ref=search-standalone,retail consumer products,Management - Area/Multi-site,Head of Retail,Chempro,-,160000.0,162500.0,165000.0,Gold Coast QLD,Join the Gold Coasts leading pharmacy group!,"[<div class=""_1wkzzau0 a1msqi6m""><span class=""_1wkzzau0 a1msqi4y lnocuo0 lnocuo1 lnocuo21 _1d0g9qk4 lnocuo7""><a aria-label=""Limit results to Molendinar"" class=""_1wkzzau0 _1wkzzauf _1wkzzau0 _1wkzzauf _842p0a0 _842p0a2"" data-automation=""jobLocation"" href=""/jobs-in-retail-consumer-products/in-Molendinar-QLD-4214?salarytype=annual&amp;salaryrange=160000-165000"" rel=""nofollow"" tabindex=""-1"" target=""_self"" title=""Limit results to Molendinar"">Molendinar</a>, <a aria-label=""Limit results to Gold Coast QLD"" class=""_1wkzzau0 _1wkzzauf _1wkzzau0 _1wkzzauf _842p0a0 _842p0a2"" data-automation=""jobLocation"" href=""/jobs-in-retail-consumer-products/in-All-Gold-Coast-QLD?salarytype=annual&amp;salaryrange=160000-165000"" rel=""nofollow"" tabindex=""-1"" target=""_self"" title=""Limit results to Gold Coast QLD"">Gold Coast QLD</a></span></div>]",,Retail-consumer-products - None,08/02/2024
67,https://www.seek.com.au//job/72935424?type=promoted&ref=search-standalone,retail consumer products,Buying,Vehicle Buyer/Wholesaler,Alto Group,-,160000.0,162500.0,165000.0,Sydney NSW,The Alto Group is a family-owned and operated organization with over 700 employees and has been serving the motoring needs of the local community.,"[<div class=""_1wkzzau0 a1msqi6m""><span class=""_1wkzzau0 a1msqi4y lnocuo0 lnocuo1 lnocuo21 _1d0g9qk4 lnocuo7""><a aria-label=""Limit results to Artarmon"" class=""_1wkzzau0 _1wkzzauf _1wkzzau0 _1wkzzauf _842p0a0 _842p0a2"" data-automation=""jobLocation"" href=""/jobs-in-retail-consumer-products/in-Artarmon-NSW-2064?salarytype=annual&amp;salaryrange=160000-165000"" rel=""nofollow"" tabindex=""-1"" target=""_self"" title=""Limit results to Artarmon"">Artarmon</a>, <a aria-label=""Limit results to Sydney NSW"" class=""_1wkzzau0 _1wkzzauf _1wkzzau0 _1wkzzauf _842p0a0 _842p0a2"" data-automation=""jobLocation"" href=""/jobs-in-retail-consumer-products/in-All-Sydney-NSW?salarytype=annual&amp;salaryrange=160000-165000"" rel=""nofollow"" tabindex=""-1"" target=""_self"" title=""Limit results to Sydney NSW"">Sydney NSW</a></span></div>]",,Retail-consumer-products - None,08/02/2024
68,https://www.seek.com.au//job/73026751?type=standout&ref=search-standalone,retail consumer products,Management - Store,Store Manager,Dyson Appliances (Aust.) Pty Ltd,-,160000.0,162500.0,165000.0,Sydney NSW,"We’re growing fast and our ambition is huge – more categories, more locations and more people.","[<div class=""_1wkzzau0 a1msqi6m""><span class=""_1wkzzau0 a1msqi4y lnocuo0 lnocuo1 lnocuo21 _1d0g9qk4 lnocuo7""><a aria-label=""Limit results to Sydney NSW"" class=""_1wkzzau0 _1wkzzauf _1wkzzau0 _1wkzzauf _842p0a0 _842p0a2"" data-automation=""jobLocation"" href=""/jobs-in-retail-consumer-products/in-All-Sydney-NSW?salarytype=annual&amp;salaryrange=160000-165000"" rel=""nofollow"" tabindex=""-1"" target=""_self"" title=""Limit results to Sydney NSW"">Sydney NSW</a></span></div>]",2024-01-15,Retail-consumer-products - None,08/02/2024
69,https://www.seek.com.au//job/73388869?type=standard&ref=search-standalone,retail consumer products,Planning,Space Planner Repco - Rowville,Repco Australia - A Division of GPC Asia Pacific,Stability + Growth + Generous Staff Discounts,160000.0,162500.0,165000.0,Melbourne VIC,"An exciting new opportunity to join Repco, and make your mark, as a Space Planner, with flexibility on base location.","[<div class=""_1wkzzau0 a1msqi6m""><span class=""_1wkzzau0 a1msqi4y lnocuo0 lnocuo1 lnocuo21 _1d0g9qk4 lnocuo7""><a aria-label=""Limit results to Rowville"" class=""_1wkzzau0 _1wkzzauf _1wkzzau0 _1wkzzauf _842p0a0 _842p0a2"" data-automation=""jobLocation"" href=""/jobs-in-retail-consumer-products/in-Rowville-VIC-3178?salarytype=annual&amp;salaryrange=160000-165000"" rel=""nofollow"" tabindex=""-1"" target=""_self"" title=""Limit results to Rowville"">Rowville</a>, <a aria-label=""Limit results to Melbourne VIC"" class=""_1wkzzau0 _1wkzzauf _1wkzzau0 _1wkzzauf _842p0a0 _842p0a2"" data-automation=""jobLocation"" href=""/jobs-in-retail-consumer-products/in-All-Melbourne-VIC?salarytype=annual&amp;salaryrange=160000-165000"" rel=""nofollow"" tabindex=""-1"" target=""_self"" title=""Limit results to Melbourne VIC"">Melbourne VIC</a></span></div>, <div class=""_1wkzzau0 a1msqi6m""><div aria-label=""Salary: Stability + Growth + Generous Staff Discounts"" class=""_1wkzzau0""><span class=""_1wkzzau0 a1msqi4y lnocuo0 lnocuo1 lnocuo21 _1d0g9qk4 lnocuo7"" data-automation=""jobSalary""><span class=""_1wkzzau0 _16v7pfz1 a1msqi4y a1msqi0 a1msqir _16v7pfz3"" style=""--_16v7pfz2:2"">Stability + Growth + Generous Staff Discounts</span></span></div></div>]",2024-01-30,Retail-consumer-products - None,08/02/2024
70,https://www.seek.com.au//job/73080785?type=standout&ref=search-standalone,retail consumer products,Other,Strategy Manager 2IC,Morgan McKinley,$180k - $200k p.a. + + superannuation,180000.0,190000.0,200000.0,Sydney NSW,Exciting opportunity to join a leading Australian retailer and report directly to the Chief Strategy Officer to establish the strategic program.,"[<div class=""_1wkzzau0 a1msqi6m""><span class=""_1wkzzau0 a1msqi4y lnocuo0 lnocuo1 lnocuo21 _1d0g9qk4 lnocuo7""><a aria-label=""Limit results to Sydney NSW"" class=""_1wkzzau0 _1wkzzauf _1wkzzau0 _1wkzzauf _842p0a0 _842p0a2"" data-automation=""jobLocation"" href=""/jobs-in-retail-consumer-products/in-All-Sydney-NSW?salarytype=annual&amp;salaryrange=160000-165000"" rel=""nofollow"" tabindex=""-1"" target=""_self"" title=""Limit results to Sydney NSW"">Sydney NSW</a></span></div>, <div class=""_1wkzzau0 a1msqi6m""><div aria-label=""Salary: $180k - $200k p.a. + + superannuation"" class=""_1wkzzau0""><span class=""_1wkzzau0 a1msqi4y lnocuo0 lnocuo1 lnocuo21 _1d0g9qk4 lnocuo7"" data-automation=""jobSalary""><span class=""_1wkzzau0 _16v7pfz1 a1msqi4y a1msqi0 a1msqir _16v7pfz3"" style=""--_16v7pfz2:2"">$180k - $200k p.a. + + superannuation</span></span></div></div>]",2024-01-17,Retail-consumer-products - None,08/02/2024
71,https://www.seek.com.au//job/73417601?type=standout&ref=search-standalone,retail consumer products,Other,Product Development Manager-(Footwear and Leather accessories),Jo Mercer,-,160000.0,162500.0,165000.0,Melbourne VIC,First time offered in over 10 years so don't miss this opportunity to join our Premium leather business to further enhance our product range..,"[<div class=""_1wkzzau0 a1msqi6m""><span class=""_1wkzzau0 a1msqi4y lnocuo0 lnocuo1 lnocuo21 _1d0g9qk4 lnocuo7""><a aria-label=""Limit results to South Yarra"" class=""_1wkzzau0 _1wkzzauf _1wkzzau0 _1wkzzauf _842p0a0 _842p0a2"" data-automation=""jobLocation"" href=""/jobs-in-retail-consumer-products/in-South-Yarra-VIC-3141?salarytype=annual&amp;salaryrange=160000-165000"" rel=""nofollow"" tabindex=""-1"" target=""_self"" title=""Limit results to South Yarra"">South Yarra</a>, <a aria-label=""Limit results to Melbourne VIC"" class=""_1wkzzau0 _1wkzzauf _1wkzzau0 _1wkzzauf _842p0a0 _842p0a2"" data-automation=""jobLocation"" href=""/jobs-in-retail-consumer-products/in-All-Melbourne-VIC?salarytype=annual&amp;salaryrange=160000-165000"" rel=""nofollow"" tabindex=""-1"" target=""_self"" title=""Limit results to Melbourne VIC"">Melbourne VIC</a></span></div>]",2024-01-31,Retail-consumer-products - None,08/02/2024
72,https://www.seek.com.au//job/73052732?type=standout&ref=search-standalone,retail consumer products,Other,Process Improvement Manager,Compass Group,Annual salary + yearly incentive bones,160000.0,162500.0,165000.0,Sydney NSW,Drive outstanding performance within our FoodBuy business by analysing and streamlining processes,"[<div class=""_1wkzzau0 a1msqi6m""><span class=""_1wkzzau0 a1msqi4y lnocuo0 lnocuo1 lnocuo21 _1d0g9qk4 lnocuo7""><a aria-label=""Limit results to Sydney NSW"" class=""_1wkzzau0 _1wkzzauf _1wkzzau0 _1wkzzauf _842p0a0 _842p0a2"" data-automation=""jobLocation"" href=""/jobs-in-retail-consumer-products/in-All-Sydney-NSW?salarytype=annual&amp;salaryrange=160000-165000"" rel=""nofollow"" tabindex=""-1"" target=""_self"" title=""Limit results to Sydney NSW"">Sydney NSW</a></span></div>, <div class=""_1wkzzau0 a1msqi6m""><div aria-label=""Salary: Annual salary + yearly incentive bones"" class=""_1wkzzau0""><span class=""_1wkzzau0 a1msqi4y lnocuo0 lnocuo1 lnocuo21 _1d0g9qk4 lnocuo7"" data-automation=""jobSalary""><span class=""_1wkzzau0 _16v7pfz1 a1msqi4y a1msqi0 a1msqir _16v7pfz3"" style=""--_16v7pfz2:2"">Annual salary + yearly incentive bones</span></span></div></div>]",2024-01-16,Retail-consumer-products - None,08/02/2024
73,https://www.seek.com.au//job/73153906?type=standout&ref=search-standalone,retail consumer products,Planning,Sales Planning Manager,Woolworths Group,-,160000.0,162500.0,165000.0,Sydney NSW,We are looking for a Sales Planning Manager to join on Sydney based Replenishment team.,"[<div class=""_1wkzzau0 a1msqi6m""><span class=""_1wkzzau0 a1msqi4y lnocuo0 lnocuo1 lnocuo21 _1d0g9qk4 lnocuo7""><a aria-label=""Limit results to Norwest"" class=""_1wkzzau0 _1wkzzauf _1wkzzau0 _1wkzzauf _842p0a0 _842p0a2"" data-automation=""jobLocation"" href=""/jobs-in-retail-consumer-products/in-Norwest-NSW-2153?salarytype=annual&amp;salaryrange=160000-165000"" rel=""nofollow"" tabindex=""-1"" target=""_self"" title=""Limit results to Norwest"">Norwest</a>, <a aria-label=""Limit results to Sydney NSW"" class=""_1wkzzau0 _1wkzzauf _1wkzzau0 _1wkzzauf _842p0a0 _842p0a2"" data-automation=""jobLocation"" href=""/jobs-in-retail-consumer-products/in-All-Sydney-NSW?salarytype=annual&amp;salaryrange=160000-165000"" rel=""nofollow"" tabindex=""-1"" target=""_self"" title=""Limit results to Sydney NSW"">Sydney NSW</a></span></div>]",2024-01-19,Retail-consumer-products - None,08/02/2024
74,https://www.seek.com.au//job/72886184?type=standard&ref=search-standalone,retail consumer products,Buying,FMCG Buyer,Frontline Executive Retail Sydney,$140k - $150k p.a.,140000.0,145000.0,150000.0,Sydney NSW,"Importance of Retail FMCG Buying experience, good knowledge of customer, operations plan/execution and supplier engagement, rebates.","[<div class=""_1wkzzau0 a1msqi6m""><span class=""_1wkzzau0 a1msqi4y lnocuo0 lnocuo1 lnocuo21 _1d0g9qk4 lnocuo7""><a aria-label=""Limit results to Sydney NSW"" class=""_1wkzzau0 _1wkzzauf _1wkzzau0 _1wkzzauf _842p0a0 _842p0a2"" data-automation=""jobLocation"" href=""/jobs-in-retail-consumer-products/in-All-Sydney-NSW?salarytype=annual&amp;salaryrange=160000-165000"" rel=""nofollow"" tabindex=""-1"" target=""_self"" title=""Limit results to Sydney NSW"">Sydney NSW</a></span></div>, <div class=""_1wkzzau0 a1msqi6m""><div aria-label=""Salary: $140k - $150k p.a."" class=""_1wkzzau0""><span class=""_1wkzzau0 a1msqi4y lnocuo0 lnocuo1 lnocuo21 _1d0g9qk4 lnocuo7"" data-automation=""jobSalary""><span class=""_1wkzzau0 _16v7pfz1 a1msqi4y a1msqi0 a1msqir _16v7pfz3"" style=""--_16v7pfz2:2"">$140k - $150k p.a.</span></span></div></div>]",2024-01-10,Retail-consumer-products - None,08/02/2024
75,https://www.seek.com.au//job/73245986?type=standard&ref=search-standalone,retail consumer products,Planning,Senior Merchandise Planner,Planning Talent,-,160000.0,162500.0,165000.0,Melbourne VIC,"Looking for a change, challenge or to broaden your experience? This will increase your diversity of experience & skill within the retail environment.","[<div class=""_1wkzzau0 a1msqi6m""><span class=""_1wkzzau0 a1msqi4y lnocuo0 lnocuo1 lnocuo21 _1d0g9qk4 lnocuo7""><a aria-label=""Limit results to Melbourne VIC"" class=""_1wkzzau0 _1wkzzauf _1wkzzau0 _1wkzzauf _842p0a0 _842p0a2"" data-automation=""jobLocation"" href=""/jobs-in-retail-consumer-products/in-All-Melbourne-VIC?salarytype=annual&amp;salaryrange=160000-165000"" rel=""nofollow"" tabindex=""-1"" target=""_self"" title=""Limit results to Melbourne VIC"">Melbourne VIC</a></span></div>]",2024-01-23,Retail-consumer-products - None,08/02/2024
76,https://www.seek.com.au//job/72927433?type=standout&ref=search-standalone,retail consumer products,Buying,"Buyer - Womens Sleep, Socks & Hosiery",Target Australia Pty Ltd,-,160000.0,162500.0,165000.0,Melbourne VIC,"Buyer will be responsible for building & trading a department range/business group that delivers the strategy, vision & KPI's.","[<div class=""_1wkzzau0 a1msqi6m""><span class=""_1wkzzau0 a1msqi4y lnocuo0 lnocuo1 lnocuo21 _1d0g9qk4 lnocuo7""><a aria-label=""Limit results to Williams Landing"" class=""_1wkzzau0 _1wkzzauf _1wkzzau0 _1wkzzauf _842p0a0 _842p0a2"" data-automation=""jobLocation"" href=""/jobs-in-retail-consumer-products/in-Williams-Landing-VIC-3027?salarytype=annual&amp;salaryrange=160000-165000"" rel=""nofollow"" tabindex=""-1"" target=""_self"" title=""Limit results to Williams Landing"">Williams Landing</a>, <a aria-label=""Limit results to Melbourne VIC"" class=""_1wkzzau0 _1wkzzauf _1wkzzau0 _1wkzzauf _842p0a0 _842p0a2"" data-automation=""jobLocation"" href=""/jobs-in-retail-consumer-products/in-All-Melbourne-VIC?salarytype=annual&amp;salaryrange=160000-165000"" rel=""nofollow"" tabindex=""-1"" target=""_self"" title=""Limit results to Melbourne VIC"">Melbourne VIC</a></span></div>]",2024-01-11,Retail-consumer-products - None,08/02/2024
77,https://www.seek.com.au//job/72969689?type=standout&ref=search-standalone,retail consumer products,Buying,Buyer,Best & Less,-,160000.0,162500.0,165000.0,Sydney NSW,"Based at our National Support Office in Rhodes, we are seeking a strong Buyer with experience in Baby wear","[<div class=""_1wkzzau0 a1msqi6m""><span class=""_1wkzzau0 a1msqi4y lnocuo0 lnocuo1 lnocuo21 _1d0g9qk4 lnocuo7""><a aria-label=""Limit results to Rhodes"" class=""_1wkzzau0 _1wkzzauf _1wkzzau0 _1wkzzauf _842p0a0 _842p0a2"" data-automation=""jobLocation"" href=""/jobs-in-retail-consumer-products/in-Rhodes-NSW-2138?salarytype=annual&amp;salaryrange=160000-165000"" rel=""nofollow"" tabindex=""-1"" target=""_self"" title=""Limit results to Rhodes"">Rhodes</a>, <a aria-label=""Limit results to Sydney NSW"" class=""_1wkzzau0 _1wkzzauf _1wkzzau0 _1wkzzauf _842p0a0 _842p0a2"" data-automation=""jobLocation"" href=""/jobs-in-retail-consumer-products/in-All-Sydney-NSW?salarytype=annual&amp;salaryrange=160000-165000"" rel=""nofollow"" tabindex=""-1"" target=""_self"" title=""Limit results to Sydney NSW"">Sydney NSW</a></span></div>]",2024-01-12,Retail-consumer-products - None,08/02/2024
78,https://www.seek.com.au//job/73353137?type=standard&ref=search-standalone,retail consumer products,Planning,Senior Merchandise Planner,JIVARO recruitment,-,160000.0,162500.0,165000.0,Melbourne VIC,JIVARO are looking for an experienced Senior Merchandise Planner to join a well-established retailer based in Melbourne.,"[<div class=""_1wkzzau0 a1msqi6m""><span class=""_1wkzzau0 a1msqi4y lnocuo0 lnocuo1 lnocuo21 _1d0g9qk4 lnocuo7""><a aria-label=""Limit results to Melbourne VIC"" class=""_1wkzzau0 _1wkzzauf _1wkzzau0 _1wkzzauf _842p0a0 _842p0a2"" data-automation=""jobLocation"" href=""/jobs-in-retail-consumer-products/in-All-Melbourne-VIC?salarytype=annual&amp;salaryrange=160000-165000"" rel=""nofollow"" tabindex=""-1"" target=""_self"" title=""Limit results to Melbourne VIC"">Melbourne VIC</a></span></div>]",2024-01-29,Retail-consumer-products - None,08/02/2024
79,https://www.seek.com.au//job/72880156?type=standout&ref=search-standalone,retail consumer products,Buying,Buyer,WH Smith Australia,-,160000.0,162500.0,165000.0,Sydney NSW,"Are you a master of the marketplace, with a keen eye for spotting the next big thing? If so, we want you on our team!","[<div class=""_1wkzzau0 a1msqi6m""><span class=""_1wkzzau0 a1msqi4y lnocuo0 lnocuo1 lnocuo21 _1d0g9qk4 lnocuo7""><a aria-label=""Limit results to Woolloomooloo"" class=""_1wkzzau0 _1wkzzauf _1wkzzau0 _1wkzzauf _842p0a0 _842p0a2"" data-automation=""jobLocation"" href=""/jobs-in-retail-consumer-products/in-Woolloomooloo-NSW-2011?salarytype=annual&amp;salaryrange=160000-165000"" rel=""nofollow"" tabindex=""-1"" target=""_self"" title=""Limit results to Woolloomooloo"">Woolloomooloo</a>, <a aria-label=""Limit results to Sydney NSW"" class=""_1wkzzau0 _1wkzzauf _1wkzzau0 _1wkzzauf _842p0a0 _842p0a2"" data-automation=""jobLocation"" href=""/jobs-in-retail-consumer-products/in-All-Sydney-NSW?salarytype=annual&amp;salaryrange=160000-165000"" rel=""nofollow"" tabindex=""-1"" target=""_self"" title=""Limit results to Sydney NSW"">Sydney NSW</a></span></div>]",2024-01-10,Retail-consumer-products - None,08/02/2024
80,https://www.seek.com.au//job/73102397?type=standout&ref=search-standalone,retail consumer products,Buying,Category Manager - Skincare,Priceline Pty Ltd,-,160000.0,162500.0,165000.0,Melbourne VIC,Lead and oversee one of our largest and most influential category portfolios,"[<div class=""_1wkzzau0 a1msqi6m""><span class=""_1wkzzau0 a1msqi4y lnocuo0 lnocuo1 lnocuo21 _1d0g9qk4 lnocuo7""><a aria-label=""Limit results to Docklands"" class=""_1wkzzau0 _1wkzzauf _1wkzzau0 _1wkzzauf _842p0a0 _842p0a2"" data-automation=""jobLocation"" href=""/jobs-in-retail-consumer-products/in-Docklands-VIC-3008?salarytype=annual&amp;salaryrange=160000-165000"" rel=""nofollow"" tabindex=""-1"" target=""_self"" title=""Limit results to Docklands"">Docklands</a>, <a aria-label=""Limit results to Melbourne VIC"" class=""_1wkzzau0 _1wkzzauf _1wkzzau0 _1wkzzauf _842p0a0 _842p0a2"" data-automation=""jobLocation"" href=""/jobs-in-retail-consumer-products/in-All-Melbourne-VIC?salarytype=annual&amp;salaryrange=160000-165000"" rel=""nofollow"" tabindex=""-1"" target=""_self"" title=""Limit results to Melbourne VIC"">Melbourne VIC</a></span></div>]",2024-01-18,Retail-consumer-products - None,08/02/2024
81,https://www.seek.com.au//job/72923162?type=standout&ref=search-standalone,retail consumer products,Planning,Planning & Purchasing Manager,New Balance Australia Pty Ltd,-,160000.0,162500.0,165000.0,Melbourne VIC,Seeking an experienced Planning & Purchasing Manager to join our Head Office team based in Cheltenham.,"[<div class=""_1wkzzau0 a1msqi6m""><span class=""_1wkzzau0 a1msqi4y lnocuo0 lnocuo1 lnocuo21 _1d0g9qk4 lnocuo7""><a aria-label=""Limit results to Cheltenham"" class=""_1wkzzau0 _1wkzzauf _1wkzzau0 _1wkzzauf _842p0a0 _842p0a2"" data-automation=""jobLocation"" href=""/jobs-in-retail-consumer-products/in-Cheltenham-VIC-3192?salarytype=annual&amp;salaryrange=160000-165000"" rel=""nofollow"" tabindex=""-1"" target=""_self"" title=""Limit results to Cheltenham"">Cheltenham</a>, <a aria-label=""Limit results to Melbourne VIC"" class=""_1wkzzau0 _1wkzzauf _1wkzzau0 _1wkzzauf _842p0a0 _842p0a2"" data-automation=""jobLocation"" href=""/jobs-in-retail-consumer-products/in-All-Melbourne-VIC?salarytype=annual&amp;salaryrange=160000-165000"" rel=""nofollow"" tabindex=""-1"" target=""_self"" title=""Limit results to Melbourne VIC"">Melbourne VIC</a></span></div>]",2024-01-11,Retail-consumer-products - None,08/02/2024
82,https://www.seek.com.au//job/73279156?type=standard&ref=search-standalone,retail consumer products,Planning,Senior Planner,JIVARO recruitment,-,160000.0,162500.0,165000.0,Sydney NSW,"Reporting into the Head of Planning, join a well-established, market leading retailer to help drive the strategic vision.","[<div class=""_1wkzzau0 a1msqi6m""><span class=""_1wkzzau0 a1msqi4y lnocuo0 lnocuo1 lnocuo21 _1d0g9qk4 lnocuo7""><a aria-label=""Limit results to Sydney NSW"" class=""_1wkzzau0 _1wkzzauf _1wkzzau0 _1wkzzauf _842p0a0 _842p0a2"" data-automation=""jobLocation"" href=""/jobs-in-retail-consumer-products/in-All-Sydney-NSW?salarytype=annual&amp;salaryrange=160000-165000"" rel=""nofollow"" tabindex=""-1"" target=""_self"" title=""Limit results to Sydney NSW"">Sydney NSW</a></span></div>]",2024-01-24,Retail-consumer-products - None,08/02/2024
83,https://www.seek.com.au//job/72940698?type=standout&ref=search-standalone,retail consumer products,Planning,Merchandise Planner - Girls 1-8,Target Australia Pty Ltd,-,160000.0,162500.0,165000.0,Melbourne VIC,Make an impact across our stores and the wider merchandise team through superior planning skills of our inventory.,"[<div class=""_1wkzzau0 a1msqi6m""><span class=""_1wkzzau0 a1msqi4y lnocuo0 lnocuo1 lnocuo21 _1d0g9qk4 lnocuo7""><a aria-label=""Limit results to Williams Landing"" class=""_1wkzzau0 _1wkzzauf _1wkzzau0 _1wkzzauf _842p0a0 _842p0a2"" data-automation=""jobLocation"" href=""/jobs-in-retail-consumer-products/in-Williams-Landing-VIC-3027?salarytype=annual&amp;salaryrange=160000-165000"" rel=""nofollow"" tabindex=""-1"" target=""_self"" title=""Limit results to Williams Landing"">Williams Landing</a>, <a aria-label=""Limit results to Melbourne VIC"" class=""_1wkzzau0 _1wkzzauf _1wkzzau0 _1wkzzauf _842p0a0 _842p0a2"" data-automation=""jobLocation"" href=""/jobs-in-retail-consumer-products/in-All-Melbourne-VIC?salarytype=annual&amp;salaryrange=160000-165000"" rel=""nofollow"" tabindex=""-1"" target=""_self"" title=""Limit results to Melbourne VIC"">Melbourne VIC</a></span></div>]",2024-01-11,Retail-consumer-products - None,08/02/2024
84,https://www.seek.com.au//job/72935424?type=standout&ref=search-standalone,retail consumer products,Buying,Vehicle Buyer/Wholesaler,Alto Group,-,160000.0,162500.0,165000.0,Sydney NSW,The Alto Group is a family-owned and operated organization with over 700 employees and has been serving the motoring needs of the local community.,"[<div class=""_1wkzzau0 a1msqi6m""><span class=""_1wkzzau0 a1msqi4y lnocuo0 lnocuo1 lnocuo21 _1d0g9qk4 lnocuo7""><a aria-label=""Limit results to Artarmon"" class=""_1wkzzau0 _1wkzzauf _1wkzzau0 _1wkzzauf _842p0a0 _842p0a2"" data-automation=""jobLocation"" href=""/jobs-in-retail-consumer-products/in-Artarmon-NSW-2064?salarytype=annual&amp;salaryrange=160000-165000"" rel=""nofollow"" tabindex=""-1"" target=""_self"" title=""Limit results to Artarmon"">Artarmon</a>, <a aria-label=""Limit results to Sydney NSW"" class=""_1wkzzau0 _1wkzzauf _1wkzzau0 _1wkzzauf _842p0a0 _842p0a2"" data-automation=""jobLocation"" href=""/jobs-in-retail-consumer-products/in-All-Sydney-NSW?salarytype=annual&amp;salaryrange=160000-165000"" rel=""nofollow"" tabindex=""-1"" target=""_self"" title=""Limit results to Sydney NSW"">Sydney NSW</a></span></div>]",2024-01-11,Retail-consumer-products - None,08/02/2024
