,link,classification,category,title,company,salary,min_salary,average_salary,max_salary,location,description,entireDiv,date_posted,Category,Date
82,https://www.seek.com.au//job/73525558?type=standard&ref=search-standalone,real estate property,Body Corporate & Facilities Management,General Manager,Design & Build,-,245000.0,247500.0,250000.0,Sydney NSW,Undoubtedly one of the most exciting Strata roles in the market - Lead a team of Strata professionals to raise the bar in service delivery to clients,"[<div class=""_1wkzzau0 a1msqi6m""><span class=""_1wkzzau0 a1msqi4y lnocuo0 lnocuo1 lnocuo21 _1d0g9qk4 lnocuo7""><a aria-label=""Limit results to Sydney NSW"" class=""_1wkzzau0 _1wkzzauf _1wkzzau0 _1wkzzauf _842p0a0 _842p0a2"" data-automation=""jobLocation"" href=""/jobs-in-real-estate-property/in-All-Sydney-NSW?salarytype=annual&amp;salaryrange=245000-250000"" rel=""nofollow"" tabindex=""-1"" target=""_self"" title=""Limit results to Sydney NSW"">Sydney NSW</a></span></div>]",2024-02-05,Real-estate-property - None,08/02/2024
83,https://www.seek.com.au//job/73201361?type=standard&ref=search-standalone,real estate property,Retail & Property Development,Acquisitions Manager,Allura Partners,$230-275K package + bonus,55200.0,152600.0,250000.0,Sydney NSW,Large Property Group are looking for an Acquisitions Manager to join them on a permanent basis. High Growth trajectory and an active role.,"[<div class=""_1wkzzau0 a1msqi6m""><span class=""_1wkzzau0 a1msqi4y lnocuo0 lnocuo1 lnocuo21 _1d0g9qk4 lnocuo7""><a aria-label=""Limit results to Sydney NSW"" class=""_1wkzzau0 _1wkzzauf _1wkzzau0 _1wkzzauf _842p0a0 _842p0a2"" data-automation=""jobLocation"" href=""/jobs-in-real-estate-property/in-All-Sydney-NSW?salarytype=annual&amp;salaryrange=245000-250000"" rel=""nofollow"" tabindex=""-1"" target=""_self"" title=""Limit results to Sydney NSW"">Sydney NSW</a></span></div>, <div class=""_1wkzzau0 a1msqi6m""><div aria-label=""Salary: $230-275K package + bonus"" class=""_1wkzzau0""><span class=""_1wkzzau0 a1msqi4y lnocuo0 lnocuo1 lnocuo21 _1d0g9qk4 lnocuo7"" data-automation=""jobSalary""><span class=""_1wkzzau0 _16v7pfz1 a1msqi4y a1msqi0 a1msqir _16v7pfz3"" style=""--_16v7pfz2:2"">$230-275K package + bonus</span></span></div></div>]",2024-01-22,Real-estate-property - None,08/02/2024
84,https://www.seek.com.au//job/73454364?type=standard&ref=search-standalone,real estate property,Retail & Property Development,Senior Development Manager - Land Subdivision,Design & Build,$200k - $230k,200000.0,215000.0,230000.0,Sydney NSW,"Senior Development Manager needed for a large medium density developer to run multiple land sites from design, construction to handover.","[<div class=""_1wkzzau0 a1msqi6m""><span class=""_1wkzzau0 a1msqi4y lnocuo0 lnocuo1 lnocuo21 _1d0g9qk4 lnocuo7""><a aria-label=""Limit results to Norwest"" class=""_1wkzzau0 _1wkzzauf _1wkzzau0 _1wkzzauf _842p0a0 _842p0a2"" data-automation=""jobLocation"" href=""/jobs-in-real-estate-property/in-Norwest-NSW-2153?salarytype=annual&amp;salaryrange=245000-250000"" rel=""nofollow"" tabindex=""-1"" target=""_self"" title=""Limit results to Norwest"">Norwest</a>, <a aria-label=""Limit results to Sydney NSW"" class=""_1wkzzau0 _1wkzzauf _1wkzzau0 _1wkzzauf _842p0a0 _842p0a2"" data-automation=""jobLocation"" href=""/jobs-in-real-estate-property/in-All-Sydney-NSW?salarytype=annual&amp;salaryrange=245000-250000"" rel=""nofollow"" tabindex=""-1"" target=""_self"" title=""Limit results to Sydney NSW"">Sydney NSW</a></span></div>, <div class=""_1wkzzau0 a1msqi6m""><div aria-label=""Salary: $200k - $230k"" class=""_1wkzzau0""><span class=""_1wkzzau0 a1msqi4y lnocuo0 lnocuo1 lnocuo21 _1d0g9qk4 lnocuo7"" data-automation=""jobSalary""><span class=""_1wkzzau0 _16v7pfz1 a1msqi4y a1msqi0 a1msqir _16v7pfz3"" style=""--_16v7pfz2:2"">$200k - $230k</span></span></div></div>]",2024-02-01,Real-estate-property - None,08/02/2024
85,https://www.seek.com.au//job/73610014?type=standout&ref=search-standalone,real estate property,Retail & Property Development,Development Manager,GOUGH RECRUITMENT - REAL ESTATE | PROPERTY | DEVELOPMENT | CONSTRUCTION,-,245000.0,247500.0,250000.0,Sydney NSW,"Development Manager required for Australian private developer, established for over 40 years. Flat structure, large pipeline!","[<div class=""_1wkzzau0 a1msqi6m""><span class=""_1wkzzau0 a1msqi4y lnocuo0 lnocuo1 lnocuo21 _1d0g9qk4 lnocuo7""><a aria-label=""Limit results to Sydney NSW"" class=""_1wkzzau0 _1wkzzauf _1wkzzau0 _1wkzzauf _842p0a0 _842p0a2"" data-automation=""jobLocation"" href=""/jobs-in-real-estate-property/in-All-Sydney-NSW?salarytype=annual&amp;salaryrange=245000-250000"" rel=""nofollow"" tabindex=""-1"" target=""_self"" title=""Limit results to Sydney NSW"">Sydney NSW</a></span></div>]",,Real-estate-property - None,08/02/2024
86,https://www.seek.com.au//job/73070559?type=standout&ref=search-standalone,real estate property,"Commercial Sales, Leasing & Property Mgmt",Leasing Agent,Savills Pty Ltd,Excellent salary package,245000.0,247500.0,250000.0,Brisbane QLD,"Due to growth within our QLD business, we are seeking determined self-starters looking for their next challenge.","[<div class=""_1wkzzau0 a1msqi6m""><span class=""_1wkzzau0 a1msqi4y lnocuo0 lnocuo1 lnocuo21 _1d0g9qk4 lnocuo7""><a aria-label=""Limit results to Brisbane QLD"" class=""_1wkzzau0 _1wkzzauf _1wkzzau0 _1wkzzauf _842p0a0 _842p0a2"" data-automation=""jobLocation"" href=""/jobs-in-real-estate-property/in-All-Brisbane-QLD?salarytype=annual&amp;salaryrange=245000-250000"" rel=""nofollow"" tabindex=""-1"" target=""_self"" title=""Limit results to Brisbane QLD"">Brisbane QLD</a></span></div>, <div class=""_1wkzzau0 a1msqi6m""><div aria-label=""Salary: Excellent salary package "" class=""_1wkzzau0""><span class=""_1wkzzau0 a1msqi4y lnocuo0 lnocuo1 lnocuo21 _1d0g9qk4 lnocuo7"" data-automation=""jobSalary""><span class=""_1wkzzau0 _16v7pfz1 a1msqi4y a1msqi0 a1msqir _16v7pfz3"" style=""--_16v7pfz2:2"">Excellent salary package </span></span></div></div>]",2024-01-17,Real-estate-property - None,08/02/2024
87,https://www.seek.com.au//job/73083780?type=standard&ref=search-standalone,real estate property,Residential Sales,Real Estate Agent,One Lifestyle Southern Gold Coast,-,245000.0,247500.0,250000.0,Gold Coast QLD,As an interstate business expanding into the Gold Coast the potential and opportunities are exceptional. Join us on our journey to success.,"[<div class=""_1wkzzau0 a1msqi6m""><span class=""_1wkzzau0 a1msqi4y lnocuo0 lnocuo1 lnocuo21 _1d0g9qk4 lnocuo7""><a aria-label=""Limit results to Surfers Paradise"" class=""_1wkzzau0 _1wkzzauf _1wkzzau0 _1wkzzauf _842p0a0 _842p0a2"" data-automation=""jobLocation"" href=""/jobs-in-real-estate-property/in-Surfers-Paradise-QLD-4217?salarytype=annual&amp;salaryrange=245000-250000"" rel=""nofollow"" tabindex=""-1"" target=""_self"" title=""Limit results to Surfers Paradise"">Surfers Paradise</a>, <a aria-label=""Limit results to Gold Coast QLD"" class=""_1wkzzau0 _1wkzzauf _1wkzzau0 _1wkzzauf _842p0a0 _842p0a2"" data-automation=""jobLocation"" href=""/jobs-in-real-estate-property/in-All-Gold-Coast-QLD?salarytype=annual&amp;salaryrange=245000-250000"" rel=""nofollow"" tabindex=""-1"" target=""_self"" title=""Limit results to Gold Coast QLD"">Gold Coast QLD</a></span></div>]",2024-01-17,Real-estate-property - None,08/02/2024
88,https://www.seek.com.au//job/73004059?type=standout&ref=search-standalone,real estate property,"Commercial Sales, Leasing & Property Mgmt","Vice President, Investment & Asset Management",Redpath Partners Pty Ltd,-,245000.0,247500.0,250000.0,Sydney NSW,"Global real estate investment, development and capital management company is looking to add a VP to their Asset Management team.","[<div class=""_1wkzzau0 a1msqi6m""><span class=""_1wkzzau0 a1msqi4y lnocuo0 lnocuo1 lnocuo21 _1d0g9qk4 lnocuo7""><a aria-label=""Limit results to Sydney NSW"" class=""_1wkzzau0 _1wkzzauf _1wkzzau0 _1wkzzauf _842p0a0 _842p0a2"" data-automation=""jobLocation"" href=""/jobs-in-real-estate-property/in-All-Sydney-NSW?salarytype=annual&amp;salaryrange=245000-250000"" rel=""nofollow"" tabindex=""-1"" target=""_self"" title=""Limit results to Sydney NSW"">Sydney NSW</a></span></div>]",2024-01-15,Real-estate-property - None,08/02/2024
89,https://www.seek.com.au//job/73210414?type=standout&ref=search-standalone,real estate property,Other,Capital Transactions Manager,Dexus,-,245000.0,247500.0,250000.0,Sydney NSW,Capital Transactions Manager | REIT | Health Transactions | Sydney,"[<div class=""_1wkzzau0 a1msqi6m""><span class=""_1wkzzau0 a1msqi4y lnocuo0 lnocuo1 lnocuo21 _1d0g9qk4 lnocuo7""><a aria-label=""Limit results to Sydney NSW"" class=""_1wkzzau0 _1wkzzauf _1wkzzau0 _1wkzzauf _842p0a0 _842p0a2"" data-automation=""jobLocation"" href=""/jobs-in-real-estate-property/in-All-Sydney-NSW?salarytype=annual&amp;salaryrange=245000-250000"" rel=""nofollow"" tabindex=""-1"" target=""_self"" title=""Limit results to Sydney NSW"">Sydney NSW</a></span></div>]",2024-01-22,Real-estate-property - None,08/02/2024
90,https://www.seek.com.au//job/73369960?type=standout&ref=search-standalone,real estate property,Retail & Property Development,Senior Development Manager,Satterley Property Group,-,245000.0,247500.0,250000.0,Melbourne VIC,Excellent opportunity to join a leading private residential property developer and play a key role in creating outstanding master-planned communities.,"[<div class=""_1wkzzau0 a1msqi6m""><span class=""_1wkzzau0 a1msqi4y lnocuo0 lnocuo1 lnocuo21 _1d0g9qk4 lnocuo7""><a aria-label=""Limit results to Melbourne VIC"" class=""_1wkzzau0 _1wkzzauf _1wkzzau0 _1wkzzauf _842p0a0 _842p0a2"" data-automation=""jobLocation"" href=""/jobs-in-real-estate-property/in-All-Melbourne-VIC?salarytype=annual&amp;salaryrange=245000-250000"" rel=""nofollow"" tabindex=""-1"" target=""_self"" title=""Limit results to Melbourne VIC"">Melbourne VIC</a></span></div>]",2024-01-29,Real-estate-property - None,08/02/2024
91,https://www.seek.com.au//job/73420024?type=standout&ref=search-standalone,real estate property,Retail & Property Development,Senior Development Manager,AVJennings,"Competitive salary, mobile phone + other benefits",245000.0,247500.0,250000.0,Sydney NSW,We are looking for an experienced Senior Development Manager with a proven track record of managing and delivering subdivision projects.,"[<div class=""_1wkzzau0 a1msqi6m""><span class=""_1wkzzau0 a1msqi4y lnocuo0 lnocuo1 lnocuo21 _1d0g9qk4 lnocuo7""><a aria-label=""Limit results to Baulkham Hills"" class=""_1wkzzau0 _1wkzzauf _1wkzzau0 _1wkzzauf _842p0a0 _842p0a2"" data-automation=""jobLocation"" href=""/jobs-in-real-estate-property/in-Baulkham-Hills-NSW-2153?salarytype=annual&amp;salaryrange=245000-250000"" rel=""nofollow"" tabindex=""-1"" target=""_self"" title=""Limit results to Baulkham Hills"">Baulkham Hills</a>, <a aria-label=""Limit results to Sydney NSW"" class=""_1wkzzau0 _1wkzzauf _1wkzzau0 _1wkzzauf _842p0a0 _842p0a2"" data-automation=""jobLocation"" href=""/jobs-in-real-estate-property/in-All-Sydney-NSW?salarytype=annual&amp;salaryrange=245000-250000"" rel=""nofollow"" tabindex=""-1"" target=""_self"" title=""Limit results to Sydney NSW"">Sydney NSW</a></span></div>, <div class=""_1wkzzau0 a1msqi6m""><div aria-label=""Salary: Competitive salary, mobile phone + other benefits"" class=""_1wkzzau0""><span class=""_1wkzzau0 a1msqi4y lnocuo0 lnocuo1 lnocuo21 _1d0g9qk4 lnocuo7"" data-automation=""jobSalary""><span class=""_1wkzzau0 _16v7pfz1 a1msqi4y a1msqi0 a1msqir _16v7pfz3"" style=""--_16v7pfz2:2"">Competitive salary, mobile phone + other benefits</span></span></div></div>]",2024-01-31,Real-estate-property - None,08/02/2024
92,https://www.seek.com.au//job/73521401?type=standout&ref=search-standalone,real estate property,Valuation,Director of Commercial Valuations,Australia's Leading Recruitment Agency,$170 - 200K + Bonuses + Allowances,306000.0,278000.0,250000.0,Melbourne VIC,"Director – Commercial Office Valuations (Middle Market and Institutional) to join a Melbourne office with a ready-made, valuable valuations desk.","[<div class=""_1wkzzau0 a1msqi6m""><span class=""_1wkzzau0 a1msqi4y lnocuo0 lnocuo1 lnocuo21 _1d0g9qk4 lnocuo7""><a aria-label=""Limit results to Melbourne VIC"" class=""_1wkzzau0 _1wkzzauf _1wkzzau0 _1wkzzauf _842p0a0 _842p0a2"" data-automation=""jobLocation"" href=""/jobs-in-real-estate-property/in-All-Melbourne-VIC?salarytype=annual&amp;salaryrange=245000-250000"" rel=""nofollow"" tabindex=""-1"" target=""_self"" title=""Limit results to Melbourne VIC"">Melbourne VIC</a></span></div>, <div class=""_1wkzzau0 a1msqi6m""><div aria-label=""Salary: $170 - 200K + Bonuses + Allowances"" class=""_1wkzzau0""><span class=""_1wkzzau0 a1msqi4y lnocuo0 lnocuo1 lnocuo21 _1d0g9qk4 lnocuo7"" data-automation=""jobSalary""><span class=""_1wkzzau0 _16v7pfz1 a1msqi4y a1msqi0 a1msqir _16v7pfz3"" style=""--_16v7pfz2:2"">$170 - 200K + Bonuses + Allowances</span></span></div></div>]",2024-02-05,Real-estate-property - None,08/02/2024
93,https://www.seek.com.au//job/73003387?type=standout&ref=search-standalone,real estate property,Residential Sales,Real Estate Agent includes retainer and high % commission,Arrow Executive Sales Pty Ltd,-,245000.0,247500.0,250000.0,Brisbane QLD,Retainer and high level commission. Tom Panos (top Real Estate Coach) with training and coaching to support your career development,"[<div class=""_1wkzzau0 a1msqi6m""><span class=""_1wkzzau0 a1msqi4y lnocuo0 lnocuo1 lnocuo21 _1d0g9qk4 lnocuo7""><a aria-label=""Limit results to Brisbane QLD"" class=""_1wkzzau0 _1wkzzauf _1wkzzau0 _1wkzzauf _842p0a0 _842p0a2"" data-automation=""jobLocation"" href=""/jobs-in-real-estate-property/in-All-Brisbane-QLD?salarytype=annual&amp;salaryrange=245000-250000"" rel=""nofollow"" tabindex=""-1"" target=""_self"" title=""Limit results to Brisbane QLD"">Brisbane QLD</a></span></div>]",2024-01-15,Real-estate-property - None,08/02/2024
94,https://www.seek.com.au//job/73385258?type=standout&ref=search-standalone,real estate property,Retail & Property Development,Development Manager - Residential Estates,Allegra Recruitment Pty Ltd,"$150,000 - $200,000 package",150000.0,175000.0,200000.0,Sydney NSW,Large scale residential greenfield land subdivision projects with a major Australian development group in exciting growth phase.,"[<div class=""_1wkzzau0 a1msqi6m""><span class=""_1wkzzau0 a1msqi4y lnocuo0 lnocuo1 lnocuo21 _1d0g9qk4 lnocuo7""><a aria-label=""Limit results to Parramatta"" class=""_1wkzzau0 _1wkzzauf _1wkzzau0 _1wkzzauf _842p0a0 _842p0a2"" data-automation=""jobLocation"" href=""/jobs-in-real-estate-property/in-Parramatta-NSW-2150?salarytype=annual&amp;salaryrange=245000-250000"" rel=""nofollow"" tabindex=""-1"" target=""_self"" title=""Limit results to Parramatta"">Parramatta</a>, <a aria-label=""Limit results to Sydney NSW"" class=""_1wkzzau0 _1wkzzauf _1wkzzau0 _1wkzzauf _842p0a0 _842p0a2"" data-automation=""jobLocation"" href=""/jobs-in-real-estate-property/in-All-Sydney-NSW?salarytype=annual&amp;salaryrange=245000-250000"" rel=""nofollow"" tabindex=""-1"" target=""_self"" title=""Limit results to Sydney NSW"">Sydney NSW</a></span></div>, <div class=""_1wkzzau0 a1msqi6m""><div aria-label=""Salary: $150,000 - $200,000 package"" class=""_1wkzzau0""><span class=""_1wkzzau0 a1msqi4y lnocuo0 lnocuo1 lnocuo21 _1d0g9qk4 lnocuo7"" data-automation=""jobSalary""><span class=""_1wkzzau0 _16v7pfz1 a1msqi4y a1msqi0 a1msqir _16v7pfz3"" style=""--_16v7pfz2:2"">$150,000 - $200,000 package</span></span></div></div>]",2024-01-30,Real-estate-property - None,08/02/2024
95,https://www.seek.com.au//job/73595097?type=standard&ref=search-standalone,real estate property,Body Corporate & Facilities Management,General Manager - Strata Management,GOUGH RECRUITMENT - REAL ESTATE | PROPERTY | DEVELOPMENT | CONSTRUCTION,-,245000.0,247500.0,250000.0,Sydney NSW,General Manager - Strata Management. Are you a Branch Manager or Team Leader looking to take on a new challenge? Great dollars $$ & Growing business!,"[<div class=""_1wkzzau0 a1msqi6m""><span class=""_1wkzzau0 a1msqi4y lnocuo0 lnocuo1 lnocuo21 _1d0g9qk4 lnocuo7""><a aria-label=""Limit results to Sydney NSW"" class=""_1wkzzau0 _1wkzzauf _1wkzzau0 _1wkzzauf _842p0a0 _842p0a2"" data-automation=""jobLocation"" href=""/jobs-in-real-estate-property/in-All-Sydney-NSW?salarytype=annual&amp;salaryrange=245000-250000"" rel=""nofollow"" tabindex=""-1"" target=""_self"" title=""Limit results to Sydney NSW"">Sydney NSW</a></span></div>]",2024-02-07,Real-estate-property - None,08/02/2024
96,https://www.seek.com.au//job/73310988?type=standout&ref=search-standalone,real estate property,Body Corporate & Facilities Management,Senior Operations Manager,GPT Group,-,245000.0,247500.0,250000.0,Sydney NSW,"Lead the day to day maintenance of our 3 premium, largescale commercial towers at Darling Park in this leadership role","[<div class=""_1wkzzau0 a1msqi6m""><span class=""_1wkzzau0 a1msqi4y lnocuo0 lnocuo1 lnocuo21 _1d0g9qk4 lnocuo7""><a aria-label=""Limit results to Sydney NSW"" class=""_1wkzzau0 _1wkzzauf _1wkzzau0 _1wkzzauf _842p0a0 _842p0a2"" data-automation=""jobLocation"" href=""/jobs-in-real-estate-property/in-All-Sydney-NSW?salarytype=annual&amp;salaryrange=245000-250000"" rel=""nofollow"" tabindex=""-1"" target=""_self"" title=""Limit results to Sydney NSW"">Sydney NSW</a></span></div>]",2024-01-25,Real-estate-property - None,08/02/2024
97,https://www.seek.com.au//job/73270420?type=standout&ref=search-standalone,real estate property,Body Corporate & Facilities Management,Superintendent - Facilities & Logistics,CITIC Pacific Mining Management Pty Ltd,Mine site experience highly regarded,245000.0,247500.0,250000.0,Perth WA,Do you have outstanding stakeholder engagement skills and experience with contract management?,"[<div class=""_1wkzzau0 a1msqi6m""><span class=""_1wkzzau0 a1msqi4y lnocuo0 lnocuo1 lnocuo21 _1d0g9qk4 lnocuo7""><a aria-label=""Limit results to Perth WA"" class=""_1wkzzau0 _1wkzzauf _1wkzzau0 _1wkzzauf _842p0a0 _842p0a2"" data-automation=""jobLocation"" href=""/jobs-in-real-estate-property/in-All-Perth-WA?salarytype=annual&amp;salaryrange=245000-250000"" rel=""nofollow"" tabindex=""-1"" target=""_self"" title=""Limit results to Perth WA"">Perth WA</a></span></div>, <div class=""_1wkzzau0 a1msqi6m""><div aria-label=""Salary: Mine site experience highly regarded"" class=""_1wkzzau0""><span class=""_1wkzzau0 a1msqi4y lnocuo0 lnocuo1 lnocuo21 _1d0g9qk4 lnocuo7"" data-automation=""jobSalary""><span class=""_1wkzzau0 _16v7pfz1 a1msqi4y a1msqi0 a1msqir _16v7pfz3"" style=""--_16v7pfz2:2"">Mine site experience highly regarded</span></span></div></div>]",2024-01-24,Real-estate-property - None,08/02/2024
98,https://www.seek.com.au//job/73267329?type=standout&ref=search-standalone,real estate property,Residential Sales,Project Sales Consultant,Talent Butler PTY LTD,-,245000.0,247500.0,250000.0,Melbourne VIC,Upcoming new launch requires seasoned sales professional,"[<div class=""_1wkzzau0 a1msqi6m""><span class=""_1wkzzau0 a1msqi4y lnocuo0 lnocuo1 lnocuo21 _1d0g9qk4 lnocuo7""><a aria-label=""Limit results to Melbourne VIC"" class=""_1wkzzau0 _1wkzzauf _1wkzzau0 _1wkzzauf _842p0a0 _842p0a2"" data-automation=""jobLocation"" href=""/jobs-in-real-estate-property/in-All-Melbourne-VIC?salarytype=annual&amp;salaryrange=245000-250000"" rel=""nofollow"" tabindex=""-1"" target=""_self"" title=""Limit results to Melbourne VIC"">Melbourne VIC</a></span></div>]",2024-01-24,Real-estate-property - None,08/02/2024
99,https://www.seek.com.au//job/73307643?type=standout&ref=search-standalone,real estate property,Other,Development Director - Development Advisory,CBRE,-,245000.0,247500.0,250000.0,Sydney NSW,Great opportunity for a client side Project/Development Director to join our expanding consultancy-based Development Advisory group.,"[<div class=""_1wkzzau0 a1msqi6m""><span class=""_1wkzzau0 a1msqi4y lnocuo0 lnocuo1 lnocuo21 _1d0g9qk4 lnocuo7""><a aria-label=""Limit results to Sydney NSW"" class=""_1wkzzau0 _1wkzzauf _1wkzzau0 _1wkzzauf _842p0a0 _842p0a2"" data-automation=""jobLocation"" href=""/jobs-in-real-estate-property/in-All-Sydney-NSW?salarytype=annual&amp;salaryrange=245000-250000"" rel=""nofollow"" tabindex=""-1"" target=""_self"" title=""Limit results to Sydney NSW"">Sydney NSW</a></span></div>]",2024-01-25,Real-estate-property - None,08/02/2024
100,https://www.seek.com.au//job/73166255?type=standout&ref=search-standalone,real estate property,Residential Sales,Sales Consultant - Sherridon Homes: Clyde North,AHB Australia,Uncapped Commissions - OTE $250k +,245000.0,247500.0,250000.0,Melbourne VIC,Come work for the only builder in Victoria that is still growing!!,"[<div class=""_1wkzzau0 a1msqi6m""><span class=""_1wkzzau0 a1msqi4y lnocuo0 lnocuo1 lnocuo21 _1d0g9qk4 lnocuo7""><a aria-label=""Limit results to Cranbourne North"" class=""_1wkzzau0 _1wkzzauf _1wkzzau0 _1wkzzauf _842p0a0 _842p0a2"" data-automation=""jobLocation"" href=""/jobs-in-real-estate-property/in-Cranbourne-North-VIC-3977?salarytype=annual&amp;salaryrange=245000-250000"" rel=""nofollow"" tabindex=""-1"" target=""_self"" title=""Limit results to Cranbourne North"">Cranbourne North</a>, <a aria-label=""Limit results to Melbourne VIC"" class=""_1wkzzau0 _1wkzzauf _1wkzzau0 _1wkzzauf _842p0a0 _842p0a2"" data-automation=""jobLocation"" href=""/jobs-in-real-estate-property/in-All-Melbourne-VIC?salarytype=annual&amp;salaryrange=245000-250000"" rel=""nofollow"" tabindex=""-1"" target=""_self"" title=""Limit results to Melbourne VIC"">Melbourne VIC</a></span></div>, <div class=""_1wkzzau0 a1msqi6m""><div aria-label=""Salary: Uncapped Commissions - OTE $250k +"" class=""_1wkzzau0""><span class=""_1wkzzau0 a1msqi4y lnocuo0 lnocuo1 lnocuo21 _1d0g9qk4 lnocuo7"" data-automation=""jobSalary""><span class=""_1wkzzau0 _16v7pfz1 a1msqi4y a1msqi0 a1msqir _16v7pfz3"" style=""--_16v7pfz2:2"">Uncapped Commissions - OTE $250k +</span></span></div></div>]",2024-01-19,Real-estate-property - None,08/02/2024
101,https://www.seek.com.au//job/73166804?type=standout&ref=search-standalone,real estate property,Residential Sales,New Home Sales Consultant - Northern Suburbs,AHB Australia,Uncapped Commissions - OTE $250k +,245000.0,247500.0,250000.0,Melbourne VIC,"Come work for the leader in New Home Sales - Sherridon Homes Northern Suburbs locations. Great team, amazing leadership and phenomenal culture.","[<div class=""_1wkzzau0 a1msqi6m""><span class=""_1wkzzau0 a1msqi4y lnocuo0 lnocuo1 lnocuo21 _1d0g9qk4 lnocuo7""><a aria-label=""Limit results to Greenvale"" class=""_1wkzzau0 _1wkzzauf _1wkzzau0 _1wkzzauf _842p0a0 _842p0a2"" data-automation=""jobLocation"" href=""/jobs-in-real-estate-property/in-Greenvale-VIC-3059?salarytype=annual&amp;salaryrange=245000-250000"" rel=""nofollow"" tabindex=""-1"" target=""_self"" title=""Limit results to Greenvale"">Greenvale</a>, <a aria-label=""Limit results to Melbourne VIC"" class=""_1wkzzau0 _1wkzzauf _1wkzzau0 _1wkzzauf _842p0a0 _842p0a2"" data-automation=""jobLocation"" href=""/jobs-in-real-estate-property/in-All-Melbourne-VIC?salarytype=annual&amp;salaryrange=245000-250000"" rel=""nofollow"" tabindex=""-1"" target=""_self"" title=""Limit results to Melbourne VIC"">Melbourne VIC</a></span></div>, <div class=""_1wkzzau0 a1msqi6m""><div aria-label=""Salary: Uncapped Commissions - OTE $250k +"" class=""_1wkzzau0""><span class=""_1wkzzau0 a1msqi4y lnocuo0 lnocuo1 lnocuo21 _1d0g9qk4 lnocuo7"" data-automation=""jobSalary""><span class=""_1wkzzau0 _16v7pfz1 a1msqi4y a1msqi0 a1msqir _16v7pfz3"" style=""--_16v7pfz2:2"">Uncapped Commissions - OTE $250k +</span></span></div></div>]",2024-01-19,Real-estate-property - None,08/02/2024
102,https://www.seek.com.au//job/73186607?type=standout&ref=search-standalone,real estate property,Body Corporate & Facilities Management,State Manager - Victoria,NOVA Partners Executive Search & Selection,-,245000.0,247500.0,250000.0,Melbourne VIC,"Reporting to a National GM, you will lead a team of Regional Managers in delivering integrated operational and asset service solutions.","[<div class=""_1wkzzau0 a1msqi6m""><span class=""_1wkzzau0 a1msqi4y lnocuo0 lnocuo1 lnocuo21 _1d0g9qk4 lnocuo7""><a aria-label=""Limit results to Melbourne VIC"" class=""_1wkzzau0 _1wkzzauf _1wkzzau0 _1wkzzauf _842p0a0 _842p0a2"" data-automation=""jobLocation"" href=""/jobs-in-real-estate-property/in-All-Melbourne-VIC?salarytype=annual&amp;salaryrange=245000-250000"" rel=""nofollow"" tabindex=""-1"" target=""_self"" title=""Limit results to Melbourne VIC"">Melbourne VIC</a></span></div>]",2024-01-20,Real-estate-property - None,08/02/2024
103,https://www.seek.com.au//job/73351014?type=standard&ref=search-standalone,real estate property,Retail & Property Development,Retail Leasing Executive,GOUGH RECRUITMENT - REAL ESTATE | PROPERTY | DEVELOPMENT | CONSTRUCTION,-,245000.0,247500.0,250000.0,Sydney NSW,A rare opportunity to be mentored in Retail Leasing with an established and experienced team.,"[<div class=""_1wkzzau0 a1msqi6m""><span class=""_1wkzzau0 a1msqi4y lnocuo0 lnocuo1 lnocuo21 _1d0g9qk4 lnocuo7""><a aria-label=""Limit results to Sydney NSW"" class=""_1wkzzau0 _1wkzzauf _1wkzzau0 _1wkzzauf _842p0a0 _842p0a2"" data-automation=""jobLocation"" href=""/jobs-in-real-estate-property/in-All-Sydney-NSW?salarytype=annual&amp;salaryrange=245000-250000"" rel=""nofollow"" tabindex=""-1"" target=""_self"" title=""Limit results to Sydney NSW"">Sydney NSW</a></span></div>]",2024-01-29,Real-estate-property - None,08/02/2024
