,link,classification,category,title,company,salary,min_salary,average_salary,max_salary,location,description,entireDiv,date_posted,Category,Date
0,https://www.seek.com.au//job/73480155?type=promoted&ref=search-standalone,retail consumer products,Management - Area/Multi-site,State Manager - VIC,,-,160000.0,162500.0,165000.0,Melbourne VIC,"This is a hands-on and leadership role, responsible for developing and optimising the operations, overall sales, and profitability of the State.","[<div class=""_1wkzzau0 a1msqi6m""><span class=""_1wkzzau0 a1msqi4y lnocuo0 lnocuo1 lnocuo21 _1d0g9qk4 lnocuo7""><a aria-label=""Limit results to Clayton"" class=""_1wkzzau0 _1wkzzauf _1wkzzau0 _1wkzzauf _842p0a0 _842p0a2"" data-automation=""jobLocation"" href=""/jobs-in-retail-consumer-products/in-Clayton-VIC-3168?salarytype=annual&amp;salaryrange=160000-165000"" rel=""nofollow"" tabindex=""-1"" target=""_self"" title=""Limit results to Clayton"">Clayton</a>, <a aria-label=""Limit results to Melbourne VIC"" class=""_1wkzzau0 _1wkzzauf _1wkzzau0 _1wkzzauf _842p0a0 _842p0a2"" data-automation=""jobLocation"" href=""/jobs-in-retail-consumer-products/in-All-Melbourne-VIC?salarytype=annual&amp;salaryrange=160000-165000"" rel=""nofollow"" tabindex=""-1"" target=""_self"" title=""Limit results to Melbourne VIC"">Melbourne VIC</a></span></div>]",,Retail-consumer-products - None,08/02/2024
1,https://www.seek.com.au//job/73581823?type=promoted&ref=search-standalone,retail consumer products,Buying,Buyer Homewares,Kmart,-,160000.0,162500.0,165000.0,Melbourne VIC,"Manage the Technical Design team, to support the Apparel merchandising & Design departments in the execution of complex product","[<div class=""_1wkzzau0 a1msqi6m""><span class=""_1wkzzau0 a1msqi4y lnocuo0 lnocuo1 lnocuo21 _1d0g9qk4 lnocuo7""><a aria-label=""Limit results to Mulgrave"" class=""_1wkzzau0 _1wkzzauf _1wkzzau0 _1wkzzauf _842p0a0 _842p0a2"" data-automation=""jobLocation"" href=""/jobs-in-retail-consumer-products/in-Mulgrave-VIC-3170?salarytype=annual&amp;salaryrange=160000-165000"" rel=""nofollow"" tabindex=""-1"" target=""_self"" title=""Limit results to Mulgrave"">Mulgrave</a>, <a aria-label=""Limit results to Melbourne VIC"" class=""_1wkzzau0 _1wkzzauf _1wkzzau0 _1wkzzauf _842p0a0 _842p0a2"" data-automation=""jobLocation"" href=""/jobs-in-retail-consumer-products/in-All-Melbourne-VIC?salarytype=annual&amp;salaryrange=160000-165000"" rel=""nofollow"" tabindex=""-1"" target=""_self"" title=""Limit results to Melbourne VIC"">Melbourne VIC</a></span></div>]",,Retail-consumer-products - None,08/02/2024
2,https://www.seek.com.au//job/73601355?type=standard&ref=search-standalone,retail consumer products,Management - Area/Multi-site,National Gym and Retail Manager,Ryderwear PTY LTD,-,160000.0,162500.0,165000.0,Adelaide SA,Lead and shape the future of retail and gym operations within a leading global activewear brand.,"[<div class=""_1wkzzau0 a1msqi6m""><span class=""_1wkzzau0 a1msqi4y lnocuo0 lnocuo1 lnocuo21 _1d0g9qk4 lnocuo7""><a aria-label=""Limit results to Adelaide SA"" class=""_1wkzzau0 _1wkzzauf _1wkzzau0 _1wkzzauf _842p0a0 _842p0a2"" data-automation=""jobLocation"" href=""/jobs-in-retail-consumer-products/in-All-Adelaide-SA?salarytype=annual&amp;salaryrange=160000-165000"" rel=""nofollow"" tabindex=""-1"" target=""_self"" title=""Limit results to Adelaide SA"">Adelaide SA</a></span></div>]",2024-02-07,Retail-consumer-products - None,08/02/2024
3,https://www.seek.com.au//job/73623494?type=standout&ref=search-standalone,retail consumer products,Management - Area/Multi-site,Retail Operations Manager - International luxury fashion apparel,HSS Recruitment,$120K - $150K,120000.0,135000.0,150000.0,Melbourne VIC,Higher Solution Specialists are seeking an experienced Retail Operations Manager for a renowned international luxury retailer in Melbourne or Sydney,"[<div class=""_1wkzzau0 a1msqi6m""><span class=""_1wkzzau0 a1msqi4y lnocuo0 lnocuo1 lnocuo21 _1d0g9qk4 lnocuo7""><a aria-label=""Limit results to Melbourne VIC"" class=""_1wkzzau0 _1wkzzauf _1wkzzau0 _1wkzzauf _842p0a0 _842p0a2"" data-automation=""jobLocation"" href=""/jobs-in-retail-consumer-products/in-All-Melbourne-VIC?salarytype=annual&amp;salaryrange=160000-165000"" rel=""nofollow"" tabindex=""-1"" target=""_self"" title=""Limit results to Melbourne VIC"">Melbourne VIC</a></span></div>, <div class=""_1wkzzau0 a1msqi6m""><div aria-label=""Salary: $120K - $150K"" class=""_1wkzzau0""><span class=""_1wkzzau0 a1msqi4y lnocuo0 lnocuo1 lnocuo21 _1d0g9qk4 lnocuo7"" data-automation=""jobSalary""><span class=""_1wkzzau0 _16v7pfz1 a1msqi4y a1msqi0 a1msqir _16v7pfz3"" style=""--_16v7pfz2:2"">$120K - $150K</span></span></div></div>]",,Retail-consumer-products - None,08/02/2024
4,https://www.seek.com.au//job/73483263?type=standard&ref=search-standalone,retail consumer products,Management - Area/Multi-site,National Sales Director – Retail,,-,160000.0,162500.0,165000.0,Sydney NSW,"Use your quick thinking, strong coaching ability, and time management to manage and motivate regional Retail teams to drive sales and achieve goals!","[<div class=""_1wkzzau0 a1msqi6m""><span class=""_1wkzzau0 a1msqi4y lnocuo0 lnocuo1 lnocuo21 _1d0g9qk4 lnocuo7""><a aria-label=""Limit results to Sydney NSW"" class=""_1wkzzau0 _1wkzzauf _1wkzzau0 _1wkzzauf _842p0a0 _842p0a2"" data-automation=""jobLocation"" href=""/jobs-in-retail-consumer-products/in-All-Sydney-NSW?salarytype=annual&amp;salaryrange=160000-165000"" rel=""nofollow"" tabindex=""-1"" target=""_self"" title=""Limit results to Sydney NSW"">Sydney NSW</a></span></div>]",2024-02-02,Retail-consumer-products - None,08/02/2024
5,https://www.seek.com.au//job/73512829?type=standout&ref=search-standalone,retail consumer products,Management - Area/Multi-site,Head of Retail,Simonyi Recruitment Pty Ltd,-,160000.0,162500.0,165000.0,Brisbane QLD,Apply your expertise in growing franchise & company-owned networks & continue the positive momentum of a retailer actively investing for the future.,"[<div class=""_1wkzzau0 a1msqi6m""><span class=""_1wkzzau0 a1msqi4y lnocuo0 lnocuo1 lnocuo21 _1d0g9qk4 lnocuo7""><a aria-label=""Limit results to Eagle Farm"" class=""_1wkzzau0 _1wkzzauf _1wkzzau0 _1wkzzauf _842p0a0 _842p0a2"" data-automation=""jobLocation"" href=""/jobs-in-retail-consumer-products/in-Eagle-Farm-QLD-4009?salarytype=annual&amp;salaryrange=160000-165000"" rel=""nofollow"" tabindex=""-1"" target=""_self"" title=""Limit results to Eagle Farm"">Eagle Farm</a>, <a aria-label=""Limit results to Brisbane QLD"" class=""_1wkzzau0 _1wkzzauf _1wkzzau0 _1wkzzauf _842p0a0 _842p0a2"" data-automation=""jobLocation"" href=""/jobs-in-retail-consumer-products/in-All-Brisbane-QLD?salarytype=annual&amp;salaryrange=160000-165000"" rel=""nofollow"" tabindex=""-1"" target=""_self"" title=""Limit results to Brisbane QLD"">Brisbane QLD</a></span></div>]",2024-02-05,Retail-consumer-products - None,08/02/2024
6,https://www.seek.com.au//job/73442388?type=standout&ref=search-standalone,retail consumer products,Management - Area/Multi-site,State Manager - NSW,K&S Freighters,-,160000.0,162500.0,165000.0,Newcastle NSW,Be a part of a legacy organization with a national presence and kickstart a rewarding career.,"[<div class=""_1wkzzau0 a1msqi6m""><span class=""_1wkzzau0 a1msqi4y lnocuo0 lnocuo1 lnocuo21 _1d0g9qk4 lnocuo7""><a aria-label=""Limit results to Newcastle"" class=""_1wkzzau0 _1wkzzauf _1wkzzau0 _1wkzzauf _842p0a0 _842p0a2"" data-automation=""jobLocation"" href=""/jobs-in-retail-consumer-products/in-Newcastle-NSW-2300?salarytype=annual&amp;salaryrange=160000-165000"" rel=""nofollow"" tabindex=""-1"" target=""_self"" title=""Limit results to Newcastle"">Newcastle</a>, <a aria-label=""Limit results to Newcastle, Maitland &amp; Hunter NSW"" class=""_1wkzzau0 _1wkzzauf _1wkzzau0 _1wkzzauf _842p0a0 _842p0a2"" data-automation=""jobLocation"" href=""/jobs-in-retail-consumer-products/in-Newcastle,-Maitland-&amp;-Hunter-NSW?salarytype=annual&amp;salaryrange=160000-165000"" rel=""nofollow"" tabindex=""-1"" target=""_self"" title=""Limit results to Newcastle, Maitland &amp; Hunter NSW"">Newcastle, Maitland &amp; Hunter NSW</a></span></div>]",2024-02-01,Retail-consumer-products - None,08/02/2024
7,https://www.seek.com.au//job/73380832?type=standard&ref=search-standalone,retail consumer products,Management - Area/Multi-site,"Retail Area Manager, Viva Energy - ACT",Coles,-,160000.0,162500.0,165000.0,Canberra ACT,We're looking for a Retail Area Manager with extensive retail experience who can lead with passion and pace in this multi-site management position.,"[<div class=""_1wkzzau0 a1msqi6m""><span class=""_1wkzzau0 a1msqi4y lnocuo0 lnocuo1 lnocuo21 _1d0g9qk4 lnocuo7""><a aria-label=""Limit results to Canberra ACT"" class=""_1wkzzau0 _1wkzzauf _1wkzzau0 _1wkzzauf _842p0a0 _842p0a2"" data-automation=""jobLocation"" href=""/jobs-in-retail-consumer-products/in-All-Canberra-ACT?salarytype=annual&amp;salaryrange=160000-165000"" rel=""nofollow"" tabindex=""-1"" target=""_self"" title=""Limit results to Canberra ACT"">Canberra ACT</a></span></div>]",2024-01-30,Retail-consumer-products - None,08/02/2024
8,https://www.seek.com.au//job/73480155?type=standout&ref=search-standalone,retail consumer products,Management - Area/Multi-site,State Manager - VIC,,-,160000.0,162500.0,165000.0,Melbourne VIC,"This is a hands-on and leadership role, responsible for developing and optimising the operations, overall sales, and profitability of the State.","[<div class=""_1wkzzau0 a1msqi6m""><span class=""_1wkzzau0 a1msqi4y lnocuo0 lnocuo1 lnocuo21 _1d0g9qk4 lnocuo7""><a aria-label=""Limit results to Clayton"" class=""_1wkzzau0 _1wkzzauf _1wkzzau0 _1wkzzauf _842p0a0 _842p0a2"" data-automation=""jobLocation"" href=""/jobs-in-retail-consumer-products/in-Clayton-VIC-3168?salarytype=annual&amp;salaryrange=160000-165000"" rel=""nofollow"" tabindex=""-1"" target=""_self"" title=""Limit results to Clayton"">Clayton</a>, <a aria-label=""Limit results to Melbourne VIC"" class=""_1wkzzau0 _1wkzzauf _1wkzzau0 _1wkzzauf _842p0a0 _842p0a2"" data-automation=""jobLocation"" href=""/jobs-in-retail-consumer-products/in-All-Melbourne-VIC?salarytype=annual&amp;salaryrange=160000-165000"" rel=""nofollow"" tabindex=""-1"" target=""_self"" title=""Limit results to Melbourne VIC"">Melbourne VIC</a></span></div>]",2024-02-02,Retail-consumer-products - None,08/02/2024
9,https://www.seek.com.au//job/73379673?type=standout&ref=search-standalone,retail consumer products,Management - Area/Multi-site,Head of Retail,Chempro,-,160000.0,162500.0,165000.0,Gold Coast QLD,Join the Gold Coasts leading pharmacy group!,"[<div class=""_1wkzzau0 a1msqi6m""><span class=""_1wkzzau0 a1msqi4y lnocuo0 lnocuo1 lnocuo21 _1d0g9qk4 lnocuo7""><a aria-label=""Limit results to Molendinar"" class=""_1wkzzau0 _1wkzzauf _1wkzzau0 _1wkzzauf _842p0a0 _842p0a2"" data-automation=""jobLocation"" href=""/jobs-in-retail-consumer-products/in-Molendinar-QLD-4214?salarytype=annual&amp;salaryrange=160000-165000"" rel=""nofollow"" tabindex=""-1"" target=""_self"" title=""Limit results to Molendinar"">Molendinar</a>, <a aria-label=""Limit results to Gold Coast QLD"" class=""_1wkzzau0 _1wkzzauf _1wkzzau0 _1wkzzauf _842p0a0 _842p0a2"" data-automation=""jobLocation"" href=""/jobs-in-retail-consumer-products/in-All-Gold-Coast-QLD?salarytype=annual&amp;salaryrange=160000-165000"" rel=""nofollow"" tabindex=""-1"" target=""_self"" title=""Limit results to Gold Coast QLD"">Gold Coast QLD</a></span></div>]",2024-01-30,Retail-consumer-products - None,08/02/2024
10,https://www.seek.com.au//job/73520791?type=standout&ref=search-standalone,retail consumer products,Other,"Head of Retail, ANZ",Aesop,-,160000.0,162500.0,165000.0,Melbourne VIC,"Aesop are seeking a commercially minded and delivery focused Head of Retail Operations, ANZ to join our Retail team based in Melbourne.","[<div class=""_1wkzzau0 a1msqi6m""><span class=""_1wkzzau0 a1msqi4y lnocuo0 lnocuo1 lnocuo21 _1d0g9qk4 lnocuo7""><a aria-label=""Limit results to Collingwood"" class=""_1wkzzau0 _1wkzzauf _1wkzzau0 _1wkzzauf _842p0a0 _842p0a2"" data-automation=""jobLocation"" href=""/jobs-in-retail-consumer-products/in-Collingwood-VIC-3066?salarytype=annual&amp;salaryrange=160000-165000"" rel=""nofollow"" tabindex=""-1"" target=""_self"" title=""Limit results to Collingwood"">Collingwood</a>, <a aria-label=""Limit results to Melbourne VIC"" class=""_1wkzzau0 _1wkzzauf _1wkzzau0 _1wkzzauf _842p0a0 _842p0a2"" data-automation=""jobLocation"" href=""/jobs-in-retail-consumer-products/in-All-Melbourne-VIC?salarytype=annual&amp;salaryrange=160000-165000"" rel=""nofollow"" tabindex=""-1"" target=""_self"" title=""Limit results to Melbourne VIC"">Melbourne VIC</a></span></div>]",2024-02-05,Retail-consumer-products - None,08/02/2024
11,https://www.seek.com.au//job/73246241?type=standout&ref=search-standalone,retail consumer products,Management - Area/Multi-site,Regional Manager Western Australia,Spotlight Pty Ltd,Great Salary + Car + Profit Share,160000.0,162500.0,165000.0,Perth WA,"As our Regional Manager in WA, you will implement strategies to improve sales performance & maximise Net profit through your 16 high volume stores","[<div class=""_1wkzzau0 a1msqi6m""><span class=""_1wkzzau0 a1msqi4y lnocuo0 lnocuo1 lnocuo21 _1d0g9qk4 lnocuo7""><a aria-label=""Limit results to Perth WA"" class=""_1wkzzau0 _1wkzzauf _1wkzzau0 _1wkzzauf _842p0a0 _842p0a2"" data-automation=""jobLocation"" href=""/jobs-in-retail-consumer-products/in-All-Perth-WA?salarytype=annual&amp;salaryrange=160000-165000"" rel=""nofollow"" tabindex=""-1"" target=""_self"" title=""Limit results to Perth WA"">Perth WA</a></span></div>, <div class=""_1wkzzau0 a1msqi6m""><div aria-label=""Salary: Great Salary + Car + Profit Share"" class=""_1wkzzau0""><span class=""_1wkzzau0 a1msqi4y lnocuo0 lnocuo1 lnocuo21 _1d0g9qk4 lnocuo7"" data-automation=""jobSalary""><span class=""_1wkzzau0 _16v7pfz1 a1msqi4y a1msqi0 a1msqir _16v7pfz3"" style=""--_16v7pfz2:2"">Great Salary + Car + Profit Share</span></span></div></div>]",2024-01-23,Retail-consumer-products - None,08/02/2024
12,https://www.seek.com.au//job/73447257?type=standout&ref=search-standalone,retail consumer products,Retail Assistants,Sales Assistant - Casual,Glamaco Australia Pty Ltd,-,160000.0,162500.0,165000.0,Brisbane QLD,Sales Assistant - Casual,"[<div class=""_1wkzzau0 a1msqi6m""><span class=""_1wkzzau0 a1msqi4y lnocuo0 lnocuo1 lnocuo21 _1d0g9qk4 lnocuo7""><a aria-label=""Limit results to Browns Plains"" class=""_1wkzzau0 _1wkzzauf _1wkzzau0 _1wkzzauf _842p0a0 _842p0a2"" data-automation=""jobLocation"" href=""/jobs-in-retail-consumer-products/in-Browns-Plains-QLD-4118?salarytype=annual&amp;salaryrange=160000-165000"" rel=""nofollow"" tabindex=""-1"" target=""_self"" title=""Limit results to Browns Plains"">Browns Plains</a>, <a aria-label=""Limit results to Brisbane QLD"" class=""_1wkzzau0 _1wkzzauf _1wkzzau0 _1wkzzauf _842p0a0 _842p0a2"" data-automation=""jobLocation"" href=""/jobs-in-retail-consumer-products/in-All-Brisbane-QLD?salarytype=annual&amp;salaryrange=160000-165000"" rel=""nofollow"" tabindex=""-1"" target=""_self"" title=""Limit results to Brisbane QLD"">Brisbane QLD</a></span></div>]",2024-02-01,Retail-consumer-products - None,08/02/2024
13,https://www.seek.com.au//job/73447211?type=standout&ref=search-standalone,retail consumer products,Retail Assistants,Sales Assistant - Casual,Glamaco Australia Pty Ltd,-,160000.0,162500.0,165000.0,Brisbane QLD,Sales Assistant - Casual,"[<div class=""_1wkzzau0 a1msqi6m""><span class=""_1wkzzau0 a1msqi4y lnocuo0 lnocuo1 lnocuo21 _1d0g9qk4 lnocuo7""><a aria-label=""Limit results to North Lakes"" class=""_1wkzzau0 _1wkzzauf _1wkzzau0 _1wkzzauf _842p0a0 _842p0a2"" data-automation=""jobLocation"" href=""/jobs-in-retail-consumer-products/in-North-Lakes-QLD-4509?salarytype=annual&amp;salaryrange=160000-165000"" rel=""nofollow"" tabindex=""-1"" target=""_self"" title=""Limit results to North Lakes"">North Lakes</a>, <a aria-label=""Limit results to Brisbane QLD"" class=""_1wkzzau0 _1wkzzauf _1wkzzau0 _1wkzzauf _842p0a0 _842p0a2"" data-automation=""jobLocation"" href=""/jobs-in-retail-consumer-products/in-All-Brisbane-QLD?salarytype=annual&amp;salaryrange=160000-165000"" rel=""nofollow"" tabindex=""-1"" target=""_self"" title=""Limit results to Brisbane QLD"">Brisbane QLD</a></span></div>]",2024-02-01,Retail-consumer-products - None,08/02/2024
14,https://www.seek.com.au//job/73447159?type=standout&ref=search-standalone,retail consumer products,Retail Assistants,Sales Assistant - Casual,Glamaco Australia Pty Ltd,-,160000.0,162500.0,165000.0,"Garbutt, Northern QLD",Sales Assistant - Casual,"[<div class=""_1wkzzau0 a1msqi6m""><span class=""_1wkzzau0 a1msqi4y lnocuo0 lnocuo1 lnocuo21 _1d0g9qk4 lnocuo7""><a aria-label=""Limit results to Garbutt"" class=""_1wkzzau0 _1wkzzauf _1wkzzau0 _1wkzzauf _842p0a0 _842p0a2"" data-automation=""jobLocation"" href=""/jobs-in-retail-consumer-products/in-Garbutt-QLD-4814?salarytype=annual&amp;salaryrange=160000-165000"" rel=""nofollow"" tabindex=""-1"" target=""_self"" title=""Limit results to Garbutt"">Garbutt</a>, <a aria-label=""Limit results to Northern QLD"" class=""_1wkzzau0 _1wkzzauf _1wkzzau0 _1wkzzauf _842p0a0 _842p0a2"" data-automation=""jobLocation"" href=""/jobs-in-retail-consumer-products/in-Northern-QLD?salarytype=annual&amp;salaryrange=160000-165000"" rel=""nofollow"" tabindex=""-1"" target=""_self"" title=""Limit results to Northern QLD"">Northern QLD</a></span></div>]",2024-02-01,Retail-consumer-products - None,08/02/2024
15,https://www.seek.com.au//job/73447120?type=standout&ref=search-standalone,retail consumer products,Retail Assistants,Sales Assistant - Casual,Glamaco Australia Pty Ltd,-,160000.0,162500.0,165000.0,Gold Coast QLD,Sales Assistant - Casual,"[<div class=""_1wkzzau0 a1msqi6m""><span class=""_1wkzzau0 a1msqi4y lnocuo0 lnocuo1 lnocuo21 _1d0g9qk4 lnocuo7""><a aria-label=""Limit results to Mermaid Waters"" class=""_1wkzzau0 _1wkzzauf _1wkzzau0 _1wkzzauf _842p0a0 _842p0a2"" data-automation=""jobLocation"" href=""/jobs-in-retail-consumer-products/in-Mermaid-Waters-QLD-4218?salarytype=annual&amp;salaryrange=160000-165000"" rel=""nofollow"" tabindex=""-1"" target=""_self"" title=""Limit results to Mermaid Waters"">Mermaid Waters</a>, <a aria-label=""Limit results to Gold Coast QLD"" class=""_1wkzzau0 _1wkzzauf _1wkzzau0 _1wkzzauf _842p0a0 _842p0a2"" data-automation=""jobLocation"" href=""/jobs-in-retail-consumer-products/in-All-Gold-Coast-QLD?salarytype=annual&amp;salaryrange=160000-165000"" rel=""nofollow"" tabindex=""-1"" target=""_self"" title=""Limit results to Gold Coast QLD"">Gold Coast QLD</a></span></div>]",2024-02-01,Retail-consumer-products - None,08/02/2024
16,https://www.seek.com.au//job/73447293?type=standout&ref=search-standalone,retail consumer products,Retail Assistants,Sales Assistant - Casual,Glamaco Australia Pty Ltd,-,160000.0,162500.0,165000.0,Brisbane QLD,Sales Assistant - Casual,"[<div class=""_1wkzzau0 a1msqi6m""><span class=""_1wkzzau0 a1msqi4y lnocuo0 lnocuo1 lnocuo21 _1d0g9qk4 lnocuo7""><a aria-label=""Limit results to Arana Hills"" class=""_1wkzzau0 _1wkzzauf _1wkzzau0 _1wkzzauf _842p0a0 _842p0a2"" data-automation=""jobLocation"" href=""/jobs-in-retail-consumer-products/in-Arana-Hills-QLD-4054?salarytype=annual&amp;salaryrange=160000-165000"" rel=""nofollow"" tabindex=""-1"" target=""_self"" title=""Limit results to Arana Hills"">Arana Hills</a>, <a aria-label=""Limit results to Brisbane QLD"" class=""_1wkzzau0 _1wkzzauf _1wkzzau0 _1wkzzauf _842p0a0 _842p0a2"" data-automation=""jobLocation"" href=""/jobs-in-retail-consumer-products/in-All-Brisbane-QLD?salarytype=annual&amp;salaryrange=160000-165000"" rel=""nofollow"" tabindex=""-1"" target=""_self"" title=""Limit results to Brisbane QLD"">Brisbane QLD</a></span></div>]",2024-02-01,Retail-consumer-products - None,08/02/2024
17,https://www.seek.com.au//job/73581823?type=standout&ref=search-standalone,retail consumer products,Buying,Buyer Homewares,Kmart,-,160000.0,162500.0,165000.0,Melbourne VIC,"Manage the Technical Design team, to support the Apparel merchandising & Design departments in the execution of complex product","[<div class=""_1wkzzau0 a1msqi6m""><span class=""_1wkzzau0 a1msqi4y lnocuo0 lnocuo1 lnocuo21 _1d0g9qk4 lnocuo7""><a aria-label=""Limit results to Mulgrave"" class=""_1wkzzau0 _1wkzzauf _1wkzzau0 _1wkzzauf _842p0a0 _842p0a2"" data-automation=""jobLocation"" href=""/jobs-in-retail-consumer-products/in-Mulgrave-VIC-3170?salarytype=annual&amp;salaryrange=160000-165000"" rel=""nofollow"" tabindex=""-1"" target=""_self"" title=""Limit results to Mulgrave"">Mulgrave</a>, <a aria-label=""Limit results to Melbourne VIC"" class=""_1wkzzau0 _1wkzzauf _1wkzzau0 _1wkzzauf _842p0a0 _842p0a2"" data-automation=""jobLocation"" href=""/jobs-in-retail-consumer-products/in-All-Melbourne-VIC?salarytype=annual&amp;salaryrange=160000-165000"" rel=""nofollow"" tabindex=""-1"" target=""_self"" title=""Limit results to Melbourne VIC"">Melbourne VIC</a></span></div>]",2024-02-07,Retail-consumer-products - None,08/02/2024
18,https://www.seek.com.au//job/73392436?type=standard&ref=search-standalone,retail consumer products,Management - Area/Multi-site,Area Manager,ALDI Stores Australia,-,160000.0,162500.0,165000.0,"Sale, Bairnsdale & Gippsland VIC","As an ALDI Area Manager, you will be the driving force behind multiple store locations, shaping the future of retail and inspiring excellence.","[<div class=""_1wkzzau0 a1msqi6m""><span class=""_1wkzzau0 a1msqi4y lnocuo0 lnocuo1 lnocuo21 _1d0g9qk4 lnocuo7""><a aria-label=""Limit results to Sale"" class=""_1wkzzau0 _1wkzzauf _1wkzzau0 _1wkzzauf _842p0a0 _842p0a2"" data-automation=""jobLocation"" href=""/jobs-in-retail-consumer-products/in-Sale-VIC-3850?salarytype=annual&amp;salaryrange=160000-165000"" rel=""nofollow"" tabindex=""-1"" target=""_self"" title=""Limit results to Sale"">Sale</a>, <a aria-label=""Limit results to Bairnsdale &amp; Gippsland VIC"" class=""_1wkzzau0 _1wkzzauf _1wkzzau0 _1wkzzauf _842p0a0 _842p0a2"" data-automation=""jobLocation"" href=""/jobs-in-retail-consumer-products/in-Bairnsdale-&amp;-Gippsland-VIC?salarytype=annual&amp;salaryrange=160000-165000"" rel=""nofollow"" tabindex=""-1"" target=""_self"" title=""Limit results to Bairnsdale &amp; Gippsland VIC"">Bairnsdale &amp; Gippsland VIC</a></span></div>]",2024-01-30,Retail-consumer-products - None,08/02/2024
19,https://www.seek.com.au//job/73277708?type=standout&ref=search-standalone,retail consumer products,Management - Area/Multi-site,Operations Manager,Wizard Professional Services,"$160,000 – $180,000 + Bonus of up to $20,000 p.a",160000.0,170000.0,180000.0,"Kalgoorlie, Kalgoorlie, Goldfields & Esperance WA",Exciting opportunity to make an impact on the local community in Kalgoorlie through the operations management of four Wizard Pharmacies.,"[<div class=""_1wkzzau0 a1msqi6m""><span class=""_1wkzzau0 a1msqi4y lnocuo0 lnocuo1 lnocuo21 _1d0g9qk4 lnocuo7""><a aria-label=""Limit results to Kalgoorlie"" class=""_1wkzzau0 _1wkzzauf _1wkzzau0 _1wkzzauf _842p0a0 _842p0a2"" data-automation=""jobLocation"" href=""/jobs-in-retail-consumer-products/in-Kalgoorlie-WA-6430?salarytype=annual&amp;salaryrange=160000-165000"" rel=""nofollow"" tabindex=""-1"" target=""_self"" title=""Limit results to Kalgoorlie"">Kalgoorlie</a>, <a aria-label=""Limit results to Kalgoorlie, Goldfields &amp; Esperance WA"" class=""_1wkzzau0 _1wkzzauf _1wkzzau0 _1wkzzauf _842p0a0 _842p0a2"" data-automation=""jobLocation"" href=""/jobs-in-retail-consumer-products/in-Kalgoorlie,-Goldfields-&amp;-Esperance-WA?salarytype=annual&amp;salaryrange=160000-165000"" rel=""nofollow"" tabindex=""-1"" target=""_self"" title=""Limit results to Kalgoorlie, Goldfields &amp; Esperance WA"">Kalgoorlie, Goldfields &amp; Esperance WA</a></span></div>, <div class=""_1wkzzau0 a1msqi6m""><div aria-label=""Salary: $160,000 – $180,000 + Bonus of up to $20,000 p.a"" class=""_1wkzzau0""><span class=""_1wkzzau0 a1msqi4y lnocuo0 lnocuo1 lnocuo21 _1d0g9qk4 lnocuo7"" data-automation=""jobSalary""><span class=""_1wkzzau0 _16v7pfz1 a1msqi4y a1msqi0 a1msqir _16v7pfz3"" style=""--_16v7pfz2:2"">$160,000 – $180,000 + Bonus of up to $20,000 p.a</span></span></div></div>]",2024-01-24,Retail-consumer-products - None,08/02/2024
20,https://www.seek.com.au//job/73572624?type=standout&ref=search-standalone,retail consumer products,Management - Store,Store Manager - Woolworths Greater Hobart Area,Woolworths Group,-,160000.0,162500.0,165000.0,Hobart TAS,"Apply your business lens across multiple departments while driving positive outcomes for your store, teams and customers","[<div class=""_1wkzzau0 a1msqi6m""><span class=""_1wkzzau0 a1msqi4y lnocuo0 lnocuo1 lnocuo21 _1d0g9qk4 lnocuo7""><a aria-label=""Limit results to Hobart TAS"" class=""_1wkzzau0 _1wkzzauf _1wkzzau0 _1wkzzauf _842p0a0 _842p0a2"" data-automation=""jobLocation"" href=""/jobs-in-retail-consumer-products/in-All-Hobart-TAS?salarytype=annual&amp;salaryrange=160000-165000"" rel=""nofollow"" tabindex=""-1"" target=""_self"" title=""Limit results to Hobart TAS"">Hobart TAS</a></span></div>]",2024-02-07,Retail-consumer-products - None,08/02/2024
21,https://www.seek.com.au//job/73611168?type=standard&ref=search-standalone,retail consumer products,Planning,Merchandise Planner - Retail,Quest Personnel,-,160000.0,162500.0,165000.0,Melbourne VIC,Seasoned Planner - Retail,"[<div class=""_1wkzzau0 a1msqi6m""><span class=""_1wkzzau0 a1msqi4y lnocuo0 lnocuo1 lnocuo21 _1d0g9qk4 lnocuo7""><a aria-label=""Limit results to Melbourne VIC"" class=""_1wkzzau0 _1wkzzauf _1wkzzau0 _1wkzzauf _842p0a0 _842p0a2"" data-automation=""jobLocation"" href=""/jobs-in-retail-consumer-products/in-All-Melbourne-VIC?salarytype=annual&amp;salaryrange=160000-165000"" rel=""nofollow"" tabindex=""-1"" target=""_self"" title=""Limit results to Melbourne VIC"">Melbourne VIC</a></span></div>]",,Retail-consumer-products - None,08/02/2024
