,link,classification,category,title,company,salary,min_salary,average_salary,max_salary,location,description,entireDiv,date_posted,Category,Date
39,https://www.seek.com.au//job/73229451?type=standout&ref=search-standalone,real estate property,Other,Superintendent Accommodation Services,Coronado Curragh Pty Ltd,Competitive remuneration package!,245000.0,247500.0,250000.0,"Blackwater, Gladstone & Central QLD","Join our team at the Curragh Mine as Superintendent of Accommodation Services in Blackwater, in a newly created and exciting role!","[<div class=""_1wkzzau0 a1msqi6m""><span class=""_1wkzzau0 a1msqi4y lnocuo0 lnocuo1 lnocuo21 _1d0g9qk4 lnocuo7""><a aria-label=""Limit results to Blackwater"" class=""_1wkzzau0 _1wkzzauf _1wkzzau0 _1wkzzauf _842p0a0 _842p0a2"" data-automation=""jobLocation"" href=""/jobs-in-real-estate-property/in-Blackwater-QLD-4717?salarytype=annual&amp;salaryrange=245000-250000"" rel=""nofollow"" tabindex=""-1"" target=""_self"" title=""Limit results to Blackwater"">Blackwater</a>, <a aria-label=""Limit results to Gladstone &amp; Central QLD"" class=""_1wkzzau0 _1wkzzauf _1wkzzau0 _1wkzzauf _842p0a0 _842p0a2"" data-automation=""jobLocation"" href=""/jobs-in-real-estate-property/in-Gladstone-&amp;-Central-QLD?salarytype=annual&amp;salaryrange=245000-250000"" rel=""nofollow"" tabindex=""-1"" target=""_self"" title=""Limit results to Gladstone &amp; Central QLD"">Gladstone &amp; Central QLD</a></span></div>, <div class=""_1wkzzau0 a1msqi6m""><div aria-label=""Salary: Competitive remuneration package!"" class=""_1wkzzau0""><span class=""_1wkzzau0 a1msqi4y lnocuo0 lnocuo1 lnocuo21 _1d0g9qk4 lnocuo7"" data-automation=""jobSalary""><span class=""_1wkzzau0 _16v7pfz1 a1msqi4y a1msqi0 a1msqir _16v7pfz3"" style=""--_16v7pfz2:2"">Competitive remuneration package!</span></span></div></div>]",2024-01-23,Real-estate-property - None,08/02/2024
40,https://www.seek.com.au//job/73541257?type=standout&ref=search-standalone,real estate property,"Commercial Sales, Leasing & Property Mgmt",Leasing Executive,RetPro,-,245000.0,247500.0,250000.0,Gold Coast QLD,"Do you love securing deals, and building relationships with retailers? Apply now to take full ownership of this Leasing Executive role at RetPro.","[<div class=""_1wkzzau0 a1msqi6m""><span class=""_1wkzzau0 a1msqi4y lnocuo0 lnocuo1 lnocuo21 _1d0g9qk4 lnocuo7""><a aria-label=""Limit results to Varsity Lakes"" class=""_1wkzzau0 _1wkzzauf _1wkzzau0 _1wkzzauf _842p0a0 _842p0a2"" data-automation=""jobLocation"" href=""/jobs-in-real-estate-property/in-Varsity-Lakes-QLD-4227?salarytype=annual&amp;salaryrange=245000-250000"" rel=""nofollow"" tabindex=""-1"" target=""_self"" title=""Limit results to Varsity Lakes"">Varsity Lakes</a>, <a aria-label=""Limit results to Gold Coast QLD"" class=""_1wkzzau0 _1wkzzauf _1wkzzau0 _1wkzzauf _842p0a0 _842p0a2"" data-automation=""jobLocation"" href=""/jobs-in-real-estate-property/in-All-Gold-Coast-QLD?salarytype=annual&amp;salaryrange=245000-250000"" rel=""nofollow"" tabindex=""-1"" target=""_self"" title=""Limit results to Gold Coast QLD"">Gold Coast QLD</a></span></div>]",2024-02-06,Real-estate-property - None,08/02/2024
41,https://www.seek.com.au//job/73614759?type=standard&ref=search-standalone,real estate property,Body Corporate & Facilities Management,Facility Management General Manager,Denique Consulting Pty Ltd,-,245000.0,247500.0,250000.0,Melbourne VIC,Utilise your commercial/operational skills to lead & drive a $50M+ outsourced maintenance services contract in a highly profitable & growing company.,"[<div class=""_1wkzzau0 a1msqi6m""><span class=""_1wkzzau0 a1msqi4y lnocuo0 lnocuo1 lnocuo21 _1d0g9qk4 lnocuo7""><a aria-label=""Limit results to Melbourne VIC"" class=""_1wkzzau0 _1wkzzauf _1wkzzau0 _1wkzzauf _842p0a0 _842p0a2"" data-automation=""jobLocation"" href=""/jobs-in-real-estate-property/in-All-Melbourne-VIC?salarytype=annual&amp;salaryrange=245000-250000"" rel=""nofollow"" tabindex=""-1"" target=""_self"" title=""Limit results to Melbourne VIC"">Melbourne VIC</a></span></div>]",,Real-estate-property - None,08/02/2024
42,https://www.seek.com.au//job/73357092?type=standard&ref=search-standalone,real estate property,Other,Brokers - Hotels and Motels,,"$200,000 – $250,000 per year",200000.0,225000.0,250000.0,Gold Coast QLD,Work with QLD's 4th biggest seller of property with a proven model,"[<div class=""_1wkzzau0 a1msqi6m""><span class=""_1wkzzau0 a1msqi4y lnocuo0 lnocuo1 lnocuo21 _1d0g9qk4 lnocuo7""><a aria-label=""Limit results to Southport"" class=""_1wkzzau0 _1wkzzauf _1wkzzau0 _1wkzzauf _842p0a0 _842p0a2"" data-automation=""jobLocation"" href=""/jobs-in-real-estate-property/in-Southport-QLD-4215?salarytype=annual&amp;salaryrange=245000-250000"" rel=""nofollow"" tabindex=""-1"" target=""_self"" title=""Limit results to Southport"">Southport</a>, <a aria-label=""Limit results to Gold Coast QLD"" class=""_1wkzzau0 _1wkzzauf _1wkzzau0 _1wkzzauf _842p0a0 _842p0a2"" data-automation=""jobLocation"" href=""/jobs-in-real-estate-property/in-All-Gold-Coast-QLD?salarytype=annual&amp;salaryrange=245000-250000"" rel=""nofollow"" tabindex=""-1"" target=""_self"" title=""Limit results to Gold Coast QLD"">Gold Coast QLD</a></span></div>, <div class=""_1wkzzau0 a1msqi6m""><div aria-label=""Salary: $200,000 – $250,000 per year"" class=""_1wkzzau0""><span class=""_1wkzzau0 a1msqi4y lnocuo0 lnocuo1 lnocuo21 _1d0g9qk4 lnocuo7"" data-automation=""jobSalary""><span class=""_1wkzzau0 _16v7pfz1 a1msqi4y a1msqi0 a1msqir _16v7pfz3"" style=""--_16v7pfz2:2"">$200,000 – $250,000 per year</span></span></div></div>]",2024-01-29,Real-estate-property - None,08/02/2024
43,https://www.seek.com.au//job/73476548?type=standard&ref=search-standalone,real estate property,"Commercial Sales, Leasing & Property Mgmt",Leasing Executive - Shopping Centres,GOUGH RECRUITMENT - REAL ESTATE | PROPERTY | DEVELOPMENT | CONSTRUCTION,Flexible Dependent on Experience,245000.0,247500.0,250000.0,Melbourne VIC,Work with a major ASX Listed property group! Seeking a Retail Leasing Executive to work across Major Shopping Centres in VIC,"[<div class=""_1wkzzau0 a1msqi6m""><span class=""_1wkzzau0 a1msqi4y lnocuo0 lnocuo1 lnocuo21 _1d0g9qk4 lnocuo7""><a aria-label=""Limit results to Melbourne VIC"" class=""_1wkzzau0 _1wkzzauf _1wkzzau0 _1wkzzauf _842p0a0 _842p0a2"" data-automation=""jobLocation"" href=""/jobs-in-real-estate-property/in-All-Melbourne-VIC?salarytype=annual&amp;salaryrange=245000-250000"" rel=""nofollow"" tabindex=""-1"" target=""_self"" title=""Limit results to Melbourne VIC"">Melbourne VIC</a></span></div>, <div class=""_1wkzzau0 a1msqi6m""><div aria-label=""Salary: Flexible Dependent on Experience"" class=""_1wkzzau0""><span class=""_1wkzzau0 a1msqi4y lnocuo0 lnocuo1 lnocuo21 _1d0g9qk4 lnocuo7"" data-automation=""jobSalary""><span class=""_1wkzzau0 _16v7pfz1 a1msqi4y a1msqi0 a1msqir _16v7pfz3"" style=""--_16v7pfz2:2"">Flexible Dependent on Experience</span></span></div></div>]",2024-02-02,Real-estate-property - None,08/02/2024
44,https://www.seek.com.au//job/73510964?type=promoted&ref=search-standalone,real estate property,Retail & Property Development,Development Manager,Bluestone Recruitment,-,245000.0,247500.0,250000.0,Melbourne VIC,Delivery focused opportunity with an established private developer who are undertaking a joint venture with a leading global institution,"[<div class=""_1wkzzau0 a1msqi6m""><span class=""_1wkzzau0 a1msqi4y lnocuo0 lnocuo1 lnocuo21 _1d0g9qk4 lnocuo7""><a aria-label=""Limit results to Melbourne VIC"" class=""_1wkzzau0 _1wkzzauf _1wkzzau0 _1wkzzauf _842p0a0 _842p0a2"" data-automation=""jobLocation"" href=""/jobs-in-real-estate-property/in-All-Melbourne-VIC?salarytype=annual&amp;salaryrange=245000-250000"" rel=""nofollow"" tabindex=""-1"" target=""_self"" title=""Limit results to Melbourne VIC"">Melbourne VIC</a></span></div>]",,Real-estate-property - None,08/02/2024
45,https://www.seek.com.au//job/73278836?type=standout&ref=search-standalone,real estate property,Retail & Property Development,Head of Development,Kingfisher Recruitment,Up to $250k p.a. + Additional Benefits,245000.0,247500.0,250000.0,Melbourne VIC,Great opportunity for an experienced individual looking to work within a values driven organisation making a positive impact to people's lives.,"[<div class=""_1wkzzau0 a1msqi6m""><span class=""_1wkzzau0 a1msqi4y lnocuo0 lnocuo1 lnocuo21 _1d0g9qk4 lnocuo7""><a aria-label=""Limit results to Melbourne VIC"" class=""_1wkzzau0 _1wkzzauf _1wkzzau0 _1wkzzauf _842p0a0 _842p0a2"" data-automation=""jobLocation"" href=""/jobs-in-real-estate-property/in-All-Melbourne-VIC?salarytype=annual&amp;salaryrange=245000-250000"" rel=""nofollow"" tabindex=""-1"" target=""_self"" title=""Limit results to Melbourne VIC"">Melbourne VIC</a></span></div>, <div class=""_1wkzzau0 a1msqi6m""><div aria-label=""Salary: Up to $250k p.a. + Additional Benefits"" class=""_1wkzzau0""><span class=""_1wkzzau0 a1msqi4y lnocuo0 lnocuo1 lnocuo21 _1d0g9qk4 lnocuo7"" data-automation=""jobSalary""><span class=""_1wkzzau0 _16v7pfz1 a1msqi4y a1msqi0 a1msqir _16v7pfz3"" style=""--_16v7pfz2:2"">Up to $250k p.a. + Additional Benefits</span></span></div></div>]",2024-01-24,Real-estate-property - None,08/02/2024
46,https://www.seek.com.au//job/73406853?type=standout&ref=search-standalone,real estate property,Residential Sales,Property Investment Sales,Ironfish,-,245000.0,247500.0,250000.0,Sydney NSW,We are looking for experienced sales professionals who are passionate about property investment & enjoy creating long term customer relationships,"[<div class=""_1wkzzau0 a1msqi6m""><span class=""_1wkzzau0 a1msqi4y lnocuo0 lnocuo1 lnocuo21 _1d0g9qk4 lnocuo7""><a aria-label=""Limit results to North Sydney"" class=""_1wkzzau0 _1wkzzauf _1wkzzau0 _1wkzzauf _842p0a0 _842p0a2"" data-automation=""jobLocation"" href=""/jobs-in-real-estate-property/in-North-Sydney-NSW-2060?salarytype=annual&amp;salaryrange=245000-250000"" rel=""nofollow"" tabindex=""-1"" target=""_self"" title=""Limit results to North Sydney"">North Sydney</a>, <a aria-label=""Limit results to Sydney NSW"" class=""_1wkzzau0 _1wkzzauf _1wkzzau0 _1wkzzauf _842p0a0 _842p0a2"" data-automation=""jobLocation"" href=""/jobs-in-real-estate-property/in-All-Sydney-NSW?salarytype=annual&amp;salaryrange=245000-250000"" rel=""nofollow"" tabindex=""-1"" target=""_self"" title=""Limit results to Sydney NSW"">Sydney NSW</a></span></div>]",2024-01-31,Real-estate-property - None,08/02/2024
47,https://www.seek.com.au//job/73517508?type=standout&ref=search-standalone,real estate property,"Commercial Sales, Leasing & Property Mgmt",Commercial Leasing Consultant,Real Estate Career Developers,-,245000.0,247500.0,250000.0,Melbourne VIC,This is an incredible opportunity for a Salesperson to work with a prestigious real estate firm in the vibrant northern suburbs.,"[<div class=""_1wkzzau0 a1msqi6m""><span class=""_1wkzzau0 a1msqi4y lnocuo0 lnocuo1 lnocuo21 _1d0g9qk4 lnocuo7""><a aria-label=""Limit results to Carlton"" class=""_1wkzzau0 _1wkzzauf _1wkzzau0 _1wkzzauf _842p0a0 _842p0a2"" data-automation=""jobLocation"" href=""/jobs-in-real-estate-property/in-Carlton-VIC-3053?salarytype=annual&amp;salaryrange=245000-250000"" rel=""nofollow"" tabindex=""-1"" target=""_self"" title=""Limit results to Carlton"">Carlton</a>, <a aria-label=""Limit results to Melbourne VIC"" class=""_1wkzzau0 _1wkzzauf _1wkzzau0 _1wkzzauf _842p0a0 _842p0a2"" data-automation=""jobLocation"" href=""/jobs-in-real-estate-property/in-All-Melbourne-VIC?salarytype=annual&amp;salaryrange=245000-250000"" rel=""nofollow"" tabindex=""-1"" target=""_self"" title=""Limit results to Melbourne VIC"">Melbourne VIC</a></span></div>]",2024-02-05,Real-estate-property - None,08/02/2024
48,https://www.seek.com.au//job/73444969?type=standout&ref=search-standalone,real estate property,Other,Planning & Approvals Manager,AGL,-,245000.0,247500.0,250000.0,Brisbane QLD,Support AGL's decarbonisation strategy by managing renewable energy projects' land planning and regulatory approval processes.,"[<div class=""_1wkzzau0 a1msqi6m""><span class=""_1wkzzau0 a1msqi4y lnocuo0 lnocuo1 lnocuo21 _1d0g9qk4 lnocuo7""><a aria-label=""Limit results to Brisbane QLD"" class=""_1wkzzau0 _1wkzzauf _1wkzzau0 _1wkzzauf _842p0a0 _842p0a2"" data-automation=""jobLocation"" href=""/jobs-in-real-estate-property/in-All-Brisbane-QLD?salarytype=annual&amp;salaryrange=245000-250000"" rel=""nofollow"" tabindex=""-1"" target=""_self"" title=""Limit results to Brisbane QLD"">Brisbane QLD</a></span></div>]",2024-02-01,Real-estate-property - None,08/02/2024
49,https://www.seek.com.au//job/73453941?type=standout&ref=search-standalone,real estate property,Retail & Property Development,Land Acquisitions Manager - Land Lots for House and Land Packages,Devcon Property Services Pty Ltd,"OTE $200,000 pa (Salary plus Uncapped Commission)",245000.0,247500.0,250000.0,Brisbane QLD,Use your Knowledge and contact base to take your career in Land Acquisitions to a new level,"[<div class=""_1wkzzau0 a1msqi6m""><span class=""_1wkzzau0 a1msqi4y lnocuo0 lnocuo1 lnocuo21 _1d0g9qk4 lnocuo7""><a aria-label=""Limit results to North Lakes"" class=""_1wkzzau0 _1wkzzauf _1wkzzau0 _1wkzzauf _842p0a0 _842p0a2"" data-automation=""jobLocation"" href=""/jobs-in-real-estate-property/in-North-Lakes-QLD-4509?salarytype=annual&amp;salaryrange=245000-250000"" rel=""nofollow"" tabindex=""-1"" target=""_self"" title=""Limit results to North Lakes"">North Lakes</a>, <a aria-label=""Limit results to Brisbane QLD"" class=""_1wkzzau0 _1wkzzauf _1wkzzau0 _1wkzzauf _842p0a0 _842p0a2"" data-automation=""jobLocation"" href=""/jobs-in-real-estate-property/in-All-Brisbane-QLD?salarytype=annual&amp;salaryrange=245000-250000"" rel=""nofollow"" tabindex=""-1"" target=""_self"" title=""Limit results to Brisbane QLD"">Brisbane QLD</a></span></div>, <div class=""_1wkzzau0 a1msqi6m""><div aria-label=""Salary: OTE $200,000 pa (Salary plus Uncapped Commission)"" class=""_1wkzzau0""><span class=""_1wkzzau0 a1msqi4y lnocuo0 lnocuo1 lnocuo21 _1d0g9qk4 lnocuo7"" data-automation=""jobSalary""><span class=""_1wkzzau0 _16v7pfz1 a1msqi4y a1msqi0 a1msqir _16v7pfz3"" style=""--_16v7pfz2:2"">OTE $200,000 pa (Salary plus Uncapped Commission)</span></span></div></div>]",2024-02-01,Real-estate-property - None,08/02/2024
50,https://www.seek.com.au//job/73238837?type=standard&ref=search-standalone,real estate property,"Commercial Sales, Leasing & Property Mgmt",Senior Property Manager,Curtis Partnership,Market leading salary,245000.0,247500.0,250000.0,Sydney NSW,"Exciting client side, Senior Property Manager role managing a portfolio of office, retail and mixed use assets.","[<div class=""_1wkzzau0 a1msqi6m""><span class=""_1wkzzau0 a1msqi4y lnocuo0 lnocuo1 lnocuo21 _1d0g9qk4 lnocuo7""><a aria-label=""Limit results to Sydney NSW"" class=""_1wkzzau0 _1wkzzauf _1wkzzau0 _1wkzzauf _842p0a0 _842p0a2"" data-automation=""jobLocation"" href=""/jobs-in-real-estate-property/in-All-Sydney-NSW?salarytype=annual&amp;salaryrange=245000-250000"" rel=""nofollow"" tabindex=""-1"" target=""_self"" title=""Limit results to Sydney NSW"">Sydney NSW</a></span></div>, <div class=""_1wkzzau0 a1msqi6m""><div aria-label=""Salary: Market leading salary"" class=""_1wkzzau0""><span class=""_1wkzzau0 a1msqi4y lnocuo0 lnocuo1 lnocuo21 _1d0g9qk4 lnocuo7"" data-automation=""jobSalary""><span class=""_1wkzzau0 _16v7pfz1 a1msqi4y a1msqi0 a1msqir _16v7pfz3"" style=""--_16v7pfz2:2"">Market leading salary</span></span></div></div>]",2024-01-23,Real-estate-property - None,08/02/2024
51,https://www.seek.com.au//job/73506898?type=standout&ref=search-standalone,real estate property,Retail & Property Development,Senior Development Manager,Kingfisher Recruitment,Bonus + phone & laptop provided,245000.0,247500.0,250000.0,Melbourne VIC,"Lead ID_Land's growth as Senior Development Manager in Melbourne. Drive innovative residential projects, influence strategy, and shape team success.","[<div class=""_1wkzzau0 a1msqi6m""><span class=""_1wkzzau0 a1msqi4y lnocuo0 lnocuo1 lnocuo21 _1d0g9qk4 lnocuo7""><a aria-label=""Limit results to Melbourne VIC"" class=""_1wkzzau0 _1wkzzauf _1wkzzau0 _1wkzzauf _842p0a0 _842p0a2"" data-automation=""jobLocation"" href=""/jobs-in-real-estate-property/in-All-Melbourne-VIC?salarytype=annual&amp;salaryrange=245000-250000"" rel=""nofollow"" tabindex=""-1"" target=""_self"" title=""Limit results to Melbourne VIC"">Melbourne VIC</a></span></div>, <div class=""_1wkzzau0 a1msqi6m""><div aria-label=""Salary: Bonus + phone &amp; laptop provided"" class=""_1wkzzau0""><span class=""_1wkzzau0 a1msqi4y lnocuo0 lnocuo1 lnocuo21 _1d0g9qk4 lnocuo7"" data-automation=""jobSalary""><span class=""_1wkzzau0 _16v7pfz1 a1msqi4y a1msqi0 a1msqir _16v7pfz3"" style=""--_16v7pfz2:2"">Bonus + phone &amp; laptop provided</span></span></div></div>]",2024-02-04,Real-estate-property - None,08/02/2024
52,https://www.seek.com.au//job/73236581?type=standout&ref=search-standalone,real estate property,"Commercial Sales, Leasing & Property Mgmt",Asset Manager,Fiveight Property Management Pty Ltd,-,245000.0,247500.0,250000.0,Perth WA,"As an Asset Manager at Fiveight, you will play a pivotal role in the active and prudent management of our diverse portfolio of real estate assets.","[<div class=""_1wkzzau0 a1msqi6m""><span class=""_1wkzzau0 a1msqi4y lnocuo0 lnocuo1 lnocuo21 _1d0g9qk4 lnocuo7""><a aria-label=""Limit results to Perth WA"" class=""_1wkzzau0 _1wkzzauf _1wkzzau0 _1wkzzauf _842p0a0 _842p0a2"" data-automation=""jobLocation"" href=""/jobs-in-real-estate-property/in-All-Perth-WA?salarytype=annual&amp;salaryrange=245000-250000"" rel=""nofollow"" tabindex=""-1"" target=""_self"" title=""Limit results to Perth WA"">Perth WA</a></span></div>]",2024-01-23,Real-estate-property - None,08/02/2024
53,https://www.seek.com.au//job/73583038?type=standout&ref=search-standalone,real estate property,Analysts,Senior Analyst,Redpath Partners Pty Ltd,-,245000.0,247500.0,250000.0,Sydney NSW,"Redpath Partners are proud to be partnering with an investment platform in strong growth phase, for the recruitment of a Senior / Lead Analyst","[<div class=""_1wkzzau0 a1msqi6m""><span class=""_1wkzzau0 a1msqi4y lnocuo0 lnocuo1 lnocuo21 _1d0g9qk4 lnocuo7""><a aria-label=""Limit results to Sydney NSW"" class=""_1wkzzau0 _1wkzzauf _1wkzzau0 _1wkzzauf _842p0a0 _842p0a2"" data-automation=""jobLocation"" href=""/jobs-in-real-estate-property/in-All-Sydney-NSW?salarytype=annual&amp;salaryrange=245000-250000"" rel=""nofollow"" tabindex=""-1"" target=""_self"" title=""Limit results to Sydney NSW"">Sydney NSW</a></span></div>]",2024-02-07,Real-estate-property - None,08/02/2024
54,https://www.seek.com.au//job/73352236?type=standard&ref=search-standalone,real estate property,Residential Sales,Investment Property Specialist Consultant,CAMERON BIRD PROPERTY GROUP,"Annual earnings exceeding $250,000 per annum",245000.0,247500.0,250000.0,Brisbane QLD,The property market is currently experiencing an unprecedented surge in activity. You have the chance to generate exceptional income.,"[<div class=""_1wkzzau0 a1msqi6m""><span class=""_1wkzzau0 a1msqi4y lnocuo0 lnocuo1 lnocuo21 _1d0g9qk4 lnocuo7""><a aria-label=""Limit results to Brisbane QLD"" class=""_1wkzzau0 _1wkzzauf _1wkzzau0 _1wkzzauf _842p0a0 _842p0a2"" data-automation=""jobLocation"" href=""/jobs-in-real-estate-property/in-All-Brisbane-QLD?salarytype=annual&amp;salaryrange=245000-250000"" rel=""nofollow"" tabindex=""-1"" target=""_self"" title=""Limit results to Brisbane QLD"">Brisbane QLD</a></span></div>, <div class=""_1wkzzau0 a1msqi6m""><div aria-label=""Salary: Annual earnings exceeding $250,000 per annum"" class=""_1wkzzau0""><span class=""_1wkzzau0 a1msqi4y lnocuo0 lnocuo1 lnocuo21 _1d0g9qk4 lnocuo7"" data-automation=""jobSalary""><span class=""_1wkzzau0 _16v7pfz1 a1msqi4y a1msqi0 a1msqir _16v7pfz3"" style=""--_16v7pfz2:2"">Annual earnings exceeding $250,000 per annum</span></span></div></div>]",2024-01-29,Real-estate-property - None,08/02/2024
55,https://www.seek.com.au//job/73379707?type=standout&ref=search-standalone,real estate property,Body Corporate & Facilities Management,"National Operations Manager, Region Group",Knight Frank,Annual package,245000.0,247500.0,250000.0,Sydney NSW,A very unique opportunity to lead the Operational functions of a national retail facilities team,"[<div class=""_1wkzzau0 a1msqi6m""><span class=""_1wkzzau0 a1msqi4y lnocuo0 lnocuo1 lnocuo21 _1d0g9qk4 lnocuo7""><a aria-label=""Limit results to Sydney NSW"" class=""_1wkzzau0 _1wkzzauf _1wkzzau0 _1wkzzauf _842p0a0 _842p0a2"" data-automation=""jobLocation"" href=""/jobs-in-real-estate-property/in-All-Sydney-NSW?salarytype=annual&amp;salaryrange=245000-250000"" rel=""nofollow"" tabindex=""-1"" target=""_self"" title=""Limit results to Sydney NSW"">Sydney NSW</a></span></div>, <div class=""_1wkzzau0 a1msqi6m""><div aria-label=""Salary: Annual package"" class=""_1wkzzau0""><span class=""_1wkzzau0 a1msqi4y lnocuo0 lnocuo1 lnocuo21 _1d0g9qk4 lnocuo7"" data-automation=""jobSalary""><span class=""_1wkzzau0 _16v7pfz1 a1msqi4y a1msqi0 a1msqir _16v7pfz3"" style=""--_16v7pfz2:2"">Annual package</span></span></div></div>]",2024-01-30,Real-estate-property - None,08/02/2024
56,https://www.seek.com.au//job/73597775?type=standout&ref=search-standalone,real estate property,Administration,Regional Manager Retail Administration,Scentre Group,-,245000.0,247500.0,250000.0,Sydney NSW,"Great opportunity to join our Retail Administration team in a leadership role! Join an ASX listed company, who supports and develops their people!","[<div class=""_1wkzzau0 a1msqi6m""><span class=""_1wkzzau0 a1msqi4y lnocuo0 lnocuo1 lnocuo21 _1d0g9qk4 lnocuo7""><a aria-label=""Limit results to Sydney NSW"" class=""_1wkzzau0 _1wkzzauf _1wkzzau0 _1wkzzauf _842p0a0 _842p0a2"" data-automation=""jobLocation"" href=""/jobs-in-real-estate-property/in-All-Sydney-NSW?salarytype=annual&amp;salaryrange=245000-250000"" rel=""nofollow"" tabindex=""-1"" target=""_self"" title=""Limit results to Sydney NSW"">Sydney NSW</a></span></div>]",2024-02-07,Real-estate-property - None,08/02/2024
57,https://www.seek.com.au//job/73533913?type=standard&ref=search-standalone,real estate property,Retail & Property Development,Senior Development Manager,Boston Global,"$250,000 – $300,000 per year",250000.0,275000.0,300000.0,Sydney NSW,"Lead landmark projects, negotiate deals, and advance your career as a Senior DM. Join our group for growth and diverse real estate opportunities","[<div class=""_1wkzzau0 a1msqi6m""><span class=""_1wkzzau0 a1msqi4y lnocuo0 lnocuo1 lnocuo21 _1d0g9qk4 lnocuo7""><a aria-label=""Limit results to Sydney NSW"" class=""_1wkzzau0 _1wkzzauf _1wkzzau0 _1wkzzauf _842p0a0 _842p0a2"" data-automation=""jobLocation"" href=""/jobs-in-real-estate-property/in-All-Sydney-NSW?salarytype=annual&amp;salaryrange=245000-250000"" rel=""nofollow"" tabindex=""-1"" target=""_self"" title=""Limit results to Sydney NSW"">Sydney NSW</a></span></div>, <div class=""_1wkzzau0 a1msqi6m""><div aria-label=""Salary: $250,000 – $300,000 per year"" class=""_1wkzzau0""><span class=""_1wkzzau0 a1msqi4y lnocuo0 lnocuo1 lnocuo21 _1d0g9qk4 lnocuo7"" data-automation=""jobSalary""><span class=""_1wkzzau0 _16v7pfz1 a1msqi4y a1msqi0 a1msqir _16v7pfz3"" style=""--_16v7pfz2:2"">$250,000 – $300,000 per year</span></span></div></div>]",2024-02-06,Real-estate-property - None,08/02/2024
58,https://www.seek.com.au//job/73513689?type=standout&ref=search-standalone,real estate property,Retail & Property Development,Development Director,Capstone Recruitment Group Pty Ltd,-,245000.0,247500.0,250000.0,Sydney NSW,Strategic and leadership role focusing on residential development and masterplan communities,"[<div class=""_1wkzzau0 a1msqi6m""><span class=""_1wkzzau0 a1msqi4y lnocuo0 lnocuo1 lnocuo21 _1d0g9qk4 lnocuo7""><a aria-label=""Limit results to Sydney NSW"" class=""_1wkzzau0 _1wkzzauf _1wkzzau0 _1wkzzauf _842p0a0 _842p0a2"" data-automation=""jobLocation"" href=""/jobs-in-real-estate-property/in-All-Sydney-NSW?salarytype=annual&amp;salaryrange=245000-250000"" rel=""nofollow"" tabindex=""-1"" target=""_self"" title=""Limit results to Sydney NSW"">Sydney NSW</a></span></div>]",2024-02-05,Real-estate-property - None,08/02/2024
59,https://www.seek.com.au//job/73268362?type=standard&ref=search-standalone,real estate property,Retail & Property Development,Acquisitions Manager,Allura Partners,$230-275K package + bonus,55200.0,152600.0,250000.0,Brisbane QLD,Large Property Group are looking for an Acquisitions Manager to join them on a permanent basis. High Growth trajectory and an active role.,"[<div class=""_1wkzzau0 a1msqi6m""><span class=""_1wkzzau0 a1msqi4y lnocuo0 lnocuo1 lnocuo21 _1d0g9qk4 lnocuo7""><a aria-label=""Limit results to Brisbane QLD"" class=""_1wkzzau0 _1wkzzauf _1wkzzau0 _1wkzzauf _842p0a0 _842p0a2"" data-automation=""jobLocation"" href=""/jobs-in-real-estate-property/in-All-Brisbane-QLD?salarytype=annual&amp;salaryrange=245000-250000"" rel=""nofollow"" tabindex=""-1"" target=""_self"" title=""Limit results to Brisbane QLD"">Brisbane QLD</a></span></div>, <div class=""_1wkzzau0 a1msqi6m""><div aria-label=""Salary: $230-275K package + bonus"" class=""_1wkzzau0""><span class=""_1wkzzau0 a1msqi4y lnocuo0 lnocuo1 lnocuo21 _1d0g9qk4 lnocuo7"" data-automation=""jobSalary""><span class=""_1wkzzau0 _16v7pfz1 a1msqi4y a1msqi0 a1msqir _16v7pfz3"" style=""--_16v7pfz2:2"">$230-275K package + bonus</span></span></div></div>]",2024-01-24,Real-estate-property - None,08/02/2024
