,link,classification,category,title,company,salary,min_salary,average_salary,max_salary,location,description,entireDiv,date_posted,Category,Date
0,https://www.seek.com.au//job/73618173?type=promoted&ref=search-standalone,construction,Foreperson/Supervisors,Building Supervisor,Sterling Homes Pty. Ltd.,-,140000.0,142500.0,145000.0,Adelaide SA,Full time Building Supervisor position at a top South Australian builder,"[<div class=""_1wkzzau0 a1msqi6m""><span class=""_1wkzzau0 a1msqi4y lnocuo0 lnocuo1 lnocuo21 _1d0g9qk4 lnocuo7""><a aria-label=""Limit results to Allenby Gardens"" class=""_1wkzzau0 _1wkzzauf _1wkzzau0 _1wkzzauf _842p0a0 _842p0a2"" data-automation=""jobLocation"" href=""/jobs-in-construction/in-Allenby-Gardens-SA-5009?salarytype=annual&amp;salaryrange=140000-145000"" rel=""nofollow"" tabindex=""-1"" target=""_self"" title=""Limit results to Allenby Gardens"">Allenby Gardens</a>, <a aria-label=""Limit results to Adelaide SA"" class=""_1wkzzau0 _1wkzzauf _1wkzzau0 _1wkzzauf _842p0a0 _842p0a2"" data-automation=""jobLocation"" href=""/jobs-in-construction/in-All-Adelaide-SA?salarytype=annual&amp;salaryrange=140000-145000"" rel=""nofollow"" tabindex=""-1"" target=""_self"" title=""Limit results to Adelaide SA"">Adelaide SA</a></span></div>]",,Construction - None,08/02/2024
1,https://www.seek.com.au//job/73628445?type=promoted&ref=search-standalone,construction,Foreperson/Supervisors,Construction Supervisor - Northern Midlands Irrigation Scheme,Tasmanian Irrigation,-,140000.0,142500.0,145000.0,"Launceston, Launceston & North East TAS",We are looking for a proactive and experienced individual to join our site supervision team and integrate with our Project Management teams.,"[<div class=""_1wkzzau0 a1msqi6m""><span class=""_1wkzzau0 a1msqi4y lnocuo0 lnocuo1 lnocuo21 _1d0g9qk4 lnocuo7""><a aria-label=""Limit results to Launceston"" class=""_1wkzzau0 _1wkzzauf _1wkzzau0 _1wkzzauf _842p0a0 _842p0a2"" data-automation=""jobLocation"" href=""/jobs-in-construction/in-Launceston-TAS-7250?salarytype=annual&amp;salaryrange=140000-145000"" rel=""nofollow"" tabindex=""-1"" target=""_self"" title=""Limit results to Launceston"">Launceston</a>, <a aria-label=""Limit results to Launceston &amp; North East TAS"" class=""_1wkzzau0 _1wkzzauf _1wkzzau0 _1wkzzauf _842p0a0 _842p0a2"" data-automation=""jobLocation"" href=""/jobs-in-construction/in-Launceston-&amp;-North-East-TAS?salarytype=annual&amp;salaryrange=140000-145000"" rel=""nofollow"" tabindex=""-1"" target=""_self"" title=""Limit results to Launceston &amp; North East TAS"">Launceston &amp; North East TAS</a></span></div>]",,Construction - None,08/02/2024
2,https://www.seek.com.au//job/73620820?type=standard&ref=search-standalone,construction,Project Management,Project Manager,Wingecarribee Shire Council,"$113,187.88 – $131,298.44 per year",113187.88,122243.16,131298.44,Other,Full-time Opportunity for a Project Manager to join the Wingecarribee Shire Council!,"[<div class=""_1wkzzau0 a1msqi6m""><span class=""_1wkzzau0 a1msqi4y lnocuo0 lnocuo1 lnocuo21 _1d0g9qk4 lnocuo7""><a aria-label=""Limit results to Moss Vale"" class=""_1wkzzau0 _1wkzzauf _1wkzzau0 _1wkzzauf _842p0a0 _842p0a2"" data-automation=""jobLocation"" href=""/jobs-in-construction/in-Moss-Vale-NSW-2577?salarytype=annual&amp;salaryrange=140000-145000"" rel=""nofollow"" tabindex=""-1"" target=""_self"" title=""Limit results to Moss Vale"">Moss Vale</a>, <a aria-label=""Limit results to Southern Highlands &amp; Tablelands NSW"" class=""_1wkzzau0 _1wkzzauf _1wkzzau0 _1wkzzauf _842p0a0 _842p0a2"" data-automation=""jobLocation"" href=""/jobs-in-construction/in-Southern-Highlands-&amp;-Tablelands-NSW?salarytype=annual&amp;salaryrange=140000-145000"" rel=""nofollow"" tabindex=""-1"" target=""_self"" title=""Limit results to Southern Highlands &amp; Tablelands NSW"">Southern Highlands &amp; Tablelands NSW</a></span></div>, <div class=""_1wkzzau0 a1msqi6m""><div aria-label=""Salary: $113,187.88 – $131,298.44 per year"" class=""_1wkzzau0""><span class=""_1wkzzau0 a1msqi4y lnocuo0 lnocuo1 lnocuo21 _1d0g9qk4 lnocuo7"" data-automation=""jobSalary""><span class=""_1wkzzau0 _16v7pfz1 a1msqi4y a1msqi0 a1msqir _16v7pfz3"" style=""--_16v7pfz2:2"">$113,187.88 – $131,298.44 per year</span></span></div></div>]",,Construction - None,08/02/2024
3,https://www.seek.com.au//job/73470724?type=standard&ref=search-standalone,construction,Foreperson/Supervisors,Site Manager,Monarch Building Solutions (AUST) P/L,"$130,000 – $150,000 per year",130000.0,140000.0,150000.0,Other,Site Manager,"[<div class=""_1wkzzau0 a1msqi6m""><span class=""_1wkzzau0 a1msqi4y lnocuo0 lnocuo1 lnocuo21 _1d0g9qk4 lnocuo7""><a aria-label=""Limit results to Wagga Wagga"" class=""_1wkzzau0 _1wkzzauf _1wkzzau0 _1wkzzauf _842p0a0 _842p0a2"" data-automation=""jobLocation"" href=""/jobs-in-construction/in-Wagga-Wagga-NSW-2650?salarytype=annual&amp;salaryrange=140000-145000"" rel=""nofollow"" tabindex=""-1"" target=""_self"" title=""Limit results to Wagga Wagga"">Wagga Wagga</a>, <a aria-label=""Limit results to Wagga Wagga &amp; Riverina NSW"" class=""_1wkzzau0 _1wkzzauf _1wkzzau0 _1wkzzauf _842p0a0 _842p0a2"" data-automation=""jobLocation"" href=""/jobs-in-construction/in-Wagga-Wagga-&amp;-Riverina-NSW?salarytype=annual&amp;salaryrange=140000-145000"" rel=""nofollow"" tabindex=""-1"" target=""_self"" title=""Limit results to Wagga Wagga &amp; Riverina NSW"">Wagga Wagga &amp; Riverina NSW</a></span></div>, <div class=""_1wkzzau0 a1msqi6m""><div aria-label=""Salary: $130,000 – $150,000 per year"" class=""_1wkzzau0""><span class=""_1wkzzau0 a1msqi4y lnocuo0 lnocuo1 lnocuo21 _1d0g9qk4 lnocuo7"" data-automation=""jobSalary""><span class=""_1wkzzau0 _16v7pfz1 a1msqi4y a1msqi0 a1msqir _16v7pfz3"" style=""--_16v7pfz2:2"">$130,000 – $150,000 per year</span></span></div></div>]",2024-02-02,Construction - None,08/02/2024
4,https://www.seek.com.au//job/73632716?type=standout&ref=search-standalone,construction,Foreperson/Supervisors,Site supervisor,GEMCON Building,"$120,000 – $135,000 per year",120000.0,127500.0,135000.0,Sydney NSW,.,"[<div class=""_1wkzzau0 a1msqi6m""><span class=""_1wkzzau0 a1msqi4y lnocuo0 lnocuo1 lnocuo21 _1d0g9qk4 lnocuo7""><a aria-label=""Limit results to Sydney NSW"" class=""_1wkzzau0 _1wkzzauf _1wkzzau0 _1wkzzauf _842p0a0 _842p0a2"" data-automation=""jobLocation"" href=""/jobs-in-construction/in-All-Sydney-NSW?salarytype=annual&amp;salaryrange=140000-145000"" rel=""nofollow"" tabindex=""-1"" target=""_self"" title=""Limit results to Sydney NSW"">Sydney NSW</a></span></div>, <div class=""_1wkzzau0 a1msqi6m""><div aria-label=""Salary: $120,000 – $135,000 per year"" class=""_1wkzzau0""><span class=""_1wkzzau0 a1msqi4y lnocuo0 lnocuo1 lnocuo21 _1d0g9qk4 lnocuo7"" data-automation=""jobSalary""><span class=""_1wkzzau0 _16v7pfz1 a1msqi4y a1msqi0 a1msqir _16v7pfz3"" style=""--_16v7pfz2:2"">$120,000 – $135,000 per year</span></span></div></div>]",,Construction - None,08/02/2024
5,https://www.seek.com.au//job/73430049?type=standard&ref=search-standalone,construction,Plant & Machinery Operators,Civil Labourers/Roller Operators - multi positions,Protech NQ,$45 - $63 per hour,81000.0,97200.0,113400.0,"Rockhampton, Rockhampton & Capricorn Coast QLD",Do you currently hold a Roller competency/ticket?,"[<div class=""_1wkzzau0 a1msqi6m""><span class=""_1wkzzau0 a1msqi4y lnocuo0 lnocuo1 lnocuo21 _1d0g9qk4 lnocuo7""><a aria-label=""Limit results to Rockhampton"" class=""_1wkzzau0 _1wkzzauf _1wkzzau0 _1wkzzauf _842p0a0 _842p0a2"" data-automation=""jobLocation"" href=""/jobs-in-construction/in-Rockhampton-QLD-4700?salarytype=annual&amp;salaryrange=140000-145000"" rel=""nofollow"" tabindex=""-1"" target=""_self"" title=""Limit results to Rockhampton"">Rockhampton</a>, <a aria-label=""Limit results to Rockhampton &amp; Capricorn Coast QLD"" class=""_1wkzzau0 _1wkzzauf _1wkzzau0 _1wkzzauf _842p0a0 _842p0a2"" data-automation=""jobLocation"" href=""/jobs-in-construction/in-Rockhampton-&amp;-Capricorn-Coast-QLD?salarytype=annual&amp;salaryrange=140000-145000"" rel=""nofollow"" tabindex=""-1"" target=""_self"" title=""Limit results to Rockhampton &amp; Capricorn Coast QLD"">Rockhampton &amp; Capricorn Coast QLD</a></span></div>, <div class=""_1wkzzau0 a1msqi6m""><div aria-label=""Salary: $45 - $63 per hour"" class=""_1wkzzau0""><span class=""_1wkzzau0 a1msqi4y lnocuo0 lnocuo1 lnocuo21 _1d0g9qk4 lnocuo7"" data-automation=""jobSalary""><span class=""_1wkzzau0 _16v7pfz1 a1msqi4y a1msqi0 a1msqir _16v7pfz3"" style=""--_16v7pfz2:2"">$45 - $63 per hour</span></span></div></div>]",2024-01-31,Construction - None,08/02/2024
6,https://www.seek.com.au//job/73581703?type=standout&ref=search-standalone,construction,Surveying,Building Consultant,CHU Underwriting Agencies Pty Ltd,"Base, annual bonus and vehicle / vehicle allowance",140000.0,142500.0,145000.0,Other,We are seeking an enthusiastic Building Consultant to come and join our growing CHU Consult Team in NSW!,"[<div class=""_1wkzzau0 a1msqi6m""><span class=""_1wkzzau0 a1msqi4y lnocuo0 lnocuo1 lnocuo21 _1d0g9qk4 lnocuo7""><a aria-label=""Limit results to Gosford"" class=""_1wkzzau0 _1wkzzauf _1wkzzau0 _1wkzzauf _842p0a0 _842p0a2"" data-automation=""jobLocation"" href=""/jobs-in-construction/in-Gosford-NSW-2250?salarytype=annual&amp;salaryrange=140000-145000"" rel=""nofollow"" tabindex=""-1"" target=""_self"" title=""Limit results to Gosford"">Gosford</a>, <a aria-label=""Limit results to Gosford &amp; Central Coast NSW"" class=""_1wkzzau0 _1wkzzauf _1wkzzau0 _1wkzzauf _842p0a0 _842p0a2"" data-automation=""jobLocation"" href=""/jobs-in-construction/in-Gosford-&amp;-Central-Coast-NSW?salarytype=annual&amp;salaryrange=140000-145000"" rel=""nofollow"" tabindex=""-1"" target=""_self"" title=""Limit results to Gosford &amp; Central Coast NSW"">Gosford &amp; Central Coast NSW</a></span></div>, <div class=""_1wkzzau0 a1msqi6m""><div aria-label=""Salary: Base, annual bonus and vehicle / vehicle allowance"" class=""_1wkzzau0""><span class=""_1wkzzau0 a1msqi4y lnocuo0 lnocuo1 lnocuo21 _1d0g9qk4 lnocuo7"" data-automation=""jobSalary""><span class=""_1wkzzau0 _16v7pfz1 a1msqi4y a1msqi0 a1msqir _16v7pfz3"" style=""--_16v7pfz2:2"">Base, annual bonus and vehicle / vehicle allowance</span></span></div></div>]",2024-02-07,Construction - None,08/02/2024
7,https://www.seek.com.au//job/73628445?type=standout&ref=search-standalone,construction,Foreperson/Supervisors,Construction Supervisor - Northern Midlands Irrigation Scheme,Tasmanian Irrigation,-,140000.0,142500.0,145000.0,"Launceston, Launceston & North East TAS",We are looking for a proactive and experienced individual to join our site supervision team and integrate with our Project Management teams.,"[<div class=""_1wkzzau0 a1msqi6m""><span class=""_1wkzzau0 a1msqi4y lnocuo0 lnocuo1 lnocuo21 _1d0g9qk4 lnocuo7""><a aria-label=""Limit results to Launceston"" class=""_1wkzzau0 _1wkzzauf _1wkzzau0 _1wkzzauf _842p0a0 _842p0a2"" data-automation=""jobLocation"" href=""/jobs-in-construction/in-Launceston-TAS-7250?salarytype=annual&amp;salaryrange=140000-145000"" rel=""nofollow"" tabindex=""-1"" target=""_self"" title=""Limit results to Launceston"">Launceston</a>, <a aria-label=""Limit results to Launceston &amp; North East TAS"" class=""_1wkzzau0 _1wkzzauf _1wkzzau0 _1wkzzauf _842p0a0 _842p0a2"" data-automation=""jobLocation"" href=""/jobs-in-construction/in-Launceston-&amp;-North-East-TAS?salarytype=annual&amp;salaryrange=140000-145000"" rel=""nofollow"" tabindex=""-1"" target=""_self"" title=""Limit results to Launceston &amp; North East TAS"">Launceston &amp; North East TAS</a></span></div>]",,Construction - None,08/02/2024
8,https://www.seek.com.au//job/73578688?type=standout&ref=search-standalone,construction,Foreperson/Supervisors,Construction Site Supervisor (South East Region),Mimosa Homes,-,140000.0,142500.0,145000.0,Melbourne VIC,"•	$$$ + Super + Car  + Mobile Phone + Laptop + Ipad!
•	Join a dynamic team with a great culture
•	Melbourne’s award-winning new home building company","[<div class=""_1wkzzau0 a1msqi6m""><span class=""_1wkzzau0 a1msqi4y lnocuo0 lnocuo1 lnocuo21 _1d0g9qk4 lnocuo7""><a aria-label=""Limit results to Clyde"" class=""_1wkzzau0 _1wkzzauf _1wkzzau0 _1wkzzauf _842p0a0 _842p0a2"" data-automation=""jobLocation"" href=""/jobs-in-construction/in-Clyde-VIC-3978?salarytype=annual&amp;salaryrange=140000-145000"" rel=""nofollow"" tabindex=""-1"" target=""_self"" title=""Limit results to Clyde"">Clyde</a>, <a aria-label=""Limit results to Melbourne VIC"" class=""_1wkzzau0 _1wkzzauf _1wkzzau0 _1wkzzauf _842p0a0 _842p0a2"" data-automation=""jobLocation"" href=""/jobs-in-construction/in-All-Melbourne-VIC?salarytype=annual&amp;salaryrange=140000-145000"" rel=""nofollow"" tabindex=""-1"" target=""_self"" title=""Limit results to Melbourne VIC"">Melbourne VIC</a></span></div>]",2024-02-07,Construction - None,08/02/2024
9,https://www.seek.com.au//job/73545748?type=standard&ref=search-standalone,construction,Project Management,Construction Project Manager,SGA Design,"$90,000 – $135,000 per year",90000.0,112500.0,135000.0,Melbourne VIC,"High-End Residential Projects.
Both design and construction are managed in-house.
Competitive salary and opportunities for professional growth.","[<div class=""_1wkzzau0 a1msqi6m""><span class=""_1wkzzau0 a1msqi4y lnocuo0 lnocuo1 lnocuo21 _1d0g9qk4 lnocuo7""><a aria-label=""Limit results to Box Hill"" class=""_1wkzzau0 _1wkzzauf _1wkzzau0 _1wkzzauf _842p0a0 _842p0a2"" data-automation=""jobLocation"" href=""/jobs-in-construction/in-Box-Hill-VIC-3128?salarytype=annual&amp;salaryrange=140000-145000"" rel=""nofollow"" tabindex=""-1"" target=""_self"" title=""Limit results to Box Hill"">Box Hill</a>, <a aria-label=""Limit results to Melbourne VIC"" class=""_1wkzzau0 _1wkzzauf _1wkzzau0 _1wkzzauf _842p0a0 _842p0a2"" data-automation=""jobLocation"" href=""/jobs-in-construction/in-All-Melbourne-VIC?salarytype=annual&amp;salaryrange=140000-145000"" rel=""nofollow"" tabindex=""-1"" target=""_self"" title=""Limit results to Melbourne VIC"">Melbourne VIC</a></span></div>, <div class=""_1wkzzau0 a1msqi6m""><div aria-label=""Salary: $90,000 – $135,000 per year"" class=""_1wkzzau0""><span class=""_1wkzzau0 a1msqi4y lnocuo0 lnocuo1 lnocuo21 _1d0g9qk4 lnocuo7"" data-automation=""jobSalary""><span class=""_1wkzzau0 _16v7pfz1 a1msqi4y a1msqi0 a1msqir _16v7pfz3"" style=""--_16v7pfz2:2"">$90,000 – $135,000 per year</span></span></div></div>]",2024-02-06,Construction - None,08/02/2024
10,https://www.seek.com.au//job/73451817?type=standout&ref=search-standalone,construction,Project Management,Project Manager,Forefront Recruitment,$140 – $160k plus car,252000.0,252000.0,252000.0,Other,Are you looking for a new challenge? Do you see yourself leading a business? Commercial builder developing in the Albury and Wagga regions.,"[<div class=""_1wkzzau0 a1msqi6m""><span class=""_1wkzzau0 a1msqi4y lnocuo0 lnocuo1 lnocuo21 _1d0g9qk4 lnocuo7""><a aria-label=""Limit results to Albury"" class=""_1wkzzau0 _1wkzzauf _1wkzzau0 _1wkzzauf _842p0a0 _842p0a2"" data-automation=""jobLocation"" href=""/jobs-in-construction/in-Albury-NSW-2640?salarytype=annual&amp;salaryrange=140000-145000"" rel=""nofollow"" tabindex=""-1"" target=""_self"" title=""Limit results to Albury"">Albury</a>, <a aria-label=""Limit results to Albury Area NSW"" class=""_1wkzzau0 _1wkzzauf _1wkzzau0 _1wkzzauf _842p0a0 _842p0a2"" data-automation=""jobLocation"" href=""/jobs-in-construction/in-Albury-Area-NSW?salarytype=annual&amp;salaryrange=140000-145000"" rel=""nofollow"" tabindex=""-1"" target=""_self"" title=""Limit results to Albury Area NSW"">Albury Area NSW</a></span></div>, <div class=""_1wkzzau0 a1msqi6m""><div aria-label=""Salary: $140 – $160k plus car"" class=""_1wkzzau0""><span class=""_1wkzzau0 a1msqi4y lnocuo0 lnocuo1 lnocuo21 _1d0g9qk4 lnocuo7"" data-automation=""jobSalary""><span class=""_1wkzzau0 _16v7pfz1 a1msqi4y a1msqi0 a1msqir _16v7pfz3"" style=""--_16v7pfz2:2"">$140 – $160k plus car</span></span></div></div>]",2024-02-01,Construction - None,08/02/2024
11,https://www.seek.com.au//job/73622917?type=standout&ref=search-standalone,construction,Foreperson/Supervisors,Construction Supervisor - Residential Construction,Lofty Building Group,-,140000.0,142500.0,145000.0,Adelaide SA,Lofty Building Group is a South Australian owned and operated residential building company and recently ranked the 9th largest builder in SA.,"[<div class=""_1wkzzau0 a1msqi6m""><span class=""_1wkzzau0 a1msqi4y lnocuo0 lnocuo1 lnocuo21 _1d0g9qk4 lnocuo7""><a aria-label=""Limit results to Unley"" class=""_1wkzzau0 _1wkzzauf _1wkzzau0 _1wkzzauf _842p0a0 _842p0a2"" data-automation=""jobLocation"" href=""/jobs-in-construction/in-Unley-SA-5061?salarytype=annual&amp;salaryrange=140000-145000"" rel=""nofollow"" tabindex=""-1"" target=""_self"" title=""Limit results to Unley"">Unley</a>, <a aria-label=""Limit results to Adelaide SA"" class=""_1wkzzau0 _1wkzzauf _1wkzzau0 _1wkzzauf _842p0a0 _842p0a2"" data-automation=""jobLocation"" href=""/jobs-in-construction/in-All-Adelaide-SA?salarytype=annual&amp;salaryrange=140000-145000"" rel=""nofollow"" tabindex=""-1"" target=""_self"" title=""Limit results to Adelaide SA"">Adelaide SA</a></span></div>]",,Construction - None,08/02/2024
12,https://www.seek.com.au//job/73611492?type=standout&ref=search-standalone,construction,Foreperson/Supervisors,Works Supervisor (Civil Construction),Ivory Group,$55 - $60 per hour + Super,99000.0,103500.0,108000.0,Other,"Ivory Group is seeking an experienced Construction Supervisor to join a regional Council, to lead major maintenance projects in a 6 month contract.","[<div class=""_1wkzzau0 a1msqi6m""><span class=""_1wkzzau0 a1msqi4y lnocuo0 lnocuo1 lnocuo21 _1d0g9qk4 lnocuo7""><a aria-label=""Limit results to Port Macquarie &amp; Mid North Coast NSW"" class=""_1wkzzau0 _1wkzzauf _1wkzzau0 _1wkzzauf _842p0a0 _842p0a2"" data-automation=""jobLocation"" href=""/jobs-in-construction/in-Port-Macquarie-&amp;-Mid-North-Coast-NSW?salarytype=annual&amp;salaryrange=140000-145000"" rel=""nofollow"" tabindex=""-1"" target=""_self"" title=""Limit results to Port Macquarie &amp; Mid North Coast NSW"">Port Macquarie &amp; Mid North Coast NSW</a></span></div>, <div class=""_1wkzzau0 a1msqi6m""><div aria-label=""Salary: $55 - $60 per hour + Super"" class=""_1wkzzau0""><span class=""_1wkzzau0 a1msqi4y lnocuo0 lnocuo1 lnocuo21 _1d0g9qk4 lnocuo7"" data-automation=""jobSalary""><span class=""_1wkzzau0 _16v7pfz1 a1msqi4y a1msqi0 a1msqir _16v7pfz3"" style=""--_16v7pfz2:2"">$55 - $60 per hour + Super</span></span></div></div>]",,Construction - None,08/02/2024
13,https://www.seek.com.au//job/73610931?type=standout&ref=search-standalone,construction,Foreperson/Supervisors,Site Manager,,"$80,000 – $120,000 per year",80000.0,100000.0,120000.0,Sydney NSW,An exciting opportunity to work for an established commercial fitout company specialising in quality end-to-end fitouts.,"[<div class=""_1wkzzau0 a1msqi6m""><span class=""_1wkzzau0 a1msqi4y lnocuo0 lnocuo1 lnocuo21 _1d0g9qk4 lnocuo7""><a aria-label=""Limit results to North Sydney"" class=""_1wkzzau0 _1wkzzauf _1wkzzau0 _1wkzzauf _842p0a0 _842p0a2"" data-automation=""jobLocation"" href=""/jobs-in-construction/in-North-Sydney-NSW-2060?salarytype=annual&amp;salaryrange=140000-145000"" rel=""nofollow"" tabindex=""-1"" target=""_self"" title=""Limit results to North Sydney"">North Sydney</a>, <a aria-label=""Limit results to Sydney NSW"" class=""_1wkzzau0 _1wkzzauf _1wkzzau0 _1wkzzauf _842p0a0 _842p0a2"" data-automation=""jobLocation"" href=""/jobs-in-construction/in-All-Sydney-NSW?salarytype=annual&amp;salaryrange=140000-145000"" rel=""nofollow"" tabindex=""-1"" target=""_self"" title=""Limit results to Sydney NSW"">Sydney NSW</a></span></div>, <div class=""_1wkzzau0 a1msqi6m""><div aria-label=""Salary: $80,000 – $120,000 per year"" class=""_1wkzzau0""><span class=""_1wkzzau0 a1msqi4y lnocuo0 lnocuo1 lnocuo21 _1d0g9qk4 lnocuo7"" data-automation=""jobSalary""><span class=""_1wkzzau0 _16v7pfz1 a1msqi4y a1msqi0 a1msqir _16v7pfz3"" style=""--_16v7pfz2:2"">$80,000 – $120,000 per year</span></span></div></div>]",,Construction - None,08/02/2024
14,https://www.seek.com.au//job/73581772?type=standout&ref=search-standalone,construction,Surveying,Building Consultant,CHU Underwriting Agencies Pty Ltd,"Base, annual bonus and vehicle / vehicle allowance",140000.0,142500.0,145000.0,Sydney NSW,We are seeking an enthusiastic Building Consultant to come and join our growing CHU Consult Team in NSW!,"[<div class=""_1wkzzau0 a1msqi6m""><span class=""_1wkzzau0 a1msqi4y lnocuo0 lnocuo1 lnocuo21 _1d0g9qk4 lnocuo7""><a aria-label=""Limit results to Sydney NSW"" class=""_1wkzzau0 _1wkzzauf _1wkzzau0 _1wkzzauf _842p0a0 _842p0a2"" data-automation=""jobLocation"" href=""/jobs-in-construction/in-All-Sydney-NSW?salarytype=annual&amp;salaryrange=140000-145000"" rel=""nofollow"" tabindex=""-1"" target=""_self"" title=""Limit results to Sydney NSW"">Sydney NSW</a></span></div>, <div class=""_1wkzzau0 a1msqi6m""><div aria-label=""Salary: Base, annual bonus and vehicle / vehicle allowance"" class=""_1wkzzau0""><span class=""_1wkzzau0 a1msqi4y lnocuo0 lnocuo1 lnocuo21 _1d0g9qk4 lnocuo7"" data-automation=""jobSalary""><span class=""_1wkzzau0 _16v7pfz1 a1msqi4y a1msqi0 a1msqir _16v7pfz3"" style=""--_16v7pfz2:2"">Base, annual bonus and vehicle / vehicle allowance</span></span></div></div>]",2024-02-07,Construction - None,08/02/2024
15,https://www.seek.com.au//job/73506972?type=standout&ref=search-standalone,construction,Foreperson/Supervisors,Construction Supervisor South West,JWH Group Pty Ltd,-,140000.0,142500.0,145000.0,"Bunbury, Bunbury & South West WA",Seeking a dynamic and driven Construction Supervisor/Trainee Construction Supervisor to join our team,"[<div class=""_1wkzzau0 a1msqi6m""><span class=""_1wkzzau0 a1msqi4y lnocuo0 lnocuo1 lnocuo21 _1d0g9qk4 lnocuo7""><a aria-label=""Limit results to Bunbury"" class=""_1wkzzau0 _1wkzzauf _1wkzzau0 _1wkzzauf _842p0a0 _842p0a2"" data-automation=""jobLocation"" href=""/jobs-in-construction/in-Bunbury-WA-6230?salarytype=annual&amp;salaryrange=140000-145000"" rel=""nofollow"" tabindex=""-1"" target=""_self"" title=""Limit results to Bunbury"">Bunbury</a>, <a aria-label=""Limit results to Bunbury &amp; South West WA"" class=""_1wkzzau0 _1wkzzauf _1wkzzau0 _1wkzzauf _842p0a0 _842p0a2"" data-automation=""jobLocation"" href=""/jobs-in-construction/in-Bunbury-&amp;-South-West-WA?salarytype=annual&amp;salaryrange=140000-145000"" rel=""nofollow"" tabindex=""-1"" target=""_self"" title=""Limit results to Bunbury &amp; South West WA"">Bunbury &amp; South West WA</a></span></div>]",2024-02-04,Construction - None,08/02/2024
16,https://www.seek.com.au//job/73622872?type=standard&ref=search-standalone,construction,Foreperson/Supervisors,Site Supervisor - Residential - ACT,Design & Build,$100k+super/car/phone,100000.0,122500.0,145000.0,Canberra ACT,This is a prime opportunity to step into a Supervisor position working for a leading residential builder.,"[<div class=""_1wkzzau0 a1msqi6m""><span class=""_1wkzzau0 a1msqi4y lnocuo0 lnocuo1 lnocuo21 _1d0g9qk4 lnocuo7""><a aria-label=""Limit results to Canberra ACT"" class=""_1wkzzau0 _1wkzzauf _1wkzzau0 _1wkzzauf _842p0a0 _842p0a2"" data-automation=""jobLocation"" href=""/jobs-in-construction/in-All-Canberra-ACT?salarytype=annual&amp;salaryrange=140000-145000"" rel=""nofollow"" tabindex=""-1"" target=""_self"" title=""Limit results to Canberra ACT"">Canberra ACT</a></span></div>, <div class=""_1wkzzau0 a1msqi6m""><div aria-label=""Salary: $100k+super/car/phone"" class=""_1wkzzau0""><span class=""_1wkzzau0 a1msqi4y lnocuo0 lnocuo1 lnocuo21 _1d0g9qk4 lnocuo7"" data-automation=""jobSalary""><span class=""_1wkzzau0 _16v7pfz1 a1msqi4y a1msqi0 a1msqir _16v7pfz3"" style=""--_16v7pfz2:2"">$100k+super/car/phone</span></span></div></div>]",,Construction - None,08/02/2024
17,https://www.seek.com.au//job/73561091?type=standout&ref=search-standalone,construction,Contracts Management,Contracts Administrator / Assistant Project Manager,SFN Build,"$120,000 – $150,000 per year",120000.0,135000.0,150000.0,Sydney NSW,Contracts Administrator required for award-winning Inner West builder with several new projects in the pipeline. A great time to join SFN Build.,"[<div class=""_1wkzzau0 a1msqi6m""><span class=""_1wkzzau0 a1msqi4y lnocuo0 lnocuo1 lnocuo21 _1d0g9qk4 lnocuo7""><a aria-label=""Limit results to Leichhardt"" class=""_1wkzzau0 _1wkzzauf _1wkzzau0 _1wkzzauf _842p0a0 _842p0a2"" data-automation=""jobLocation"" href=""/jobs-in-construction/in-Leichhardt-NSW-2040?salarytype=annual&amp;salaryrange=140000-145000"" rel=""nofollow"" tabindex=""-1"" target=""_self"" title=""Limit results to Leichhardt"">Leichhardt</a>, <a aria-label=""Limit results to Sydney NSW"" class=""_1wkzzau0 _1wkzzauf _1wkzzau0 _1wkzzauf _842p0a0 _842p0a2"" data-automation=""jobLocation"" href=""/jobs-in-construction/in-All-Sydney-NSW?salarytype=annual&amp;salaryrange=140000-145000"" rel=""nofollow"" tabindex=""-1"" target=""_self"" title=""Limit results to Sydney NSW"">Sydney NSW</a></span></div>, <div class=""_1wkzzau0 a1msqi6m""><div aria-label=""Salary: $120,000 – $150,000 per year"" class=""_1wkzzau0""><span class=""_1wkzzau0 a1msqi4y lnocuo0 lnocuo1 lnocuo21 _1d0g9qk4 lnocuo7"" data-automation=""jobSalary""><span class=""_1wkzzau0 _16v7pfz1 a1msqi4y a1msqi0 a1msqir _16v7pfz3"" style=""--_16v7pfz2:2"">$120,000 – $150,000 per year</span></span></div></div>]",2024-02-06,Construction - None,08/02/2024
