,link,classification,category,title,company,salary,min_salary,average_salary,max_salary,location,description,entireDiv,date_posted,Category,Date
43,https://www.seek.com.au//job/73445077?type=standout&ref=search-standalone,retail consumer products,Other,Innovation & Development ANZ Lead,Haleon,-,160000.0,162500.0,165000.0,Sydney NSW,Drive key innovation and development projects aimed at improving the health and quality of life for consumers!,"[<div class=""_1wkzzau0 a1msqi6m""><span class=""_1wkzzau0 a1msqi4y lnocuo0 lnocuo1 lnocuo21 _1d0g9qk4 lnocuo7""><a aria-label=""Limit results to Parramatta"" class=""_1wkzzau0 _1wkzzauf _1wkzzau0 _1wkzzauf _842p0a0 _842p0a2"" data-automation=""jobLocation"" href=""/jobs-in-retail-consumer-products/in-Parramatta-NSW-2150?salarytype=annual&amp;salaryrange=160000-165000"" rel=""nofollow"" tabindex=""-1"" target=""_self"" title=""Limit results to Parramatta"">Parramatta</a>, <a aria-label=""Limit results to Sydney NSW"" class=""_1wkzzau0 _1wkzzauf _1wkzzau0 _1wkzzauf _842p0a0 _842p0a2"" data-automation=""jobLocation"" href=""/jobs-in-retail-consumer-products/in-All-Sydney-NSW?salarytype=annual&amp;salaryrange=160000-165000"" rel=""nofollow"" tabindex=""-1"" target=""_self"" title=""Limit results to Sydney NSW"">Sydney NSW</a></span></div>]",2024-02-01,Retail-consumer-products - None,08/02/2024
44,https://www.seek.com.au//job/73480155?type=promoted&ref=search-standalone,retail consumer products,Management - Area/Multi-site,State Manager - VIC,,-,160000.0,162500.0,165000.0,Melbourne VIC,"This is a hands-on and leadership role, responsible for developing and optimising the operations, overall sales, and profitability of the State.","[<div class=""_1wkzzau0 a1msqi6m""><span class=""_1wkzzau0 a1msqi4y lnocuo0 lnocuo1 lnocuo21 _1d0g9qk4 lnocuo7""><a aria-label=""Limit results to Clayton"" class=""_1wkzzau0 _1wkzzauf _1wkzzau0 _1wkzzauf _842p0a0 _842p0a2"" data-automation=""jobLocation"" href=""/jobs-in-retail-consumer-products/in-Clayton-VIC-3168?salarytype=annual&amp;salaryrange=160000-165000"" rel=""nofollow"" tabindex=""-1"" target=""_self"" title=""Limit results to Clayton"">Clayton</a>, <a aria-label=""Limit results to Melbourne VIC"" class=""_1wkzzau0 _1wkzzauf _1wkzzau0 _1wkzzauf _842p0a0 _842p0a2"" data-automation=""jobLocation"" href=""/jobs-in-retail-consumer-products/in-All-Melbourne-VIC?salarytype=annual&amp;salaryrange=160000-165000"" rel=""nofollow"" tabindex=""-1"" target=""_self"" title=""Limit results to Melbourne VIC"">Melbourne VIC</a></span></div>]",,Retail-consumer-products - None,08/02/2024
45,https://www.seek.com.au//job/73015287?type=promoted&ref=search-standalone,retail consumer products,Management - Area/Multi-site,Project Manager - Retail Site Expansion,,-,160000.0,162500.0,165000.0,Wollongong NSW,Project Management role within a dynamic and rapidly growing business,"[<div class=""_1wkzzau0 a1msqi6m""><span class=""_1wkzzau0 a1msqi4y lnocuo0 lnocuo1 lnocuo21 _1d0g9qk4 lnocuo7""><a aria-label=""Limit results to Wollongong"" class=""_1wkzzau0 _1wkzzauf _1wkzzau0 _1wkzzauf _842p0a0 _842p0a2"" data-automation=""jobLocation"" href=""/jobs-in-retail-consumer-products/in-Wollongong-NSW-2500?salarytype=annual&amp;salaryrange=160000-165000"" rel=""nofollow"" tabindex=""-1"" target=""_self"" title=""Limit results to Wollongong"">Wollongong</a>, <a aria-label=""Limit results to Wollongong, Illawarra &amp; South Coast NSW"" class=""_1wkzzau0 _1wkzzauf _1wkzzau0 _1wkzzauf _842p0a0 _842p0a2"" data-automation=""jobLocation"" href=""/jobs-in-retail-consumer-products/in-Wollongong,-Illawarra-&amp;-South-Coast-NSW?salarytype=annual&amp;salaryrange=160000-165000"" rel=""nofollow"" tabindex=""-1"" target=""_self"" title=""Limit results to Wollongong, Illawarra &amp; South Coast NSW"">Wollongong, Illawarra &amp; South Coast NSW</a></span></div>]",,Retail-consumer-products - None,08/02/2024
46,https://www.seek.com.au//job/72875407?type=standout&ref=search-standalone,retail consumer products,Management - Area/Multi-site,Area Manager,,"$130,000 – $150,000 package per year + bonus",130000.0,140000.0,150000.0,Brisbane QLD,"Be a visible leader working to develop your people, to get great commercial restaurant results in an environment where everyone is truly welcome.","[<div class=""_1wkzzau0 a1msqi6m""><span class=""_1wkzzau0 a1msqi4y lnocuo0 lnocuo1 lnocuo21 _1d0g9qk4 lnocuo7""><a aria-label=""Limit results to Brisbane QLD"" class=""_1wkzzau0 _1wkzzauf _1wkzzau0 _1wkzzauf _842p0a0 _842p0a2"" data-automation=""jobLocation"" href=""/jobs-in-retail-consumer-products/in-All-Brisbane-QLD?salarytype=annual&amp;salaryrange=160000-165000"" rel=""nofollow"" tabindex=""-1"" target=""_self"" title=""Limit results to Brisbane QLD"">Brisbane QLD</a></span></div>, <div class=""_1wkzzau0 a1msqi6m""><div aria-label=""Salary: $130,000 – $150,000 package per year + bonus"" class=""_1wkzzau0""><span class=""_1wkzzau0 a1msqi4y lnocuo0 lnocuo1 lnocuo21 _1d0g9qk4 lnocuo7"" data-automation=""jobSalary""><span class=""_1wkzzau0 _16v7pfz1 a1msqi4y a1msqi0 a1msqir _16v7pfz3"" style=""--_16v7pfz2:2"">$130,000 – $150,000 package per year + bonus</span></span></div></div>]",2024-01-10,Retail-consumer-products - None,08/02/2024
47,https://www.seek.com.au//job/72940320?type=standout&ref=search-standalone,retail consumer products,Management - Area/Multi-site,National Retail Manager,Propel Group Pty Ltd,-,160000.0,162500.0,165000.0,Melbourne VIC,"A unique opportunity for a commercially astute National Retail Manager to join RB Sellars, a loved heritage Australian brand.","[<div class=""_1wkzzau0 a1msqi6m""><span class=""_1wkzzau0 a1msqi4y lnocuo0 lnocuo1 lnocuo21 _1d0g9qk4 lnocuo7""><a aria-label=""Limit results to Melbourne VIC"" class=""_1wkzzau0 _1wkzzauf _1wkzzau0 _1wkzzauf _842p0a0 _842p0a2"" data-automation=""jobLocation"" href=""/jobs-in-retail-consumer-products/in-All-Melbourne-VIC?salarytype=annual&amp;salaryrange=160000-165000"" rel=""nofollow"" tabindex=""-1"" target=""_self"" title=""Limit results to Melbourne VIC"">Melbourne VIC</a></span></div>]",2024-01-11,Retail-consumer-products - None,08/02/2024
48,https://www.seek.com.au//job/73118027?type=standard&ref=search-standalone,retail consumer products,Management - Area/Multi-site,Area Manager,ALDI Stores Australia,-,160000.0,162500.0,165000.0,Melbourne VIC,"As an ALDI Area Manager, you will be the driving force behind multiple store locations, shaping the future of retail and inspiring excellence.","[<div class=""_1wkzzau0 a1msqi6m""><span class=""_1wkzzau0 a1msqi4y lnocuo0 lnocuo1 lnocuo21 _1d0g9qk4 lnocuo7""><a aria-label=""Limit results to Derrimut"" class=""_1wkzzau0 _1wkzzauf _1wkzzau0 _1wkzzauf _842p0a0 _842p0a2"" data-automation=""jobLocation"" href=""/jobs-in-retail-consumer-products/in-Derrimut-VIC-3030?salarytype=annual&amp;salaryrange=160000-165000"" rel=""nofollow"" tabindex=""-1"" target=""_self"" title=""Limit results to Derrimut"">Derrimut</a>, <a aria-label=""Limit results to Melbourne VIC"" class=""_1wkzzau0 _1wkzzauf _1wkzzau0 _1wkzzauf _842p0a0 _842p0a2"" data-automation=""jobLocation"" href=""/jobs-in-retail-consumer-products/in-All-Melbourne-VIC?salarytype=annual&amp;salaryrange=160000-165000"" rel=""nofollow"" tabindex=""-1"" target=""_self"" title=""Limit results to Melbourne VIC"">Melbourne VIC</a></span></div>]",2024-01-18,Retail-consumer-products - None,08/02/2024
49,https://www.seek.com.au//job/73016660?type=standard&ref=search-standalone,retail consumer products,Management - Area/Multi-site,Program Manager,Ethos BeathChapman,AUD 180000 - 190000 per annum,160000.0,162500.0,165000.0,Sydney NSW,2 year Fixed Term Contract - Program Manager role working in the retail and innovation team of a commercial business,"[<div class=""_1wkzzau0 a1msqi6m""><span class=""_1wkzzau0 a1msqi4y lnocuo0 lnocuo1 lnocuo21 _1d0g9qk4 lnocuo7""><a aria-label=""Limit results to Sydney NSW"" class=""_1wkzzau0 _1wkzzauf _1wkzzau0 _1wkzzauf _842p0a0 _842p0a2"" data-automation=""jobLocation"" href=""/jobs-in-retail-consumer-products/in-All-Sydney-NSW?salarytype=annual&amp;salaryrange=160000-165000"" rel=""nofollow"" tabindex=""-1"" target=""_self"" title=""Limit results to Sydney NSW"">Sydney NSW</a></span></div>, <div class=""_1wkzzau0 a1msqi6m""><div aria-label=""Salary: AUD 180000 - 190000 per annum"" class=""_1wkzzau0""><span class=""_1wkzzau0 a1msqi4y lnocuo0 lnocuo1 lnocuo21 _1d0g9qk4 lnocuo7"" data-automation=""jobSalary""><span class=""_1wkzzau0 _16v7pfz1 a1msqi4y a1msqi0 a1msqir _16v7pfz3"" style=""--_16v7pfz2:2"">AUD 180000 - 190000 per annum</span></span></div></div>]",2024-01-15,Retail-consumer-products - None,08/02/2024
50,https://www.seek.com.au//job/73377214?type=standout&ref=search-standalone,retail consumer products,Planning,Planning Manager,Planning Talent,-,160000.0,162500.0,165000.0,Melbourne VIC,"You will be Innovative, Strategic & Proven Leader in Planning with Commercial Acumen to trade a Retail Business & bring others along with you.","[<div class=""_1wkzzau0 a1msqi6m""><span class=""_1wkzzau0 a1msqi4y lnocuo0 lnocuo1 lnocuo21 _1d0g9qk4 lnocuo7""><a aria-label=""Limit results to Melbourne VIC"" class=""_1wkzzau0 _1wkzzauf _1wkzzau0 _1wkzzauf _842p0a0 _842p0a2"" data-automation=""jobLocation"" href=""/jobs-in-retail-consumer-products/in-All-Melbourne-VIC?salarytype=annual&amp;salaryrange=160000-165000"" rel=""nofollow"" tabindex=""-1"" target=""_self"" title=""Limit results to Melbourne VIC"">Melbourne VIC</a></span></div>]",2024-01-30,Retail-consumer-products - None,08/02/2024
51,https://www.seek.com.au//job/73202949?type=standout&ref=search-standalone,retail consumer products,Management - Area/Multi-site,Regional Manager,ACD Trade,-,160000.0,162500.0,165000.0,Brisbane QLD,Are you passionate about building high-performing teams? A track record in leadership and achieving growth targets? This opportunity could be yours!,"[<div class=""_1wkzzau0 a1msqi6m""><span class=""_1wkzzau0 a1msqi4y lnocuo0 lnocuo1 lnocuo21 _1d0g9qk4 lnocuo7""><a aria-label=""Limit results to Brisbane QLD"" class=""_1wkzzau0 _1wkzzauf _1wkzzau0 _1wkzzauf _842p0a0 _842p0a2"" data-automation=""jobLocation"" href=""/jobs-in-retail-consumer-products/in-All-Brisbane-QLD?salarytype=annual&amp;salaryrange=160000-165000"" rel=""nofollow"" tabindex=""-1"" target=""_self"" title=""Limit results to Brisbane QLD"">Brisbane QLD</a></span></div>]",2024-01-22,Retail-consumer-products - None,08/02/2024
52,https://www.seek.com.au//job/73472238?type=standout&ref=search-standalone,retail consumer products,Buying,Automotive Buyers - Full Time & Part Time,Dutton Automotive,"$100,000 - $150,000 OTE",100000.0,125000.0,150000.0,Melbourne VIC,Automotive Buyers - Full Time & Part Time,"[<div class=""_1wkzzau0 a1msqi6m""><span class=""_1wkzzau0 a1msqi4y lnocuo0 lnocuo1 lnocuo21 _1d0g9qk4 lnocuo7""><a aria-label=""Limit results to Burnley"" class=""_1wkzzau0 _1wkzzauf _1wkzzau0 _1wkzzauf _842p0a0 _842p0a2"" data-automation=""jobLocation"" href=""/jobs-in-retail-consumer-products/in-Burnley-VIC-3121?salarytype=annual&amp;salaryrange=160000-165000"" rel=""nofollow"" tabindex=""-1"" target=""_self"" title=""Limit results to Burnley"">Burnley</a>, <a aria-label=""Limit results to Melbourne VIC"" class=""_1wkzzau0 _1wkzzauf _1wkzzau0 _1wkzzauf _842p0a0 _842p0a2"" data-automation=""jobLocation"" href=""/jobs-in-retail-consumer-products/in-All-Melbourne-VIC?salarytype=annual&amp;salaryrange=160000-165000"" rel=""nofollow"" tabindex=""-1"" target=""_self"" title=""Limit results to Melbourne VIC"">Melbourne VIC</a></span></div>, <div class=""_1wkzzau0 a1msqi6m""><div aria-label=""Salary: $100,000 - $150,000 OTE"" class=""_1wkzzau0""><span class=""_1wkzzau0 a1msqi4y lnocuo0 lnocuo1 lnocuo21 _1d0g9qk4 lnocuo7"" data-automation=""jobSalary""><span class=""_1wkzzau0 _16v7pfz1 a1msqi4y a1msqi0 a1msqir _16v7pfz3"" style=""--_16v7pfz2:2"">$100,000 - $150,000 OTE</span></span></div></div>]",2024-02-02,Retail-consumer-products - None,08/02/2024
53,https://www.seek.com.au//job/73474188?type=standard&ref=search-standalone,retail consumer products,Retail Assistants,Golf Fitter,RecruitShop,Earn Negotiable Salary + Super + Incentives,160000.0,162500.0,165000.0,Sydney NSW,Reputable & Leading Golf Retailer Located In Alexandria | Quarterly Team Building Events | Training & Career Opps | Receive Discounts on Products,"[<div class=""_1wkzzau0 a1msqi6m""><span class=""_1wkzzau0 a1msqi4y lnocuo0 lnocuo1 lnocuo21 _1d0g9qk4 lnocuo7""><a aria-label=""Limit results to Alexandria"" class=""_1wkzzau0 _1wkzzauf _1wkzzau0 _1wkzzauf _842p0a0 _842p0a2"" data-automation=""jobLocation"" href=""/jobs-in-retail-consumer-products/in-Alexandria-NSW-2015?salarytype=annual&amp;salaryrange=160000-165000"" rel=""nofollow"" tabindex=""-1"" target=""_self"" title=""Limit results to Alexandria"">Alexandria</a>, <a aria-label=""Limit results to Sydney NSW"" class=""_1wkzzau0 _1wkzzauf _1wkzzau0 _1wkzzauf _842p0a0 _842p0a2"" data-automation=""jobLocation"" href=""/jobs-in-retail-consumer-products/in-All-Sydney-NSW?salarytype=annual&amp;salaryrange=160000-165000"" rel=""nofollow"" tabindex=""-1"" target=""_self"" title=""Limit results to Sydney NSW"">Sydney NSW</a></span></div>, <div class=""_1wkzzau0 a1msqi6m""><div aria-label=""Salary: Earn Negotiable Salary + Super + Incentives"" class=""_1wkzzau0""><span class=""_1wkzzau0 a1msqi4y lnocuo0 lnocuo1 lnocuo21 _1d0g9qk4 lnocuo7"" data-automation=""jobSalary""><span class=""_1wkzzau0 _16v7pfz1 a1msqi4y a1msqi0 a1msqir _16v7pfz3"" style=""--_16v7pfz2:2"">Earn Negotiable Salary + Super + Incentives</span></span></div></div>]",2024-02-02,Retail-consumer-products - None,08/02/2024
54,https://www.seek.com.au//job/73439517?type=standout&ref=search-standalone,retail consumer products,Other,Senior Product Developer,dusk Australasia,-,160000.0,162500.0,165000.0,Sydney NSW,"•	Competitive $$ inc bonus
•	Career progression opportunities
•	Hybrid work arrangement and supportive team 
•	Alexandria- based","[<div class=""_1wkzzau0 a1msqi6m""><span class=""_1wkzzau0 a1msqi4y lnocuo0 lnocuo1 lnocuo21 _1d0g9qk4 lnocuo7""><a aria-label=""Limit results to Sydney NSW"" class=""_1wkzzau0 _1wkzzauf _1wkzzau0 _1wkzzauf _842p0a0 _842p0a2"" data-automation=""jobLocation"" href=""/jobs-in-retail-consumer-products/in-All-Sydney-NSW?salarytype=annual&amp;salaryrange=160000-165000"" rel=""nofollow"" tabindex=""-1"" target=""_self"" title=""Limit results to Sydney NSW"">Sydney NSW</a></span></div>]",2024-02-01,Retail-consumer-products - None,08/02/2024
55,https://www.seek.com.au//job/73269047?type=standard&ref=search-standalone,retail consumer products,Buying,Buying Manager,Milligram,-,160000.0,162500.0,165000.0,Melbourne VIC,Showcase your commercial acumen and leadership expertise as you connect our customers with the world's best tools for living,"[<div class=""_1wkzzau0 a1msqi6m""><span class=""_1wkzzau0 a1msqi4y lnocuo0 lnocuo1 lnocuo21 _1d0g9qk4 lnocuo7""><a aria-label=""Limit results to Collingwood"" class=""_1wkzzau0 _1wkzzauf _1wkzzau0 _1wkzzauf _842p0a0 _842p0a2"" data-automation=""jobLocation"" href=""/jobs-in-retail-consumer-products/in-Collingwood-VIC-3066?salarytype=annual&amp;salaryrange=160000-165000"" rel=""nofollow"" tabindex=""-1"" target=""_self"" title=""Limit results to Collingwood"">Collingwood</a>, <a aria-label=""Limit results to Melbourne VIC"" class=""_1wkzzau0 _1wkzzauf _1wkzzau0 _1wkzzauf _842p0a0 _842p0a2"" data-automation=""jobLocation"" href=""/jobs-in-retail-consumer-products/in-All-Melbourne-VIC?salarytype=annual&amp;salaryrange=160000-165000"" rel=""nofollow"" tabindex=""-1"" target=""_self"" title=""Limit results to Melbourne VIC"">Melbourne VIC</a></span></div>]",2024-01-24,Retail-consumer-products - None,08/02/2024
56,https://www.seek.com.au//job/73281437?type=standout&ref=search-standalone,retail consumer products,Management - Department/Assistant,Store Manager - Big W Taigum,Big W,-,160000.0,162500.0,165000.0,Brisbane QLD,Develop and inspire the leaders of tomorrow whilst delighting our customers in this wonderful local community.,"[<div class=""_1wkzzau0 a1msqi6m""><span class=""_1wkzzau0 a1msqi4y lnocuo0 lnocuo1 lnocuo21 _1d0g9qk4 lnocuo7""><a aria-label=""Limit results to Taigum"" class=""_1wkzzau0 _1wkzzauf _1wkzzau0 _1wkzzauf _842p0a0 _842p0a2"" data-automation=""jobLocation"" href=""/jobs-in-retail-consumer-products/in-Taigum-QLD-4018?salarytype=annual&amp;salaryrange=160000-165000"" rel=""nofollow"" tabindex=""-1"" target=""_self"" title=""Limit results to Taigum"">Taigum</a>, <a aria-label=""Limit results to Brisbane QLD"" class=""_1wkzzau0 _1wkzzauf _1wkzzau0 _1wkzzauf _842p0a0 _842p0a2"" data-automation=""jobLocation"" href=""/jobs-in-retail-consumer-products/in-All-Brisbane-QLD?salarytype=annual&amp;salaryrange=160000-165000"" rel=""nofollow"" tabindex=""-1"" target=""_self"" title=""Limit results to Brisbane QLD"">Brisbane QLD</a></span></div>]",2024-01-24,Retail-consumer-products - None,08/02/2024
57,https://www.seek.com.au//job/73471380?type=standout&ref=search-standalone,retail consumer products,Planning,Senior Planner,Michael Hill Jeweller,"great perks, free parking, amazing discounts",160000.0,162500.0,165000.0,Brisbane QLD,"Be part of the team who really are behind the moments that matter - join the team surrounded by diamonds, coloured stones, watches, silver and gold!","[<div class=""_1wkzzau0 a1msqi6m""><span class=""_1wkzzau0 a1msqi4y lnocuo0 lnocuo1 lnocuo21 _1d0g9qk4 lnocuo7""><a aria-label=""Limit results to Cannon Hill"" class=""_1wkzzau0 _1wkzzauf _1wkzzau0 _1wkzzauf _842p0a0 _842p0a2"" data-automation=""jobLocation"" href=""/jobs-in-retail-consumer-products/in-Cannon-Hill-QLD-4170?salarytype=annual&amp;salaryrange=160000-165000"" rel=""nofollow"" tabindex=""-1"" target=""_self"" title=""Limit results to Cannon Hill"">Cannon Hill</a>, <a aria-label=""Limit results to Brisbane QLD"" class=""_1wkzzau0 _1wkzzauf _1wkzzau0 _1wkzzauf _842p0a0 _842p0a2"" data-automation=""jobLocation"" href=""/jobs-in-retail-consumer-products/in-All-Brisbane-QLD?salarytype=annual&amp;salaryrange=160000-165000"" rel=""nofollow"" tabindex=""-1"" target=""_self"" title=""Limit results to Brisbane QLD"">Brisbane QLD</a></span></div>, <div class=""_1wkzzau0 a1msqi6m""><div aria-label=""Salary: great perks, free parking, amazing discounts"" class=""_1wkzzau0""><span class=""_1wkzzau0 a1msqi4y lnocuo0 lnocuo1 lnocuo21 _1d0g9qk4 lnocuo7"" data-automation=""jobSalary""><span class=""_1wkzzau0 _16v7pfz1 a1msqi4y a1msqi0 a1msqir _16v7pfz3"" style=""--_16v7pfz2:2"">great perks, free parking, amazing discounts</span></span></div></div>]",2024-02-02,Retail-consumer-products - None,08/02/2024
58,https://www.seek.com.au//job/73168318?type=standout&ref=search-standalone,retail consumer products,Management - Store,Store Manager - BIG W Wetherill Park,Big W,-,160000.0,162500.0,165000.0,Sydney NSW,Develop and inspire the leaders of tomorrow whilst delighting our customers in this wonderful local community.,"[<div class=""_1wkzzau0 a1msqi6m""><span class=""_1wkzzau0 a1msqi4y lnocuo0 lnocuo1 lnocuo21 _1d0g9qk4 lnocuo7""><a aria-label=""Limit results to Wetherill Park"" class=""_1wkzzau0 _1wkzzauf _1wkzzau0 _1wkzzauf _842p0a0 _842p0a2"" data-automation=""jobLocation"" href=""/jobs-in-retail-consumer-products/in-Wetherill-Park-NSW-2164?salarytype=annual&amp;salaryrange=160000-165000"" rel=""nofollow"" tabindex=""-1"" target=""_self"" title=""Limit results to Wetherill Park"">Wetherill Park</a>, <a aria-label=""Limit results to Sydney NSW"" class=""_1wkzzau0 _1wkzzauf _1wkzzau0 _1wkzzauf _842p0a0 _842p0a2"" data-automation=""jobLocation"" href=""/jobs-in-retail-consumer-products/in-All-Sydney-NSW?salarytype=annual&amp;salaryrange=160000-165000"" rel=""nofollow"" tabindex=""-1"" target=""_self"" title=""Limit results to Sydney NSW"">Sydney NSW</a></span></div>]",2024-01-19,Retail-consumer-products - None,08/02/2024
59,https://www.seek.com.au//job/73211167?type=standout&ref=search-standalone,retail consumer products,Planning,Head of Planning,Talent Matters Australia Pty Ltd,-,160000.0,162500.0,165000.0,Sydney NSW,Opportunity for an experienced Head of Planning to join a highly successful global fashion brand that continues to grow!,"[<div class=""_1wkzzau0 a1msqi6m""><span class=""_1wkzzau0 a1msqi4y lnocuo0 lnocuo1 lnocuo21 _1d0g9qk4 lnocuo7""><a aria-label=""Limit results to Sydney NSW"" class=""_1wkzzau0 _1wkzzauf _1wkzzau0 _1wkzzauf _842p0a0 _842p0a2"" data-automation=""jobLocation"" href=""/jobs-in-retail-consumer-products/in-All-Sydney-NSW?salarytype=annual&amp;salaryrange=160000-165000"" rel=""nofollow"" tabindex=""-1"" target=""_self"" title=""Limit results to Sydney NSW"">Sydney NSW</a></span></div>]",2024-01-22,Retail-consumer-products - None,08/02/2024
60,https://www.seek.com.au//job/73158318?type=standard&ref=search-standalone,retail consumer products,Management - Store,Store Manager - Scone,Coles,-,160000.0,162500.0,165000.0,Newcastle NSW,Combine your retail management experience with your awesome leadership abilities to run one of our multi-million dollar stores!,"[<div class=""_1wkzzau0 a1msqi6m""><span class=""_1wkzzau0 a1msqi4y lnocuo0 lnocuo1 lnocuo21 _1d0g9qk4 lnocuo7""><a aria-label=""Limit results to Scone"" class=""_1wkzzau0 _1wkzzauf _1wkzzau0 _1wkzzauf _842p0a0 _842p0a2"" data-automation=""jobLocation"" href=""/jobs-in-retail-consumer-products/in-Scone-NSW-2337?salarytype=annual&amp;salaryrange=160000-165000"" rel=""nofollow"" tabindex=""-1"" target=""_self"" title=""Limit results to Scone"">Scone</a>, <a aria-label=""Limit results to Newcastle, Maitland &amp; Hunter NSW"" class=""_1wkzzau0 _1wkzzauf _1wkzzau0 _1wkzzauf _842p0a0 _842p0a2"" data-automation=""jobLocation"" href=""/jobs-in-retail-consumer-products/in-Newcastle,-Maitland-&amp;-Hunter-NSW?salarytype=annual&amp;salaryrange=160000-165000"" rel=""nofollow"" tabindex=""-1"" target=""_self"" title=""Limit results to Newcastle, Maitland &amp; Hunter NSW"">Newcastle, Maitland &amp; Hunter NSW</a></span></div>]",2024-01-19,Retail-consumer-products - None,08/02/2024
61,https://www.seek.com.au//job/73057676?type=standard&ref=search-standalone,retail consumer products,Management - Area/Multi-site,Systems and Process Manager,Southland Supply Group,-,160000.0,162500.0,165000.0,Sydney NSW,Join us as a Systems & Process Manager! Make a big impact in our dynamic team at Southland Supply Group. Apply now!,"[<div class=""_1wkzzau0 a1msqi6m""><span class=""_1wkzzau0 a1msqi4y lnocuo0 lnocuo1 lnocuo21 _1d0g9qk4 lnocuo7""><a aria-label=""Limit results to Eastern Creek"" class=""_1wkzzau0 _1wkzzauf _1wkzzau0 _1wkzzauf _842p0a0 _842p0a2"" data-automation=""jobLocation"" href=""/jobs-in-retail-consumer-products/in-Eastern-Creek-NSW-2766?salarytype=annual&amp;salaryrange=160000-165000"" rel=""nofollow"" tabindex=""-1"" target=""_self"" title=""Limit results to Eastern Creek"">Eastern Creek</a>, <a aria-label=""Limit results to Sydney NSW"" class=""_1wkzzau0 _1wkzzauf _1wkzzau0 _1wkzzauf _842p0a0 _842p0a2"" data-automation=""jobLocation"" href=""/jobs-in-retail-consumer-products/in-All-Sydney-NSW?salarytype=annual&amp;salaryrange=160000-165000"" rel=""nofollow"" tabindex=""-1"" target=""_self"" title=""Limit results to Sydney NSW"">Sydney NSW</a></span></div>]",2024-01-16,Retail-consumer-products - None,08/02/2024
62,https://www.seek.com.au//job/73351467?type=standout&ref=search-standalone,retail consumer products,Buying,Buyer & Category Manager - Hush Puppies and Julius Marlow,Brand Collective,-,160000.0,162500.0,165000.0,Melbourne VIC,We are on the lookout for a Buyer & Category Manager to join our iconic Hush Puppies & Julius Marlow footwear brands!,"[<div class=""_1wkzzau0 a1msqi6m""><span class=""_1wkzzau0 a1msqi4y lnocuo0 lnocuo1 lnocuo21 _1d0g9qk4 lnocuo7""><a aria-label=""Limit results to Richmond"" class=""_1wkzzau0 _1wkzzauf _1wkzzau0 _1wkzzauf _842p0a0 _842p0a2"" data-automation=""jobLocation"" href=""/jobs-in-retail-consumer-products/in-Richmond-VIC-3121?salarytype=annual&amp;salaryrange=160000-165000"" rel=""nofollow"" tabindex=""-1"" target=""_self"" title=""Limit results to Richmond"">Richmond</a>, <a aria-label=""Limit results to Melbourne VIC"" class=""_1wkzzau0 _1wkzzauf _1wkzzau0 _1wkzzauf _842p0a0 _842p0a2"" data-automation=""jobLocation"" href=""/jobs-in-retail-consumer-products/in-All-Melbourne-VIC?salarytype=annual&amp;salaryrange=160000-165000"" rel=""nofollow"" tabindex=""-1"" target=""_self"" title=""Limit results to Melbourne VIC"">Melbourne VIC</a></span></div>]",2024-01-29,Retail-consumer-products - None,08/02/2024
63,https://www.seek.com.au//job/73081266?type=standout&ref=search-standalone,retail consumer products,Buying,Buyer - Womenswear,Kmart,-,160000.0,162500.0,165000.0,Melbourne VIC,As a Buyer you are instrumental in sourcing the best products that bring meaningful moments to our customers lives. lives.,"[<div class=""_1wkzzau0 a1msqi6m""><span class=""_1wkzzau0 a1msqi4y lnocuo0 lnocuo1 lnocuo21 _1d0g9qk4 lnocuo7""><a aria-label=""Limit results to Mulgrave"" class=""_1wkzzau0 _1wkzzauf _1wkzzau0 _1wkzzauf _842p0a0 _842p0a2"" data-automation=""jobLocation"" href=""/jobs-in-retail-consumer-products/in-Mulgrave-VIC-3170?salarytype=annual&amp;salaryrange=160000-165000"" rel=""nofollow"" tabindex=""-1"" target=""_self"" title=""Limit results to Mulgrave"">Mulgrave</a>, <a aria-label=""Limit results to Melbourne VIC"" class=""_1wkzzau0 _1wkzzauf _1wkzzau0 _1wkzzauf _842p0a0 _842p0a2"" data-automation=""jobLocation"" href=""/jobs-in-retail-consumer-products/in-All-Melbourne-VIC?salarytype=annual&amp;salaryrange=160000-165000"" rel=""nofollow"" tabindex=""-1"" target=""_self"" title=""Limit results to Melbourne VIC"">Melbourne VIC</a></span></div>]",2024-01-17,Retail-consumer-products - None,08/02/2024
