,link,classification,category,title,company,salary,min_salary,average_salary,max_salary,location,description,entireDiv,date_posted,Category,Date
66,https://www.seek.com.au//job/73481461?type=promoted&ref=search-standalone,insurance superannuation,Workers' Compensation,Return to Work Specialist,Allianz Australia Insurance Ltd,-,140000.0,142500.0,145000.0,Hobart TAS,"Look after personal injury clients within Perth region. 
Understanding injury, return to work plans, treatment of pathways.","[<div class=""_1wkzzau0 a1msqi6m""><span class=""_1wkzzau0 a1msqi4y lnocuo0 lnocuo1 lnocuo21 _1d0g9qk4 lnocuo7""><a aria-label=""Limit results to Hobart TAS"" class=""_1wkzzau0 _1wkzzauf _1wkzzau0 _1wkzzauf _842p0a0 _842p0a2"" data-automation=""jobLocation"" href=""/jobs-in-insurance-superannuation/in-All-Hobart-TAS?salarytype=annual&amp;salaryrange=140000-145000"" rel=""nofollow"" tabindex=""-1"" target=""_self"" title=""Limit results to Hobart TAS"">Hobart TAS</a></span></div>]",,Insurance-superannuation - None,08/02/2024
67,https://www.seek.com.au//job/72923939?type=promoted&ref=search-standalone,insurance superannuation,Brokerage,Commercial Insurance Broker,Chevron Equipment Finance,"Minimum OTE $120,000 with uncapped commission",140000.0,142500.0,145000.0,Gold Coast QLD,This isn't just a job; it's an opportunity to shape your future in commercial insurance working alongside a team of high performers.,"[<div class=""_1wkzzau0 a1msqi6m""><span class=""_1wkzzau0 a1msqi4y lnocuo0 lnocuo1 lnocuo21 _1d0g9qk4 lnocuo7""><a aria-label=""Limit results to Burleigh Waters"" class=""_1wkzzau0 _1wkzzauf _1wkzzau0 _1wkzzauf _842p0a0 _842p0a2"" data-automation=""jobLocation"" href=""/jobs-in-insurance-superannuation/in-Burleigh-Waters-QLD-4220?salarytype=annual&amp;salaryrange=140000-145000"" rel=""nofollow"" tabindex=""-1"" target=""_self"" title=""Limit results to Burleigh Waters"">Burleigh Waters</a>, <a aria-label=""Limit results to Gold Coast QLD"" class=""_1wkzzau0 _1wkzzauf _1wkzzau0 _1wkzzauf _842p0a0 _842p0a2"" data-automation=""jobLocation"" href=""/jobs-in-insurance-superannuation/in-All-Gold-Coast-QLD?salarytype=annual&amp;salaryrange=140000-145000"" rel=""nofollow"" tabindex=""-1"" target=""_self"" title=""Limit results to Gold Coast QLD"">Gold Coast QLD</a></span></div>, <div class=""_1wkzzau0 a1msqi6m""><div aria-label=""Salary: Minimum OTE $120,000 with uncapped commission"" class=""_1wkzzau0""><span class=""_1wkzzau0 a1msqi4y lnocuo0 lnocuo1 lnocuo21 _1d0g9qk4 lnocuo7"" data-automation=""jobSalary""><span class=""_1wkzzau0 _16v7pfz1 a1msqi4y a1msqi0 a1msqir _16v7pfz3"" style=""--_16v7pfz2:2"">Minimum OTE $120,000 with uncapped commission</span></span></div></div>]",,Insurance-superannuation - None,08/02/2024
68,https://www.seek.com.au//job/73360426?type=standout&ref=search-standalone,insurance superannuation,Brokerage,Reinsurance Specialist,Aon Corporation,-,140000.0,142500.0,145000.0,Sydney NSW,This position will suit a junior lawyer with an interest in insurance and a desire to become an all-rounder. Apply now!,"[<div class=""_1wkzzau0 a1msqi6m""><span class=""_1wkzzau0 a1msqi4y lnocuo0 lnocuo1 lnocuo21 _1d0g9qk4 lnocuo7""><a aria-label=""Limit results to Sydney NSW"" class=""_1wkzzau0 _1wkzzauf _1wkzzau0 _1wkzzauf _842p0a0 _842p0a2"" data-automation=""jobLocation"" href=""/jobs-in-insurance-superannuation/in-All-Sydney-NSW?salarytype=annual&amp;salaryrange=140000-145000"" rel=""nofollow"" tabindex=""-1"" target=""_self"" title=""Limit results to Sydney NSW"">Sydney NSW</a></span></div>]",2024-01-29,Insurance-superannuation - None,08/02/2024
69,https://www.seek.com.au//job/73540684?type=standout&ref=search-standalone,insurance superannuation,Claims,Senior Claims Officer - Property Liability,Suncorp,Competitive salary with bonus and great benefits!,140000.0,142500.0,145000.0,Sydney NSW,We’re looking for a Property Liability Specialist with experience in dealing with public and product liability claims to join our team.,"[<div class=""_1wkzzau0 a1msqi6m""><span class=""_1wkzzau0 a1msqi4y lnocuo0 lnocuo1 lnocuo21 _1d0g9qk4 lnocuo7""><a aria-label=""Limit results to Sydney NSW"" class=""_1wkzzau0 _1wkzzauf _1wkzzau0 _1wkzzauf _842p0a0 _842p0a2"" data-automation=""jobLocation"" href=""/jobs-in-insurance-superannuation/in-All-Sydney-NSW?salarytype=annual&amp;salaryrange=140000-145000"" rel=""nofollow"" tabindex=""-1"" target=""_self"" title=""Limit results to Sydney NSW"">Sydney NSW</a></span></div>, <div class=""_1wkzzau0 a1msqi6m""><div aria-label=""Salary: Competitive salary with bonus and great benefits!"" class=""_1wkzzau0""><span class=""_1wkzzau0 a1msqi4y lnocuo0 lnocuo1 lnocuo21 _1d0g9qk4 lnocuo7"" data-automation=""jobSalary""><span class=""_1wkzzau0 _16v7pfz1 a1msqi4y a1msqi0 a1msqir _16v7pfz3"" style=""--_16v7pfz2:2"">Competitive salary with bonus and great benefits!</span></span></div></div>]",2024-02-06,Insurance-superannuation - None,08/02/2024
70,https://www.seek.com.au//job/73571492?type=standard&ref=search-standalone,insurance superannuation,Brokerage,Account Manager,Kennedy Reid,$140k -$150k + Super,140000.0,145000.0,150000.0,Sydney NSW,Opportunity to autonomously run a portfolio of corporate clients,"[<div class=""_1wkzzau0 a1msqi6m""><span class=""_1wkzzau0 a1msqi4y lnocuo0 lnocuo1 lnocuo21 _1d0g9qk4 lnocuo7""><a aria-label=""Limit results to Sydney NSW"" class=""_1wkzzau0 _1wkzzauf _1wkzzau0 _1wkzzauf _842p0a0 _842p0a2"" data-automation=""jobLocation"" href=""/jobs-in-insurance-superannuation/in-All-Sydney-NSW?salarytype=annual&amp;salaryrange=140000-145000"" rel=""nofollow"" tabindex=""-1"" target=""_self"" title=""Limit results to Sydney NSW"">Sydney NSW</a></span></div>, <div class=""_1wkzzau0 a1msqi6m""><div aria-label=""Salary: $140k -$150k + Super"" class=""_1wkzzau0""><span class=""_1wkzzau0 a1msqi4y lnocuo0 lnocuo1 lnocuo21 _1d0g9qk4 lnocuo7"" data-automation=""jobSalary""><span class=""_1wkzzau0 _16v7pfz1 a1msqi4y a1msqi0 a1msqir _16v7pfz3"" style=""--_16v7pfz2:2"">$140k -$150k + Super</span></span></div></div>]",2024-02-07,Insurance-superannuation - None,08/02/2024
71,https://www.seek.com.au//job/73622173?type=standout&ref=search-standalone,insurance superannuation,Risk Consulting,Risk and WHS Coordinator,Inner West Council,"$121,422.08 - $132,031.64 + 11% Superannuation",121422.08,126726.86000000002,132031.64,Sydney NSW,Inner West Council is seeking a Risk and WHS Coordinator to join their friendly team!,"[<div class=""_1wkzzau0 a1msqi6m""><span class=""_1wkzzau0 a1msqi4y lnocuo0 lnocuo1 lnocuo21 _1d0g9qk4 lnocuo7""><a aria-label=""Limit results to Sydney NSW"" class=""_1wkzzau0 _1wkzzauf _1wkzzau0 _1wkzzauf _842p0a0 _842p0a2"" data-automation=""jobLocation"" href=""/jobs-in-insurance-superannuation/in-All-Sydney-NSW?salarytype=annual&amp;salaryrange=140000-145000"" rel=""nofollow"" tabindex=""-1"" target=""_self"" title=""Limit results to Sydney NSW"">Sydney NSW</a></span></div>, <div class=""_1wkzzau0 a1msqi6m""><div aria-label=""Salary: $121,422.08 - $132,031.64 + 11% Superannuation"" class=""_1wkzzau0""><span class=""_1wkzzau0 a1msqi4y lnocuo0 lnocuo1 lnocuo21 _1d0g9qk4 lnocuo7"" data-automation=""jobSalary""><span class=""_1wkzzau0 _16v7pfz1 a1msqi4y a1msqi0 a1msqir _16v7pfz3"" style=""--_16v7pfz2:2"">$121,422.08 - $132,031.64 + 11% Superannuation</span></span></div></div>]",,Insurance-superannuation - None,08/02/2024
72,https://www.seek.com.au//job/73572672?type=standard&ref=search-standalone,insurance superannuation,Other,Regulatory Change Product Lead,QBE,-,140000.0,142500.0,145000.0,Sydney NSW,In this role you will work within a project team environment being responsible for leading regulatory change implementation and delivery.,"[<div class=""_1wkzzau0 a1msqi6m""><span class=""_1wkzzau0 a1msqi4y lnocuo0 lnocuo1 lnocuo21 _1d0g9qk4 lnocuo7""><a aria-label=""Limit results to Sydney NSW"" class=""_1wkzzau0 _1wkzzauf _1wkzzau0 _1wkzzauf _842p0a0 _842p0a2"" data-automation=""jobLocation"" href=""/jobs-in-insurance-superannuation/in-All-Sydney-NSW?salarytype=annual&amp;salaryrange=140000-145000"" rel=""nofollow"" tabindex=""-1"" target=""_self"" title=""Limit results to Sydney NSW"">Sydney NSW</a></span></div>]",2024-02-07,Insurance-superannuation - None,08/02/2024
73,https://www.seek.com.au//job/73543463?type=standout&ref=search-standalone,insurance superannuation,Brokerage,Team Leader - SME,Succession Partners Pty Ltd,-,140000.0,142500.0,145000.0,Sydney NSW,"Excellent opportunity to work in a professional, dynamic firm - managing a team of Account Exec's, focus on both business development & retention","[<div class=""_1wkzzau0 a1msqi6m""><span class=""_1wkzzau0 a1msqi4y lnocuo0 lnocuo1 lnocuo21 _1d0g9qk4 lnocuo7""><a aria-label=""Limit results to Sydney NSW"" class=""_1wkzzau0 _1wkzzauf _1wkzzau0 _1wkzzauf _842p0a0 _842p0a2"" data-automation=""jobLocation"" href=""/jobs-in-insurance-superannuation/in-All-Sydney-NSW?salarytype=annual&amp;salaryrange=140000-145000"" rel=""nofollow"" tabindex=""-1"" target=""_self"" title=""Limit results to Sydney NSW"">Sydney NSW</a></span></div>]",2024-02-06,Insurance-superannuation - None,08/02/2024
74,https://www.seek.com.au//job/73377974?type=standout&ref=search-standalone,insurance superannuation,Underwriting,Property Underwriter or Assistant Property Underwriter,"HDI Global SE, Australia",-,140000.0,142500.0,145000.0,Melbourne VIC,"Join HDI Global! Property Underwriter or Assistant Underwriter  - focus on large, technical risks.","[<div class=""_1wkzzau0 a1msqi6m""><span class=""_1wkzzau0 a1msqi4y lnocuo0 lnocuo1 lnocuo21 _1d0g9qk4 lnocuo7""><a aria-label=""Limit results to Melbourne VIC"" class=""_1wkzzau0 _1wkzzauf _1wkzzau0 _1wkzzauf _842p0a0 _842p0a2"" data-automation=""jobLocation"" href=""/jobs-in-insurance-superannuation/in-All-Melbourne-VIC?salarytype=annual&amp;salaryrange=140000-145000"" rel=""nofollow"" tabindex=""-1"" target=""_self"" title=""Limit results to Melbourne VIC"">Melbourne VIC</a></span></div>]",2024-01-30,Insurance-superannuation - None,08/02/2024
75,https://www.seek.com.au//job/73386855?type=standout&ref=search-standalone,insurance superannuation,Brokerage,Senior Broker,Ausure Insurance Brokers Pty Ltd,-,140000.0,142500.0,145000.0,Brisbane QLD,.,"[<div class=""_1wkzzau0 a1msqi6m""><span class=""_1wkzzau0 a1msqi4y lnocuo0 lnocuo1 lnocuo21 _1d0g9qk4 lnocuo7""><a aria-label=""Limit results to Brisbane QLD"" class=""_1wkzzau0 _1wkzzauf _1wkzzau0 _1wkzzauf _842p0a0 _842p0a2"" data-automation=""jobLocation"" href=""/jobs-in-insurance-superannuation/in-All-Brisbane-QLD?salarytype=annual&amp;salaryrange=140000-145000"" rel=""nofollow"" tabindex=""-1"" target=""_self"" title=""Limit results to Brisbane QLD"">Brisbane QLD</a></span></div>]",2024-01-30,Insurance-superannuation - None,08/02/2024
76,https://www.seek.com.au//job/73299202?type=standout&ref=search-standalone,insurance superannuation,Other,Account Executive,Elders Insurance,-,140000.0,142500.0,145000.0,"Pakenham, West Gippsland & Latrobe Valley VIC","We are looking for a new Account Executive to add value to our already successful team,","[<div class=""_1wkzzau0 a1msqi6m""><span class=""_1wkzzau0 a1msqi4y lnocuo0 lnocuo1 lnocuo21 _1d0g9qk4 lnocuo7""><a aria-label=""Limit results to Pakenham"" class=""_1wkzzau0 _1wkzzauf _1wkzzau0 _1wkzzauf _842p0a0 _842p0a2"" data-automation=""jobLocation"" href=""/jobs-in-insurance-superannuation/in-Pakenham-VIC-3810?salarytype=annual&amp;salaryrange=140000-145000"" rel=""nofollow"" tabindex=""-1"" target=""_self"" title=""Limit results to Pakenham"">Pakenham</a>, <a aria-label=""Limit results to West Gippsland &amp; Latrobe Valley VIC"" class=""_1wkzzau0 _1wkzzauf _1wkzzau0 _1wkzzauf _842p0a0 _842p0a2"" data-automation=""jobLocation"" href=""/jobs-in-insurance-superannuation/in-West-Gippsland-&amp;-Latrobe-Valley-VIC?salarytype=annual&amp;salaryrange=140000-145000"" rel=""nofollow"" tabindex=""-1"" target=""_self"" title=""Limit results to West Gippsland &amp; Latrobe Valley VIC"">West Gippsland &amp; Latrobe Valley VIC</a></span></div>]",2024-01-25,Insurance-superannuation - None,08/02/2024
77,https://www.seek.com.au//job/73102614?type=standard&ref=search-standalone,insurance superannuation,Brokerage,Insurance Broker,Bluhdorn Group,"OTE $100,000 pa (comms only)",140000.0,142500.0,145000.0,Adelaide SA,"OTE $100k pa (comms only) 
Potential equity position
25-35 direct referrals per month","[<div class=""_1wkzzau0 a1msqi6m""><span class=""_1wkzzau0 a1msqi4y lnocuo0 lnocuo1 lnocuo21 _1d0g9qk4 lnocuo7""><a aria-label=""Limit results to Modbury"" class=""_1wkzzau0 _1wkzzauf _1wkzzau0 _1wkzzauf _842p0a0 _842p0a2"" data-automation=""jobLocation"" href=""/jobs-in-insurance-superannuation/in-Modbury-SA-5092?salarytype=annual&amp;salaryrange=140000-145000"" rel=""nofollow"" tabindex=""-1"" target=""_self"" title=""Limit results to Modbury"">Modbury</a>, <a aria-label=""Limit results to Adelaide SA"" class=""_1wkzzau0 _1wkzzauf _1wkzzau0 _1wkzzauf _842p0a0 _842p0a2"" data-automation=""jobLocation"" href=""/jobs-in-insurance-superannuation/in-All-Adelaide-SA?salarytype=annual&amp;salaryrange=140000-145000"" rel=""nofollow"" tabindex=""-1"" target=""_self"" title=""Limit results to Adelaide SA"">Adelaide SA</a></span></div>, <div class=""_1wkzzau0 a1msqi6m""><div aria-label=""Salary: OTE $100,000 pa (comms only)"" class=""_1wkzzau0""><span class=""_1wkzzau0 a1msqi4y lnocuo0 lnocuo1 lnocuo21 _1d0g9qk4 lnocuo7"" data-automation=""jobSalary""><span class=""_1wkzzau0 _16v7pfz1 a1msqi4y a1msqi0 a1msqir _16v7pfz3"" style=""--_16v7pfz2:2"">OTE $100,000 pa (comms only)</span></span></div></div>]",2024-01-18,Insurance-superannuation - None,08/02/2024
78,https://www.seek.com.au//job/73452049?type=standout&ref=search-standalone,insurance superannuation,Workers' Compensation,Technical Specialist - Workers Compensation,Haylo People,"$120,000 - $125,000 package + Benefits",120000.0,122500.0,125000.0,Sydney NSW,Use your technical workers compensation knowledge to be part of a TMF claims team in Sydney CBD.,"[<div class=""_1wkzzau0 a1msqi6m""><span class=""_1wkzzau0 a1msqi4y lnocuo0 lnocuo1 lnocuo21 _1d0g9qk4 lnocuo7""><a aria-label=""Limit results to Sydney NSW"" class=""_1wkzzau0 _1wkzzauf _1wkzzau0 _1wkzzauf _842p0a0 _842p0a2"" data-automation=""jobLocation"" href=""/jobs-in-insurance-superannuation/in-All-Sydney-NSW?salarytype=annual&amp;salaryrange=140000-145000"" rel=""nofollow"" tabindex=""-1"" target=""_self"" title=""Limit results to Sydney NSW"">Sydney NSW</a></span></div>, <div class=""_1wkzzau0 a1msqi6m""><div aria-label=""Salary: $120,000 - $125,000 package + Benefits"" class=""_1wkzzau0""><span class=""_1wkzzau0 a1msqi4y lnocuo0 lnocuo1 lnocuo21 _1d0g9qk4 lnocuo7"" data-automation=""jobSalary""><span class=""_1wkzzau0 _16v7pfz1 a1msqi4y a1msqi0 a1msqir _16v7pfz3"" style=""--_16v7pfz2:2"">$120,000 - $125,000 package + Benefits</span></span></div></div>]",2024-02-01,Insurance-superannuation - None,08/02/2024
79,https://www.seek.com.au//job/73481461?type=standout&ref=search-standalone,insurance superannuation,Workers' Compensation,Return to Work Specialist,Allianz Australia Insurance Ltd,-,140000.0,142500.0,145000.0,Hobart TAS,"Look after personal injury clients within Perth region. 
Understanding injury, return to work plans, treatment of pathways.","[<div class=""_1wkzzau0 a1msqi6m""><span class=""_1wkzzau0 a1msqi4y lnocuo0 lnocuo1 lnocuo21 _1d0g9qk4 lnocuo7""><a aria-label=""Limit results to Hobart TAS"" class=""_1wkzzau0 _1wkzzauf _1wkzzau0 _1wkzzauf _842p0a0 _842p0a2"" data-automation=""jobLocation"" href=""/jobs-in-insurance-superannuation/in-All-Hobart-TAS?salarytype=annual&amp;salaryrange=140000-145000"" rel=""nofollow"" tabindex=""-1"" target=""_self"" title=""Limit results to Hobart TAS"">Hobart TAS</a></span></div>]",2024-02-02,Insurance-superannuation - None,08/02/2024
80,https://www.seek.com.au//job/73311585?type=standout&ref=search-standalone,insurance superannuation,Brokerage,General Insurance Brokers - Corporate / Commercial,ExecSource,-,140000.0,142500.0,145000.0,Brisbane QLD,"International, national and local professional insurance groups - General Insurance vacancies across a wide variety of roles","[<div class=""_1wkzzau0 a1msqi6m""><span class=""_1wkzzau0 a1msqi4y lnocuo0 lnocuo1 lnocuo21 _1d0g9qk4 lnocuo7""><a aria-label=""Limit results to Brisbane QLD"" class=""_1wkzzau0 _1wkzzauf _1wkzzau0 _1wkzzauf _842p0a0 _842p0a2"" data-automation=""jobLocation"" href=""/jobs-in-insurance-superannuation/in-All-Brisbane-QLD?salarytype=annual&amp;salaryrange=140000-145000"" rel=""nofollow"" tabindex=""-1"" target=""_self"" title=""Limit results to Brisbane QLD"">Brisbane QLD</a></span></div>]",2024-01-25,Insurance-superannuation - None,08/02/2024
81,https://www.seek.com.au//job/73515457?type=standout&ref=search-standalone,insurance superannuation,Superannuation,Manager Member Office  - Member Engagement,Insignia Financial Ltd,Competitive Salary Package + Career Progression,140000.0,142500.0,145000.0,Sydney NSW,Bring your high level awareness of superannuation law & regulatory requirements to this pivotal role in our Member Office Division.,"[<div class=""_1wkzzau0 a1msqi6m""><span class=""_1wkzzau0 a1msqi4y lnocuo0 lnocuo1 lnocuo21 _1d0g9qk4 lnocuo7""><a aria-label=""Limit results to Sydney NSW"" class=""_1wkzzau0 _1wkzzauf _1wkzzau0 _1wkzzauf _842p0a0 _842p0a2"" data-automation=""jobLocation"" href=""/jobs-in-insurance-superannuation/in-All-Sydney-NSW?salarytype=annual&amp;salaryrange=140000-145000"" rel=""nofollow"" tabindex=""-1"" target=""_self"" title=""Limit results to Sydney NSW"">Sydney NSW</a></span></div>, <div class=""_1wkzzau0 a1msqi6m""><div aria-label=""Salary: Competitive Salary Package + Career Progression"" class=""_1wkzzau0""><span class=""_1wkzzau0 a1msqi4y lnocuo0 lnocuo1 lnocuo21 _1d0g9qk4 lnocuo7"" data-automation=""jobSalary""><span class=""_1wkzzau0 _16v7pfz1 a1msqi4y a1msqi0 a1msqir _16v7pfz3"" style=""--_16v7pfz2:2"">Competitive Salary Package + Career Progression</span></span></div></div>]",2024-02-05,Insurance-superannuation - None,08/02/2024
82,https://www.seek.com.au//job/73418787?type=standout&ref=search-standalone,insurance superannuation,Brokerage,Team Manager,COLLAR®,"$110,000 - $150,000",110000.0,130000.0,150000.0,Sydney NSW,Join a leading General Insurance Broker experiencing substantial growth as a Team Manager,"[<div class=""_1wkzzau0 a1msqi6m""><span class=""_1wkzzau0 a1msqi4y lnocuo0 lnocuo1 lnocuo21 _1d0g9qk4 lnocuo7""><a aria-label=""Limit results to Sydney NSW"" class=""_1wkzzau0 _1wkzzauf _1wkzzau0 _1wkzzauf _842p0a0 _842p0a2"" data-automation=""jobLocation"" href=""/jobs-in-insurance-superannuation/in-All-Sydney-NSW?salarytype=annual&amp;salaryrange=140000-145000"" rel=""nofollow"" tabindex=""-1"" target=""_self"" title=""Limit results to Sydney NSW"">Sydney NSW</a></span></div>, <div class=""_1wkzzau0 a1msqi6m""><div aria-label=""Salary: $110,000 - $150,000"" class=""_1wkzzau0""><span class=""_1wkzzau0 a1msqi4y lnocuo0 lnocuo1 lnocuo21 _1d0g9qk4 lnocuo7"" data-automation=""jobSalary""><span class=""_1wkzzau0 _16v7pfz1 a1msqi4y a1msqi0 a1msqir _16v7pfz3"" style=""--_16v7pfz2:2"">$110,000 - $150,000</span></span></div></div>]",2024-01-31,Insurance-superannuation - None,08/02/2024
83,https://www.seek.com.au//job/73305868?type=standout&ref=search-standalone,insurance superannuation,Brokerage,General Insurance Broker,Peter Brown and Associates,-,140000.0,142500.0,145000.0,Canberra ACT,Join a respected and successful insurance brokerage. Learn on the job with an industry experts. Secure a career by retaining mid to top-tier clients.,"[<div class=""_1wkzzau0 a1msqi6m""><span class=""_1wkzzau0 a1msqi4y lnocuo0 lnocuo1 lnocuo21 _1d0g9qk4 lnocuo7""><a aria-label=""Limit results to Canberra ACT"" class=""_1wkzzau0 _1wkzzauf _1wkzzau0 _1wkzzauf _842p0a0 _842p0a2"" data-automation=""jobLocation"" href=""/jobs-in-insurance-superannuation/in-All-Canberra-ACT?salarytype=annual&amp;salaryrange=140000-145000"" rel=""nofollow"" tabindex=""-1"" target=""_self"" title=""Limit results to Canberra ACT"">Canberra ACT</a></span></div>]",2024-01-25,Insurance-superannuation - None,08/02/2024
84,https://www.seek.com.au//job/73616000?type=standout&ref=search-standalone,insurance superannuation,Risk Consulting,Senior Risk and Governance Advisor,Gramerci,$65 per hr + Super,117000.0,131000.0,145000.0,Brisbane QLD,Join a superb financial services team of professionals in a role which combines Risk and Governance.,"[<div class=""_1wkzzau0 a1msqi6m""><span class=""_1wkzzau0 a1msqi4y lnocuo0 lnocuo1 lnocuo21 _1d0g9qk4 lnocuo7""><a aria-label=""Limit results to Brisbane QLD"" class=""_1wkzzau0 _1wkzzauf _1wkzzau0 _1wkzzauf _842p0a0 _842p0a2"" data-automation=""jobLocation"" href=""/jobs-in-insurance-superannuation/in-All-Brisbane-QLD?salarytype=annual&amp;salaryrange=140000-145000"" rel=""nofollow"" tabindex=""-1"" target=""_self"" title=""Limit results to Brisbane QLD"">Brisbane QLD</a></span></div>, <div class=""_1wkzzau0 a1msqi6m""><div aria-label=""Salary: $65 per hr + Super"" class=""_1wkzzau0""><span class=""_1wkzzau0 a1msqi4y lnocuo0 lnocuo1 lnocuo21 _1d0g9qk4 lnocuo7"" data-automation=""jobSalary""><span class=""_1wkzzau0 _16v7pfz1 a1msqi4y a1msqi0 a1msqir _16v7pfz3"" style=""--_16v7pfz2:2"">$65 per hr + Super</span></span></div></div>]",,Insurance-superannuation - None,08/02/2024
85,https://www.seek.com.au//job/73355973?type=standout&ref=search-standalone,insurance superannuation,Underwriting,Senior Underwriter Property,Vero (Suncorp Group),Attractive salary onus + great benefits,140000.0,142500.0,145000.0,Perth WA,Don't miss this exciting opportunity to utilise your Property Underwriting experience and join our supportive team.,"[<div class=""_1wkzzau0 a1msqi6m""><span class=""_1wkzzau0 a1msqi4y lnocuo0 lnocuo1 lnocuo21 _1d0g9qk4 lnocuo7""><a aria-label=""Limit results to Perth WA"" class=""_1wkzzau0 _1wkzzauf _1wkzzau0 _1wkzzauf _842p0a0 _842p0a2"" data-automation=""jobLocation"" href=""/jobs-in-insurance-superannuation/in-All-Perth-WA?salarytype=annual&amp;salaryrange=140000-145000"" rel=""nofollow"" tabindex=""-1"" target=""_self"" title=""Limit results to Perth WA"">Perth WA</a></span></div>, <div class=""_1wkzzau0 a1msqi6m""><div aria-label=""Salary: Attractive salary onus + great benefits"" class=""_1wkzzau0""><span class=""_1wkzzau0 a1msqi4y lnocuo0 lnocuo1 lnocuo21 _1d0g9qk4 lnocuo7"" data-automation=""jobSalary""><span class=""_1wkzzau0 _16v7pfz1 a1msqi4y a1msqi0 a1msqir _16v7pfz3"" style=""--_16v7pfz2:2"">Attractive salary onus + great benefits</span></span></div></div>]",2024-01-29,Insurance-superannuation - None,08/02/2024
86,https://www.seek.com.au//job/73471499?type=standard&ref=search-standalone,insurance superannuation,Brokerage,Commercial Account Manager,Stewart Insurance,"$120,000 per year plus superannuation",120000.0,132500.0,145000.0,Melbourne VIC,"Are you an experienced Tier 1 qualified Account Manager looking to take your career to the next level? Join our dynamic, award-winning  and team.","[<div class=""_1wkzzau0 a1msqi6m""><span class=""_1wkzzau0 a1msqi4y lnocuo0 lnocuo1 lnocuo21 _1d0g9qk4 lnocuo7""><a aria-label=""Limit results to Brighton"" class=""_1wkzzau0 _1wkzzauf _1wkzzau0 _1wkzzauf _842p0a0 _842p0a2"" data-automation=""jobLocation"" href=""/jobs-in-insurance-superannuation/in-Brighton-VIC-3186?salarytype=annual&amp;salaryrange=140000-145000"" rel=""nofollow"" tabindex=""-1"" target=""_self"" title=""Limit results to Brighton"">Brighton</a>, <a aria-label=""Limit results to Melbourne VIC"" class=""_1wkzzau0 _1wkzzauf _1wkzzau0 _1wkzzauf _842p0a0 _842p0a2"" data-automation=""jobLocation"" href=""/jobs-in-insurance-superannuation/in-All-Melbourne-VIC?salarytype=annual&amp;salaryrange=140000-145000"" rel=""nofollow"" tabindex=""-1"" target=""_self"" title=""Limit results to Melbourne VIC"">Melbourne VIC</a></span></div>, <div class=""_1wkzzau0 a1msqi6m""><div aria-label=""Salary: $120,000 per year plus superannuation"" class=""_1wkzzau0""><span class=""_1wkzzau0 a1msqi4y lnocuo0 lnocuo1 lnocuo21 _1d0g9qk4 lnocuo7"" data-automation=""jobSalary""><span class=""_1wkzzau0 _16v7pfz1 a1msqi4y a1msqi0 a1msqir _16v7pfz3"" style=""--_16v7pfz2:2"">$120,000 per year plus superannuation</span></span></div></div>]",2024-02-02,Insurance-superannuation - None,08/02/2024
87,https://www.seek.com.au//job/73377784?type=standard&ref=search-standalone,insurance superannuation,Brokerage,Account Manager - General Insurance,u&u. Recruitment Partners,-,140000.0,142500.0,145000.0,Melbourne VIC,"Support the Director in managing portfolios: renewals, endorsements, new business, claims, remarketing, and report management.","[<div class=""_1wkzzau0 a1msqi6m""><span class=""_1wkzzau0 a1msqi4y lnocuo0 lnocuo1 lnocuo21 _1d0g9qk4 lnocuo7""><a aria-label=""Limit results to Melbourne VIC"" class=""_1wkzzau0 _1wkzzauf _1wkzzau0 _1wkzzauf _842p0a0 _842p0a2"" data-automation=""jobLocation"" href=""/jobs-in-insurance-superannuation/in-All-Melbourne-VIC?salarytype=annual&amp;salaryrange=140000-145000"" rel=""nofollow"" tabindex=""-1"" target=""_self"" title=""Limit results to Melbourne VIC"">Melbourne VIC</a></span></div>]",2024-01-30,Insurance-superannuation - None,08/02/2024
