,link,classification,category,title,company,salary,min_salary,average_salary,max_salary,location,description,entireDiv,date_posted,Category,Date
0,https://www.seek.com.au//job/73622813?type=promoted&ref=search-standalone,engineering,Process Engineering,Tooling Engineer,Alstom,-,170000.0,172500.0,175000.0,Melbourne VIC,Seeking a Tooling Engineer to bring their wealth of technical experience of processing and manufacturing to our Dandenong Manfacturing Site,"[<div class=""_1wkzzau0 a1msqi6m""><span class=""_1wkzzau0 a1msqi4y lnocuo0 lnocuo1 lnocuo21 _1d0g9qk4 lnocuo7""><a aria-label=""Limit results to Melbourne VIC"" class=""_1wkzzau0 _1wkzzauf _1wkzzau0 _1wkzzauf _842p0a0 _842p0a2"" data-automation=""jobLocation"" href=""/jobs-in-engineering/in-All-Melbourne-VIC?salarytype=annual&amp;salaryrange=170000-175000"" rel=""nofollow"" tabindex=""-1"" target=""_self"" title=""Limit results to Melbourne VIC"">Melbourne VIC</a></span></div>]",,Engineering - None,08/02/2024
1,https://www.seek.com.au//job/73514071?type=promoted&ref=search-standalone,engineering,Project Engineering,SMP Project Engineer,Civmec Construction & Engineering,-,170000.0,172500.0,175000.0,Perth WA,We are seeking an experienced SMP Project Engineer's to join our Western Range team!,"[<div class=""_1wkzzau0 a1msqi6m""><span class=""_1wkzzau0 a1msqi4y lnocuo0 lnocuo1 lnocuo21 _1d0g9qk4 lnocuo7""><a aria-label=""Limit results to Perth WA"" class=""_1wkzzau0 _1wkzzauf _1wkzzau0 _1wkzzauf _842p0a0 _842p0a2"" data-automation=""jobLocation"" href=""/jobs-in-engineering/in-All-Perth-WA?salarytype=annual&amp;salaryrange=170000-175000"" rel=""nofollow"" tabindex=""-1"" target=""_self"" title=""Limit results to Perth WA"">Perth WA</a></span></div>]",,Engineering - None,08/02/2024
2,https://www.seek.com.au//job/73623145?type=standout&ref=search-standalone,engineering,Chemical Engineering,Expression of Interest (EOI) - National R&D Engineering Manager,Chandler Macleod,High Level Salary and Benefits,170000.0,172500.0,175000.0,Brisbane QLD,Opportunity to work on high impact technology that will make a positive impact in the energy sector,"[<div class=""_1wkzzau0 a1msqi6m""><span class=""_1wkzzau0 a1msqi4y lnocuo0 lnocuo1 lnocuo21 _1d0g9qk4 lnocuo7""><a aria-label=""Limit results to Brisbane QLD"" class=""_1wkzzau0 _1wkzzauf _1wkzzau0 _1wkzzauf _842p0a0 _842p0a2"" data-automation=""jobLocation"" href=""/jobs-in-engineering/in-All-Brisbane-QLD?salarytype=annual&amp;salaryrange=170000-175000"" rel=""nofollow"" tabindex=""-1"" target=""_self"" title=""Limit results to Brisbane QLD"">Brisbane QLD</a></span></div>, <div class=""_1wkzzau0 a1msqi6m""><div aria-label=""Salary: High Level Salary and Benefits"" class=""_1wkzzau0""><span class=""_1wkzzau0 a1msqi4y lnocuo0 lnocuo1 lnocuo21 _1d0g9qk4 lnocuo7"" data-automation=""jobSalary""><span class=""_1wkzzau0 _16v7pfz1 a1msqi4y a1msqi0 a1msqir _16v7pfz3"" style=""--_16v7pfz2:2"">High Level Salary and Benefits</span></span></div></div>]",,Engineering - None,08/02/2024
3,https://www.seek.com.au//job/73613805?type=standout&ref=search-standalone,engineering,Industrial Engineering,Process Engineer,Core Talent,$130k - $150k p.a. + + super,130000.0,140000.0,150000.0,"Maryborough, Bendigo, Goldfields & Macedon Ranges VIC","Experienced process engineer from FMCG, food or beverage background is highly desirable","[<div class=""_1wkzzau0 a1msqi6m""><span class=""_1wkzzau0 a1msqi4y lnocuo0 lnocuo1 lnocuo21 _1d0g9qk4 lnocuo7""><a aria-label=""Limit results to Maryborough"" class=""_1wkzzau0 _1wkzzauf _1wkzzau0 _1wkzzauf _842p0a0 _842p0a2"" data-automation=""jobLocation"" href=""/jobs-in-engineering/in-Maryborough-VIC-3465?salarytype=annual&amp;salaryrange=170000-175000"" rel=""nofollow"" tabindex=""-1"" target=""_self"" title=""Limit results to Maryborough"">Maryborough</a>, <a aria-label=""Limit results to Bendigo, Goldfields &amp; Macedon Ranges VIC"" class=""_1wkzzau0 _1wkzzauf _1wkzzau0 _1wkzzauf _842p0a0 _842p0a2"" data-automation=""jobLocation"" href=""/jobs-in-engineering/in-Bendigo,-Goldfields-&amp;-Macedon-Ranges-VIC?salarytype=annual&amp;salaryrange=170000-175000"" rel=""nofollow"" tabindex=""-1"" target=""_self"" title=""Limit results to Bendigo, Goldfields &amp; Macedon Ranges VIC"">Bendigo, Goldfields &amp; Macedon Ranges VIC</a></span></div>, <div class=""_1wkzzau0 a1msqi6m""><div aria-label=""Salary: $130k - $150k p.a. + + super"" class=""_1wkzzau0""><span class=""_1wkzzau0 a1msqi4y lnocuo0 lnocuo1 lnocuo21 _1d0g9qk4 lnocuo7"" data-automation=""jobSalary""><span class=""_1wkzzau0 _16v7pfz1 a1msqi4y a1msqi0 a1msqir _16v7pfz3"" style=""--_16v7pfz2:2"">$130k - $150k p.a. + + super</span></span></div></div>]",,Engineering - None,08/02/2024
4,https://www.seek.com.au//job/73525147?type=standout&ref=search-standalone,engineering,Maintenance,Maintenance Engineering Manager,Sara Lee Holdings Pty Ltd,-,170000.0,172500.0,175000.0,Other,A sweet opportunity for our next Maintenane Engineering Manager to join our team on the NSW Central Coast,"[<div class=""_1wkzzau0 a1msqi6m""><span class=""_1wkzzau0 a1msqi4y lnocuo0 lnocuo1 lnocuo21 _1d0g9qk4 lnocuo7""><a aria-label=""Limit results to Lisarow"" class=""_1wkzzau0 _1wkzzauf _1wkzzau0 _1wkzzauf _842p0a0 _842p0a2"" data-automation=""jobLocation"" href=""/jobs-in-engineering/in-Lisarow-NSW-2250?salarytype=annual&amp;salaryrange=170000-175000"" rel=""nofollow"" tabindex=""-1"" target=""_self"" title=""Limit results to Lisarow"">Lisarow</a>, <a aria-label=""Limit results to Gosford &amp; Central Coast NSW"" class=""_1wkzzau0 _1wkzzauf _1wkzzau0 _1wkzzauf _842p0a0 _842p0a2"" data-automation=""jobLocation"" href=""/jobs-in-engineering/in-Gosford-&amp;-Central-Coast-NSW?salarytype=annual&amp;salaryrange=170000-175000"" rel=""nofollow"" tabindex=""-1"" target=""_self"" title=""Limit results to Gosford &amp; Central Coast NSW"">Gosford &amp; Central Coast NSW</a></span></div>]",2024-02-05,Engineering - None,08/02/2024
5,https://www.seek.com.au//job/73611133?type=standout&ref=search-standalone,engineering,Project Management,Project Manager/Project Engineer,HD Civil Pty Ltd,"$100,000 – $150,000 per year",100000.0,125000.0,150000.0,Wollongong NSW,"Project Manager/Project Engineer position, opportunity to grow with a expanding business and work a small core group including company director","[<div class=""_1wkzzau0 a1msqi6m""><span class=""_1wkzzau0 a1msqi4y lnocuo0 lnocuo1 lnocuo21 _1d0g9qk4 lnocuo7""><a aria-label=""Limit results to Moruya"" class=""_1wkzzau0 _1wkzzauf _1wkzzau0 _1wkzzauf _842p0a0 _842p0a2"" data-automation=""jobLocation"" href=""/jobs-in-engineering/in-Moruya-NSW-2537?salarytype=annual&amp;salaryrange=170000-175000"" rel=""nofollow"" tabindex=""-1"" target=""_self"" title=""Limit results to Moruya"">Moruya</a>, <a aria-label=""Limit results to Wollongong, Illawarra &amp; South Coast NSW"" class=""_1wkzzau0 _1wkzzauf _1wkzzau0 _1wkzzauf _842p0a0 _842p0a2"" data-automation=""jobLocation"" href=""/jobs-in-engineering/in-Wollongong,-Illawarra-&amp;-South-Coast-NSW?salarytype=annual&amp;salaryrange=170000-175000"" rel=""nofollow"" tabindex=""-1"" target=""_self"" title=""Limit results to Wollongong, Illawarra &amp; South Coast NSW"">Wollongong, Illawarra &amp; South Coast NSW</a></span></div>, <div class=""_1wkzzau0 a1msqi6m""><div aria-label=""Salary: $100,000 – $150,000 per year"" class=""_1wkzzau0""><span class=""_1wkzzau0 a1msqi4y lnocuo0 lnocuo1 lnocuo21 _1d0g9qk4 lnocuo7"" data-automation=""jobSalary""><span class=""_1wkzzau0 _16v7pfz1 a1msqi4y a1msqi0 a1msqir _16v7pfz3"" style=""--_16v7pfz2:2"">$100,000 – $150,000 per year</span></span></div></div>]",,Engineering - None,08/02/2024
6,https://www.seek.com.au//job/73611407?type=standout&ref=search-standalone,engineering,Project Engineering,Project Engineer,THE BMD GROUP,Base + Super + Ute + Phone + Laptop,170000.0,172500.0,175000.0,Darwin NT,Join our team in delivering civil infrastructure projects in the Top End - Enjoy the laid-back enviable lifestyle in NT with a stable family company,"[<div class=""_1wkzzau0 a1msqi6m""><span class=""_1wkzzau0 a1msqi4y lnocuo0 lnocuo1 lnocuo21 _1d0g9qk4 lnocuo7""><a aria-label=""Limit results to Darwin NT"" class=""_1wkzzau0 _1wkzzauf _1wkzzau0 _1wkzzauf _842p0a0 _842p0a2"" data-automation=""jobLocation"" href=""/jobs-in-engineering/in-All-Darwin-NT?salarytype=annual&amp;salaryrange=170000-175000"" rel=""nofollow"" tabindex=""-1"" target=""_self"" title=""Limit results to Darwin NT"">Darwin NT</a></span></div>, <div class=""_1wkzzau0 a1msqi6m""><div aria-label=""Salary: Base + Super + Ute + Phone + Laptop"" class=""_1wkzzau0""><span class=""_1wkzzau0 a1msqi4y lnocuo0 lnocuo1 lnocuo21 _1d0g9qk4 lnocuo7"" data-automation=""jobSalary""><span class=""_1wkzzau0 _16v7pfz1 a1msqi4y a1msqi0 a1msqir _16v7pfz3"" style=""--_16v7pfz2:2"">Base + Super + Ute + Phone + Laptop</span></span></div></div>]",,Engineering - None,08/02/2024
7,https://www.seek.com.au//job/73577378?type=standard&ref=search-standalone,engineering,Engineering Drafting,Engineering draftsperson,Malkin Consulting,$70 – $100 per hour,126000.0,153000.0,180000.0,"Bright, Yarra Valley & High Country VIC",Exciting and varied drafting and design opportunity in s small and dynamic engineering consultancy in beautiful north east Victoria.,"[<div class=""_1wkzzau0 a1msqi6m""><span class=""_1wkzzau0 a1msqi4y lnocuo0 lnocuo1 lnocuo21 _1d0g9qk4 lnocuo7""><a aria-label=""Limit results to Bright"" class=""_1wkzzau0 _1wkzzauf _1wkzzau0 _1wkzzauf _842p0a0 _842p0a2"" data-automation=""jobLocation"" href=""/jobs-in-engineering/in-Bright-VIC-3741?salarytype=annual&amp;salaryrange=170000-175000"" rel=""nofollow"" tabindex=""-1"" target=""_self"" title=""Limit results to Bright"">Bright</a>, <a aria-label=""Limit results to Yarra Valley &amp; High Country VIC"" class=""_1wkzzau0 _1wkzzauf _1wkzzau0 _1wkzzauf _842p0a0 _842p0a2"" data-automation=""jobLocation"" href=""/jobs-in-engineering/in-Yarra-Valley-&amp;-High-Country-VIC?salarytype=annual&amp;salaryrange=170000-175000"" rel=""nofollow"" tabindex=""-1"" target=""_self"" title=""Limit results to Yarra Valley &amp; High Country VIC"">Yarra Valley &amp; High Country VIC</a></span></div>, <div class=""_1wkzzau0 a1msqi6m""><div aria-label=""Salary: $70 – $100 per hour"" class=""_1wkzzau0""><span class=""_1wkzzau0 a1msqi4y lnocuo0 lnocuo1 lnocuo21 _1d0g9qk4 lnocuo7"" data-automation=""jobSalary""><span class=""_1wkzzau0 _16v7pfz1 a1msqi4y a1msqi0 a1msqir _16v7pfz3"" style=""--_16v7pfz2:2"">$70 – $100 per hour</span></span></div></div>]",2024-02-07,Engineering - None,08/02/2024
8,https://www.seek.com.au//job/73499011?type=standout&ref=search-standalone,engineering,Management,Engineering Maintenance Manager,Austcorp Executive,"$125,000 + Car + Super",125000.0,150000.0,175000.0,"Wemen, Mildura & Murray VIC",One of our clients in food manufacturing is currently in search of an Engineering Maintenance Manager to join their expanding team.,"[<div class=""_1wkzzau0 a1msqi6m""><span class=""_1wkzzau0 a1msqi4y lnocuo0 lnocuo1 lnocuo21 _1d0g9qk4 lnocuo7""><a aria-label=""Limit results to Wemen"" class=""_1wkzzau0 _1wkzzauf _1wkzzau0 _1wkzzauf _842p0a0 _842p0a2"" data-automation=""jobLocation"" href=""/jobs-in-engineering/in-Wemen-VIC-3549?salarytype=annual&amp;salaryrange=170000-175000"" rel=""nofollow"" tabindex=""-1"" target=""_self"" title=""Limit results to Wemen"">Wemen</a>, <a aria-label=""Limit results to Mildura &amp; Murray VIC"" class=""_1wkzzau0 _1wkzzauf _1wkzzau0 _1wkzzauf _842p0a0 _842p0a2"" data-automation=""jobLocation"" href=""/jobs-in-engineering/in-Mildura-&amp;-Murray-VIC?salarytype=annual&amp;salaryrange=170000-175000"" rel=""nofollow"" tabindex=""-1"" target=""_self"" title=""Limit results to Mildura &amp; Murray VIC"">Mildura &amp; Murray VIC</a></span></div>, <div class=""_1wkzzau0 a1msqi6m""><div aria-label=""Salary: $125,000 + Car + Super"" class=""_1wkzzau0""><span class=""_1wkzzau0 a1msqi4y lnocuo0 lnocuo1 lnocuo21 _1d0g9qk4 lnocuo7"" data-automation=""jobSalary""><span class=""_1wkzzau0 _16v7pfz1 a1msqi4y a1msqi0 a1msqir _16v7pfz3"" style=""--_16v7pfz2:2"">$125,000 + Car + Super</span></span></div></div>]",2024-02-03,Engineering - None,08/02/2024
9,https://www.seek.com.au//job/73612209?type=standout&ref=search-standalone,engineering,Management,Engineering Manager,CTC,-,170000.0,172500.0,175000.0,Adelaide SA,Are you a Mechanical / Process Engineer who is tired of sitting in front of a computer? Are you looking for a more hands on practical role?,"[<div class=""_1wkzzau0 a1msqi6m""><span class=""_1wkzzau0 a1msqi4y lnocuo0 lnocuo1 lnocuo21 _1d0g9qk4 lnocuo7""><a aria-label=""Limit results to Adelaide SA"" class=""_1wkzzau0 _1wkzzauf _1wkzzau0 _1wkzzauf _842p0a0 _842p0a2"" data-automation=""jobLocation"" href=""/jobs-in-engineering/in-All-Adelaide-SA?salarytype=annual&amp;salaryrange=170000-175000"" rel=""nofollow"" tabindex=""-1"" target=""_self"" title=""Limit results to Adelaide SA"">Adelaide SA</a></span></div>]",,Engineering - None,08/02/2024
10,https://www.seek.com.au//job/73584661?type=standard&ref=search-standalone,engineering,Project Engineering,Project Engineer,Hicks Civil and Mining,$80 – $90 per hour,144000.0,153000.0,162000.0,Perth WA,"Head quartered in Port Hedland and with satellite offices in Perth, our employees are spoilt for choice when choosing a work location.","[<div class=""_1wkzzau0 a1msqi6m""><span class=""_1wkzzau0 a1msqi4y lnocuo0 lnocuo1 lnocuo21 _1d0g9qk4 lnocuo7""><a aria-label=""Limit results to Perth WA"" class=""_1wkzzau0 _1wkzzauf _1wkzzau0 _1wkzzauf _842p0a0 _842p0a2"" data-automation=""jobLocation"" href=""/jobs-in-engineering/in-All-Perth-WA?salarytype=annual&amp;salaryrange=170000-175000"" rel=""nofollow"" tabindex=""-1"" target=""_self"" title=""Limit results to Perth WA"">Perth WA</a></span></div>, <div class=""_1wkzzau0 a1msqi6m""><div aria-label=""Salary: $80 – $90 per hour"" class=""_1wkzzau0""><span class=""_1wkzzau0 a1msqi4y lnocuo0 lnocuo1 lnocuo21 _1d0g9qk4 lnocuo7"" data-automation=""jobSalary""><span class=""_1wkzzau0 _16v7pfz1 a1msqi4y a1msqi0 a1msqir _16v7pfz3"" style=""--_16v7pfz2:2"">$80 – $90 per hour</span></span></div></div>]",2024-02-07,Engineering - None,08/02/2024
11,https://www.seek.com.au//job/73620159?type=standout&ref=search-standalone,engineering,Project Engineering,Project Engineer,Georgiou Group Pty Ltd,-,170000.0,172500.0,175000.0,"Toowoomba, Toowoomba & Darling Downs QLD",Fantastic opportunity for a Project Engineer to take on multiple projects for flood recovery works.,"[<div class=""_1wkzzau0 a1msqi6m""><span class=""_1wkzzau0 a1msqi4y lnocuo0 lnocuo1 lnocuo21 _1d0g9qk4 lnocuo7""><a aria-label=""Limit results to Toowoomba"" class=""_1wkzzau0 _1wkzzauf _1wkzzau0 _1wkzzauf _842p0a0 _842p0a2"" data-automation=""jobLocation"" href=""/jobs-in-engineering/in-Toowoomba-QLD-4350?salarytype=annual&amp;salaryrange=170000-175000"" rel=""nofollow"" tabindex=""-1"" target=""_self"" title=""Limit results to Toowoomba"">Toowoomba</a>, <a aria-label=""Limit results to Toowoomba &amp; Darling Downs QLD"" class=""_1wkzzau0 _1wkzzauf _1wkzzau0 _1wkzzauf _842p0a0 _842p0a2"" data-automation=""jobLocation"" href=""/jobs-in-engineering/in-Toowoomba-&amp;-Darling-Downs-QLD?salarytype=annual&amp;salaryrange=170000-175000"" rel=""nofollow"" tabindex=""-1"" target=""_self"" title=""Limit results to Toowoomba &amp; Darling Downs QLD"">Toowoomba &amp; Darling Downs QLD</a></span></div>]",,Engineering - None,08/02/2024
12,https://www.seek.com.au//job/73469209?type=standout&ref=search-standalone,engineering,Other,Engineering Capability,ASC,-,170000.0,172500.0,175000.0,Hobart TAS,Make change happen in 2024! We are inviting talented individuals to join ASC’s Engineering team.,"[<div class=""_1wkzzau0 a1msqi6m""><span class=""_1wkzzau0 a1msqi4y lnocuo0 lnocuo1 lnocuo21 _1d0g9qk4 lnocuo7""><a aria-label=""Limit results to Hobart TAS"" class=""_1wkzzau0 _1wkzzauf _1wkzzau0 _1wkzzauf _842p0a0 _842p0a2"" data-automation=""jobLocation"" href=""/jobs-in-engineering/in-All-Hobart-TAS?salarytype=annual&amp;salaryrange=170000-175000"" rel=""nofollow"" tabindex=""-1"" target=""_self"" title=""Limit results to Hobart TAS"">Hobart TAS</a></span></div>]",2024-02-02,Engineering - None,08/02/2024
13,https://www.seek.com.au//job/73588998?type=standout&ref=search-standalone,engineering,Management,Engineering Manager,Core Talent,$180k - $200k p.a. + + Bonus + Super,180000.0,190000.0,200000.0,Sydney NSW,Responsible for leading multidisciplinary teams to ensure plant and equipment is maintained.,"[<div class=""_1wkzzau0 a1msqi6m""><span class=""_1wkzzau0 a1msqi4y lnocuo0 lnocuo1 lnocuo21 _1d0g9qk4 lnocuo7""><a aria-label=""Limit results to Liverpool"" class=""_1wkzzau0 _1wkzzauf _1wkzzau0 _1wkzzauf _842p0a0 _842p0a2"" data-automation=""jobLocation"" href=""/jobs-in-engineering/in-Liverpool-NSW-2170?salarytype=annual&amp;salaryrange=170000-175000"" rel=""nofollow"" tabindex=""-1"" target=""_self"" title=""Limit results to Liverpool"">Liverpool</a>, <a aria-label=""Limit results to Sydney NSW"" class=""_1wkzzau0 _1wkzzauf _1wkzzau0 _1wkzzauf _842p0a0 _842p0a2"" data-automation=""jobLocation"" href=""/jobs-in-engineering/in-All-Sydney-NSW?salarytype=annual&amp;salaryrange=170000-175000"" rel=""nofollow"" tabindex=""-1"" target=""_self"" title=""Limit results to Sydney NSW"">Sydney NSW</a></span></div>, <div class=""_1wkzzau0 a1msqi6m""><div aria-label=""Salary: $180k - $200k p.a. + + Bonus + Super"" class=""_1wkzzau0""><span class=""_1wkzzau0 a1msqi4y lnocuo0 lnocuo1 lnocuo21 _1d0g9qk4 lnocuo7"" data-automation=""jobSalary""><span class=""_1wkzzau0 _16v7pfz1 a1msqi4y a1msqi0 a1msqir _16v7pfz3"" style=""--_16v7pfz2:2"">$180k - $200k p.a. + + Bonus + Super</span></span></div></div>]",2024-02-07,Engineering - None,08/02/2024
14,https://www.seek.com.au//job/73623036?type=standout&ref=search-standalone,engineering,Project Management,Project Manager,Brockman Engineering,-,170000.0,172500.0,175000.0,Wollongong NSW,"Permanent full time | March 2024 start | Wollongong, NSW","[<div class=""_1wkzzau0 a1msqi6m""><span class=""_1wkzzau0 a1msqi4y lnocuo0 lnocuo1 lnocuo21 _1d0g9qk4 lnocuo7""><a aria-label=""Limit results to Wollongong"" class=""_1wkzzau0 _1wkzzauf _1wkzzau0 _1wkzzauf _842p0a0 _842p0a2"" data-automation=""jobLocation"" href=""/jobs-in-engineering/in-Wollongong-NSW-2500?salarytype=annual&amp;salaryrange=170000-175000"" rel=""nofollow"" tabindex=""-1"" target=""_self"" title=""Limit results to Wollongong"">Wollongong</a>, <a aria-label=""Limit results to Wollongong, Illawarra &amp; South Coast NSW"" class=""_1wkzzau0 _1wkzzauf _1wkzzau0 _1wkzzauf _842p0a0 _842p0a2"" data-automation=""jobLocation"" href=""/jobs-in-engineering/in-Wollongong,-Illawarra-&amp;-South-Coast-NSW?salarytype=annual&amp;salaryrange=170000-175000"" rel=""nofollow"" tabindex=""-1"" target=""_self"" title=""Limit results to Wollongong, Illawarra &amp; South Coast NSW"">Wollongong, Illawarra &amp; South Coast NSW</a></span></div>]",,Engineering - None,08/02/2024
15,https://www.seek.com.au//job/73609232?type=standout&ref=search-standalone,engineering,Systems Engineering,Teacher - Engineering Technology (Mechatronics),Melbourne Polytechnic,$82 – $88.59 per hour,147600.0,153531.0,159462.00000000003,Melbourne VIC,Inspire Engineering students at Melbourne Polytechnic!,"[<div class=""_1wkzzau0 a1msqi6m""><span class=""_1wkzzau0 a1msqi4y lnocuo0 lnocuo1 lnocuo21 _1d0g9qk4 lnocuo7""><a aria-label=""Limit results to Preston"" class=""_1wkzzau0 _1wkzzauf _1wkzzau0 _1wkzzauf _842p0a0 _842p0a2"" data-automation=""jobLocation"" href=""/jobs-in-engineering/in-Preston-VIC-3072?salarytype=annual&amp;salaryrange=170000-175000"" rel=""nofollow"" tabindex=""-1"" target=""_self"" title=""Limit results to Preston"">Preston</a>, <a aria-label=""Limit results to Melbourne VIC"" class=""_1wkzzau0 _1wkzzauf _1wkzzau0 _1wkzzauf _842p0a0 _842p0a2"" data-automation=""jobLocation"" href=""/jobs-in-engineering/in-All-Melbourne-VIC?salarytype=annual&amp;salaryrange=170000-175000"" rel=""nofollow"" tabindex=""-1"" target=""_self"" title=""Limit results to Melbourne VIC"">Melbourne VIC</a></span></div>, <div class=""_1wkzzau0 a1msqi6m""><div aria-label=""Salary: $82 – $88.59 per hour"" class=""_1wkzzau0""><span class=""_1wkzzau0 a1msqi4y lnocuo0 lnocuo1 lnocuo21 _1d0g9qk4 lnocuo7"" data-automation=""jobSalary""><span class=""_1wkzzau0 _16v7pfz1 a1msqi4y a1msqi0 a1msqir _16v7pfz3"" style=""--_16v7pfz2:2"">$82 – $88.59 per hour</span></span></div></div>]",,Engineering - None,08/02/2024
16,https://www.seek.com.au//job/73582182?type=standout&ref=search-standalone,engineering,Mechanical Engineering,Engineering Manager,Kongsberg Defence Australia,-,170000.0,172500.0,175000.0,Canberra ACT,Engineering Manager based in Canberra ACT or Adelaide SA to support a small project team in the design and construction of a new production capability,"[<div class=""_1wkzzau0 a1msqi6m""><span class=""_1wkzzau0 a1msqi4y lnocuo0 lnocuo1 lnocuo21 _1d0g9qk4 lnocuo7""><a aria-label=""Limit results to Canberra International Airport"" class=""_1wkzzau0 _1wkzzauf _1wkzzau0 _1wkzzauf _842p0a0 _842p0a2"" data-automation=""jobLocation"" href=""/jobs-in-engineering/in-Canberra-International-Airport-ACT-2609?salarytype=annual&amp;salaryrange=170000-175000"" rel=""nofollow"" tabindex=""-1"" target=""_self"" title=""Limit results to Canberra International Airport"">Canberra International Airport</a>, <a aria-label=""Limit results to Canberra ACT"" class=""_1wkzzau0 _1wkzzauf _1wkzzau0 _1wkzzauf _842p0a0 _842p0a2"" data-automation=""jobLocation"" href=""/jobs-in-engineering/in-All-Canberra-ACT?salarytype=annual&amp;salaryrange=170000-175000"" rel=""nofollow"" tabindex=""-1"" target=""_self"" title=""Limit results to Canberra ACT"">Canberra ACT</a></span></div>]",2024-02-07,Engineering - None,08/02/2024
17,https://www.seek.com.au//job/73574118?type=standout&ref=search-standalone,engineering,Civil/Structural Engineering,Engineer,Ausgrid,"$135,140 – $159,993 per year",135140.0,147566.5,159993.0,Newcastle NSW,"Our vision is simple; for our communities to have the power for a resilient, affordable net zero future. ​","[<div class=""_1wkzzau0 a1msqi6m""><span class=""_1wkzzau0 a1msqi4y lnocuo0 lnocuo1 lnocuo21 _1d0g9qk4 lnocuo7""><a aria-label=""Limit results to Wallsend"" class=""_1wkzzau0 _1wkzzauf _1wkzzau0 _1wkzzauf _842p0a0 _842p0a2"" data-automation=""jobLocation"" href=""/jobs-in-engineering/in-Wallsend-NSW-2287?salarytype=annual&amp;salaryrange=170000-175000"" rel=""nofollow"" tabindex=""-1"" target=""_self"" title=""Limit results to Wallsend"">Wallsend</a>, <a aria-label=""Limit results to Newcastle, Maitland &amp; Hunter NSW"" class=""_1wkzzau0 _1wkzzauf _1wkzzau0 _1wkzzauf _842p0a0 _842p0a2"" data-automation=""jobLocation"" href=""/jobs-in-engineering/in-Newcastle,-Maitland-&amp;-Hunter-NSW?salarytype=annual&amp;salaryrange=170000-175000"" rel=""nofollow"" tabindex=""-1"" target=""_self"" title=""Limit results to Newcastle, Maitland &amp; Hunter NSW"">Newcastle, Maitland &amp; Hunter NSW</a></span></div>, <div class=""_1wkzzau0 a1msqi6m""><div aria-label=""Salary: $135,140 – $159,993 per year"" class=""_1wkzzau0""><span class=""_1wkzzau0 a1msqi4y lnocuo0 lnocuo1 lnocuo21 _1d0g9qk4 lnocuo7"" data-automation=""jobSalary""><span class=""_1wkzzau0 _16v7pfz1 a1msqi4y a1msqi0 a1msqir _16v7pfz3"" style=""--_16v7pfz2:2"">$135,140 – $159,993 per year</span></span></div></div>]",2024-02-07,Engineering - None,08/02/2024
18,https://www.seek.com.au//job/73611998?type=standout&ref=search-standalone,engineering,Mechanical Engineering,Mechanical Engineer,APA Group,-,170000.0,172500.0,175000.0,Melbourne VIC,"We have an exciting opportunity available for a Mechanical Engineer to join us in Melbourne, Victoria or Brisbane, Queensland on a full-time basis.","[<div class=""_1wkzzau0 a1msqi6m""><span class=""_1wkzzau0 a1msqi4y lnocuo0 lnocuo1 lnocuo21 _1d0g9qk4 lnocuo7""><a aria-label=""Limit results to Melbourne VIC"" class=""_1wkzzau0 _1wkzzauf _1wkzzau0 _1wkzzauf _842p0a0 _842p0a2"" data-automation=""jobLocation"" href=""/jobs-in-engineering/in-All-Melbourne-VIC?salarytype=annual&amp;salaryrange=170000-175000"" rel=""nofollow"" tabindex=""-1"" target=""_self"" title=""Limit results to Melbourne VIC"">Melbourne VIC</a></span></div>]",,Engineering - None,08/02/2024
19,https://www.seek.com.au//job/73611997?type=standout&ref=search-standalone,engineering,Mechanical Engineering,Mechanical Engineer,APA Group,-,170000.0,172500.0,175000.0,Brisbane QLD,"We have an exciting opportunity available for a Mechanical Engineer to join us in Melbourne, Victoria or Brisbane, Queensland on a full-time basis.","[<div class=""_1wkzzau0 a1msqi6m""><span class=""_1wkzzau0 a1msqi4y lnocuo0 lnocuo1 lnocuo21 _1d0g9qk4 lnocuo7""><a aria-label=""Limit results to Brisbane QLD"" class=""_1wkzzau0 _1wkzzauf _1wkzzau0 _1wkzzauf _842p0a0 _842p0a2"" data-automation=""jobLocation"" href=""/jobs-in-engineering/in-All-Brisbane-QLD?salarytype=annual&amp;salaryrange=170000-175000"" rel=""nofollow"" tabindex=""-1"" target=""_self"" title=""Limit results to Brisbane QLD"">Brisbane QLD</a></span></div>]",,Engineering - None,08/02/2024
