,link,classification,category,title,company,salary,min_salary,average_salary,max_salary,location,description,entireDiv,date_posted,Category,Date
266,https://www.seek.com.au//job/73356527?type=standout&ref=search-standalone,engineering,Project Engineering,Project Engineer,ACCIONA Australia,Attractive salary package,170000.0,172500.0,175000.0,Sydney NSW,"Looking to engage a Project Engineer responsible for resource planning, safety focus, mentorship, quality and cost control.","[<div class=""_1wkzzau0 a1msqi6m""><span class=""_1wkzzau0 a1msqi4y lnocuo0 lnocuo1 lnocuo21 _1d0g9qk4 lnocuo7""><a aria-label=""Limit results to Sydney NSW"" class=""_1wkzzau0 _1wkzzauf _1wkzzau0 _1wkzzauf _842p0a0 _842p0a2"" data-automation=""jobLocation"" href=""/jobs-in-engineering/in-All-Sydney-NSW?salarytype=annual&amp;salaryrange=170000-175000"" rel=""nofollow"" tabindex=""-1"" target=""_self"" title=""Limit results to Sydney NSW"">Sydney NSW</a></span></div>, <div class=""_1wkzzau0 a1msqi6m""><div aria-label=""Salary: Attractive salary package"" class=""_1wkzzau0""><span class=""_1wkzzau0 a1msqi4y lnocuo0 lnocuo1 lnocuo21 _1d0g9qk4 lnocuo7"" data-automation=""jobSalary""><span class=""_1wkzzau0 _16v7pfz1 a1msqi4y a1msqi0 a1msqir _16v7pfz3"" style=""--_16v7pfz2:2"">Attractive salary package</span></span></div></div>]",2024-01-29,Engineering - None,08/02/2024
267,https://www.seek.com.au//job/73581325?type=standard&ref=search-standalone,engineering,Project Management,Project Controls Manager | Minerals & Metals - Brisbane,Wood.,-,170000.0,172500.0,175000.0,Brisbane QLD,"Wood is currently seeking a Project Controls Manager to join our Brisbane team - Minerals & Metals, to join an upcoming long-term project.","[<div class=""_1wkzzau0 a1msqi6m""><span class=""_1wkzzau0 a1msqi4y lnocuo0 lnocuo1 lnocuo21 _1d0g9qk4 lnocuo7""><a aria-label=""Limit results to Brisbane QLD"" class=""_1wkzzau0 _1wkzzauf _1wkzzau0 _1wkzzauf _842p0a0 _842p0a2"" data-automation=""jobLocation"" href=""/jobs-in-engineering/in-All-Brisbane-QLD?salarytype=annual&amp;salaryrange=170000-175000"" rel=""nofollow"" tabindex=""-1"" target=""_self"" title=""Limit results to Brisbane QLD"">Brisbane QLD</a></span></div>]",2024-02-07,Engineering - None,08/02/2024
268,https://www.seek.com.au//job/73412515?type=standard&ref=search-standalone,engineering,Civil/Structural Engineering,Project Engineer,Ivory Group,"$140,000 - $160,000 + Super + Car",140000.0,150000.0,160000.0,Sydney NSW,A well established Civil Contractor is looking for multiple Project Engineers to assist with the delivery of exciting civil projects!,"[<div class=""_1wkzzau0 a1msqi6m""><span class=""_1wkzzau0 a1msqi4y lnocuo0 lnocuo1 lnocuo21 _1d0g9qk4 lnocuo7""><a aria-label=""Limit results to Parramatta"" class=""_1wkzzau0 _1wkzzauf _1wkzzau0 _1wkzzauf _842p0a0 _842p0a2"" data-automation=""jobLocation"" href=""/jobs-in-engineering/in-Parramatta-NSW-2150?salarytype=annual&amp;salaryrange=170000-175000"" rel=""nofollow"" tabindex=""-1"" target=""_self"" title=""Limit results to Parramatta"">Parramatta</a>, <a aria-label=""Limit results to Sydney NSW"" class=""_1wkzzau0 _1wkzzauf _1wkzzau0 _1wkzzauf _842p0a0 _842p0a2"" data-automation=""jobLocation"" href=""/jobs-in-engineering/in-All-Sydney-NSW?salarytype=annual&amp;salaryrange=170000-175000"" rel=""nofollow"" tabindex=""-1"" target=""_self"" title=""Limit results to Sydney NSW"">Sydney NSW</a></span></div>, <div class=""_1wkzzau0 a1msqi6m""><div aria-label=""Salary: $140,000 - $160,000 + Super + Car"" class=""_1wkzzau0""><span class=""_1wkzzau0 a1msqi4y lnocuo0 lnocuo1 lnocuo21 _1d0g9qk4 lnocuo7"" data-automation=""jobSalary""><span class=""_1wkzzau0 _16v7pfz1 a1msqi4y a1msqi0 a1msqir _16v7pfz3"" style=""--_16v7pfz2:2"">$140,000 - $160,000 + Super + Car</span></span></div></div>]",2024-01-31,Engineering - None,08/02/2024
269,https://www.seek.com.au//job/73407796?type=standout&ref=search-standalone,engineering,Management,ENGINEERING MANAGER AND ENGINEERING MANAGER (DEPUTY),BAE Systems,-,170000.0,172500.0,175000.0,Newcastle NSW,Exciting new opportunities for Engineering Manager and Engineering Manager (Deputy) to join our team based in Williamtown NSW,"[<div class=""_1wkzzau0 a1msqi6m""><span class=""_1wkzzau0 a1msqi4y lnocuo0 lnocuo1 lnocuo21 _1d0g9qk4 lnocuo7""><a aria-label=""Limit results to Williamtown"" class=""_1wkzzau0 _1wkzzauf _1wkzzau0 _1wkzzauf _842p0a0 _842p0a2"" data-automation=""jobLocation"" href=""/jobs-in-engineering/in-Williamtown-NSW-2318?salarytype=annual&amp;salaryrange=170000-175000"" rel=""nofollow"" tabindex=""-1"" target=""_self"" title=""Limit results to Williamtown"">Williamtown</a>, <a aria-label=""Limit results to Newcastle, Maitland &amp; Hunter NSW"" class=""_1wkzzau0 _1wkzzauf _1wkzzau0 _1wkzzauf _842p0a0 _842p0a2"" data-automation=""jobLocation"" href=""/jobs-in-engineering/in-Newcastle,-Maitland-&amp;-Hunter-NSW?salarytype=annual&amp;salaryrange=170000-175000"" rel=""nofollow"" tabindex=""-1"" target=""_self"" title=""Limit results to Newcastle, Maitland &amp; Hunter NSW"">Newcastle, Maitland &amp; Hunter NSW</a></span></div>]",2024-01-31,Engineering - None,08/02/2024
270,https://www.seek.com.au//job/73572443?type=standout&ref=search-standalone,engineering,Civil/Structural Engineering,Senior Project Engineer,Zenith Search,$150000.00 - $180000.00 p.a.,150000.0,165000.0,180000.0,Brisbane QLD,Be apart of Queensland most crucial infrastructure projects. Elevate your construction career today!,"[<div class=""_1wkzzau0 a1msqi6m""><span class=""_1wkzzau0 a1msqi4y lnocuo0 lnocuo1 lnocuo21 _1d0g9qk4 lnocuo7""><a aria-label=""Limit results to Brisbane QLD"" class=""_1wkzzau0 _1wkzzauf _1wkzzau0 _1wkzzauf _842p0a0 _842p0a2"" data-automation=""jobLocation"" href=""/jobs-in-engineering/in-All-Brisbane-QLD?salarytype=annual&amp;salaryrange=170000-175000"" rel=""nofollow"" tabindex=""-1"" target=""_self"" title=""Limit results to Brisbane QLD"">Brisbane QLD</a></span></div>, <div class=""_1wkzzau0 a1msqi6m""><div aria-label=""Salary: $150000.00 - $180000.00 p.a."" class=""_1wkzzau0""><span class=""_1wkzzau0 a1msqi4y lnocuo0 lnocuo1 lnocuo21 _1d0g9qk4 lnocuo7"" data-automation=""jobSalary""><span class=""_1wkzzau0 _16v7pfz1 a1msqi4y a1msqi0 a1msqir _16v7pfz3"" style=""--_16v7pfz2:2"">$150000.00 - $180000.00 p.a.</span></span></div></div>]",2024-02-07,Engineering - None,08/02/2024
271,https://www.seek.com.au//job/73434219?type=standout&ref=search-standalone,engineering,Electrical/Electronic Engineering,Robotics Engineer,Absolute People Solutions,-,170000.0,172500.0,175000.0,Perth WA,Exceptional opportunity for a talented Robotics Engineer to join a passionate team who are committed to developing innovative maritime technology.,"[<div class=""_1wkzzau0 a1msqi6m""><span class=""_1wkzzau0 a1msqi4y lnocuo0 lnocuo1 lnocuo21 _1d0g9qk4 lnocuo7""><a aria-label=""Limit results to Bibra Lake"" class=""_1wkzzau0 _1wkzzauf _1wkzzau0 _1wkzzauf _842p0a0 _842p0a2"" data-automation=""jobLocation"" href=""/jobs-in-engineering/in-Bibra-Lake-WA-6163?salarytype=annual&amp;salaryrange=170000-175000"" rel=""nofollow"" tabindex=""-1"" target=""_self"" title=""Limit results to Bibra Lake"">Bibra Lake</a>, <a aria-label=""Limit results to Perth WA"" class=""_1wkzzau0 _1wkzzauf _1wkzzau0 _1wkzzauf _842p0a0 _842p0a2"" data-automation=""jobLocation"" href=""/jobs-in-engineering/in-All-Perth-WA?salarytype=annual&amp;salaryrange=170000-175000"" rel=""nofollow"" tabindex=""-1"" target=""_self"" title=""Limit results to Perth WA"">Perth WA</a></span></div>]",2024-01-31,Engineering - None,08/02/2024
272,https://www.seek.com.au//job/73518286?type=standout&ref=search-standalone,engineering,Project Engineering,Senior Project Engineer,Schneider Electric,-,170000.0,172500.0,175000.0,Melbourne VIC,Join our team as a Senior Project Engineer (Industrial Automation - Citect) and be part of an exciting opportunity! Location flexible!,"[<div class=""_1wkzzau0 a1msqi6m""><span class=""_1wkzzau0 a1msqi4y lnocuo0 lnocuo1 lnocuo21 _1d0g9qk4 lnocuo7""><a aria-label=""Limit results to Melbourne VIC"" class=""_1wkzzau0 _1wkzzauf _1wkzzau0 _1wkzzauf _842p0a0 _842p0a2"" data-automation=""jobLocation"" href=""/jobs-in-engineering/in-All-Melbourne-VIC?salarytype=annual&amp;salaryrange=170000-175000"" rel=""nofollow"" tabindex=""-1"" target=""_self"" title=""Limit results to Melbourne VIC"">Melbourne VIC</a></span></div>]",2024-02-05,Engineering - None,08/02/2024
273,https://www.seek.com.au//job/73586554?type=standout&ref=search-standalone,engineering,Maintenance,Maintenance Manager - Maintenance Operations NSW,Downer EDI Limited,-,170000.0,172500.0,175000.0,Sydney NSW,You will lead and guide the maintenance team and associated sub-contractors. Role will be based at Auburn Maintenance Centre.,"[<div class=""_1wkzzau0 a1msqi6m""><span class=""_1wkzzau0 a1msqi4y lnocuo0 lnocuo1 lnocuo21 _1d0g9qk4 lnocuo7""><a aria-label=""Limit results to Auburn"" class=""_1wkzzau0 _1wkzzauf _1wkzzau0 _1wkzzauf _842p0a0 _842p0a2"" data-automation=""jobLocation"" href=""/jobs-in-engineering/in-Auburn-NSW-2144?salarytype=annual&amp;salaryrange=170000-175000"" rel=""nofollow"" tabindex=""-1"" target=""_self"" title=""Limit results to Auburn"">Auburn</a>, <a aria-label=""Limit results to Sydney NSW"" class=""_1wkzzau0 _1wkzzauf _1wkzzau0 _1wkzzauf _842p0a0 _842p0a2"" data-automation=""jobLocation"" href=""/jobs-in-engineering/in-All-Sydney-NSW?salarytype=annual&amp;salaryrange=170000-175000"" rel=""nofollow"" tabindex=""-1"" target=""_self"" title=""Limit results to Sydney NSW"">Sydney NSW</a></span></div>]",2024-02-07,Engineering - None,08/02/2024
274,https://www.seek.com.au//job/73591323?type=standout&ref=search-standalone,engineering,Civil/Structural Engineering,Area Engineer - Surface Stations,Cross River Rail Delivery Authority,-,170000.0,172500.0,175000.0,Brisbane QLD,"Site based station build project engineering position available for Merrimac, Gold Coast station site supporting design and construction.","[<div class=""_1wkzzau0 a1msqi6m""><span class=""_1wkzzau0 a1msqi4y lnocuo0 lnocuo1 lnocuo21 _1d0g9qk4 lnocuo7""><a aria-label=""Limit results to Brisbane QLD"" class=""_1wkzzau0 _1wkzzauf _1wkzzau0 _1wkzzauf _842p0a0 _842p0a2"" data-automation=""jobLocation"" href=""/jobs-in-engineering/in-All-Brisbane-QLD?salarytype=annual&amp;salaryrange=170000-175000"" rel=""nofollow"" tabindex=""-1"" target=""_self"" title=""Limit results to Brisbane QLD"">Brisbane QLD</a></span></div>]",2024-02-07,Engineering - None,08/02/2024
275,https://www.seek.com.au//job/73626543?type=standout&ref=search-standalone,engineering,Electrical/Electronic Engineering,Transmission and Substation Engineering vacancies,PERSOLKELLY,-,170000.0,172500.0,175000.0,Perth WA,"We have 3 new Electrical Engineering positions available. True career opportunities, offering exceptional conditions and work/life balance.","[<div class=""_1wkzzau0 a1msqi6m""><span class=""_1wkzzau0 a1msqi4y lnocuo0 lnocuo1 lnocuo21 _1d0g9qk4 lnocuo7""><a aria-label=""Limit results to Perth WA"" class=""_1wkzzau0 _1wkzzauf _1wkzzau0 _1wkzzauf _842p0a0 _842p0a2"" data-automation=""jobLocation"" href=""/jobs-in-engineering/in-All-Perth-WA?salarytype=annual&amp;salaryrange=170000-175000"" rel=""nofollow"" tabindex=""-1"" target=""_self"" title=""Limit results to Perth WA"">Perth WA</a></span></div>]",,Engineering - None,08/02/2024
276,https://www.seek.com.au//job/73608033?type=standout&ref=search-standalone,engineering,Project Engineering,Senior Project Engineer - Linewide,Parklife Metro DC,-,170000.0,172500.0,175000.0,Sydney NSW,Sydney Metro & Parklife JV is seeking a Senior Project Engineer to become a crucial part of our Linewide team on this major project!,"[<div class=""_1wkzzau0 a1msqi6m""><span class=""_1wkzzau0 a1msqi4y lnocuo0 lnocuo1 lnocuo21 _1d0g9qk4 lnocuo7""><a aria-label=""Limit results to Orchard Hills"" class=""_1wkzzau0 _1wkzzauf _1wkzzau0 _1wkzzauf _842p0a0 _842p0a2"" data-automation=""jobLocation"" href=""/jobs-in-engineering/in-Orchard-Hills-NSW-2748?salarytype=annual&amp;salaryrange=170000-175000"" rel=""nofollow"" tabindex=""-1"" target=""_self"" title=""Limit results to Orchard Hills"">Orchard Hills</a>, <a aria-label=""Limit results to Sydney NSW"" class=""_1wkzzau0 _1wkzzauf _1wkzzau0 _1wkzzauf _842p0a0 _842p0a2"" data-automation=""jobLocation"" href=""/jobs-in-engineering/in-All-Sydney-NSW?salarytype=annual&amp;salaryrange=170000-175000"" rel=""nofollow"" tabindex=""-1"" target=""_self"" title=""Limit results to Sydney NSW"">Sydney NSW</a></span></div>]",,Engineering - None,08/02/2024
277,https://www.seek.com.au//job/73233787?type=standout&ref=search-standalone,engineering,Electrical/Electronic Engineering,Engineers,TasNetworks,-,170000.0,172500.0,175000.0,Hobart TAS,Energise your Engineering career!,"[<div class=""_1wkzzau0 a1msqi6m""><span class=""_1wkzzau0 a1msqi4y lnocuo0 lnocuo1 lnocuo21 _1d0g9qk4 lnocuo7""><a aria-label=""Limit results to Cambridge"" class=""_1wkzzau0 _1wkzzauf _1wkzzau0 _1wkzzauf _842p0a0 _842p0a2"" data-automation=""jobLocation"" href=""/jobs-in-engineering/in-Cambridge-TAS-7170?salarytype=annual&amp;salaryrange=170000-175000"" rel=""nofollow"" tabindex=""-1"" target=""_self"" title=""Limit results to Cambridge"">Cambridge</a>, <a aria-label=""Limit results to Hobart TAS"" class=""_1wkzzau0 _1wkzzauf _1wkzzau0 _1wkzzauf _842p0a0 _842p0a2"" data-automation=""jobLocation"" href=""/jobs-in-engineering/in-All-Hobart-TAS?salarytype=annual&amp;salaryrange=170000-175000"" rel=""nofollow"" tabindex=""-1"" target=""_self"" title=""Limit results to Hobart TAS"">Hobart TAS</a></span></div>]",2024-01-23,Engineering - None,08/02/2024
278,https://www.seek.com.au//job/73298399?type=standout&ref=search-standalone,engineering,Management,Engineering Manager,Inghams Enterprises Pty Ltd,-,170000.0,172500.0,175000.0,Melbourne VIC,Lead a team at Thomastown to deliver improvements across maintenance and unplanned downtime whilst managing capital plans across the site!,"[<div class=""_1wkzzau0 a1msqi6m""><span class=""_1wkzzau0 a1msqi4y lnocuo0 lnocuo1 lnocuo21 _1d0g9qk4 lnocuo7""><a aria-label=""Limit results to Thomastown"" class=""_1wkzzau0 _1wkzzauf _1wkzzau0 _1wkzzauf _842p0a0 _842p0a2"" data-automation=""jobLocation"" href=""/jobs-in-engineering/in-Thomastown-VIC-3074?salarytype=annual&amp;salaryrange=170000-175000"" rel=""nofollow"" tabindex=""-1"" target=""_self"" title=""Limit results to Thomastown"">Thomastown</a>, <a aria-label=""Limit results to Melbourne VIC"" class=""_1wkzzau0 _1wkzzauf _1wkzzau0 _1wkzzauf _842p0a0 _842p0a2"" data-automation=""jobLocation"" href=""/jobs-in-engineering/in-All-Melbourne-VIC?salarytype=annual&amp;salaryrange=170000-175000"" rel=""nofollow"" tabindex=""-1"" target=""_self"" title=""Limit results to Melbourne VIC"">Melbourne VIC</a></span></div>]",2024-01-25,Engineering - None,08/02/2024
279,https://www.seek.com.au//job/73481456?type=standout&ref=search-standalone,engineering,Management,Manager Electrical and Controls Engineering,Snowy Hydro,-,170000.0,172500.0,175000.0,Canberra ACT,Leading the Electrical and Controls team and provide technical support across major overhauls and upgrade projects in the Production Group,"[<div class=""_1wkzzau0 a1msqi6m""><span class=""_1wkzzau0 a1msqi4y lnocuo0 lnocuo1 lnocuo21 _1d0g9qk4 lnocuo7""><a aria-label=""Limit results to Canberra ACT"" class=""_1wkzzau0 _1wkzzauf _1wkzzau0 _1wkzzauf _842p0a0 _842p0a2"" data-automation=""jobLocation"" href=""/jobs-in-engineering/in-All-Canberra-ACT?salarytype=annual&amp;salaryrange=170000-175000"" rel=""nofollow"" tabindex=""-1"" target=""_self"" title=""Limit results to Canberra ACT"">Canberra ACT</a></span></div>]",2024-02-02,Engineering - None,08/02/2024
280,https://www.seek.com.au//job/73616521?type=standout&ref=search-standalone,engineering,Systems Engineering,Safety Assurance Engineer - QTMP,Downer EDI Limited,-,170000.0,172500.0,175000.0,Brisbane QLD,You will manage completion of safety assurance activities to confirm and document compliance to contract specification requirements.,"[<div class=""_1wkzzau0 a1msqi6m""><span class=""_1wkzzau0 a1msqi4y lnocuo0 lnocuo1 lnocuo21 _1d0g9qk4 lnocuo7""><a aria-label=""Limit results to Brisbane QLD"" class=""_1wkzzau0 _1wkzzauf _1wkzzau0 _1wkzzauf _842p0a0 _842p0a2"" data-automation=""jobLocation"" href=""/jobs-in-engineering/in-All-Brisbane-QLD?salarytype=annual&amp;salaryrange=170000-175000"" rel=""nofollow"" tabindex=""-1"" target=""_self"" title=""Limit results to Brisbane QLD"">Brisbane QLD</a></span></div>]",,Engineering - None,08/02/2024
281,https://www.seek.com.au//job/73476957?type=standard&ref=search-standalone,engineering,Mechanical Engineering,Senior Mechanical Design Engineer,Michael Page,$80 - $100 p.h. + Super,144000.0,162000.0,180000.0,Perth WA,Great opportunity for an accomplished Senior Designer & Designer in the mechanical and piping space,"[<div class=""_1wkzzau0 a1msqi6m""><span class=""_1wkzzau0 a1msqi4y lnocuo0 lnocuo1 lnocuo21 _1d0g9qk4 lnocuo7""><a aria-label=""Limit results to Perth WA"" class=""_1wkzzau0 _1wkzzauf _1wkzzau0 _1wkzzauf _842p0a0 _842p0a2"" data-automation=""jobLocation"" href=""/jobs-in-engineering/in-All-Perth-WA?salarytype=annual&amp;salaryrange=170000-175000"" rel=""nofollow"" tabindex=""-1"" target=""_self"" title=""Limit results to Perth WA"">Perth WA</a></span></div>, <div class=""_1wkzzau0 a1msqi6m""><div aria-label=""Salary: $80 - $100 p.h. + Super"" class=""_1wkzzau0""><span class=""_1wkzzau0 a1msqi4y lnocuo0 lnocuo1 lnocuo21 _1d0g9qk4 lnocuo7"" data-automation=""jobSalary""><span class=""_1wkzzau0 _16v7pfz1 a1msqi4y a1msqi0 a1msqir _16v7pfz3"" style=""--_16v7pfz2:2"">$80 - $100 p.h. + Super</span></span></div></div>]",2024-02-02,Engineering - None,08/02/2024
282,https://www.seek.com.au//job/73546391?type=standout&ref=search-standalone,engineering,Engineering Drafting,Piping Designer,Mineral Resources Limited,-,170000.0,172500.0,175000.0,Perth WA,"Fantastic opportunity for an experienced Piping Designer join our team in Osborne Park with cafe's, gym, restaurant & Shuttle Bus from Train Station.","[<div class=""_1wkzzau0 a1msqi6m""><span class=""_1wkzzau0 a1msqi4y lnocuo0 lnocuo1 lnocuo21 _1d0g9qk4 lnocuo7""><a aria-label=""Limit results to Osborne Park"" class=""_1wkzzau0 _1wkzzauf _1wkzzau0 _1wkzzauf _842p0a0 _842p0a2"" data-automation=""jobLocation"" href=""/jobs-in-engineering/in-Osborne-Park-WA-6017?salarytype=annual&amp;salaryrange=170000-175000"" rel=""nofollow"" tabindex=""-1"" target=""_self"" title=""Limit results to Osborne Park"">Osborne Park</a>, <a aria-label=""Limit results to Perth WA"" class=""_1wkzzau0 _1wkzzauf _1wkzzau0 _1wkzzauf _842p0a0 _842p0a2"" data-automation=""jobLocation"" href=""/jobs-in-engineering/in-All-Perth-WA?salarytype=annual&amp;salaryrange=170000-175000"" rel=""nofollow"" tabindex=""-1"" target=""_self"" title=""Limit results to Perth WA"">Perth WA</a></span></div>]",2024-02-06,Engineering - None,08/02/2024
283,https://www.seek.com.au//job/73555593?type=standout&ref=search-standalone,engineering,Electrical/Electronic Engineering,Lead Avionics Engineer,Gilmour Space Technologies Pty Ltd,-,170000.0,172500.0,175000.0,Gold Coast QLD,"All Orbits, All Planets - Join us on our journey Gilmour Space is the leading Australian rocket company, pioneering next-generation hybrid propulsi...","[<div class=""_1wkzzau0 a1msqi6m""><span class=""_1wkzzau0 a1msqi4y lnocuo0 lnocuo1 lnocuo21 _1d0g9qk4 lnocuo7""><a aria-label=""Limit results to Helensvale"" class=""_1wkzzau0 _1wkzzauf _1wkzzau0 _1wkzzauf _842p0a0 _842p0a2"" data-automation=""jobLocation"" href=""/jobs-in-engineering/in-Helensvale-QLD-4212?salarytype=annual&amp;salaryrange=170000-175000"" rel=""nofollow"" tabindex=""-1"" target=""_self"" title=""Limit results to Helensvale"">Helensvale</a>, <a aria-label=""Limit results to Gold Coast QLD"" class=""_1wkzzau0 _1wkzzauf _1wkzzau0 _1wkzzauf _842p0a0 _842p0a2"" data-automation=""jobLocation"" href=""/jobs-in-engineering/in-All-Gold-Coast-QLD?salarytype=annual&amp;salaryrange=170000-175000"" rel=""nofollow"" tabindex=""-1"" target=""_self"" title=""Limit results to Gold Coast QLD"">Gold Coast QLD</a></span></div>]",2024-02-06,Engineering - None,08/02/2024
284,https://www.seek.com.au//job/73244381?type=standard&ref=search-standalone,engineering,Maintenance,Engineering Manager,"Randstad - Construction, Property & Engineering",$150k - $160k p.a. + + 11% Superannuation,150000.0,155000.0,160000.0,Sydney NSW,Exclusive opportunity for an Engineering Manager to join managerial ranks with one of industry leaders in food and confectionery manufacturing.,"[<div class=""_1wkzzau0 a1msqi6m""><span class=""_1wkzzau0 a1msqi4y lnocuo0 lnocuo1 lnocuo21 _1d0g9qk4 lnocuo7""><a aria-label=""Limit results to Erskine Park"" class=""_1wkzzau0 _1wkzzauf _1wkzzau0 _1wkzzauf _842p0a0 _842p0a2"" data-automation=""jobLocation"" href=""/jobs-in-engineering/in-Erskine-Park-NSW-2759?salarytype=annual&amp;salaryrange=170000-175000"" rel=""nofollow"" tabindex=""-1"" target=""_self"" title=""Limit results to Erskine Park"">Erskine Park</a>, <a aria-label=""Limit results to Sydney NSW"" class=""_1wkzzau0 _1wkzzauf _1wkzzau0 _1wkzzauf _842p0a0 _842p0a2"" data-automation=""jobLocation"" href=""/jobs-in-engineering/in-All-Sydney-NSW?salarytype=annual&amp;salaryrange=170000-175000"" rel=""nofollow"" tabindex=""-1"" target=""_self"" title=""Limit results to Sydney NSW"">Sydney NSW</a></span></div>, <div class=""_1wkzzau0 a1msqi6m""><div aria-label=""Salary: $150k - $160k p.a. + + 11% Superannuation"" class=""_1wkzzau0""><span class=""_1wkzzau0 a1msqi4y lnocuo0 lnocuo1 lnocuo21 _1d0g9qk4 lnocuo7"" data-automation=""jobSalary""><span class=""_1wkzzau0 _16v7pfz1 a1msqi4y a1msqi0 a1msqir _16v7pfz3"" style=""--_16v7pfz2:2"">$150k - $160k p.a. + + 11% Superannuation</span></span></div></div>]",2024-01-23,Engineering - None,08/02/2024
285,https://www.seek.com.au//job/73387517?type=standout&ref=search-standalone,engineering,Project Management,Project Manager,Jacobs,-,170000.0,172500.0,175000.0,Brisbane QLD,We are looking for a Project Manager to join our team. This role provides support to unmanned aerial systems and has great career progression,"[<div class=""_1wkzzau0 a1msqi6m""><span class=""_1wkzzau0 a1msqi4y lnocuo0 lnocuo1 lnocuo21 _1d0g9qk4 lnocuo7""><a aria-label=""Limit results to Brisbane QLD"" class=""_1wkzzau0 _1wkzzauf _1wkzzau0 _1wkzzauf _842p0a0 _842p0a2"" data-automation=""jobLocation"" href=""/jobs-in-engineering/in-All-Brisbane-QLD?salarytype=annual&amp;salaryrange=170000-175000"" rel=""nofollow"" tabindex=""-1"" target=""_self"" title=""Limit results to Brisbane QLD"">Brisbane QLD</a></span></div>]",2024-01-30,Engineering - None,08/02/2024
286,https://www.seek.com.au//job/73364597?type=promoted&ref=search-standalone,engineering,Civil/Structural Engineering,"Project Engineer, Superstructures",Laing O'Rourke Australia Construction Pty Limited,-,170000.0,172500.0,175000.0,Perth WA,Exciting and rare opportunity. Accelerate your career with Laing O'Rourke.,"[<div class=""_1wkzzau0 a1msqi6m""><span class=""_1wkzzau0 a1msqi4y lnocuo0 lnocuo1 lnocuo21 _1d0g9qk4 lnocuo7""><a aria-label=""Limit results to Fremantle"" class=""_1wkzzau0 _1wkzzauf _1wkzzau0 _1wkzzauf _842p0a0 _842p0a2"" data-automation=""jobLocation"" href=""/jobs-in-engineering/in-Fremantle-WA-6160?salarytype=annual&amp;salaryrange=170000-175000"" rel=""nofollow"" tabindex=""-1"" target=""_self"" title=""Limit results to Fremantle"">Fremantle</a>, <a aria-label=""Limit results to Perth WA"" class=""_1wkzzau0 _1wkzzauf _1wkzzau0 _1wkzzauf _842p0a0 _842p0a2"" data-automation=""jobLocation"" href=""/jobs-in-engineering/in-All-Perth-WA?salarytype=annual&amp;salaryrange=170000-175000"" rel=""nofollow"" tabindex=""-1"" target=""_self"" title=""Limit results to Perth WA"">Perth WA</a></span></div>]",,Engineering - None,08/02/2024
287,https://www.seek.com.au//job/73586554?type=promoted&ref=search-standalone,engineering,Maintenance,Maintenance Manager - Maintenance Operations NSW,Downer EDI Limited,-,170000.0,172500.0,175000.0,Sydney NSW,You will lead and guide the maintenance team and associated sub-contractors. Role will be based at Auburn Maintenance Centre.,"[<div class=""_1wkzzau0 a1msqi6m""><span class=""_1wkzzau0 a1msqi4y lnocuo0 lnocuo1 lnocuo21 _1d0g9qk4 lnocuo7""><a aria-label=""Limit results to Auburn"" class=""_1wkzzau0 _1wkzzauf _1wkzzau0 _1wkzzauf _842p0a0 _842p0a2"" data-automation=""jobLocation"" href=""/jobs-in-engineering/in-Auburn-NSW-2144?salarytype=annual&amp;salaryrange=170000-175000"" rel=""nofollow"" tabindex=""-1"" target=""_self"" title=""Limit results to Auburn"">Auburn</a>, <a aria-label=""Limit results to Sydney NSW"" class=""_1wkzzau0 _1wkzzauf _1wkzzau0 _1wkzzauf _842p0a0 _842p0a2"" data-automation=""jobLocation"" href=""/jobs-in-engineering/in-All-Sydney-NSW?salarytype=annual&amp;salaryrange=170000-175000"" rel=""nofollow"" tabindex=""-1"" target=""_self"" title=""Limit results to Sydney NSW"">Sydney NSW</a></span></div>]",,Engineering - None,08/02/2024
288,https://www.seek.com.au//job/73575611?type=standout&ref=search-standalone,engineering,Project Engineering,E&I Senior Project Engineer - Major Oil and Gas Construction Projects,Monadelphous,-,170000.0,172500.0,175000.0,Perth WA,Join our team as an Senior E&I Project Engineer for a challenging two-year Oil & Gas project in WA.,"[<div class=""_1wkzzau0 a1msqi6m""><span class=""_1wkzzau0 a1msqi4y lnocuo0 lnocuo1 lnocuo21 _1d0g9qk4 lnocuo7""><a aria-label=""Limit results to Perth WA"" class=""_1wkzzau0 _1wkzzauf _1wkzzau0 _1wkzzauf _842p0a0 _842p0a2"" data-automation=""jobLocation"" href=""/jobs-in-engineering/in-All-Perth-WA?salarytype=annual&amp;salaryrange=170000-175000"" rel=""nofollow"" tabindex=""-1"" target=""_self"" title=""Limit results to Perth WA"">Perth WA</a></span></div>]",2024-02-07,Engineering - None,08/02/2024
