,link,classification,category,title,company,salary,min_salary,average_salary,max_salary,location,description,entireDiv,date_posted,Category,Date
22,https://www.seek.com.au//job/73443067?type=promoted&ref=search-standalone,retail consumer products,Planning,Product Owner - Planning and Merchandise,Kmart,-,160000.0,162500.0,165000.0,Melbourne VIC,An exciting new opportunity for a Product Owner - Planning & Merchandise to join Kmart & Target!,"[<div class=""_1wkzzau0 a1msqi6m""><span class=""_1wkzzau0 a1msqi4y lnocuo0 lnocuo1 lnocuo21 _1d0g9qk4 lnocuo7""><a aria-label=""Limit results to Mulgrave"" class=""_1wkzzau0 _1wkzzauf _1wkzzau0 _1wkzzauf _842p0a0 _842p0a2"" data-automation=""jobLocation"" href=""/jobs-in-retail-consumer-products/in-Mulgrave-VIC-3170?salarytype=annual&amp;salaryrange=160000-165000"" rel=""nofollow"" tabindex=""-1"" target=""_self"" title=""Limit results to Mulgrave"">Mulgrave</a>, <a aria-label=""Limit results to Melbourne VIC"" class=""_1wkzzau0 _1wkzzauf _1wkzzau0 _1wkzzauf _842p0a0 _842p0a2"" data-automation=""jobLocation"" href=""/jobs-in-retail-consumer-products/in-All-Melbourne-VIC?salarytype=annual&amp;salaryrange=160000-165000"" rel=""nofollow"" tabindex=""-1"" target=""_self"" title=""Limit results to Melbourne VIC"">Melbourne VIC</a></span></div>]",,Retail-consumer-products - None,08/02/2024
23,https://www.seek.com.au//job/73480155?type=promoted&ref=search-standalone,retail consumer products,Management - Area/Multi-site,State Manager - VIC,,-,160000.0,162500.0,165000.0,Melbourne VIC,"This is a hands-on and leadership role, responsible for developing and optimising the operations, overall sales, and profitability of the State.","[<div class=""_1wkzzau0 a1msqi6m""><span class=""_1wkzzau0 a1msqi4y lnocuo0 lnocuo1 lnocuo21 _1d0g9qk4 lnocuo7""><a aria-label=""Limit results to Clayton"" class=""_1wkzzau0 _1wkzzauf _1wkzzau0 _1wkzzauf _842p0a0 _842p0a2"" data-automation=""jobLocation"" href=""/jobs-in-retail-consumer-products/in-Clayton-VIC-3168?salarytype=annual&amp;salaryrange=160000-165000"" rel=""nofollow"" tabindex=""-1"" target=""_self"" title=""Limit results to Clayton"">Clayton</a>, <a aria-label=""Limit results to Melbourne VIC"" class=""_1wkzzau0 _1wkzzauf _1wkzzau0 _1wkzzauf _842p0a0 _842p0a2"" data-automation=""jobLocation"" href=""/jobs-in-retail-consumer-products/in-All-Melbourne-VIC?salarytype=annual&amp;salaryrange=160000-165000"" rel=""nofollow"" tabindex=""-1"" target=""_self"" title=""Limit results to Melbourne VIC"">Melbourne VIC</a></span></div>]",,Retail-consumer-products - None,08/02/2024
24,https://www.seek.com.au//job/73446129?type=standout&ref=search-standalone,retail consumer products,Planning,"Change Manager - Merchandise, Inventory & Planning (12mth FTC)",Kmart,-,160000.0,162500.0,165000.0,Melbourne VIC,"An exciting new opportunity for a Change Manager - Merchandise, Inventory & Planning to join Kmart & Target!","[<div class=""_1wkzzau0 a1msqi6m""><span class=""_1wkzzau0 a1msqi4y lnocuo0 lnocuo1 lnocuo21 _1d0g9qk4 lnocuo7""><a aria-label=""Limit results to Mulgrave"" class=""_1wkzzau0 _1wkzzauf _1wkzzau0 _1wkzzauf _842p0a0 _842p0a2"" data-automation=""jobLocation"" href=""/jobs-in-retail-consumer-products/in-Mulgrave-VIC-3170?salarytype=annual&amp;salaryrange=160000-165000"" rel=""nofollow"" tabindex=""-1"" target=""_self"" title=""Limit results to Mulgrave"">Mulgrave</a>, <a aria-label=""Limit results to Melbourne VIC"" class=""_1wkzzau0 _1wkzzauf _1wkzzau0 _1wkzzauf _842p0a0 _842p0a2"" data-automation=""jobLocation"" href=""/jobs-in-retail-consumer-products/in-All-Melbourne-VIC?salarytype=annual&amp;salaryrange=160000-165000"" rel=""nofollow"" tabindex=""-1"" target=""_self"" title=""Limit results to Melbourne VIC"">Melbourne VIC</a></span></div>]",2024-02-01,Retail-consumer-products - None,08/02/2024
25,https://www.seek.com.au//job/73524470?type=standout&ref=search-standalone,retail consumer products,Planning,Range and Space Planning Manager,Coca-Cola Europacific Partners,-,160000.0,162500.0,165000.0,Melbourne VIC,Work at one of the worlds' leading companies in consumer goods as a Range & Space Planning Manager!,"[<div class=""_1wkzzau0 a1msqi6m""><span class=""_1wkzzau0 a1msqi4y lnocuo0 lnocuo1 lnocuo21 _1d0g9qk4 lnocuo7""><a aria-label=""Limit results to Melbourne VIC"" class=""_1wkzzau0 _1wkzzauf _1wkzzau0 _1wkzzauf _842p0a0 _842p0a2"" data-automation=""jobLocation"" href=""/jobs-in-retail-consumer-products/in-All-Melbourne-VIC?salarytype=annual&amp;salaryrange=160000-165000"" rel=""nofollow"" tabindex=""-1"" target=""_self"" title=""Limit results to Melbourne VIC"">Melbourne VIC</a></span></div>]",2024-02-05,Retail-consumer-products - None,08/02/2024
26,https://www.seek.com.au//job/73111420?type=standout&ref=search-standalone,retail consumer products,Management - Area/Multi-site,State Manager,Bob Jane T- Marts,-,160000.0,162500.0,165000.0,Melbourne VIC,Bob Jane T-Marts has a great opportunity available for an experienced State Manager to join the Victorian fast-paced store support team.,"[<div class=""_1wkzzau0 a1msqi6m""><span class=""_1wkzzau0 a1msqi4y lnocuo0 lnocuo1 lnocuo21 _1d0g9qk4 lnocuo7""><a aria-label=""Limit results to Melbourne VIC"" class=""_1wkzzau0 _1wkzzauf _1wkzzau0 _1wkzzauf _842p0a0 _842p0a2"" data-automation=""jobLocation"" href=""/jobs-in-retail-consumer-products/in-All-Melbourne-VIC?salarytype=annual&amp;salaryrange=160000-165000"" rel=""nofollow"" tabindex=""-1"" target=""_self"" title=""Limit results to Melbourne VIC"">Melbourne VIC</a></span></div>]",2024-01-18,Retail-consumer-products - None,08/02/2024
27,https://www.seek.com.au//job/73524400?type=standout&ref=search-standalone,retail consumer products,Planning,Range and Space Planning Manager,Coca-Cola Europacific Partners,-,160000.0,162500.0,165000.0,Sydney NSW,Work at one of the worlds' leading companies in consumer goods as a Range & Space Planning Manager!,"[<div class=""_1wkzzau0 a1msqi6m""><span class=""_1wkzzau0 a1msqi4y lnocuo0 lnocuo1 lnocuo21 _1d0g9qk4 lnocuo7""><a aria-label=""Limit results to Sydney NSW"" class=""_1wkzzau0 _1wkzzauf _1wkzzau0 _1wkzzauf _842p0a0 _842p0a2"" data-automation=""jobLocation"" href=""/jobs-in-retail-consumer-products/in-All-Sydney-NSW?salarytype=annual&amp;salaryrange=160000-165000"" rel=""nofollow"" tabindex=""-1"" target=""_self"" title=""Limit results to Sydney NSW"">Sydney NSW</a></span></div>]",2024-02-05,Retail-consumer-products - None,08/02/2024
28,https://www.seek.com.au//job/73514482?type=standard&ref=search-standalone,retail consumer products,Planning,Head of Planning,Kathmandu (Australia),-,160000.0,162500.0,165000.0,Melbourne VIC,We are searching for a newly created Head of Planning to lead our Commercial team. Come and lead our passionate team!,"[<div class=""_1wkzzau0 a1msqi6m""><span class=""_1wkzzau0 a1msqi4y lnocuo0 lnocuo1 lnocuo21 _1d0g9qk4 lnocuo7""><a aria-label=""Limit results to South Melbourne"" class=""_1wkzzau0 _1wkzzauf _1wkzzau0 _1wkzzauf _842p0a0 _842p0a2"" data-automation=""jobLocation"" href=""/jobs-in-retail-consumer-products/in-South-Melbourne-VIC-3205?salarytype=annual&amp;salaryrange=160000-165000"" rel=""nofollow"" tabindex=""-1"" target=""_self"" title=""Limit results to South Melbourne"">South Melbourne</a>, <a aria-label=""Limit results to Melbourne VIC"" class=""_1wkzzau0 _1wkzzauf _1wkzzau0 _1wkzzauf _842p0a0 _842p0a2"" data-automation=""jobLocation"" href=""/jobs-in-retail-consumer-products/in-All-Melbourne-VIC?salarytype=annual&amp;salaryrange=160000-165000"" rel=""nofollow"" tabindex=""-1"" target=""_self"" title=""Limit results to Melbourne VIC"">Melbourne VIC</a></span></div>]",2024-02-05,Retail-consumer-products - None,08/02/2024
29,https://www.seek.com.au//job/73172384?type=standout&ref=search-standalone,retail consumer products,Management - Area/Multi-site,Head of Retail,Talent Matters Australia Pty Ltd,-,160000.0,162500.0,165000.0,Sydney NSW,Are you a passionate retailer that thrives in developing people and driving performance? This could be the change you have been seeking!,"[<div class=""_1wkzzau0 a1msqi6m""><span class=""_1wkzzau0 a1msqi4y lnocuo0 lnocuo1 lnocuo21 _1d0g9qk4 lnocuo7""><a aria-label=""Limit results to Sydney NSW"" class=""_1wkzzau0 _1wkzzauf _1wkzzau0 _1wkzzauf _842p0a0 _842p0a2"" data-automation=""jobLocation"" href=""/jobs-in-retail-consumer-products/in-All-Sydney-NSW?salarytype=annual&amp;salaryrange=160000-165000"" rel=""nofollow"" tabindex=""-1"" target=""_self"" title=""Limit results to Sydney NSW"">Sydney NSW</a></span></div>]",2024-01-19,Retail-consumer-products - None,08/02/2024
30,https://www.seek.com.au//job/73616502?type=standout&ref=search-standalone,retail consumer products,Management - Store,Merchandise Manager,Outback Stores,-,160000.0,162500.0,165000.0,Darwin NT,Outback Stores is on the search for a Merchandise Manager to join our Senior Leadership Team!,"[<div class=""_1wkzzau0 a1msqi6m""><span class=""_1wkzzau0 a1msqi4y lnocuo0 lnocuo1 lnocuo21 _1d0g9qk4 lnocuo7""><a aria-label=""Limit results to Berrimah"" class=""_1wkzzau0 _1wkzzauf _1wkzzau0 _1wkzzauf _842p0a0 _842p0a2"" data-automation=""jobLocation"" href=""/jobs-in-retail-consumer-products/in-Berrimah-NT-0828?salarytype=annual&amp;salaryrange=160000-165000"" rel=""nofollow"" tabindex=""-1"" target=""_self"" title=""Limit results to Berrimah"">Berrimah</a>, <a aria-label=""Limit results to Darwin NT"" class=""_1wkzzau0 _1wkzzauf _1wkzzau0 _1wkzzauf _842p0a0 _842p0a2"" data-automation=""jobLocation"" href=""/jobs-in-retail-consumer-products/in-All-Darwin-NT?salarytype=annual&amp;salaryrange=160000-165000"" rel=""nofollow"" tabindex=""-1"" target=""_self"" title=""Limit results to Darwin NT"">Darwin NT</a></span></div>]",,Retail-consumer-products - None,08/02/2024
31,https://www.seek.com.au//job/73118951?type=standard&ref=search-standalone,retail consumer products,Management - Area/Multi-site,Area Manager (Shepparton),ALDI Stores Australia,-,160000.0,162500.0,165000.0,"Shepparton, Shepparton & Goulburn Valley VIC","As an ALDI Area Manager, you will be the driving force behind multiple store locations, shaping the future of retail and inspiring excellence.","[<div class=""_1wkzzau0 a1msqi6m""><span class=""_1wkzzau0 a1msqi4y lnocuo0 lnocuo1 lnocuo21 _1d0g9qk4 lnocuo7""><a aria-label=""Limit results to Shepparton"" class=""_1wkzzau0 _1wkzzauf _1wkzzau0 _1wkzzauf _842p0a0 _842p0a2"" data-automation=""jobLocation"" href=""/jobs-in-retail-consumer-products/in-Shepparton-VIC-3630?salarytype=annual&amp;salaryrange=160000-165000"" rel=""nofollow"" tabindex=""-1"" target=""_self"" title=""Limit results to Shepparton"">Shepparton</a>, <a aria-label=""Limit results to Shepparton &amp; Goulburn Valley VIC"" class=""_1wkzzau0 _1wkzzauf _1wkzzau0 _1wkzzauf _842p0a0 _842p0a2"" data-automation=""jobLocation"" href=""/jobs-in-retail-consumer-products/in-Shepparton-&amp;-Goulburn-Valley-VIC?salarytype=annual&amp;salaryrange=160000-165000"" rel=""nofollow"" tabindex=""-1"" target=""_self"" title=""Limit results to Shepparton &amp; Goulburn Valley VIC"">Shepparton &amp; Goulburn Valley VIC</a></span></div>]",2024-01-18,Retail-consumer-products - None,08/02/2024
32,https://www.seek.com.au//job/72960133?type=standout&ref=search-standalone,retail consumer products,Management - Area/Multi-site,Retail Operations Manager,Jones Retail Group,-,160000.0,162500.0,165000.0,Brisbane QLD,"Calling all supermarket Operations Manager's who are results-driven, think strategically and have a passion for retail. We’d like to hear from you!","[<div class=""_1wkzzau0 a1msqi6m""><span class=""_1wkzzau0 a1msqi4y lnocuo0 lnocuo1 lnocuo21 _1d0g9qk4 lnocuo7""><a aria-label=""Limit results to Cleveland"" class=""_1wkzzau0 _1wkzzauf _1wkzzau0 _1wkzzauf _842p0a0 _842p0a2"" data-automation=""jobLocation"" href=""/jobs-in-retail-consumer-products/in-Cleveland-QLD-4163?salarytype=annual&amp;salaryrange=160000-165000"" rel=""nofollow"" tabindex=""-1"" target=""_self"" title=""Limit results to Cleveland"">Cleveland</a>, <a aria-label=""Limit results to Brisbane QLD"" class=""_1wkzzau0 _1wkzzauf _1wkzzau0 _1wkzzauf _842p0a0 _842p0a2"" data-automation=""jobLocation"" href=""/jobs-in-retail-consumer-products/in-All-Brisbane-QLD?salarytype=annual&amp;salaryrange=160000-165000"" rel=""nofollow"" tabindex=""-1"" target=""_self"" title=""Limit results to Brisbane QLD"">Brisbane QLD</a></span></div>]",2024-01-12,Retail-consumer-products - None,08/02/2024
33,https://www.seek.com.au//job/73036864?type=standard&ref=search-standalone,retail consumer products,Management - Area/Multi-site,Retail Area Manager R3 A3 - Docklands Corp HO,Coles,-,160000.0,162500.0,165000.0,Melbourne VIC,We're looking for a Retail Area Manager with extensive retail experience who can lead with passion and pace in this multi-site management position.,"[<div class=""_1wkzzau0 a1msqi6m""><span class=""_1wkzzau0 a1msqi4y lnocuo0 lnocuo1 lnocuo21 _1d0g9qk4 lnocuo7""><a aria-label=""Limit results to Docklands"" class=""_1wkzzau0 _1wkzzauf _1wkzzau0 _1wkzzauf _842p0a0 _842p0a2"" data-automation=""jobLocation"" href=""/jobs-in-retail-consumer-products/in-Docklands-VIC-3008?salarytype=annual&amp;salaryrange=160000-165000"" rel=""nofollow"" tabindex=""-1"" target=""_self"" title=""Limit results to Docklands"">Docklands</a>, <a aria-label=""Limit results to Melbourne VIC"" class=""_1wkzzau0 _1wkzzauf _1wkzzau0 _1wkzzauf _842p0a0 _842p0a2"" data-automation=""jobLocation"" href=""/jobs-in-retail-consumer-products/in-All-Melbourne-VIC?salarytype=annual&amp;salaryrange=160000-165000"" rel=""nofollow"" tabindex=""-1"" target=""_self"" title=""Limit results to Melbourne VIC"">Melbourne VIC</a></span></div>]",2024-01-16,Retail-consumer-products - None,08/02/2024
34,https://www.seek.com.au//job/73015287?type=standout&ref=search-standalone,retail consumer products,Management - Area/Multi-site,Project Manager - Retail Site Expansion,,-,160000.0,162500.0,165000.0,Wollongong NSW,Project Management role within a dynamic and rapidly growing business,"[<div class=""_1wkzzau0 a1msqi6m""><span class=""_1wkzzau0 a1msqi4y lnocuo0 lnocuo1 lnocuo21 _1d0g9qk4 lnocuo7""><a aria-label=""Limit results to Wollongong"" class=""_1wkzzau0 _1wkzzauf _1wkzzau0 _1wkzzauf _842p0a0 _842p0a2"" data-automation=""jobLocation"" href=""/jobs-in-retail-consumer-products/in-Wollongong-NSW-2500?salarytype=annual&amp;salaryrange=160000-165000"" rel=""nofollow"" tabindex=""-1"" target=""_self"" title=""Limit results to Wollongong"">Wollongong</a>, <a aria-label=""Limit results to Wollongong, Illawarra &amp; South Coast NSW"" class=""_1wkzzau0 _1wkzzauf _1wkzzau0 _1wkzzauf _842p0a0 _842p0a2"" data-automation=""jobLocation"" href=""/jobs-in-retail-consumer-products/in-Wollongong,-Illawarra-&amp;-South-Coast-NSW?salarytype=annual&amp;salaryrange=160000-165000"" rel=""nofollow"" tabindex=""-1"" target=""_self"" title=""Limit results to Wollongong, Illawarra &amp; South Coast NSW"">Wollongong, Illawarra &amp; South Coast NSW</a></span></div>]",2024-01-15,Retail-consumer-products - None,08/02/2024
35,https://www.seek.com.au//job/73515671?type=standout&ref=search-standalone,retail consumer products,Other,Category Manager - Construction,Sharp & Carter Sales,-,160000.0,162500.0,165000.0,Melbourne VIC,"Expanding the Category Team due to success of the business, we are looking for someone who is a great relationship builder and looking for progression","[<div class=""_1wkzzau0 a1msqi6m""><span class=""_1wkzzau0 a1msqi4y lnocuo0 lnocuo1 lnocuo21 _1d0g9qk4 lnocuo7""><a aria-label=""Limit results to Melbourne VIC"" class=""_1wkzzau0 _1wkzzauf _1wkzzau0 _1wkzzauf _842p0a0 _842p0a2"" data-automation=""jobLocation"" href=""/jobs-in-retail-consumer-products/in-All-Melbourne-VIC?salarytype=annual&amp;salaryrange=160000-165000"" rel=""nofollow"" tabindex=""-1"" target=""_self"" title=""Limit results to Melbourne VIC"">Melbourne VIC</a></span></div>]",2024-02-05,Retail-consumer-products - None,08/02/2024
36,https://www.seek.com.au//job/73450009?type=standout&ref=search-standalone,retail consumer products,Planning,Business Planner - Retail,Spotlight Pty Ltd,"Permanent Full Time role, Hybrid with Profit Share",160000.0,162500.0,165000.0,Melbourne VIC,Rare opportunity to join the Spotlight Planning team in one of the biggest portfolios in Australian Retail.  Profit Share + Hybrid role + more!,"[<div class=""_1wkzzau0 a1msqi6m""><span class=""_1wkzzau0 a1msqi4y lnocuo0 lnocuo1 lnocuo21 _1d0g9qk4 lnocuo7""><a aria-label=""Limit results to South Melbourne"" class=""_1wkzzau0 _1wkzzauf _1wkzzau0 _1wkzzauf _842p0a0 _842p0a2"" data-automation=""jobLocation"" href=""/jobs-in-retail-consumer-products/in-South-Melbourne-VIC-3205?salarytype=annual&amp;salaryrange=160000-165000"" rel=""nofollow"" tabindex=""-1"" target=""_self"" title=""Limit results to South Melbourne"">South Melbourne</a>, <a aria-label=""Limit results to Melbourne VIC"" class=""_1wkzzau0 _1wkzzauf _1wkzzau0 _1wkzzauf _842p0a0 _842p0a2"" data-automation=""jobLocation"" href=""/jobs-in-retail-consumer-products/in-All-Melbourne-VIC?salarytype=annual&amp;salaryrange=160000-165000"" rel=""nofollow"" tabindex=""-1"" target=""_self"" title=""Limit results to Melbourne VIC"">Melbourne VIC</a></span></div>, <div class=""_1wkzzau0 a1msqi6m""><div aria-label=""Salary: Permanent Full Time role, Hybrid with Profit Share"" class=""_1wkzzau0""><span class=""_1wkzzau0 a1msqi4y lnocuo0 lnocuo1 lnocuo21 _1d0g9qk4 lnocuo7"" data-automation=""jobSalary""><span class=""_1wkzzau0 _16v7pfz1 a1msqi4y a1msqi0 a1msqir _16v7pfz3"" style=""--_16v7pfz2:2"">Permanent Full Time role, Hybrid with Profit Share</span></span></div></div>]",2024-02-01,Retail-consumer-products - None,08/02/2024
37,https://www.seek.com.au//job/73560648?type=standout&ref=search-standalone,retail consumer products,Other,Customer Value Manager,Endeavour Group,-,160000.0,162500.0,165000.0,Sydney NSW,You’ll effectively partner with the merchandise trading team to deliver value in relation to Pricing and Supplier agreements.,"[<div class=""_1wkzzau0 a1msqi6m""><span class=""_1wkzzau0 a1msqi4y lnocuo0 lnocuo1 lnocuo21 _1d0g9qk4 lnocuo7""><a aria-label=""Limit results to Surry Hills"" class=""_1wkzzau0 _1wkzzauf _1wkzzau0 _1wkzzauf _842p0a0 _842p0a2"" data-automation=""jobLocation"" href=""/jobs-in-retail-consumer-products/in-Surry-Hills-NSW-2010?salarytype=annual&amp;salaryrange=160000-165000"" rel=""nofollow"" tabindex=""-1"" target=""_self"" title=""Limit results to Surry Hills"">Surry Hills</a>, <a aria-label=""Limit results to Sydney NSW"" class=""_1wkzzau0 _1wkzzauf _1wkzzau0 _1wkzzauf _842p0a0 _842p0a2"" data-automation=""jobLocation"" href=""/jobs-in-retail-consumer-products/in-All-Sydney-NSW?salarytype=annual&amp;salaryrange=160000-165000"" rel=""nofollow"" tabindex=""-1"" target=""_self"" title=""Limit results to Sydney NSW"">Sydney NSW</a></span></div>]",2024-02-06,Retail-consumer-products - None,08/02/2024
38,https://www.seek.com.au//job/73480988?type=standout&ref=search-standalone,retail consumer products,Buying,Buyer,Best & Less,-,160000.0,162500.0,165000.0,Sydney NSW,"Based at our National Support Office in Rhodes, we are seeking a strong Buyer ideally with experience in product development from scratch.","[<div class=""_1wkzzau0 a1msqi6m""><span class=""_1wkzzau0 a1msqi4y lnocuo0 lnocuo1 lnocuo21 _1d0g9qk4 lnocuo7""><a aria-label=""Limit results to Rhodes"" class=""_1wkzzau0 _1wkzzauf _1wkzzau0 _1wkzzauf _842p0a0 _842p0a2"" data-automation=""jobLocation"" href=""/jobs-in-retail-consumer-products/in-Rhodes-NSW-2138?salarytype=annual&amp;salaryrange=160000-165000"" rel=""nofollow"" tabindex=""-1"" target=""_self"" title=""Limit results to Rhodes"">Rhodes</a>, <a aria-label=""Limit results to Sydney NSW"" class=""_1wkzzau0 _1wkzzauf _1wkzzau0 _1wkzzauf _842p0a0 _842p0a2"" data-automation=""jobLocation"" href=""/jobs-in-retail-consumer-products/in-All-Sydney-NSW?salarytype=annual&amp;salaryrange=160000-165000"" rel=""nofollow"" tabindex=""-1"" target=""_self"" title=""Limit results to Sydney NSW"">Sydney NSW</a></span></div>]",2024-02-02,Retail-consumer-products - None,08/02/2024
39,https://www.seek.com.au//job/73542360?type=standout&ref=search-standalone,retail consumer products,Management - Store,Branch Manager,Motion Asia Pacific,-,160000.0,162500.0,165000.0,"Kalgoorlie, Kalgoorlie, Goldfields & Esperance WA","Exciting opportunity to showcase your leadership experience to develop, motivate and inspire your team! Get rewarded for your efforts!","[<div class=""_1wkzzau0 a1msqi6m""><span class=""_1wkzzau0 a1msqi4y lnocuo0 lnocuo1 lnocuo21 _1d0g9qk4 lnocuo7""><a aria-label=""Limit results to Kalgoorlie"" class=""_1wkzzau0 _1wkzzauf _1wkzzau0 _1wkzzauf _842p0a0 _842p0a2"" data-automation=""jobLocation"" href=""/jobs-in-retail-consumer-products/in-Kalgoorlie-WA-6430?salarytype=annual&amp;salaryrange=160000-165000"" rel=""nofollow"" tabindex=""-1"" target=""_self"" title=""Limit results to Kalgoorlie"">Kalgoorlie</a>, <a aria-label=""Limit results to Kalgoorlie, Goldfields &amp; Esperance WA"" class=""_1wkzzau0 _1wkzzauf _1wkzzau0 _1wkzzauf _842p0a0 _842p0a2"" data-automation=""jobLocation"" href=""/jobs-in-retail-consumer-products/in-Kalgoorlie,-Goldfields-&amp;-Esperance-WA?salarytype=annual&amp;salaryrange=160000-165000"" rel=""nofollow"" tabindex=""-1"" target=""_self"" title=""Limit results to Kalgoorlie, Goldfields &amp; Esperance WA"">Kalgoorlie, Goldfields &amp; Esperance WA</a></span></div>]",2024-02-06,Retail-consumer-products - None,08/02/2024
40,https://www.seek.com.au//job/73571743?type=standout&ref=search-standalone,retail consumer products,Planning,Planner - Portmans,Portmans,-,160000.0,162500.0,165000.0,Melbourne VIC,If you’re a Planner looking for a new challenge - apply now for this unique opportunity with Portmans!,"[<div class=""_1wkzzau0 a1msqi6m""><span class=""_1wkzzau0 a1msqi4y lnocuo0 lnocuo1 lnocuo21 _1d0g9qk4 lnocuo7""><a aria-label=""Limit results to Melbourne VIC"" class=""_1wkzzau0 _1wkzzauf _1wkzzau0 _1wkzzauf _842p0a0 _842p0a2"" data-automation=""jobLocation"" href=""/jobs-in-retail-consumer-products/in-All-Melbourne-VIC?salarytype=annual&amp;salaryrange=160000-165000"" rel=""nofollow"" tabindex=""-1"" target=""_self"" title=""Limit results to Melbourne VIC"">Melbourne VIC</a></span></div>]",2024-02-07,Retail-consumer-products - None,08/02/2024
41,https://www.seek.com.au//job/73443067?type=standout&ref=search-standalone,retail consumer products,Planning,Product Owner - Planning and Merchandise,Kmart,-,160000.0,162500.0,165000.0,Melbourne VIC,An exciting new opportunity for a Product Owner - Planning & Merchandise to join Kmart & Target!,"[<div class=""_1wkzzau0 a1msqi6m""><span class=""_1wkzzau0 a1msqi4y lnocuo0 lnocuo1 lnocuo21 _1d0g9qk4 lnocuo7""><a aria-label=""Limit results to Mulgrave"" class=""_1wkzzau0 _1wkzzauf _1wkzzau0 _1wkzzauf _842p0a0 _842p0a2"" data-automation=""jobLocation"" href=""/jobs-in-retail-consumer-products/in-Mulgrave-VIC-3170?salarytype=annual&amp;salaryrange=160000-165000"" rel=""nofollow"" tabindex=""-1"" target=""_self"" title=""Limit results to Mulgrave"">Mulgrave</a>, <a aria-label=""Limit results to Melbourne VIC"" class=""_1wkzzau0 _1wkzzauf _1wkzzau0 _1wkzzauf _842p0a0 _842p0a2"" data-automation=""jobLocation"" href=""/jobs-in-retail-consumer-products/in-All-Melbourne-VIC?salarytype=annual&amp;salaryrange=160000-165000"" rel=""nofollow"" tabindex=""-1"" target=""_self"" title=""Limit results to Melbourne VIC"">Melbourne VIC</a></span></div>]",2024-02-01,Retail-consumer-products - None,08/02/2024
42,https://www.seek.com.au//job/73379658?type=standout&ref=search-standalone,retail consumer products,Other,Commercial Manager,Flybuys,Competitive salary + awesome benefits!,160000.0,162500.0,165000.0,Melbourne VIC,Be responsible for managing and delivering on all contractual partnership elements. Join our Partner Growth and Success team!,"[<div class=""_1wkzzau0 a1msqi6m""><span class=""_1wkzzau0 a1msqi4y lnocuo0 lnocuo1 lnocuo21 _1d0g9qk4 lnocuo7""><a aria-label=""Limit results to Melbourne VIC"" class=""_1wkzzau0 _1wkzzauf _1wkzzau0 _1wkzzauf _842p0a0 _842p0a2"" data-automation=""jobLocation"" href=""/jobs-in-retail-consumer-products/in-All-Melbourne-VIC?salarytype=annual&amp;salaryrange=160000-165000"" rel=""nofollow"" tabindex=""-1"" target=""_self"" title=""Limit results to Melbourne VIC"">Melbourne VIC</a></span></div>, <div class=""_1wkzzau0 a1msqi6m""><div aria-label=""Salary: Competitive salary + awesome benefits!"" class=""_1wkzzau0""><span class=""_1wkzzau0 a1msqi4y lnocuo0 lnocuo1 lnocuo21 _1d0g9qk4 lnocuo7"" data-automation=""jobSalary""><span class=""_1wkzzau0 _16v7pfz1 a1msqi4y a1msqi0 a1msqir _16v7pfz3"" style=""--_16v7pfz2:2"">Competitive salary + awesome benefits!</span></span></div></div>]",2024-01-30,Retail-consumer-products - None,08/02/2024
