,link,classification,category,title,company,salary,min_salary,average_salary,max_salary,location,description,entireDiv,date_posted,Category,Date
44,https://www.seek.com.au//job/73002654?type=standard&ref=search-standalone,design architecture,Other,Kitchen/Wardrobe Designer,Kinsman,-,190000.0,192500.0,195000.0,"Geelong, South West Coast VIC","An exciting, unique, and once in a lifetime opportunity for ambitious and success driven sales professionals with a no limits OTE","[<div class=""_1wkzzau0 a1msqi6m""><span class=""_1wkzzau0 a1msqi4y lnocuo0 lnocuo1 lnocuo21 _1d0g9qk4 lnocuo7""><a aria-label=""Limit results to Geelong"" class=""_1wkzzau0 _1wkzzauf _1wkzzau0 _1wkzzauf _842p0a0 _842p0a2"" data-automation=""jobLocation"" href=""/jobs-in-design-architecture/in-Geelong-VIC-3220?salarytype=annual&amp;salaryrange=190000-195000"" rel=""nofollow"" tabindex=""-1"" target=""_self"" title=""Limit results to Geelong"">Geelong</a>, <a aria-label=""Limit results to South West Coast VIC"" class=""_1wkzzau0 _1wkzzauf _1wkzzau0 _1wkzzauf _842p0a0 _842p0a2"" data-automation=""jobLocation"" href=""/jobs-in-design-architecture/in-South-West-Coast-VIC?salarytype=annual&amp;salaryrange=190000-195000"" rel=""nofollow"" tabindex=""-1"" target=""_self"" title=""Limit results to South West Coast VIC"">South West Coast VIC</a></span></div>]",2024-01-15,Design-architecture - None,08/02/2024
45,https://www.seek.com.au//job/73099765?type=standout&ref=search-standalone,design architecture,Architecture,Design Coordinator / Manager,Infrastructure People,-,190000.0,192500.0,195000.0,Sydney NSW,IP are actively seeking a Design Coordinator/ Manager to join a leading local civil construction company of whom are experiencing remarkable growth.,"[<div class=""_1wkzzau0 a1msqi6m""><span class=""_1wkzzau0 a1msqi4y lnocuo0 lnocuo1 lnocuo21 _1d0g9qk4 lnocuo7""><a aria-label=""Limit results to Sydney NSW"" class=""_1wkzzau0 _1wkzzauf _1wkzzau0 _1wkzzauf _842p0a0 _842p0a2"" data-automation=""jobLocation"" href=""/jobs-in-design-architecture/in-All-Sydney-NSW?salarytype=annual&amp;salaryrange=190000-195000"" rel=""nofollow"" tabindex=""-1"" target=""_self"" title=""Limit results to Sydney NSW"">Sydney NSW</a></span></div>]",2024-01-18,Design-architecture - None,08/02/2024
46,https://www.seek.com.au//job/73554914?type=standout&ref=search-standalone,design architecture,Landscape Architecture,Landscape Architect - Oran Park,APG Workforce,-,190000.0,192500.0,195000.0,Sydney NSW,APG Workforce are currently seeking a Landscape Architect for a local Camden council based in Oran Park.,"[<div class=""_1wkzzau0 a1msqi6m""><span class=""_1wkzzau0 a1msqi4y lnocuo0 lnocuo1 lnocuo21 _1d0g9qk4 lnocuo7""><a aria-label=""Limit results to Oran Park"" class=""_1wkzzau0 _1wkzzauf _1wkzzau0 _1wkzzauf _842p0a0 _842p0a2"" data-automation=""jobLocation"" href=""/jobs-in-design-architecture/in-Oran-Park-NSW-2570?salarytype=annual&amp;salaryrange=190000-195000"" rel=""nofollow"" tabindex=""-1"" target=""_self"" title=""Limit results to Oran Park"">Oran Park</a>, <a aria-label=""Limit results to Sydney NSW"" class=""_1wkzzau0 _1wkzzauf _1wkzzau0 _1wkzzauf _842p0a0 _842p0a2"" data-automation=""jobLocation"" href=""/jobs-in-design-architecture/in-All-Sydney-NSW?salarytype=annual&amp;salaryrange=190000-195000"" rel=""nofollow"" tabindex=""-1"" target=""_self"" title=""Limit results to Sydney NSW"">Sydney NSW</a></span></div>]",2024-02-06,Design-architecture - None,08/02/2024
47,https://www.seek.com.au//job/73166831?type=standout&ref=search-standalone,design architecture,Urban Design & Planning,City Strategy and Design Manager,Campbelltown City Council,-,190000.0,192500.0,195000.0,Sydney NSW,This is an exciting opportunity to have a real impact on the community of Campbelltown and the experience of its residents and visitors.,"[<div class=""_1wkzzau0 a1msqi6m""><span class=""_1wkzzau0 a1msqi4y lnocuo0 lnocuo1 lnocuo21 _1d0g9qk4 lnocuo7""><a aria-label=""Limit results to Campbelltown"" class=""_1wkzzau0 _1wkzzauf _1wkzzau0 _1wkzzauf _842p0a0 _842p0a2"" data-automation=""jobLocation"" href=""/jobs-in-design-architecture/in-Campbelltown-NSW-2560?salarytype=annual&amp;salaryrange=190000-195000"" rel=""nofollow"" tabindex=""-1"" target=""_self"" title=""Limit results to Campbelltown"">Campbelltown</a>, <a aria-label=""Limit results to Sydney NSW"" class=""_1wkzzau0 _1wkzzauf _1wkzzau0 _1wkzzauf _842p0a0 _842p0a2"" data-automation=""jobLocation"" href=""/jobs-in-design-architecture/in-All-Sydney-NSW?salarytype=annual&amp;salaryrange=190000-195000"" rel=""nofollow"" tabindex=""-1"" target=""_self"" title=""Limit results to Sydney NSW"">Sydney NSW</a></span></div>]",2024-01-19,Design-architecture - None,08/02/2024
48,https://www.seek.com.au//job/73032144?type=standard&ref=search-standalone,design architecture,Other,Kitchen/Wardrobe Designer,Kinsman,-,190000.0,192500.0,195000.0,Gold Coast QLD,"An exciting, unique, and once in a lifetime opportunity for ambitious and success driven sales professionals with a no limits OTE","[<div class=""_1wkzzau0 a1msqi6m""><span class=""_1wkzzau0 a1msqi4y lnocuo0 lnocuo1 lnocuo21 _1d0g9qk4 lnocuo7""><a aria-label=""Limit results to Southport"" class=""_1wkzzau0 _1wkzzauf _1wkzzau0 _1wkzzauf _842p0a0 _842p0a2"" data-automation=""jobLocation"" href=""/jobs-in-design-architecture/in-Southport-QLD-4215?salarytype=annual&amp;salaryrange=190000-195000"" rel=""nofollow"" tabindex=""-1"" target=""_self"" title=""Limit results to Southport"">Southport</a>, <a aria-label=""Limit results to Gold Coast QLD"" class=""_1wkzzau0 _1wkzzauf _1wkzzau0 _1wkzzauf _842p0a0 _842p0a2"" data-automation=""jobLocation"" href=""/jobs-in-design-architecture/in-All-Gold-Coast-QLD?salarytype=annual&amp;salaryrange=190000-195000"" rel=""nofollow"" tabindex=""-1"" target=""_self"" title=""Limit results to Gold Coast QLD"">Gold Coast QLD</a></span></div>]",2024-01-16,Design-architecture - None,08/02/2024
49,https://www.seek.com.au//job/73377561?type=standard&ref=search-standalone,design architecture,Interior Design,Experienced kitchen designers and sales,,-,190000.0,192500.0,195000.0,Sydney NSW,3 years experienced kitchen designers and sales wanted. Attractive commission + bonus. Unlimited earning.,"[<div class=""_1wkzzau0 a1msqi6m""><span class=""_1wkzzau0 a1msqi4y lnocuo0 lnocuo1 lnocuo21 _1d0g9qk4 lnocuo7""><a aria-label=""Limit results to Sydney NSW"" class=""_1wkzzau0 _1wkzzauf _1wkzzau0 _1wkzzauf _842p0a0 _842p0a2"" data-automation=""jobLocation"" href=""/jobs-in-design-architecture/in-All-Sydney-NSW?salarytype=annual&amp;salaryrange=190000-195000"" rel=""nofollow"" tabindex=""-1"" target=""_self"" title=""Limit results to Sydney NSW"">Sydney NSW</a></span></div>]",2024-01-30,Design-architecture - None,08/02/2024
50,https://www.seek.com.au//job/72879691?type=standout&ref=search-standalone,design architecture,Industrial Design,Distribution Centre Design Manager | Automation | Hybrid | Sydney,Woolworths Group,-,190000.0,192500.0,195000.0,Sydney NSW,Be at the forefront of initiating innovation & change across the Supply Chain landscape,"[<div class=""_1wkzzau0 a1msqi6m""><span class=""_1wkzzau0 a1msqi4y lnocuo0 lnocuo1 lnocuo21 _1d0g9qk4 lnocuo7""><a aria-label=""Limit results to Norwest"" class=""_1wkzzau0 _1wkzzauf _1wkzzau0 _1wkzzauf _842p0a0 _842p0a2"" data-automation=""jobLocation"" href=""/jobs-in-design-architecture/in-Norwest-NSW-2153?salarytype=annual&amp;salaryrange=190000-195000"" rel=""nofollow"" tabindex=""-1"" target=""_self"" title=""Limit results to Norwest"">Norwest</a>, <a aria-label=""Limit results to Sydney NSW"" class=""_1wkzzau0 _1wkzzauf _1wkzzau0 _1wkzzauf _842p0a0 _842p0a2"" data-automation=""jobLocation"" href=""/jobs-in-design-architecture/in-All-Sydney-NSW?salarytype=annual&amp;salaryrange=190000-195000"" rel=""nofollow"" tabindex=""-1"" target=""_self"" title=""Limit results to Sydney NSW"">Sydney NSW</a></span></div>]",2024-01-10,Design-architecture - None,08/02/2024
51,https://www.seek.com.au//job/73346990?type=standard&ref=search-standalone,design architecture,Landscape Architecture,Landscape Architect,Public Sector People,$55 - $65ph + Super,99000.0,108000.0,117000.0,Sydney NSW,"Currently inviting applications for a Development Assessment Planner for a Local Council, located North of Sydney.","[<div class=""_1wkzzau0 a1msqi6m""><span class=""_1wkzzau0 a1msqi4y lnocuo0 lnocuo1 lnocuo21 _1d0g9qk4 lnocuo7""><a aria-label=""Limit results to Sydney NSW"" class=""_1wkzzau0 _1wkzzauf _1wkzzau0 _1wkzzauf _842p0a0 _842p0a2"" data-automation=""jobLocation"" href=""/jobs-in-design-architecture/in-All-Sydney-NSW?salarytype=annual&amp;salaryrange=190000-195000"" rel=""nofollow"" tabindex=""-1"" target=""_self"" title=""Limit results to Sydney NSW"">Sydney NSW</a></span></div>, <div class=""_1wkzzau0 a1msqi6m""><div aria-label=""Salary: $55 - $65ph + Super"" class=""_1wkzzau0""><span class=""_1wkzzau0 a1msqi4y lnocuo0 lnocuo1 lnocuo21 _1d0g9qk4 lnocuo7"" data-automation=""jobSalary""><span class=""_1wkzzau0 _16v7pfz1 a1msqi4y a1msqi0 a1msqir _16v7pfz3"" style=""--_16v7pfz2:2"">$55 - $65ph + Super</span></span></div></div>]",2024-01-28,Design-architecture - None,08/02/2024
52,https://www.seek.com.au//job/73276823?type=standout&ref=search-standalone,design architecture,Architecture,Architectural Studio Lead - Industrial/Commercial,Redpath Partners Pty Ltd,-,190000.0,192500.0,195000.0,Melbourne VIC,"Due to an increasing pipeline of national client work, this specialist Sydney Boutique is seeking a Studio Lead to open their Melbourne Business.","[<div class=""_1wkzzau0 a1msqi6m""><span class=""_1wkzzau0 a1msqi4y lnocuo0 lnocuo1 lnocuo21 _1d0g9qk4 lnocuo7""><a aria-label=""Limit results to Melbourne VIC"" class=""_1wkzzau0 _1wkzzauf _1wkzzau0 _1wkzzauf _842p0a0 _842p0a2"" data-automation=""jobLocation"" href=""/jobs-in-design-architecture/in-All-Melbourne-VIC?salarytype=annual&amp;salaryrange=190000-195000"" rel=""nofollow"" tabindex=""-1"" target=""_self"" title=""Limit results to Melbourne VIC"">Melbourne VIC</a></span></div>]",2024-01-24,Design-architecture - None,08/02/2024
53,https://www.seek.com.au//job/73048093?type=standout&ref=search-standalone,design architecture,Architectural Drafting,Architectural Draftsman - Revit/AutoCAD,Concise Recruitment,-,190000.0,192500.0,195000.0,Melbourne VIC,Specialist design and construct engineering company is seeking an Architectural Draftsman working on infrastructure projects.,"[<div class=""_1wkzzau0 a1msqi6m""><span class=""_1wkzzau0 a1msqi4y lnocuo0 lnocuo1 lnocuo21 _1d0g9qk4 lnocuo7""><a aria-label=""Limit results to Melbourne VIC"" class=""_1wkzzau0 _1wkzzauf _1wkzzau0 _1wkzzauf _842p0a0 _842p0a2"" data-automation=""jobLocation"" href=""/jobs-in-design-architecture/in-All-Melbourne-VIC?salarytype=annual&amp;salaryrange=190000-195000"" rel=""nofollow"" tabindex=""-1"" target=""_self"" title=""Limit results to Melbourne VIC"">Melbourne VIC</a></span></div>]",2024-01-16,Design-architecture - None,08/02/2024
54,https://www.seek.com.au//job/73099728?type=standout&ref=search-standalone,design architecture,Architecture,Access Consultant,Bureau Veritas Australia Pty Ltd,"$100,000 – $150,000 per year",100000.0,125000.0,150000.0,Melbourne VIC,Leave Your Mark that is unmatched in the industry.,"[<div class=""_1wkzzau0 a1msqi6m""><span class=""_1wkzzau0 a1msqi4y lnocuo0 lnocuo1 lnocuo21 _1d0g9qk4 lnocuo7""><a aria-label=""Limit results to Melbourne VIC"" class=""_1wkzzau0 _1wkzzauf _1wkzzau0 _1wkzzauf _842p0a0 _842p0a2"" data-automation=""jobLocation"" href=""/jobs-in-design-architecture/in-All-Melbourne-VIC?salarytype=annual&amp;salaryrange=190000-195000"" rel=""nofollow"" tabindex=""-1"" target=""_self"" title=""Limit results to Melbourne VIC"">Melbourne VIC</a></span></div>, <div class=""_1wkzzau0 a1msqi6m""><div aria-label=""Salary: $100,000 – $150,000 per year"" class=""_1wkzzau0""><span class=""_1wkzzau0 a1msqi4y lnocuo0 lnocuo1 lnocuo21 _1d0g9qk4 lnocuo7"" data-automation=""jobSalary""><span class=""_1wkzzau0 _16v7pfz1 a1msqi4y a1msqi0 a1msqir _16v7pfz3"" style=""--_16v7pfz2:2"">$100,000 – $150,000 per year</span></span></div></div>]",2024-01-18,Design-architecture - None,08/02/2024
55,https://www.seek.com.au//job/73164916?type=standard&ref=search-standalone,design architecture,Architecture,Senior Architect - Technical Leadership,Bespoke Careers,"$150,000 – $180,000 + Super",150000.0,165000.0,180000.0,Sydney NSW,Senior architect - strong delivery skills,"[<div class=""_1wkzzau0 a1msqi6m""><span class=""_1wkzzau0 a1msqi4y lnocuo0 lnocuo1 lnocuo21 _1d0g9qk4 lnocuo7""><a aria-label=""Limit results to Sydney NSW"" class=""_1wkzzau0 _1wkzzauf _1wkzzau0 _1wkzzauf _842p0a0 _842p0a2"" data-automation=""jobLocation"" href=""/jobs-in-design-architecture/in-All-Sydney-NSW?salarytype=annual&amp;salaryrange=190000-195000"" rel=""nofollow"" tabindex=""-1"" target=""_self"" title=""Limit results to Sydney NSW"">Sydney NSW</a></span></div>, <div class=""_1wkzzau0 a1msqi6m""><div aria-label=""Salary: $150,000 – $180,000 + Super"" class=""_1wkzzau0""><span class=""_1wkzzau0 a1msqi4y lnocuo0 lnocuo1 lnocuo21 _1d0g9qk4 lnocuo7"" data-automation=""jobSalary""><span class=""_1wkzzau0 _16v7pfz1 a1msqi4y a1msqi0 a1msqir _16v7pfz3"" style=""--_16v7pfz2:2"">$150,000 – $180,000 + Super</span></span></div></div>]",2024-01-19,Design-architecture - None,08/02/2024
56,https://www.seek.com.au//job/73541566?type=standout&ref=search-standalone,design architecture,Web & Interaction Design,Design Manager | Design Systems,Just Digital People,-,190000.0,192500.0,195000.0,Brisbane QLD,"Leading a team of 6-7 designers, you will transform the design systems and impliment new tools & ways of working to this impactful business in QLD!","[<div class=""_1wkzzau0 a1msqi6m""><span class=""_1wkzzau0 a1msqi4y lnocuo0 lnocuo1 lnocuo21 _1d0g9qk4 lnocuo7""><a aria-label=""Limit results to Brisbane QLD"" class=""_1wkzzau0 _1wkzzauf _1wkzzau0 _1wkzzauf _842p0a0 _842p0a2"" data-automation=""jobLocation"" href=""/jobs-in-design-architecture/in-All-Brisbane-QLD?salarytype=annual&amp;salaryrange=190000-195000"" rel=""nofollow"" tabindex=""-1"" target=""_self"" title=""Limit results to Brisbane QLD"">Brisbane QLD</a></span></div>]",2024-02-06,Design-architecture - None,08/02/2024
57,https://www.seek.com.au//job/73032155?type=standard&ref=search-standalone,design architecture,Other,Kitchen/Wardrobe Designer,Kinsman,-,190000.0,192500.0,195000.0,Brisbane QLD,"An exciting, unique, and once in a lifetime opportunity for ambitious and success driven sales professionals with a no limits OTE","[<div class=""_1wkzzau0 a1msqi6m""><span class=""_1wkzzau0 a1msqi4y lnocuo0 lnocuo1 lnocuo21 _1d0g9qk4 lnocuo7""><a aria-label=""Limit results to Mount Gravatt"" class=""_1wkzzau0 _1wkzzauf _1wkzzau0 _1wkzzauf _842p0a0 _842p0a2"" data-automation=""jobLocation"" href=""/jobs-in-design-architecture/in-Mount-Gravatt-QLD-4122?salarytype=annual&amp;salaryrange=190000-195000"" rel=""nofollow"" tabindex=""-1"" target=""_self"" title=""Limit results to Mount Gravatt"">Mount Gravatt</a>, <a aria-label=""Limit results to Brisbane QLD"" class=""_1wkzzau0 _1wkzzauf _1wkzzau0 _1wkzzauf _842p0a0 _842p0a2"" data-automation=""jobLocation"" href=""/jobs-in-design-architecture/in-All-Brisbane-QLD?salarytype=annual&amp;salaryrange=190000-195000"" rel=""nofollow"" tabindex=""-1"" target=""_self"" title=""Limit results to Brisbane QLD"">Brisbane QLD</a></span></div>]",2024-01-16,Design-architecture - None,08/02/2024
58,https://www.seek.com.au//job/73410247?type=standout&ref=search-standalone,design architecture,Interior Design,Workplace Strategist - Elevate Strategy Lead,Concept Commercial Interiors,-,190000.0,192500.0,195000.0,Melbourne VIC,Flexible career building opportunity in a collaborative environment for a Senior Interior Designer passionate about workplace design and strategy.,"[<div class=""_1wkzzau0 a1msqi6m""><span class=""_1wkzzau0 a1msqi4y lnocuo0 lnocuo1 lnocuo21 _1d0g9qk4 lnocuo7""><a aria-label=""Limit results to Melbourne VIC"" class=""_1wkzzau0 _1wkzzauf _1wkzzau0 _1wkzzauf _842p0a0 _842p0a2"" data-automation=""jobLocation"" href=""/jobs-in-design-architecture/in-All-Melbourne-VIC?salarytype=annual&amp;salaryrange=190000-195000"" rel=""nofollow"" tabindex=""-1"" target=""_self"" title=""Limit results to Melbourne VIC"">Melbourne VIC</a></span></div>]",2024-01-31,Design-architecture - None,08/02/2024
59,https://www.seek.com.au//job/73447323?type=standout&ref=search-standalone,design architecture,Fashion & Textile Design,"AXL + CO by CONNOR BRAND DESIGNER, SYDNEY",CONNOR CLOTHING,-,190000.0,192500.0,195000.0,Sydney NSW,AXL + CO by Connor is a new fashion & value brand and we are looking for an experienced and talented Brand Designer to join the team!,"[<div class=""_1wkzzau0 a1msqi6m""><span class=""_1wkzzau0 a1msqi4y lnocuo0 lnocuo1 lnocuo21 _1d0g9qk4 lnocuo7""><a aria-label=""Limit results to Waterloo"" class=""_1wkzzau0 _1wkzzauf _1wkzzau0 _1wkzzauf _842p0a0 _842p0a2"" data-automation=""jobLocation"" href=""/jobs-in-design-architecture/in-Waterloo-NSW-2017?salarytype=annual&amp;salaryrange=190000-195000"" rel=""nofollow"" tabindex=""-1"" target=""_self"" title=""Limit results to Waterloo"">Waterloo</a>, <a aria-label=""Limit results to Sydney NSW"" class=""_1wkzzau0 _1wkzzauf _1wkzzau0 _1wkzzauf _842p0a0 _842p0a2"" data-automation=""jobLocation"" href=""/jobs-in-design-architecture/in-All-Sydney-NSW?salarytype=annual&amp;salaryrange=190000-195000"" rel=""nofollow"" tabindex=""-1"" target=""_self"" title=""Limit results to Sydney NSW"">Sydney NSW</a></span></div>]",2024-02-01,Design-architecture - None,08/02/2024
60,https://www.seek.com.au//job/73168574?type=standout&ref=search-standalone,design architecture,Urban Design & Planning,Principal Planning Officer,Karlka Recruiting Group,$75.00 per hour + super,135000.0,165000.0,195000.0,Sydney NSW,Contract until 31/03/2024 | NSW Location | State Government Agency | Full time position,"[<div class=""_1wkzzau0 a1msqi6m""><span class=""_1wkzzau0 a1msqi4y lnocuo0 lnocuo1 lnocuo21 _1d0g9qk4 lnocuo7""><a aria-label=""Limit results to Parramatta"" class=""_1wkzzau0 _1wkzzauf _1wkzzau0 _1wkzzauf _842p0a0 _842p0a2"" data-automation=""jobLocation"" href=""/jobs-in-design-architecture/in-Parramatta-NSW-2150?salarytype=annual&amp;salaryrange=190000-195000"" rel=""nofollow"" tabindex=""-1"" target=""_self"" title=""Limit results to Parramatta"">Parramatta</a>, <a aria-label=""Limit results to Sydney NSW"" class=""_1wkzzau0 _1wkzzauf _1wkzzau0 _1wkzzauf _842p0a0 _842p0a2"" data-automation=""jobLocation"" href=""/jobs-in-design-architecture/in-All-Sydney-NSW?salarytype=annual&amp;salaryrange=190000-195000"" rel=""nofollow"" tabindex=""-1"" target=""_self"" title=""Limit results to Sydney NSW"">Sydney NSW</a></span></div>, <div class=""_1wkzzau0 a1msqi6m""><div aria-label=""Salary: $75.00 per hour + super"" class=""_1wkzzau0""><span class=""_1wkzzau0 a1msqi4y lnocuo0 lnocuo1 lnocuo21 _1d0g9qk4 lnocuo7"" data-automation=""jobSalary""><span class=""_1wkzzau0 _16v7pfz1 a1msqi4y a1msqi0 a1msqir _16v7pfz3"" style=""--_16v7pfz2:2"">$75.00 per hour + super</span></span></div></div>]",2024-01-19,Design-architecture - None,08/02/2024
61,https://www.seek.com.au//job/73002686?type=standard&ref=search-standalone,design architecture,Other,Kitchen/Wardrobe Designer,Kinsman,-,190000.0,192500.0,195000.0,Melbourne VIC,"An exciting, unique, and once in a lifetime opportunity for ambitious and success driven sales professionals with a no limits OTE","[<div class=""_1wkzzau0 a1msqi6m""><span class=""_1wkzzau0 a1msqi4y lnocuo0 lnocuo1 lnocuo21 _1d0g9qk4 lnocuo7""><a aria-label=""Limit results to Essendon"" class=""_1wkzzau0 _1wkzzauf _1wkzzau0 _1wkzzauf _842p0a0 _842p0a2"" data-automation=""jobLocation"" href=""/jobs-in-design-architecture/in-Essendon-VIC-3040?salarytype=annual&amp;salaryrange=190000-195000"" rel=""nofollow"" tabindex=""-1"" target=""_self"" title=""Limit results to Essendon"">Essendon</a>, <a aria-label=""Limit results to Melbourne VIC"" class=""_1wkzzau0 _1wkzzauf _1wkzzau0 _1wkzzauf _842p0a0 _842p0a2"" data-automation=""jobLocation"" href=""/jobs-in-design-architecture/in-All-Melbourne-VIC?salarytype=annual&amp;salaryrange=190000-195000"" rel=""nofollow"" tabindex=""-1"" target=""_self"" title=""Limit results to Melbourne VIC"">Melbourne VIC</a></span></div>]",2024-01-15,Design-architecture - None,08/02/2024
62,https://www.seek.com.au//job/73002723?type=standard&ref=search-standalone,design architecture,Other,Kitchen/Wardrobe Designer,Kinsman,-,190000.0,192500.0,195000.0,Melbourne VIC,"An exciting, unique, and once in a lifetime opportunity for ambitious and success driven sales professionals with a no limits OTE","[<div class=""_1wkzzau0 a1msqi6m""><span class=""_1wkzzau0 a1msqi4y lnocuo0 lnocuo1 lnocuo21 _1d0g9qk4 lnocuo7""><a aria-label=""Limit results to Nunawading"" class=""_1wkzzau0 _1wkzzauf _1wkzzau0 _1wkzzauf _842p0a0 _842p0a2"" data-automation=""jobLocation"" href=""/jobs-in-design-architecture/in-Nunawading-VIC-3131?salarytype=annual&amp;salaryrange=190000-195000"" rel=""nofollow"" tabindex=""-1"" target=""_self"" title=""Limit results to Nunawading"">Nunawading</a>, <a aria-label=""Limit results to Melbourne VIC"" class=""_1wkzzau0 _1wkzzauf _1wkzzau0 _1wkzzauf _842p0a0 _842p0a2"" data-automation=""jobLocation"" href=""/jobs-in-design-architecture/in-All-Melbourne-VIC?salarytype=annual&amp;salaryrange=190000-195000"" rel=""nofollow"" tabindex=""-1"" target=""_self"" title=""Limit results to Melbourne VIC"">Melbourne VIC</a></span></div>]",2024-01-15,Design-architecture - None,08/02/2024
63,https://www.seek.com.au//job/73152520?type=standout&ref=search-standalone,design architecture,Architecture,Senior Specification Consultant/Architect,SCLspec Pty Ltd,-,190000.0,192500.0,195000.0,Melbourne VIC,You will be preparing architectural specifications for major projects across APAC & the Middle East for top architectural practices.,"[<div class=""_1wkzzau0 a1msqi6m""><span class=""_1wkzzau0 a1msqi4y lnocuo0 lnocuo1 lnocuo21 _1d0g9qk4 lnocuo7""><a aria-label=""Limit results to Melbourne VIC"" class=""_1wkzzau0 _1wkzzauf _1wkzzau0 _1wkzzauf _842p0a0 _842p0a2"" data-automation=""jobLocation"" href=""/jobs-in-design-architecture/in-All-Melbourne-VIC?salarytype=annual&amp;salaryrange=190000-195000"" rel=""nofollow"" tabindex=""-1"" target=""_self"" title=""Limit results to Melbourne VIC"">Melbourne VIC</a></span></div>]",2024-01-19,Design-architecture - None,08/02/2024
64,https://www.seek.com.au//job/73576386?type=standout&ref=search-standalone,design architecture,Web & Interaction Design,Service Designer - User-Centred - Journey Maps - Federal Government,HiTech Personnel,Competitive Hourly Rates!,190000.0,192500.0,195000.0,Melbourne VIC,Service Designer - User Journey - Blueprints - Multiple locations + WFH available - Contract until Dec 2025 + possible ext - Federal Govt - Apply now!,"[<div class=""_1wkzzau0 a1msqi6m""><span class=""_1wkzzau0 a1msqi4y lnocuo0 lnocuo1 lnocuo21 _1d0g9qk4 lnocuo7""><a aria-label=""Limit results to Melbourne VIC"" class=""_1wkzzau0 _1wkzzauf _1wkzzau0 _1wkzzauf _842p0a0 _842p0a2"" data-automation=""jobLocation"" href=""/jobs-in-design-architecture/in-All-Melbourne-VIC?salarytype=annual&amp;salaryrange=190000-195000"" rel=""nofollow"" tabindex=""-1"" target=""_self"" title=""Limit results to Melbourne VIC"">Melbourne VIC</a></span></div>, <div class=""_1wkzzau0 a1msqi6m""><div aria-label=""Salary: Competitive Hourly Rates!"" class=""_1wkzzau0""><span class=""_1wkzzau0 a1msqi4y lnocuo0 lnocuo1 lnocuo21 _1d0g9qk4 lnocuo7"" data-automation=""jobSalary""><span class=""_1wkzzau0 _16v7pfz1 a1msqi4y a1msqi0 a1msqir _16v7pfz3"" style=""--_16v7pfz2:2"">Competitive Hourly Rates!</span></span></div></div>]",2024-02-07,Design-architecture - None,08/02/2024
65,https://www.seek.com.au//job/72873138?type=standout&ref=search-standalone,design architecture,Architecture,Senior Design Architect,CTC,Salary $110k-$150k depending on experience,190000.0,192500.0,195000.0,Adelaide SA,Utilise your passion for architecture & experience with a firm that has a genuine focus on good design & a truly collaborative work environment,"[<div class=""_1wkzzau0 a1msqi6m""><span class=""_1wkzzau0 a1msqi4y lnocuo0 lnocuo1 lnocuo21 _1d0g9qk4 lnocuo7""><a aria-label=""Limit results to Adelaide SA"" class=""_1wkzzau0 _1wkzzauf _1wkzzau0 _1wkzzauf _842p0a0 _842p0a2"" data-automation=""jobLocation"" href=""/jobs-in-design-architecture/in-All-Adelaide-SA?salarytype=annual&amp;salaryrange=190000-195000"" rel=""nofollow"" tabindex=""-1"" target=""_self"" title=""Limit results to Adelaide SA"">Adelaide SA</a></span></div>, <div class=""_1wkzzau0 a1msqi6m""><div aria-label=""Salary: Salary $110k-$150k depending on experience"" class=""_1wkzzau0""><span class=""_1wkzzau0 a1msqi4y lnocuo0 lnocuo1 lnocuo21 _1d0g9qk4 lnocuo7"" data-automation=""jobSalary""><span class=""_1wkzzau0 _16v7pfz1 a1msqi4y a1msqi0 a1msqir _16v7pfz3"" style=""--_16v7pfz2:2"">Salary $110k-$150k depending on experience</span></span></div></div>]",2024-01-10,Design-architecture - None,08/02/2024
