,link,classification,category,title,company,salary,min_salary,average_salary,max_salary,location,description,entireDiv,date_posted,Category,Date
0,https://www.seek.com.au//job/73618017?type=promoted&ref=search-standalone,design architecture,Web & Interaction Design,Mid/Senior UX Designer,Thought Collaborative Pty Ltd,-,190000.0,192500.0,195000.0,Melbourne VIC,You'll be joining an initiative re-defining the way they deliver their own digital self serve experience.,"[<div class=""_1wkzzau0 a1msqi6m""><span class=""_1wkzzau0 a1msqi4y lnocuo0 lnocuo1 lnocuo21 _1d0g9qk4 lnocuo7""><a aria-label=""Limit results to Melbourne VIC"" class=""_1wkzzau0 _1wkzzauf _1wkzzau0 _1wkzzauf _842p0a0 _842p0a2"" data-automation=""jobLocation"" href=""/jobs-in-design-architecture/in-All-Melbourne-VIC?salarytype=annual&amp;salaryrange=190000-195000"" rel=""nofollow"" tabindex=""-1"" target=""_self"" title=""Limit results to Melbourne VIC"">Melbourne VIC</a></span></div>]",,Design-architecture - None,08/02/2024
1,https://www.seek.com.au//job/73410247?type=promoted&ref=search-standalone,design architecture,Interior Design,Workplace Strategist - Elevate Strategy Lead,Concept Commercial Interiors,-,190000.0,192500.0,195000.0,Melbourne VIC,Flexible career building opportunity in a collaborative environment for a Senior Interior Designer passionate about workplace design and strategy.,"[<div class=""_1wkzzau0 a1msqi6m""><span class=""_1wkzzau0 a1msqi4y lnocuo0 lnocuo1 lnocuo21 _1d0g9qk4 lnocuo7""><a aria-label=""Limit results to Melbourne VIC"" class=""_1wkzzau0 _1wkzzauf _1wkzzau0 _1wkzzauf _842p0a0 _842p0a2"" data-automation=""jobLocation"" href=""/jobs-in-design-architecture/in-All-Melbourne-VIC?salarytype=annual&amp;salaryrange=190000-195000"" rel=""nofollow"" tabindex=""-1"" target=""_self"" title=""Limit results to Melbourne VIC"">Melbourne VIC</a></span></div>]",,Design-architecture - None,08/02/2024
2,https://www.seek.com.au//job/73542350?type=standout&ref=search-standalone,design architecture,Architecture,Design Manager,Co. Recruit,Competitive remuneration on offer,190000.0,192500.0,195000.0,Brisbane QLD,"Key design role with highly regarded, award winning Developer Builder.","[<div class=""_1wkzzau0 a1msqi6m""><span class=""_1wkzzau0 a1msqi4y lnocuo0 lnocuo1 lnocuo21 _1d0g9qk4 lnocuo7""><a aria-label=""Limit results to Brisbane QLD"" class=""_1wkzzau0 _1wkzzauf _1wkzzau0 _1wkzzauf _842p0a0 _842p0a2"" data-automation=""jobLocation"" href=""/jobs-in-design-architecture/in-All-Brisbane-QLD?salarytype=annual&amp;salaryrange=190000-195000"" rel=""nofollow"" tabindex=""-1"" target=""_self"" title=""Limit results to Brisbane QLD"">Brisbane QLD</a></span></div>, <div class=""_1wkzzau0 a1msqi6m""><div aria-label=""Salary: Competitive remuneration on offer"" class=""_1wkzzau0""><span class=""_1wkzzau0 a1msqi4y lnocuo0 lnocuo1 lnocuo21 _1d0g9qk4 lnocuo7"" data-automation=""jobSalary""><span class=""_1wkzzau0 _16v7pfz1 a1msqi4y a1msqi0 a1msqir _16v7pfz3"" style=""--_16v7pfz2:2"">Competitive remuneration on offer</span></span></div></div>]",2024-02-06,Design-architecture - None,08/02/2024
3,https://www.seek.com.au//job/73480259?type=standout&ref=search-standalone,design architecture,Architecture,Design Manager,Delivering 4 Customers,-,190000.0,192500.0,195000.0,Sydney NSW,D4C is seeking additional Design Managers to join the Engineering and Design team.,"[<div class=""_1wkzzau0 a1msqi6m""><span class=""_1wkzzau0 a1msqi4y lnocuo0 lnocuo1 lnocuo21 _1d0g9qk4 lnocuo7""><a aria-label=""Limit results to Sydney NSW"" class=""_1wkzzau0 _1wkzzauf _1wkzzau0 _1wkzzauf _842p0a0 _842p0a2"" data-automation=""jobLocation"" href=""/jobs-in-design-architecture/in-All-Sydney-NSW?salarytype=annual&amp;salaryrange=190000-195000"" rel=""nofollow"" tabindex=""-1"" target=""_self"" title=""Limit results to Sydney NSW"">Sydney NSW</a></span></div>]",2024-02-02,Design-architecture - None,08/02/2024
4,https://www.seek.com.au//job/73628153?type=standard&ref=search-standalone,design architecture,Architecture,Architectural/NPI Designer,TRS Staffing Solutions (Australia) Pty Ltd,-,190000.0,192500.0,195000.0,Perth WA,Fluor are seeking an Architectural/NPI Designer with a strong background in mining non-process infrastructure.,"[<div class=""_1wkzzau0 a1msqi6m""><span class=""_1wkzzau0 a1msqi4y lnocuo0 lnocuo1 lnocuo21 _1d0g9qk4 lnocuo7""><a aria-label=""Limit results to Perth WA"" class=""_1wkzzau0 _1wkzzauf _1wkzzau0 _1wkzzauf _842p0a0 _842p0a2"" data-automation=""jobLocation"" href=""/jobs-in-design-architecture/in-All-Perth-WA?salarytype=annual&amp;salaryrange=190000-195000"" rel=""nofollow"" tabindex=""-1"" target=""_self"" title=""Limit results to Perth WA"">Perth WA</a></span></div>]",,Design-architecture - None,08/02/2024
5,https://www.seek.com.au//job/73409916?type=standout&ref=search-standalone,design architecture,Architecture,Design Manager,Multiplex Constructions,Salary + Super + annual bonus + insurance,190000.0,192500.0,195000.0,Perth WA,Large scale construction projects within the health sector - delivery of all design aspects.,"[<div class=""_1wkzzau0 a1msqi6m""><span class=""_1wkzzau0 a1msqi4y lnocuo0 lnocuo1 lnocuo21 _1d0g9qk4 lnocuo7""><a aria-label=""Limit results to Perth WA"" class=""_1wkzzau0 _1wkzzauf _1wkzzau0 _1wkzzauf _842p0a0 _842p0a2"" data-automation=""jobLocation"" href=""/jobs-in-design-architecture/in-All-Perth-WA?salarytype=annual&amp;salaryrange=190000-195000"" rel=""nofollow"" tabindex=""-1"" target=""_self"" title=""Limit results to Perth WA"">Perth WA</a></span></div>, <div class=""_1wkzzau0 a1msqi6m""><div aria-label=""Salary: Salary + Super + annual bonus + insurance"" class=""_1wkzzau0""><span class=""_1wkzzau0 a1msqi4y lnocuo0 lnocuo1 lnocuo21 _1d0g9qk4 lnocuo7"" data-automation=""jobSalary""><span class=""_1wkzzau0 _16v7pfz1 a1msqi4y a1msqi0 a1msqir _16v7pfz3"" style=""--_16v7pfz2:2"">Salary + Super + annual bonus + insurance</span></span></div></div>]",2024-01-31,Design-architecture - None,08/02/2024
6,https://www.seek.com.au//job/73520012?type=standout&ref=search-standalone,design architecture,Architecture,City Architect,Capstone Recruitment Group Pty Ltd,-,190000.0,192500.0,195000.0,Sydney NSW,"City Architect - help bring to fruition, the City of Ryde's vision of becoming Sydney's premier destination to work, live & play.","[<div class=""_1wkzzau0 a1msqi6m""><span class=""_1wkzzau0 a1msqi4y lnocuo0 lnocuo1 lnocuo21 _1d0g9qk4 lnocuo7""><a aria-label=""Limit results to Ryde"" class=""_1wkzzau0 _1wkzzauf _1wkzzau0 _1wkzzauf _842p0a0 _842p0a2"" data-automation=""jobLocation"" href=""/jobs-in-design-architecture/in-Ryde-NSW-2112?salarytype=annual&amp;salaryrange=190000-195000"" rel=""nofollow"" tabindex=""-1"" target=""_self"" title=""Limit results to Ryde"">Ryde</a>, <a aria-label=""Limit results to Sydney NSW"" class=""_1wkzzau0 _1wkzzauf _1wkzzau0 _1wkzzauf _842p0a0 _842p0a2"" data-automation=""jobLocation"" href=""/jobs-in-design-architecture/in-All-Sydney-NSW?salarytype=annual&amp;salaryrange=190000-195000"" rel=""nofollow"" tabindex=""-1"" target=""_self"" title=""Limit results to Sydney NSW"">Sydney NSW</a></span></div>]",2024-02-05,Design-architecture - None,08/02/2024
7,https://www.seek.com.au//job/73364893?type=standard&ref=search-standalone,design architecture,Architecture,Design Manager- Developer/Builder- Projects up to $200m- Attractive pacakge-,StreamTalent,-,190000.0,192500.0,195000.0,Sydney NSW,"Exciting opportunity for an experienced Design manager to join a leading builder/developer in a key role, Phone Josh 0476669387 for more details!","[<div class=""_1wkzzau0 a1msqi6m""><span class=""_1wkzzau0 a1msqi4y lnocuo0 lnocuo1 lnocuo21 _1d0g9qk4 lnocuo7""><a aria-label=""Limit results to Sydney NSW"" class=""_1wkzzau0 _1wkzzauf _1wkzzau0 _1wkzzauf _842p0a0 _842p0a2"" data-automation=""jobLocation"" href=""/jobs-in-design-architecture/in-All-Sydney-NSW?salarytype=annual&amp;salaryrange=190000-195000"" rel=""nofollow"" tabindex=""-1"" target=""_self"" title=""Limit results to Sydney NSW"">Sydney NSW</a></span></div>]",2024-01-29,Design-architecture - None,08/02/2024
8,https://www.seek.com.au//job/73551543?type=standard&ref=search-standalone,design architecture,Architecture,Documentum Architect,HCL Australia Services Pty Ltd,-,190000.0,192500.0,195000.0,Sydney NSW,A job that provides perfect platform to grow yourself and your career.,"[<div class=""_1wkzzau0 a1msqi6m""><span class=""_1wkzzau0 a1msqi4y lnocuo0 lnocuo1 lnocuo21 _1d0g9qk4 lnocuo7""><a aria-label=""Limit results to Sydney NSW"" class=""_1wkzzau0 _1wkzzauf _1wkzzau0 _1wkzzauf _842p0a0 _842p0a2"" data-automation=""jobLocation"" href=""/jobs-in-design-architecture/in-All-Sydney-NSW?salarytype=annual&amp;salaryrange=190000-195000"" rel=""nofollow"" tabindex=""-1"" target=""_self"" title=""Limit results to Sydney NSW"">Sydney NSW</a></span></div>]",2024-02-06,Design-architecture - None,08/02/2024
9,https://www.seek.com.au//job/73622495?type=standout&ref=search-standalone,design architecture,Graphic Design,Digital Design Manager,Easygo Solutions,up to 20% annual bonus,190000.0,192500.0,195000.0,Melbourne VIC,"Looking for a Design Manager to join our Digital Design team and facilitate the growth of seven designers, whilst still having ability to be creative","[<div class=""_1wkzzau0 a1msqi6m""><span class=""_1wkzzau0 a1msqi4y lnocuo0 lnocuo1 lnocuo21 _1d0g9qk4 lnocuo7""><a aria-label=""Limit results to Melbourne VIC"" class=""_1wkzzau0 _1wkzzauf _1wkzzau0 _1wkzzauf _842p0a0 _842p0a2"" data-automation=""jobLocation"" href=""/jobs-in-design-architecture/in-All-Melbourne-VIC?salarytype=annual&amp;salaryrange=190000-195000"" rel=""nofollow"" tabindex=""-1"" target=""_self"" title=""Limit results to Melbourne VIC"">Melbourne VIC</a></span></div>, <div class=""_1wkzzau0 a1msqi6m""><div aria-label=""Salary: up to 20% annual bonus"" class=""_1wkzzau0""><span class=""_1wkzzau0 a1msqi4y lnocuo0 lnocuo1 lnocuo21 _1d0g9qk4 lnocuo7"" data-automation=""jobSalary""><span class=""_1wkzzau0 _16v7pfz1 a1msqi4y a1msqi0 a1msqir _16v7pfz3"" style=""--_16v7pfz2:2"">up to 20% annual bonus</span></span></div></div>]",,Design-architecture - None,08/02/2024
10,https://www.seek.com.au//job/73471062?type=standout&ref=search-standalone,design architecture,Other,Design Development Manager - 12 Month Contract,Redpath Partners Pty Ltd,"$140,000 - $180,000",140000.0,160000.0,180000.0,Sydney NSW,Work for a trusted ASX listed National Retail Leader - 12 month Contract,"[<div class=""_1wkzzau0 a1msqi6m""><span class=""_1wkzzau0 a1msqi4y lnocuo0 lnocuo1 lnocuo21 _1d0g9qk4 lnocuo7""><a aria-label=""Limit results to Sydney NSW"" class=""_1wkzzau0 _1wkzzauf _1wkzzau0 _1wkzzauf _842p0a0 _842p0a2"" data-automation=""jobLocation"" href=""/jobs-in-design-architecture/in-All-Sydney-NSW?salarytype=annual&amp;salaryrange=190000-195000"" rel=""nofollow"" tabindex=""-1"" target=""_self"" title=""Limit results to Sydney NSW"">Sydney NSW</a></span></div>, <div class=""_1wkzzau0 a1msqi6m""><div aria-label=""Salary: $140,000 - $180,000"" class=""_1wkzzau0""><span class=""_1wkzzau0 a1msqi4y lnocuo0 lnocuo1 lnocuo21 _1d0g9qk4 lnocuo7"" data-automation=""jobSalary""><span class=""_1wkzzau0 _16v7pfz1 a1msqi4y a1msqi0 a1msqir _16v7pfz3"" style=""--_16v7pfz2:2"">$140,000 - $180,000</span></span></div></div>]",2024-02-02,Design-architecture - None,08/02/2024
11,https://www.seek.com.au//job/73361892?type=standout&ref=search-standalone,design architecture,Graphic Design,Casual Teachers Art Design and Photography (Art & Design Business Area),Chisholm Institute,-,190000.0,192500.0,195000.0,Melbourne VIC,Great opportunity for an experienced Art Design or Photography professional to join the Art and Design teaching team at Chisholm,"[<div class=""_1wkzzau0 a1msqi6m""><span class=""_1wkzzau0 a1msqi4y lnocuo0 lnocuo1 lnocuo21 _1d0g9qk4 lnocuo7""><a aria-label=""Limit results to Frankston"" class=""_1wkzzau0 _1wkzzauf _1wkzzau0 _1wkzzauf _842p0a0 _842p0a2"" data-automation=""jobLocation"" href=""/jobs-in-design-architecture/in-Frankston-VIC-3199?salarytype=annual&amp;salaryrange=190000-195000"" rel=""nofollow"" tabindex=""-1"" target=""_self"" title=""Limit results to Frankston"">Frankston</a>, <a aria-label=""Limit results to Melbourne VIC"" class=""_1wkzzau0 _1wkzzauf _1wkzzau0 _1wkzzauf _842p0a0 _842p0a2"" data-automation=""jobLocation"" href=""/jobs-in-design-architecture/in-All-Melbourne-VIC?salarytype=annual&amp;salaryrange=190000-195000"" rel=""nofollow"" tabindex=""-1"" target=""_self"" title=""Limit results to Melbourne VIC"">Melbourne VIC</a></span></div>]",2024-01-29,Design-architecture - None,08/02/2024
12,https://www.seek.com.au//job/73375426?type=standard&ref=search-standalone,design architecture,Other,Creative Director,GPS Group,"$130,000 – negotiable depending on experience",130000.0,162500.0,195000.0,Melbourne VIC,"Seeking a ‘design’ led Creative Director, passionate about all forms of Design, shape and lead the creative culture of our business and our clients.","[<div class=""_1wkzzau0 a1msqi6m""><span class=""_1wkzzau0 a1msqi4y lnocuo0 lnocuo1 lnocuo21 _1d0g9qk4 lnocuo7""><a aria-label=""Limit results to Keysborough"" class=""_1wkzzau0 _1wkzzauf _1wkzzau0 _1wkzzauf _842p0a0 _842p0a2"" data-automation=""jobLocation"" href=""/jobs-in-design-architecture/in-Keysborough-VIC-3173?salarytype=annual&amp;salaryrange=190000-195000"" rel=""nofollow"" tabindex=""-1"" target=""_self"" title=""Limit results to Keysborough"">Keysborough</a>, <a aria-label=""Limit results to Melbourne VIC"" class=""_1wkzzau0 _1wkzzauf _1wkzzau0 _1wkzzauf _842p0a0 _842p0a2"" data-automation=""jobLocation"" href=""/jobs-in-design-architecture/in-All-Melbourne-VIC?salarytype=annual&amp;salaryrange=190000-195000"" rel=""nofollow"" tabindex=""-1"" target=""_self"" title=""Limit results to Melbourne VIC"">Melbourne VIC</a></span></div>, <div class=""_1wkzzau0 a1msqi6m""><div aria-label=""Salary: $130,000 – negotiable depending on experience"" class=""_1wkzzau0""><span class=""_1wkzzau0 a1msqi4y lnocuo0 lnocuo1 lnocuo21 _1d0g9qk4 lnocuo7"" data-automation=""jobSalary""><span class=""_1wkzzau0 _16v7pfz1 a1msqi4y a1msqi0 a1msqir _16v7pfz3"" style=""--_16v7pfz2:2"">$130,000 – negotiable depending on experience</span></span></div></div>]",2024-01-30,Design-architecture - None,08/02/2024
13,https://www.seek.com.au//job/73403431?type=standout&ref=search-standalone,design architecture,Other,Kitchen/Wardrobe Designer,Kinsman,-,190000.0,192500.0,195000.0,Adelaide SA,"An exciting, unique, and once in a lifetime opportunity for ambitious and success driven sales professionals with a no limits OTE","[<div class=""_1wkzzau0 a1msqi6m""><span class=""_1wkzzau0 a1msqi4y lnocuo0 lnocuo1 lnocuo21 _1d0g9qk4 lnocuo7""><a aria-label=""Limit results to Mile End"" class=""_1wkzzau0 _1wkzzauf _1wkzzau0 _1wkzzauf _842p0a0 _842p0a2"" data-automation=""jobLocation"" href=""/jobs-in-design-architecture/in-Mile-End-SA-5031?salarytype=annual&amp;salaryrange=190000-195000"" rel=""nofollow"" tabindex=""-1"" target=""_self"" title=""Limit results to Mile End"">Mile End</a>, <a aria-label=""Limit results to Adelaide SA"" class=""_1wkzzau0 _1wkzzauf _1wkzzau0 _1wkzzauf _842p0a0 _842p0a2"" data-automation=""jobLocation"" href=""/jobs-in-design-architecture/in-All-Adelaide-SA?salarytype=annual&amp;salaryrange=190000-195000"" rel=""nofollow"" tabindex=""-1"" target=""_self"" title=""Limit results to Adelaide SA"">Adelaide SA</a></span></div>]",2024-01-31,Design-architecture - None,08/02/2024
14,https://www.seek.com.au//job/73586985?type=standout&ref=search-standalone,design architecture,Architecture,BIM MANAGER,Bloomfield Tremayne & Partners,"Circa $145,000-150,000 + Superannuation",190000.0,192500.0,195000.0,Melbourne VIC,"This is an excellent opportunity for an experienced ArchiCAD model manager or BIM manager looking to join a thriving, highly awarded studio.","[<div class=""_1wkzzau0 a1msqi6m""><span class=""_1wkzzau0 a1msqi4y lnocuo0 lnocuo1 lnocuo21 _1d0g9qk4 lnocuo7""><a aria-label=""Limit results to Melbourne VIC"" class=""_1wkzzau0 _1wkzzauf _1wkzzau0 _1wkzzauf _842p0a0 _842p0a2"" data-automation=""jobLocation"" href=""/jobs-in-design-architecture/in-All-Melbourne-VIC?salarytype=annual&amp;salaryrange=190000-195000"" rel=""nofollow"" tabindex=""-1"" target=""_self"" title=""Limit results to Melbourne VIC"">Melbourne VIC</a></span></div>, <div class=""_1wkzzau0 a1msqi6m""><div aria-label=""Salary: Circa $145,000-150,000 + Superannuation"" class=""_1wkzzau0""><span class=""_1wkzzau0 a1msqi4y lnocuo0 lnocuo1 lnocuo21 _1d0g9qk4 lnocuo7"" data-automation=""jobSalary""><span class=""_1wkzzau0 _16v7pfz1 a1msqi4y a1msqi0 a1msqir _16v7pfz3"" style=""--_16v7pfz2:2"">Circa $145,000-150,000 + Superannuation</span></span></div></div>]",2024-02-07,Design-architecture - None,08/02/2024
15,https://www.seek.com.au//job/73582683?type=standard&ref=search-standalone,design architecture,Other,National Sales Manager,Aston Advantage,AUD 120000 - 150000 per annum,190000.0,192500.0,195000.0,Sydney NSW,"National Sales Manager | Commercial Fit Out | $120k - $150k + Super + Commissions + Car Allowance. Seeking exp leader, fit-out background essential.","[<div class=""_1wkzzau0 a1msqi6m""><span class=""_1wkzzau0 a1msqi4y lnocuo0 lnocuo1 lnocuo21 _1d0g9qk4 lnocuo7""><a aria-label=""Limit results to Sydney NSW"" class=""_1wkzzau0 _1wkzzauf _1wkzzau0 _1wkzzauf _842p0a0 _842p0a2"" data-automation=""jobLocation"" href=""/jobs-in-design-architecture/in-All-Sydney-NSW?salarytype=annual&amp;salaryrange=190000-195000"" rel=""nofollow"" tabindex=""-1"" target=""_self"" title=""Limit results to Sydney NSW"">Sydney NSW</a></span></div>, <div class=""_1wkzzau0 a1msqi6m""><div aria-label=""Salary: AUD 120000 - 150000 per annum"" class=""_1wkzzau0""><span class=""_1wkzzau0 a1msqi4y lnocuo0 lnocuo1 lnocuo21 _1d0g9qk4 lnocuo7"" data-automation=""jobSalary""><span class=""_1wkzzau0 _16v7pfz1 a1msqi4y a1msqi0 a1msqir _16v7pfz3"" style=""--_16v7pfz2:2"">AUD 120000 - 150000 per annum</span></span></div></div>]",2024-02-07,Design-architecture - None,08/02/2024
16,https://www.seek.com.au//job/73275163?type=standard&ref=search-standalone,design architecture,Architecture,ARCHITECT PARTNERSHIP OPPORTUNITY,Architeria Architects,-,190000.0,192500.0,195000.0,Sydney NSW,DREAM OPPORTUNITY TO BE YOUR OWN,"[<div class=""_1wkzzau0 a1msqi6m""><span class=""_1wkzzau0 a1msqi4y lnocuo0 lnocuo1 lnocuo21 _1d0g9qk4 lnocuo7""><a aria-label=""Limit results to Sydney NSW"" class=""_1wkzzau0 _1wkzzauf _1wkzzau0 _1wkzzauf _842p0a0 _842p0a2"" data-automation=""jobLocation"" href=""/jobs-in-design-architecture/in-All-Sydney-NSW?salarytype=annual&amp;salaryrange=190000-195000"" rel=""nofollow"" tabindex=""-1"" target=""_self"" title=""Limit results to Sydney NSW"">Sydney NSW</a></span></div>]",2024-01-24,Design-architecture - None,08/02/2024
17,https://www.seek.com.au//job/73442266?type=standout&ref=search-standalone,design architecture,Urban Design & Planning,Manager Development Services,LG Services Group,"$180,000 – $210,000 per year",180000.0,195000.0,210000.0,Canberra ACT,Lead Transformative Development Initiatives in the Scenic Shoalhaven Region,"[<div class=""_1wkzzau0 a1msqi6m""><span class=""_1wkzzau0 a1msqi4y lnocuo0 lnocuo1 lnocuo21 _1d0g9qk4 lnocuo7""><a aria-label=""Limit results to Canberra ACT"" class=""_1wkzzau0 _1wkzzauf _1wkzzau0 _1wkzzauf _842p0a0 _842p0a2"" data-automation=""jobLocation"" href=""/jobs-in-design-architecture/in-All-Canberra-ACT?salarytype=annual&amp;salaryrange=190000-195000"" rel=""nofollow"" tabindex=""-1"" target=""_self"" title=""Limit results to Canberra ACT"">Canberra ACT</a></span></div>, <div class=""_1wkzzau0 a1msqi6m""><div aria-label=""Salary: $180,000 – $210,000 per year"" class=""_1wkzzau0""><span class=""_1wkzzau0 a1msqi4y lnocuo0 lnocuo1 lnocuo21 _1d0g9qk4 lnocuo7"" data-automation=""jobSalary""><span class=""_1wkzzau0 _16v7pfz1 a1msqi4y a1msqi0 a1msqir _16v7pfz3"" style=""--_16v7pfz2:2"">$180,000 – $210,000 per year</span></span></div></div>]",2024-02-01,Design-architecture - None,08/02/2024
18,https://www.seek.com.au//job/73361616?type=standout&ref=search-standalone,design architecture,Architecture,Senior Design Manager,Stockland,-,190000.0,192500.0,195000.0,Sydney NSW,"We have an opportunity for a Senior Design Manager to join the team, based in Stockland's Sydney Head Offices working on Multi Residential projects","[<div class=""_1wkzzau0 a1msqi6m""><span class=""_1wkzzau0 a1msqi4y lnocuo0 lnocuo1 lnocuo21 _1d0g9qk4 lnocuo7""><a aria-label=""Limit results to Sydney NSW"" class=""_1wkzzau0 _1wkzzauf _1wkzzau0 _1wkzzauf _842p0a0 _842p0a2"" data-automation=""jobLocation"" href=""/jobs-in-design-architecture/in-All-Sydney-NSW?salarytype=annual&amp;salaryrange=190000-195000"" rel=""nofollow"" tabindex=""-1"" target=""_self"" title=""Limit results to Sydney NSW"">Sydney NSW</a></span></div>]",2024-01-29,Design-architecture - None,08/02/2024
19,https://www.seek.com.au//job/73165043?type=standard&ref=search-standalone,design architecture,Architecture,Principal - Architect,Bespoke Careers,"$180,000 – $220,000 + Super",180000.0,200000.0,220000.0,Sydney NSW,An opportunity for a talented and ambitious architect to join a progressive and successful Architecture design practice,"[<div class=""_1wkzzau0 a1msqi6m""><span class=""_1wkzzau0 a1msqi4y lnocuo0 lnocuo1 lnocuo21 _1d0g9qk4 lnocuo7""><a aria-label=""Limit results to Sydney NSW"" class=""_1wkzzau0 _1wkzzauf _1wkzzau0 _1wkzzauf _842p0a0 _842p0a2"" data-automation=""jobLocation"" href=""/jobs-in-design-architecture/in-All-Sydney-NSW?salarytype=annual&amp;salaryrange=190000-195000"" rel=""nofollow"" tabindex=""-1"" target=""_self"" title=""Limit results to Sydney NSW"">Sydney NSW</a></span></div>, <div class=""_1wkzzau0 a1msqi6m""><div aria-label=""Salary: $180,000 – $220,000 + Super"" class=""_1wkzzau0""><span class=""_1wkzzau0 a1msqi4y lnocuo0 lnocuo1 lnocuo21 _1d0g9qk4 lnocuo7"" data-automation=""jobSalary""><span class=""_1wkzzau0 _16v7pfz1 a1msqi4y a1msqi0 a1msqir _16v7pfz3"" style=""--_16v7pfz2:2"">$180,000 – $220,000 + Super</span></span></div></div>]",2024-01-19,Design-architecture - None,08/02/2024
20,https://www.seek.com.au//job/73622422?type=standout&ref=search-standalone,design architecture,Other,Brand Manager,Easygo Solutions,$140k - $160k p.a. + up to 20% annual bonus,140000.0,150000.0,160000.0,Melbourne VIC,We're looking for a Brand Manager who can take ownership our brands and create a new branding division within Easygo.,"[<div class=""_1wkzzau0 a1msqi6m""><span class=""_1wkzzau0 a1msqi4y lnocuo0 lnocuo1 lnocuo21 _1d0g9qk4 lnocuo7""><a aria-label=""Limit results to Melbourne VIC"" class=""_1wkzzau0 _1wkzzauf _1wkzzau0 _1wkzzauf _842p0a0 _842p0a2"" data-automation=""jobLocation"" href=""/jobs-in-design-architecture/in-All-Melbourne-VIC?salarytype=annual&amp;salaryrange=190000-195000"" rel=""nofollow"" tabindex=""-1"" target=""_self"" title=""Limit results to Melbourne VIC"">Melbourne VIC</a></span></div>, <div class=""_1wkzzau0 a1msqi6m""><div aria-label=""Salary: $140k - $160k p.a. + up to 20% annual bonus"" class=""_1wkzzau0""><span class=""_1wkzzau0 a1msqi4y lnocuo0 lnocuo1 lnocuo21 _1d0g9qk4 lnocuo7"" data-automation=""jobSalary""><span class=""_1wkzzau0 _16v7pfz1 a1msqi4y a1msqi0 a1msqir _16v7pfz3"" style=""--_16v7pfz2:2"">$140k - $160k p.a. + up to 20% annual bonus</span></span></div></div>]",,Design-architecture - None,08/02/2024
21,https://www.seek.com.au//job/73585067?type=standout&ref=search-standalone,design architecture,Urban Design & Planning,Senior Design Integrator,Aurecon,"Attractive package, training and flexible working",190000.0,192500.0,195000.0,Perth WA,"Flex working options including: working from home, flexible hours to fit in your life, part-time, purchased leave and many more to suit your lifestyle","[<div class=""_1wkzzau0 a1msqi6m""><span class=""_1wkzzau0 a1msqi4y lnocuo0 lnocuo1 lnocuo21 _1d0g9qk4 lnocuo7""><a aria-label=""Limit results to Perth WA"" class=""_1wkzzau0 _1wkzzauf _1wkzzau0 _1wkzzauf _842p0a0 _842p0a2"" data-automation=""jobLocation"" href=""/jobs-in-design-architecture/in-All-Perth-WA?salarytype=annual&amp;salaryrange=190000-195000"" rel=""nofollow"" tabindex=""-1"" target=""_self"" title=""Limit results to Perth WA"">Perth WA</a></span></div>, <div class=""_1wkzzau0 a1msqi6m""><div aria-label=""Salary: Attractive package, training and flexible working"" class=""_1wkzzau0""><span class=""_1wkzzau0 a1msqi4y lnocuo0 lnocuo1 lnocuo21 _1d0g9qk4 lnocuo7"" data-automation=""jobSalary""><span class=""_1wkzzau0 _16v7pfz1 a1msqi4y a1msqi0 a1msqir _16v7pfz3"" style=""--_16v7pfz2:2"">Attractive package, training and flexible working</span></span></div></div>]",2024-02-07,Design-architecture - None,08/02/2024
